Video Id,Title,View Count,Length,Channel
0zcM4rxGYkE,"🔴Live: రాజమండ్రి జైలు నుంచి ప్రత్యక్ష ప్రసారం || Pawan Kalyan, Balakrishna to meet Chandrababu | ABN",1 334 616 katselukertaa,11.54.58,/@abntelugutv
Q-nSNssz3p0,ABN Telugu LIVE || ABN LIVE || Telugu News | 24x7 LIVE Updates @ABN Telugu,,,/@abntelugutv
dcU1xjsv3VM,🔴Judgement LIVE UPDATES : చంద్రబాబుకు ఊరట | ABN Telugu,67 409 katselukertaa,3.19.31,/@abntelugutv
068H7l4opNs,🔴LIVE : జైల్లోనే సేఫ్టీ ఉంటుందని ప్రభుత్వ లాయర్లు అనడంలో అర్థమేంటి? | కుట్ర వెనుక కుట్ర | ABN Telugu,98 280 katselukertaa,11.11.33,/@abntelugutv
gvcNhgzB0Jo,సోదరా పవన్ కళ్యాణ్ థాంక్యూ ||PAWAN KALYAN || BALAKRISHNA || ABN TELUGU,619 744 katselukertaa,5.35,/@abntelugutv
A-LkENOiirg,LIVE: చంద్ర‌బాబు-ప‌వ‌న్ పొత్తుపై సీఎం జ‌గ‌న్ ఫ‌స్ట్ రియాక్ష‌న్|Jagan first reaction on tdp janasena,,,/@abntelugutv
-ckNdnA9oB4,ABN Venkata Krishna Analysis : చంద్రబాబు అరెస్టు వెనుక మరో కుట్ర దాగి ఉందా? | ABN Telugu,45 100 katselukertaa,7.01,/@abntelugutv
Dz_VS78s-eU,🔴Live: చంద్రబాబు కు  జైల్ సేఫ్ కాదు? మాజీ జైలర్ సంచలన నిజాలు | Srinivasa Rao | ABN,67 441 katselukertaa,3.58.50,/@abntelugutv
wvN-UzimgNs,రోజా సంబరాలపై లోకేష్ రియాక్షన్ || NARA LOKESH || ABN TELUGU,265 623 katselukertaa,2.16,/@abntelugutv
hWGVjesWKwI,ఉత్కంఠకు తెర..చంద్రబాబు హౌస్ కస్టడీపై ఏసీబీ కోర్టు తీర్పు ఇదీ.. | Chandrababu | ABN,18 712 katselukertaa,2.28,/@abntelugutv
fsn47585uIA,🔴LIVE : చంద్రబాబుపై జగన్ కక్ష సాధింపులో నెక్స్ట్ ఏం జరగబోతోంది? | కక్ష - శిక్ష | The Debate | ABN,83 994 katselukertaa,11.52.00,/@abntelugutv
KQEG7bVIfEs,🔴Chandrababu Case LIVE : చంద్రబాబుకు బెయిల్ పిటిషన్ ఏసీబీ కోర్టులో వాదనలు షురూ Bail for Chandrababu?,388 426 katselukertaa,10.16.09,/@abntelugutv
uf5aOXorX1w,LIVE : ABN Digital LIVE,,,/@ABNDigitalExclusives
Z85AmOqOlfM,🔴Live: సిద్ధార్థ్ లూథ్రా ప్రశ్నల వర్షం.. తీర్పు పై ఉత్కంఠ || Chandrababu In ACB Court || ABN,539 244 katselukertaa,10.06.41,/@abntelugutv
KiJVoum8bjQ,🔴Live: నో క‌స్ట‌డీ!..హైకోర్టులో చంద్రబాబుకు బిగ్‌ రిలీఫ్.. | Big Relief to Chandrababu | High Court,87 641 katselukertaa,3.05.26,/@abntelugutv
eeDIQ7KjYoM,తీర్పు తర్వాత.. చంద్రబాబు లాయర్లకు ఏసీబీ కోర్టు గ్రీన్ సిగ్నల్! | Chandrababu Arrest | ABN,564 319 katselukertaa,2.41,/@abntelugutv
Rce265kOF0A,🔴LIVE : చంద్రబాబు అరెస్ట్ పై కేసీఆర్ ఆరా.. మినిట్ To మినిట్ అప్డేట్ | CM KCR on Chandrababu Arrest,253 884 katselukertaa,5.22.38,/@abntelugutv
2i59KSf-ud4,Chandrababu Live: చంద్ర‌బాబుతో కుటుంబ స‌భ్యుల భేటీ| Chandrababu Family Members Mulakhath | ABN,72 895 katselukertaa,3.22.22,/@abntelugutv
