Video Id,Title,View Count,Length,Channel
7PCkvCPvDXk,Meghan Trainor - All About That Bass (Official Video),2 593 609 220 katselukertaa,3.10,/channel/UCkXgEcpoTE4tHsebYBouWpA
g36jg5hEYo8,Vlad and Niki - new Funny stories about Toys for children,1 146 209 157 katselukertaa,21.34,/@VladandNiki
kIzVtelW2Ak,Stacy and story for kids about toys,1 002 983 885 katselukertaa,2.46,/@MilenaStesha
rPe4yziWiOg,Blippi Learns about Jungle Animals for Kids | Educational Videos for Toddlers,923 873 761 katselukertaa,15.20,/@Blippi
w46bWxS9IjY,I Don't Want To Talk About It (from One Night Only! Rod Stewart Live at Royal Albert Hall),845 367 682 katselukertaa,4.30,/channel/UCm09uYWfEygr5gWjDm9xmUA
bvWRMAU6V-c,"We Don't Talk About Bruno (From ""Encanto"")",554 142 608 katselukertaa,3.42,/@DisneyMusicVEVO
1VHsNcxA1Go,Diana and Her Funny Stories - Big Video Compilation,548 075 742 katselukertaa,38.14,/@KidsDianaShow
jBOyUo3JaiA,Vlad and story about Worms from the game,544 582 206 katselukertaa,2.54,/@VladandNiki
qmNVJ4ZWQY0,Diana and Dad - Funny Stories for Kids,505 529 708 katselukertaa,11.33,/@KidsDianaShow
n1OQ9zPsLI0,Vlad and kids story about green friends,498 702 496 katselukertaa,4.00,/@VladandNiki
dqOx8G7Yjxg,Vlad and Nikita a compilation of funny series about friends,492 640 953 katselukertaa,41.28,/@VladandNiki
vS0kJhR92_k,Vlad and kids story about Magic wheel,490 226 257 katselukertaa,3.31,/@VladandNiki
2PDK3a7tYbs,Vlad and Nikita - funny stories about Cars for Kids,377 103 418 katselukertaa,12.06,/@VladandNiki
ClU3fctbGls,P!NK - What About Us (Official Video),348 645 754 katselukertaa,5.22,/channel/UCE5yTn9ljzSnC_oMp9Jnckg
V-ztjRNGIxI,Funny stories about Tractor Excavator and Truck - compilation Alex ride on Power Wheels,344 156 297 katselukertaa,12.23,/@onedayalex888
h_fda9urHHk,Diana and useful stories about good behavior from her life,321 793 392 katselukertaa,25.39,/@KidsDianaShow
CdqoNKCCt7A,Simple Minds - Don't You (Forget About Me),291 263 522 katselukertaa,4.20,/channel/UCXBep4C-pg5oCTrjw3nO-LA
j91XUB-gSYw,Vlad and story about how Kids should not behave,267 411 839 katselukertaa,3.41,/@VladandNiki
ivPEKaBHjYA,P!NK - Try (The Truth About Love - Live From Los Angeles),251 783 536 katselukertaa,4.31,/channel/UCE5yTn9ljzSnC_oMp9Jnckg
1r0LCbFCUgM,Vlad and Niki - new funny stories about Toys,246 204 030 katselukertaa,15.30,/@VladandNiki
