Video Id,Title,View Count,Length,Channel
TQMbvJNRpLE,How to Achieve Your Most Ambitious Goals | Stephen Duneier | TEDxTucson,12 363 004 katselukertaa,17.53,/@TEDx
vepWGo24PJU,3 Keys To Achieve Success and Create Impact | Sadhguru,182 201 katselukertaa,6.49,/@sadhguru
Imql1NW1kJg,Use This To Achieve Anything You Want - IT REALLY WORKS!,1 163 072 katselukertaa,6.09,/@BeInspiredChannel
ReGOQI8bHDg,"NEW | How to Achieve the Best of Both Worlds - Mufti Menk in Panorama, South Africa",308 998 katselukertaa,1.00.42,/@muftimenkofficial
arEyOAy0VKU,How to achieve your goals,642 365 katselukertaa,1.00,/@In59seconds
wsu-K5sEV-8,"Achieve Everything You Want 》Manifest Your Deepest Desire 》Vibration of Success Meditation, Binaural",61 096 katselukertaa,11.54.53,/@GoodVibesMusic
30molCgfe4k,How The Law Of Attraction REALLY WORKS (Achieve Anything By DOING THIS)| Rhonda Byrne & Lewis Howes,2 516 567 katselukertaa,1.21.34,/@lewishowes
JydaYnH3RL0,How To Achieve THE Perfect Fit! (My step by step process),1 462 katselukertaa,11.21,/@Penguinandpear
IvhBbv8COfw,Stop Letting Yourself Down: How to Actually Achieve Your Goals,229 394 katselukertaa,11.39,/@IzzySealey
vo_lZiytsMw,Change Your Mindset and Achieve Anything | Colin O'Brady | TEDxPortland,3 252 387 katselukertaa,18.08,/@TEDx
J6yp8iiwd4c,How To Achieve Your Goals,363 596 katselukertaa,10.13,/@sadhguru
QvLETnLBrOs,Actual IELTS Listening | Practice  Test  | Achieve 8+ Bands (Books Does Angelina Likes),37 katselukertaa,25.45,/@thethamesenglishacademy1799
1F5-JaNrHhQ,ACHIEVE ~ Sleep Meditation ~ Achieve Your Greatest Dreams,314 061 katselukertaa,2.00.01,/@Dauchsy
V2PP3p4_4R8,"If you want to achieve your goals, don't focus on them: Reggie Rivers at TEDxCrestmoorParkED",6 132 250 katselukertaa,10.41,/@TEDx
7CKrumDEoHA,How to Master Consistency to Achieve Your Goals,630 609 katselukertaa,9.13,/@TheArtofImprovement
7owBdtgIUU4,How to achieve our goals? | Dr. APJ Abdul Kalam Inspiring speech | Interaction with students |,1 821 371 katselukertaa,0.39,/@BeautifulQuotes-RJTAbhishekRam
_D_C2-2FZ5w,The Easy Way to Achieve Your Goals,382 172 katselukertaa,8.41,/@aliabdaal
cHwFM6kVq0o,7 TIPS TO ACHIEVE YOUR GOALS,159 079 katselukertaa,3.37,/@Psych2go
QGNw17MOGO0,How to achieve your goal?🤔 #sandeepmaheshwari #shorts,138 361 katselukertaa,0.36,/@SandeepMHshortshindi
y01ogDEMJ9Q,You CAN Achieve Your Goals (From Zero),196 056 katselukertaa,13.56,/@ManuMercurial
