Video Id,Title,View Count,Length,Channel
d7pYDFp0Wh4,Roma and Diana actively rest on the sea,81 673 224 katselukertaa,25.45,/@KidsRomaShow
T0-4oW8Jrg8,Roma and Diana show how to actively spend the weekend!,47 011 521 katselukertaa,23.26,/@KidsRomaShow
gcz-gYmH9aI,Roma and Diana learn to be active and develop good habits,15 375 953 katselukertaa,12.12,/@KidsRomaShow
1pnpZZaejq0,Diana and Roma Actively Rest on Summer Vacation,4 193 153 katselukertaa,6.38,/@TheElenaYa
ANxpqyIzs10,5 Things You Should Know When Someone is Actively Dying,2 431 283 katselukertaa,10.31,/@hospiceofthechesapeake3453
IKYDdjVA5-Q,How To Keep Betta Fish Active?,2 220 878 katselukertaa,0.41,/@AQUATICMEDIA
xg1ccuWs89U,Tyler Perry: Actively Chase Your Dreams | FULL EPISODE | Praise on TBN,1 949 538 katselukertaa,53.36,/@TBN
vkd-7Jjgcho,2019 STXL Actively Cooled long lens and camera enclosure,1 463 358 katselukertaa,3.37,/@DotworkzOfficial
7wUCyjiyXdg,Active Listening Skills,1 038 234 katselukertaa,6.14,/@alexanderlyon
rzsVh8YwZEQ,Active Listening,693 390 katselukertaa,1.28,/@GCFLearnFree
m7Zls_raeQo,Real video of Actively dying. (Educational),647 809 katselukertaa,2.44,/@hospicenursejulie
nqbw5_tKRD4,A CAR THAT IS ACTIVELY TRYING TO KILL YOU | Automation / BeamNG,485 723 katselukertaa,27.06,/@ConsiderGaming
mKclUM2CQbo,Disgruntled Trump Actively Undermines Vaccination Push,457 525 katselukertaa,6.02,/@msnbc
vzapweAHcdg,Anabella and Bogdan actively rest on the sea and respect the rules for children,396 613 katselukertaa,11.57,/@BogdansShow
V1cMVZOKdBw,Blizzard is Actively trying to Scam Overwatch 1 players,345 983 katselukertaa,8.12,/@Dittozz
SXN8iSxbXBw,Video of Actively dying,331 130 katselukertaa,2.32,/@hospicenursejulie
Q1NnwHwVUIM,Cursed Halo actively drains my life force,252 638 katselukertaa,23.03,/@TheReachWay
-E0t69mhYRo,"""Actively not wanting to be fat is Fatphobic""",248 971 katselukertaa,0.44,/@balkangains
w5Kneg9x9xg,MUST WATCH! How TV News Is ACTIVELY Baiting You | The Problem With Jon Stewart | Apple TV+,221 779 katselukertaa,2.27,/@TheProblemWithJonStewart
ay_qY0Zsgqw,Full Video : 10 days to weather the storm actively build a safe shelter,219 751 katselukertaa,2.52.32,/@forestlifeskillsdt
