Video Id,Title,View Count,Length,Channel
UkZxPIZ1ngY,How to Adjust a Rear Derailleur – Limit Screws & Indexing,10 459 053 katselukertaa,16.07,/@parktool
ZNG7g83lI-s,How to Adjust a Front Derailleur,6 746 355 katselukertaa,13.44,/@parktool
6AbUJTK4Nzg,Adjusting Entries Part 1 (Filipino),148 536 katselukertaa,12.44,/@TeacherJade
uJLAXFhEQNg,"Rainbird Spray Nozzle Adjustments (HE-VAN, VAN, and MPR)",188 189 katselukertaa,7.09,/@SmartIrrigation1
ExfFlYFAffg,Adjusting the Etachron Regulator: A Beginners Guide,17 735 katselukertaa,30.32,/@watchrepairtutorials
V5rvepYd36A,5 Minute Gear Adjust | How To Set Up Your Mountain Bike Gears Correctly,1 423 781 katselukertaa,8.50,/@gmbntech
Bbk5RcH0bbQ,How To Index Your Gears - Adjusting Your Rear Derailleur,3 024 143 katselukertaa,7.58,/@gcn
jv0PfpLlh34,HYPOCRISY - Adjusting The Sun (OFFICIAL LIVE VIDEO),40 745 katselukertaa,4.47,/channel/UCqvJQy1kxIi23k_YR1lY3lA
d4c0IjeyYek,Adjusting a Hunter Rotor: Rotor Right Stop Adjustment,1 934 958 katselukertaa,4.41,/@Hunter_Industries
AFKVj7X7o6Q,"ASMR Fixing, Adjusting & Recalibrating You (pressing buttons, measuring, examining)",93 333 katselukertaa,25.56,/@AbbyASMR
wQEIJsjbPDw,Adjusting the Sun,101 434 katselukertaa,4.44,/channel/UCqvJQy1kxIi23k_YR1lY3lA
H0N7tvXuJlU,Prepayments and Accruals | Adjusting Entries,511 031 katselukertaa,9.57,/@AccountingStuff
gkqoIqeiCsU,FA14 - Adjusting Journal Entries EXAMPLES,263 946 katselukertaa,32.43,/@TRUTonyBell
eqY-ipqLOKM,Grow and Go Extend 'n Ride: Adjusting the Harness | Safety 1st,18 678 katselukertaa,0.23,/@Safety1st
7aXu2J3m5ws,Adjusting Your Adjustable Threaded Stem,142 472 katselukertaa,1.26,/@diamondbackbikes
tOLo3qOy56Y,Rookie Mistakes Adjusting Your Coilovers,271 434 katselukertaa,6.44,/@FitmentIndustries
alYJH66tN18,Benelli Super Black Eagle 3 Shim System: Adjusting Drop and Cast,153 433 katselukertaa,6.59,/@Benelli_USA
nPXMlyHJhR4,23 Years of Pain - 21 Minute Chiropractic Adjusting Flow w/ Dr. Brett Jones Jones,63 186 katselukertaa,21.10,/@DrBrettJones
