Video Id,Title,View Count,Length,Channel
fJTBmCVaaTc,Baby John To The Rescue | Wheels On The Ambulance & More Little Angel Kids Songs,356Â 315Â 597 katselukertaa,47.35,/channel/UCNzsYU0aWwjERj-9Y9HUEng
OeRs_HEIit8,Ambulance baby doll and Doctor toys play,295Â 781Â 214 katselukertaa,8.35,/@toypudding
ILU9NbWn4t0,"PARIS, PEARWAH - à¸£à¸±à¸à¸•à¸´à¸”à¹„à¸‹à¹€à¸£à¸™ (My Ambulance) [Official MV]",266Â 824Â 391 katselukertaa,6.16,/@NadaoMusic
Wa2U3tcXNAo,"CHOTU DADA AMBULANCE WALA | ""à¤›à¥‹à¤Ÿà¥‚ à¤¦à¤¾à¤¦à¤¾ à¤à¤®à¥à¤¬à¥à¤²à¥‡à¤‚à¤¸ à¤µà¤¾à¤²à¤¾"" Khandesh Hindi Comedy | Chotu Comedy Video",242Â 909Â 157 katselukertaa,12.41,/@Jkk_Entertainment
BOKVowJWtV8,"Ambulance Rescue Team | Doctor Cartoon, Fire Truck | Nursery Rhymes | Kids Songs | BabyBus",224Â 660Â 855 katselukertaa,29.02,/@babybus
JSsTkZ6zorM,Florence the Ambulance and Ross the Race Car - Real City Heroes (RCH) | Videos for Children,204Â 572Â 879 katselukertaa,15.59,/@coilbook
R3wb56nmOaA,When The Ambulance Forgets You!,168Â 004Â 382 katselukertaa,0.11,/@jojosim
PUJEwZGnksg,Colors for Children to Learn with Train Transporter Toy Street Vehicles - Educational Videos,147Â 319Â 400 katselukertaa,13.37,/@SuperKidsTVtoys
DS6mHpy7MoE,Thomas & Friends Tokyo maintenance factory for lots of unique toys RiChannel,140Â 935Â 540 katselukertaa,18.09,/@richannel_youtube
-dg1dgao3GU,Ambulance Rescue Team | Little Angel Nursery Rhymes and Kids Songs,129Â 000Â 468 katselukertaa,18.53,/channel/UCNzsYU0aWwjERj-9Y9HUEng
aSdJMLfMh0Y,"Emergency Vehicles - Rescue Trucks - Fire, Police & Ambulance - The Kids' Picture Show",123Â 718Â 020 katselukertaa,3.16,/@TheKidsPictureShow
oPwe10JlrNc,"Fire Truck, Police Car, Ambulance In Surprise Eggs | Nursery Rhymes | Kids Cartoon | BabyBus",98Â 805Â 027 katselukertaa,24.15,/@babybus
34qyeO8Ej8A,Wheels On The Ambulance | Kids Cartoons and Nursery Rhymes,69Â 255Â 652 katselukertaa,3.23,/@kidscartoonsandnurseryrhym910
WKmDFS7VDW8,ğŸš¨ Daily life Safety with AMBER | EP 01~26 | Robocar POLI | Kids animation,63Â 892Â 816 katselukertaa,2.40.34,/@robocarpoli
aPnPXgeF47Q,Barbie ambulance hospital toy set,58Â 040Â 890 katselukertaa,3.24,/@happyhappytoys8330
rnPf08Cu-us,æ•‘æ€¥è»Šã®ãƒŸãƒ‹ã‚«ãƒ¼èµ°ã‚‹ï¼ç·Šæ€¥èµ°è¡Œãƒ†ã‚¹ãƒˆã€‚å‚é“èµ°ã‚‹â˜†Ambulance minicar runs in an emergency! Slope driving test,53Â 825Â 976 katselukertaa,5.33,/@user-qv4st9cf7e
UVO0tDiyMGA,Dolls go to Hospital in ambulance -Sitcom for All Krankenwagen Enfermeira Ø¯Ù…Ù‰ Ø§Ù„Ø·Ø¨ÙŠØ¨ MÃ©decin Perawat,52Â 850Â 013 katselukertaa,10.02,/@FunFunMiniWorld
RzFsMAZCCn4,911 Call ! Barbie Ambulance Care Clinic Car ! Cookie Swirl C Video,49Â 819Â 052 katselukertaa,6.17,/@Cookieswirlc
q88KwLG-xoY,"Emergency Vehicles for kids, Learn Name and Sounds #PoliceCar, Fire Truck,Ambulance, Helicopter",48Â 765Â 954 katselukertaa,2.57,/@dunotoys7583
6_5hJeJ-5lg,emergency ambulance,45Â 226Â 759 katselukertaa,0.08,/@CandyCrushing-oz1wg
