Video Id,Title,View Count,Length,Channel
t4M97-rHeBg,Thoughtful Amenities at One Sierra,3 815 366 katselukertaa,0.20,/@onesierra7594
iPlRFpSkcMc,"Inside a $72,500,000 Hollywood Hills MEGA Estate with Incredible Amenities!",3 343 689 katselukertaa,44.53,/@EnesYilmazer
NdSrtHJUXbs,Chandler & Ross Load Up on Hotel Amenities | Friends,1 424 107 katselukertaa,4.49,/@Friends
XYSAg5DbKrE,"TOUR: $22.5M Miami condo with 70,000 sq ft of insane amenities | CNBC Prime",895 081 katselukertaa,14.36,/@CNBCAmbition
3mWxSQytj6I,Experience elevated living sky-high amenities at MK One.,518 896 katselukertaa,0.22,/@MKBuildersAndDevelopers
IU1utd0e9Ws,Building Swimming Pool In Fully Equipped Underground House With Modern Amenities,465 347 katselukertaa,22.35,/@PrimitiveSurvival92
qAqm9wJaaOc,Moon Residences Amenities,379 725 katselukertaa,0.30,/@almarasemdevelopment6017
C4tE6vROV2o,An Epitome of Unparalleled Systems & Amenities | Citadel 7,322 818 katselukertaa,0.42,/@chakorventures
cPs2X2ikUTo,"ULTRA-LUXURIOUS 4bhk BESPOKE Residences with SUN DECK and AMENITIES, Upper Juhu, Mumbai",312 034 katselukertaa,11.18,/@codeestate
oon0IRbuXf8,"Asathalaana Rooftop amenities at The World of Joy, Beautiful Apartments at Siruseri",262 586 katselukertaa,0.30,/@Urbanrise
y59Zj62qOKM,Lake Residence by Rotana Services and Amenities,200 879 katselukertaa,0.47,/@almarasemdevelopment6017
cxyq29oZPv0,Amenities Provided by My Home Bhooja | Pride Project of Hyderabad | Ntv,178 409 katselukertaa,18.15,/@ntvtelugu
X6pCGKMgcRE,The Front Desk: Hotel Amenities ft. J.B. Smoove,168 578 katselukertaa,3.25,/@aboveaverage
VJYukkt-DGc,Premium Amenities वाला Project / Location- Kiwale / Real Estate / 9834506815 / 9503077605,161 238 katselukertaa,0.57,/@kdassetbuilder
A9_cs5IFKVo,Subaru Amenities,158 718 katselukertaa,0.15,/@hananiasubaruoforangepark9516
TjpmBjMnqK0,Pyramid Point Development | Ocean View Properties in Prime Ocho Rios | Modern Amenities,158 067 katselukertaa,19.28,/@TheDelprattFamily
rx0UaQ30snA,Amenities,156 712 katselukertaa,3.23,/@AMSOMmp
Abn-h6YzWcA,Introducing Home With All Luxury Amenities | Manglam Park Infinia Rajapark,155 283 katselukertaa,0.48,/@ManglamBuildDevelopersLtd
FX83HWKVk-Q,Incredibly amazing lifestyle with iconic amenities at Easter River Residency!,137 412 katselukertaa,0.24,/@easternriverresidency1262
jVmbKszPVAY,"Shilp Revanta, 3 BHK Apartments With 70+ Amenities At Shela",129 874 katselukertaa,1.01,/@ShilpGroup
