Video Id,Title,View Count,Length,Channel
hvNwhGDe1HM,Calibre 50 - A La Antig칲ita,182142767 katselukertaa,2.36,/channel/UC7r3fSrFc31cs9pJRNgGWiQ
lkzJgS0etOY,A La Antig칲ita - Calibre 50 (LETRA),158455109 katselukertaa,3.13,/@delregionalmusic
hksZMDmrYRg,Calibre 50 - A La Antig칲ita (En Vivo),99381810 katselukertaa,2.43,/channel/UC7r3fSrFc31cs9pJRNgGWiQ
pifvIJ9372o,Pedro Fern치ndez - Amarte A La Antigua,77928945 katselukertaa,3.31,/channel/UCPDAy-ra3dQ8fP0OcgHlHKA
USXMXHVCWOY,Antigua Oraci칩n  a San Jose conocida por no fallar Nunca,6896081 katselukertaa,3.10,/@Oracionesenvideo
A8ZmclQDIKM,Video游꿘Mix Baladas Del Recuerdo仇Clasicos Inmortales Recordar Es Volver A Vivir游닡Part 3 (Dj Harold),5122826 katselukertaa,57.20,/@djharoldmusic
jv9UxNti3fg,"Antigua y Poderosa Oraci칩n al Justo Juez Protecci칩n de Enemigos, Males, Peligros, Muertes, Robos",3945594 katselukertaa,5.20,/@Oracionesenvideo
t-n5bfnIMyo,Cuando bebi칩 oro el hombre m치s rico de la Antigua Roma,2936469 katselukertaa,0.59,/@Ariel_Flowers_1999
CgpBXyTG9FY,Dappy x M24 x Backroad Gee - Antigua [Music Video] | GRM Daily,2058687 katselukertaa,4.30,/@Grmdaily
MMLnI76XCr8,Asher Otto ft. Joss Stone - Antigua,1760208 katselukertaa,5.32,/channel/UCr3uoU9jGjXXb8MTCO6zBeA
scMGdyRkDss,Adivina el pa칤s por su ANTIGUA bandera (y algunas pistas) PARTE 8 游땓,1181305 katselukertaa,0.41,/@SoulMB
Ik9NeDDnd5Q,Antigua Vacation Travel Guide | Expedia,964650 katselukertaa,6.54,/@Expedia
bhmYgiq6BUU,Antigua and Barbuda Geography/Antigua and Barbuda Country,934643 katselukertaa,2.58,/@klt
xT8DU0gwmig,Amarte a la Antigua - Eslabon Armado (Video Lyrics),925065 katselukertaa,3.39,/@musicygc9441
5OpiUD3qtY8,Geography Now! Antigua and Barbuda,862099 katselukertaa,7.17,/@GeographyNow
Py6E4vZb-AU,Pedro Fern치ndez - Amarte A La Antigua (LETRA),804691 katselukertaa,3.34,/channel/UCPDAy-ra3dQ8fP0OcgHlHKA
DPNl1DfrAoc,ERIK (ERICK)- ANTIGUA,744238 katselukertaa,2.45,/@sergiodelira
KMzT3g9gMbk,BIRTHDAY BAECATION IN PARADISE - ANTIGUA | TRAVEL VLOG 8,716408 katselukertaa,43.36,/@SherlinaNym
jsB4efOvsmw,Sunlight Project - Antigua (Original Mix) [Music Video] [Sunlight Tunes],490213 katselukertaa,5.01,/@16klu
5ZHv5sAVmHc,"""Grenzenlos - Die Welt entdecken"" auf Antigua",435216 katselukertaa,41.37,/@GrenzenlosDieWeltEntdecken
