Video Id,Title,View Count,Length,Channel
BF25AA4dgGg,The Applicability of Mathematics (William Lane Craig vs Alex Rosenberg),13 187 katselukertaa,4.11,/@drcraigvideos
41_Eess31o4,Applicability Of Companies Act 2013 | Mohit Agarwal,3 759 katselukertaa,3.40,/@currentaffairs_mohitsir
H2wiMXqrx9E,Applicability | meaning of Applicability,231 katselukertaa,0.43,/@DefinitionOfTheWords
LQi3qf5RH4I,What is Industrial Applicability?,118 katselukertaa,3.27,/@attorneythoughts5256
7ka8RLc06vk,Steps to Develop Your Statement of Applicability with SOA template ISO 27001,595 katselukertaa,5.11,/@LearnITSecuritywithLuvJohar
yxuamhsM6eM,Filling in the template | How to Write ISO 27001 Statement of Applicability,4 715 katselukertaa,1.05,/@DejanKosutic
f_SnjWOhifU,Applicability of Indian AS and its Framework. #IndAS #IFRS #ACCA #English #CA | CA Swati Gupta,15 380 katselukertaa,19.07,/@StayAheadwithSwati
Dcxw0ierjPE,God Is the Best Explanation for the Applicability of Mathematics to the Physical World,7 807 katselukertaa,2.06,/@drcraigvideos
RsJbYVmW2vU,Applicability — APPLICABILITY definition,8 katselukertaa,0.32,/@SpeakEnglishWithLF
VlpKvfvCMcM,Topic of the day : What is CSR Applicability ?,14 889 katselukertaa,0.55,/@SleepyClassesIAS
IXcNa58tg1M,04. Risk Assessment -Statement of Applicability,223 katselukertaa,2.04,/@letstutor2722
e0ZrVv_3dB0,What Is Company & Applicability Of Companies | CA Inter Other Laws Chapter - 1 | Companies Act 2013,920 katselukertaa,12.32,/@CAIntermediateGrooming
W-aW-BpTDmM,Applicability of Change in Definition of Small Company | CA. Pramod Jain,3 730 katselukertaa,3.40,/@CAPramodJain
cNO63NYdJ3k,02 Tax audit Applicability with Illustrations | Examples of Tax Audit Applicability,725 katselukertaa,13.45,/@eliteconsultants9626
O0jcoTfKW-g,Applicability Of Ind AS  in India | By CA Amit Darekar | Finpro Consulting,1 884 katselukertaa,12.38,/@FinProConsulting
FvX6Ea130E0,What APPLICABILITY means • applicability MEANING • applicability DEFINITION,124 katselukertaa,0.15,/@meanings3495
qOGQfAj0QeY,Applicability meaning | Word of the Day | Learn English Vocabulary,105 katselukertaa,1.03,/@Improvinglish
Jn0UsTbF-M4,"Applicability domain (AD), Williams plot in Matlab QSAR study (part 1)",1 670 katselukertaa,10.00,/@duc-hainguyen8499
6fSq6Biennw,"Applicability of Transfer Pricing - India| No Technical Terms | For Professionals, Startups and MNEs",158 katselukertaa,10.34,/@nirupamadb9235
vsuIVJeQqbc,Applicability of Indian AS and its Framework. #IndAS #IFRS #ACCA #Hindi #CA | CA Swati Gupta,17 379 katselukertaa,9.28,/@StayAheadwithSwati
