Video Id,Title,View Count,Length,Channel
Jrg9KxGNeJY,Bury the Light - Vergil's battle theme from Devil May Cry 5 Special Edition,103Â 601Â 491 katselukertaa,9.43,/@shadowhunterofficial
2ppQ5VmsKxY,Approach (Full Video) Jovan Dhillon feat. Dilpreet Dhillon I Karan Aujla | Latest Punjabi Songs 2018,48Â 180Â 027 katselukertaa,3.21,/@RehaanRecords
NQrnowo3ogg,Baby saw the toy while Granny is sleeping and train is approaching fast | Centy train in California,40Â 866Â 824 katselukertaa,0.05,/@ShivaniRaghavGaurish
5rpgzB6dLdc,Mother is walking near the railway track and centy train is approaching fast | London Train Station,34Â 610Â 167 katselukertaa,0.04,/@ShivaniRaghavGaurish
bR3vD99dHRQ,POV you get a notification when danger is approaching ğŸ‘€,31Â 093Â 738 katselukertaa,1.00,/@IanBoggs
Cq-g32NFVwE,Lillian is approaching her 3 year anniversary of having Type One Diabetes. #dexcom #diabetes #t1d,31Â 019Â 694 katselukertaa,0.45,/@ClintonSvatos
drFTXXjjEsY,Wheelchair is near the track and the train is approaching fast | Wheelchair = Wheel + Chair | USA,29Â 511Â 558 katselukertaa,0.05,/@ShivaniRaghavGaurish
BFPTLiKMXRg,Minecraft Style Remix - Approaching Nirvana,19Â 699Â 496 katselukertaa,4.15,/@ApproachingNirvana
6XpcG2EtJ_8,Vergil's Chair,16Â 284Â 399 katselukertaa,0.55,/@NoLifeKing-
lQ8DYoEDi5o,Friends have very different reactions to approaching herd of bison #Shorts,16Â 200Â 782 katselukertaa,0.39,/@USATODAY
w_KIM4AXMcw,Cats are crossing the railway track and train is approaching fast | Centy Train in America #cats,15Â 889Â 411 katselukertaa,0.04,/@ShivaniRaghavGaurish
NOZONW-UK0w,I AM THE STORM THAT IS APPROACHING,15Â 140Â 949 katselukertaa,0.55,/@awonddy
ai0OcFxP0Dw,POV you get a notification when danger is approaching... #shorts,13Â 917Â 326 katselukertaa,0.59,/@ElianaGhen
oZytEPAtWAk,Baby playing in mini pool and train is approaching fast | Centy Train in Hawaii Beach | Sea tides,10Â 504Â 778 katselukertaa,0.05,/@ShivaniRaghavGaurish
i2faAyUnieY,NEVER approach a girl like this at the gym,10Â 484Â 369 katselukertaa,0.38,/@howtobeast
TBhxsbVzfxQ,How good are you at approaching to girls/womenâ“ ğŸ˜‰ #shorts,10Â 142Â 507 katselukertaa,1.00,/@Just_for_Laughs
kpUQ7wgiTqM,Spiderman is celebrating Birthday on the railway track and train is approaching fast | Centy Train,9Â 131Â 216 katselukertaa,0.04,/@ShivaniRaghavGaurish
JRU6GnETSN4,Undertale OST: 009 - Enemy Approaching,8Â 751Â 932 katselukertaa,0.57,/@Misakiu
1ebYnhFckQk,Tsunami - Five signs approaching tsunami,8Â 417Â 305 katselukertaa,4.40,/@TOPTopics
tR6qS4IfP3o,Man Shoots At Police & Then K*lls Himself After Allegedly Approaching Minors,7Â 968Â 097 katselukertaa,17.23,/@ApeHuncho
