Video Id,Title,View Count,Length,Channel
xweiQukBM_k,Paula Abdul - Opposites Attract (Official Music Video),28 631 381 katselukertaa,3.44,/channel/UClPHrtNd1LqDmHwavrRsTyw
PEJRmo6QubY,Attract Abundance of Money Prosperity Luck & Wealth | Jupiter's Spin Frequency |Theta Binaural Beats,17 763 555 katselukertaa,2.00.22,/@GoodVibesMusic
VHrBTcERXRw,"[Try Listening for 15 Mins] Attract Wealth, Success and Love VERY FAST, Miracle Frequency",694 956 katselukertaa,7.07.07,/@CircleofAttraction
-XXRbd8XKgU,Avautuu kaikkina aikoina | Houkuttelee runsautta | Rahaa | Universaali vauraus | Rikkaus ja täyteys,2 964 605 katselukertaa,5.00.00,/@masterofabundance6487
I9c-Gcwr3-E,"Musiikki kiireellisen rahan houkuttelemiseksi | Rikkaus, yltäkylläisyys ja vauraus Voimaa ja voimaa",3 657 218 katselukertaa,5.00.00,/@masterofabundance6487
r3OPzhcrv8A,"MIRACLES HAPPEN: Receive Money in 15 Minutes, 432 Hz Music to Attract Urgent Money and Abundance",1 553 381 katselukertaa,11.55.00,/@abundancemeditation1993
LEHTy62Vmyw,How to attract love effortlessly,252 252 katselukertaa,19.55,/@shownemoto
VQdiogQtUMk,"639 hz, Harmonize Relationships, Attracts Love and Positive Energy, Heal Old Negative Energy",2 036 000 katselukertaa,6.04.55,/@angelhealingmusic1993
BZuvAEXTs50,How to dress to attract a man…. A full tutorial 🥰💕,7 366 103 katselukertaa,0.27,/@haleyybaylee
gb4S7jqxYTI,Opposites Attract,36 514 katselukertaa,0.09,/@CegielskiTwins
4nW3dpAwmrc,Houkuttelee Onnea ja äärimmäistä Onnea | Vastaanota Varallisuutta ja Kiireellistä Rahaa,345 623 katselukertaa,6.45.00,/@infiniteabundance8
sChmUhb7DG8,High Energy Attracts Money! #energy #manifest,21 429 katselukertaa,0.50,/@YouAreCreators
-8Xp9KtA1Lc,"GET REAL RESULTS FAST: Attract Money & Wealth in 10 Minutes, 777 Hz & 432 Hz (Very Powerful)",14 656 katselukertaa,11.11.11,/@CircleofAttraction
d6J8eQ5L20Q,Attract Love | Make your Crush Go Crazy Over You | VERY POWERFUL Love Frequency | Telepathy is Real,1 222 279 katselukertaa,8.34.43,/@PeacefulNightMusic
N0Fhu-Uur18,"528 hz + 639 hz | Music to Attract Money, Love and Abundance with Quantum Waves",8 126 385 katselukertaa,5.00.00,/@masterofabundance6487
-EE0VwF0Oeo,6 Secrets To Attract A Boy #shorts,191 230 katselukertaa,0.27,/@DPMindset
Y9TR-2wKwMk,639Hz - Harmonize Relationships: Attracts Love and Positive Energy - Heal Old Negative Energy & Pain,4 388 899 katselukertaa,2.00.00,/@PowerThoughtsclub
FoWV7nJetb8,IT'S SCARY this prayer attracts money to your life fast,31 970 katselukertaa,4.19,/@DariusWallis
xvLC_bGE72k,Be on their Mind and attract anyone you desire with the Law of Attraction,8 863 731 katselukertaa,3.00.01,/@ImmensityBeats
