Video Id,Title,View Count,Length,Channel
rdnAJBoFKOw,Compiler Design Lecture 19 -- S attributed and L attributed definitions,425 226 katselukertaa,26.12,/@uncode-gate
w03voSY4REs,Lec-20: S-Attributed vs L-Attributed SDT | Types of SDT,268 662 katselukertaa,10.11,/@GateSmashers
jefJns5kxBw,How to Create an Attribute Block in AutoCAD,242 797 katselukertaa,7.35,/@cyberCADsolutions
TWZXj27-6Cw,Part 52   C# Tutorial   Attributes in C#,235 468 katselukertaa,16.22,/@Csharp-video-tutorialsBlogspot
coHxp23wTyc,type of attributes in dbms,226 770 katselukertaa,12.38,/@education4uofficial
nIMBA0qO684,Syntax directed definition(SDD) in compier design||Types of attributes||Types of SDD,173 978 katselukertaa,14.31,/@SudhakarAtchala
0c5My7n371o,Compiler Design: S-Attributed and L-Attributed Definition,159 365 katselukertaa,18.42,/@anitar8483
PZjNFwVraSc,NBA 2K23 MyCareer - How To Upgrade Attributes (Current Gen),142 738 katselukertaa,2.01,/@RuthlessDK
K_XEqFk-qOM,#32 | Create Blocks with ATTRIBUTES in AutoCAD @DeepakVerma_dp,101 336 katselukertaa,13.12,/@DeepakVerma_dp
jlpkV3oY5-A,HTML - Attributes,101 177 katselukertaa,5.33,/@TutorialsPoint_
rIVxR-4BbK8,Epidemiology: Calculating Attributable Risk,99 590 katselukertaa,4.31,/@watsonpho1
Zt82lC6r04Q,Real Players Guess Their  FM Attributes,87 465 katselukertaa,10.07,/@ZealandonYT
h8BIqwy4Lks,WHAT IS THE BEST VALUE FOR EVERY ATTRIBUTE IN NBA 2K23?,72 281 katselukertaa,40.00,/@LakerFan
7s26zicph-Y,NBA 2K23 - How To Get Past Attributes Screen When Creating A Build,65 709 katselukertaa,1.53,/@RuthlessDK
U1W4T8Qwzyk,CD33: Types of SDT | S-Attributed SDT | L- Attributed SDT |Synthesized and Inherited Attribute,65 094 katselukertaa,10.56,/@UniversityAcademy
HBxaCxgOWHg,Annotated parse tree for 3*5||Inherited attributes,65 098 katselukertaa,7.28,/@SudhakarAtchala
RiJGk8w4_-8,Synthesized Attribute And Inherited Attribute Explained With Examples l Compiler Design Course,54 177 katselukertaa,5.38,/@5MinutesEngineering
ppmkzGH3aNY,Names Of Allah And His Attributes | Lesson 1 | The Master & Nurturer | Ustadh Hisham Abu Yusuf,53 879 katselukertaa,48.37,/@AlfurqanMCR
cgTa7YnGfHA,Attribute Based Access Control,49 614 katselukertaa,3.42,/@NIST
rtf1X7MdP50,Attribute meaning in Hindi | Attribute का हिंदी में अर्थ | explained Attribute in Hindi,40 656 katselukertaa,0.48,/@WorldwideSpokenEnglishByVS
