Video Id,Title,View Count,Length,Channel
I1nX5EuvwzE,Shubh - Elevated (Official Music Video),86Â 536Â 322 katselukertaa,3.50,/channel/UCtGbExCzlwmsyWKpxLnyEww
qnN9Zz6BBzs,Travis Greene - You Waited (Official Music Video),72Â 251Â 894 katselukertaa,5.51,/channel/UC4jufEFPiBuZhH2QDul-mHw
9_kUmaHS7kk,Most awaited moment ğŸ¥º#shortvideo #shorts #babybirth #newborn #doctor,21Â 555Â 738 katselukertaa,0.16,/@junior_moment4302
2cjILGNivpk,Most Awaited Love Songs | Chinnari Chinnari Chiluka Video Song | Lalitha Audios And Videos,16Â 164Â 647 katselukertaa,9.11,/@LalithaAudiosAndVideos
7upwSrRFVqw,The pet owner's long-awaited friend has finally returned to her.,11Â 523Â 216 katselukertaa,0.10,/@catlala
sY6R-jBGf8o,Delicious Cocktail and Salad Of Juicy Watermelon! The Most Long-Awaited Dessert Of The Summer,10Â 651Â 522 katselukertaa,16.14,/@KananBadalovChannel
V_VefDYe3Dw,The most awaited Barkat-e-Ramzan OST by #RahatFatehAliKhan,9Â 274Â 737 katselukertaa,6.23,/@NewsOnePkofficial
uJgklZ_weJw,my long awaited ice cream,6Â 637Â 551 katselukertaa,0.29,/@Levsob
5_TX05DBZ7E,Most Awaited Lyric-less Music Video of India |  VALAGA RELOADED | Official Video,6Â 501Â 265 katselukertaa,5.39,/@BipinBopannaPodamada
3-BRSqycZsg,Finally most awaited Home Tour part-1 | Shoaib Ibrahim | Ibrahim Family | Vlog,6Â 377Â 903 katselukertaa,20.10,/@ShoaibIbrahimOfficial
CvpArrFRKuU,Laung Laachi | Most Awaited Song Remix With Dhol | Waseem Talagangi 2019,5Â 557Â 889 katselukertaa,4.28,/@WaseemDholMaster
67Lwh7QM09g,Munawar Faruqui Ã— Ruhee Dosani Ã— Nazilaâ¤ï¸ | Most awaited video,5Â 322Â 693 katselukertaa,0.49,/@CareerGoalsIndia
Y-ygKLwRy0c,B2K VS RUOK FF | BORN2KILL VS RUOK 1V1 MOST AWAITED ROOM IN THE WORLD,5Â 098Â 355 katselukertaa,8.06,/@RIGADAFF
INXeYRo9Y9k,The long awaited meeting #edit #httyd #shorts,3Â 663Â 549 katselukertaa,0.19,/@biansage
ilTgzCEjSMg,the long awaited skincare routine | my secret to clear skin revealed,3Â 589Â 944 katselukertaa,10.23,/@alessyafarrugia
4pi1rKq2KFw,Jon Snow & Night King's most awaited battle in Winterfell #GameOfThrones #HouseOfTheDragon #Shorts,3Â 519Â 755 katselukertaa,0.43,/@dragonwolftv
QRd_B9W4wuM,The long-awaited sequel #shorts #chiknnuggit,3Â 422Â 172 katselukertaa,0.06,/@chiknnuggit
-obpFLY-33k,Finally - Unlucky RCB's Long-Awaited Moment of Glory! #Shorts #Viral #RCB,3Â 369Â 107 katselukertaa,0.32,/@BndRajput17
fmQef3Cp-kk,The Long Awaited Return | 2023 Mitsubishi Motors RALLIART,2Â 969Â 558 katselukertaa,0.31,/@mitsubishicars
QMoeycPtzx0,Long Awaited Halibut Haul - Longlining in the Gulf of Alaska,2Â 792Â 326 katselukertaa,47.38,/@EISAlaska
