Video Id,Title,View Count,Length,Channel
64tSUb_LTdI,Fifty Shades Freed (2018) - I Await Your Pleasure Scene (10/10) | Movieclips,10Â 760Â 129 katselukertaa,2.38,/@MOVIECLIPS
jVEgftSh1PA,Dog Awaiting Death In The Spot Where He Was Abandoned (Part 2) | Animal in Crisis EP170,10Â 557Â 269 katselukertaa,10.15,/@kritterklub
fP5i4cYKWVI,Oddbods | AWAITING CHRISTMAS | Funny Cartoons For Kids,7Â 536Â 410 katselukertaa,20.10,/@Oddbods
yew9L0Xjm_g,Slayer - Hell Awaits,5Â 506Â 340 katselukertaa,6.18,/@Nikz847
jFamWoA3Jro,AWAIT FURTHER INSTRUCTIONS (2018) Ending Explained,5Â 197Â 916 katselukertaa,28.29,/@FoundFlix
luap--gQmWg,Awaiting Life In Abandoned Giant Nandu Eggs,2Â 429Â 411 katselukertaa,9.16,/@AChickCalledAlbert
CPONodnuImw,King Iso -  I Won't Quit feat. Tech N9ne and Awaiting Eli (Official Video),1Â 920Â 755 katselukertaa,5.41,/channel/UCxL4Tb6txLFWyxHza6dehzA
nc9nRkt-q3Y,Unbelievable Prizes Awaiting You With #ONPASSIVE,1Â 430Â 786 katselukertaa,2.10,/@ONPASSIVE
Kx9tkpiiWl4,"In Prison, These Women Await Death | Full Documentary",1Â 260Â 506 katselukertaa,53.16,/@BestDoc
LU14o6YGWT4,Finally... The Long Awaited Freestyle Vibe Between HYPE MONSTER AND THE BLACK BOY IS OUT...,1Â 194Â 571 katselukertaa,20.50,/@hypemoster
UKFb1oiFqh8,How to Beat the FAKE NEWS in AWAIT FURTHER INSTRUCTIONS,893Â 342 katselukertaa,34.34,/@NerdExplains
xSOCk34vt1U,Await Further Instructions Trailer #1 (2018) | Movieclips Indie,867Â 188 katselukertaa,1.54,/@RottenTomatoesINDIE
Vb050VjZMFI,ğŸ˜± I am Ready & Awaiting ! ! Reply to Dr. Misbahi Ø­ÙØ¸Û Ø§Ù„Ù„Û on JAHAZ wala BABA ! ! Engr. Muhammad Ali,748Â 807 katselukertaa,28.44,/@EngineerMuhammadAliMirzaClips
QAV_YnMJ2g0,Marilyn Manson - Birds Of Hell Awaiting,711Â 633 katselukertaa,5.08,/@MattGabriel666
juQugbSLFvw,Future Awaits (w/ Lyrics) â€“ Xenoblade Chronicles 3: Future Redeemed ~ Original Soundtrack OST,648Â 014 katselukertaa,4.39,/@NintendoMelodyHD
YCskk8oJf7A,The teaser of the long awaited episode 1 one of RARE LOVE series is here.,575Â 152 katselukertaa,0.31,/@flexfilmztv
Vk4wmi_y7S4,Ocala homeowner slept in closet awaiting squatter who trashed his home,554Â 305 katselukertaa,1.58,/@fox35
UtfOzYfoEs4,Ale Ale trend after long awaiting,553Â 506 katselukertaa,0.36,/@SaroVideoPhotography
xHtSElUma6E,XANDRIA - The Wonders Still Awaiting (Official Video) | Napalm Records,505Â 603 katselukertaa,5.26,/@napalmrecords
gpDgjyM_kps,Ø§Ù„ÙÙŠÙ„Ù… ÙƒØ§Ù…Ù„ Ø¨Ø¯ÙˆÙ† ØªØ¹Ù„ÙŠÙ‚ | ÙÙŠ Ø§Ù†ØªØ¸Ø§Ø± Ø§Ù„Ø±ÙŠØ§Ø­ | Awaiting the winds,447Â 416 katselukertaa,42.15,/@laadiyoune
