Video Id,Title,View Count,Length,Channel
o-83E6levzM,"Incremental vs Differential Backup, & Full - Explained",317 733 katselukertaa,6.56,/@PowerCertAnimatedVideos
NFsDp09vAZg,aftrthght x Lazarus! - BacKUp!,14 936 katselukertaa,2.02,/channel/UC-DgRUfLZdZKE24F0bMDgog
tXGVzMUsuE4,The Best Free Backup for EVERY Operating System,184 740 katselukertaa,13.31,/@ChrisTitusTech
S0KZ5iXTkzg,Backups: You're doing 'em wrong!,260 261 katselukertaa,8.53,/@JeffGeerling
rFO6NyLIP7M,Data Backup: The 3-2-1 Rule,132 267 katselukertaa,6.16,/@ExplainingComputers
jRs24C60q6g,"Windows 10 Backup Free, Fast & Easy with built in Windows 10 Backup",175 982 katselukertaa,7.23,/@techtiptricks
07EHsPuKXc0,Disaster Recovery vs. Backup: What's the difference?,78 347 katselukertaa,9.32,/@IBMTechnology
FOu0LYt4uiI,What Backup Program Should I Use? A Recommended Approach,28 703 katselukertaa,10.20,/@askleonotenboom
CkSmo9WIjfA,Backup Types - SY0-601 CompTIA Security+ : 2.5,76 900 katselukertaa,10.26,/@professormesser
R-J61K7dFfM,How to Create an Image Backup,20 109 katselukertaa,14.12,/@askleonotenboom
h4upG3YmtJE,Lil Skies - Backup [Official Audio],378 015 katselukertaa,2.13,/channel/UCLEyFXOmaIgG6h4_6wqLx7Q
mpxBmxj5mP0,Backing Up Your Life is THIS Easy,2 326 227 katselukertaa,15.44,/@LinusTechTips
DNVXFLg41W0,What Free Backup Program Should You Use,20 845 katselukertaa,8.26,/@Britec09
jwkRLHdtsmc,How Do I Backup All My Servers???,150 776 katselukertaa,19.49,/@CraftComputing
-j3no_EHHbc,My ULTIMATE PHOTO BACKUP Strategy,24 148 katselukertaa,6.14,/@NigelDanson
f6AyeeLxzN8,All Synology Backup Methods Explained and Which One is Right For You?,76 460 katselukertaa,21.22,/@SpaceRexWill
JZbJ6q5Cscc,DeJ Loaf - Back Up (Video) ft. Big Sean,61 306 156 katselukertaa,4.03,/channel/UCGho0HsYFowWzC_-RxSdesQ
0H5LrF8PIeg,Das ultimative Backup für JEDEN! Örtlich getrennt | iDomiX,386 505 katselukertaa,16.06,/@iDomiX
4tAN9Pfrnos,"88 Come fare il backup, facile, sicuro, definitivo | AssMaggiolina Daniele Castelletti",10 026 katselukertaa,15.30,/@AssMaggiolina
BzMAW8kW0CU,Battery BACKUP for Home - DIY Step by Step,349 559 katselukertaa,32.54,/@ProjectsWithDave
