Video Id,Title,View Count,Length,Channel
68Gng7hV6jQ,"My Friends Trapped Me In 2b2t, So I Got REVENGE",1Â 231Â 953 katselukertaa,10.10,/@MinecraftCurios
nqNayNWdwe0,I took 4 edibles and decided to bake| BAKE WHILE BAKEDğŸƒneverrrr again,3Â 199 katselukertaa,17.23,/@princesstommi
p3TzgOmpS_s,The Effect of Steam When Baking Bread,8Â 676Â 223 katselukertaa,0.32,/@benjaminthebaker
2bUZqX3K0D0,How I Faked My Death On This Hardcore Minecraft SMP...,791Â 796 katselukertaa,10.45,/@MinecraftCurios
bSLN_3NOW14,The Baked Alaska Pressure Test! | MasterChef Canada | MasterChef World,35Â 734 katselukertaa,11.46,/@MasterChefWorld
Ly3dvV7_pfs,Best Baked Chicken // Worth Bragging About â¤ï¸,1Â 120Â 164 katselukertaa,6.52,/@rachelcookswithlove
2uYoqclu6so,"BAKED SALMON | easy, no-fail recipe with lemon garlic butter",3Â 771Â 945 katselukertaa,6.56,/@Downshiftology
bRN0bzp-O4g,Banana Baked Oats | Meals That Got Me Through College,7Â 240Â 584 katselukertaa,0.51,/@letsKWOOWK
uAnzZ5n22dg,Why the Baked Alaska is so hard to make,3Â 700Â 297 katselukertaa,0.59,/channel/UCAynUBIkB7gX10An54eEt4A
MiQFuCjgG6Q,Oven baked stuffed squid,10 katselukertaa,5.56,/@vanessamanalad5974
klUTNuyUP38,I Fooled My Girlfriend using ONE WAY Glass in Minecraft,71Â 197 katselukertaa,7.40,/@BakedCurios
33RXTCH1ZTY,How To Make The Most Mouthwatering Juicy Baked Chicken Ever | How To Bake A Whole Chicken.,162Â 971 katselukertaa,7.17,/@IslandVibeCooking
lhT6IJNXnj0,The Rions - Minivan | baked,766 katselukertaa,4.32,/@maisonbaked
RwiflPzF1p4,"My Friends Trapped me in NUKE REACTOR, So I Got REVENGE",1Â 967Â 544 katselukertaa,8.42,/@MinecraftCurios
TA7FecCAWS0,The Best Oven Baked Chicken and Rice EVER!!! | Baked Chicken Recipe,7Â 862Â 829 katselukertaa,10.30,/@RayMacksKitchenandGrill
8sQALDBpr4k,Baked brie and apricot jam,440Â 359 katselukertaa,0.22,/@daenskitchen
DJ02J0a4xmA,How to Tell When Chocolate Cake is Done Baking & What to Do With Under/Overbaked Cakes,2Â 906Â 057 katselukertaa,1.00,/@benjaminthebaker
MeQnv4W-0Y0,Why Baked Potatoes Always Taste Better At A Restaurant,193Â 207 katselukertaa,11.28,/@MashedFood
XrCdaPSonVk,Twice Baked Potatoes,219Â 802 katselukertaa,1.00,/@oldscoolkevmo
