Video Id,Title,View Count,Length,Channel
06kJXhOZhLU,What do investment bankers actually do?,567 345 katselukertaa,9.12,/@GoodWorkMB
nd5OA02kbq0,WTF Do Investment Bankers Actually Do?,829 295 katselukertaa,14.12,/@HowMoneyWorks
PsFpFP8o1o8,"Money, Power, Impunity: The Bankers Who Stole The World | 2008 Bank Crisis & Recession Documentary",312 880 katselukertaa,54.54,/@JavaDiscover
AkHbB9GuCkE,Jamie Dimon - The Most Powerful Banker in America | Full Documentary,2 644 967 katselukertaa,34.32,/@Finaius
BrKf9nYeXT0,All Wars Are Bankers Wars [English subtitles],50 688 katselukertaa,43.34,/@ratatoskr8462
J_-nk9-sMus,The Banker — Official Trailer | Apple TV+,2 552 803 katselukertaa,2.31,/@AppleTV
zj2_oClg04M,IBPS PO Pre 2023 | Complete Paper-2 | Reasoning By Puneet Sharma,8 076 katselukertaa,54.32,/@bankerswaybyunacademy
r4I6uqLuJfA,How the Central Bankers Plan to Come After Your Assets.,38 947 katselukertaa,24.51,/@maneco64
E1FqgQotJEE,Bankers: The Men Who Collapsed The Global Economy (2008 Financial Crisis Documentary),7 069 katselukertaa,54.54,/@dispatchdocumentaries
iAFCxZqaF6Q,"15 Sept 2023 | The Hindu Editorial Analysis, Vocab, Idioms, Reading Comprehension | Vishal Parihar",5 572 katselukertaa,49.14,/@bankerswaybyunacademy
wa0btZay9gU,Revealing my BANKER SALARY for the first time,394 651 katselukertaa,9.47,/@nischa
MgYNP6SK-eU,"Junior Bankers Need to Work 12 Hour Days, J.P. Morgan's Erdoes Says",678 730 katselukertaa,3.35,/@DavidRubenstein
hp33zFcvyRU,The Banker Trailer #1 (2019) | Movieclips Trailers,1 216 572 katselukertaa,2.33,/@RottenTomatoesTRAILERS
pn548uALuYw,The Ex-Banker on Cocaine Binges & £600k Bonuses | Informer,5 146 866 katselukertaa,6.30,/@VICE
ipqTsyUajWA,15 September Current Affairs 2023 | Current Affairs Today | Current Affairs by Abhijeet Mishra,6 615 katselukertaa,1.18.41,/@bankerswaybyunacademy
LgI0ViiFIJY,Are you ready to become bankers? | Marcos Eguiguren | TEDxGracia,41 919 katselukertaa,14.25,/@TEDx
_s42gOg2WSU,Suits - Investment bankers,3 359 992 katselukertaa,2.08,/@ackeeee1
7F5HqjBCujo,THE BANKERS FULL VIDEO (New Hit Movie) - Ken Erics|LizzyGold|2023 Latest Nigerian Nollywood Movie,18 069 katselukertaa,5.12.19,/@africanmoviestv1
5_knRwioioM,Investment Bankers Discuss Masculinity | Grayson Perry: All Man,58 923 katselukertaa,3.15,/@Channel4Entertainment
v3vlji3-tks,THE BANKERS SEASON 1 (New Hit Movie) - Ken Erics|LizzyGold|2023 Latest Nigerian Nollywood Movie,128 100 katselukertaa,31.56,/@Firstnollytv
