Video Id,Title,View Count,Length,Channel
ydfyM48MtsY,How to Tame a Wild Beard (6 Step Tutorial) | GQ,3 303 088 katselukertaa,16.40,/@GQVideos
URCSfGeY2UU,TIMTHETATMAN REACTS TO UNBEATEN FOOD CHALLENGE WITH BEARD,76 919 katselukertaa,15.40,/@timthetatmantwo
hysVSoMn6E8,THIS MIXED GRILL CHALLENGE HAS ONLY BEEN BEATEN ONCE!! | BeardMeatsFood,2 450 880 katselukertaa,14.21,/@Beardmeatsfood
umVRa_pD7Uk,NO WONDER THE WALL OF FAME HERE IS STILL EMPTY! | BeardMeatsFood,3 084 241 katselukertaa,13.48,/@Beardmeatsfood
paUSXWMboxM,How to Shape Up Your Beard (4 Step Tutorial) | GQ,12 980 283 katselukertaa,9.40,/@GQVideos
pEXx2MFJsFU,8 BEARD GROWING MISTAKES YOU NEED TO AVOID with Matty Conrad,1 667 546 katselukertaa,4.37,/@mattyconradgrooming
Hcfg6zRLMdQ,10 Beard Mistakes You're Probably Making (and How to Fix Them),24 486 katselukertaa,9.54,/@Beardster
t5Gv3k_xgYw,WHAT SHAPE  OF BEARD IS BEST FOR BALD GUYS?  With GQ's Matty Conrad,95 100 katselukertaa,21.15,/@mattyconradgrooming
ozVA90lNueM,College Girls React to Men’s Hair and Beards with Greg Berzinsky,1 313 510 katselukertaa,18.47,/@BeardbrandAlliance
MetGyLinnzk,Notable Beard Co. Live | NEW COMPANY RELEASE! | Episode 76,295 katselukertaa,1.32.09,/@Kensconsin
oThUGqg5TuA,Best BEARD STYLES for MEN to try,755 281 katselukertaa,5.05,/@DLMMensLifestyle
BZtXqqV_RlU,10 BIGGEST Beard Mistakes You Need to AVOID!,189 536 katselukertaa,9.18,/@alpham
-4kh_KXPcrM,Beard Expert Critiques Celebrity Beards | Fine Points | GQ,2 513 511 katselukertaa,13.49,/@GQVideos
3YDQw4QY7Wc,How To Get The Perfect Beard And Hair Combination,15 038 katselukertaa,10.06,/@RealMenRealStyle
9L6DJLByaKI,How to Shape your BEARD For A PERFECT JAWLINE  (Step-By-Step Guide),151 010 katselukertaa,10.27,/@JosecZuniga
tZoQVf0Y_FE,Expert Tips to Avoid Beard Shaping Disasters! | LIVE BEARDED,3 070 katselukertaa,4.37,/@livebearded
5ba3e2P2j8k,THICK & DENSE Beard Gets Kratos Inspired Trim,15 449 katselukertaa,14.30,/@Beardbrand
BGxooA7r4dg,HOW TO TRIM YOUR BEARD AT HOME - KRATOS DIY EDITION,464 119 katselukertaa,21.18,/@mattyconradgrooming
nVY_hvAkmSY,How to Trim Your Beard at Home (4 Step Tutorial) | GQ,3 700 834 katselukertaa,10.01,/@GQVideos
