Video Id,Title,View Count,Length,Channel
XrCg9G_OHAA,Beau Is Afraid | Official Trailer 2 HD | A24,10 309 483 katselukertaa,0.46,/@A24
PuiWDn976Ek,Beau Is Afraid | Official Trailer HD | A24,9 334 978 katselukertaa,2.25,/@A24
s8eCWBoyLMk,Let's talk about Susanna Gibson and Virginia....,78 708 katselukertaa,4.12,/@BeauoftheFifthColumn
LEKIJpVppKE,Beau Dermott is Amanda Holden's golden girl  | Week 1 Auditions | Britain’s Got Talent 2016,29 262 628 katselukertaa,4.12,/@BGT
kFFSFxjg-TY,Rafting the most polluted river in Australia,275 400 katselukertaa,21.51,/@BeauMiles
iWUuVf8sY-M,Bo vs Beau  😱,33 044 katselukertaa,0.36,/@NHL
k3u89kf3hVk,Let's talk about Trump and severed cases....,74 705 katselukertaa,3.59,/@BeauoftheFifthColumn
pJzfJIwxoXM,Let's talk about how news is created rather than reported and charts....,87 305 katselukertaa,6.30,/@BeauoftheFifthColumn
-dKZuyQsXWg,A weekend away after the hardest year of my life,637 102 katselukertaa,5.43,/@BeauMiles
gqhBegc00cM,"Ari Aster opens up about his bizarre ""nightmare comedy"" Beau Is Afraid",163 873 katselukertaa,14.18,/@QwithTomPower
iWC6GjhhXjM,"Let's talk about McCarthy, Biden, Trump, and impeachments....",129 130 katselukertaa,4.23,/@BeauoftheFifthColumn
WeMzw1-toW0,'Beau Is Afraid' is a LOT (Review),399 160 katselukertaa,9.18,/@KarstenRunquist
PBTdbRsdQ-U,"Let's talk about Ukraine, Russia, ships, and cars....",83 446 katselukertaa,5.02,/@BeauoftheFifthColumn
aA6rHFxmUaE,My Dog Beau,16 293 282 katselukertaa,9.57,/@Haminations
hBZ4VoNImhI,RAW | Beau Akey 09.14.23,1 231 katselukertaa,3.45,/@edmontonoilers
l_nCxzTkecw,"Let's talk about Memphis, the feds, and Mr. Nichols....",79 011 katselukertaa,5.41,/@BeauoftheFifthColumn
_0RkDRfnTF4,Mirela Petrean si Alex de la Orastie - Lasati-ma ca sa beau (video oficial 2023),220 200 katselukertaa,3.16,/channel/UCWEnn5iPYAJhRnyn29G3Rfw
o8YgqN9cG84,Renovating a canoe while running a marathon,360 671 katselukertaa,21.01,/@BeauMiles
