Video Id,Title,View Count,Length,Channel
NNnIGh9g6fA,1. Introduction to Human Behavioral Biology,16 714 406 katselukertaa,57.15,/@stanford
Y0Oa4Lp5fLE,2. Behavioral Evolution,6 632 716 katselukertaa,1.36.57,/@stanford
uNYRM58jBB0,HE SAW EVERYTHING in the COURTROOM During Amber Heard's Testimony! Inside Scoop on JURY REACTION!,3 575 354 katselukertaa,45.04,/@TheBehavioralArts
oKNAzl-XN4I,3. Behavioral Evolution II,2 875 075 katselukertaa,1.36.59,/@stanford
6aO6cGTcnUg,How to succeed in your JOB INTERVIEW: Behavioral Questions,2 257 710 katselukertaa,22.26,/@engvidEmma
IKJPtpaNP2A,Healing Inner Child: Transformative CBT Methods to Address Abandonment,2 051 702 katselukertaa,43.52,/@DocSnipes
ZMLzP1VCANo,Split brain behavioral experiments,2 013 139 katselukertaa,4.36,/@Neuroslicer
9X68dm92HVI,Are we in control of our decisions? | Dan Ariely,1 956 166 katselukertaa,17.27,/@TED
IV30jAw7dxA,How to Answer Behavioral Interview Questions Sample Answers,1 657 610 katselukertaa,7.51,/@SelfMadeMillennial
GHOMMsmF_EE,Body Language Analyst REACTS to Johnny Depp v. Amber Heard TRIAL. Who is Lying?!,1 632 358 katselukertaa,32.33,/@TheBehavioralArts
7LD8iC4NqXM,Case study clinical example CBT: First session with a client with symptoms of depression (CBT model),1 617 882 katselukertaa,13.55,/@JudithJohnsonphd
XUKEFp4e6RU,Body Language Analyst REACTS to Amber Heard TESTIMONY! Did Johnny Depp Hit Her? Shocking PERJURY!,1 591 895 katselukertaa,42.05,/@TheBehavioralArts
8-2WQF3SWwo,LIVE Cognitive Behavioral Therapy Session,1 426 461 katselukertaa,23.10,/@MedCircle
e0WZx7lUOrY,6. Behavioral Genetics I,1 422 213 katselukertaa,1.38.35,/@stanford
n3OWsRFtTeI,ANIMALS ADAPTATION | How Adaptation In Animals Work? | The Dr Binocs Show | Peekaboo Kidz,1 363 441 katselukertaa,6.54,/@Peekaboo_Kidz
5cyzMp6CSs8,"Body Language Analyst REACTS to Harry & Meghan, Netflix Documentary. What AREN'T They Saying?",1 325 208 katselukertaa,49.41,/@TheBehavioralArts
ZLtO_7LjzVg,7 BEST Behavioural Interview Questions & Answers!,1 293 960 katselukertaa,14.16,/@CareerVidz
g7B3n9jobus,What is Cognitive Behavioral Therapy,928 321 katselukertaa,10.20,/@Katimorton
dqxQ3E1bubI,Behavioral Economics: Crash Course Economics #27,872 484 katselukertaa,10.34,/@crashcourse
