Video Id,Title,View Count,Length,Channel
qqy_rCmcNp8,"BELGIAN FOOD TOUR! (First Time in Brussels, Belgium)",35 605 katselukertaa,16.38,/@DeanaandPhil
C6h7NnkX7hk,Race Highlights | 2023 Belgian Grand Prix,5 232 907 katselukertaa,8.13,/@Formula1
12qn9VpYXus,Malinois VS Doberman,66 695 katselukertaa,8.03,/@ViralBe
o0PT6bOwfFM,10 Best Places to Visit in Belgium - Travel Video,483 291 katselukertaa,12.54,/@touropia
oQYrQJou4WU,"The Best BELGIAN FRIES TOUR of Brussels, Belgium!",65 830 katselukertaa,15.27,/@Davidsbeenhere
rrYenMOo8Rg,Qualifying Highlights | 2023 Belgian Grand Prix,4 251 345 katselukertaa,7.23,/@Formula1
uXFgXU8bTCo,WINDOWS TRANSFORMATION: we gave our windows a FRESH LOOK /   [Turning OLD SHED into TINY HOUSE],45 246 katselukertaa,28.09,/@DeHoeveOldBelgianFarm
XLg54FEI1XE,Irish People Try Strong Belgian Beers,376 355 katselukertaa,11.35,/@TheTRYChannel
5j4EBtEFRgY,Belgium 5-0 Estonia | Vertonghen's 150th game | #REDDEVILS | European Qualifiers,131 765 katselukertaa,2.11,/@royalbelgianfa
orAGU04T0rc,"Belgian Malinois, Amazing Athlete!!!",7 919 921 katselukertaa,3.08,/@JosephCartertheMinkMan
Kudda-4FO3Q,Beer expert blind tastes 16 Belgian Tripels | The Craft Beer Channel,22 885 katselukertaa,25.31,/@TheCraftBeerChannel
cxEySPSUcXs,Why is Belgium a country? - History of Belgium in 11 Minutes,2 162 651 katselukertaa,11.01,/@Knowledgia
P3RO1JbL02U,"BRUSSELS, BELGIUM (2022) | 10 BEST Things To Do In Brussels",215 220 katselukertaa,10.05,/@worldwildhearts
DbPsfDhhTTw,You Know You're Dating a BELGIAN Woman When...,109 202 katselukertaa,6.10,/@DatingBeyondBorders
gZuI-dR9pfU,Belgium: Bruges and Brussels,3 269 489 katselukertaa,26.09,/@ricksteves
6eGEX_LTqhQ,Why does Belgium Exist? (Short Animated Documentary),3 473 657 katselukertaa,5.00,/@HistoryMatters
2ZfqIfSdeK0,F1 Sprint Highlights | 2023 Belgian Grand Prix,3 896 268 katselukertaa,7.11,/@Formula1
2SIQ3PR6lsw,I Flew To Belgium Just To Try Belgian Waffles | The Night Shift,490 568 katselukertaa,17.00,/@MikeMajlakVlogs
iUFGPK2AUtQ,Belgium: The Don'ts of Visiting Belgium,147 668 katselukertaa,14.12,/@woltersworld
