Video Id,Title,View Count,Length,Channel
PCrD5AIe0O8,"Nice collection, Bez #animation",4 472 022 katselukertaa,0.24,/@chiknnuggit
_CZj-l9MJmg,The Bezel-less Mi Mix - BEND TEST and Ceramic Scratch Test,2 937 937 katselukertaa,5.55,/@JerryRigEverything
fmPsQcuHUMM,Film Theory: Time is Running OUT! (Chikn Nuggit Lore),2 679 195 katselukertaa,17.06,/@FilmTheory
8ZQl3HTNXpo,Can this REALLY make bezels DISAPPEAR??? - ASUS ROG Bezel-Free Kit,2 652 731 katselukertaa,7.38,/@ShortCircuit
zPhTT8OvHMA,…Interesting #animation #chiknnuggit #shorts #cartoon,2 503 021 katselukertaa,0.11,/@oscarotoole
ThkMi9fkdEc,Let's Talk About Smartphone Chins!,1 955 671 katselukertaa,6.04,/@mkbhd
GKfK1g3LNtE,✨Bezel ON AIR✨#animation,1 703 861 katselukertaa,0.30,/@chiknnuggit
WmWgMrymayA,Chikn ponders on Bezel’s words #animation #chiknnuggit #shorts #cartoon,1 480 008 katselukertaa,0.25,/@oscarotoole
zY8GG_5H6Ss,Why Do Screens Need Ugly BORDERS?,1 215 927 katselukertaa,5.25,/@techquickie
84Cp9Q_BFsc,Chikn Nuggit Lore Pt. 1,1 061 383 katselukertaa,5.26,/@chiknnuggit
RufQ_0aQN4Y,The NEWEST chikn nugget videos compilation✨🌺🧸,1 032 128 katselukertaa,4.49,/@lovelife5025
grBqKn58KNE,Dracbaby x Bezzal - Redeye (Official Music Video),989 541 katselukertaa,3.13,/@Ftystudios1
u2KZV_Ar4Bo,How to read a tachymeter watch bezel,868 417 katselukertaa,3.46,/@GrayAndSonsFL
Vs7QOFg_MiQ,Does It Actually WORK!?  ASUS Bezel-Free Kit Review,860 088 katselukertaa,12.21,/@HardwareCanucks
oYmomrmaSYg,Boat Wave EDGE Unboxing Bezel Less Display With Functional Crown Under 2000 Rs 🔥,799 620 katselukertaa,0.55,/@azeemshort
luS3P_P8D6Y,ProStreet OST 04 - Junkie XL - Bezel,753 485 katselukertaa,3.02,/@Kisiel14
bkoOE5d-z0w,Top 12 FAIRY PENDANTS MADE OUT OF AN EPOXY RESIN Open bezel technique,653 017 katselukertaa,11.34,/@top20svetafresh11
fXNkN5T7hIw,How to bezel a 30x22mm Swarovski cabochon - Free beading tutorial by Sidonia's handmade jewelry,626 656 katselukertaa,47.53,/@Sidoniashandmadejewelry
WaHSADVB9Ag,What is a Diver's Watch? How to Use a Divers Bezel.,473 819 katselukertaa,2.32,/@Synthspike
3yL1TV4K0ng,Android Phones Vs iPhone X Bezels? The Notch Game 🔥🔥🔥,432 400 katselukertaa,6.02,/@TechnicalGuruji
