Video Id,Title,View Count,Length,Channel
3BI3NI54aAg,"15 Things to do in Billings, Montana",95 437 katselukertaa,8.36,/@ThroughMyLens
yQYkepKLM68,"BILLINGS, MONTANA - The TOP 10 Places you NEED to see!",25 345 katselukertaa,9.59,/@601TRAVELS
A_OTVionYUA,BILLINGS: Just How DULL & DRAB Is Montana's Biggest City?,177 519 katselukertaa,22.20,/@JoeandNicsRoadTrip
wJakmlpqY1c,10 Things to do in Billings Montana,9 584 katselukertaa,11.14,/@AliceFordAdventures
1pKz1N_mmTY,"Driving in Downtown Billings, Montana - 4K60fps",7 448 katselukertaa,11.35,/@weicitytour
WipeaEb3KZQ,"TOP 10 Reasons why BILLINGS, MONTANA is the WORST city in the US!",30 026 katselukertaa,8.51,/@601TRAVELS
t7S_07E-9CA,American Revolutionary Song: Chester - William Billings,458 599 katselukertaa,2.22,/@IanBerwick
j1EJWbNCluc,"'Busy, but empty': downtown Billings hit hard by business closures",504 katselukertaa,2.08,/@KTVQNews
xET-4DpAAR4,15 Things to Know - Moving to Billings Montana ‼️,9 710 katselukertaa,6.26,/@movemetomt
W6CR6-0NAXM,Billings Montana: Top 5 Highlights,1 137 katselukertaa,6.55,/@travelhighlights
iYnLJGS3iSs,Downtown Billings: A look at the past and the future,30 858 katselukertaa,4.12,/@KTVQNews
J96jTtKLi2E,"Living in Billings, Montana",10 393 katselukertaa,18.58,/@LivinginMontana1
rH8UCzcuvMU,"[4K] Billings Downtown 4k -Driving downtown - Montana, USA",5 214 katselukertaa,20.33,/@mslulurara6826
o5LOU1wygSo,Arriving Billings Montana (KBIL),575 katselukertaa,18.58,/@BruceAirFlying
jUfCdx7NXt4,"It's All About The Rims, Baby - (Billings, Montana)",6 621 katselukertaa,18.17,/@DimeStoreAdventures
Czxv-J2724s,Q2 Rewind: Revisiting Montana Avenue's sordid past in downtown Billings,3 118 katselukertaa,3.19,/@KTVQNews
BoF1mYpciiY,"Uncovering the Dark Past of the Largest Mansion in Billings, MT",1 051 818 katselukertaa,8.34,/@RidiculousRealEstate
nHkLMn8PkDI,Rock Hounding My Favorite Spot On The Yellowstone river | Billings Montana    July 2022#thefinders,4 225 katselukertaa,10.57,/@406findings
oj9XYLC17H8,"Billings, MT - Driving Tour 4K",23 507 katselukertaa,14.09,/@dsnevada911
