Video Id,Title,View Count,Length,Channel
4XcikWp3hN8,#BIOGRAPHY #Mohammed Rafi l  #मोहम्मद_रफ़ी की जीवनी l Legend of Hindi Cinema,4 519 359 katselukertaa,1.28.19,/@BVKaTV
bu1D2yo4h4M,What is a Biography?,168 017 katselukertaa,2.09,/@LearningAcademyforKids
DRObW9noiVk,"""A Cloud Never Dies"" biographical documentary of Zen Master Thich Nhat Hanh narrated by Peter Coyote",1 041 020 katselukertaa,27.13,/@plumvillageonline
OpT8mEGMUDI,"Gene Kelly: To Live and Dance | Biography, Documentary | Full Movie",510 838 katselukertaa,52.16,/@CultCinemaClassics
tQkRUiOUnlQ,Emily Dickinson – Unravelling her 20 year Seclusion | Biographical Documentary,222 669 katselukertaa,26.59,/@professorgraemeyorston
kiPVB4F83dg,"Al Pacino: The Godfather Of Cinema | Full Biography (The Godfather, Heat, Scent of a Woman)",495 722 katselukertaa,1.28.46,/@ItsBiographer
BPjEVRJtycw,Tom Jones: Musical Phenomenon | Full Documentary | Biography,985 508 katselukertaa,45.10,/@Biography
ck-6yZdE1os,"The Hard Way of Robert Downey Jr.'s Success | Full Biography (Avengers, Sherlock Holmes, Zodiac)",433 194 katselukertaa,1.10.31,/@ItsBiographer
BowIPxXAlRw,"Tom Cruise: Life On The Line | Full Biography (Top Gun, Mission: Impossible, Rain Man)",2 709 627 katselukertaa,55.46,/@ItsBiographer
6Sc9Rcm-FwU,"Who Is Leonardo DiCaprio? | Full Biography (Titanic, Inception, The Revenant)",1 026 965 katselukertaa,1.24.51,/@ItsBiographer
cp4zZzdC_M0,Elements of a Biography - With Audio,14 827 katselukertaa,2.36,/@christinanording9018
BLTfP1G5DTM,Emily Brontë - The Strange One -  Biographical Documentary,265 980 katselukertaa,26.36,/@professorgraemeyorston
sqT24MU4iR0,William Howard Taft Biography || William Howard Taft : A Biographical Journey || (1857-1930),32 katselukertaa,8.15,/@InternationalBiography07
