Video Id,Title,View Count,Length,Channel
5ybRY_DzQLA,"EDI project on Bitcoin SV using Unwriter's Planaria, Bitpipe & Craig Wright patent w/ Joshua Henslee",1 258 katselukertaa,1.54.05,/@mariannejett4846
Hlsy8VFmW4I,BitPipe session 1,38 katselukertaa,4.08,/@bataais3091
D_7Ia1yznNM,BitPipe session 2,27 katselukertaa,3.08,/@bataais3091
H_3ArkbQzto,"BitPipe, drone tonic note / modes select on power up",25 katselukertaa,2.39,/@bataais3091
B3HwfEa25TI,How to pronounce bitpipe - Vocab Today,3 katselukertaa,0.26,/@vocabtoday5262
