Video Id,Title,View Count,Length,Channel
BhltwjuiEk4,How To Make a WordPress Blog - Step by Step,530 247 katselukertaa,2.14.31,/@TylerMoore
HFBCOrZfGo4,How to Use AI to Make $10k/Month Blogging (Masterclass for 2023),29 159 katselukertaa,39.41,/@AdamEnfroy
mhYq-xhcGPI,Train Dikh Gayi 😅 But Popat Hogya,2 367 009 katselukertaa,8.50,/@souravjoshivlogs7028
YFiTev4okcI,Make Money Blogging in 30 Days (MASTERCLASS Built for Speed),9 445 katselukertaa,39.22,/@AdamEnfroy
IrYwLttQ5Fw,How to Start a Blog in 2023 (57 Minute Masterclass),191 068 katselukertaa,57.58,/@AdamEnfroy
gWYJfNeR3xc,How To Make A WordPress Blog ~ 2023 ~ A Blog Tutorial For Beginners,201 753 katselukertaa,2.45.58,/@WebYoda
DdkwTIkhSIQ,EXACTLY How Much Bloggers are Earning in 2023: More Than Ever,46 631 katselukertaa,15.27,/@IncomeSchool
3RfHVDVZ9bc,Make money blogging in 2023 ⎯ times have changed (advice from a six figure blogger) 💸,12 307 katselukertaa,11.36,/@MiaBrox
I6DXbYbUQlE,My TOP Recommendation When Starting Your Blog | This is IMPORTANT,5 090 katselukertaa,10.32,/@perfectingblogging
uly9Bp0ayjs,How to Write The Perfect Blog Post in 2023 (Step By Step Tutorial),76 536 katselukertaa,27.38,/@AdamEnfroy
ZHX9l1ooL_g,"💻 3xDEV: MERN Blog App | Day 2: Frontend Setup and UI Design | Three Projects, Three Weeks",571 katselukertaa,1.14.53,/@GeeksforGeeksWebDevelopment
LGYEE4Jjpkc,Your blog's first 90 days... exactly what to do,140 639 katselukertaa,24.03,/@AdamEnfroy
6VUm1ofYODo,How to Start a Blog: The Fastest Way to Make $10k a Month in 2023,36 771 katselukertaa,52.48,/@AdamEnfroy
Fjf2q9C17BI,How to Start a Blog in 2023 | By Sophia Lee,175 935 katselukertaa,27.26,/@perfectingblogging
-sDQfu9XqBM,How to Make a Free Blog Website on Blogger.com,283 428 katselukertaa,13.55,/@TonyTeachesTech
VcnILIo0zVI,Blog-M -im Licht- #5.9,795 katselukertaa,53.59,/@blog-m
PPG1-CqAghA,How To Start A Blog & Make Money From Day 1 (Step by Step),711 384 katselukertaa,18.20,/@mikevestil
iYdU57Y231o,COMO CRIAR UM BLOG DO ZERO [2 MIL REAIS POR MÊS COM SITES!],51 332 katselukertaa,20.29,/@NerdsdeNegocios
nwlcflaOxCk,"Find Low-Competition, High-Traffic Blog Topics (with 5 FREE Tools) | Micro Niche Blog Topics 2023",44 589 katselukertaa,17.44,/@wscubetech
