Video Id,Title,View Count,Length,Channel
qldf3CPLqJA,Blogger Tutorial For Beginners 2023 (Step-By-Step),15 356 katselukertaa,8.30,/@tutorialsbymanizharyan2121
-sDQfu9XqBM,How to Make a Free Blog Website on Blogger.com,283 405 katselukertaa,13.55,/@TonyTeachesTech
DdkwTIkhSIQ,EXACTLY How Much Bloggers are Earning in 2023: More Than Ever,46 627 katselukertaa,15.27,/@IncomeSchool
oF5j342uTYg,Blogger - Tutorial for Beginners in 12 MINUTES!  [ COMPLETE ],468 465 katselukertaa,12.55,/@bai
BFZgOpJDgK0,First Impressions Don’t Always Tell the Whole Story!,15 967 katselukertaa,17.38,/@aCanadianBeekeepersBlog
ZQfJWu8jSnQ,How to Make Money with Blogger (with AdSense ads),66 549 katselukertaa,4.11,/@TonyTeachesTech
NuC-yJetAPY,Blogger.com For Beginners 2023 - How to Use Blogger to Create Blogs!,44 417 katselukertaa,8.22,/@thesocialguide7659
IrYwLttQ5Fw,How to Start a Blog in 2023 (57 Minute Masterclass),191 061 katselukertaa,57.58,/@AdamEnfroy
YFiTev4okcI,Make Money Blogging in 30 Days (MASTERCLASS Built for Speed),9 420 katselukertaa,39.22,/@AdamEnfroy
dEiRWraOejs,Google's Blogger Pros and Cons,37 910 katselukertaa,7.50,/@DavidUtke
R4sLsDO1XGk,"Make Money Blogging in 2023 - 4 Best Ways to Make $10,000 per Month",5 207 katselukertaa,12.30,/@AnastasiaBlogger
MPyyLCBqfa8,Blogger Tutorial For Beginners - How To Create a Professional Blogger Blog,11 587 katselukertaa,44.42,/@bladeprogramming7526
be80VTMSBlY,"VLOG ★ a day in my life *cooking, friends, etc*",723 713 katselukertaa,9.10,/@SydneySerena
6VpIGX5_5KU,Should you start a blog in 2023? Advice from a six figure blogger + TUTORIAL 💻✨,16 476 katselukertaa,19.15,/@MiaBrox
ZJWaQj6kjbE,News Blog Kaise Banaye in 2023 & Earn $5000 per month? Wordpress Blog Tutorial in Hindi,782 122 katselukertaa,1.11.46,/@SatishKVideos
LyqQKxEhl2o,Secret Income Method on Blogger: Free Blogger Crash Course to Make Money Online!,134 283 katselukertaa,41.28,/@90sMentor
Ggv0qisZWQk,"New ""Blogger"" Earning method 2023 | Free | Work from home job | Part time job | Sanjiv Kumar Jindal",261 952 katselukertaa,1.43.08,/@SanjivKumarJindal-Jobs-Skills
-lTwsITMQEk,🔴 Cómo CREAR un BLOG en Blogger y Personalizarlo - Blogger Tutorial 2023,35 067 katselukertaa,17.36,/@MonetizaTuTiempo
JNU_rjsC7PY,Blogging Complete Course for Beginners | How to Start Blogging & Earn Money in 2023,280 970 katselukertaa,2.19.42,/@KashifMajeed
