Video Id,Title,View Count,Length,Channel
oAHbLRjF0vo,The Better Boarding Method Airlines Won't Use,22 359 395 katselukertaa,8.28,/@CGPGrey
d6vfjWBT45o,What's Life Like in a Private British Boarding School? | Leaving Home at 8 Years Old,2 896 873 katselukertaa,45.18,/@_origin
LLv7RdFf0DA,Finnair Boarding Music 2022 FULL VERSION [New Cabin Ambiance],7 009 katselukertaa,45.30,/@inflightfin1308
AwJLa8UB0gM,Far Orange - Boarding (Royalty Free Music),2 709 katselukertaa,4.59,/@EpidemicLounge
DptGBVPnvKE,The Boarding of Flight 314 - SNL,8 591 710 katselukertaa,3.49,/@SaturdayNightLive
sBOlVTSiOEs,Boarding Schools - what are they like?,2 839 894 katselukertaa,8.24,/@lindybeige
iuGEqnmySvo,Why Airlines Won’t Fix Inefficient Boarding,519 438 katselukertaa,12.53,/@CNBC
qhxlZC8BZJ4,Boarding a Plane Shouldn’t Be This Hard - Key & Peele,9 216 918 katselukertaa,3.54,/@KeyAndPeele
UuDpMKR9uNI,Mobile App: Creating Boarding Pass - Turkish Airlines,10 208 katselukertaa,0.40,/@TurkishAirlines
vSwSn5XI2tg,EasyJet Flight EZY8934 Paphos - London Gatwick | TRIP REPORT | GoPro Wing View | Boarding to Landing,83 018 katselukertaa,10.49,/@greatflyer_aviation
810qddPcsqo,Bill Burr’s Issues With The Airline Boarding Process | CONAN on TBS,13 831 598 katselukertaa,7.33,/@TeamCoco
JhXE0w8y1iE,Boarding - T. M. Revolution,4 562 katselukertaa,4.55,/@adamcarlson961
LwrhyQEpRIY,Boarding Party,29 731 katselukertaa,3.05,/channel/UCS2dKEQMc9kCBgkIGOybokQ
4LGe265pwvU,Boarding Order - Key & Peele,19 027 505 katselukertaa,3.50,/@ComedyCentral
h8d2rFS5kog,Explaining Boarding Actions in Science Fiction,170 262 katselukertaa,8.31,/@Spacedock
1NBMUNawCGs,Starfield - Boarding Enemy Ships.. My Favorite Feature Hands Down  #sponsored,12 738 katselukertaa,14.43,/@CaptainShack
ARERGvMzhmc,Bill Burr's Issues With The Airline Boarding Process | CONAN on TBS,6 053 850 katselukertaa,14.31,/@TeamCoco
0z0E30uOMbs,Useful English expressions for Airport check-in (boarding pass),26 130 katselukertaa,1.29,/@RossIELTSAcademy
nHh0X8P_36c,Living Like Harry Potter - A Day At Boarding School,94 117 katselukertaa,6.21,/@dweuromaxx
G8q9T_D0RDc,A WEEK IN THE LIFE OF BOARDING SCHOOL!,4 097 278 katselukertaa,6.28,/@kateelisabeth
