Video Id,Title,View Count,Length,Channel
bwmSjveL3Lc,BLACKPINK - '붐바야 (BOOMBAYAH)' M/V,1 631 127 517 katselukertaa,4.04,/channel/UCOmHUn--16B90oW2L6FRR3A
b3CBErpZQQo,Kothi Mattu Bale Hannu Haadu | Kannada Rhymes for Children | Infobells,1 482 503 173 katselukertaa,2.13,/@infobellskannadarhymes
ReSiCM5bJYo,Vlad and Nikita had a Fun Day on the Beach! Plying with Mom and Sand,319 666 096 katselukertaa,6.14,/@VladandNiki
ivoS3HUJB3Q,BLACKPINK - '붐바야(BOOMBAYAH)' DANCE PRACTICE VIDEO,298 342 352 katselukertaa,4.09,/channel/UCOmHUn--16B90oW2L6FRR3A
G2RCCDSBEGk,Mohombi - Bumpy Ride,282 469 125 katselukertaa,4.00,/channel/UCkJdEfGbZwB2Dn_BmXvMfmw
UJC3QN7cOGw,Oota Ready - Playing with Kitchen Set Toys | Kannada Rhymes for Children | Infobells,270 635 660 katselukertaa,1.36,/@infobellskannadarhymes
cdR7tzSOhtE,Bombay To Punjab : DEEP JANDU Ft. DIVINE (Full Video) Karan Aujla | Satti Dhillon | Geet MP3,246 653 637 katselukertaa,4.12,/@GeetMP3
IWZFRzF_ndg,"Mumbai Dilli Di Kudiyaan | Student Of The Year 2 |  Tiger, Tara & Ananya| Vishal Shekhar| Dev, Payal",236 856 049 katselukertaa,3.39,/@zeemusiccompany
6eMbQUaEijI,Thotake Hogu Timma - Kannada Rhymes 3D Animated,221 283 399 katselukertaa,2.50,/@infobellskannadarhymes
y-k_ofefdkk,BAMB AAGYA (Official Video) Gur Sidhu | Jasmine Sandlas | Kaptaan |New Punjabi Song 2022,175 293 091 katselukertaa,3.30,/@browntownmusic
xq5f3SMU7lA,Baby doll kitchen cart food cooking toys baby Doli play,173 448 579 katselukertaa,10.36,/@toypudding
LpSH8MrYCfg,BLACKPINK - '붐바야(BOOMBAYAH)' 0814 SBS Inkigayo,168 148 008 katselukertaa,4.11,/channel/UCOmHUn--16B90oW2L6FRR3A
kMTBXLvqyx8,Funny stories with toys for kids - Vlad and Niki videos,164 686 269 katselukertaa,20.45,/@VladandNiki
FS9dkwhPypY,DIVINE – Chal Bombay | Official Music Video,138 318 371 katselukertaa,3.54,/@massappealindia
eJ4quPJ7-7Y,"How To Build House, Swimming Pool, Ground water For Catfish and Eel From Magnetic Balls (Satisfying)",132 348 746 katselukertaa,11.38,/@MagnetSatisfying
5jK8cwxMIBQ,Diana Pretend Play with Toy Sewing machine,122 216 871 katselukertaa,5.45,/@KidsDianaShow
fsfl25JQRdo,ನನ್ನ ಪ್ರೀತಿಯ ಹಸು | Kannada Rhymes for Children | Infobells,104 569 025 katselukertaa,1.59,/@infobellskannadarhymes
dcS5W-J01Hw,Diana and Roma Vending Machine Kids Toy Story,103 662 641 katselukertaa,7.57,/@KidsDianaShow
ibyq-P4fCp4,Chitti Aduttidane Doctor Doctor - Playing with Toys | Kannada Rhymes & Kids Cartoons | Infobells,55 908 940 katselukertaa,5.27,/@infobellskannadarhymes
c1fdZ_FGJe0,Mata - Szafir,48 650 854 katselukertaa,3.22,/@sbm_label
