Video Id,Title,View Count,Length,Channel
AkuAtmNa3CI,Scam Spotter 2022: Office Bonuses,70 341 451 katselukertaa,0.16,/@FightCybercrimeCSN
RxmuO85xwtY,Best of Bluey Bonus Bits! | 20 MINUTES | Bluey,15 548 239 katselukertaa,19.54,/@BlueyOfficialChannel
ad4R0Q6rTAw,"Priceless reaction. $500,000 in Christmas bonuses. | Gorilla Pro Custom #shorts #thebrick #custom",10 122 632 katselukertaa,0.51,/@gorillaprocustoms
HII_R4Y8ToM,Fortnite: ALL 38 emotes and dances [No bonuses] + Their real life original references,7 584 038 katselukertaa,10.20,/@LFPGaming
pn548uALuYw,The Ex-Banker on Cocaine Binges & £600k Bonuses | Informer,5 147 263 katselukertaa,6.30,/@VICE
KCwBAcnLpuk,Explore the Phemex Universe to win trading bonuses and NFTs,3 773 007 katselukertaa,0.50,/@Phemex
Vz2xhAL5_o0,Scam Spotter: Office Bonuses,3 462 073 katselukertaa,0.16,/@FightCybercrimeCSN
1fAu985eUPo,"Incredibox | All Secret Bonuses (Remastered) | Original, V2, V3, V4, V5, V6 | El Cazador",2 146 930 katselukertaa,19.19,/@Cazador1
DlW-LkIrfBg,Incredibox v6 All bonuses and combos + lyrics,1 502 648 katselukertaa,4.36,/@artemiykopych
kHS4syKyw2E,Enjoy Amazing Bonuses on 9KONFAM - 9mobile,1 411 459 katselukertaa,0.16,/@9mobileng
ypM4W4dHBUY,TOP 10 CRAZY SHOTS & BONUSES | Northern Ireland Snooker 2019,1 166 282 katselukertaa,6.15,/@SnookerPlanet
ujsadzWWbfA,Top 10 Video Game Completion Bonuses,1 128 296 katselukertaa,9.45,/@WatchMojo
4pWJ6J4KXRI,Games With Weird Pre-Order Bonuses,1 043 925 katselukertaa,0.47,/@CircleToonsHD
cm7sA54B450,10 DUMBEST Pre-Order Bonuses VIDEO GAMES Tried To Give You | Chaos,1 043 394 katselukertaa,10.50,/@ChaosGaming
AWdGqVhjkmg,Shoe Seller Humiliates POOR MAN | Dhar Mann Bonus Videos,944 684 katselukertaa,6.12,/@DharMannStudios
bpGxtg0Abnc,Batman: Arkham Knight - All Batman Skins & Pre-Order Bonuses,915 972 katselukertaa,8.46,/@BatmanArkhamVideos
caT8zxKXTqE,"FULL Armor Guide TotK - All 136 Armor Pieces, Set Bonuses, Upgrade Costs & More Tears of the Kingdom",894 110 katselukertaa,23.55,/@AustinJohnPlays
tP2Q8g3Y77M,RACIST MOM Calls Cops On NEIGHBORS | Dhar Mann Bonus Videos,771 983 katselukertaa,8.44,/@DharMannStudios
9Q2KEaXekbw,Wife CAUGHT CHEATING Red-Handed | Dhar Mann Bonus Videos,766 638 katselukertaa,7.45,/@DharMannStudios
fKIclu5VrbQ,$250 Max Bet NON STOP BONUSES On Lightning Link 🔴High Limit Live Casino Play From Las Vegas,738 759 katselukertaa,1.52.33,/@NGSlot
