Video Id,Title,View Count,Length,Channel
S7Rjw-ZzzdA,The Most Perfect Country in Africa | Botswana,522 599 katselukertaa,19.45,/@TayoAinaFilms
VslKKgYvVKU,Botswana: How to Make a Country Rich (From Scratch),2 046 087 katselukertaa,6.24,/@BritMonkey
5ghdo7bu8Kc,Botswana's Luxurious Safari Camps In The Middle Of Nature | World Class Compilation,11 091 katselukertaa,45.58,/@TRACKSTravelDocs
9rz91N8kmKw,Botswana & Okavango Delta 4K - Scenic Wildlife Film With African Music,1 694 064 katselukertaa,1.00.54,/@ScenicRelaxationFilms
aAJvY9QkVRY,From Rags to Riches: Unveiling Botswana's Economic Triumph | Botswana Economy | Econ,89 912 katselukertaa,11.12,/@econYT
HXSHzfrc5ZY,BOTSWANA TRAVEL DOCUMENTARY | 4x4 Safari Road Trip feat. Victoria Falls,3 883 603 katselukertaa,38.25,/@LucasTJahn
ypuqEsW8h7Y,Amazing Quest: Stories from Botswana | Somewhere on Earth: Botswana | Free Documentary,218 871 katselukertaa,52.14,/@FreeDocumentary
LKoM5UYQxcs,"Botswana, Escaping Drought | Deadliest Journeys",1 104 978 katselukertaa,48.03,/@BestDoc
mD0l68P1Psw,The Other Side of Trophy Hunting in Botswana,3 231 katselukertaa,12.40,/@BloodOrigins
oLeNLOBzCnE,"BOTSWANA in the wet season EP2 - Central Kalahari, Makgadikgadi, Sitatunga",31 817 katselukertaa,50.51,/@OurLifeInAfrica
OETj9aTYO2Q,The Botswana Adventure Part 1 | Top Gear | BBC,19 625 901 katselukertaa,9.19,/@TopGear
FRlR-Yw6Pc0,How Botswana Plans on Getting Insanely Rich,794 960 katselukertaa,13.09,/@CasualScholar
RJkIdd5D8HA,Geography Now! Botswana,1 049 354 katselukertaa,11.12,/@GeographyNow
yYYZPJQ0OOA,Botswana You Never See - Gaborone 2023 HD,12 873 katselukertaa,13.20,/@botswanainsight3804
G1hlfJy_vMI,Camping in the Kalahari; Khutse Game Reserve in Botswana,97 987 katselukertaa,40.11,/@GetOutGO
5ovlpXpp-Ek,15 Best Places to Visit in Botswana | Travel Video | Travel Guide | SKY Travel,35 272 katselukertaa,3.14,/@Sky.Travel
eZvpa-V-JWw,BOTSWANA The Ultimate African Adventure Ep1.,756 991 katselukertaa,49.54,/@OverlandingEscape
-XD7dTLamV0,7 Amazing Facts About Botswana [Discover Botswana 2021],207 172 katselukertaa,5.39,/@topsightafrica8554
ESkA8260tJQ,Could Botswana be the Garden of Eden on Earth? | Subtitled Documentary,193 481 katselukertaa,25.35,/@BestDoc
r-Aeti5XKG8,The 22 Year Old Kenyan Dropout Building Botswana’s Biggest Farm,471 931 katselukertaa,13.20,/@TayoAinaFilms
