Video Id,Title,View Count,Length,Channel
XDWJXec-B_s,Branding 101: How To Build A Strategic Brand in 2023,72 450 katselukertaa,25.05,/@BrandMasterAcademy
sO4te2QNsHY,What Is Branding? 4 Minute Crash Course.,1 093 463 katselukertaa,3.49,/@thefutur
p6aF5ma7BiM,How Brands Use Design & Marketing to Control Your Mind,1 010 068 katselukertaa,40.26,/@Design.Theory
LGq0uVspNms,Alex Hormozi's Advice on Branding in 2023,436 846 katselukertaa,1.01.36,/@mozimediaofficial
4eIDBV4Mpek,How Apple and Nike have branded your brain | Your Brain on Money | Big Think,3 069 483 katselukertaa,5.35,/@bigthink
BPK_qzeH_yk,Seth Godin - Everything You (probably) DON'T Know about Marketing,2 205 283 katselukertaa,46.35,/@BehindtheBrand
QuQVpNuRmd4,Full Course - Branding from Scratch,11 106 katselukertaa,1.17.10,/@Kayla-app
s2eka_dWAxs,"10,000 years of branding explained in 6 minutes | Debbie Millman",122 703 katselukertaa,6.02,/@bigthink
yOwxrJZ1VnI,"Sales Evolution: AI, Marketing, & Branding",34 katselukertaa,1.02.02,/@whiskeywinsday
z_YNMsS6NLk,How to brand anything | Youri Sawerschel | TEDxEHLLausanne,23 416 katselukertaa,10.40,/@TEDx
dpZfNNYUZEc,What is Branding? A deep dive with Marty Neumeier,456 576 katselukertaa,1.22.49,/@thefutur
ozMCb0wOnMU,"5 Steps to Building a Personal Brand You Feel Good About | The Way We Work, a TED series",119 648 katselukertaa,6.15,/@TED
On2K52lcM3c,Branding Like A Boss (10 Best Brand Strategy Examples),88 187 katselukertaa,21.59,/@BrandMasterAcademy
wr9INQEZlsI,Designing a Brand Identity from Scratch!,100 450 katselukertaa,12.51,/@abiconnick
NNs705zTuzA,Creating a Brand Identity: From Start to Finish,343 076 katselukertaa,16.42,/@abiconnick
yK7Rk7Oe588,What Is The Difference Between Branding & Marketing? What's more important?,247 758 katselukertaa,37.02,/@thefutur
DNZ5mPGW93Q,"VIRGIL ABLOH - CREATIVE ADVICE, BRAND BUILDING, AND TOXIC PERFECTIONISM",290 023 katselukertaa,14.17,/@creativemindsyoutube
hcr3MshYe3g,Powerful Personal Branding | Ann Bastianelli | TEDxWabashCollege,478 875 katselukertaa,22.23,/@TEDx
VrwBu8DYWkE,Learn Brand Strategy In 17 Minutes (2023 Crash Course),225 681 katselukertaa,17.01,/@BrandMasterAcademy
HXQStYuhi8k,The Future Of Branding & Brand Strategy (w/ Marty Neumeier),73 296 katselukertaa,53.06,/@BrandMasterAcademy
