Video Id,Title,View Count,Length,Channel
n6wFGU2nrKk,Breakers Conference LIVE,27 082 katselukertaa,8.09.15,/@MikeSignorelli_
zCdA2eJa-6c,MORE EVIDENCE FOR ANDROIDS RAIDER FOR SEASON 4?! - Dragon Ball The Breakers,2 116 katselukertaa,12.55,/@ironcane
XLQhKc7XD4E,LETS GET OUR SHOP FRONT OPEN TO THE PUBLIC | WHAT A LOAD OF SCRAP - EP69,11 163 katselukertaa,40.16,/@BCB
cy2NUcUgCys,Android 18 is a Top Tier Transphere in | Dragon Ball The Breakers | Season 3,5 595 katselukertaa,22.20,/@StrayStream
BS9duq081tM,Most CRUEL Ankle Breakers in NBA,412 772 katselukertaa,9.21,/@GoldenHoopsProduction
5jkaI1aDzds,BEST MULTI-PURPOSE ACTIVE SKILL IN THE GAME?! Dragon Ball The Breakers Season 3 Fake Death Showcase,1 568 katselukertaa,27.30,/@ironcane
ph7xGnzCM8Q,The BEST Ankle Breakers & Crossovers Of 2021!! (It's WILD),956 107 katselukertaa,13.48,/@ballislife
7GxMmEMSjTg,GAME BREAKERS - Dota 2 Short Film Contest 2023,4 785 katselukertaa,1.30,/@Anomidae
SNBfppriDjc,Circuit Breaker Explained | Working Principle,59 527 katselukertaa,7.54,/@realpars
F8cOAJaRdBI,Blind Fold Gaming First Attempt | Dragon Ball The Breakers,485 katselukertaa,7.01,/@CraicTical
zf5_FYV-m6Q,Top 100 ANKLE BREAKERS OF ALL TIME!! (Absolute INSANITY),492 394 katselukertaa,15.03,/@ballislife
7SVC4m29J2Q,Breakers Revenge: All Supers,22 792 katselukertaa,5.44,/@demonstrate1
ZBPV2r7VTgw,Circuit Breakers Explained,85 826 katselukertaa,15.00,/@eatonvideos
L1dFjloBZYo,"Local Natives - ""Breakers"" (Official Music Video)",1 855 982 katselukertaa,4.10,/channel/UC5JQlKSXQUDmixQY5upiADQ
QKLsaVxSHLk,Three Idiots Play DRAGON BALL: THE BREAKERS 🔥 (CRAZY MATCH),795 581 katselukertaa,23.20,/@SeeReax
obajy4mMmJk,"Testing The World's BEST GLASS BREAKERS (GTFO, RESQME, ATOMIC BEAR)",1 145 katselukertaa,14.03,/@Battlbox
g6diopPqzTg,A Closer Look: The Breakers Newport’s Gilded Age Mansion | Cultured Elegance,29 544 katselukertaa,8.43,/@CulturedElegance
v13IBsp0J2c,"Touring The Breakers Mansion, Newport, Rhode Island",184 610 katselukertaa,8.59,/@PierreRepooc
Q-GxeWnHQkw,This DBZ Game Is NOT Balanced,195 511 katselukertaa,16.19,/@DotoDoya
