Video Id,Title,View Count,Length,Channel
_I_D_8Z4sJE,Nicky Jam x J. Balvin - X (EQUIS) | Video Oficial | Prod. Afro Bros & Jeon,2 182 061 704 katselukertaa,3.12,/channel/UCpb_iJuhFe8V6rQdbNqfAlQ
f6vY6tYvKGA,"Cham Cham Full Video | BAAGHI | Tiger Shroff, Shraddha Kapoor| Meet Bros, Monali Thakur| Sabbir Khan",1 171 446 477 katselukertaa,3.52,/@tseries
zpsVpnvFfZQ,"'Chittiyaan Kalaiyaan' FULL VIDEO SONG | Roy | Meet Bros Anjjan, Kanika Kapoor | T-SERIES",762 913 700 katselukertaa,3.07,/@tseries
1--qqQrimMA,Dil Galti Kar Baitha Hai | Meet Bros Ft. Jubin Nautiyal | Mouni Roy | Manoj M | Ashish P | Bhushan K,570 074 560 katselukertaa,5.01,/@tseries
FQS7i2z1CoA,Main Tera Boyfriend Song | Raabta | Arijit S | Neha K Meet Bros | Sushant Singh Rajput Kriti Sanon,525 315 777 katselukertaa,3.09,/@tseries
Q21XkobMXLM,Pacman vs Super Mario - Super Mario Bros,448 167 458 katselukertaa,2.49,/@AntonioPalmucci
7lfFZs50JHM,"Kinna Sona Full Video | Marjaavaan | Sidharth M, Tara S | Meet Bros,Jubin N, Dhvani Bhanushali",417 585 855 katselukertaa,4.30,/@tseries
zing4uQ3dR4,"Ik Mulaqaat - Dream Girl | Ayushmann Khurrana, Nushrat Bharucha | Meet Bros Ft. Altamash F & Palak M",337 000 579 katselukertaa,2.37,/@zeemusiccompany
JVUQDE8vLxw,"Mujhe Kaise, Pata Na Chala | Meet Bros Ft. Papon | Manjul | Rits Badiani | Kumaar | Love Song",234 555 984 katselukertaa,4.47,/@MBMusicOfficial
P-z3aLhp9w4,"Aawara Shaam Hai | Meet Bros Ft. Piyush Mehroliyaa | Manjul, Rits Badiani, Shabbir | Hit Song",220 860 381 katselukertaa,5.32,/@MBMusicOfficial
N_KpjLhJa1k,HIGH HEELS TE NACHCHE Video Song | KI & KA | Meet Bros ft. Jaz Dhami | Yo Yo Honey Singh | T-Series,209 878 253 katselukertaa,2.57,/@tseries
4dF1uxUTYZI,Nachan Farrate VIDEO Song ft. Sonakshi Sinha | All Is Well | Meet Bros | Kanika Kapoor,183 753 163 katselukertaa,2.44,/@tseries
u1NlmFa0-68,Wonder Woman 1984 | Young Diana Takes on The Amazon Games | Warner Bros. Entertainment,169 838 616 katselukertaa,7.50,/@warnerbrosentertainment
yP9KiFTyBks,Baby Doll Full Video Song Ragini MMS 2 | Sunny Leone | Meet Bros Anjjan Feat. Kanika Kapoor,168 788 175 katselukertaa,3.22,/@tseries
sYeBnmwiWzA,"'Chittiyaan Kalaiyaan' VIDEO SONG | Roy | Meet Bros Anjjan, Kanika Kapoor | T-SERIES",155 248 224 katselukertaa,2.15,/@tseries
1gqBb4Y7LJA,"Hangover Full Video Song | Kick | Salman Khan, Jacqueline Fernandez | Meet Bros Anjjan",152 611 483 katselukertaa,5.06,/@tseries
cijXcKxluZ8,Super Mario CAT Bros.,152 241 857 katselukertaa,3.10,/@MrTVCow
R7spJ7YjNOY,"LUV LETTER VIDEO SONG | The Legend of Michael Mishra | MEET BROS,KANIKA KAPOOR | T-Series",150 318 227 katselukertaa,3.19,/@tseries
kShTN0Jz6Jg,"""Baby Doll"" Ragini MMS 2 Sunny Leone Song | Meet Bros Anjjan Feat. Kanika Kapoor",138 053 681 katselukertaa,2.24,/@tseries
vf-XIsSWiGA,"Baithe Baithe - Mouni Roy, Angad | Meet Bros ft Stebin Ben, Danish, Aishwarya| Zee Music Originals",129 682 812 katselukertaa,4.48,/@zeemusiccompany
