Video Id,Title,View Count,Length,Channel
x76VEPXYaI0,GoPro: Backflip Over 72ft Canyon - Kelly McGarry Red Bull Rampage 2013,223Â 793Â 408 katselukertaa,2.04,/@GoPro
KZKIiiSfn_0,"MINECRAFT SKELETON RAP REMIX | ""I've Got A Bone"" | Oxygen Beats Dan Bull Animated Music Video",176Â 396Â 955 katselukertaa,4.28,/channel/UC1hkAIJnb2CSmm7SPJaPR-A
XnitQYkYYcw,Damn Nature You Scary | Funny Scary Animal Encounters,171Â 830Â 151 katselukertaa,8.52,/@failarmy
wlcDkOpkK_E,Stories for Kids | The Mouse and the Bull | Infobells,160Â 757Â 736 katselukertaa,2.27,/@Infobellsrhymes
J3pYoolbMMo,Nicholi Rogatkin goes full send with a 1440 at Red Bull District Ride 2017,152Â 135Â 972 katselukertaa,1.56,/@RedBullBike
E9oKEJ1pXPw,Jumping From Space! - Red Bull Space Dive - BBC,140Â 947Â 240 katselukertaa,4.17,/@BBCStudios
e3BHJtaLzEM,The Biggest *SAVE* In Red Bull Flugtag History,138Â 368Â 323 katselukertaa,0.08,/@redbull
IwnL7lPm9No,You're Actually Meant To Stay WITH The Plane...,125Â 955Â 931 katselukertaa,0.24,/@redbull
nysT0OGxczY,A Human Size Sligshot Red Bull Flugtag Flying Machine,118Â 294Â 843 katselukertaa,0.13,/@redbull
ZZujisNZuw0,MINECRAFT CREEPER RAP | Dan Bull | ENDING A,115Â 405Â 009 katselukertaa,2.38,/channel/UC1hkAIJnb2CSmm7SPJaPR-A
FNif88NEn4w,ASSASSINS CREED UNITY RAP | ZARCORT Y DAN BULL,88Â 954Â 138 katselukertaa,3.56,/channel/UCE3qZH8ltYwmQDmm5uinPXw
2W0vHcJtXBY,this is bull ğŸ¥: aarongrande10 (IG) #shorts,87Â 694Â 507 katselukertaa,0.12,/@dustymdouglas
bT3ZeNHYUzE,Bull and a Human - By dairygoatmother (tt),87Â 218Â 889 katselukertaa,0.09,/@TheGlobalAnimalsWorld
mwm0OwqWvF4,Meet 'Hulk': The Giant 175lb Family Pit Bull | DOG DYNASTY,83Â 306Â 835 katselukertaa,5.06,/@truly-channel
530z-_yjdlU,Michael Jordan last 3 minutes in his FINAL BULLS GAME vs Jazz (1998),82Â 781Â 244 katselukertaa,13.45,/@pennyccw
vZG_s7eHrGc,MINECRAFT ENDERMAN RAP | DAN BULL VERSION,80Â 000Â 650 katselukertaa,3.56,/channel/UC1hkAIJnb2CSmm7SPJaPR-A
3L4YrGaR8E4,Rage Against The Machine - Bulls On Parade (Official HD Video),77Â 035Â 116 katselukertaa,3.54,/channel/UCm_W_hbwbzJE8w52jZ2NO0A
WumCI56iYUk,Pierce The Veil - Bulls in the Bronx,62Â 938Â 140 katselukertaa,4.49,/channel/UCyipvkWkNpmEQPGovalDjFA
qWIIZVHTjB8,SON  TOROS DIFICIL DE QUEDARLES!! Los Destructores de Memo Ocampo por primera vez en michigan,62Â 116Â 342 katselukertaa,19.30,/@guerrerodeljaripeo
SRyC_jh1hIg,How Would You Rate These Attempts? ğŸ“ˆâœˆï¸,61Â 618Â 528 katselukertaa,0.59,/@redbull
