Video Id,Title,View Count,Length,Channel
9bqk6ZUsKyA,I Spent 50 Hours Buried Alive,295 572 943 katselukertaa,12.40,/@MrBeast
c20QogTo9cQ,Almost buried in 900kg OF ICE,224 203 575 katselukertaa,0.16,/@xRaFFniX
yGqP54lv9q4,One Wedding and a Funeral | Funny Clip | Classic Mr Bean,129 231 654 katselukertaa,15.12,/@ClassicMrBean
UQ13nr6urIo,"Yogi & Skrillex - Burial (feat. Pusha T, Moody Good, TrollPhace) [Official Video]",64 600 530 katselukertaa,3.59,/channel/UC_TVqp_SyG6j5hG-xVRy95A
R0ykLlhg0AQ,Drake - Money In The Grave ft. Rick Ross,59 468 768 katselukertaa,4.18,/channel/UCByOQJjav0CUDwxCk-jVNRQ
Q7U7O7nbuHk,"PiRATE BEACH we buried ADLEY!! new lake surprises, making sand castles, and bedtime routine reviews!",27 247 399 katselukertaa,23.05,/@Shonduras
Ao8FIszjKZg,Band of Horses - The Funeral (lyrics in description),18 085 138 katselukertaa,5.23,/@Onewecallgod
hUNAX1UYeAE,AFTER THE BURIAL - Lost In The Static (Stream),12 186 114 katselukertaa,4.32,/@SumerianRecords
O6zoSDNtF1A,The City Of Free Funerals! #332,10 559 974 katselukertaa,0.59,/@NasDaily
TRw2dpIwnrg,Bradford Finds Lucy's Burial Site - The Rookie,10 445 928 katselukertaa,2.14,/@ABCNetwork
ZOhIdaufd3Q,The Burial - Official Trailer | Prime Video,10 136 304 katselukertaa,2.47,/@PrimeVideo
foQpxSJE_BE,Why Osama bin Laden Was Buried at Sea,9 489 291 katselukertaa,0.50,/@TheMilitaryShow
Oc-wS-qG0_A,LIVING A WEEK with the DEATH TRIBE of Indonesia,7 472 682 katselukertaa,26.42,/@fearlessandfar
vy1o1DfWuU4,"SHOCKING: Dead man rises from funeral pyre, people scared",6 953 579 katselukertaa,0.48,/@SouthAsianTelevision
CZKIuyNHud4,The priceless Bugatti that was buried! #shorts,6 405 657 katselukertaa,0.58,/@LaunchMode123
_G8qU7MyfGQ,What Happens When US Navy Sailors Have A Burial in the Middle Of The Sea,5 181 053 katselukertaa,8.12,/@navyproductions
qxmRcGT3MQg,"Burial (feat. Pusha T, Moody Good, TrollPhace)",5 017 476 katselukertaa,3.47,/channel/UCMJs2mqNboYFEpSTSW4B4Wg
lNl4A7yNK0Q,Queen Elizabeth II Funeral: royal family say final goodbye,4 943 133 katselukertaa,25.17,/@Channel4News
RLSKS9ORWdE,THE MOMENTS YOUR SOUL ENTERS THE GRAVE,4 753 227 katselukertaa,5.20,/@iLovUAllah
nP7QyfLPtLE,AFTER THE BURIAL - A Wolf Amongst Ravens,4 693 282 katselukertaa,5.09,/@SumerianRecords
