Video Id,Title,View Count,Length,Channel
oLnd4G7dsHg,Wheels On The Bus (School Version) | CoComelon Nursery Rhymes & Kids Songs,834 683 944 katselukertaa,2.59,/channel/UCbCmjCuTUZos6Inko4u57UQ
dUaCEs3HfdI,Aastha Gill - Buzz feat Badshah | Priyank Sharma | Official Music Video,436 473 573 katselukertaa,3.01,/@SonyMusicIndia
Jyst8oIHOAY,Mercy - Badshah Feat. Lauren Gottlieb | Official Music Video | Latest Hit Song 2017,408 176 899 katselukertaa,2.57,/@SonyMusicIndia
Oi8q1zIGph0,"Naagin - Vayu, Aastha Gill, AKASA, Puri | Official Music Video 2019",391 572 168 katselukertaa,2.44,/@SonyMusicIndia
e_vl5aFXB4Q,"Full Video: Akh Lad Jaave | Loveyatri | Aayush S|Warina H |Badshah, Tanishk Bagchi,Jubin N, ,Asees K",234 128 051 katselukertaa,3.01,/@tseries
6lHjesO3cFA,Toy Story Toons: Extra Small,171 620 747 katselukertaa,7.02,/@disneyla
bWUgZm_AE64,The Bees Go Buzzing | Kids Songs | Super Simple Songs,166 714 871 katselukertaa,4.43,/@SuperSimpleSongs
U0Btvigtd2w,Aastha Gill - Saara India | Priyank Sharma | Mixsingh | Arvindr Khaira | Nikk,119 015 742 katselukertaa,2.50,/@SonyMusicIndia
NbCFG7ywnHg,Buzz - Lyrics Video | Aastha Gill feat Badshah & Priyank Sharma,117 048 180 katselukertaa,3.02,/@sonymusicindiaVEVO
lKf6uyrtz0o,Giant Toy Story Toys Collection with Buzz Lightyear Sheriff Woody and Mcdonalds Power Rangers,85 481 298 katselukertaa,6.43,/@showandtelltoys
0i5d2oBCYE4,"Toy Story 3 ESPAÑOL PELICULA COMPLETA del juego Amigo Fiel Jessie,Buzz,Woody - Juegos De Pelicula",70 759 135 katselukertaa,2.37.11,/@mymoviegames-juegosdepelic8989
8D0tRQgQY6o,Elsa vs Buzz Lightyear,63 928 232 katselukertaa,1.55,/@jjkmovies
dMyxAQw2gxY,Toy Story 4 Benson Dummy Turned ME Into A Dummy!,62 225 543 katselukertaa,10.08,/@TheFunSquad
y1KHUICxEqc,Box filled with Toy Story Collection for Kids,58 178 779 katselukertaa,10.42,/@Kidibli
X2RycRmM56U,Da Buzz - Wonder Where You Are (Anton Ishutin Remix),52 433 560 katselukertaa,6.37,/@musicTapOfficial
0_CksCHnooM,Eric Church - Round Here Buzz (Official Music Video),44 068 933 katselukertaa,4.36,/channel/UCO83-v8Iqb9yN2RnyBrZkwQ
AITFlO6rKOk,Disney Pixar CARS meet TOY STORY Lightning McQueen Buzz Lightyear & Woody ANIMATION SHORT,40 266 466 katselukertaa,19.46,/@carstoysmovies
Bdi_p0gZGkU,Buzz buzz buzz Mosquito Song | Kids Song | for babies,36 710 627 katselukertaa,6.50,/@pandobibaby
KrZx4BhwA5U,Toy Story GIANT Surprise Egg Opening! Unboxing Buzz Lightyear & Woody Toys | Kiddyzuzaa,32 901 344 katselukertaa,10.05,/@kiddyzuzaa
150zHOYJDb0,Buzz,32 821 758 katselukertaa,3.14,/channel/UCmAmPrwXCnxxROncOJDWyzw
