Video Id,Title,View Count,Length,Channel
KmM6DOy0aMc,STOP overbuilding cabinets,512 201 katselukertaa,15.13,/@bentswoodworking
Vey9ZclCFMI,"So you want to build cabinets, eh?",170 990 katselukertaa,15.36,/@MWAWoodworks
AZ0jP2g-znI,Nepotism Alarm in Zimbabwe: Mnangagwa Appoints Son & Nephew to Cabinet | Vantage with Palki Sharma,53 275 katselukertaa,5.56,/@Firstpost
4Xh3dmfrrd8,STOP struggling to get level cabinets,353 995 katselukertaa,10.06,/@bentswoodworking
7KkvrgMk8Us,How to Build Cabinets,2 301 751 katselukertaa,19.13,/@MWAWoodworks
SMQVklOfig4,How to Build Wall Cabinets,390 152 katselukertaa,13.36,/@MWAWoodworks
89WeF52XwcI,Build Cabinets The Easy Way | How to Build Cabinets,3 370 143 katselukertaa,20.57,/@Bourbonmoth
5ibjNx9wbMc,The New Cabinets Are Here!!! | RENOVATING OUR 2008 SINGLEWIDE MOBILE HOME {DEBT FREE},89 977 katselukertaa,48.05,/@IAGFARMS
XtfoThdGU2w,I can't believe building custom cabinets was this easy,291 412 katselukertaa,11.18,/@MWAWoodworks
j-VEsdM1rdw,How to Build Basic Cabinets--Using ONLY PLYWOOD!,1 083 175 katselukertaa,20.00,/@WoodshopDiaries
Lqz-I8Ue4AI,How to Build Cabinets in under 30mins //The Easy Way,1 048 184 katselukertaa,24.21,/@eastcarolinawoodworks
i8jcNQ0FzWQ,DIY Wall Cabinets with 5 Storage Options | Shop Organization,961 530 katselukertaa,10.15,/@Fixthisbuildthat
XthRuvmIHTY,How To Install Kitchen Cabinets: The Ultimate DIY Guide,240 305 katselukertaa,37.10,/@TheExcellentLaborer
iDRTzhcCRHQ,11 Tricks For Perfect Kitchen Cabinets,278 301 katselukertaa,34.21,/@HomeRenoVisionDIY
c6TtSt0Hyw8,The Hardest Cabinets I've Ever Built || Vintage Airstream Remodel,178 695 katselukertaa,27.31,/@Bourbonmoth
xrBPsnsvPhc,Build Cabinets The Easy Way || Natural Wood Cabinets,602 500 katselukertaa,35.16,/@Bourbonmoth
BTzA3_qP2vM,Corner Cabinet Magic: 6 Genius Solutions | IKEA Kitchen Planner,313 517 katselukertaa,21.11,/@MTKDofficial
67WLsVJ0TXQ,How To Build Kitchen Cabinets The Easy Way,39 656 katselukertaa,9.49,/@JonnyBuilds
3N_T-YpkBCg,Cabinetry Basics Part 1 [video 435],1 515 990 katselukertaa,8.20,/@10MinuteWorkshop
7cRZJ6P4grQ,How to Build a Base Cabinet with Drawers | DIY Shop Storage,1 035 599 katselukertaa,9.44,/@Fixthisbuildthat
