Video Id,Title,View Count,Length,Channel
9Ga9dP3bvN8,How To Calculate In Chess,2 879 813 katselukertaa,32.02,/@GothamChess
AL0-0f9azNo,Finding a Percent of a Number | Calculating Percentages,1 705 238 katselukertaa,6.27,/@MathwithMrJ
BCmQN6nZz14,THE DILLINGER ESCAPE PLAN -  'Calculating Infinity' (Full Album Stream),284 160 katselukertaa,37.32,/@relapserecords
DNCzcxZs_pc,How I learned to Calculate Extremely Fast,2 305 920 katselukertaa,5.18,/@MikeShake
X_ZJc9_n7TY,How to Calculate Faster than a Calculator - Mental Maths #1,4 142 598 katselukertaa,5.42,/@mathOgenius
PjJWi18dqYE,How to Calculate Percentages: 5 Easy Methods,1 002 242 katselukertaa,12.11,/@BRIGHTSIDEOFFICIAL
l9c9j5KOv28,Calculations,3 986 935 katselukertaa,3.34,/channel/UC4gE0O_SyPb1cuRNzT_NMqQ
xXJiWukbjB0,Hikaru Calculating Vs Levy Calculating..... 😂,1 218 626 katselukertaa,1.32,/@Chess-Chad
9Jcxc-ddWKI,Calculate your pet's HP with my 100% legitimate formula | Unraveled,4 056 219 katselukertaa,15.18,/@polygon
uCoCy-2HEtc,CALCULATIONS - Arjan Dhillon (NEW SONG)Official Video Saroor New Album | New Punjabi Songs 2023,397 455 katselukertaa,4.50,/channel/UCrD2hPARNUKSCxnpik0NwWw
FSXCgSKae9g,How did hikaru calculate this?,2 994 914 katselukertaa,0.27,/@chesspalaceYT
Hs0wjbxvCt0,How to Calculate Faster than a Calculator - Mental Maths #2| Addition and Subtraction,2 004 598 katselukertaa,8.00,/@mathOgenius
Co72nQwPzSg,Calculating Scourge's Unbelievably High Kill Count,622 908 katselukertaa,8.55,/@Theorymus
AN4gqEqIXm0,The BEST Way To Calculate in Chess,436 857 katselukertaa,22.58,/@AnnaCramling
fdEcZqJQoaA,Math tricks for fast calculation,2 205 348 katselukertaa,7.58,/@tecmath
og9bDI2XJfA,How to Calculate a Discount without a Calculator | Calculating Discounts by Hand | Math with Mr. J,97 656 katselukertaa,7.48,/@MathwithMrJ
EKoI1hYbpA4,How to Calculate ANY Fraction Easily!,374 515 katselukertaa,12.29,/@tecmath
i3D7XYQExt0,Calculating a Car Crash - Numberphile,405 947 katselukertaa,8.25,/@numberphile
5nZEUpZX_P0,Math Antics - Calculating Percent Change,583 053 katselukertaa,12.51,/@mathantics
F-THPY14fzc,Impossible Challenge: Teenagers mentally calculate 100 3-digit numbers in seconds,2 637 382 katselukertaa,4.20,/@cgtn
