Video Id,Title,View Count,Length,Channel
cnTRLCqNhrk,Nines - Calendar (Official Video),2 063 221 katselukertaa,3.21,/channel/UCvDkzrj8ZPlBqRd6fIxdhTw
p_70V0kVDjI,Why Do Some Countries Use Different Calendars?,183 027 katselukertaa,13.04,/@General.Knowledge
OaYMK2n9Aow,A brief History of the Calendar and Time Keeping,180 178 katselukertaa,58.19,/@SchoolofBusinessandEconomics
QFsUE3uccvY,The WORST 4-Star Advent Calendar Mystery Box,1 364 852 katselukertaa,22.41,/@nerdecrafter
REvKJmvuAEc,Calendars Around the World,294 355 katselukertaa,14.13,/@WonderWhy
Frd8oxyxz6o,SPACE NK ADVENT CALENDAR UNBOXING 2023,3 306 katselukertaa,25.23,/@RandomLifestyleVlog
ENPEEB8P0BI,REVEALING YESSTYLE'S 2023 ADVENT CALENDAR : WINTER BEAUTYLAND ❄️,14 719 katselukertaa,19.50,/@j.uuuuudy
kzprsR2SvrQ,A Short History of the Modern Calendar,532 672 katselukertaa,3.55,/@jeremiahjw
D8ZQTsbJ55w,Calendars for Kids | Helping Kids Learn Months and Days (without getting bored),281 545 katselukertaa,5.00,/@LearnBright
sI4C301xsJE,A Strange History of the Calendar,105 918 katselukertaa,10.53,/@Answerarchive
zOhfsdYJ0aI,Nines - Calendar (Official Audio),104 431 katselukertaa,3.15,/channel/UCvDkzrj8ZPlBqRd6fIxdhTw
7dIGU2w-sRg,Ditch Google Calendar and Use These Apps Instead,194 193 katselukertaa,10.15,/@mariana-vieira
6o2tm00Ar8A,How I Manage My Time - The Trident Calendar System,2 205 185 katselukertaa,19.02,/@aliabdaal
V4DuyG7WcSM,"""Calendars"" - A New Mac App Lands!",40 667 katselukertaa,5.40,/@keepproductive
Ip992FqPZFI,Top 8 Calendar Apps 2022,154 508 katselukertaa,7.30,/@keepproductive
SV5g-sZOKIQ,How Was The Calendar Invented?,318 275 katselukertaa,3.29,/@Seeker
AbaXTKoM0RA,I Made a BETTER Calendar,1 272 088 katselukertaa,9.31,/@OatsJenkins
ODXV-fb_c-I,How to Organize Your Calendar - The Ultimate Guide,773 467 katselukertaa,13.24,/@Thomasfrank
1XlOQdYcLFk,SPACE NK 2023 ADVENT CALENDAR UNBOXING,1 705 katselukertaa,40.13,/@PlanningwithCrystal
ILCRuXriKMU,Using a Calendar,139 664 katselukertaa,4.54,/@usatestprep
