Video Id,Title,View Count,Length,Channel
y0wXQ5EdW_0,"Relaxing SOLO Camping with Rain Forest Mountain views [ gloomy weather, cosy shelter, rain ASMR ]",8 336 619 katselukertaa,32.41,/@go4x4media
ISEM3C3chUg,Hot Tent Camping In A Snowstorm,9 645 472 katselukertaa,35.38,/@HikeCampClimb
S0EykVi_2e0,Camping On Abandoned Highway,346 391 katselukertaa,29.41,/@campingwithsteve
F4Zawl32vKc,Camp,1 224 361 katselukertaa,3.41,/channel/UCl-tyxErWS-1ElS8UM8jryQ
GpE37iwg-qI,I Went To Fat Camp,1 538 266 katselukertaa,19.56,/@WillTennyson
Rx11Ti_8Meo,Camping in HEAVY RAIN and THUNDERSTORMS | Tent and Tarp,22 616 katselukertaa,26.25,/@CampingwithSamBananas
4wM1QUELqe4,"Yksin camping rankkasade - kaatosade ja rentouttava , viihtyisä teltta , syö , ASMR",5 550 674 katselukertaa,34.44,/@yoyocamp
VGlYxtkZUXI,Cozy Campfire 🔥 Relaxing Fireplace Sounds 🔥 Burning Fireplace & Crackling Fire Sounds (NO MUSIC),2 584 078 katselukertaa,12.00.44,/@cattrumpet
3Dke2VlJ8Y8,SOLO Two Days WINTER BUSHCRAFT Camp - Shelter in Snowfall - Lavvu Poncho - Spoon Carving,36 770 923 katselukertaa,28.58,/@AsbjornOlsenBergBushcraft
fk2nkksxpwQ,Hot Tent Camping In Heavy Snowfall,8 262 155 katselukertaa,28.16,/@HikeCampClimb
YcyLsp-bhSM,Abandoned Train Bridge Urban Stealth Camp,246 katselukertaa,32.08,/@Hojangle
lM3Kx1VymgA,"SOLO Camping in the RAIN || RELAX, SLEEP and Eat in the JUNGLE || Rain ASMR",661 810 katselukertaa,1.09.08,/@go4x4media
uLc2eqRWzPk,Nikki Taylor - Here's Where I Stand (from CAMP),522 689 katselukertaa,5.31,/@CokeGlitter
U7xUWaMDF4Q,Building a Survival Shelter in a Forest - Camp food from natural herbs,18 706 709 katselukertaa,26.40,/@MrWildNature
9nBFKH3qhGE,"Campfire by the Lake Ambience with Crickets, Owls, Water, & Night Sounds for Relaxation & Sleep",1 247 928 katselukertaa,8.03.03,/@CalmedByNature
FRnCyRUH9y4,"7 Days SOLO SURVIVAL CAMPING In RAIN, THUNDER - Building Warm BUSHCRAFT SHELTER - Lamb Cooking",4 273 770 katselukertaa,1.08.01,/@BushcraftHakankarahan
wcDFgir_jgY,Dugout Shelter Under 10ft (3m) of Snow - Solo Camping in Survival Shelter During Snow Storm,24 657 016 katselukertaa,21.24,/@OutdoorBoys
hm2pZQRR4y4,La Estética de la Performance: El CAMP,80 192 katselukertaa,25.14,/@JWIBEL
gc5xyn6e_pE,SOLO Car Camping in RAIN - Cozy Relaxing with my Dog | Sleep in a tent,973 931 katselukertaa,31.42,/@go4x4media
Ez05xccmTbo,CAMPING in a Blizzard - Winter SNOWSTORM - Tent Camp in Heavy Snow,226 757 katselukertaa,55.53,/@AbelandVictoria
