Video Id,Title,View Count,Length,Channel
ZlxIEWygQYY,Diana Pretend Play with Princess Carriage Inflatable Toy,1 076 149 393 katselukertaa,7.59,/@KidsDianaShow
aCzIHKU97A8,Dynacraft 24v Disney Princess Carriage Ride-on Powerwheels with Cinderella and Rapunzel Doll,174 060 262 katselukertaa,5.15,/@toysmakemesmile
w6kdqn48bls,Princess Barbie Expandable Carriage Princess doll New Dresses Putri Barbie Gaun Vestidos Princesa,131 974 816 katselukertaa,12.47,/@FunFunMiniWorld
UhomKxo0xzg,Diana wants to be a Princess & Ride On Princess Carriage,99 168 824 katselukertaa,9.16,/@TheElenaYa
D1LdQlu6FGA,Diana Pretend Play with Princess carriage toy,97 435 869 katselukertaa,11.31,/@KidsDianaShow
qVCG5XNumo8,Gecko's Late Night Job｜Gecko's Garage｜Funny Cartoon For Kids｜Learning Videos For Toddlers,80 989 776 katselukertaa,30.24,/channel/UCZzfOkvfLKdKYEWAZ_Vc0zg
cy1R0rqSYt4,"Little Princesses 5 -The Mechanic, The Ride On Pink Disney Princess Carriage, and The Lesson",72 269 593 katselukertaa,7.05,/@star-light-kids
bzhM2zOtdEs,"Elsa & Anna Bloopers, Outtakes and Behind the Scenes - Fun with Princess Carriage Power Wheels!",67 157 968 katselukertaa,9.00,/@TwinFamilyFunVlogs
gI6jwYj3CPc,Vlad and Nikita play with Princess Carriage,50 281 786 katselukertaa,3.53,/@VladandNiki
oW5Zjyq_P48,The Twins get the Disney Princess Carriage Ride on,45 404 523 katselukertaa,19.09,/@SurpriseTubecom
8lzBP2xdvqE,Photobook Carriage Commercial | Dollar Car Rental,43 352 471 katselukertaa,0.16,/@DollarCarRentals
hyOf7N4FwmI,Wendy with Princess Carriage Inflatable Kids Toy,38 035 795 katselukertaa,5.02,/@toysandcolors
QTMvv8uCt9Y,Princess Carriage Play !,30 843 314 katselukertaa,10.27,/@ellitv2289
NFChhyTHnCw,Wendy Pretend Play with Inflatable Princess Carriage Toy,30 086 846 katselukertaa,9.45,/@toysandcolors
N2D-5CEP06w,Wendy Pretend Play w/ Princess Ride On Horse Carriage & Dress Up Kids Toy,25 792 955 katselukertaa,10.13,/@toysandcolors
S2U5wBo2jE0,Disney Princess Carriage  Ride On Toy Power Wheels Car at The Pirate Ship Playground Park for Kids,25 632 015 katselukertaa,16.48,/@FunFactoryYoutube
B6X44MD6YPE,Gecko Gets Sick! Mechanicals Take Over | Gecko's Garage | Trucks For Children | Cartoons For Kids,20 011 957 katselukertaa,30.29,/@GeckosGarage
RJGPqINyq20,Princess Carriage Ride Pretend Play with Wendy,18 488 793 katselukertaa,6.01,/@toysandcolors
pcSIJeLUUzw,Jack's Creepy Carriage Gets Spookling Clean | Carl's Car Wash | Halloween Special,17 383 384 katselukertaa,7.14,/@SuperSimpleTV
fN_9kkxPlzk,Princess Carriage with Dolls,16 209 964 katselukertaa,10.04,/@Kidibli
