Video Id,Title,View Count,Length,Channel
nMDZTi1rWpI,"Active Backup Suite: Centralized Data Protection, License Free",301 031 katselukertaa,1.42,/@synologyinc
EW6tQCPwxdI,NexAEI EmPal | Centralized Mobile-based Employee Attendance | Teaser,213 125 katselukertaa,0.19,/@nexaei1543
dYF85eyxVV0,CTE Form Factor Designed by Thermaltake - Centralized Thermal Efficiency,212 706 katselukertaa,0.55,/@Thermaltakereview
lfP8dx2TdEM,Rick and Morty single centralized galactic currency drops to zero,191 312 katselukertaa,1.02,/@johnleach
jviFsd4hhfE,Centralization vs Decentralization,170 659 katselukertaa,6.14,/@alexanderlyon
9llVrI-Bnzs,Centralized Authority Doubling Down Russel Brand Joe Rogan JRE Clips | #shorts #jre #joerogan,127 422 katselukertaa,0.59,/@storyfiend
pS7_bPCJSaI,🔴 Centralisation and Decentralisation | Organising | Class 12 Business studies | video 21,123 567 katselukertaa,13.48,/@UnacademyCAFoundationPro
9ybYhv_VFaE,Decentralization: Which Crypto's Aren't Centralized?! Let's Find Out!,122 748 katselukertaa,22.28,/@CoinBureau
jTysfcWpf2c,Thermaltake CTE C750 Series Chassis Product Animation - Centralized Thermal Efficiency,94 148 katselukertaa,2.05,/@Thermaltakereview
sbHJ4VwJlow,Ripple = WEF (Is XRP a Centralized Banker Coin?),87 389 katselukertaa,11.07,/@DiscoverCrypto_
RMxLpLFXoCo,iSecure CCTV Centralized Power Supply Implementation Tutorials,76 476 katselukertaa,4.11,/@isecurecctv
_yQlKEq-Ueg,Centralized vs Distributed Version Control in 90 seconds,75 638 katselukertaa,1.32,/@CodebeamerbyPTC
qYXQ1fLopno,Differences between Centralization and Decentralization.,67 783 katselukertaa,2.43,/@AcademicGainTutorials
a0noVY2dtqs,Centralisation And Decentralisation - Organising | Class 12 Business Studies (2022-23),59 759 katselukertaa,31.42,/@MagnetBrainsEducation
iQhkrYqA7S4,Spontaneous Order vs. Centralized Control,59 155 katselukertaa,10.34,/@academyofideas
1tnF4kdAnxk,Centralized Climate Control! Rimworld Mod Showcase,53 920 katselukertaa,7.45,/@BaRKy
NxzY6kKGbNY,Difference Between Centralization & Decentralization ? Urdu / Hindi,52 491 katselukertaa,3.31,/@ZPZEducation
MIRpHe_hLhI,[Cities: Skyline] Centralized City Timelapse,51 492 katselukertaa,5.23,/@Edax_Royeaux
D7tNIfi4LP8,Difference Between Centralisation and Decentralisation - Organising | Class 12 B Studies (2022-23),51 021 katselukertaa,7.24,/@MagnetBrainsEducation
Y3VG2m9uWs8,[EU4 MEME] Centralized VS Decentralized HRE USERS,43 097 katselukertaa,0.41,/@geouria
