Video Id,Title,View Count,Length,Channel
ewXLOSEeyKA,Mao Zedong - Chairman Mao Documentary,959 078 katselukertaa,1.07.07,/@PeopleProfiles
NwwV7YJfrsY,"Złomnik: Daewoo Chairman z FSO, i to w longu",335 300 katselukertaa,20.08,/@Zlomnik_official
UwUi9XKMQNI,'You're Not The Chairman Anymore!': Mike Johnson Loses It With Jerry Nadler,1 201 124 katselukertaa,25.01,/@ForbesBreakingNews
eQVnw-Agaic,Chairman Mao Explained In 25 Minutes | Best Mao Zedong Documentary,857 881 katselukertaa,30.56,/@TheLifeGuide
ZAG4-C034E0,"John Adams: ""The Chairman Dances"" mit Alan Gilbert | NDR Elbphilharmonie Orchester",22 742 katselukertaa,13.11,/@NDRKlassik
RiS0nxyfK-Q,"#137 LeChairman & Alban Ivanov parlent Comédie, Ali Saidi, Alcoolisme, Jamel, Social, Famille, 78..",138 660 katselukertaa,1.01.43,/@ouihustle
QA19NDIfXaQ,The Chairman Dances (Foxtrot for Orchestra),149 270 katselukertaa,12.32,/channel/UCHGpGKEPmN3AQCO7Iqx8_6g
cSJWCoZwvSc,"#153 LeChairman & Didi-stone parlent Mode, Koffi, Christianisme, Unicef, Kongo, Discriminations, 93.",162 391 katselukertaa,1.01.31,/@ouihustle
TJmLd8ucrfE,Chairman Mao,13 391 katselukertaa,4.24,/channel/UCphZOvc25w5fJGZ-HqnUggA
IyEadGANbgM,"Jamie Dimon, Chairman, President, and CEO of JPMorgan Chase",2 125 191 katselukertaa,57.19,/@stanfordgsb
LFfRVA88K8Y,Ssangyong Chairman  W Summit Luxury Sedan,97 695 katselukertaa,2.00,/@Tnkfree
ilOxZ8ilo3E,"#143 LeChairman & Juan Branco parlent Politique, Wikileaks, Hanouna, Social, Ousmane Sonko, Sénégal",377 435 katselukertaa,1.15.31,/@ouihustle
i9y2fYIgVaU,"#124 LeChairman & Omar Sy parlent Éducation, Famille, Tirailleurs Sénégalais, Jamel, Héritage, 78",325 896 katselukertaa,1.11.37,/@ouihustle
p2_IGQbid_8,Deep Intel From the Chairman of the Joint Chiefs of Staff,89 542 katselukertaa,2.30.15,/@WardCarroll
c7Dme8NWUlA,Young Thug - Chairman (Unreleased),23 556 katselukertaa,3.01,/@kelvisklevis8490
XqFN09NcJ0Q,"#151 LeChairman & Nawal Ben Ali parlent Journalisme, Tunisie, Géopolitique, Kaïs Saïed, Afrique...",36 394 katselukertaa,57.43,/@ouihustle
BUZB4Ossjmk,Chairman Of The Board - Nostalgia Critic,489 332 katselukertaa,13.22,/@ChannelAwesome
LRiHz94uw-4,Welcome and Chairman,21 996 katselukertaa,1.16.25,/@goyouthpodcast8242
