Video Id,Title,View Count,Length,Channel
2RuliP9dqKE,Central Cee - Chapters (Lyrics),1 283 458 katselukertaa,1.55,/channel/UCV_CsAy5CNBX_uwDQ7RMe1Q
bIdOAZ-B_bE,Twisted Frat Boy Hid his Disturbing Secrets in Plain Sight,628 058 katselukertaa,31.39,/@ThatChapter
rhxKSm8r46A,The Scariest Disappearances that are still a Mystery,657 606 katselukertaa,45.13,/@ThatChapter
3lTUAWOgoHs,Cercle Story - Chapter One (melodic mix),3 266 370 katselukertaa,45.21,/@Cercle
qgep6MDvRk8,Office Bully Planned Murderous Revenge After Losing Job | Robert Telles,884 347 katselukertaa,29.27,/@ThatChapter
y0CUC67T0pw,Chapters,1 402 018 katselukertaa,1.55,/channel/UCV_CsAy5CNBX_uwDQ7RMe1Q
Jq1Nq3ynVV0,Boruto Chapter 2 EARLY SPOILERS!!! SARADA???,4 005 katselukertaa,10.17,/@IAMDYNASTY
4Wdr7P8nlCA,"David Carpenter, Trailside Killer | That Chapter Podcast",73 997 katselukertaa,34.46,/@thatchapterpodcast
AKJYNlylDJU,Brett Young - Chapters (The Acoustic Sessions) ft. Gavin DeGraw,14 514 764 katselukertaa,4.24,/channel/UCqIcU8Cj4PeAoPYDciLsmRw
81sJ4ORvBZA,The Dark Web Tip that Led to a Ring of Evil in the Woods,726 328 katselukertaa,23.43,/@ThatChapter
vslITeVWCLo,Husband's Deadly Rage After Finding Her Secret Emails | Keith Reed,1 049 772 katselukertaa,22.36,/@ThatChapter
TNMGVm8wT30,Investigator Tricks Elusive Monster Into Confessing | Rebekah Gould,867 039 katselukertaa,29.02,/@ThatChapter
nBURPuvSJwI,She was TRICKED Into Committing Crime that Shook the World | Kim Jong-Nam,913 495 katselukertaa,34.47,/@ThatChapter
jEna16oX-Vg,Camping Trip Takes Dark Turn When Husband Vanishes,744 666 katselukertaa,22.00,/@ThatChapter
wMshDRtvprM,David Fuller Hid In Plain Sight Committing Unspeakable Acts,844 523 katselukertaa,24.09,/@ThatChapter
c76WS9AGVYI,This Man Sold the World's Most TERRIFYING Secrets | Robert Hanssen,1 039 180 katselukertaa,1.06.30,/@ThatChapter
wId1Hy_cNGg,I'M A MADAM BO FAN! - Mortal Kombat 1 Story Mode Chapter 1: The New Era,9 998 katselukertaa,24.34,/@lostygirl
BHj1p4QAVjk,The Cruel Ambush Waiting for Jared Bridegan,869 728 katselukertaa,24.11,/@ThatChapter
ryPVr7QySLY,Evil Neighbourhood Monster Almost Got Away With Everything | Tim Hennis,1 191 993 katselukertaa,30.28,/@ThatChapter
