Video Id,Title,View Count,Length,Channel
r16GKiqj3S4,How to Turn Wood into GOOD Charcoal!,457 681 katselukertaa,7.05,/@lumbercapitallogyard
FqRCnF9dovw,"How to make Charcoal for your BBQ | Tip, life hack | BBQ Pit Boys",634 386 katselukertaa,3.55,/@bbqpitboys
lXA-9zpgdjE,4 Quls by Sheikh Mishary Rashid Al Afsy,30 833 172 katselukertaa,3.06,/@ShortHax
1ZpGV9soTlU,Mix Charcoal Powder And Super Glue. You Will Be Amazed With The Results,2 181 451 katselukertaa,5.41,/@creationholic101
JsObuHO1tMA,Primitive Technology: Making Charcoal (3 Different Methods),1 852 937 katselukertaa,15.16,/@primitivetechnology9550
58eEmeMYILE,HOW IT WORKS - Charcoal,555 025 katselukertaa,4.30,/@FreeDocumentary
6tzofI2F8YM,Traditional Woodland Crafts in the UK: Charcoal Burning | RIng Kiln,91 542 katselukertaa,28.06,/@TAOutdoors
CdVBhjMZp2g,Tips For Using a Charcoal Chimney Starter,644 472 katselukertaa,3.55,/@GrillTopExperience
GzLvqCTvOQY,Primitive Technology: Charcoal,22 573 044 katselukertaa,5.31,/@primitivetechnology9550
gUL1FB5i2JY,How to make charcoal in your backyard,1 414 469 katselukertaa,6.16,/@KimballCody
wXKb8DAKgKI,A Beginner's Guide To Charcoal | Lump vs Briquettes,16 491 katselukertaa,14.34,/@tomwadek
NoZJYcNcbUA,Beginners Guide to Using a Charcoal Grill,265 011 katselukertaa,4.26,/@GrillTopExperience
Rb7eqJviMFA,Everything I know about charcoal drawing in one video,64 196 katselukertaa,20.45,/@ArtbyLouise
4dP67EyAzOc,Benefits of Activated Charcoal | Dr. Josh Axe,854 589 katselukertaa,5.51,/@drjoshaxe
_g6Q7RmxG0I,How To Make Charcoal (Using Stir Sticks and Paint Cans),2 477 516 katselukertaa,5.20,/@TheKingofRandom
TDxDS4j4mdY,How Charcoal is Made,320 621 katselukertaa,14.38,/@StrangeParts
MVtXZKLKQZI,The Easiest Way to Make Backyard Charcoal,240 578 katselukertaa,8.19,/@wantedwastaken
K5DRltODdSQ,How To Light a Grill the Right Way,3 567 767 katselukertaa,3.07,/@Munchies
lF1Cnb_VZ2g,What Is Activated Charcoal and How To Use it? – Dr. Berg,185 335 katselukertaa,1.29,/@DrEricBergDC
