Video Id,Title,View Count,Length,Channel
-ZnD0AGqQ7I,Characterization Lesson | Using Disney's Frozen,890 901 katselukertaa,4.56,/@Mayllie
HCshdu8loDo,Characterization in Literature,438 135 katselukertaa,2.08,/@educationaltutorials7591
voi2dTr00SI,Characterization In Acting | Beginner's Actor Training Week 5 | Garima's Good Life,214 589 katselukertaa,13.05,/@GarimasGoodlife
dGc224glKw8,Kalki is characterized as a powerful force with eight divine powers,116 341 katselukertaa,0.58,/@AakashKhemchand
-vAQ1ZzQycs,Kylie Jenner Characterized In Stage Play Over Cultural Appropriation,69 857 katselukertaa,2.49,/@HollywoodLife
xLocLH3e8jw,Characterization,66 463 katselukertaa,2.41,/@billieblalock667
nvofJRt5KtA,Making a Characterized Sugar Rocket Motor - ElementalMaker,56 584 katselukertaa,17.11,/@ElementalMaker
8i-6Ex39xX4,POV: you kissed my other avatars (you’re characterized as a boy),43 360 katselukertaa,0.14,/@midnightcat1606
PjMqeQBCRfQ,Diversity and Plurality that has characterized Indian Civilization - Javed Akhtar,41 745 katselukertaa,1.40.53,/@sanchifoundation
BAyPg8jE2Tg,Poetry is a rhyming composition characterized by brevity and succinct ideas,33 196 katselukertaa,1.04.20,/@PerronejrFTW
UlyUNgIysVM,Unique Holi characterized by a scramble of color,27 841 katselukertaa,0.53,/@bayareacolorfestivalbigges6042
NDUxNPmYzlg,Chan characterized STAYS same as anelderlymeme 🥺,18 979 katselukertaa,0.15,/@bangchanspreciouslaptop3174
ILd_lUxQbfc,Midnite: They’re characterized as the chant and call style #shorts,16 671 katselukertaa,0.59,/@reggaegistxtra_ng
k3FUC_iqchw,"Goei AT Low noise, Low vibration drill (characterized by water circulation system)",15 315 katselukertaa,3.32,/@masamimiyawaki
uoJW1kCCwMY,Characterization,14 076 katselukertaa,9.04,/@bluemeanie07
zpZ0eywHavE,Characterization in Hindi - Literary terms of English Literature,11 703 katselukertaa,4.04,/@EnglishGuruji007
SUDj4ssuB4o,Haare Haare Song | Udit Narayan | Alka Yagnik | Sharique Khan | Characterized by Kunal Sinha,10 660 katselukertaa,4.42,/@TheRobArtist
S5BPrunIdZY,What Is Characterization?,9 505 katselukertaa,1.34,/@headspace1165
YjyDLSSV6B0,Low voter turnout characterized the election in the most constituencies,8 079 katselukertaa,35.30,/@kenyacitizentv
q9zQ1Xa4IrM,SCAR marker or Sequence Characterized Amplified Region. What and how to design.,8 002 katselukertaa,5.04,/@XploreBio
