Video Id,Title,View Count,Length,Channel
OqCTq3EeDcY,Moses Parts the Sea - The Ten Commandments (6/10) Movie CLIP (1956) HD,15 349 887 katselukertaa,2.26,/@MOVIECLIPS
ahkwQhQZWG8,Let My People Go - The Ten Commandments (1/10) Movie CLIP (1956) HD,8 792 997 katselukertaa,2.35,/@MOVIECLIPS
88OmFN_-Lwg,Chelsea Vs Charlton in 1937#shorts,8 389 339 katselukertaa,0.44,/@AudiSportsJunction
dHxqqUXrmOQ,Through To The Semi-Finals! 🙌 | United 3-0 Charlton | Highlights,4 913 168 katselukertaa,2.24,/@manutd
n8u7bqeRLU4,I Built A JUNGLE MANSION in Minecraft 1.19 Hardcore (#56),3 510 719 katselukertaa,17.05,/@FarzyMC
0bi1PvXCbr8,"Charlton Heston Mark Antony speech ""Julius Caesar"" (1970)",2 746 409 katselukertaa,9.47,/@ArikElman
ElHLPvB1ZW0,The Who - Baba O'Riley (Charlton '74),1 581 500 katselukertaa,5.31,/@millaa1971
_8jJHjk3hH0,Charlton Heston's Daughter Confirms What We Thought All Along,853 374 katselukertaa,7.46,/@FactsVerse
ZKjF_S6PDN4,My First Car  🚘 | Unveiling With Family | Gabriella Charlton,760 941 katselukertaa,12.31,/@GabriellaCharltonYT
mthSnw3gXEA,The Who - 'Baba O'Riley'  Charlton 1974,662 060 katselukertaa,5.25,/@brownsfan84
glcuSPMAAHs,From Bolt Action Lee to LMG: The Charlton Automatic Rifle,576 350 katselukertaa,19.41,/@ForgottenWeapons
94j25hjwccE,"🚦Footballer 1:RACE 22🚦(Wenger push, Xhaka red, Rooney breaks Charlton's record!)",522 471 katselukertaa,2.21,/@442oons
XXAVOcy1GMY,"Charlton Heston, Kim Basinger | Full Movies | Adventure, Mystery, Thriller",484 860 katselukertaa,1.38.12,/@dramamovie3538
WOEqY7zYfLk,INCREDIBLE Lee Bowyer Dressing Room Speech! | Charlton Athletic Promoted | #SkyBetPlayOffs,411 746 katselukertaa,1.01,/@skybet
A1BcrAByBqw,The CRAZIEST stoppage time you will EVER see!,382 780 katselukertaa,9.49,/@CAFCOfficial
yJdGxLZ5qzE,55 Days at Peking 1963  Charlton Heston Ava Gardner David Niven War/Drama Full Movie HD 4K,356 356 katselukertaa,2.42.07,/@videosway2246
feAtjcPZuBE,Top 100 Patrick William Charlton Vines | Patrick William Charlton Vine Compilation 2018,341 678 katselukertaa,10.24,/@WorldWideVinesS
spUWlJzQ0rc,"Charlton Heston in ""Nairobi Affair"" (1984)",335 264 katselukertaa,1.34.25,/@DonaldPBorchersOG
1yen_ZhNKOU,"The Death of Charlton Heston - April, 2008 - part 1 of 2",332 061 katselukertaa,9.18,/@videoholic2000s
x80O_2qzVIY,My New Car 🚗 | Ippadi Oru Nelamaiya ?😓 | Gabriella Charlton,325 517 katselukertaa,13.24,/@GabriellaCharltonYT
