Video Id,Title,View Count,Length,Channel
43Vrnaz8fYU,The Secret to Great Characters — Characterization Explained,152 641 katselukertaa,17.03,/@StudioBinder
PhM2aFrVpyg,Silly Characters Who Are No Joke,893 296 katselukertaa,16.09,/@RadChad
L7b9sdt4qRI,MORTAL KOMBAT 1 - All Characters FULL ROSTER & Poses (MK1 2023) PS5,322 454 katselukertaa,3.28,/@ZanarAesthetics
L4ivMJzcB-0,MORTAL KOMBAT 1 All Characters Endings MK1,151 905 katselukertaa,28.08,/@MKIceAndFire
qL_RMqNNaEQ,Guess the Character by the Emojis Quiz,237 542 katselukertaa,18.15,/@TheQuizShow
VF7xCEU56Yg,Horror Movie Characters I Can BEAT,4 117 476 katselukertaa,13.12,/@Degenerocity
RkRl8fwkaqw,Netflix Presents: The Characters | Tim Robinson | Netflix,936 208 katselukertaa,2.52,/@Netflix
Bp_or8nrOxs,Top 20 Times Movie Characters Went GOD MODE,441 699 katselukertaa,22.31,/@WatchMojo
RkC3KUD7qu0,Kid or Adult Version of these Characters?,11 629 630 katselukertaa,1.00,/@Sambucha
c3k6YiRDQQ0,Redesigning Scooby Doo Characters,3 999 260 katselukertaa,0.16,/@serenescetches
8wm9ti-gzLM,GOOD vs BAD Character Design: Tips and Tricks!,4 318 920 katselukertaa,20.21,/@BaMAnimation
25vG8TL9dSE,Characters Welcome! 9/13/23,411 katselukertaa,1.11.33,/@CharactersWelcome
RxfkaQOsdsw,10 WORST Tips for Creating CHARACTERS,280 150 katselukertaa,12.39,/@JennaMoreci
kkKanok3vC0,Top 10 STRONGEST Anime Characters!,1 490 417 katselukertaa,0.36,/@pain_-
BIZPzyDznHI,Top 15 Strongest Alan Becker Characters,709 603 katselukertaa,0.28,/@Earmo777
WTr1lObW5Z8,4 Artists Design Characters from the Same Description,2 504 268 katselukertaa,36.33,/@Drawfee
nbelRss9ZQc,How Tall Are These Characters?,3 998 025 katselukertaa,1.00,/@Sambucha
NA9zsGn9btY,FOUR Artists Design New Characters from ONE Description,773 054 katselukertaa,35.13,/@Drawfee
9NL51Eej4hA,What’s the weirdest fictional character you’ve been attracted to? Pt. 2,8 816 534 katselukertaa,0.54,/@Wafellow
HUkiUtri104,Are These Character Designs Racist?,1 778 431 katselukertaa,0.49,/@Sambucha
