Video Id,Title,View Count,Length,Channel
qQzEXZa6dsY,I was asked to model for a professional portrait painter at the stunning Chateau de Puy Vidal!,59 555 katselukertaa,23.49,/@TheChateauDiaries
d7uLO1PWOCo,"I reached the TOP of the chateau, installing the ATTIC floor.",138 972 katselukertaa,15.51,/@escapetoruralfrance
5UeZHeKthHc,20 Year Chateau RENOVATION in 20 Minutes,18 306 katselukertaa,24.10,/@BordeauxLife
zaLxe_ChSEc,The Water Mirror of the Chateau + The Hydroelectric Generator Project,16 685 katselukertaa,6.21,/@ChateaudeDampierre
t-wtFowqaNc,Ancient chateau renovation: What comes out must go back in,5 315 katselukertaa,19.17,/@ChateauDeMontmagner
fFHR164mnjg,Angus & Julia Stone - Chateau,25 649 408 katselukertaa,4.49,/channel/UCf7Z_KgORfeGD4RVPuoPtag
_gpy0Y0XLSo,Cleaning and cleaning/ Renovating on lake Como,4 829 katselukertaa,18.15,/@DreamingofAChateau
EvI3IxZCA-4,Chateau | 6x6 LIM Coaster | Route 66 | Rollercoaster Tycoon Classic,325 katselukertaa,2.24,/@StuTube
U_M9vJNJp7Y,Giving The Chateau A New Grand Entrance!,29 897 katselukertaa,13.22,/@ChateaudelaFerte
j68TdvzyoAc,TRANSFORMATIONAL TRAVEL | Our September 2023 Painting Workshop,10 421 katselukertaa,25.03,/@LadyoftheChateauProductions
rqeBL2Nnxig,A PRINCE JOINS THE FAMILY | Final preparations for our CREATIVE RETREAT,18 872 katselukertaa,45.15,/@LadyoftheChateauProductions
HQ6kKYPupIo,Revealing the plans for our Chateau Master Suite Transformation,166 112 katselukertaa,18.27,/@HowToRenovateAChateau
o40mXpSZHtM,A classical chateau set in a small village just twenty minutes from Saint-Emilion.,1 568 katselukertaa,2.05,/@Sifexchateaux
mXDhAQ8YjpE,Al het werk VOOR NIETS? Alles laat LOS... 😱 | CLASSICS: Chateau Meiland #AFL30,5 448 katselukertaa,39.22,/@sbs6
FPvvEgSqj_0,Amazing 4 Year Transformation - Tour our Renovated French Chateau Home,1 052 947 katselukertaa,12.09,/@HowToRenovateAChateau
0gIhTHXAdtA,Our French Chateau Bedroom Suite Re-Do: PART ONE!,20 445 katselukertaa,15.05,/@OurFrenchChateau
Q0sbUO4hgQQ,Jaw-Dropping BEFORE & AFTER: Our French Chateau Restoration,96 662 katselukertaa,22.55,/@OurFrenchChateau
pJd9OtmrTKA,Tour of A FRENCH CHATEAU in the SAME FAMILY for OVER 700 YEARS !,867 447 katselukertaa,32.25,/@SoChateauxTV
7xH095cIiFQ,"How Much I Bought the Chateau, Restoration Costs. Let's Talk About Money !",176 436 katselukertaa,6.35,/@ChateaudeDampierre
