Video Id,Title,View Count,Length,Channel
avc1rjNM3o0,Mamachya Gavala Jauya - Marathi Balgeet For Kids (with lyrics),472┬а806┬а999 katselukertaa,3.22,/@kidsplanetmarathi
-yyhXOOUzJw,Chiv Chiv Chimni in 3D - Marathi 3D Rhymes | Marathi Balgeet Song рдорд░рд╛рдареА рдЧрд╛рдгреА 2019,372┬а748┬а158 katselukertaa,1.34,/@kidsplanetmarathi
2EVev7a5B2M,"Sang Sang Bholanath | Marathi kids song, balgeet by Jingle Toons",199┬а149┬а175 katselukertaa,4.06,/@JingletoonsMarathi
x8RaWlHkBdE,Labad Landga Dhong рд▓рдмрд╛рдб рд▓рд╛рдВрдбрдЧ рдвреЛрдВрдЧ рдХрд░рддрдВрдп  | Makdacha Davakhana | JingleToons Famous Marathi Songs,163┬а937┬а149 katselukertaa,8.02,/@JingletoonsMarathi
BgftSsyrMdY,Gharapudhe Thambla Tanga | Superhit Marathi Balgeet | Kids Songs by Jingle Toons,151┬а811┬а590 katselukertaa,4.15,/@JingletoonsMarathi
L_LUpnjgPso,Fireplace 10 hours full HD,123┬а551┬а374 katselukertaa,10.01.26,/@Fireplace10hours
6MFLqquqiRM,рдУрд╡реАрдиреЗ рдмрдирд╡рд▓реА рдордБрдЧреЛ рдХрдБрдбреАЁЯНн Mango IceCream Recipe by Ovee &  @CrazyFoodyRanjita,90┬а382┬а944 katselukertaa,8.08,/@oveemumma2775
MHf0pO2ZBeU,Chiv Chiv Chimani | Latest Animated Marathi Balgeet Songs and Bad Bad Geete,79┬а751┬а534 katselukertaa,1.34,/@kidsplanetmarathi
kDU-P1vQCIE,"Chal re Bhopalya Tunuk , Tunuk !",65┬а549┬а548 katselukertaa,8.30,/@marathigammatgoshti4016
wygHI6Wwxl4,Mamachya Gavala Jauya | Zuk zuk Aagingadi Top Marathi Balgeet | Marathi Children Song by JingleToons,62┬а451┬а719 katselukertaa,3.36,/@JingletoonsMarathi
AWfJ0f7s3Rk,Apadi Thapadi - Marathi 3D Rhymes | Chiv Chiv Chimni Marathi Balgeet Song JingleToons рдорд░рд╛рдареА рдЧрд╛рдгреА2021,61┬а865┬а806 katselukertaa,1.45,/@JingletoonsMarathi
6fc2ahfyYQ0,sasa re sasa рд╕рд╕рд╛ рд░реЗ рд╕рд╕рд╛ | Sasa Kasav | Hair & Tortoise Marathi JingleToons,49┬а100┬а466 katselukertaa,3.33,/@JingletoonsMarathi
mL3sho1CpkI,Primitive Technology: Chimney and pots,34┬а783┬а284 katselukertaa,6.39,/@primitivetechnology9550
MmLeuqpQAxs,рдпреЗрд░реЗ рдпреЗрд░реЗ рдкрд╛рд╡рд╕рд╛ | рдордЬреЗрджрд╛рд░ рдорд░рд╛рдареА рдмрд╛рд▓рдЧреАрдд | Marathi Rhymes | Marathi Balgeet | Jingle Toons,33┬а342┬а323 katselukertaa,10.27,/@JingletoonsMarathi
KkK4BLxt-wg,Marathi Baalgeet- Nach Re Mora Kids songs | Marathi Rain Song and many more popular rhymes,31┬а737┬а573 katselukertaa,3.44,/@MarathiBaalgeet
iqNVwihxFr4,Pinga | Bajirao Mastani | Kids Dance | Steps Growing Entertainment,31┬а013┬а816 katselukertaa,1.31,/@TeamSG
UgHKb_7884o,12 HOURS of Relaxing Fireplace Sounds - Burning Fireplace & Crackling Fire Sounds (NO MUSIC),28┬а224┬а606 katselukertaa,12.00.38,/@cattrumpet
hKzkUjAftMY,Chimane Chimane Ye ga_Latest Marathi Balgeet,26┬а842┬а292 katselukertaa,4.56,/@MammamTV
UWs-l13jxDI,рдЬрдВрдЧрд▓ рдореЗрдВ рдмрд╛рд░рд┐рд╢ рдХрд╛ рдХрд╣рд░ ред Hindi Cartoon |Tuni Chidiya aur kauwa | Chidiya kI  Kahani | Cartoon Hindi,25┬а769┬а789 katselukertaa,11.46,/@JungleBuddiesOfficial
MtFLKmb2w7A,Climbing the Tallest Chimney in Europe,25┬а031┬а133 katselukertaa,6.21,/@flaviucernescu
