Video Id,Title,View Count,Length,Channel
6QYO3EMb-ho,How and When to take Cialis (Tadalafil) | What Patients Need to Know,728 505 katselukertaa,6.40,/@JHPMedicalUK
FwN99cmXvOQ,"Cialis Review (Tadalafil) - Dose, Side effects, Safety - Doctor Explains",276 712 katselukertaa,3.45,/@howtomedicate
Igc7rFJkm84,Cialis Vs Viagra - Which one is Better | Erectile Dysfunction Treatment | Sildenafil Vs Tadalafil,2 545 386 katselukertaa,3.29,/@Medinaz
Yh6rclTB64M,"Cialis (Tadalafil) Explained: Benefits, How it works, Side Effects & More",16 458 katselukertaa,4.46,/@MedBoard
miIAkXqHYd0,3 Things To Know Before Using Cialis (Tadalafil),28 046 katselukertaa,1.30,/@DrugTalk
LZHoecZl16M,Are Viagra and Cialis Really Harmful to Your Heart? | UroChannel,580 052 katselukertaa,5.05,/@UroChannel1A
2VGRjSlWbco,Cialis,68 309 katselukertaa,10.55,/@wellnowdoctor5976
kRMQeaY6Jbg,"Before You Use Viagra or Cialis, Watch This Video!!",18 862 katselukertaa,2.16,/@NovusCenters
J5o1WpX4Yf4,Viagra vs. Cialis: Little Blue Pill Is Losing Big,322 306 katselukertaa,1.30,/@business
jbURUoUpygI,10 Cialis Secrets and Answers 💪,515 152 katselukertaa,3.41,/@DrSamBailey
NTtxjb24U4Y,Benefits of Cialis,5 136 katselukertaa,2.36,/@powerprojectclips5137
IN0h2STOTCY,CIALIS AS A PRE-WORKOUT?,41 850 katselukertaa,2.49,/@rxmuscle
d0ItVdi8Jkg,Everything you need to know about Sildenafil vs Tadalafil for erectile dysfunction | ED pills,7 534 030 katselukertaa,10.18,/@RenaMalikMD
wQ53UYtu6ME,How long does CIALIS last? 💪💊,16 279 katselukertaa,0.13,/@DrugTalk
kZ2h1VU_B0Q,How to use Cialis (Tadalafil) for Best Results 5mg/10mg/20mg,37 467 katselukertaa,4.01,/@drkiddMD
bnfFLX-9-yI,Effects of Mixing Cialis and Alcohol,25 271 katselukertaa,8.19,/@EricBZink
8lRq3BGmKPE,Viagra or Cialis - Which is Better for Sex Drive and Muscle Gains,3 675 katselukertaa,8.02,/@DavidDeMesquita
fvuCPW4VS88,Cialis (Tadalafil) vs. Viagra (Sildenafil) MADE EASY,64 622 katselukertaa,5.03,/@MedicalVideosAnimated
VZxZI94uKrA,Does Cialis give you a hard on?,32 650 katselukertaa,2.05,/@AskAboutAPPS
sv8Tvky_hj4,Is Cialis 20 mg too much?,3 714 katselukertaa,1.10,/@PeopleWHYS
