Video Id,Title,View Count,Length,Channel
oEaB_X23ifc,The 3 Circular Saw Tips Every Beginner Should Know!,112 679 katselukertaa,5.56,/@TheFunnyCarpenter
le1azjkxy9Q,5 CLEVER Tricks For Perfect Circular Saw Cuts,163 959 katselukertaa,16.24,/@LRN2DIY
rLvdbW7-P4o,Circular Reasoning,34 629 katselukertaa,59.28,/@CrackingTheCryptic
8pvKGW7NlZc,Making Circular Saw Crosscut & Miter Jig The Max Cut,1 117 058 katselukertaa,12.40,/@MrHWoodworking
FXd8jYqVVJs,85% of People Get this Wrong Cutting with a Circular Saw,2 542 072 katselukertaa,3.24,/@TheFunnyCarpenter
vV691tXe4RQ,How To Make A Homemade Table Saw With Circular Saw,4 101 584 katselukertaa,4.35,/@welldonetips
__0Spwj8DkM,What is the circular economy? | CNBC Explains,239 173 katselukertaa,3.43,/@CnbcIntl
zCRKvDyyHmI,Explaining the Circular Economy and How Society Can Re-think Progress | Animated Video Essay,1 559 237 katselukertaa,3.49,/@EllenMacArthurFoundation
hR-JJyxpOY4,Max Cooper - Circular (Official Video by Páraic McGloughlin),181 093 katselukertaa,4.35,/channel/UCuisDAMnvHMYuLFRedMgmVw
bflTi41S6Og,HOW TO USE A CIRCULAR SAW FOR BEGINNERS- PART 1,1 032 528 katselukertaa,4.22,/@TrainingHandsAcademy
QljFKnLbsMM,"How is Adaptis solving circular construction, decarbonization and waste mitigation for built world?",8 katselukertaa,45.18,/@proptechbuzz
ts4ciSiaUJ0,Top 3 Circular Saw Projects || 3 Best Circular Saw Ideas,15 579 594 katselukertaa,10.45,/@MistryMakeTool
HLsNYd5FmoY,Make This Circular Saw Track Saw Guide....With a Circular Saw!,553 707 katselukertaa,8.52,/@OutoftheWoodwork
N1nA08Wr_hk,How to make clean cuts with circular saw,870 873 katselukertaa,13.55,/@billshowto
BOulVzfwRCQ,Circular Ring vs Oura Ring Initial Review - Lot's of Potential!,47 959 katselukertaa,19.04,/@ChaseTheSummit
56jbiJuvBng,Circular Saw (Cutting a Circle Part 1),33 845 katselukertaa,2.21,/@ConstructionTip
KODPeMHykAk,PRECISION: This is How I Cut Wood Like a Pro using a circular saw jig,1 963 474 katselukertaa,6.14,/@diyandwood
zQC4-TU-c1M,CIRCULAR SAW on Tractor MOWER !?,755 035 katselukertaa,8.06,/@DShomemade
fgJIMBz6La8,Hammock - Circular As Our Way (Silencia),299 721 katselukertaa,7.01,/channel/UCJ5q1LpG-iISADNJ_E87C9g
PmEa9Y4Tpbc,Liebherr - T 55-7s telescopic handler in support of the circular economy,138 katselukertaa,1.51,/@LiebherrGroup
