Video Id,Title,View Count,Length,Channel
cfVY9wLKltA,Team Iron Man vs Team Cap - Airport Battle Scene - Captain America: Civil War - Movie CLIP HD,266 829 913 katselukertaa,3.51,/@topmovieclips5056
RzhAS_GnJIc,Safe & Sound feat. The Civil Wars (The Hunger Games: Songs From District 12 And Beyond),201 572 711 katselukertaa,4.01,/channel/UCqECaJ8Gagnn7YCbPEzWH6g
dKrVegVI0Us,Marvel's Captain America: Civil War - Trailer 2,88 786 579 katselukertaa,2.25,/@marvel
BNcxTNrtRdk,"Spider-Man ""Hey Everyone"" - Airport Argument Scene - Captain America: Civil War - Movie CLIP HD",82 025 796 katselukertaa,2.47,/@topmovieclips5056
cbc-q6R0-94,Tony Stark & Black Panther vs Bucky - Fight Scene - Captain America: Civil War (2016) Movie CLIP HD,67 777 721 katselukertaa,1.47,/@topmovieclips5056
isCh4kCeNYU,Civil War,66 401 081 katselukertaa,7.43,/channel/UCIak6JLVOjqhStxrL1Lcytw
uVdV-lxRPFo,Captain America: Civil War - Trailer World Premiere,60 547 418 katselukertaa,2.27,/@JimmyKimmelLive
tsxmyL7TUJg,The American Civil War - OverSimplified (Part 1),53 569 737 katselukertaa,29.53,/@OverSimplified
kGesLXV3PcU,What If This Happened in Marvel's Civil War [ Parody ] ft Spider-man Homecoming,53 021 857 katselukertaa,3.20,/@CartoonHooligans
OT8w4dx_N8U,Deadpool and Spider-Man: Civil War,42 144 650 katselukertaa,0.45,/@ZachAce
4epUZ1ZmKzU,Civil Engineer Ka Badla,40 245 155 katselukertaa,0.30,/@SaifAli00
xuVHe-0r-BE,"Civil War 1864: A Virtual Reality Experience, Full Version",39 747 767 katselukertaa,11.56,/@AmericanBattlefieldTrust
immZ8Ed2Wa4,Team Captain America vs Team Iron Man - Civil War Battle,31 121 934 katselukertaa,10.29,/@KjraGaming
fvLw021rVN0,How Captain America: Civil War Should Have Ended,30 380 815 katselukertaa,6.33,/@HowItShouldHaveEnded
FkTybqcX-Yo,"Captain America: Civil War Official Trailer #1 (2016) - Chris Evans, Scarlett Johansson Movie HD",30 367 452 katselukertaa,2.27,/@RottenTomatoesTRAILERS
sV6uuMAnJUE,The American Civil War  - OverSimplified (Part 2),29 648 197 katselukertaa,22.43,/@OverSimplified
UQnaNGyPriM,Mini hydroelectric dum!!civil engineering tricks,25 829 265 katselukertaa,0.16,/@BilalTechzone
4Ty1zVZQ8X4,Tony Stark vs. Steve Rogers - the last donut (2016) Captain America Civil War,22 572 790 katselukertaa,0.47,/@moviemaniacs
Ec7PREYiJUY,Masked Wolf - Astronaut In The Ocean (Soner Karaca Remix) | Captain America: Civil War,22 349 035 katselukertaa,3.22,/@TrapMusicXD
nDROiMF3_r0,War Machine Falls Scene - Airport Battle - Captain America: Civil War - Movie CLIP HD,21 318 404 katselukertaa,2.25,/@topmovieclips5056
