Video Id,Title,View Count,Length,Channel
kqbrUdS3BI8,CLUB me STAG ENTRY कैसे करे😎 | Sandesh Mhaske #ClubEntry #Shorts,29 041 832 katselukertaa,0.55,/@Sandy611
qH1wbp-FASo,Love in This Club,23 904 399 katselukertaa,4.20,/channel/UCaNrhBiXsXIM2epDl_kEzgQ
QAz4e94zwHM,Dominoes Choose Your Golf Clubs!! (W/ Hailey Ostrom!),22 155 895 katselukertaa,1.00,/@SamJagoda
8RQUnbPqjfE,Wizard Duel Club...,20 132 827 katselukertaa,1.00,/@IamMoBo
z_SDkpYCyA4,Naked Club's Video Streak edition 3,19 946 322 katselukertaa,16.40,/@NakedClub
-KFdq63cVVo,@Numberblocks- Club Picnic 🧺 | Shapes | Season 5 Full Episode 18 | Learn to Count,18 771 957 katselukertaa,4.34,/@Numberblocks
C5VDfS39fGA,SNEAK CANDY INTO A CLUB #2 || Weird Ways to Sneak Food! Secret Snacks and Candies by 123 GO! SCHOOL,18 112 202 katselukertaa,9.43,/@123GOSCHOOL
m0Xyj3QUzWQ,Coi Leray sings ‘Players’ Live in London Club,16 329 432 katselukertaa,0.10,/@MFNIGHTS
lFQAodUSHio,Which Football Club Could MrBeast Afford To Buy? 💰,15 069 001 katselukertaa,0.40,/@JohnNellis
MQVxhgdzI2U,"2017 Rhythmic Worlds, Pesaro (ITA) - Clubs+Ribbon Finals, Highlights - We Are Gymnastics !",13 702 775 katselukertaa,26.12,/@gymnasticschannel
bUecW-4YCFU,Club SURPRISES Tate with $1million birthday party,12 785 429 katselukertaa,0.26,/@therealworldtrw
fGf0rGx7gJw,Famous Goals Against Former Clubs in Football - Respect & Disrespect,12 145 060 katselukertaa,11.38,/@SirAlexmu
FtXEpNNmRMI,Glee Clubs & Glory - Final Performance - Austin & Ally - Disney Channel Official,10 029 057 katselukertaa,2.54,/@disneychannel
JcSNkByPH78,How Clubs be Making up Anything so You can’t get inside,9 632 239 katselukertaa,1.29,/@RDCworld1
6nb2UJa7kTg,Trying to get into the world’s MOST EXCLUSIVE club!?,8 933 674 katselukertaa,1.00,/@uptins
Gq7akxvNb38,Name football clubs beginning with the letter D (IMPOSSIBLE!) #shorts,8 703 592 katselukertaa,0.34,/@GOAL
UCT5Ggpdar0,pov: you are in club at party with your friends but it's 2012,8 422 713 katselukertaa,37.54,/@RoseateMusic
j0KVhT1z8qE,Types of Christian Dances at the Club✨ #TheManniiShow.com/series,7 801 949 katselukertaa,0.31,/@TheManniiShow
wMDi_IcB47Y,Dancing Coaches From Big Clubs 🕺👑🤩 || #shorts #viral #trending,7 142 554 katselukertaa,0.24,/@JustEditzTM
pC8wnGmNijA,RICH AND POOR CLUB || Funny Ways To Sneak Food For Smart By 123GO! SCHOOL,7 030 565 katselukertaa,20.58,/@123GOSCHOOL
