Video Id,Title,View Count,Length,Channel
UYklKASRVOk,The First Call of Duty Ghost Movie,63 844 958 katselukertaa,1.00,/@JakeCeja
CThDPY3BSco,The MOST DISRESPECTFUL KILL IN COD HISTORY 😂,52 457 837 katselukertaa,0.58,/@ASAPBLOCKAY
Td-AvHH6sDI,COD BLACK OPS 3 EPIC RAP | ZARCORT | CYCLO | KRONNO | PITER-G,47 403 315 katselukertaa,5.27,/channel/UCE3qZH8ltYwmQDmm5uinPXw
EeF3UTkCoxY,Official Reveal Trailer | Call of Duty: Infinite Warfare,46 475 977 katselukertaa,3.25,/@CallofDuty
bH1lHCirCGI,Official Reveal Trailer | Call of Duty: Modern Warfare,40 313 625 katselukertaa,1.53,/@CallofDuty
mHDEDDrGYvo,Gameplay Reveal Trailer | Call of Duty: Modern Warfare III,37 023 572 katselukertaa,2.07,/@CallofDuty
OQ1CwPhE8KQ,Reveal Trailer | Call of Duty: Vanguard,26 763 526 katselukertaa,3.00,/@CallofDuty
o1h_wzxVfHQ,Monster School : CALL OF DUTY MOBILE CHALLENGE - Minecraft Animation,23 593 685 katselukertaa,10.01,/@PlataBush
WnLvgbWU77U,PUBG VS FREE FIRE VS CALL OF DUTY 😎🔥 WHICH IS BEST MOBILE GAME?🤔 #trending #shorts,18 843 610 katselukertaa,0.47,/@VivekGuptaGaming
C_6J06wdgXY,Modern Warfare III - Makarov Reveal Trailer,16 341 078 katselukertaa,1.49,/@CallofDuty
bkwaq2wcTNU,In Cold Blood | कौन खेल रहा है Team CID के साथ Mystifying Game? | CID | सीआईडी | Full Episode,14 708 253 katselukertaa,43.36,/@SETIndia
oJca6zoI50E,Warzone 2.0 Launch Trailer | Call of Duty: Warzone 2.0,13 405 350 katselukertaa,2.04,/@CallofDuty
aTS9n_m7TW0,Reveal Trailer | Call of Duty: Black Ops Cold War,13 340 747 katselukertaa,2.28,/@CallofDuty
KC4zok3U3fE,"Let's Go, Squad! | Live Action | Call of Duty: Mobile - Garena",12 797 741 katselukertaa,2.28,/@GarenaCallofDutyMobile
g_ZSVVkincQ,If Call of Duty Zombies Was Real,12 315 463 katselukertaa,0.34,/@CoreyTonge
vXcC7h18k9g,Modern Warfare Ninja Montage #10,12 161 874 katselukertaa,16.51,/@YTCookieNinja
OzxPDZAQPK8,REAL LIFE Call of Duty Takedowns! | Alex Zedra,11 987 856 katselukertaa,14.23,/@Alex_zedra
-ojxvpI9_i0,GXSOUL - RAAT VARI ft. C.O.D | MUSIC VIDEO,11 380 990 katselukertaa,4.31,/channel/UCywkpxF4B_3MId6SSJ2-EJQ
4LBCz6UhV7I,THE MOST SADDEST/HEROIC SACRIFICES MOMENTS in Call of Duty [ Modern Warfare - Black Ops Cold War ],10 801 694 katselukertaa,21.32,/@GetRektNoob
XV8vBqNu9nI,CALL OF DUTY MODERN WARFARE 2 Gameplay Walkthrough Part 1 Campaign FULL GAME [4K 60FPS PS5],10 718 770 katselukertaa,4.37.36,/@MKIceAndFire
