Video Id,Title,View Count,Length,Channel
-FD5fexy8C8,James O'Brien pillories right-wing columnists 'attacking' Emily Maitlis,87 770 katselukertaa,0.59,/@LBCOfficial
FGz2jn79eWY,Σιωπητήριο Ελληνικού στρατού (original) columnists of Greek army,87 290 katselukertaa,2.24,/@TheThEsSaLoNiKiCiTy
TXF7XOuWPW0,Famous Columnists Gave New Direction About Bushra Bibi,75 607 katselukertaa,7.15,/@HaqeeqatTV
Zl90fme0XEc,Putin blasts Russian media 5th columnists,67 753 katselukertaa,4.44,/@InessaS
ng_pppvRnuI,People are falling behind: WSJ Opinion Columnist,54 238 katselukertaa,5.48,/@FoxBusiness
vH8057RJt2E,How quislings and fifth-columnists in Britain hope to destroy the country's culture from within,31 313 katselukertaa,6.41,/@HistoryDebunkedsimonwebb
QI1RmHTgLVY,WE BECAME ADVICE COLUMNISTS,22 535 katselukertaa,11.29,/@WattsTheSafeword
RX02q2nEIBQ,"How Tilda Swinton Became Dueling Twin Gossip Columnists in Hail, Caesar!",22 124 katselukertaa,1.08,/@VanityFair
m-zvXgZaTgs,Daily Mail train ban debate: Mail vs the Guardian columnists,17 329 katselukertaa,5.35,/@Channel4News
TXZYjEyX8TM,"Pakistan MUST Get Rid Of Fifth Columnists, Traitors | Brig. Samson Sharaf | Israr Kasana",15 606 katselukertaa,49.08,/@israrkasana5279
DOhVvIaqloE,Stumping the Advice Columnists - Dan Savage and Amy Richards,15 167 katselukertaa,3.52,/@foratv
St7K-6FI7ig,"Cramer Responds To Critics: Obama White House, Daily Show, Columnists, Pundits, Bloggers, New Allies",14 595 katselukertaa,9.30,/@Addicted2News
xY4aWZ3Miss,Old Timey Hollywood Gossip Columnists,14 578 katselukertaa,0.36,/@kylegordonisgreat8611
MlzjrquWtV0,"Hail, Caesar! - Featurette: ""The Gossip Columnists"" (HD)",13 653 katselukertaa,1.09,/@UniversalPictures
ZoGY42NJ2qM,El-Rufai Insists Fifth Columnists Behind Crisis To Scuttle APC,11 857 katselukertaa,13.25,/@tvcnewsnigeria
ERnkMfiYT7Q,Wall Street Journal Columnists Unironically Push Hillary 2024,11 237 katselukertaa,10.19,/@TheHumanistReport
zsvqJ0uMQ8s,"Why You Must Ignore Asari Dokubo’s Rants, Don’t Let 5th Columnists Drag You To Unnecessary War",10 675 katselukertaa,38.55,/@NjenjeMedia
CaOr5RiTOaY,Joe Scarborough Goes Off On 'Pathetic' Columnists Shaming Lewinsky,10 499 katselukertaa,2.13,/@tpmtv
iWX5SGNJx38,“Point/Counterpoint” columnists in 1973 on Nixon impeachment,9 703 katselukertaa,3.32,/@60minutes
Ww248jrARFg,Pakistani Columnists Defending Joe Biden's Statement | Details by Lt Gen (R) Amjad Shoaib,9 087 katselukertaa,11.01,/@DDPAnalytica
