Video Id,Title,View Count,Length,Channel
ZNqxCwrJ4q4,Boosted Trampwall combo 🔥,223 431 728 katselukertaa,0.18,/@Travelbatics
DkarTDILJKE,Wendy Sing-Along Kids Songs & Nursery Rhymes,138 445 356 katselukertaa,3.18,/@toysandcolors
CtV2tyXLgj0,Roblox Floor is Lava AT THE PLAYGROUND Let's Play with Combo Panda,101 062 785 katselukertaa,10.09,/@ComboPanda
n5CPMf5eC_s,The Romantic Saga - Talking Tom & Friends (One Hour Episodes Combo),99 130 759 katselukertaa,1.02.17,/@TalkingFriends
_PdogVJx9Iw,QUEVEDO || BZRP Music Sessions #52 (Letra) | quedate que la noche sin ti duele,89 929 142 katselukertaa,3.22,/@jostland
mBa2b0WlWwY,ROBLOX Box Slide down a Rainbow on Fidget Spinner! Let's Play with Combo Panda!,88 060 185 katselukertaa,12.03,/@ComboPanda
QRXbC-_dNrw,Roblox Escape the Bowling Alley Bowling OBBY Let's Play with Combo Panda,82 497 060 katselukertaa,10.49,/@ComboPanda
QCgbNpjeUFQ,"Tu Combo Kabrón, Rocío Quiroz - Culpables (Video Oficial)",66 199 043 katselukertaa,4.28,/channel/UC0CliPmINZ5z1R_tA9fFS7g
ZE131NPhP-4,Roblox Flee the Facility RUN FROM THE BEAST Let's Play with Ryan ToysReview and Combo Panda,58 936 979 katselukertaa,10.35,/@RWvtubers
iipqkBXpghw,ROBLOX Water Park Let's Play with Combo Panda,55 900 567 katselukertaa,7.18,/@ComboPanda
ZEGPWSAqhS0,RYAN PLAYS FLOOR IS LAVA on ROBLOX against ROBO COMBO ! Let's Play,53 515 595 katselukertaa,11.50,/@RWvtubers
f0M1Dk0oKJw,ROBLOX Crushed by a Speeding Wall RUN FOR COVER Let's Play with Combo Panda,51 734 349 katselukertaa,10.46,/@ComboPanda
IBBkxpZ7lCE,Roblox SLIDE DOWN STUFF in a Rainbow Box Let's Play with VTubers Ryan ToysReview Vs Combo Panda,50 808 514 katselukertaa,10.23,/@RWvtubers
oHhWo1VmUkU,Ryan lost Combo Panda's Gaming Controller in the Swimming Pool.....,45 012 362 katselukertaa,10.51,/@RyansWorld
XVD6c9uCpvw,Bro did a punch and slap combo 🤣💀 #ufc #mma,41 680 459 katselukertaa,0.36,/@Moe_CLIPSit
or9qHSKIRIA,Advanced Combo Tutorial by IsiShuffles,39 950 526 katselukertaa,0.24,/@IsiShuffles
t24wGYEpOLE,Roblox Ride Cart to End Let's Play with Combo Panda,37 920 045 katselukertaa,10.28,/@ComboPanda
2-purqQ7PsY,Roblox Flood Escape Let's Play with Combo Panda,37 007 551 katselukertaa,10.08,/@ComboPanda
lEELU7gro-0,Roblox Hide N Seek Extreme! Let's Play with Combo Panda,31 637 058 katselukertaa,8.44,/@ComboPanda
5sy5CiyXc8g,Ryan's first Combo Panda at Build-a-Bear Workshop!!!,30 828 242 katselukertaa,7.24,/@RyansWorld
