Video Id,Title,View Count,Length,Channel
-ZOGdKANL5s,Understanding Combined Arms Warfare,189 225 katselukertaa,42.06,/@ArmyUniversityPress
SNKWRB1-5pA,"John Deere X9  - 1450 , largest Combine Harvester , in 4K",8 409 489 katselukertaa,16.07,/@norbertschindhelm6380
pLz_ZWNMa1M,Combining Every Item In Minecraft,891 497 katselukertaa,37.50,/@UnspeakablePlays
bBkt0Gxmbxo,Minecraft but items can be Combined,8 423 112 katselukertaa,17.58,/@Craftee
G2jtzZok2Qs,"Minecraft, But You Can Combine Anything...",3 660 276 katselukertaa,9.01,/@Bionic
8rdUp9oN44A,Half-Life: Combined | A Half-Life Cinematic [S2FM],777 921 katselukertaa,15.06,/@Virlance
E-eDQHX78Vg,The Combined Timeline | COMPLETE Half-Life & Portal Story & Lore,3 936 161 katselukertaa,2.51.23,/@Skyrionn
_WNRwDRDNmY,"Minecraft, But You Combine Any Item…",2 612 157 katselukertaa,12.30,/@wisp
ZZ-sCT_maAQ,Combined Arms Breach,264 289 katselukertaa,19.25,/@tbocsims
1HJU4sayEdM,all minecraft mobs combined,5 993 515 katselukertaa,1.09,/@axol
4IyD5bDoXow,Jamie Carragher & Gary Neville DISAGREE over Man Utd 99' & Man City 23' combined XI,581 640 katselukertaa,9.59,/@skysportspremierleague
gP4sU_xzwHE,Combined Manchester Derby XI | FA Cup Special Part 4,558 752 katselukertaa,29.25,/@TheOverlap
U2Pu4qPWbXs,Creating A Gorilla Tag Ghost…(Trolled With It),1 053 346 katselukertaa,8.01,/@demitriusdamonke
t-Xiqit_yBQ,I Combined A Moth And A Kitten To Create a Mitten l DIY Art Doll,625 249 katselukertaa,16.56,/@KaypeaCreations
7pvjYFwSEyk,I Cheated with //COMBINE in a Build Battle...,672 944 katselukertaa,19.50,/@SkiddziePlays
1mDvqk09fGA,all mobs combined,6 069 146 katselukertaa,1.02,/@axol
g5Qdu7b6eGs,Just how bad is The Combine?,2 387 438 katselukertaa,19.10,/@Leadhead
dorVKdSVxUI,Exercise Super Garuda Shield 2023 - Combined Arms Live Fire Exercise,10 216 katselukertaa,1.27,/@DefenceAustralia
_gO4CbYhYdE,Liverpool vs Real Madrid COMBINED XI (Champions League Final Special) ► 442oons,924 025 katselukertaa,3.52,/@onefootball
