Video Id,Title,View Count,Length,Channel
G7O9ZpJ-aiU,Facts of Congress - Committees,19 598 katselukertaa,1.05,/@iucorg
cTtP39bLYBg,What are select committees?,13 316 katselukertaa,2.13,/@ukparliament
evLR90Dx79M,Congressional Committees: Crash Course Government and Politics #7,1 348 797 katselukertaa,8.28,/@crashcourse
7bRlef1u3jc,Dick Durbin Leads Contentious Senate Judiciary Committee Hearing On 'Book Bans And Censorship',23 632 katselukertaa,1.54.17,/@ForbesBreakingNews
iLvNmMJmD0w,What are select committees and how do they work?,84 200 katselukertaa,16.41,/@ukparliament
o_2RDuDs44c,How do House of Commons Select Committees work?,40 875 katselukertaa,1.36,/@ukparliament
88UFXPuL4f0,Why are Select Committees important?,7 493 katselukertaa,2.33,/@ukparliament
flNXQK-tOTE,What Do Legislative Committees Do? | Peach State Politics,3 657 katselukertaa,2.11,/@GPBEducation
BbpFpgFNBYc,House Oversight Committee Holds A Hearing On Third-Party Litigation Funding,5 290 katselukertaa,3.29.54,/@ForbesBreakingNews
z9ftWPKMGBs,McCarthy tells House committee to open impeachment inquiry into Biden,37 559 katselukertaa,12.37,/@CBSNews
D6OmS0g6SQo,House Speaker McCarthy directs House committees to launch impeachment inquiry into Pres. Biden,33 547 katselukertaa,0.52,/@ABCNews
GvGpUVg7C4o,Sen. Whitehouse on Book Banning in a Senate Judiciary Committee Hearing,6 943 katselukertaa,4.11,/@SenatorWhitehouse
pkQvQHaI4Bo,Tom McClintock Leads House Judiciary Committee Hearing On Terrorist Entry At The Southwest Border,13 972 katselukertaa,1.50.06,/@ForbesBreakingNews
BHvCqUPos1Y,"Most important facts about parliamentary committees II A Few Minutes Series II April 14, 2023",9 998 katselukertaa,5.01,/@SleepyClassesIAS
i_gf0swjQkg,How Marjorie Taylor Greene landed seats on two key House committees,96 674 katselukertaa,8.16,/@CNN
IkCRelUpOqg,Federal Bureau Of Prisons Director Colette Peters Testifies Before Senate Judiciary Committee,12 213 katselukertaa,1.31.45,/@ForbesBreakingNews
liK6gIAsPLo,House Committee On Ways & Means Holds A Member Day Hearing,9 618 katselukertaa,3.22.39,/@ForbesBreakingNews
0f-SRugWrkw,How do Select Committees work?,10 307 katselukertaa,2.06,/@ukparliament
8jTK6ED_6sc,List Of Important Committees & Commissions in India 2022 by Ashish Gautam Sir,45 314 katselukertaa,25.36,/@Adda247Official
