Video Id,Title,View Count,Length,Channel
tS-UJofdvoE,Does the Konami Code on the Fisher Price Controller ACTUALLY WORK?!,8 262 229 katselukertaa,0.23,/@Burdettedog
ykj-SyPIbNg,Rinyu - Controller (Remix) Feat. Locko,7 385 009 katselukertaa,3.45,/@AkumbaMusic
2FAaC7E4sJ4,RINYU - CONTROLLER (Official Video) Directed by Kwedi Nelson,5 347 167 katselukertaa,3.52,/@AkumbaMusic
tQ-cDwQupj8,What It Takes To Be An Air Traffic Controller At The World's Busiest Airport,4 449 183 katselukertaa,9.48,/@InsiderBusiness
EtNIMvyEIQA,Channel Tres - Controller,2 376 432 katselukertaa,3.31,/@GODMODEMUSIC
7PI5bd2YNhg,No more PS5 controller stick drift?..,2 275 252 katselukertaa,0.14,/@JohnGlasscock
fjNrxydbmlE,"""Most"" | Susana Mendoza for Illinois Comptroller (w/subtitles)",550 552 katselukertaa,0.31,/@susanamendoza10
S9l-bCxZRPc,Mary Fay for CT Comptroller,397 725 katselukertaa,0.22,/@globalmarketing1557
S4Mrat8Sw_8,Mary Fay for  CT Comptroller -Tweed New Haven Airport,148 662 katselukertaa,0.25,/@globalmarketing1557
4yBkZmcYl2Q,Comptroller And Auditor General of india | Indian Polity by M Laxmikanth for UPSC - Lecture 62,108 001 katselukertaa,38.53,/@studyiqofficial
8iGZXUdHHP4,Go Leslie Munger for Illinois Comptroller,103 268 katselukertaa,0.33,/@lesliegeisslermunger1077
wjuekaXdwgs,CAG (Comptroller & Auditor General of India)  | Dr. Dharmendra Mishra,92 133 katselukertaa,8.39,/@vmouonline
AQdtc25jJfE,"CFO vs. Controller | What Are The Differences In Terms Of Tasks, Pay & Education",85 577 katselukertaa,9.01,/@TheFinancialController
4DBLZzNQ-c4,Indian Polity by Laxmikant- Chapter 49: COMPTROLLER AND AUDITOR GENERAL OF INDIA|CAG,81 102 katselukertaa,31.43,/@MAYURMOGRE
EzcLn6H-VtI,Its Happening Soon - IMF and USA Comptroller of Currency foreshadowing whats to come.  Get ready,78 526 katselukertaa,10.31,/@DarrenMooreJr
V6ytuZN3a_k,Ready to Lead | Brian Benjamin for Comptroller,75 930 katselukertaa,0.31,/@Benjamin-yn5ld
PgZsQASdhMY,A Month in the life of a Controller,67 969 katselukertaa,15.29,/@TheFinancialController
Dui2Va7IO4A,COMPTROLLER AND AUDITOR GENERAL,61 048 katselukertaa,28.06,/@KALYANSIROnlineIAS
C3gkXK9Z2hk,Mary Fay for Connecticut Comptroller,59 833 katselukertaa,0.25,/@globalmarketing1557
8RIrOZD92og,We Have Had Enough | Brian Benjamin for Comptroller,51 220 katselukertaa,0.31,/@Benjamin-yn5ld
