Video Id,Title,View Count,Length,Channel
fURwhooNZpo,How to configure cisco router for the first time (CCNA Level) | 2021,37 304 katselukertaa,18.15,/@ITSolutionsNetwork
BpqlM-gaqJs,🔵 Configure Meaning - Configuration Examples - Configure Definition -Configure Configuration,758 katselukertaa,6.35,/@iswearenglish
OBt21zoxIDc,How To Configure Gmail Account In Outlook 2007 ! Gmail Configuration in Microsoft Outlook 2007,26 katselukertaa,4.27,/@EMS_Solution
7dXBN8a-X2U,Cisco Switch basic Configuration | Cisco Switch Configuration Step by Step,666 728 katselukertaa,18.50,/@CiscoConfig
pV06kEk3r54,How to install and configure windows server 2019 NPS as RADIUS,21 078 katselukertaa,15.19,/@Liv4IT
BrfLQdfDbsQ,1.1.7 Packet Tracer - Basic Switch Configuration - Physical Mode,65 025 katselukertaa,50.04,/@romeroc24
U5DUt697tMQ,How to Configure Networks in ESXi Server,38 640 katselukertaa,9.45,/@HudaTechTalk
NVWVHiLx1sU,Configuring a Custom Linux Kernel (5.6.7-gentoo),114 053 katselukertaa,36.18,/@MentalOutlaw
69bT6bRM-LQ,Cisco Packet tracer Router configuration step by step,107 073 katselukertaa,19.30,/@NetworkEngineerStuff
J0EVd5HbtUY,Managing your .NET app configuration like a pro,72 315 katselukertaa,15.16,/@nickchapsas
DThTHSGYL64,Novastar NovaLCT Setup and Configuration Tutorial,41 547 katselukertaa,6.50,/@kevinringvideo
QKVBite1p3E,Configure Windows Server 2019 for Ubiquiti UniFi RADIUS Authentication,80 844 katselukertaa,20.39,/@thecybersecuritymindset
NWfuXl7YcWc,What is the role of Configure method ?,4 764 katselukertaa,1.38,/@interviewhappy
9WUjfUVBbIA,Configuring an MPLS Network from Scratch,32 352 katselukertaa,56.02,/@kwallaceccie
-YV9Y_YIDcI,Basic Router & Switch IOS configuration commands - CCNA beginner,123 503 katselukertaa,20.54,/@danscourses
V1Zceq02vMA,VE Configure 3 basic | Victron Energy,329 098 katselukertaa,5.38,/@VictronEnergyBV
9Po54nRgmN4,How To Configure LACP on a FortiGate | With Cisco and UniFi Switches,14 732 katselukertaa,15.13,/@KBTrainings
tDQ682bsEOY,Configuring Cisco Trunk Ports - How to configure Trunk Port between Cisco Switch,113 014 katselukertaa,14.28,/@CiscoConfig
pddYuixPBJ0,How to Configure an IP Address,234 658 katselukertaa,5.14,/@trainsignal
