Video Id,Title,View Count,Length,Channel
MtuRTtN7ktw,How Is Pet Otter Anber Conserved?,1Â 834Â 768 katselukertaa,1.00,/@tiutac
GHCc9b2phn0,Is energy always conserved?,297Â 255 katselukertaa,6.04,/@physicsgirl
cQQuEvSTXqA,Is Mass Always Conserved?,244Â 498 katselukertaa,6.39,/@TheActionLab
vPjMC3_cPWI,Tubble Gum Gelli Conserved ğŸ¤¯ #tubblegum #lovesweetslife #viralgum #gum,238Â 951 katselukertaa,0.11,/@lovesweetslife
y3ro29uBIVc,Relocating a humungous five-legged elephant to a Conserved Forrest. Part 1,77Â 467 katselukertaa,7.33,/@THEWILDELEPHANT
hY-1j_Jn4xU,"Joe Biden (In 2023) ""By 2020, We Will Have Conserved 30% Of All The Lands And Waters""",37Â 815 katselukertaa,0.17,/@GOPWarRoom
-p3msL1P8bw,ENERGY IS CONSERVED Physics Song - Conservation of Energy,30Â 333 katselukertaa,4.35,/@rjdepta
jZaSFaOxWr4,"Summer Is Starting To Bite, Have I Conserved Enough Maize Silage?",18Â 399 katselukertaa,13.54,/@TheOnceADayFarmer
dHrflL6yNCw,ClustalW |Result Interpretation & Conserved Regions Prediction| Lecture 3 Part 2 Dr. Muhammad Naveed,17Â 711 katselukertaa,6.41,/@Prof.Dr.MuhammadNaveed
TIwT5lRBLkI,Joo Chiat Freehold Conserved Terrace Tour | Singapore Landed Property | Ruth Dick Landed Property,15Â 663 katselukertaa,6.15,/@ruthdickproperty
_402ARiZ9V4,World jigsaw puzzle - glued using puzzle conserved,14Â 932 katselukertaa,0.38,/@madfella65
7Z1jxoGkevs,Conserve meaning in Hindi | Conserve à¤•à¤¾ à¤¹à¤¿à¤‚à¤¦à¥€ à¤®à¥‡à¤‚ à¤…à¤°à¥à¤¥ | explained Conserve in Hindi,14Â 218 katselukertaa,0.35,/@WorldwideSpokenEnglishByVS
lvyyxkjwSCg,Introduction and Conserved Charges in Classical Electromagnetism (Lecture 1 of 10),10Â 019 katselukertaa,1.52.05,/@highenergytheorygroup6275
Ou68VwzOBB8,Angular Momentum conserved for particle moving under central force,8Â 596 katselukertaa,2.11,/@Physicsmee
XvOWU1qAd_U,DISCUSSION HOUR  3RD FEBRUARY  2023 | TOPIC : HOW CAN LOKTAK LAKE BE CONSERVED ?,8Â 392 katselukertaa,1.06.29,/@istvdiscussionhour
70mt7bozJb8,Conserving ICCAs - territories of life | ICCA Consortium,8Â 214 katselukertaa,20.12,/@ICCAConsortium
lkRsmjV1mfE,Angular momentum is not conserved,7Â 693 katselukertaa,2.15,/@baurresearchcc23
X3QI3X9t8pQ,Inside A $5.3M Rare Conserved House in District 9 | Singapore Landed Property Home Tour,7Â 303 katselukertaa,7.20,/@HomeCentralsg
Y-0aklHBBi8,Wild Nagaland: Exploring the Community Conserved Areas,6Â 711 katselukertaa,4.13,/@journeysexplore6679
fnZWduc-IT8,"Our beautiful mother Africa is where life began. Nature preserved, tradition conserved, joy is pureğŸ’•",6Â 344 katselukertaa,0.16,/@afrikanheritage99
