Video Id,Title,View Count,Length,Channel
cawbXRUAph8,CONTENTS,119 699 katselukertaa,27.23,/@Freeskatemagazine
gxTNbc5WkSQ,How to Make Table of Contents in Word,785 655 katselukertaa,8.21,/@KevinStratvert
K6DSMZ8b3LE,Seven Continents Song,47 745 492 katselukertaa,2.03,/@Hopscotchsongs
vfAdcbOUc0Q,How to make a table of contents in word,697 956 katselukertaa,1.36,/@karinaadcock
0cN-JX6HP7c,Creating a Table of Contents in Microsoft Word,4 918 947 katselukertaa,7.06,/@techteachersandstudents
Actb1MUqbd0,How to Insert Table of Contents in Word | Microsoft Word ⏩,196 930 katselukertaa,2.14,/@Quick_Look
9Tnux7K3MOQ,Content,9 966 765 katselukertaa,1.37,/channel/UC81hVmI5eEBIt3s3HQpJd_w
cbKYRi_PvjI,How To Create A Table Of Contents In Word - Effectively Insert And Customize Your TOC,230 426 katselukertaa,10.14,/@SharonSmith
ZdUQUJa4NZg,"Write, Record, and Edit Video Content Using Powerful AI | BIGVU Webinar",280 katselukertaa,51.11,/@BIGVU
j4G-pew6n2U,AMBAUKA - Contents (amb El Pot Petit) (videoclip),2 043 475 katselukertaa,3.36,/channel/UCkbrYK7kel3WIW1ZSsxNvoQ
xcjqc10fVgs,Informational Writing for Kids - Episode 7: Making a Table of Contents,404 416 katselukertaa,1.52,/@TeachingWithoutFrills
DrpH44YDHNI,how to find Content Ideas for youtube,4 552 052 katselukertaa,0.27,/@drktalks
-bQpsCMgCkA,How to Create Consistent Content on Social Media (100 posts in 30 days!),229 355 katselukertaa,23.18,/@VanessaLau
-HrfqfDyqCQ,How To Become a Content Creator - Complete Beginner's Guide,144 628 katselukertaa,7.43,/@Howfinity
MLbTm5Nt5yY,How to create a table of contents in Microsoft Word: APA 7th edition,262 162 katselukertaa,22.43,/@smartstudent_official
sn39D0SpFnI,How to insert page numbers and a table of contents using Microsoft Word 2010?,368 047 katselukertaa,0.57,/@ulrikahedlund
2kPe-2lv2Is,We All Got Tricked into Content Addiction,911 645 katselukertaa,10.16,/@HorsesOnYT
131OX_YHkwo,How To Make Content Consistently | New Media Academy,314 885 katselukertaa,15.36,/@garyvee
wcUGMgabJx0,How to insert Table of Contents in Word (Step by Step) | Microsoft Word Tutorial: Table of content,1 741 944 katselukertaa,8.05,/@pickupbrain
pQWPF9C5jeU,Automatic Table of Contents in APA 7th Edition Style,54 319 katselukertaa,7.01,/@brentward1831
