Video Id,Title,View Count,Length,Channel
NYIwoGIpXNI,"+18, Swiss Government Supported Body and Freedom Festival, contains public nudity",205Â 725Â 839 katselukertaa,8.05,/@OzgurCagdas
8xGC2Uu2KkA,"Surprise eggs contain So cute ducklings, koi fish, crabs, catfish, Freshwater shark, goldfish, eel",171Â 058Â 144 katselukertaa,2.40,/@AnimalHT
-0lyuOhrQ10,"Monkey Baby Bon Bon and puppy open Surprise eggs contain So cute ducklings, koi fish, goldfish",82Â 529Â 882 katselukertaa,1.41,/@AnimalHT
X9Tx48Hw9x0,"Monkey Baby Bon Bon open Surprise eggs contain ducklings, koi fish and swims with puppy at the pool",29Â 566Â 292 katselukertaa,2.15,/@AnimalHT
Nnoe48557J0,Monkey Baby Bim Bim and puppy open Yummy Kinder Surprise Egg contain toys and chocolate,20Â 251Â 159 katselukertaa,2.13,/@BabyMonkeyAnimal
L4UQXMaBhdo,Monkey Baby Bon Bon and puppy open Yummy Kinder Surprise Egg contain toys and chocolate,16Â 879Â 274 katselukertaa,2.13,/@AnimalHT
q3r_Y9MWNDs,Do Vapes Contain Toxic Metals? | The Real Cost,16Â 438Â 794 katselukertaa,0.31,/@TheRealCost
kbVFR3vqS3E,"Gold panning blacksand, does it contain gold?",10Â 556Â 228 katselukertaa,0.54,/@TheSluicers
oDyyRe4Hu3w,"Canteeni Mandeer || Ravneet || Baddi University Of Emerging Sciences & Tech, Baddi || New Episode",8Â 323Â 286 katselukertaa,46.40,/@mhonecanteenimandeer
DhsP1Xj2xVQ,This little guy couldnâ€™t contain his excitement at kindergarten graduation â¤ï¸â¤ï¸,8Â 227Â 229 katselukertaa,0.26,/@MajicallyNews
TedbvUO3_BM,Philza can't contain his laughter,7Â 493Â 243 katselukertaa,0.29,/@Canooon
xHRiYJigl-I,I tried to contain myself but couldn't resist. #learnfromkhaby  #comic #comedy,7Â 190Â 544 katselukertaa,0.59,/@khabylame
1MFurJmxNCs,Secure. Contain. Protect.,7Â 131Â 850 katselukertaa,3.09,/@displace
O5FhyDt6_cs,Coca-Cola used to contain cocaine,6Â 301Â 147 katselukertaa,1.00,/@HenryBelcaster
G4Doz6yrEUQ,Cooking with Technoblade! (contains swearing),6Â 011Â 547 katselukertaa,3.35,/@Technoblade
uoKU2hBPU-Q,Edward can't contain his glee ğŸ¤­ #twilight,5Â 871Â 679 katselukertaa,0.38,/@TheDollarTheater
VZCrK6rJNV4,Flags Contain Themselves,4Â 736Â 317 katselukertaa,0.23,/@fIags
9GpRks8sBag,SCP-4217 Contain the Bismarck! (SCP Animation),4Â 536Â 521 katselukertaa,11.14,/@TheRubber
Ztiva93aivY,Mischievous Louis Can't Contain Himself at Jubilee Pageant,4Â 185Â 960 katselukertaa,2.25,/@royalchannel
0fEHsqHGdek,My New Phone Contained an SCP Monster! - Garry's Mod Gameplay - Gmod SCP Survival,3Â 974Â 265 katselukertaa,12.16,/@SpyCakes
