Video Id,Title,View Count,Length,Channel
YK6Nsx9o9gc,Democrat CNN Contrib Race-Shames Black Republican,169 796 katselukertaa,3.01,/@RaheemKassam
37KJtNGpZI0,SOLVED : ERROR: Could not find a version that satisfies the requirement python-opencv,125 410 katselukertaa,1.29,/@problemsolvingpoint
dqlMAOOCxuc,Member Contrib: How to Build in Minecraft - 2 : Dynamic Builds: With Mexxy!,117 342 katselukertaa,5.31,/@VoxelBoxVideos
nN9SJfK0iIo,Node-RED with Modbus Tutorial (part 1),81 181 katselukertaa,23.22,/@leovarela7679
WYbkc4C4s3I,Member Contrib: Reflection - A Minecraft Cinematic,77 079 katselukertaa,3.29,/@VoxelBoxVideos
0WsofBaXtTo,Member Contrib: How To Build In Minecraft: With Mexxy!,74 670 katselukertaa,13.50,/@VoxelBoxVideos
vMt9RLP8B3E,"Pagbabayad ng PhilHealth contrib, pinatitigil dahil malaki naman umano'ng kita | Frontline Pilipinas",56 311 katselukertaa,3.55,/@News5Everywhere
W5AS4abNbBU,"Member Contrib: ""I Love The Voxel Box"" - Sanelmax.",39 088 katselukertaa,1.16,/@VoxelBoxVideos
gtr0-yrISOc,Member Contrib: Wellstarbursts Guide to VoxelSniper Terraforming Basics,34 220 katselukertaa,5.01,/@VoxelBoxVideos
hJJeXhCB-fo,Member Contrib: VoxelTours - Dragons' Canyon,31 039 katselukertaa,7.29,/@VoxelBoxVideos
rtOUVMGfFSM,Cannot Import Django in Vs Code Solved | vscode python import could not be resolved| 100% working,26 457 katselukertaa,1.02,/@techcoffeebreak
_P6ZqWc4n3I,Upated to discuss Nod-Red-Contrib-Aedes broker - originally about  Node-Red-Contrib-MQTT-Broker..,23 616 katselukertaa,8.36,/@PeterScargill
hI-lwd0CJBw,Member Contrib: More VoxelGadget Examples!,21 757 katselukertaa,2.47,/@VoxelBoxVideos
i3TiZiuNofM,node-red-contrib-deconz,17 264 katselukertaa,3.04,/@dunkle220
GY0j9-8TCAU,Member Contrib: VoxelTours- Zah,17 109 katselukertaa,2.35,/@VoxelBoxVideos
RrtDSNMubpI,Member Contrib: PiP Studios - Moving In!,14 787 katselukertaa,4.49,/@VoxelBoxVideos
gi8V6hoq3J8,How to install opencv for python with Contrib packages | Simplest method,14 097 katselukertaa,7.24,/@makeitnow_in
xDizVoYTmic,Fix AttributeError: module 'tensorflow' has no attribute 'contrib' | Tensorflow object detection api,12 315 katselukertaa,1.18,/@brokeunistudent2474
nQ6i352FkEE,No module named 'tensorflow.contrib',11 299 katselukertaa,1.46,/@techconclave6201
D7EN673l6zU,Dir.trib.Tributos - I: Parte 9 .1 (Contrib.Especiais - 1),10 822 katselukertaa,6.02,/@cursoforumtvdicas
