Video Id,Title,View Count,Length,Channel
djTNUp4XIRo,Metric System Conversions Song | Measurement Song for Kids,2 383 415 katselukertaa,2.23,/@NUMBEROCKLLC
kOJFSH_Bn9U,"Metric Units of Length | Convert mm, cm, m and km",1 345 628 katselukertaa,5.35,/@MathwithMrJ
ZNX-a-5jGeM,Math Antics - Intro to the Metric System,1 760 451 katselukertaa,10.51,/@mathantics
eK8gXP3pImU,Converting Units With Conversion Factors - Metric System Review & Dimensional Analysis,1 127 082 katselukertaa,38.41,/@TheOrganicChemistryTutor
lc99if-_Lh8,Two-step Unit Conversions,22 638 katselukertaa,2.41,/@TheHowToScholar
CKjdsjPmp4s,Everyday English Conversions Made Easy,127 649 katselukertaa,15.01,/@easyenglish551
HZ9weUkSdoY,Understanding Conversion Factors,677 253 katselukertaa,10.14,/@tdewitt451
hQpQ0hxVNTg,Unit Conversion & Significant Figures: Crash Course Chemistry #2,4 018 969 katselukertaa,11.24,/@crashcourse
R00HJXPtEGE,Shortcut for Metric Unit Conversion,1 260 988 katselukertaa,3.11,/@MrElliottMccarthy
id-eOK9e_O0,"One Man, One Van, One Week - Peugeot Boxer Conversion",15 564 katselukertaa,27.30,/@VanologyConversions
TY4Yoyur3X4,"metric unit conversions shortcut: fast, easy how-to with examples",461 735 katselukertaa,5.47,/@CrashChemistryAcademy
7N0lRJLwpPI,Converting Units with Conversion Factors,1 088 729 katselukertaa,12.46,/@tdewitt451
w0nqd_HXHPQ,Unit conversion within the metric system | Pre-Algebra | Khan Academy,1 068 451 katselukertaa,9.17,/@khanacademy
0N6SmKVWZdI,Metric Conversions Made Easy | How Solve in Metric Conversions w/ Dimensional Analysis (Vid 1),396 051 katselukertaa,15.12,/@RegisteredNurseRN
DIMXdS4E-U4,A Budget Van without it being a Budget Build - Peugeot Boxer,7 447 katselukertaa,26.04,/@VanologyConversions
HRe1mire4Gc,Unit Conversion the Easy Way (Dimensional Analysis),1 102 733 katselukertaa,6.14,/@ketzbook
nJheKNA8C8M,AMAZING and NAIL BITING World Cup Conversions!,111 065 katselukertaa,6.58,/@WorldRugby
PX0euqxEcnc,DIY Camper Van Conversion. Full Build Timelapse,21 186 683 katselukertaa,18.15,/@FurtherFabrication
AMGRQR_ANCU,How To Convert From Km/hr to m/s and m/s to Km/hr - With Shortcut!,695 176 katselukertaa,10.43,/@TheOrganicChemistryTutor
T8WZU1QqSgI,"Learn Metric Units & Unit Conversions (Meters, Liters, Grams, & more) - [5-8-1]",210 399 katselukertaa,32.54,/@MathAndScience
