Video Id,Title,View Count,Length,Channel
H4cNK8fzSYU,Is the MINECRAFT Cookbook any good?,567 289 katselukertaa,11.46,/@MisoHungrie
7GIXtim-GKU,We Tried The Minecraft COOKBOOK In Real Life...,736 725 katselukertaa,17.59,/@Sapnap
ugo_3ln8xLc,Super Why - The Cookbook (Full Episode),506 034 katselukertaa,24.02,/@EmmanuelMora
g5zaXeAbT4s,Is THE WALKING DEAD Cookbook any good?,16 028 katselukertaa,10.37,/@MisoHungrie
yCeIbVh6omg,7 Cookbooks I Can't Live Without... (For Beginners),16 103 katselukertaa,6.05,/@OmnivorousAdam
J9kggTZ4xB4,Is the ADVENTURE TIME Cookbook any good?,226 460 katselukertaa,10.22,/@MisoHungrie
Uk5WelP5FDA,Is the AVATAR Cookbook any good?,726 850 katselukertaa,12.01,/@MisoHungrie
SdYWupACSQQ,Is the FALLOUT Cookbook any good?,1 335 423 katselukertaa,7.43,/@MisoHungrie
bdiq78jxW9U,Is the ONE PIECE Cookbook any good?,3 520 471 katselukertaa,10.34,/@MisoHungrie
aYjegYZgjS4,Is the BLACK PANTHER Cookbook any good?,23 347 katselukertaa,10.56,/@MisoHungrie
niAHnEkvbdg,Top 5 Types of Cookbooks to Avoid,11 653 katselukertaa,5.29,/@cookbookreviews9848
27Wi3mLPFrY,The Top 3 Cookbooks for Beginners,74 527 katselukertaa,6.41,/@OmnivorousAdam
lrJWSrvPdN8,Is the NINJA TURTLES Cookbook any good?,130 841 katselukertaa,11.45,/@MisoHungrie
QwZekX4YMeY,HOW TO MAKE A COOKBOOK,77 585 katselukertaa,11.39,/@gazoakleychef
xKeLz39HzKY,"I Signed 5,000 Cookbooks",2 461 984 katselukertaa,0.20,/@NickDiGiovanni
DEBfE_itBHA,Is the NECRONOMNOMNOM Cookbook any good?,200 721 katselukertaa,14.56,/@MisoHungrie
DQJKCoCOY6A,Cookbook Review: An Unapologetic Cookbook by Joshua Weissman,22 581 katselukertaa,6.41,/@cookbookreviews9848
E29bEt8h_oc,Kalu Dodol | Wild Cookbook,7 395 252 katselukertaa,0.58,/@WildCookbook
