Video Id,Title,View Count,Length,Channel
mqWq_48LxWQ,Mike Posner - Cooler Than Me,108 963 617 katselukertaa,4.36,/channel/UCTaevJgpY78By0ELxeJmQpA
jMBHj5fChYg,Cooler vs Everyone (Super Smash Bros. Z Animation),92 751 katselukertaa,8.04,/@KingOfSkill
1E5XfkgZsfY,How This Norwegian Company Is Reinventing The Cooler | Huckberry Gear Lab,17 735 katselukertaa,7.49,/@Huckberryco
l-TaaIQ2_1A,Mike Posner - Cooler Than Me (Lyrics),18 399 221 katselukertaa,3.34,/@7clouds
A3pJB4m713M,Lucky Luke - Cooler Than Me (Official Video),25 103 414 katselukertaa,3.28,/@LithuaniaHQ
u6xRSafBV8o,Ken Ashcorp - 20 Percent Cooler,10 352 654 katselukertaa,3.13,/@KenAshcorp
__73VxjkjaE,What if COOLER Turned GOOD? (Full Story),1 186 990 katselukertaa,1.55.27,/@SaladSaiyan
lArAqdSd1LU,What If Cooler was Canonically Good? Part 10,22 104 katselukertaa,18.20,/@MasakoX
iNj5UIvDc1A,"L7 ""Cooler Than Mars""",6 271 katselukertaa,3.39,/channel/UCvNz35FxAbo7aRFWRRZsFVA
BZstUJQ2QLg,DragonBall Z Abridged MOVIE: Revenge of Cooler - TeamFourStar (TFS),23 486 447 katselukertaa,18.40,/@TeamFourStar
J0Nel351sbg,Best Hard Cooler 2023? 28 Cooler ICE CHALLENGE Tells All!,609 531 katselukertaa,22.28,/@theoutdoorempire
OULB8fGBJI0,How Strong Would Black Cooler Be?,87 045 katselukertaa,12.02,/@Chuck
C8yC02d7UZY,DragonBall Z Abridged MOVIE: The Return of Cooler - TeamFourStar (TFS),20 572 625 katselukertaa,18.15,/@TeamFourStar
fMwgXcoJFow,YETI Roadie 24 vs Budget Everbilt Cooler (24hr Ice Test + Drop Test + Review),692 419 katselukertaa,9.26,/@slickdeals
QwfwI5kjBcE,The History of Cooler Explained,782 384 katselukertaa,10.54,/@Geekdom101
6FBDTA79lo8,Tutorial on air cooler,262 777 katselukertaa,1.02,/@littlemore_zanzibar205
IwCKYZWn9-4,Which Large Cooler is the Absolute Best?,276 207 katselukertaa,6.57,/@AmericasTestKitchen
TspKL_RZVD0,REVISITING THE TRUE RULER OF THE UNIVERSE! LF COOLER STILL COOKS!  | Dragon Ball Legends,119 150 katselukertaa,23.49,/@Raiyuden
mOYNAeV1QHI,How This Cooler Became a $13.2 Million Disaster,62 084 katselukertaa,18.12,/@AnomalyDocs
ijISYwhs-f4,Cooler Final Form Vs. Goku!,3 148 275 katselukertaa,3.08,/@LordPrinceCooler
