Video Id,Title,View Count,Length,Channel
nrkMd4wFk9o,HOME DECORATING TIPS || STYLING IDEAS || MY GO-TO DECORATING TIPS FOR A HIGH-END SPACE,249 064 katselukertaa,10.39,/@jennapierce
DGKeavzcBlY,New! DECORATE WITH ME || STYLING NEW DECOR || CLASSIC HOME DECOR || DECORATING IDEAS AND INSPIRATION,25 775 katselukertaa,9.36,/@BrittneyBlane
0DX_yOThZFA,Get Your Home Fall-ready With These Fall Diy Decor Ideas On A Budget,3 236 katselukertaa,27.42,/@PattiJGood
a9Sg9TWDd38,FALL DECORATING IDEAS || DECORATING FOR AUTUMN || FALL DECORATE WITH ME || AUTUMN STYLING TIPS,27 281 katselukertaa,16.19,/@jennapierce
LHPtjvDwrTg,SMALL ENTRYWAY FALL MAKEOVER & DECOR STYLING IDEAS | DECORATE WITH ME,10 095 katselukertaa,17.48,/@SimplyRHome
lPm0WoyUI-A,NEW🍁 Warm & Inviting Fall Front Porch | Outdoor Decorating Ideas For Autumn | Decorate With Me,4 369 katselukertaa,15.02,/@The2Orchids
UAOuRzUvyNQ,FALL DECORATE WITH ME 2023 | home decorating ideas - neutral fall decor 2023 | fall kitchen decor,19 653 katselukertaa,16.47,/@LaurenMidgley
pvLipZ-ACWE,10 BEST AMAZON HOME DECOR + HOUSEHOLD MUST HAVES 2023,152 760 katselukertaa,10.20,/@KristenMcGowan
o4sqqw_C2hY,New Fall Decorating Ideas | Simple Elegant Home Decor Ideas + Tour,6 125 katselukertaa,10.25,/@decoratingwithbarbara8125
S7HC98uDB0M,TARGET SHOP WITH ME FALL 2023 | NEW HOME DECOR + FURNITURE,114 088 katselukertaa,15.50,/@KristenMcGowan
5pmoutM0FmM,VINTAGE + THRIFT SHOP WITH ME | HIGH-END HOME DECOR ON A BUDGET,133 082 katselukertaa,14.36,/@KristenMcGowan
5k8tvTv7NRs,10 BEST AMAZON HOME DECOR + HOUSEHOLD MUST HAVES 2023,389 130 katselukertaa,13.09,/@KristenMcGowan
gsSx5NfoI64,Decor Bhai OP Shayari ⚡🔥 Watch Till End 🤩  #shorts  #shayari,2 727 211 katselukertaa,0.17,/@DecoRGaming
f-seyqb7gLU,🍁 New! FALL DECORATE WITH ME | 2023 FALL DECORATING IDEAS | COZY FALL DECOR IDEAS 2023 ~ PART 1,55 246 katselukertaa,19.28,/@BrittneyBlane
CePIBAsI4c0,SPRING HOME TOUR 2023 | COZY HOME TOUR | COTTAGE STYLE | SPRING DECOR | HOW TO STYLE YOUR HOME,17 222 katselukertaa,10.20,/@AdventuresinDecorating
XsEJqzTycHU,10 REASONS YOUR HOME LOOKS CHEAP | INTERIOR DESIGN MISTAKES,312 390 katselukertaa,11.53,/@KristenMcGowan
RlmrZE5or98,As Seen On TV | Simply Straight Brush | And Some Home Decor Finds,7 668 katselukertaa,14.17,/@TraditionsByTheSeasons
viIfJYxBkvY,*HIGH END HOME DECOR FOR FALL* STYLISH DIY DECOR FOR LESS!,4 072 katselukertaa,19.06,/@LisaBurningham
jH4JU7Ihaa8,10 INTERIOR DESIGN STYLING SECRETS YOU SHOULD KNOW | DESIGN HACKS,101 046 katselukertaa,11.47,/@KristenMcGowan
CQ_zG8qzR2I,41 DIY IDEAS HOME DECOR | HACKS | UPCYCLING,987 256 katselukertaa,25.14,/@lotsofdots
