Video Id,Title,View Count,Length,Channel
aWVzZgbOVhw,Cracked glass design for Stairs #shorts,262 199 652 katselukertaa,0.14,/@vibler
QFg7ezN07Ow,Interactive Mini Golf Cupcake Design #shorts,141 161 292 katselukertaa,0.15,/@SoYummy
BDLNfRum4y0,Cracked Tempered Glass Staircase Design #shorts,119 785 350 katselukertaa,0.16,/@vibler
djlKjumEi-U,Dress Design #shorts #art #satisfying #youtubeshorts,112 688 544 katselukertaa,1.00,/@muktaeasydrawing
7RrKDXu0xxc,What do you think about this design?,98 813 204 katselukertaa,0.13,/@MaviGadgets
xZQ_Qw2IJOQ,"Designer (Full Video) Guru Randhawa, Yo Yo Honey Singh Ft. Divya Khosla Kumar | Mihir G | Bhushan K",93 841 915 katselukertaa,4.00,/@tseries
b815d6wU2XE,Strwaberry Step cake design #shorts #cake,82 378 578 katselukertaa,0.54,/@MukeshCoolCake
4uDdItqwylY,R Latter cake design #video #shorts #lattercake,76 606 956 katselukertaa,0.22,/@MukeshCoolCake
ur97CXWCD7s,New Fancy Doll Cake design #shorts #dollcake #doll,73 344 081 katselukertaa,0.59,/@MukeshCoolCake
W6IcdvP6pp0,Layered Frosting Flower Cupcake Design #shorts,70 028 567 katselukertaa,0.22,/@SoYummy
zP2jt_S4ZkI,How about the design of a car with anti-collision devices?,68 115 246 katselukertaa,0.08,/@3DVideoDesigns
459FjmLx-XM,CorelDRAW Graphics Suite | Designed to get the job done.,61 615 920 katselukertaa,0.30,/@CorelDRAWchannel
Ge09W9GXoi8,Fork easy beautiful mehndi design|| arabic henna mehandi designs #shorts,59 797 437 katselukertaa,0.36,/@uhmehandi
sSroH0LEfVM,I am genuinely so sorry it’s taken me THIS LONG to design this… #sportsbra #fashion #designer,59 534 553 katselukertaa,1.00,/@blogilates
YaYSdSXqwbY,"shaving blade,mehndi designs 😲😲🙈 unexpected mehendi designs #mehndidesign",53 435 490 katselukertaa,0.49,/@sudhamehndi0740
0zx_Bb9xxCk,FUNNIEST DESIGN FAILS EVER,49 672 844 katselukertaa,12.28,/@SSSniperWolf
qOMfG4o-8jk,We created a waterproof and shaped to a body backpack! Amazing design! 🎒 #woodmood #shorts,40 591 843 katselukertaa,1.00,/@Wood_Mood
3_36wr9ih_M,I Tried to Design 1 Room for 4 Kids ...but They're GHOSTS #shorts (credit: housedesign77),38 419 393 katselukertaa,1.00,/@LaurenZside
8l75Z8wil_U,"Jedi Mind Tricks ""Design in Malice"" feat. Young Zee & Pacewon - Official Video",37 612 306 katselukertaa,3.56,/channel/UC7_GyvwHQWruXTndYHy_Q3w
zHaUHlSubO8,Kids Give Their Parents a Wild New Hairstyle | Kids Design | HiHo Kids,35 054 823 katselukertaa,7.06,/@hihokids
