Video Id,Title,View Count,Length,Channel
miD_TWmdGIY,"When ""Asian"" Is a Difficulty Mode",54 990 635 katselukertaa,3.06,/@StevenHe
Gpfgh02qJ4I,What Makes A Good Difficulty Option?,386 693 katselukertaa,26.32,/@DesignDoc
9q1VAyTK3tU,"So I made an ""RNG"" Difficulty in Minecraft...",7 263 352 katselukertaa,11.58,/@Fundy
KUwg0gU-LkE,"Minecraft, But It's On Trillionaire Difficulty...",3 806 489 katselukertaa,12.48,/@Bionic
aJREzzF1iOg,Roblox Find the Markers BUT I Find Insanely Hard Marker!,5 070 043 katselukertaa,22.17,/@Elitelupus
A4_auMe1HsY,Difficulty in Videogames,15 647 728 katselukertaa,4.58,/@videogamedunkey
9xV7Lyui6SI,Can We Perfect Video Game Difficulty?,31 929 katselukertaa,35.53,/@Lextorias
gIrLt8d2KKE,The shame of reducing the difficulty,2 710 610 katselukertaa,3.52,/@VivaLaDirtLeague
PWZnenTQDB4,"When ""Asian"" is a Difficulty Mode: EMOTIONAL DAMAGE",37 808 606 katselukertaa,5.16,/@StevenHe
Hld36cKKcm0,"So I added a ""baby mode"" difficulty to Minecraft...",14 070 017 katselukertaa,10.42,/@Fundy
MY-_dsTlosI,Difficulty in Videogames Part 2,11 305 837 katselukertaa,7.10,/@videogamedunkey
Ekui3tG3Dy4,"When ""Asian"" is a Difficulty Mode 2",29 598 669 katselukertaa,5.08,/@StevenHe
5cUazFv-sKY,DIFFICULTY IN VIDEO GAMES,205 309 katselukertaa,8.40,/@TheMacroShow
e4lqaPaRWhM,"I Beat Fundy's NEW ""IMPOSSIBLE"" Difficulty in Minecraft (first try)",9 447 133 katselukertaa,22.12,/@WadZee
2jMmBh-Rjic,"Minecraft, But There Are Custom Difficulties...",6 784 382 katselukertaa,21.35,/@Bionic
9aZYdPSjT9A,Minecraft's Hidden Difficulty,1 427 634 katselukertaa,0.59,/@Nuttist
DbB5N4yvyxc,When You Switch Minecraft to Peaceful Difficulty,2 837 816 katselukertaa,0.29,/@reidboehm
-MW-ox9hrA0,Building A Level At EVERY DIFFICULTY!,314 283 katselukertaa,18.36,/@sdslayer100
edaR0XlfAHY,"""difficulty experiment"" 72% (World Record)",1 773 410 katselukertaa,1.02,/@KaiGuyGD
5Ao2B7HvFJA,difficulty experiment,4 858 741 katselukertaa,1.12,/@KaiGuyGD
