Video Id,Title,View Count,Length,Channel
P10p7ALXkcU,Dinosaur Song | CoComelon Nursery Rhymes & Kids Songs,387 863 611 katselukertaa,3.21,/channel/UCbCmjCuTUZos6Inko4u57UQ
AjBlobu-a7g,Dinosaur Songs | CoComelon Nursery Rhymes & Kids Songs,376 224 967 katselukertaa,17.14,/channel/UCbCmjCuTUZos6Inko4u57UQ
FtCslvCjZEY,Final Battle Scene | Jurassic World,336 096 401 katselukertaa,8.37,/@jurassicworld
Pjw2A3QU8Qg,The ants go marching one by one song | Ants at war,335 902 305 katselukertaa,4.11,/@turtleinteractive
YQX7JYQjDOQ,The BEST of Dinosaurs,271 091 291 katselukertaa,56.32,/@DinosaursShow
izjXKA7CSbg,Ten Little Dinosaurs | LBB Kids Songs | ABC's Baby Nursery Rhymes - Count with Little Baby Bum,208 861 060 katselukertaa,2.17,/channel/UCKAqou7V9FAWXpZd9xtOg3Q
H96J5YEZQU4,Vlad and Niki PAW Patrol Dino Rescue Mission,169 352 701 katselukertaa,6.43,/@VladandNiki
-GfNEDs3ERw,Rexy and the Volcano - Funny Dinosaur Cartoon for Families,166 930 903 katselukertaa,8.57,/@PangeaNEW
TbeukBt8k_I,"Spiderman Indominus REX, Venom, Captain America, Iron Man  Dino Fight - Jurassic World Evolution",156 729 083 katselukertaa,9.07,/@maDinosaurs
TjmGTbNLj6Q,10 Little Dinosaurs | Kids Songs | Super Simple Songs,146 323 072 katselukertaa,2.13,/@SuperSimpleSongs
ObI4TcNa6E4,Peppa Pig Goes Shopping to Get George a New Dinosaur | Peppa Pig Official Family Kids Cartoon,144 735 000 katselukertaa,11.20,/@PeppaPigOfficial
u9ColmI3JbE,Baby T-Rex | Dinosaur Songs | Pinkfong Songs for Children,142 935 737 katselukertaa,2.07,/channel/UCcdwLMPsaU2ezNSJU1nFoBQ
c6D-11c5x8I,Pororo and Dinosaur Friends | Dinosaur songs | Kids Pop | Pororo Dino world | Nursery rhymes,124 551 055 katselukertaa,1.02.07,/@pororoenglish
0vW4_T-Wf6w,Carnivore vs Herbivore Dinosaurs | Dinosaur Food Matching Game,116 639 510 katselukertaa,16.38,/@HelloEverything
iCUNm33pa3k,Paint Animals Gorilla Cow Tiger Lion Elephant Fountain Crossing Animal Game,110 446 823 katselukertaa,9.30,/@funny3danimals
zBkjFGYKMhA,Rexy goes to Mama - Funny Dinosaur Cartoon for Families,108 240 917 katselukertaa,7.41,/@PangeaNEW
HNR4hKbSH7I,Not The Momma!,104 760 255 katselukertaa,1.34,/@polsey74
TlRHqE6VodQ,10 Little Dinosaurs #2 | Kids Songs | Super Simple Songs,104 032 322 katselukertaa,2.12,/@SuperSimpleSongs
9XQSFLMpn_c,10 Little Dinosaurs + More | Kids Songs | Super Simple Songs,103 541 369 katselukertaa,1.05.16,/@SuperSimpleSongs
yz5M8tJRq0Q,Mission: Rescue Blue the Dinosaur - LEGO Jurassic World - Mini Movie,98 407 764 katselukertaa,2.59,/@LEGO
