Video Id,Title,View Count,Length,Channel
IE0CRcAnDYs,"""Dream... and Shine Brighter!"" Full Show, Multi-Angle Version, Disneyland Paris 30th Anniversary",931 151 katselukertaa,22.44,/@MouseStepsWeekly
ALXKzjfWj8E,Disneyland Paris - Complete Walkthrough with Rides - 4K - with Captions,1 479 615 katselukertaa,3.02.24,/@ProWalks
cKXn7DdpBEw,Travel Day to Disney's Grand Californian Hotel at Disneyland!!,10 114 katselukertaa,25.53,/@PCDev
szkmAfNL8N4,"Jos arvaat hinnan, saat sen! (Disneylandissa!)✨",147 141 katselukertaa,19.42,/@Namikolinx
2Cb7s2U93pg,A Tour of Disneyland Park,1 632 382 katselukertaa,6.15,/@cowmissing
pFEnJUCXTwo,Disneyland Park 2023 - Full Walkthrough & Ride POVs [4K],497 563 katselukertaa,3.19.05,/@DocumentDisney
70sz4tzpNwI,[4K] FULL Magic Happens Parade 2023 at Disneyland Park! - Disney100 Years of Wonder Celebration,568 313 katselukertaa,19.22,/@InsideDisneyOfficial
TFMU7n8GhUk,Top 10 Fastest Rides at Disneyland Paris,682 538 katselukertaa,16.26,/@TPMvids
e1DNr4UowTM,Everything You Need to Know About Disneyland in 15 Minutes,48 046 katselukertaa,16.43,/@DFBGuide
dARo3XErXJg,[FULL SHOW] 2022 Main Street Electrical Parade 50th Anniversary - Disneyland,3 495 383 katselukertaa,15.58,/@themeparksteve1
u_5Mh0s11Yo,"Disneyland ATTRACTION GUIDE - 2023 - All Rides + Shows - Anaheim, California",208 660 katselukertaa,22.35,/@themepark101
HJHIJUREuXs,Ultimate Guide to the Best Food in Disneyland,150 354 katselukertaa,30.40,/@DFBGuide
wAol3WhcuTY,NEW! Ultimate Foodie Guide To HalloweenTime At The Disneyland Resort 2023!,181 725 katselukertaa,27.57,/@Magic_Journeys
KhMDH0wdtYQ,📅  A Day in Disneyland Paris: March 2023,164 856 katselukertaa,24.30,/@pixie-dust
qr55V1FM77Q,"Disneyland Halloween 2023 - Walkthrough, Snacks, Merch & Haunted Mansion Holiday [4K POV]",66 268 katselukertaa,48.47,/@DocumentDisney
c7jmBHbscXo,Disneyland's San Fransokyo OPENING DAY FULL TOUR  Plus SECRETS No One Knows,55 287 katselukertaa,17.47,/@provostparkpass
AZZO3WNte5k,The ULTIMATE Guide to Disneyland in 2023,241 853 katselukertaa,1.05.34,/@DFBGuide
j5pR4FZ0UH4,Fall Time Around Disneyland Ambience | Autumn Disneyland & DCA Halloween Ambience,1 041 285 katselukertaa,2.07.35,/@CinemagicParkAmbience
PPm5YPaBzE8,Disneylands Tiana’s Palace SNEAK PREVIEW Plus Food Review | Is This Now THE BEST Food At Disneyland,48 700 katselukertaa,10.55,/@provostparkpass
yLJdy8_HoSE,Big change at Disneyland dining locations around the park!  Good or bad for guests?,21 172 katselukertaa,18.58,/@FreshBakedDisney
