Video Id,Title,View Count,Length,Channel
FuBvy6Ms0bU,Doctoral Degree Tier List 2023 (Doctorate Degrees RANKED),37152 katselukertaa,16.56,/@ShaneHummus
uB7F2WWZmwQ,Why Earn a Doctoral Degree?,28357 katselukertaa,3.40,/@waldenuniversity
t9ilX6FEThQ,"Different Types Of Degrees Explained: (Associates, Bachelors, Masters, Doctorate, and Professional)",334986 katselukertaa,11.03,/@ShaneHummus
wEoM_gAUgkE,What Is The Difference Between PHD And Doctorate Degree | Phd Vs Professional Doctorate Degree,12876 katselukertaa,2.18,/@lifestyleconsultant6989
W_TZqCBR-L4,Doctorate Vs PhD - What's the main difference? I Dr. Rajeev Kurapati,11596 katselukertaa,4.25,/@BecomingFreeNow
UFFxYMXa6-k,"""I have a doctorate in music!"" 游꼣 #shorts",745335 katselukertaa,0.59,/@hellskitchen
Szj6uQnBdjo,Shaq earns doctorate degree,91607 katselukertaa,2.05,/@CBSNews
B7dTNUEq5Hw,Lecci칩n 4 C치tedra Doctoral 2023-2: Investigaci칩n en artes para la educaci칩n,339 katselukertaa,1.59.27,/@doctoradointerinstituciona3554
FBiICHs5Kpg,The NEW and different types of PhD | What's best for you?,15610 katselukertaa,13.28,/@DrAndyStapleton
gD1nNdA4Hcc,How to Wear Your Cap and Gown - Doctorate,57404 katselukertaa,2.24,/@HerffJonesTV
LtHxxH3M97A,Professional Doctorate or PhD?,22844 katselukertaa,6.05,/@BirkbeckVideo
QOYN8a-K_dU,TIMNEAT x BIGG SLEEEZZY - DOCTORATES (Official Music Video),57326 katselukertaa,2.29,/@6ixBuzzPremieres
wzAIf-ON1sY,Why I Wouldn't Get a Doctorate if I Could Start Over,22955 katselukertaa,12.48,/@PrivatePracticeSkills
XbcAdA03mmU,Blac Chyna Now Has a DOCTORATE,88485 katselukertaa,3.37,/@EntertainmentTonight
5e-mSV5hoCM,Daughter earns secret doctorate for hardworking mom | Humankind,5413888 katselukertaa,3.50,/@USATODAY
ki5Fu-j6tto,Is a doctorate worth it?,20169 katselukertaa,0.59,/@trevecca
i0AHzZcBcjU,Top 10 Doctorate Degrees,40702 katselukertaa,15.36,/@ShaneHummus
Yi6IlxFuytY,Grateful and Humbled : Receiving my Honorary Doctorate Degree 游꿉,26082 katselukertaa,2.20,/@HoneypreetInsan25
Blq-gAPvmqk,Is A DBA (Doctorate Of Business Administration) Respected?,15772 katselukertaa,11.20,/@R3ciprocityTeam
B6s8iAZhzo4,7 Best Doctorate Degrees 2023 (Best Doctoral Degrees),19385 katselukertaa,16.07,/@ShaneHummus
