Video Id,Title,View Count,Length,Channel
ir1lwPbbyog,Part 1 of 4 - Drainage pipe and start grading,37 711 katselukertaa,51.07,/@GCFD
JsV4fFDxM9s,How I Built a French Drain to Improve Drainage on Clay Soil,347 373 katselukertaa,12.51,/@AustinTexasGardening
6oBTFmZDPGQ,Best Drain Unclogging Compilation #60,166 589 katselukertaa,8.21,/@DrainerOfficial
DvgYIPbkvBE,Best Drain Unclogging Compilation #11,725 454 katselukertaa,9.56,/@DrainerOfficial
g27hGFiPObM,How to Install a French Drain that Actually Works!  DIY Project,991 343 katselukertaa,17.17,/@KomarProject
wPkMB7qlUSo,How to Build a French Drain Full Tutorial in Less than 10 Minutes [ Veteran Contractor Explains ],402 430 katselukertaa,9.29,/@FRENCHDRAINMAN
SdoXStuWeoE,What a Large Drain Opening Looks Like | Unclogging Drains Compilation #47,353 765 katselukertaa,8.16,/@DrainerOfficial
FmpcPi8uKlw,How to build your own drainage gully.,527 972 katselukertaa,4.49,/@BuildersFan
pJI3vcEX3n0,Drainage of a infected pressure ulcer on the toe (PART 1),1 003 380 katselukertaa,7.12,/@DrGeoffButler
9RQYN9fRcc8,Backyard Drainage Solutions | Ask This Old House,2 123 026 katselukertaa,2.41,/@thisoldhouse
fVW7Uj0EMzg,Drainage of knee bursitis,358 598 katselukertaa,4.07,/@DrGeoffButler
AzdcTcvd5HI,DIY Flat Yard Drainage Project | Yards With No Slope,835 761 katselukertaa,8.34,/@EverydayHomeRepairs
gn3hlG_XeNQ,"NDS Catch Basin Installation - Drainage Solutions, Inc.",522 571 katselukertaa,6.10,/@DrainageSolutionsInc
4v3R-d20vmI,FloPlast Underground Drainage System Installation Guide,24 353 katselukertaa,2.24,/@nbpltd
V17s91XeqvU,DIY French Drain | Cheap Yard Drainage Solution | pt. 1,3 834 040 katselukertaa,8.06,/@ThatTechTeacher427
y9on_qiLJxI,Drainage Assessment - Updated,29 261 katselukertaa,25.45,/@GCFD
35svdlqqsQU,Saturday Morning Drain unblocking with Jetter 1 and Jetter 2,18 305 katselukertaa,17.16,/@TheDrainUnblockers
ZUVRcSpfG2E,Planning your foul water and below ground drainage system - OsmaDrain,277 597 katselukertaa,10.29,/@WavinCoUK
DuEm5RC43tk,High capacity french drain Installed and shown in action,2 187 181 katselukertaa,27.17,/@GCFD
GNcoPY1K5nE,Biggest Mistakes to Avoid When Installing a Underground Downspout Drain [ Gutter Drainage System ],690 114 katselukertaa,4.54,/@FRENCHDRAINMAN
