Video Id,Title,View Count,Length,Channel
YUsmIWw29tU,Foam drain cleaner,197 824 652 katselukertaa,0.35,/@_vector_
_5hfE8ReeiI,Inter-Drain GP-Series V plow | laying trenchless field drainage | Van Damme Drainage,106 545 319 katselukertaa,5.00,/@Tractorspotter
kq2A61mSLFo,19 liters of fluid gets pulled from the belly - Ascites in liver failure,32 613 500 katselukertaa,9.58,/@edexitvideo
EUbIxVZEGbE,Drainage of Infected Epidermal Cyst,32 625 428 katselukertaa,7.33,/@DrGeoffButler
lBPLlladwY4,Well that's a very unique way to unclog a drain,30 098 895 katselukertaa,0.46,/@DrainerOfficial
FG0vP41ZhOA,GoPro | Drainage Ditch Kayaking Race POV | Stu Telfer #Shorts,30 657 196 katselukertaa,0.51,/@GoPro
MV9dOHRDb3c,"Draining Massive Flood By Unclogging Drains, Big Whirlpools",27 766 681 katselukertaa,18.02,/@post.10
hdQmzqKgtEc,Down Spout Catch Basin Installation to French Drain,23 756 030 katselukertaa,0.58,/@KomarProject
OvRsjzBFRn8,Awesome massive beaver dam opening by post 10 - Drain Unclogging,21 434 448 katselukertaa,0.46,/@DrainerOfficial
P23sroxQvxc,Look what they managed to pull out of this blocked street drain!,16 154 485 katselukertaa,0.36,/@DrainerOfficial
rr05LN4N614,Massive dam made of dirt getting finally opened! - Drain Unclogging,15 359 852 katselukertaa,0.41,/@DrainerOfficial
Gr0kqKFMfww,"Lymph Drainage Breast Massage Therapy Technique How To, Athena Jezik Psychetruth",13 056 646 katselukertaa,8.25,/@psychetruth
KenYSIseVNQ,Thick & Crusty Manhole Unblock #drainage #satisfying #diy,12 810 078 katselukertaa,0.59,/@TheDrainUnblockers
21GM5YYTOko,The Oddly SATISFYING Drainage Clearing Mystery Revealed #shorts,12 251 460 katselukertaa,0.47,/@JosephArning
Hy7DfcTLXew,INCISION AND DRAINAGE OF A CREAMY HEEL ABSCESS WITH DEBRIDEMENT OF ULCERATION 😭😭😭,10 349 312 katselukertaa,20.13,/@JAWSPODIATRY
xvdsi82EW2M,Draining Flooded Street With Major Amount Of Water Current,10 131 483 katselukertaa,7.54,/@post.10
jHEwhjnd-mw,Drainage of an Abscess along the Jaw Line,9 909 005 katselukertaa,4.32,/@DrGeoffButler
QA-wi0d7-Ro,"Self Lymph Drainage Massage by MassageByHeather.com in Louisville, KY",9 534 387 katselukertaa,7.16,/@massagebyheatherw
sCgcO0RK1n4,Underground Surprise Found Repairing Drain Tile,9 327 202 katselukertaa,0.54,/@TheFarmersLife
msRiD6VfG-M,Large Abscess on back Incision & Drainage. 48 hour and 4 week follow up. Patient is doing great!,9 306 203 katselukertaa,23.15,/@MrPopZitakaGregLynchDermPA
