Video Id,Title,View Count,Length,Channel
6N3LsN-PtIc,How To Draw A #FashionDoll #drawingtutorial #pidgindoll #drawing #fashionillustration #illustration,10 022 896 katselukertaa,0.31,/@PidginDoll
pYzwA-U_f3w,How Every Drawing Starts,607 694 katselukertaa,0.38,/@ProkoTV
u5_ITtiaPWk,Art drawing TikTok’s-New compilation #15,96 677 katselukertaa,10.10,/@qArtToker
8F1yd1S9B2Q,Art drawing TikTok’s-New Compilation # 2,687 565 katselukertaa,7.40,/@joytzs
bPrJZer9xAk,How to Shade A Drawing,824 549 katselukertaa,1.00,/@ProkoTV
Tkpujgcu9aM,Art drawing TikTok’s-New compilation # 5,116 852 katselukertaa,12.02,/@joytzs
W5WZusIVX-E,Figure drawing (Anatomy),2 075 474 katselukertaa,0.43,/@Chommang
3CDCXZizfiQ,Venus Fly Trap 🪴 Prints available in description #pidgindoll #venusflytrap #drawings #illustration,3 625 895 katselukertaa,0.26,/@PidginDoll
maZjeQHvYUo,Gesture drawing (Croquis),2 092 602 katselukertaa,0.52,/@Chommang
j9M2CaGGebg,Drawing Glowups part5 #shorts  #drawingglowups #chad,1 086 828 katselukertaa,0.55,/@TikTokeriART
_g4vy7H8bdo,How To Draw Stitch From Lilo And Stitch,9 585 127 katselukertaa,8.24,/@artforkidshub
0T40HR-87FI,How to Draw Mr Elephant Easy - Fun Easy Drawings #shorts,808 katselukertaa,0.56,/@funeasydrawings
o8mPAWerLGg,How to draw Pikachu  || Beginners drawing tutorials step by step || easy drawings step by step,1 749 604 katselukertaa,8.03,/@SayahArts
uFDX87NJ37g,How to Sketch #drawing,643 023 katselukertaa,0.34,/@ProkoTV
qgMjHe3SlJo,how to draw a shark 🦈😱 #art #youtubeshorts #shorts #@ArtwithBir_9 #drawing,4 668 663 katselukertaa,0.39,/@ArtwithBir_9
rS3j07fodhU,Easy circle drawing || Circle drawing for beginners || Pencil drawing in circle step by step,4 327 127 katselukertaa,11.12,/@SayahArts
y39S4af-VOw,Common Eye Drawing Mistakes,5 572 593 katselukertaa,1.00,/@ProkoTV
U7VhIxar7sw,Sometimes You Have To Make 100 BAD Drawings To Get 1 GOOD One,605 270 katselukertaa,1.00,/@ssavaart
Uigc8ofhDuo,7 Ways Simple Shapes Can Improve Your Drawings,103 029 katselukertaa,14.05,/@ProkoTV
_yl32byRdW4,Basic Figure drawing (Anatomy),548 904 katselukertaa,0.54,/@Chommang
