Video Id,Title,View Count,Length,Channel
zIgq9WatLWM,The Dukes of September - Lowdown (Live),13 099 285 katselukertaa,6.27,/@CraftRecordings
4HYqlNUjKnE,The Dukes of Hazzard (1979) What Happened To The Cast After 44 Years?? (A lot of changes),177 958 katselukertaa,7.04,/@LASTV86
YuD1X0eQ4fg,Who Would Be Monarchs of Germany? Part 2: Grand Dukes & Dukes,74 492 katselukertaa,21.28,/@UsefulCharts
KZRCvn96rPQ,Grand Dukes Desire | BL GCMM | 140-145k special!! | 1/2 | razeym,34 119 katselukertaa,19.49,/@Razeym
3q-wQKlKPiM,What Happened To The Noble Dukes Of England? | The Last Dukes | Timeline,785 469 katselukertaa,58.56,/@TimelineChannel
6R__cRZAVCA,The Dukes of Hazzard (7/10) Movie CLIP - Car Chase (2005) HD,11 724 221 katselukertaa,4.08,/@MOVIECLIPS
eII2K3hmSNE,The Richest Dukes In the World (2023),332 469 katselukertaa,10.59,/@Luxlogy
YHwnSj9EhkI,A Martini Fit for a Proper Gentleman | Duke's Bar: London's Best-Kept Secret | Kirby Allison,344 965 katselukertaa,38.03,/@kirbyallison
CuZJH5NMKUI,The Dukes of September - Reelin' In The Years (Live),1 088 951 katselukertaa,6.58,/@CraftRecordings
t_5guNuh0hU,The Last Dukes (British Aristocracy Documentary) | Real Stories,1 834 795 katselukertaa,59.00,/@RealStories
xYUVX20kiMw,DUKES - So Many Lies (Official Video),2 439 katselukertaa,5.53,/@DUKES-Hardrock-Berlin
w20XbWSTXNA,The Dukes of September - Peg (Live),231 989 katselukertaa,4.22,/@CraftRecordings
oj-oYZSQqHE,What Happened to The Dukes of Hazzard (1979-1985)?,32 092 katselukertaa,20.54,/@JoBloOriginals
67gig0f4HLo,The Dukes of Hazzard 1979 - 1985 Opening and Closing Theme,1 600 639 katselukertaa,1.34,/@TeeVeesGreatest
SBQXrhd7Cf0,What Does It Mean To Be A British Duchess Today? | The Last Dukes | Real Royalty,2 483 407 katselukertaa,58.59,/@RealRoyalty
RKkw653oilE,The Dukes Of Hazzard Season 7 Compilation,2 549 435 katselukertaa,14.42,/@DominicGrit
KDxJlW6cxRk,Duke Dumont - Ocean Drive (Official Music Video),745 719 141 katselukertaa,3.28,/channel/UCQCtrgPAP6pjxLeVFTKJfhA
NQmYB7_Z93Q,The Dukes of September - Takin It To The Streets (Live),1 775 832 katselukertaa,6.40,/@CraftRecordings
