Video Id,Title,View Count,Length,Channel
dSPiDFZmAnQ,DVRST - Dream Space,33 491 229 katselukertaa,2.52,/channel/UCJWUQibZ1DnBb4r4pCCmpGA
axi0vh1lngY,DVRST - Dream Space,9 038 392 katselukertaa,2.52,/@HFX337
LFdEwhzbl94,How to CCTV camera proper install ।। ewc ।। CCTV camera Planted,4 576 147 katselukertaa,24.17,/@electricworkcenter
0P8wR3Npkw0,CCTV Camera Complete Installation with DVR @ElectricalTechnician,3 009 841 katselukertaa,9.23,/@ElectricalTechnician
Ku34g8Zi6z4,How to connect CCTV Camera's to the Monitor Using DVR,2 997 411 katselukertaa,5.07,/@ItsFiveNow
hlJQQu2FT7g,DVR Bulls Feed Management !! DVR Bulls 16lakhs # DVRBulls #toneagri #onglebulls #shorts #ytshorts,2 310 709 katselukertaa,0.25,/@ToneAgri
7MRCMFNO4h8,Cómo instalar CÁMARAS y verlo desde el celular,2 077 023 katselukertaa,8.12,/@ElectrotecPE
IPqfzYF_l20,CP Plus DVR Ko Online Kaise Kare | How To See Live CCTV Camera On Mobile Through Router and Wifi,1 587 114 katselukertaa,5.29,/@NewComputerLink
DMpI3N50MbE,Network Setup on the DVR,1 487 062 katselukertaa,2.53,/@tvtradedave
08iNZ7oo0bg,I tricked toxic players into 1v1ing against a pro... (Gorilla Tag),1 431 732 katselukertaa,8.26,/@dvrdeda5720
rgatPUJmRXc,Difference Between DVR vs NVR | Which Is Better For You | Bharat Jain,1 337 026 katselukertaa,11.53,/@BharatJain
AUNpstk_DUs,DVR Bulls Farming | బెజవాడ నడిబొడ్డున కానూరు సెంటర్‌లో ఉన్న డీవీఆర్ బుల్స్ ఫామ్ హౌస్ ఇదే.! Tone Agri,1 317 275 katselukertaa,16.29,/@ToneAgri
C83f-K669-8,【VR店長】パ○ツ盗んだら犯罪者扱いされた件【Girls' civilization 2】,1 313 062 katselukertaa,4.41,/@Tencho_DVR
Zj-ioCe-tOk,Diferencia DVR y NVR Ventajas y Desventajas,1 289 527 katselukertaa,15.58,/@WebyServicios
9g-gjFPKHss,Connect CCTV camera to DVR using video baluns and UTP cable,1 273 108 katselukertaa,9.41,/@PoseidwnTech
KGfdTewF474,"Diferencia entre una cámara análoga, ip/wifi ¿Cual es la mejor?",918 882 katselukertaa,8.45,/@MUNDOSEGURIDADSMARTSYSTEM
3vwWu5R3dNg,Affordable cctv camera set for home & for shop || Hikvision CCTV combo set review & Installation,864 794 katselukertaa,15.56,/@BhargabVlogsReviews
g86UYnqH3XU,طــريقة توصيل ال DVR مع الهاتف و مراقبة منزلك في أي مكان في العالم,854 290 katselukertaa,5.39,/@electrohalim
fN5tJgKs-lY,como configurar dvr o nvr hikvision para ver cámaras  por celular actualizado  2019,832 537 katselukertaa,20.59,/@MICASASAC
zSI0e11W7q8,hikvision dvr password reset (ADMIN) account using SADP tool,818 642 katselukertaa,6.46,/@Techlogics
