Video Id,Title,View Count,Length,Channel
V8OnwJFNy7M,Simultaneous threading and drilling on hardened steels by EDT-TH[English Subtitles],6 603 katselukertaa,2.04,/@MOLDINOToolEngineering
IJJNQPVNH1k,What's the difference? EDT vs. EST,4 783 katselukertaa,1.23,/@sciestry8363
DClITxNNK_Q,HAWAIKI NUI - INSIDE EDT VAA,112 858 katselukertaa,13.45,/@ayel67
FquPhsxWotA,EDT | compression | LFSR patterns | decompressor,16 012 katselukertaa,20.56,/@electronicslearninggarage8881
KCoTeBni5As,What does EDT mean in time?,1 572 katselukertaa,2.30,/@AskAboutHEALTH
XjnyKNPXzu8,"Weekday Mass (Tuesday - 23rd Ordinary) - 8 a.m. EDT - Sept 12, 2023 - St. Joseph Catholic Church",42 katselukertaa,44.55,/@lawcocatholic
4WRfSD2_aYs,"Everything You Need To Know About Fragrance Concentration Levels - EDT, EDP, Parfum, & MORE",32 324 katselukertaa,8.24,/@BaldassarreFragrance
ChF8vtan0Gc,Eau de Toilette vs Eau de Parfum,844 306 katselukertaa,7.29,/@jeremyfragrance
p9HOSmikNlY,Apa beza perfume EDT dan EDP ?,45 433 katselukertaa,7.43,/@hidmanscent2745
0Cpjr16NIwY,EDT vs Конфигуратор – или зачем 1С меняет рабочую среду (курс  Профессиональная разработка в EDT),6 301 katselukertaa,11.37,/@Kursypo1C
8Rfuwn3QhDg,What Is The EDT3 (now the EDT DM)?,17 574 katselukertaa,4.28,/@HiperfireAdvantage
6jFhhCl1ffA,EDT Automotive engine decontamination machine review,1 852 katselukertaa,2.36,/@GarageWire
8DZ9TouKe7M,PSA: EST ≠ EDT ≠ ET (Timezones),24 184 katselukertaa,1.52,/@photonanim
tcH5hswA5aE,Perfumer Reviews 'Y' (EDT) - YSL,23 587 katselukertaa,4.57,/@AaronTerenceHughes
-skdQmetMjw,How To Do Density Training (EDT) w/ Kettlebells & Bodyweight To Build Muscle,5 744 katselukertaa,7.19,/@Luka-Hocevar
BO30YzD0L7c,AGCO's Electronic Diagnostic Tool (EDT),8 599 katselukertaa,1.39,/@agcocorp
