Video Id,Title,View Count,Length,Channel
g36jg5hEYo8,Vlad and Niki - new Funny stories about Toys for children,1 146 210 958 katselukertaa,21.34,/@VladandNiki
_EyZUTDAH0U,Travis Scott - BUTTERFLY EFFECT,426 195 316 katselukertaa,3.33,/channel/UCtxdfwb9wfkoGocVUAJ-Bmg
OeuMxlCmxZE,Big Domino Effect V2 #shorts,279 355 243 katselukertaa,0.33,/@Dominoeffectsimulation
zxtrcqzrNCs,Sound effects of Hungry shark! #beatbox #tiktok,271 687 358 katselukertaa,0.30,/@BeatboxJCOP
o8p0fzuzzjU,Summer Effect 🥵| #shorts | Haye Garmi | Amdavadi Man Ni Duniya | #AShortADay,214 219 468 katselukertaa,0.25,/@AmdavadiManNiDuniya
XYHze9M0z-s,Legend of Zelda Sound Effects (On Drums!),193 109 250 katselukertaa,0.22,/@JoshHarmon
n36IqbvZ8ZA,Cool Musical Sound Effects on Different Instruments #shorts,186 857 661 katselukertaa,0.56,/@JoePorterPercussion
w57PsMi69I0,Encanto Sound Effects (on drums),139 457 152 katselukertaa,0.27,/@JoshHarmon
nuckTcoZG4Q,The Chainsmokers - Side Effects (Official Video) ft. Emily Warren,131 995 161 katselukertaa,3.29,/channel/UCq3Ci-h945sbEYXpVlw7rJg
JxAMNzlUFFE,Domino Effect V10 The largest domino simulation on Real Footage,114 646 417 katselukertaa,0.49,/@IdanDavidAnimations
QeM7MSDzK0s,Super Neat Sound Effects from Different Instruments!,107 365 307 katselukertaa,0.55,/@JoePorterPercussion
bxzT4yDJkGk,Fun Sound Effects from Different Musical Instruments #shorts,86 431 799 katselukertaa,0.53,/@JoePorterPercussion
C1cMdXs6wG0,iPhone sound effect (acapella),84 065 024 katselukertaa,1.09,/channel/UC3mY2SKYhPjqImtBBXsR6_Q
uGRkI3WpLVE,Satisfying Simpsons Sound Effects,76 309 572 katselukertaa,0.21,/@JoshHarmon
hlWHL9tjnjk,Big Domino Effect,70 492 262 katselukertaa,0.41,/@Dominoeffectsimulation
5uHUVyy3rNw,Domino Effect - The largest domino simulation on Real Footage V4,64 981 597 katselukertaa,0.47,/@Dominoeffectsimulation
QHSpYF5097M,4 Best Matches Art Chain Reaction Domino Effect,61 961 609 katselukertaa,4.55,/@TheS
TPKQiO5vatc,Cocomelon Logo Effects Inverted Version,60 809 692 katselukertaa,1.04,/@CoolEffectsHub
Brw3iNVyRiY,Sugar Overload Effects. Part 2 #short #shorts #youtuber #fitness,59 184 534 katselukertaa,0.15,/@carlosreig
fufCUJEEHeE,Effect of banana on lemon tree propagation #shorts,58 722 398 katselukertaa,0.58,/@ShafikulGarden
