Video Id,Title,View Count,Length,Channel
WDetHC86Dgo,female orgasm | Female anatomy and biology,56 255 166 katselukertaa,6.31,/@DandelionMedicalAnimation
XB4S_e_sgUA,The female orgasm explained,34 282 293 katselukertaa,2.35,/@healthchannel
B3GRJGV9YNQ,The male orgasm explained,23 748 367 katselukertaa,2.02,/@healthchannel
n9kYyM2VkbY,3D Male Penis Orgasm Sex Medical Documentary,12 033 382 katselukertaa,19.54,/@RedsexshopAu
hpc2NjUAtOY,The Science of Orgasms,9 679 362 katselukertaa,2.45,/@AsapSCIENCE
ISflGq3cn7Q,Short track-Do you know what happens During sexual arousal inside the body? what is the clitoris?,8 699 139 katselukertaa,3.06,/@DandelionMedicalAnimation
ZYhZMsvBWSU,Sciences proves that ejaculating more often reduces your risk of CANCER?! A Urologist explains,6 573 094 katselukertaa,7.20,/@RenaMalikMD
zA3iQ1aR5IY,10 Questions With a Squirting Instructor,6 183 403 katselukertaa,8.39,/@VICE
RzwJdf6AlT4,Man who has suffered 100 orgasms A DAY for past two year - Daily Mail,4 480 155 katselukertaa,5.53,/@dailymail
L2chG0gyzhA,Johnny Sins Guide to: Last Longer in Bed and Beat Premature Ejaculation || SinsTV,4 185 387 katselukertaa,23.51,/@SinsTV
YOvHKSxxuYw,Erection and Ejaculation - 3D Medical Animation || ABP ©,3 963 398 katselukertaa,0.26,/@AnimatedBiomedical
GXrW_8ALE3s,The Time I Nearly Ejaculated While Performing a Play,3 758 219 katselukertaa,4.34,/@penguinz0
H1EhUE_81eo,You Will Never Believe What Women Actually Feel when They Squirt!,3 610 783 katselukertaa,4.17,/@RenaMalikMD
RGgxnhyZ_kw,Male Ejaculation,2 805 303 katselukertaa,4.03,/@sexplanations
FHCiTM20Fko,The Premature Ejaculation Coach (ft. @AnthonyPadilla) – Mini-Mocks,2 574 199 katselukertaa,2.55,/@ComedyCentral
XQT9pImh8a4,Masturbation Coach | VPRO Documentary,2 552 997 katselukertaa,12.41,/@vprodocumentary
z_AJV0fq6Ds,Psychological Facts About Human Body @Thinkus,2 293 482 katselukertaa,4.33,/@Thinkus
ELiNcRKt9po,‼️HOW TO COLLECT DOG SEMEN (start to finish detailed Instructions),2 239 042 katselukertaa,6.27,/@capttrugame7314
A_tl8fRr8Zo,Why it’s hard to go again... | The science of the Sexual Refractory Period,2 230 029 katselukertaa,9.37,/@RenaMalikMD
