Video Id,Title,View Count,Length,Channel
eNcclcihrJE,Company employs AI ROBOT as CEO of company - ‘The future!’,1 629 katselukertaa,2.30,/@GBNewsOnline
WUhyPrwyfFM,Employs | meaning of Employs,48 katselukertaa,1.13,/@DefinitionOfTheWords
I9FZxPZwIGE,This coffee shop employs all people with disabilities,3 889 katselukertaa,1.29,/@InTheKnowByYahoo
ngTlOJla6pE,My NoNNa's – Café Which Employs People With Special Needs,1 483 katselukertaa,1.45,/@danielfooddiary
ryd97INhRXk,Why Tristan Tate Employs His Children,2 214 447 katselukertaa,0.31,/@championstatus
rP9uXmFYCXo,7 SEO Secrets Every Successful Online Business Employs,12 358 katselukertaa,7.38,/@neilpatel
rRi71Zhpq-0,Employs,5 katselukertaa,2.08,/channel/UCCOG5mtQZIdndAVQ8km3zQg
GE4xKFxdF7E,"Jul, 2018: Rhenus Logistics employs EffiBOT as Smart flexible conveying solution",24 972 katselukertaa,4.01,/@Effidence
R1P1PFnOzbU,Employ Meaning,3 287 katselukertaa,0.28,/@SDictionaryEd
ht1H776xVWs,Who employs the person with the highest IQ?,4 katselukertaa,3.30,/@FunFact-ory
wip61zrjGZs,"Yes, they can: call center employs the disabled",5 150 katselukertaa,4.01,/@Israel
yhlqr9pYhig,F-15 Employs a StormBreaker smart weapon,104 997 katselukertaa,1.12,/@RTXCorporation
4429Q_F7g28,Which Company Employs the Most? Comparison,986 katselukertaa,2.31,/@KkData
i4xCL1AsApE,Married Man Employs Side Chick AS maid,87 037 katselukertaa,15.11,/@MociStudios
ThDBd2RHIb8,Meet the Haredi Serial Entrepreneur Who Employs 140 Ultra-Orthodox Women,10 694 katselukertaa,2.08,/@jewinthecity
0cytwYThmD8,Employs meaning in Hindi | Employs ka matlab kya hota hai,345 katselukertaa,1.07,/@WorldwideSpokenEnglishByVS
_mI7K7otc4g,Employs his mind as a mirror - Alan Watts,556 katselukertaa,0.44,/@TheCalmStationSpiritual
KarmBkmY2Tw,"XActRewards employs an international team with vision, ability, innovative thinking, openness",129 katselukertaa,5.23,/@pablo66ish
zT6GJEPm2hA,Video Logo for www.employs.com.au,9 katselukertaa,0.11,/@employsau3605
