Video Id,Title,View Count,Length,Channel
8PW3O2mqTn8,WhatsApp end-to-end encryption,47 991 492 katselukertaa,0.31,/@WhatsApp
zsjZ2r9Ygzw,Encryption: Last Week Tonight with John Oliver (HBO),14 020 626 katselukertaa,18.01,/@LastWeekTonight
1JWUIfUF4cA,Encryption ▶ FNAF GLITCHTRAP SONG,4 116 574 katselukertaa,3.59,/channel/UCHS0hTD4x-w5sUHxNhi6xiw
UA6k57p68Vk,Forget  App Lock ! Forget privacy and App Encryption Password in vivo Phones ! With Backup ? 2021,3 282 437 katselukertaa,6.35,/@TechGuruRahul
lvTqbM5Dq4Q,How Quantum Computers Break Encryption | Shor's Algorithm Explained,3 013 409 katselukertaa,17.31,/@MinutePhysics
S9JGmA5_unY,How secure is 256 bit security?,2 800 022 katselukertaa,5.06,/@3blue1brown
4IrPuhZk6V4,Money Man “Encrypted” Ft Sauce Walka Recorded in Houston @ 6:41 am Unmixed,2 521 587 katselukertaa,3.40,/channel/UCSHVQ3lgpeSbETMqKl8kcug
UtMMjXOlRQc,i created malware with Python (it's SCARY easy!!),1 777 243 katselukertaa,25.18,/@NetworkChuck
AQDCe585Lnc,Asymmetric Encryption - Simply explained,1 180 433 katselukertaa,4.40,/@simplyexplained
O4xNJsjtN6E,AES Explained (Advanced Encryption Standard) - Computerphile,1 137 743 katselukertaa,14.14,/@Computerphile
NuyzuNBFWxQ,7 Cryptography Concepts EVERY Developer Should Know,1 114 516 katselukertaa,11.55,/@Fireship
cy4LfKFd3ug,your status updates are end-to-end encrypted | whatsapp status end-to-end encrypted kya hai,1 068 397 katselukertaa,2.45,/@ratancreationofficial
scp5njXLjD0,What is Encrypt Device and Encrypt SD Card on android mobile | How to use ? Encryption | Decryption,1 038 568 katselukertaa,6.36,/@TechnologyGyan
zvI4cVGWJhM,A New Era of Personal Privacy with Default End-to-Encryption | WhatsApp,1 008 479 katselukertaa,1.01,/@WhatsApp
4zahvcJ9glg,The RSA Encryption Algorithm (1 of 2: Computing an Example),968 202 katselukertaa,8.40,/@misterwootube
lY0Iz0NpAoU,How To Remove BITLOCKER ENCRYPTION In Windows 10,909 479 katselukertaa,2.23,/@Tricknology
0IOzhDsQWwY,256-bit hardware encrypted drive | DataTraveler Vault Privacy 3.0,836 707 katselukertaa,0.28,/@kingston
JS4k6fOgK2Q,Your status updates are end-to-end encrypted | end -to-end encryption,739 762 katselukertaa,0.59,/@TechZaheer-sq9je
jkV1KEJGKRA,End to End Encryption (E2EE) - Computerphile,725 293 katselukertaa,8.12,/@Computerphile
opZgjsG5Vvc,G-Technology Presents: ArmorLock Encrypted NVMe SSD,701 818 katselukertaa,1.22,/@SanDiskProfessional
