Video Id,Title,View Count,Length,Channel
0pinZNYxQeo,Palin Endorsement Cold Open - SNL,10 005 008 katselukertaa,5.10,/@SaturdayNightLive
LINjxG7Ebq8,"Nikki Bella tries to convince Brie Bella to agree to an endorsement deal: Total Divas, Feb. 2, 2016",7 626 318 katselukertaa,2.01,/@WWE
M9Pmf9AB4Mo,Apex Legends | Stories from the Outlands – “The Endorsement”,5 710 085 katselukertaa,2.18,/@playapex
XPop7QQAT-g,Bill Burr Thinks Celebrity Endorsements Hurt Candidates | CONAN on TBS,3 624 175 katselukertaa,2.06,/@TeamCoco
E--oLFYs9aI,Carson Endorsement Cold Open - SNL,3 384 794 katselukertaa,6.54,/@SaturdayNightLive
LPOrlLdXgJ0,Union leader calls out Biden for false endorsement claim,2 928 153 katselukertaa,6.34,/@FoxNews
P-KjcOQPVeI,Joe Rogan Responds to Bernie Sanders Endorsement Controversy,2 927 423 katselukertaa,16.47,/@JREClips
S9W0F2mz1jc,President Barack Obama endorses Hillary Clinton for president | Hillary Clinton,2 550 460 katselukertaa,3.16,/@hillaryclinton
4Mr3WL9zD_o,U.S. Kills Al Qaeda Leader al-Zawahiri & Trump’s “Eric” Endorsement Creates Chaos | The Daily Show,2 377 505 katselukertaa,16.59,/@TheDailyShow
AVE2QYKHSm8,"Francine, Kathryn and Belle Mariano Behind The Scene for Sunsilk Endorsement",1 915 773 katselukertaa,0.14,/@francinediazupdate10
uOmfLTB6djU,Fox host leaves her colleagues SPEECHLESS with POWERFUL Biden endorsement,1 526 111 katselukertaa,0.35,/@MeidasTouch
fri1IQN3WdM,FIRST ENDORSEMENT NI SKY,1 287 617 katselukertaa,8.04,/@SerGeybin
wTvdTjn8jH4,Bud Light Crashes 30% After Endorsement of Dylan Mulvaney,1 164 674 katselukertaa,15.36,/@VALUETAINMENT
fuq1HgSnqZ0,Impractical Jokers: Inside Jokes - A Glowing Endorsement | truTV,1 149 934 katselukertaa,1.45,/@trutv
rnIeknursww,"Pretending I Endorse Your Product Is Fraud - WAN Show August 4, 2023",1 032 023 katselukertaa,3.35.04,/@LinusTechTips
Ou82IEI2WA8,Joe Biden gets surprise endorsement: Cindy McCain,1 015 477 katselukertaa,8.06,/@CNN
P6HwYVMDVeA,Mike Tyson Reacts To Dylan Mulvaney Being Endorsed By Bud Light,963 162 katselukertaa,2.59,/@VALUETAINMENT
6pkVu6Kw00M,"This is not an endorsement of arson | The History of the Seattle Mariners, a Dorktown special",958 091 katselukertaa,33.21,/@SecretBaseSBN
J-3iOZDFIHg,Trump undefeated in primary endorsement wins,917 493 katselukertaa,9.56,/@FoxNews
zCMy8BuAq1o,"Shaquille O’Neal’s Many, Many, MANY Endorsements | CONAN on TBS",830 692 katselukertaa,2.56,/@TeamCoco
