Video Id,Title,View Count,Length,Channel
An-EbRKpm20,Inquiry report into abandoned prosecution of Bruce Lehrman handed to ACT government | ABC News,7 749 katselukertaa,2.12,/@abcnewsaustralia
Ee1pzkfyFIc,Inquiry vs Enquiry vs Query | Do you know the difference?,65 810 katselukertaa,7.48,/@JadeJoddle
GIy1gbdQ5pE,🔵 Enquire or Inquire - Enquire Meaning -Inquire Examples - Enquiry Definition,4 091 katselukertaa,5.51,/@iswearenglish
k7DXdWAiouw,Hear Kevin McCarthy's full remarks on Biden impeachment inquiry,130 833 katselukertaa,10.57,/@CNN
mv9Ekl8ELo0,Speaker McCarthy announces impeachment inquiry into President Joe Biden,17 439 katselukertaa,8.05,/@ABCNews
q-JTGoBJNSw,Senators react to McCarthy endorsing a Biden impeachment inquiry,45 494 katselukertaa,1.16,/@NBCNews
Of_w0WpzSoY,House Speaker Kevin McCarthy Announces President Biden Impeachment Inquiry,30 481 katselukertaa,3.41,/@CSPAN
PdBH685dwtE,House Freedom Caucus on Biden Impeachment Inquiry,54 482 katselukertaa,3.10,/@CSPAN
MpOiz7pi3ao,Credit Card Hard Enquiries,1 433 118 katselukertaa,1.00,/@financewithsharan
8trc9nn6ycQ,Watch: Covid Inquiry - David Cameron and Sir Chris Wormald give evidence,22 474 katselukertaa,2.32.01,/@telegraph
-3mK1LfkuiA,BREAKING NEWS: Senate Republicans React To Impeachment Inquiry Into Biden,70 516 katselukertaa,1.01,/@ForbesBreakingNews
lhAHqn_jZpQ,McCarthy launches Biden impeachment inquiry,309 204 katselukertaa,3.45,/@FoxBusiness
I2Ew2PwDiQc,Biden impeachment inquiry 2023: McCarthy announces effort to impeach president | LiveNOW from FOX,15 224 katselukertaa,4.43,/@livenowfox
Je1h-nwQRYw,Enquiry (Full Song) Shavi | Ranjit Oye | Sewak Cheema | Album A | Juke Dock,1 121 893 katselukertaa,3.25,/@JukeDock
gKwsa6CnT2Y,Enquiry Vs. Inquiry,4 454 katselukertaa,1.34,/@Linguistica7
Mjsm_1IK1XA,Enquiry,45 924 katselukertaa,2.50,/channel/UCTW2KlvlqoOpQQLB78RKzuQ
2i5P5t82sbA,Inquiry Letter Trick | Inquiry Letter Format | Class 10/11 | Term 2 | Letter Writing In English,2 177 930 katselukertaa,17.47,/@DearSir
hD09YgkCigk,House of Representatives to open President Joe Biden impeachment inquiry - BBC News,105 114 katselukertaa,5.49,/@BBCNews
pJbbEz9m_b0,Chilcot Inquiry: Alastair Campbell and Brian Eno debate,24 992 katselukertaa,6.16,/@Channel4News
