Video Id,Title,View Count,Length,Channel
cKBuM8bw7cw,MİLF Mom and Son film #erotik,155 877 katselukertaa,1.32,/@sinanbey100
lE_ITOVEomM,Die sündigen Nonnen von Santa Fiora - Trailer (ab April 2023 auf silverline.tv),1 734 207 katselukertaa,1.36,/@SilverlineTV_DE
Qt5hF1nYYM0,"""Jenny, Eva und noch einige mehr  geil vor Lust"" Hörbuch  FREE",231 944 katselukertaa,1.19.04,/@erotik-furs-ohrde
ulslArw1j6k,LIFELOVER Erotik (Full album),18 778 katselukertaa,52.43,/@osmoseproductions-official
t__hUsUARIM,Erotik english sex film,230 091 katselukertaa,1.05.10,/@herseydahilkanala3978
FVWMIfdTL3g,Erotik aus Asien: Das Hausmädchen,924 085 katselukertaa,1.20,/@RatgeberTVcom
wNqCLOlucCQ,Himmlische Erotik,665 262 katselukertaa,4.58,/@carasana
plWa3wwlzUY,KOMŞU KARISI +18 YETİŞKİN FİLMİ • EROTİK • TÜRKÇE DUBLAJ ● REKLAMSIZ!,1 092 562 katselukertaa,1.30.14,/@theOrion361
ctlQvipWwto,VERLANGEN | DVD-Trailer deutsch german [HD],9 032 382 katselukertaa,1.20,/@vipmagazin
