Video Id,Title,View Count,Length,Channel
vZ7gdoigHvE,Help me set up this barbie party! More details on my IG/TT #partyplanning #partydecor #kidsparty,4 386 783 katselukertaa,1.01,/@KristinNicoleMiller_
zDZDYgBkCx0,Beekeeping for Beginners -- Hive Set Up,1 323 594 katselukertaa,5.47,/@groworganic
IVAtbduc4ec,Avoid These MISTAKES BEFORE Starting an LLC!,1 261 401 katselukertaa,16.40,/@karltondennisofficial
ehT-wihbR58,How to Set Up a LAN Network | Internet Setup,785 295 katselukertaa,1.52,/@howcast
CLS2WvMoDLc,Establishing a modified mat nursery for rice,655 994 katselukertaa,8.37,/@irrivideosofficial
Aal2W8sDOPA,How to set up a fish tank.,581 855 katselukertaa,11.22,/@electricblueaquariums4821
qIEHUUt2Wfc,Lec-66: TCP connection Establishment and connection Termination | Transport layer,485 254 katselukertaa,15.12,/@GateSmashers
eUiWFntut00,The First Day of High School: Establishing Classroom Expectations and Building Relationships,484 075 katselukertaa,6.22,/@SanBdoCitySchools
re8ufXf1LPA,Setting Up a Living Trust (Estate Planning FACTS),375 400 katselukertaa,13.47,/@ClintCoons
_6H0ipOG1uQ,"How to set up network sharing in Windows 10 and share files, folders between computers.Easily!",294 144 katselukertaa,5.41,/@ipMalik
ACN3dw-ywAU,"Establishing Shots — Setting a scene like Kubrick, Wes Anderson, and Michael Bay",281 540 katselukertaa,6.38,/@StudioBinder
MVn5mxZW6qY,Establishing Healthy Boundaries with Adult Children (Part 1) - Allison Bottke,278 466 katselukertaa,27.03,/@focusonthefamily
3LAZE6EXo6g,How To Fix “Error Establishing A Database Connection” In WordPress,264 200 katselukertaa,6.17,/@elegantthemes
Axt0nETgEXo,Beautiful Establishing Shots Compilation in Movies [HD] by X2,210 689 katselukertaa,1.48,/@ixtwoX2
4dcvwdEWyE4,Organization of a Basic Patrol and Establishing a Patrol Base,198 296 katselukertaa,11.05,/@tbocsims
u1WGBoIcK3A,How to Set Up an LLC From Start to Finish (Step-By-Step Guide),195 480 katselukertaa,8.20,/@karltondennisofficial
uLS7WFa-9sw,How to Fix the Error Establishing a Database Connection in WordPress,180 317 katselukertaa,3.01,/@wpbeginner
fQC4v07gs5k,Establishing Connections With TCP's Three Way Handshake | Network Fundamentals Part 8,108 634 katselukertaa,6.26,/@NetworkDirection
zBlaX8C9rh0,Total War: Rome II: Sparta Campaign #16 ~ Establishing the Eastern Empire!,106 942 katselukertaa,39.25,/@lionheartx10
wqnwCBdhOl8,ESTABLISHING SHOTS: Why they are important and how to film them!,89 461 katselukertaa,6.56,/@whoismatt
