Video Id,Title,View Count,Length,Channel
DcA5TotAkhs,"The Importance of Being Ethical, with Jordan Peterson",10 915 433 katselukertaa,1.02.53,/@HooverInstitution
BAswj8evFZk,How Ethics Can Help You Make Better Decisions | Michael Schur | TED,222 726 katselukertaa,11.31,/@TED
OI-G23HF6Sw,Ethical dilemma: Would you lie? - Sarah Stroud,973 499 katselukertaa,4.20,/@TEDEd
xIOAosaS3i8,How ethical are you?,13 123 598 katselukertaa,1.00,/@Sambucha
u399XmkjeXo,What is Ethics?,685 570 katselukertaa,4.55,/@ethicscentre
3rQi2uNqwxk,Ethical dilemma: Whose life is more valuable? - Rebecca L. Walker,527 322 katselukertaa,6.06,/@TEDEd
ixIoDYVfKA0,The ethical dilemma of self-driving cars - Patrick Lin,1 863 947 katselukertaa,4.16,/@TEDEd
FB921D40ibw,Ethical dilemma: Who should you believe? - Alex Worsnip,729 158 katselukertaa,4.47,/@TEDEd
4ZdF7xgbs5U,Day-8 Understanding Ethical Issues and Plagiarism,29 katselukertaa,1.23.16,/@researchfoundationofindia
qjz_07-DvE0,Ryan Montgomery - #1 Ethical Hacker Who Hunts Child Predators Catches One Live On Podcast | SRS #56,4 612 220 katselukertaa,2.48.36,/@ShawnRyanShowOfficial
idBdAw5PuTI,Why There's No Such Thing As An Ethical Business Under Capitalism,446 481 katselukertaa,18.16,/@SecondThought
ROAc3zZNbEc,What Does The #1 Ethical Hacker in The World Carry Everyday?,766 953 katselukertaa,25.27,/@ShawnRyanShowOfficial
1iXNaA7GvR8,"Fundamentals of Nursing | Learn HIPAA, Ethics & Legal Tort Law MADE EASY",148 148 katselukertaa,59.39,/@SimpleNursing
W8O131s31Rg,Ethical dilemma: The burger murders - George Siedel and Christine Ladwig,1 973 319 katselukertaa,5.46,/@TEDEd
IjfFP1u5LPQ,Are you really ethical? Let's find out. | Kelly Richmond Pope,48 568 katselukertaa,4.06,/@bigthink
wzicXbnmllc,Creating ethical cultures in business: Brooke Deterline at TEDxPresidio,532 338 katselukertaa,8.24,/@TEDx
_8juebyo_Z4,The Significance of Ethics and Ethics Education in Daily Life | Michael D. Burroughs | TEDxPSU,433 924 katselukertaa,10.32,/@TEDx
3FNYvj2U0HM,Ethical Hacking in 15 Hours - 2023 Edition - Learn to Hack! (Part 1),1 248 869 katselukertaa,7.14.30,/@TCMSecurityAcademy
3_t4obUc51A,Introduction to Ethics,730 132 katselukertaa,10.08,/@academyofideas
