Video Id,Title,View Count,Length,Channel
oEq2XjFCaps,What is Exposition in Screenwriting — 4 Keys to Writing Film Exposition That Works,203 809 katselukertaa,11.55,/@StudioBinder
V8UP2eQe3A8,9 Rules For Good Exposition,3 440 katselukertaa,13.17,/@RaisingtheStakes
HOjeRsF_GoY,"WATCH: Ang Dating Daan Bible Exposition - Mon, Sep 27, 2021, 7PM (PH Time)",160 800 katselukertaa,1.11.29,/@MCGIChannel
TJzzwMXyOnE,"MCGI Bible Exposition | October 23, 2022 | 9:30 PM PHT",74 900 katselukertaa,1.03.02,/@MCGIChannel
LtA_OF18OtM,"WATCH: Ang Dating Daan Bible Exposition - Fri, Oct 29, 2021, 7PM (PH Time)",136 518 katselukertaa,55.58,/@MCGIChannel
iq5A5bppyUg,On Writing: How to deliver exposition PART ONE [ Avatar l Matrix l Game of Thrones l Harry Potter ],362 943 katselukertaa,17.25,/@HelloFutureMe
JZdxEjNxZHg,Takénobu - Exposition,26 449 katselukertaa,4.37,/@TakenobuMusic
lZOkdMai_LU,7 Ways To Do Bad Exposition,3 407 katselukertaa,11.33,/@RaisingtheStakes
GXJamSJDklQ,Understanding Exposition,83 024 katselukertaa,16.29,/@TylerMowery
8F0d2Ma0-74,How To Write BACKSTORY + EXPOSITION The Right Way,57 094 katselukertaa,8.40,/@AbbieEmmons
8OQ3unyD0Eg,The Most Common Writing Mistake: Why Telling And Exposition Are Actually Good,19 351 katselukertaa,22.33,/@ShaelinWrites
29qeJtMD-TU,BIBLE EXPOSITION pt. 3 | The book of Acts - Pst. Enock Mwansele,96 katselukertaa,1.02.36,/@CCCUpangaTAGChurch
lsqvmZbskGo,TENET - Nolan Has An Exposition Problem,707 454 katselukertaa,19.12,/@ThomasFlight
Oudl6hlRpHo,The Hidden Genius Of Cyberpunk 2077's World — How To Do Exposition,407 612 katselukertaa,37.55,/@TheCloserLook
K8pjJ-HZidY,What is the EXPOSITION of a story?,64 516 katselukertaa,3.39,/@SpedSheets
5ffLIJrYEJ8,The Opening of Every Animated Film...,3 142 690 katselukertaa,1.10,/channel/UCR4u8Ny7c3V8qkvIF3JJG-Q
ouXRCztcJK8,EXPOSITION  - Terrible Writing Advice,246 394 katselukertaa,14.31,/@TerribleWritingAdvice
SPEAQ5eh5q4,How to Write Exposition for Your Screenplay,73 940 katselukertaa,15.41,/@TylerMowery
Dd7YbWyPcQo,"Perpetual Adoration live from St Benedict's, Melbourne",,,/@StBensBurwood
oPPKMME54eU,EXPOSITION,11 013 katselukertaa,8.13,/@MELAMAESTRA
