Video Id,Title,View Count,Length,Channel
dG4LRNE2W84,flight attendant FAQs part 6,21 887 770 katselukertaa,0.41,/@Cierra_Mistt
-GlcrZmg7Mw,"""Russia's reputation"" #Countryballs edit",9 465 220 katselukertaa,1.00,/@faqids2681
5VYb3LGIdJ0,Flight attendant FAQs (part 3),6 584 510 katselukertaa,0.52,/@Cierra_Mistt
FMcAlaYCsvY,"""German learning Mistakes"" #countryballs edit",6 266 556 katselukertaa,0.10,/@faqids2681
Kit2Vej29Xc,Gary Neville Puts Fan Questions To Sir Alex | FAQs | SPORTbible | @LADbible,6 036 631 katselukertaa,12.07,/@LADbible
ID9rE5JewVg,Cannabis Grow Lighting Myths and FAQs with Dr. Bruce Bugbee,2 843 680 katselukertaa,44.12,/@ApogeeInstrumentsInc
XJ24KDcjTWA,Flight Attendant FAQs (part 2),2 787 526 katselukertaa,0.44,/@Cierra_Mistt
oDN1z0vAysU,DON'T Do Surya Namaskars Like THIS 😩  [plus FAQs],2 721 164 katselukertaa,17.27,/@AnitaBokepalli
cZM6if_e6ao,Top 3 FAQs! #cruiseship #faq #qanda #shorts #singer,1 456 682 katselukertaa,0.59,/@KarissaEats
M1HM4a1I4RM,FAQs- what else do you wonder? #mommacusses #momlife #shorts #faq,1 356 205 katselukertaa,0.59,/@pleasantpeasantmedia
1o90kRpdr90,flight attendant FAQs part 10,1 129 180 katselukertaa,0.57,/@Cierra_Mistt
aPQWGow2YzE,Exposed: Apollo 11 Moon landing conspiracy theories | Just The FAQs,1 001 962 katselukertaa,2.14,/@USATODAY
fApg7tzlLjY,YouTube Search & Discovery: 'The Algorithm' and Performance FAQs,679 817 katselukertaa,7.07,/@youtubecreators
cCXRPZKpgWU,Are You Ready for Pointe? (beginner FAQs),550 798 katselukertaa,7.13,/@LiveonpointeBlogspot
WBV340x3GcA,Frequently Asked Questions About Time Travel Trailer - Out on DVD NOW,536 552 katselukertaa,1.52,/@lionsgateuk
eOoef7WTcFY,How Big Is Assassin’s Creed Origins? And Other FAQs Answered,493 238 katselukertaa,21.23,/@nextgenwalkthroughs
GRdG-eNBE4k,Answering Your Post Partum FAQs!,414 265 katselukertaa,16.00,/@happyislanders8787
pyFhjsEjFWk,LA MANZANA PODRIDA DE TV3 - FAQs | JOAN PLANAS,346 967 katselukertaa,20.57,/@JoanPlanas
lCaUetzqZTk,Cali Move VS Fitness FAQs | Sydney VLOG #2,336 806 katselukertaa,6.06,/@calimove
kIjYJc35nHI,Class 9 History Chapter 2 | Frequently Asked Questions(FAQs),252 613 katselukertaa,29.51,/@MagnetBrainsEducation
