Video Id,Title,View Count,Length,Channel
_6HzoUcx3eo,Old MacDonald Had A Farm | Nursery Rhymes | Super Simple Songs,380 416 522 katselukertaa,3.18,/@SuperSimpleSongs
ziXqzFbhs4k,Bingo (Farm Version) | CoComelon Nursery Rhymes & Kids Songs,293 410 690 katselukertaa,2.43,/channel/UCbCmjCuTUZos6Inko4u57UQ
amLXkNac7Cw,Bartolito | Zenon The Farmer,179 840 405 katselukertaa,2.22,/@ZenonTheFarmer
YsXc3Anej_8,"DIY tractor Farm Diorama with house for cow, pig, fish pond | how to plant a carrots field #15",168 812 045 katselukertaa,9.08,/@diyfarming4073
tTm3ibwhLV8,#shorts #agriculture #farmer #youtbeshorts #noamanreaction,154 393 355 katselukertaa,0.08,/@noamanreaction
BUd0_JyL_wY,Farmer in the Dell | Mother Goose Club Playhouse Kids Video,117 496 007 katselukertaa,1.15,/@mgcplayhouse
fQhyxaR4RCg,Farmer BiBi picks fruit to make juice,111 711 034 katselukertaa,3.01,/@animalshome467
Wyw7hXXVg1w,The Farmer In The Dell nursery rhyme + more farm songs for kids | HeyKids,101 285 379 katselukertaa,12.05,/@HeyKids
W1OQwdS2k2A,Shaun the Sheep: The Farmer's Llamas | Full Movie,93 592 073 katselukertaa,28.15,/@ShauntheSheepOfficial
MzBaHK-LdtA,Old MacDonald had a farm | Nursery rhymes | 3D rhymes | Children song by Farmees,85 240 652 katselukertaa,53.22,/@Farmees
hgzh1AtAa0E,Farmers Wife had a Tesla Question! #shorts,81 854 523 katselukertaa,0.56,/@Gjeebs
-vI_WMUBXcA,Farming : Laddi Chahal ft Parmish Verma & Mahira | Gurlej Akhtar| Desi Crew | New Punjabi Songs 2021,81 086 579 katselukertaa,4.20,/@speedrecords
j0QUhcLze3o,Picking Up Straw Bales and Work on a field - Tractor Story Of Other Colorful Vehicles And Machines,79 030 823 katselukertaa,13.26,/@Bazylland
zqzwIxptTPo,Proud To Be Desi (Official Video) | Khan Bhaini ft Fateh | Syco Style | Latest Punjabi Songs 2020,77 131 568 katselukertaa,3.50,/@speedrecords
m7YedCGtE70,Chinese farmer harvest purple Onion #agriculture,70 870 645 katselukertaa,0.34,/@amazingthinginchina
lt-Q9pOsIhw,Miss Birdie Gaita- Song for Kids | Zenon The Farmer Nursery Rhymes,70 828 660 katselukertaa,2.39,/@ZenonTheFarmer
eCZunqj2YBQ,Hublot,70 514 924 katselukertaa,3.46,/channel/UCYsC4c5K_x3qazokwtnUjfQ
Bwvi_-g3Grs,#1588 Suitable farming machinery #Farming #Agriculture #shorts,68 156 994 katselukertaa,0.27,/@AgriPisak
D7MhgeV9yA8,Old MacDonald Had A Farm (2018) | + More Kids Songs | Super Simple Songs,66 800 500 katselukertaa,55.42,/@SuperSimpleSongs
FNvZVvk0eZE,Little Farmer in Green Pants and Corn Harvest - Fairy tale about farmers for children,66 388 745 katselukertaa,16.45,/@Bazylland
