Video Id,Title,View Count,Length,Channel
_CKhQnjBtGM,Carving Logo and Filling With Epoxy,216 819 734 katselukertaa,0.52,/@ToolsToday
lgr88vowkeY,Teeth Filling | daant ki bhrai | class 1 cavity | #shorts,201 974 926 katselukertaa,0.09,/@akdentist
vp5sSqyZ5Go,I Filled My Brother’s House With Slime & Bought Him A New One,197 947 547 katselukertaa,9.25,/@MrBeast
OKWkYxikygQ,Tasha Cobbs - Fill Me Up / Overflow (Medley) [Live],193 729 388 katselukertaa,9.38,/channel/UC8aCcbdR6hWfeynEmrguPyg
fqrgFJcqTp0,INSIDE MUTTON BIRYANI | Full Goat Mutton Cooking with Stuffed Biryani | Mutton Inside Biryani Recipe,114 993 903 katselukertaa,9.11,/@VillageCookingChannel
FB9G7Zz-XOU,Wife FILLED A BUCKET with TEARS to save husband 😱| YT #shorts daily | Funyaasi #shortsvideos,110 546 406 katselukertaa,0.55,/@Funyaasi
-_XAd85OrCQ,This is how they make JELLY FILLED DONUTS,82 059 836 katselukertaa,0.38,/@Drewbelcher
MV6I1VNdKjg,Dump truck unloads Surprise Eggs filled with Fruits.,80 489 130 katselukertaa,5.58,/@SunnyKidsTV
trZWJ9lhLBA,How people think I fill my containers ….. so cringey 🤢🥴 #viral #smallbusiness,77 250 675 katselukertaa,0.26,/@Destineecosmetics
Y3sj_v62dpc,I FILLED MY ISLAND HOUSE WITH PACKING PEANUTS!,74 257 683 katselukertaa,20.49,/@Unspeakable
oOWK53d1b-c,FINDING HOW MANY TABLESPOONS TO FILL A BATHTUB,61 992 347 katselukertaa,0.39,/@isaiahphoto
TPxVj7do42I,FILLING MY ENTIRE HOUSE WITH PLASTIC BALLS...,59 406 981 katselukertaa,13.37,/@Unspeakable
y1KHUICxEqc,Box filled with Toy Story Collection for Kids,58 177 961 katselukertaa,10.42,/@Kidibli
lSSWH4NOdgE,I Turned My House Into a Trampoline Park!,51 974 815 katselukertaa,12.29,/@Unspeakable
VgbAxEjh554,FILLING MY ENTIRE HOUSE WITH ORBEEZ!,50 431 215 katselukertaa,21.14,/@Unspeakable
Y6S-ZCeA5l0,10 Million Orbeez In Our Backyard Pool!,49 171 827 katselukertaa,17.21,/@JackSkyeOfficial
SiMcpzeEzSE,Don't Fill The Glass Challenge | Wait For It #shorts #waitforit #challenge,45 724 450 katselukertaa,0.52,/@WaitForIt_Official
s1l9I1EgMb4,FILLING MY ENTIRE HOUSE WITH PACKING PEANUTS!!,40 490 271 katselukertaa,10.02,/@StokesTwins
2TGPjs5TqQY,Giant Lipstick Filled s at Makeup Spot,39 196 005 katselukertaa,12.13,/@Cookieswirlc
VQXTa0ZECps,Truck filled with Toy Vehicles for Kids,37 064 015 katselukertaa,10.03,/@Kidibli
