Video Id,Title,View Count,Length,Channel
WDGPWOlcqms,Donning Fireman Gear in 60 seconds!,543 111 880 katselukertaa,1.00,/@lifeandgodliness
CjbC9wAErts,Blippi Visits a Firetruck Station! | Blippi Full Episodes | Blippi Toys,329 294 372 katselukertaa,25.03,/@BlippiToys
Wy_YNr0ni60,Fire in the Wholefish Cafe! 🔥Fireman Sam | Safe with Sam: Home | Safety Cartoons for Kids,239 065 844 katselukertaa,3.23,/@FiremanSam
tYG8g0gMaaI,"Super Firefighter Rescue Team | Police Car, Ambulance | Nursery Rhymes | Kids Songs | BabyBus",237 924 214 katselukertaa,26.22,/@babybus
0GGzdXmvF5Y,Elephant Firefighter Rescue Team | Nursery Rhymes | Kids Songs | Kids Role Play | BabyBus,231 365 248 katselukertaa,3.22,/@babybus
WE8sJqaH5cA,William Watermore the Fire Truck - Real City Heroes (RCH) | Videos For Children,207 113 821 katselukertaa,17.10,/@coilbook
Iv3IKdBIyJ0,"Fun Rescue Missions with Police Ellie, Firefighter Charlotte, and Builder Beth",174 627 056 katselukertaa,1.00,/@toysandcolors
wmin5WkOuPw,The Prodigy - Firestarter (Official Video),165 266 293 katselukertaa,3.46,/channel/UC7IZbkKDd20v6Ni_vFX63rQ
28yn_3BEraM,Firefighters Song for Kids - Fire Truck Song - Fire Trucks Rescue Team | Kids Songs,122 253 441 katselukertaa,3.24,/@bouncepatrol
r5L_HjQ4754,All Hands to the Rescue - LEGO City: Fire Brigade - Mini Movie: Ep. 19,100 015 826 katselukertaa,2.09,/@LEGO
oPwe10JlrNc,"Fire Truck, Police Car, Ambulance In Surprise Eggs | Nursery Rhymes | Kids Cartoon | BabyBus",98 806 910 katselukertaa,24.15,/@babybus
vlYC4VC7sYU,Blippi Learns At The Fire Station Tour | Learn about Firefighters for Kids | Blippi Videos,98 672 270 katselukertaa,44.52,/@MoonbugKids_CartoonsAndSongs
RnWTsNQjJig,Firefighters To The Rescue! | Little Angel Kids Songs & Nursery Rhymes,83 826 063 katselukertaa,3.34,/channel/UCNzsYU0aWwjERj-9Y9HUEng
8nNRxAwhJuU,Fire Truck Song | Firefighter to the Rescue | Nursery Rhymes - Little Angel,75 881 038 katselukertaa,21.52,/channel/UCNzsYU0aWwjERj-9Y9HUEng
7y0ChoYgSek,Lil Wayne - Fireman (Official Music Video),75 504 793 katselukertaa,4.25,/channel/UCO9zJy7HWrIS3ojB4Lr7Yqw
lT2C3nk5EkI,Blippi Firefighting Helicopter | Learn Machines for Kids with Songs for Children | Blippi Toys,74 725 250 katselukertaa,20.16,/@BlippiToys
RI6UT82cB_E,Here Comes The Fire Truck | Kids Songs | Super Simple Songs,73 631 962 katselukertaa,2.51,/@SuperSimpleSongs
J3UXp9jIr-U,Marshmello - Here With Me Feat. CHVRCHES (Official Music Video),72 928 443 katselukertaa,2.46,/channel/UCEdvpU2pFRCVqU6yIPyTpMQ
EyDpcfhPbSw,Fire Trucks for Children | Truck Tunes for Kids | Twenty Trucks Channel | Fire Engine,72 229 906 katselukertaa,2.45,/@twentytrucks
D_uBLqMJNJk,William Watermore the Fire Truck Part 2 - Real City Heroes (RCH) | Videos For Children,69 927 589 katselukertaa,16.16,/@coilbook
