Video Id,Title,View Count,Length,Channel
WTJSt4wP2ME,K'NAAN - Wavin' Flag (Coca-Cola Celebration Mix),487 133 693 katselukertaa,3.45,/channel/UCZcmnai64lvrmqPHxdUJofQ
WHZEv024EhI,Guess ALL The Flags In The World | ULTIMATE FLAG QUIZ,8 327 697 katselukertaa,21.31,/@QuizMonster
j-fWDrZSiZs,Dido - White Flag (Official Video),250 398 805 katselukertaa,3.41,/channel/UC9Nyyq3qHochdTq1klPyVIQ
l6nO-NSk6SY,Flags I find Confusing,448 356 katselukertaa,10.22,/@JackSucksAtGeography
7wn3BcYdy0M,"Surviving 24 Hours of $10,000 Capture the Flag",872 995 katselukertaa,33.25,/@MoreJStu
xtmoRMhlePw,Guess the Country by the Flag Quiz,236 238 katselukertaa,10.51,/@TheQuizShow
y0fVBD2ltBw,Our Flag Means Death Season 2 | Official Trailer | Max,265 402 katselukertaa,2.11,/@StreamOnMax
aNw6EWnVse0,Guess and Learn ALL 49 FLAGS Of ASIA | Flag Quiz,937 958 katselukertaa,9.07,/@quizkingdom3595
l4w6808wJcU,DOES YOUR FLAG FAIL?  Grey Grades The State Flags!,5 789 460 katselukertaa,18.53,/@CGPGrey
ehnEKVabsXs,Flags in Different Seasons (Part 2) | Fun With Flags,7 982 katselukertaa,2.20,/@fIags
Hr8xbqdxCsE,Guess ALL The Flags In The World In 1 Second | ULTIMATE FLAG QUIZ,8 119 katselukertaa,15.30,/@QuizMonster
gOYWbuDNfD0,INDIAN ARMY 🇮🇳 SALUTE TO PAKISTAN FLAG 🇵🇰 INDIAN ARMY PAK ARMY VIRAL YOUTUBE SHORTS #viralshort,449 496 katselukertaa,0.30,/@kingsuperstar505
xtr7l6gB-04,Our Flag Means Death Season 2 Trailer,8 119 katselukertaa,2.11,/@RottenTomatoesTV
GFokXnCCMf8,Red Flags (ft. Montaigne) OFFICIAL VIDEO,53 882 447 katselukertaa,2.47,/channel/UCW7AGm8JSBEEew61dJIgl_A
rGcRe4lt4z4,All the Countries of the World with Flags | Countries Of The World Song,41 344 944 katselukertaa,8.46,/@klt
QPWyMSniMnU,195 Countries Guess the Flag Quiz | Ultimate Flag Quiz,533 456 katselukertaa,23.39,/@QuizMadness
xb3ibXhZx80,"Flags, but a Little More Realistic",70 010 katselukertaa,1.22,/@fIags
Frizr5pRYTE,FLAGS OF THE WORLD TIER LIST,556 321 katselukertaa,28.05,/@JackSucksAtGeography
QVh7JeXKfuY,CAPTURE THE FLAG HAS COME TO CRASH TEAM RUMBLE,1 906 katselukertaa,6.24,/@CanadianGuyEh
nQRJPvyfFvY,Painting NOOB vs PRO vs HACKER FLAGS,2 398 770 katselukertaa,21.33,/@ProjectJamesify
