Video Id,Title,View Count,Length,Channel
16y1AkoZkmQ,Boney M. - Rasputin (Sopot Festival 1979),491 463 827 katselukertaa,4.30,/channel/UCJOXLX2b_uMEct1r5F4PMXQ
tmozgOCrLjc,"Let's Eat a Flaming Leaf (FIRE PAAN) | Lahore, Pakistan food",61 065 138 katselukertaa,0.32,/@GoldenGully
q4umxEdHwMU,Roblox admin ruins her... she'll never online date again 😔,26 586 323 katselukertaa,10.49,/@flamingo
f43ODtOUmBw,Clairo - Flamin Hot Cheetos,25 847 750 katselukertaa,2.04,/channel/UCa-iCk5rSuWnAb_VT9Hzs3w
7FoARcIcEro,Flaming Pasta?!,23 719 058 katselukertaa,0.57,/@unclerogershorts
VIlCwDvkLIo,Paqui One Chip Flaming Hot Breath !?,18 430 927 katselukertaa,0.48,/@DentalDigest
3Rr57nBTOqg,Roblox CAN'T SAY THE LETTER... (tricking people),16 381 459 katselukertaa,8.05,/@flamingo
mxfZhSEhcE8,I made a Roblox FLAMINGO HATE GAME... and advertised it,14 248 527 katselukertaa,12.53,/@flamingo
m0kH4LLgwAM,Shawn's Flaming Hot Pizza Truck Birthday + Blue's Huge Surprise Gift (FV Family Vlog),13 112 911 katselukertaa,21.32,/@FVFAMILY
sL0JtdXSJ6w,"Exotic Indian Street Food Tour in Delhi, India! Crazy FLAMING FIRE PAAN!",13 074 348 katselukertaa,15.51,/@BestEverFoodReviewShow
Nt1KTWF9FXI,Flaming Pringles Mozzarella Sticks 🧀 #shorts,11 787 268 katselukertaa,1.01,/@DefinitelyNotGourmet
23O9tIn0OTE,EXTREME Flaming Hot Spicy Nachos 🥵,10 331 134 katselukertaa,0.52,/@spizee
hBGfY0PkoKA,Axel Shoots A FLAMING ARROW!,10 306 760 katselukertaa,19.52,/@TheAxelShow
lPXWt2ESxVY,The Flaming Lips - Do You Realize?? (Official Music Video) [HD Remaster],8 460 788 katselukertaa,4.27,/channel/UCLx8uTY2GZaYIv-cUAcNzwQ
cvfxKbpoxRE,The Flaming Lips - She Don't Use Jelly [Official Music Video],6 536 789 katselukertaa,3.48,/channel/UCLx8uTY2GZaYIv-cUAcNzwQ
5A4m4Gu6KhI,Sourest Candy & Flaming Hot Soda,6 041 591 katselukertaa,0.29,/@spicyycam
i459z2NAAXc,(Original) Flaming - Sungha Jung (Baritone Guitar),5 800 748 katselukertaa,4.41,/channel/UCjWRi2qaGtKjQyoQLc4OGkw
NDZGniWh9Fs,The Flaming Skull Dessert from Chica Las Vegas inside Venetian is unique delicious chocolate food,5 267 098 katselukertaa,0.55,/@vegasstarfish
UpAjlz9L0uc,Flaming - Sungha Jung,5 243 117 katselukertaa,4.37,/@Jushinjeong
5zYOKFjpm9s,the flaming lips do you realize,4 761 351 katselukertaa,3.33,/@FlamingLipsMusic
