Video Id,Title,View Count,Length,Channel
jgGA6p3v6wk,This is MADDNESS 😳😱 #shorts,128 040 138 katselukertaa,0.53,/@Houseofhighlights
nvb6tvZOYIo,Paddington | Our Bear Floods the Bathroom | The Blessed Browns,99 301 661 katselukertaa,2.14,/@Paddington
YJTqg5NlHFI,Collapsing floor by filling room with water,93 634 381 katselukertaa,1.31,/@nrk
emnA7QD0h4k,Heavy Rainstorm FLOODED Our Basement! BUSTED Window And Rushing Water!,80 400 411 katselukertaa,17.36,/@YawiVlogs
s7yuxpHSjSE,Kerala road cave-in as flood water rushes in,69 066 972 katselukertaa,0.42,/@TheHinduOfficial
GczlQqrPZLk,Hurricane simulators are no joke 👀🤣 #shorts,60 223 659 katselukertaa,0.24,/@Houseofhighlights
a-Q0F1rVYjs,Evan Almighty: The flood comes HD CLIP,55 930 203 katselukertaa,6.07,/@bingesociety
3vB3RnrqXbM,Wendy Pretend Play House Flood with Water and Sea Animals | Shark in Underwater House,53 042 838 katselukertaa,3.32,/@toysandcolors
aCHg5r6rFoI,Take That - The Flood (Official Video),49 688 163 katselukertaa,5.01,/channel/UCCHmFNsh_Sg1QTmF_L62gMg
D5kDM1FTZxE,Most Horrific Natural Disasters Caught On Camera 2023,44 556 977 katselukertaa,10.48,/@naweather4500
PnUvSn9pVaA,Evan Almighty (9/10) Movie CLIP - The Flood Comes (2007) HD,43 955 095 katselukertaa,2.53,/@MOVIECLIPS
zKmWd8DPrEc,Vance Joy - Fire and the Flood [Official Video],38 187 198 katselukertaa,4.20,/channel/UC5z8qUMf_wvFoqEprUIYZoQ
FXsin5fcR3E,Most Horrific Weather Moments Caught On Security Cameras,34 846 708 katselukertaa,15.34,/@naweather4500
LTyelOWIGh0,The 5th Wave (2016) - The End of the World Scene (1/10) | Movieclips,34 249 304 katselukertaa,4.21,/@MOVIECLIPS
Nw6_LfPbjnI,LEGO DAM BREACH AND SAND CASTLE - TOTAL FLOOD AND DESTROY,31 977 910 katselukertaa,6.09,/@KingOfDams
nm4lqpPra18,My Lamborghini and House Is Flooded…,29 171 038 katselukertaa,0.20,/@Jackdohertyy
QTrDZMIamOw,Huge storm floods our house | Camping and mudding | Farming Simulator 19,27 987 692 katselukertaa,12.58,/@HudsonsPlaygroundGaming
ORJtxkuD62E,"Monstrous Flash Flood & Debris Flow l Johnson Canyon, UT 7/16/2018",27 550 742 katselukertaa,6.46,/@ReedTimmerWx
k-oe4mpXOBo,SCARY HOUSE FLOOD! 😱,27 328 608 katselukertaa,8.45,/@thejohnsonfam
JHFqJc4vAVw,Most Horrific Monster Flash Flood Caught On Camera 2022,26 310 903 katselukertaa,15.35,/@naweather4500
