Video Id,Title,View Count,Length,Channel
pDnBknRr4qY,Roblox AVATARS are BROKEN,72 324 katselukertaa,8.01,/@FlushPlays
8GU9Z_MZ0HE,MORE BROOKHAVEN SECRETS YOU DIDN'T KNOW!,90 159 katselukertaa,8.01,/@FlushPlays
s--5ft5YiHg,How to SUPER FLUSH your Cars Cooling System,16 607 615 katselukertaa,22.07,/@chrisfix
hp6LZfqhxdE,BIGGEST ROBLOX SCAMS...,96 639 katselukertaa,8.01,/@FlushPlays
G6717bNakuA,"Asian flush, explained",3 595 403 katselukertaa,3.16,/@Vox
rq4Ua70jf_I,SUS Roblox Games...,192 553 katselukertaa,8.12,/@FlushPlays
LD2LGkUycQg,How to Flush a Heater Core Safely (with a garden hose),1 917 694 katselukertaa,14.06,/@chrisfix
5it-AuXA0jk,DISTURBING Roblox GAMES that got BANNED!,139 342 katselukertaa,8.03,/@FlushPlays
aDIIhzc-FWg,Shining a light on what comes up when you flush,392 943 katselukertaa,1.34,/@cuboulder
7i89TEXhQkg,The DARK TRUTH about AI APPS...,187 330 katselukertaa,9.08,/@FlushPlays
CRk-VIBiaiM,Flush - 'Bateau Blanc' (extended mix),22 479 katselukertaa,6.31,/@glitterboxibiza
U3bRmH2lDOU,Secrets YOU MISSED in BROOKHAVEN!,227 449 katselukertaa,8.14,/@FlushPlays
SuzcTdZIz3c,How To Flush - The three best ways!,194 564 katselukertaa,5.41,/@RobinundertheHood
CKF7UyU18kQ,Roblox GAMES BASED on DARK TRUTHS!,270 638 katselukertaa,8.10,/@FlushPlays
xyU34Fhi0FY,Where Your Waste Actually Goes When You Flush,2 214 516 katselukertaa,10.03,/@SciShow
fFkYtYT9gUc,NEVER MESSAGE this ROBLOX PLAYER...,136 071 katselukertaa,8.02,/@FlushPlays
wAJm6uA6Wjo,Flush Official Trailer |  Aisha Sulthana | Beena Kasim | William Francis | Kailas Menon,260 225 katselukertaa,2.11,/@GOODWILLENTERTAINMENTS
tYc-kaJUG2w,ROBLOX GAMES with CREEPY BACKSTORIES!,282 952 katselukertaa,8.24,/@FlushPlays
FJ5k--ucOuU,12 Things You Should Never Flush Down the Toilet,3 064 832 katselukertaa,8.20,/@BRIGHTSIDEOFFICIAL
