Video Id,Title,View Count,Length,Channel
afUx6AIG3Tg,Ozuna - Tu Foto (Video Oficial) | Odisea,889155118 katselukertaa,4.42,/channel/UCjIA3wwhi0QjSOXAZwOXbPA
7ixsUIyKIE0,Must Watch New Funniest Comedy video 2021 amazing comedy video 2021 Episode 128 By Busy Fun Ltd,340490317 katselukertaa,8.50,/@busyfunltd9692
UaOCT6EFKko,Zona Cacing di Dunia Nyata,332196921 katselukertaa,5.01,/@Mindplace
Aygpav5Pqco,Kasih nilai fotoku sesuai batrai kalian dong?游뱎 me : 89%,243385404 katselukertaa,0.22,/@andilempong
whMWUU7cfMs,Vlad y Niki juegan con fotos | Videos divertidos para ni침os,223086595 katselukertaa,32.45,/@vladandnikispain
mxF58TYuPaM,Kim Loaiza - DEVOTO (Video Oficial) Ft. Elvis De Yongol,181586986 katselukertaa,3.48,/channel/UCgmUtgxaeaT6CSHc70AQMEg
wXeFp-ivSgE,Maluma - GPS (Audio) ft. French Montana,165058889 katselukertaa,3.38,/channel/UClZuKq2m0Qu-HkopkSBLpEw
0zXSdXu6kdc,Los ni침os encuentran personajes de dibujos animados Marvel y huevos gigantes de sorpresa,162836046 katselukertaa,4.35,/@HeidiandZidaneEsp
W8PTI_3srOg,"Kalian pilih foto Nomer 1 , 2 atau 3 nii? 游뱎 Me : 2 dong游뱎",143910177 katselukertaa,0.29,/@andilempong
E_JwpT1sI1c,"Nastya juega con fotos m치gicas, historias divertidas de juguetes m치gicos",142206315 katselukertaa,15.09,/@LikeNastya_ESP
3WOH50ve-EI,Kasih nilai fotoku sesuai batrai kalian dong?游뱎 me : 17%,130066186 katselukertaa,0.22,/@andilempong
flr8vDQ9Wuc,"Juanes, Nelly Furtado - Fotograf칤a (Official Music Video)",107167417 katselukertaa,4.05,/channel/UC5sQe-dDsoobC6TRokL7SMQ
KDH2KwXHJIY,Maluma - Haw치i (Letra/Lyrics) | Deja de mentirte La foto que subiste con el,101220874 katselukertaa,3.21,/@EternityMusicGroup
eXUljEtn5wY,Fan de Tus Fotos - Nicky Jam x Romeo Santos | Video Oficial,95965809 katselukertaa,3.27,/channel/UCpb_iJuhFe8V6rQdbNqfAlQ
9tFfffFVv2U,Jay Wheeler - Dime Que Si (Cover Audio),94882458 katselukertaa,3.32,/channel/UC7fi3WLjvsa5U4LYLn1B56Q
djaepJ0xjcM,Vlad and Niki play with photos | Funny videos for kids,88404847 katselukertaa,15.33,/@VladandNiki
kHGS5Dkl6gs,Lihat Album Foto Keluarga Yuk! 游놁游닝 Kumpulan Lagu Anak | Little Angel Bahasa Indonesia,83393703 katselukertaa,20.34,/@LittleAngelIndonesia
kKPJ6GNNUOM,Carlos Vives - La Foto de los Dos,70775966 katselukertaa,4.41,/channel/UCcoTDF00osWsjkiO3eC9viw
dqnF30jwq8Y,Ide pose foto keren游뱎游댠,67313464 katselukertaa,0.22,/@andilempong
5xhpBx0Cwns,Daniel El Traviso - Muchas No Se Parecen A Su Foto De Perfil.,64602185 katselukertaa,5.39,/@DANIELELTRAVIESOVIDEOS
