Video Id,Title,View Count,Length,Channel
_VRyoaNF9sk,Travis Scott feat. Young Thug & M.I.A. - FRANCHISE (Official Music Video),126 584 481 katselukertaa,3.56,/channel/UCtxdfwb9wfkoGocVUAJ-Bmg
0T0nDZqujVw,Tired Franchises Hollywood Refuses To Let Die,1 493 915 katselukertaa,51.23,/@friendlyspaceninja
rG-EkVJFv2Q,How Franchising Works | Examples from McDonald's,43 117 katselukertaa,4.57,/@TwoTeachers
5k8D-sAJZ2A,Travis Scott feat. Young Thug & M.I.A. - FRANCHISE (Official Audio),4 062 503 katselukertaa,3.25,/channel/UCtxdfwb9wfkoGocVUAJ-Bmg
mrmzcb4au7I,How To Sell Franchises: A Guide For Franchisors,5 307 katselukertaa,36.57,/@FranchiseSecrets
bP__oMVWk00,The MOST Profitable FRANCHISE Businesses For 2023 💰,21 631 katselukertaa,4.35,/@Vettedbiz
44XqbYBZt_M,FULL SEASON SUBSCRIBER FRANCHISE - Every Game!,733 544 katselukertaa,47.46,/@YoBoyPizza
L_uvCuqr01k,World's Biggest Food Franchises (1950-2020),2 434 009 katselukertaa,7.22,/@dataisbeautiful8913
6fidL51oakg,How Franchising Works: An illustrated guide,512 959 katselukertaa,5.27,/@wbez
sNazboGaxsg,To Franchise or Not to Franchise? | What We've Learned,166 katselukertaa,51.12,/@shawnandlacey
f0qCksLbV4c,I DRAFTED SHEDEUR SANDERS WITH MY #1 OVERALL PICK! Seahawks Franchise,7 539 katselukertaa,30.41,/@Tsap
ygOUQxts6KQ,What Are The Advantages And Disadvantages Of A Franchise?,62 936 katselukertaa,4.37,/@DanLok
EYBKoz68FUg,How Franchising Works : Mcdonalds Franchise Example,153 135 katselukertaa,14.24,/@TariqJohnson
UGeOxeBoJvA,Top 5 MURDERED Franchises,1 437 413 katselukertaa,25.39,/@nerdrotic
6_QMU8CNAjw,Which Franchises Make the Most Money?,73 664 katselukertaa,8.24,/@FranchiseCityOnline
wv5byMsuzBE,"A Chick-Fil-A Franchise Costs only $10,000 and Makes 4.5 Million - What's the Catch?",1 010 239 katselukertaa,8.05,/@FranchiseCityOnline
FilwQSNIgcA,Most Profitable Franchises for 2022 (and Calling Out the FAKE Lists),39 021 katselukertaa,12.29,/@FranchiseCityOnline
JuXCmwoBlNA,Travis Scott - FRANCHISE (Lyrics) feat. Young Thug & M.I.A.,2 182 449 katselukertaa,3.25,/@vibemusic.
wTtitH5bDZs,TOP Questions to Ask a Franchisor and Franchise Owners!,26 722 katselukertaa,21.29,/@TariqJohnson
iSQGSYvDp1U,Why You Will Go Broke Owning a McDonalds Franchise,1 658 021 katselukertaa,9.38,/@TheInfographicsShow
