Video Id,Title,View Count,Length,Channel
uzsHHsA73p0,Fiksuja Huonekaluja Tilaa Säästävällä Mahtavalla Designilla | Ideoita Moderniin Kotiin  ▶10,30 880 353 katselukertaa,8.51,/@QuantumTech
hlnXG-ZDRR0,Explore the different types of sofa fabrics at Darpan Furnishings,14 688 813 katselukertaa,0.16,/@DarpanFurnishingsOfficial
8plYJgEos0E,$30 Million of In Stock Home Furnishings,4 027 413 katselukertaa,0.31,/@bigsandysuperstore1546
m27Cck_LGHc,"House vocabulary, Parts of the House, Rooms in the House, House Objects and Furniture",3 793 683 katselukertaa,10.00,/@easyenglish551
Xs22AGgAxTY,ఇంట్లోనే Furnishings selection మరియు shopping చేసుకోవడానికి వచ్చేసింది ఒక సులువైన మార్గం,3 390 092 katselukertaa,0.36,/@DarpanFurnishingsOfficial
UaLqAKORwwU,Fabulous Sofa Fabrics from Darpan Furnishings,2 879 339 katselukertaa,0.20,/@DarpanFurnishingsOfficial
xvzYyUQ-qKs,Explore the different types of sofa fabrics at Darpan Furnishings,2 455 686 katselukertaa,0.16,/@DarpanFurnishingsOfficial
oQPw_RQtim8,"Worry-free, highly durable #sofafabrics from Darpan Furnishings. #Furnishings #Hyderabad",2 532 203 katselukertaa,0.30,/@DarpanFurnishingsOfficial
W79EoZe89iU,Furnishing An Apartment With Second Hand Flips,2 138 743 katselukertaa,19.57,/@DesertDIY
PE_2RmAGCss,Gorgeous curtains for your home at Darpan Furnishings,1 875 640 katselukertaa,0.22,/@DarpanFurnishingsOfficial
0GEtcqJFGGE,How we make a sofa in Bkp homes Furniture,1 697 076 katselukertaa,1.00,/@bkphomesfurniture
n7BbOIsE6Pg,Easy Way to Select & Shop Furnishings at Home,1 562 412 katselukertaa,0.32,/@DarpanFurnishingsOfficial
P6TFTGNTKIM,Fabulous Sofa Fabrics from Darpan Furnishings,1 456 545 katselukertaa,0.25,/@DarpanFurnishingsOfficial
6bXqCx-FCC8,Big Summer Savings at Darpan Furnishings. #pillows #bedsheets #curtains #furnishings,1 358 909 katselukertaa,0.13,/@DarpanFurnishingsOfficial
oRc0RMVYeR8,Home Centre & Twinkle Khanna launch the new furnishings collection - 'My Colourful Furnishings',1 092 618 katselukertaa,0.39,/@HomeCentreIndia
CRjVxPi2Scg,Minecraft: 20 Interior Furniture Designs & Ideas!,945 441 katselukertaa,9.44,/@LombyMC
Bjk7TE57cBc,"Worry-free, highly durable #sofafabrics from Darpan Furnishings. #Furnishings #Hyderabad",947 061 katselukertaa,0.30,/@DarpanFurnishingsOfficial
Dh6aZjsFcd8,Architect's TOP 10 Furniture Hacks for Small Homes,671 888 katselukertaa,12.12,/@DanielTitchener
QdHDn_dD4XQ,Fire Pit Table - Moda Furnishings,537 723 katselukertaa,0.44,/@ModafurnishingsUk
-uQ1P5vxWxo,How to Remove a Back on a Best Home Furnishings Recliner,515 100 katselukertaa,1.10,/@BestHomeFurnishings
