Video Id,Title,View Count,Length,Channel
bu7nU9Mhpyo,å‘¨æ°å€« Jay Chou (ç‰¹åˆ¥æ¼”å‡º: æ´¾å‰ä¿Š)ã€å‘Šç™½æ°£çƒ Love Confessionã€‘Official MV,247Â 432Â 453 katselukertaa,3.36,/channel/UC8CU5nVhCQIdAGrFFp4loOQ
S3G08j3KtkA,Angry Ladies,221Â 184Â 634 katselukertaa,0.09,/@imvincentgao
sIXa8DUWCus,Vincent Gao Pulling At The Beach,112Â 946Â 540 katselukertaa,0.24,/@imvincentgao
lrs0Yo9Hac8,Vincent Gao vs Mall Bros,98Â 769Â 340 katselukertaa,0.49,/@imvincentgao
SFY_mUvVx8A,dekho meri Nani ka gao vala ghar#shorts #trending #viral #youtubeshorts #thegeetagurjar #subscribe,84Â 346Â 249 katselukertaa,0.41,/@Thegeetagurjar
D76BhoVPHqY,My unlucky day,62Â 398Â 365 katselukertaa,0.43,/@imvincentgao
7jxWlyIAPQs,Parking Lot Rizz,43Â 898Â 518 katselukertaa,0.28,/@imvincentgao
t06hdfU1Wjo,Vincent Gao In The Parking Lot,42Â 286Â 955 katselukertaa,0.35,/@imvincentgao
DVs9SSG0-o4,Simple hand hold,36Â 427Â 560 katselukertaa,0.23,/@imvincentgao
MARBvj3Jji0,ja din hogi à¤¤à¥‡à¤°à¥€ sadhi gao me pital barse go #trending #shorts #youtubeshorts #viralshort,34Â 691Â 847 katselukertaa,0.15,/@shortviral5595
FZwj7dKYhGE,Madam ne gao mai sadi kar liyağŸ˜±ğŸ¤£#shorts#entertainment#youtubeshorts#shifalipandey,33Â 988Â 363 katselukertaa,0.57,/@ShifaliPandey
CMhWyX98yU8,Oh she's fast...,32Â 765Â 749 katselukertaa,0.34,/@imvincentgao
BL0Ln5Kng8s,Vincent Gao and Country Girls,28Â 652Â 906 katselukertaa,0.37,/@imvincentgao
KtNLRdCKb0U,Vincent Gao Epic Challenge,28Â 318Â 622 katselukertaa,0.47,/@imvincentgao
M-swCSaZ_FI,DX PR Wild Force - SS Gaoranger ç™¾ç£æˆ¦éšŠã‚¬ã‚ªãƒ¬ãƒ³ã‚¸ãƒ£ãƒ¼ ( ver 2 ),25Â 876Â 942 katselukertaa,16.56,/@DuyHuynhchannel
d9zaFGANyrI,Magic System- Premier Gaou,25Â 388Â 586 katselukertaa,4.56,/@JoMc89
TgpTWDr9LAI,Vincent Gao and Bubble Gum Girl,24Â 169Â 116 katselukertaa,0.20,/@imvincentgao
b84pvJtItOQ,Vincent Gao Meets One In A Million,22Â 400Â 089 katselukertaa,0.15,/@imvincentgao
YZ_bd_EAJPE,Vincent Gao The Magician,22Â 448Â 970 katselukertaa,0.26,/@imvincentgao
C5_F31nX9to,Vincent Catches All Of Them Slacking!!,21Â 366Â 461 katselukertaa,0.56,/@imvincentgao
