Video Id,Title,View Count,Length,Channel
h1h67S02nmM,Geometric,25 617 katselukertaa,6.06,/channel/UCKD6mGixoRA_KR0QFzg1vbA
hD5xRG7FPog,"Geometry Dash - ""Geometrical Dominator"" 100% Complete [All Coins] - GuitarHeroStyles",12 046 745 katselukertaa,1.49,/@GuitarHeroStyles
6XGzJQKbV40,[NEW 2023] Sacred Geometry in Motion: Mind-Blowing Fractal Visuals for Divine Connection [4K],449 409 katselukertaa,3.00.01,/@TrippyEverythingVisuals
302eJ3TzJQU,Introduction to Geometry,1 603 201 katselukertaa,34.03,/@TheOrganicChemistryTutor
Utbb6otv_3g,Geometry Dash's Biggest LEVEL STEALING Drama,4 177 katselukertaa,8.24,/@SynteeGD
JteQEN1XPyc,Beautiful Geometry behind Geometric Series (8 dissection visual proofs without words) #math #series,107 519 katselukertaa,6.46,/@MathVisualProofs
NDMPwZL47JY,Geometric Shapes for kids - Preschool Vocabulary,217 034 katselukertaa,3.21,/@SmileandLearnEnglish
zRKZ0-kOUZM,Geometric Series and Geometric Sequences - Basic Introduction,935 024 katselukertaa,31.20,/@TheOrganicChemistryTutor
pg1NpMmPv48,The complex geometry of Islamic design - Eric Broug,3 105 791 katselukertaa,5.07,/@TEDEd
60z_hpEAtD8,A Swift Introduction to Geometric Algebra,745 727 katselukertaa,44.23,/@sudgylacmoe
lBCIGY3dWXQ,"Geometric lines, geometric shapes and plane shapes - Geometry for kids",160 135 katselukertaa,10.08,/@SmileandLearnEnglish
K73lfmxDVR0,"Every Geometry dash level! with coins! (GD, Meltdown, Subzero, World, 37 levels)",27 751 553 katselukertaa,46.56,/@selpix
lJEHXtWMXGA,Geometric,35 020 katselukertaa,7.17,/channel/UCCIw-fXiX4A0PKRbnBPdaVQ
utMx48aGndI,The Story of Creation Through Sacred Geometry,779 131 katselukertaa,12.46,/@AfterSkool
yj2L07KwL-c,Geometry Study • Pattern explorations,5 933 571 katselukertaa,7.02,/@yukikawae6549
KtZai86htng,"Geometry Introduction - Basic Overview - Review For SAT, ACT, EOC, Midterm Final Exam",399 159 katselukertaa,22.58,/@TheOrganicChemistryTutor
DGKwdHMiqCg,Math Antics - Angle Basics,4 724 763 katselukertaa,7.46,/@mathantics
DUGkQMLowXA,Polygons - Geometry for Kids,434 316 katselukertaa,4.25,/@SmileandLearnEnglish
JnLDmw3bbuw,"Area of a Rectangle, Triangle, Circle & Sector, Trapezoid, Square, Parallelogram, Rhombus, Geometry",1 890 256 katselukertaa,20.35,/@TheOrganicChemistryTutor
EJq9EM6NB_0,"THE BEST FULL VERSION ""Press Start Full"" [2.2 XL level] - Geometry Dash",47 366 024 katselukertaa,3.42,/@2.2
