Video Id,Title,View Count,Length,Channel
9mWdw-09dso,Dheeme Dheeme - @TonyKakkar | Neha Sharma | Official Music Video,695 889 327 katselukertaa,2.43,/@DesiMusicFactoryYT
0TJfl4IayTw,Vlad and Niki - funny toys stories with costumes for kids,563 449 747 katselukertaa,10.43,/@VladandNiki
mJD30Y4PwV0,DIY - How To Build Mini Swimming Pool For Pet From Magnetic Balls (Satisfying) | Magnet World Series,342 593 918 katselukertaa,12.53,/@MagnetWorld
z4joadXXNZA,skibidi toilet 49,58 590 144 katselukertaa,1.16,/@DaFuqBoom
tzUqTGIYiyk,Raj Bhai New Video.Jhimir Jhimir Paniya llझिमिर झिमिर पनिया,36 717 085 katselukertaa,3.50,/@newkhorthabeats7286
CFf7dlewJus,Meet Gmail's New Inbox,29 143 421 katselukertaa,1.11,/@Google
qhnCjPFUU0k,World population VS Gmail (Troll Face meme) #phonk #viral #shorts,23 883 676 katselukertaa,0.23,/@sanval30
dgb0o9XLXzk,Email id Kaise Banaye | Gmail id kaise Banaye.,13 429 817 katselukertaa,4.09,/@jptechnews
KabU4WPnYMc,How to Change Gmail Password | Gmail Ka Password Kaise Change Kare | Gmail Account Password Change,8 978 683 katselukertaa,2.50,/@JitinTechnologia
K9pnz8xWenE,How to Remove Gmail Account from Android Phone || Mobile se Email Id kaise delete kare,7 323 002 katselukertaa,2.42,/@Choubeyjitechnical
a0gqJgMO0Ds,Como Recuperar mi cuenta de Google Gmail o Contraseña,7 213 466 katselukertaa,6.47,/@YendryCayo
tSXbeGwGRwg,SriKrishna@gmail.com | Kudi Notada |Sanjith Hegde |Krishna |Bhavana |Nagshekar |Arjun Janya |Sandesh,6 969 862 katselukertaa,3.29,/@AnandAudio
oT0uRQ3lMU8,SriKrishna@gmail.com | Kudi Notada |Sanjith Hegde |Krishna |Bhavana |Nagshekar |Arjun Janya |Sandesh,6 304 334 katselukertaa,4.32,/@AnandAudio
WI9WZXTFD_c,Gmail ka password kaise pata kare | Gmail ID ka password Bhul Gaye to Kaise Pata kare,6 177 583 katselukertaa,2.15,/@TechnicalRest
Ox1Smuwa5x0,If Gmail Was A Person | Archit jain #shorts,5 964 505 katselukertaa,1.01,/@Archit_jain
8SnOGvUAwBQ,Gmail ka password bhul gaye to kaise pata kare | how to reset gmail password if forgotten in hindi,5 943 262 katselukertaa,3.21,/@TechmyIndia
FKPAdYnpLc4,"ELIMINAR cuenta de GOOGLE, Gmail y Youtube PARA SIEMPRE",5 466 796 katselukertaa,4.41,/@TuAppleMundo
jTxRCEpUgt0,No one knows about this GMail Trick!,4 945 462 katselukertaa,0.37,/@SetupSpawn
ZfXui4ZwEb0,"$1 TV MAN to $1,000,000,000 in GTA 5",4 649 691 katselukertaa,20.43,/@TheLoudDude
20IuXkwqYuY,How to Delete Gmail Account Permanently,4 590 870 katselukertaa,3.05,/@jptechnews
