Video Id,Title,View Count,Length,Channel
AHDtXqjgEj4,Bruno Mars - Gorilla (Official Music Video),170Â 132Â 553 katselukertaa,6.03,/channel/UCoUM-UJ7rirJYP8CQ0EIaHA
bi2OPrRwSTk,King Kong | V. rex Fight in 4K HDR,143Â 235Â 180 katselukertaa,7.55,/@UniversalPictures
6S2x_bK6zZo,Surprise Toys in our Bedroom,137Â 643Â 061 katselukertaa,4.06,/@hzhtubekidsfun
hhzrul_MU6c,King Kong | Climbing Up (and Falling from) the Empire State Building,132Â 574Â 961 katselukertaa,10.11,/@UniversalPictures
tpSKMI2ppQo,Two Giant Gorilla plays the car,132Â 144Â 487 katselukertaa,1.02,/@TheKoopZilla
JretV4EL-uA,2. Banding Together to Survive - OUT OF THE CRADLE [äººé¡èª•ç”ŸCG] / NHK Documentary,115Â 856Â 648 katselukertaa,2.13,/@NHKWORLDJAPAN
ra9dsfeAokA,King kong(gorilla) show at alvas virasath 2018.,110Â 133Â 572 katselukertaa,1.38,/@NikharaNews
iCUNm33pa3k,Paint Animals Gorilla Cow Tiger Lion Elephant Fountain Crossing Animal Game,110Â 517Â 244 katselukertaa,9.30,/@funny3danimals
23um2h4YUwU,Experts Weigh In On Harambe's Last Moments,103Â 028Â 839 katselukertaa,0.41,/@TheDodo
mKuKeTcJZEo,Cow Mammoth Elephant Tiger Gorilla Guess The Right Door ESCAPE ROOM CHALLENGE Animals Tire Game,99Â 870Â 243 katselukertaa,11.06,/@FunnyAnimalElephant
qZs0DkNsBGY,Gorilla Getaway - 104 | Tobot Galaxy Detective Season 1  | Tobot Galaxy English | Full Episodes,91Â 255Â 342 katselukertaa,11.06,/@TOBOTEnglish
MkH6UAFt35Q,"GODZILLA vs. KONG | 2021 | Clip ""Kong and Jia"" HD",90Â 801Â 070 katselukertaa,1.10,/@BDHorrorTrailersandClips
L0I3YDxANZ4,Max Level Long Legs Cow Dinosaur Elephant Gorilla Choose the Right Mystery Door Longest Staircase,82Â 380Â 815 katselukertaa,9.58,/@AnimalRevoltBattleTv
h2uZR93AIH4,Choose The Right Gift Box Run Game With  Elephant Cow Gorilla Buffalo Pig Trex Wild Animals Games,65Â 383Â 154 katselukertaa,9.17,/@doodlanddoodles8011
WMfuXvfaH1E,Cow Mammoth Elephant Tiger Gorilla Guess The Right Door ESCAPE ROOM CHALLENGE Animals Tire Game,62Â 739Â 544 katselukertaa,9.15,/@animalworld418
7B6FkBqkZ1g,Ego - The Crazy Things We Do Official Music Video (Dancing Gorillas),56Â 485Â 389 katselukertaa,3.45,/@egomusicvideo
Gka1V55k_-Y,Wild Animals Learn Fruits with Wooden Cart Toys | Gorilla and Zoo Animals,53Â 811Â 705 katselukertaa,3.29,/@jojoanimalfamily1500
m1VqyuNaE98,"Learn the ABCs: ""G"" is for Gorilla",53Â 523Â 143 katselukertaa,1.05,/channel/UCbCmjCuTUZos6Inko4u57UQ
iKke3Vm0jAI,Funny Gorillas Surprise Kakoa With Dancing Car Ride!,52Â 590Â 443 katselukertaa,2.12,/@kakoasworld
OTE4pS5I-Is,Everyone warned him to not meet the gorilla he raised â¤ï¸ ğŸ¥º,51Â 054Â 821 katselukertaa,3.49,/@We_Love_Animals
