Video Id,Title,View Count,Length,Channel
Os36_ztdIf4,Graphing LEGO Cam Motion Profiles - Part 1,43 457 580 katselukertaa,0.31,/@JKBrickworks
RSAD7QNT1hs,Memorization Trick for Graphing Functions Part 1 | Algebra Math Hack #shorts #math #school,18 340 789 katselukertaa,0.15,/@JusticeShepard
ZbfMlNvKBOY,How to Draw a Cube   3D Trick art on Graph paper,14 712 441 katselukertaa,2.03,/@SonhoscomDimensao
4OgPa7MKjRA,11 chap 03 : Kinematics 05 | Displacement time Graph -Velocity time Graph - Acceleration time Graph,4 688 043 katselukertaa,44.57,/@PhysicsWallah
NscEgI8ns9A,Making the 'papi' trend using capcut and it's graphs👀,4 638 588 katselukertaa,0.11,/@dazmoon7098
ZvPb9plO6dY,Fun things you can do on a Ti-84 Graphing Calculator (ft. Floof),4 257 241 katselukertaa,15.44,/@theodd2sout762
3PwVWX28dEE,How To Make A Line Graph In Excel-EASY Tutorial,4 042 388 katselukertaa,2.36,/@HelpfulDIY
g9aDizJpd_s,Supply and Demand: Crash Course Economics #4,3 718 799 katselukertaa,10.22,/@crashcourse
XATlmM286wg,IELTS Writing task 1: line graph,3 591 589 katselukertaa,12.03,/@ielts-uponlinelessons7695
9Uc62CuQjc4,Algebra Basics: Graphing On The Coordinate Plane - Math Antics,3 157 949 katselukertaa,10.14,/@mathantics
BQvBq3K50u8,How I animate stuff on Desmos Graphing Calculator,3 122 654 katselukertaa,7.49,/@Junferno
kvGsIo1TmsM,What is a function? | Functions and their graphs | Algebra II | Khan Academy,3 079 158 katselukertaa,7.57,/@khanacademy
R948Tsyq4vA,Finding the slope of a line from its graph | Algebra I | Khan Academy,3 034 002 katselukertaa,4.40,/@khanacademy
pcKY4hjDrxk,5.1 Graph Traversals - BFS & DFS -Breadth First Search and Depth First Search,2 879 184 katselukertaa,18.31,/@abdul_bari
TfkNkrKMF5c,Excel Quick and Simple Charts Tutorial,2 829 256 katselukertaa,9.19,/@techteachersandstudents
fyROLkZc75E,Find the Domain and Range from a Graph,2 802 048 katselukertaa,4.15,/@Mathbyfives
E91bGT9BjYk,How to spot a misleading graph - Lea Gaslowitz,2 802 655 katselukertaa,4.10,/@TEDEd
Vw-RwPBWS8g,"Graphing Sine and Cosine Trig Functions With Transformations, Phase Shifts, Period - Domain & Range",2 360 831 katselukertaa,18.35,/@TheOrganicChemistryTutor
