Video Id,Title,View Count,Length,Channel
bqGtrvcR5ls,Harrdy Sandhu - Backbone | Jaani | B Praak | Zenith Sidhu | Latest Romantic Song 2017,596Â 615Â 179 katselukertaa,3.30,/@SonyMusicIndia
KyvEm5eJFv0,"Future ""My Savages"" (WSHH Premiere - Official Music Video)",59Â 766Â 887 katselukertaa,3.27,/@worldstarhiphop
zFrkcUxubDg,YoungBoy Never Broke Again - Peace Hardly [Official Music Video],29Â 231Â 369 katselukertaa,2.43,/channel/UClW4jraMKz6Qj69lJf-tODA
dfeqKsgTjPo,Hardly Working: Yoga Teachers,22Â 172Â 029 katselukertaa,2.53,/@collegehumor
Mo6tb-vNAC4,"Little girl calls 911 - Adorable - ""He can't hardly breathe""",13Â 874Â 351 katselukertaa,3.41,/@jeffsaks123
8lP70mrN388,Avenger? I Hardly Know Her,13Â 566Â 984 katselukertaa,3.37,/@TheEllenShow
Bx3GrISdOMc,A lady in a wheel chair who can hardly stand - here is a moving and touching story,13Â 266Â 285 katselukertaa,9.04,/@TheOfficialChrisLeong
vnhXaASlVEQ,This 8 Year Old Girl Has Hardly Grown Since She Was Born | My 40 Year Old Child,12Â 677Â 150 katselukertaa,7.06,/@TLCTVUK
wFUTHcjiZGo,The Irish Rovers- Johnny I hardly knew ye,11Â 747Â 709 katselukertaa,3.38,/@Mahaim13
JrOiILxcbC4,Wiz Khalifa - DayToday: Hardly At Home,10Â 619Â 126 katselukertaa,7.54,/channel/UCVp3nfGRxmMadNDuVbJSk8A
WkOWwlXN0f8,My Irritating Sister | childhood Memories,8Â 755Â 670 katselukertaa,0.45,/@howshardy
GShb_obqY-4,Future - Hardly (Official Video),8Â 177Â 897 katselukertaa,3.05,/@NewMusicFriday
II03SfoHaic,The Guy Who Has Never Seen or Heard of Anything (Hardly Working),7Â 893Â 537 katselukertaa,1.59,/@collegehumor
MxJJ2LBI604,Is Grant Keith from Buzzfeed? | Hardly Working,7Â 745Â 720 katselukertaa,3.08,/@collegehumor
lvJXh2-Gi_g,Why Samurai Hardly Used the Katana #Shorts,7Â 645Â 933 katselukertaa,1.00,/@LetsaskShogo
fzK4ZgnMB0s,"Rio Da Yung OG feat. GrindHard E - ""Hardly Breathe"" (Official Music Video) @SBKEONTA",7Â 333Â 659 katselukertaa,3.00,/channel/UCjUy5GbylYJC6kxJZYRwwVA
xUwPh6Lm5Q0,Everyone's High School Boyfriend (Hardly Working),6Â 856Â 099 katselukertaa,3.01,/@collegehumor
JJ7TuCBaElo,BARELY a Best Day Ever!!  Niko and Navey get sick! Dad and Adley arrrr living at pirate island ğŸ´â€â˜ ï¸,6Â 580Â 058 katselukertaa,26.05,/@Shonduras
OkpiwHo0Po0,"The Irish Rovers, Johnny I Hardly Knew Ye   (w/ lyrics)",5Â 933Â 240 katselukertaa,3.26,/channel/UCKJpE_myoChmEITLi8LHIzg
