Video Id,Title,View Count,Length,Channel
WqKWfTkKCfQ,Patrick Mahomes You Did This!,181 484 katselukertaa,22.46,/@daydrian
jfyfvdiJADM,Old Man Called Me Gay!,1 945 160 katselukertaa,20.55,/@daydrian
ZmDe8WPEdtw,Fake Security Guard Prank!,2 770 715 katselukertaa,13.26,/@daydrian
v_YDWGX0R1o,He Ruined My Concert!,2 745 685 katselukertaa,34.28,/@daydrian
zY4ueDEVrwg,He Almost Killed Me!,1 617 058 katselukertaa,26.20,/@daydrian
-bDOg4Rr1RM,Group Leader vs Angry Bot!,1 640 836 katselukertaa,29.16,/@daydrian
lbi3vnOA4mg,I Love Older Women!,1 357 234 katselukertaa,29.36,/@daydrian
-MarsdcM8bk,He Seen The Meat!,2 488 124 katselukertaa,26.51,/@daydrian
bd_dBFpk0WY,He Got Me Arrested!,3 303 577 katselukertaa,23.28,/@daydrian
2sW1Xvcw2qQ,Walmart Can’t Stop Me!,12 896 297 katselukertaa,22.03,/@daydrian
ofANAyKKVP8,A BIG CHANGE HAS BEEN MADE 3 DAYS OUT FROM PREP...,15 773 katselukertaa,15.33,/@BrandonHarding
aBZHXBS5rCY,Warren G. Harding: The Most Corrupt President in US History,1 230 643 katselukertaa,24.34,/@Biographics
P6JYBZRP4jw,He Thinks I Killed Somebody!,1 942 448 katselukertaa,23.37,/@daydrian
iK70r97y_pk,DaBaby Pressed My Filmer!,2 601 532 katselukertaa,29.25,/@daydrian
UFAONvA8y1Y,I Gave Him My Crocs!,1 665 988 katselukertaa,24.15,/@daydrian
IpQw1OITruk,Cussing Toy Prank!,1 728 041 katselukertaa,24.50,/@daydrian
ntGPlnrFEgQ,Want a Cupcake?,2 548 001 katselukertaa,24.43,/@daydrian
QyZeJr5ppm8,Aldous Harding - The Barrel (Official Video),4 918 266 katselukertaa,4.54,/@4ad_official
tXHtvg6nd9g,Security Loves Us!,1 731 432 katselukertaa,26.04,/@daydrian
