Video Id,Title,View Count,Length,Channel
HdQCWXh3XXU,Re:Zero kara Hajimeru Isekai Seikatsu Ending FULL - Reï¼šã‚¼ãƒ­ã‹ã‚‰å§‹ã‚ã‚‹ç•°ä¸–ç•Œç”Ÿæ´» ED ã€ŒSTYX HELIXã€,31Â 434Â 990 katselukertaa,4.52,/@adieu9325
Xw38pGhPXIk,Hark! The Herald Angels Sing (Live At The Helix In Dublin...,23Â 334Â 254 katselukertaa,4.45,/@CelticWomenVEVO
7uJxtwBFxxI,Styx Helix,21Â 313Â 792 katselukertaa,4.50,/channel/UCy-KRbBQm9bV0Kl0mSyVhAw
tIhL2KHVdgE,ã€MVã€‘ MYTH&ROID - STYX HELIX(OFFICIAL),18Â 931Â 272 katselukertaa,4.46,/@KADOKAWAanime
PVw0n2jhLBI,Aesthetic Ear Curation Ideas Ear Piercing Ideas Earrings Jewelry for Cartilage Helix Tragus Daith,17Â 349Â 050 katselukertaa,0.07,/@impuriaearpiercingjewelry
dSJ4EWeHyE4,We Wish You A Merry Christmas (Live At The Helix In Dubli...,9Â 406Â 139 katselukertaa,3.25,/@CelticWomenVEVO
GT3ZwF5qNSA,Amaranthe - Helix,8Â 136Â 763 katselukertaa,3.40,/channel/UCuRZjIZcbcdfhixsE1V3E0A
7HKVvcNOQb0,Flume - Helix,6Â 381Â 109 katselukertaa,3.31,/channel/UCXAhoI7XO2kafTMjocm0jCg
-DWXeiOGAxg,"Butterfly or Bee Ear Piercing Jewelry for Cartilage, Helix, Tragus, Conch, Rook Piercings",5Â 661Â 298 katselukertaa,0.05,/@impuriaearpiercingjewelry
3BKXFAPi58I,When hacker plays HELIX JUMP ğŸ˜,5Â 220Â 389 katselukertaa,0.11,/@PlaywithMujeeb
dnmrNhODiOU,Helix Ft. Gappy Ranks - She A Weapon [Switch It Riddim],5Â 184Â 006 katselukertaa,3.16,/@DancehallMartinique
15D_LWIguL8,24 Levels of Butterfly Knife Tricks (Balisong): Easy to Complex,4Â 971Â 449 katselukertaa,22.52,/@WIRED
se2-vbWu1w8,The LEGO Churro Helix #shorts,3Â 709Â 189 katselukertaa,0.44,/@BrickBending
jJIgfgc01Mw,Helix Academy: Looking Back,3Â 117Â 644 katselukertaa,8.03,/@HelixStudiosTV
9isHLaEeJeo,v5.9 Banquet of Helix Trailer â€” Honkai Impact 3rd,3Â 036Â 085 katselukertaa,2.02,/@HonkaiImpact3rd
1m-teRh6W18,Helix Studios: The Gorgeous Gardener,2Â 954Â 609 katselukertaa,5.01,/@HelixStudiosTV
oTtGj8FDiQ8,Helix full ride POV,2Â 410Â 162 katselukertaa,1.51,/@Lisebergab
tWzJhkrZm5Y,Death Grips - Double Helix,2Â 215Â 989 katselukertaa,2.39,/channel/UCuq1H-HXWoW4JL-hX5bWxzw
dHcCVhifaSk,"Abel - ""To Tousel"" (ft. Helix Dynasty & Tuks) | Official Music Video",2Â 154Â 796 katselukertaa,3.25,/@abel.artist
GP3pJduCbVY,Helix Studios: Happy Campers,2Â 076Â 862 katselukertaa,18.34,/@HelixStudiosTV
