Video Id,Title,View Count,Length,Channel
GT3ZwF5qNSA,Amaranthe - Helix,8 135 416 katselukertaa,3.40,/channel/UCuRZjIZcbcdfhixsE1V3E0A
GMXh-TiVyhA,POUŽÍVÁME JEN JEDNU BARVU PŘI HŘE NA SCHOVÁVANOU v Minecraftu!,85 353 katselukertaa,14.54,/@helix8150
3cOk14zWO3Q,"Helix ""Rock You"" (Original Video and Song)",237 127 katselukertaa,2.55,/@HonestEd1
IeIXiXec6PU,Helix On Ride POV - Liseberg,31 923 katselukertaa,1.40,/@ThemeParkWorldwide
3TytkA5mYGg,Helix - Wild In The Streets Hard Rock,247 588 katselukertaa,3.52,/@WillHard84
Hh9Oomm2SqA,Helix - Heavy Metal Love,704 890 katselukertaa,3.00,/@helixvevo7407
uhEA4vGbvBs,Rock You,397 586 katselukertaa,2.54,/channel/UCN_Mal1OKsJfV8WOHP-onKA
D71U9K5gg-g,"1 Kč vs 1,000,000 Kč Hotel Ve STAVĚCÍ SOUTĚŽI!",44 203 katselukertaa,20.44,/@helix8150
FEx7ZZKrgK0,Helix a Kevin vs NEJVĚTŠÍ AQUAPARK v Minecraftu!,226 456 katselukertaa,17.42,/@helix8150
GFJ2J7b5C1A,Helix-Make me do anything you want,579 757 katselukertaa,3.39,/@federako
k50cmT-oTqo,Přežíváme Jako MOBOVÉ na RAFTU!,283 885 katselukertaa,25.05,/@helix8150
FQLM52uv1xY,Podvádím jako ENDERMAN ve STAVĚCÍ SOUTĚŽI!,57 555 katselukertaa,17.11,/@helix8150
X8K4TX3W2hU,"Minecraft, ale je ULTRA REALISTICKÝ!",139 644 katselukertaa,14.10,/@helix8150
ghBx5OwPoos,Helix má ZLOMENÝ KRK v Minecraftu!,57 600 katselukertaa,11.51,/@helix8150
_m9ngKMj3kw,"Minecraft, Ale ZKUS SE NESMÁT...",202 667 katselukertaa,12.38,/@helix8150
e9W3a_Mx2WE,MUTANT MICKEY MOUSE vs ZABEZPEČENÝ MINECRAFT DŮM!,205 356 katselukertaa,15.20,/@helix8150
U10e9ubwnHs,Helix vs Kevin: EPICKÝ PODZEMNÍ Dům v Minecraftu!,148 960 katselukertaa,22.17,/@helix8150
7nORlgsCnfk,MUTANT SPONGEBOB vs NEJZABEZPEČENĚJŠÍ Bunkr v Minecraftu!,71 671 katselukertaa,15.09,/@helix8150
