Video Id,Title,View Count,Length,Channel
xoio_JWGPzw,hire a team of cranes to lift it #fypシ #funny #mouse #funnyanimals #funnyvideo #dog #funnypets,270 155 322 katselukertaa,0.33,/@mouse11121
YLt73w6criQ,I Paid A Real Assassin To Try To Kill Me,200 950 901 katselukertaa,12.17,/@MrBeast
ns_UFyzI3uU,Camera Records Wife Allegedly Hiring Hit Man to Kill Husband: Part 2,38 809 710 katselukertaa,8.27,/@ABCNews
SkgPFSuppr4,I Hired 50 Real Life Spider-Man!,32 442 164 katselukertaa,8.12,/@MatthewBeem
Tl45jchGK5c,If People Hired Musicians to Soundtrack Their Life.,31 202 799 katselukertaa,0.51,/@DanielLaBelle
yurj7hXt2vU,Don’t hire editors off of Fiver… #goldendoodle #miami #edit,28 366 873 katselukertaa,0.09,/@BrodieThatDood
7sjQzq45DDU,Hire me,23 618 926 katselukertaa,0.55,/@JaySharon
5y-UKg6Ffss,i hired a private investigator to follow me for a month,23 073 015 katselukertaa,0.50,/@MaxFosh
b6fIzFW6M1w,What Happens If You Hire 100 Bodyguards?,22 042 470 katselukertaa,17.09,/@airrack
NgYDJrAduhE,Employment Bond #education #finance #job,21 243 163 katselukertaa,1.00,/@tejasjosh.i
TWZT9dLza1w,I Hired 100 FAKE Paparazzi!,20 588 648 katselukertaa,11.45,/@airrack
s_nc1IVoMxc,Ren - Hi Ren (Official Music Video),19 165 787 katselukertaa,9.20,/channel/UCqq3VcwPGseErHUa0-xLInQ
E1URL_gDZKY,Mom visits her son with Down syndrome at his first job ❤️,16 168 605 katselukertaa,0.17,/@Dylan_Anderson
icA9l-uZUoY,"""Now Hiring at Freddy's"" | FNAF Animated Minecraft Music Video (Song by JT Music)",12 999 420 katselukertaa,6.20,/@EnchantedMob
JR6x1iHKBig,Why you shouldn't hire a Hitman to take out a Superhero,11 016 859 katselukertaa,1.00,/@MannyMeachum
8Y9_h7r_keI,Hiring made easy with Workable,9 377 941 katselukertaa,0.31,/@WorkableSoftware
1V07vUnIEKk,I Hired a Son for a Day,9 320 377 katselukertaa,0.32,/@PrestonYT
FTkYn3fFlMo,"FNAF 6 Song by JT Music - ""Now Hiring at Freddy's"" (Live Action Music Video)",9 173 360 katselukertaa,4.26,/channel/UCzTdZz7z2sPRGCImodwOw0g
iB8cNupBMnU,How to easily get a job,9 079 533 katselukertaa,0.55,/@IamMoBo
mwrUr9aeLFM,Just a red flag #job,9 039 870 katselukertaa,0.52,/@jordan_the_stallion8
