Video Id,Title,View Count,Length,Channel
CTM7QqWEO_o,Foler Railgadi | Vegetable fruit train in bangla | learn fruits in bengali | Kiddiestv Bengali,206 742 684 katselukertaa,4.45,/@KiddiestvBangla
tor4zNgW-g8,Jason Statham's Wife - 2019 [ Rosie Huntington ],15 632 898 katselukertaa,10.07,/@WWEFullLength
x6JIGto-gNo,Eddy Huntington - U.S.S.R. (best audio),7 340 120 katselukertaa,5.57,/@ItaloDiscoKing
WbxPxaU_pUM,When House Tries To Mess With Thirteen | House M.D.,5 711 839 katselukertaa,10.08,/@HouseM.D.
yJUJgDbc_K4,Discoteka 80 Moscow - Eddy Huntington - U.S.S.R.,5 431 444 katselukertaa,4.02,/@sumafabrizio
9e4zp6PRxEY,Huntington - Secret,4 192 366 katselukertaa,3.19,/@wearehuntington
6sSQZw6G2yA,73 Questions With Rosie Huntington-Whiteley | Vogue,4 151 590 katselukertaa,6.51,/@Vogue
XSg9Xc3ie_A,Rosie Huntington-Whiteley's Guide to Perfect Baby Skin | Beauty Secrets | Vogue,4 062 667 katselukertaa,3.59,/@Vogue
vA8F1PCbexw,"Atteinte de la maladie de Huntington, à 21 ans, Chana ne rêve que de mourir",3 579 321 katselukertaa,11.55,/@france3aura
xXV3sz92k8w,View from Huntington Beach Pier,,,/@hbwebmaster1129
fbXbV7D0P-A,One Direction's Covershoot with Rosie Huntington-Whiteley (Behind The Scenes) | Glamour,3 172 876 katselukertaa,1.40,/@glamour
8kNKCe8R0FU,Rosie Huntington-Whiteley Teaches Jimmy Cockney Slang,2 480 042 katselukertaa,2.54,/@fallontonight
LHXiTJYOPHQ,"Eddy Huntington - U.S.S.R. (Disco of the 80's Festival, Russia, 2005)",2 320 511 katselukertaa,3.54,/@Disco80s
oRhtxRb8j8M,THE Rosie Huntington-Whiteley makeup tutorial - starring Rosie!,2 219 855 katselukertaa,15.16,/@LisaEldridge
3Q3PSISAZL8,Solving the Mask Shortage in Huntington Beach,2 183 903 katselukertaa,5.21,/@Chadandjtgodeep
1ez4mSEUsQk,Jen Atkin gives Rosie Huntington-Whiteley her signature waves,2 097 827 katselukertaa,5.32,/@rosiehw
Sb6YjAfB1H0,Living with Juvenile Huntington's Disease,1 974 249 katselukertaa,9.44,/@HDYOFeed
DsFpHItFRlM,Rosie Huntington-Whiteley Photoshoot | British GQ,1 500 753 katselukertaa,2.09,/@BritishGQ
7oVB7uIpU4Q,Rosie Huntington-Whiteley & Hailey have a tea party & make floral bouquets | WHO’S IN MY BATHROOM?,1 491 390 katselukertaa,14.40,/@HaileyRhodeBieber
LysIB_2lvuM,"Every Outfit Rosie Huntington-Whiteley Wears in a Week | 7 Days, 7 Looks | Vogue",1 395 547 katselukertaa,11.53,/@Vogue
