Video Id,Title,View Count,Length,Channel
Rnht_6RpUic,Where do ibis actually live? | The Secret Lives Of Our Urban Birds,7 033 katselukertaa,5.04,/@ABCScience
Tx_jon7z0MQ,Is the Ibis HD6 the only bike you need? We took it to Whistler to find out.,51 447 katselukertaa,26.23,/@FanatikBikeCo
dxzB7STGzMU,Como o ÍBIS se tornou o PIOR TIME do MUNDO??,1 170 767 katselukertaa,7.09,/@soccerjm.futebol
SrY4S3ZhUic,"FUI EM JOGO DO ÍBIS, O PIOR TIME DO MUNDO!",608 534 katselukertaa,17.51,/@Cartoloucos
EM7oSOCQARo,"Stellantis and Saft reveal a smarter, more efficient battery for autos and stationary power.",34 737 katselukertaa,2.02,/@Stellantis_official
QpfptoTigbw,The Most Hated Bird in Australia - The White Ibis | Bird Tales,44 692 katselukertaa,3.00,/@Blinsaff
9FaVVNQ_38k,Armored Core 6 - Ibis Series CEL 240 No Damage Fast Kill,171 300 katselukertaa,2.26,/@_ONGBAL
fNhonrfwi8Q,Ibis HD6 Review: The Goldilocks Enduro Bike?,30 704 katselukertaa,13.05,/@bikersedge
M1xLFISmCFo,RATING IBIS PAINT HACKS,1 878 640 katselukertaa,8.02,/@Kooleen
JarZ7LYF_jY,Ibis,76 007 katselukertaa,6.27,/channel/UCzxsHB_TDeiSKnWCfsRRd_Q
DQ9i-O_lSU4,Ibis Eremita: Un Ave en Peligro Crítico - Documental de animales,56 katselukertaa,2.55,/@Cityanimal
osJ4Bzh84vY,Ibis,290 854 katselukertaa,6.27,/@CriqueCirque
jfs5tw4Ul44,10 Most Beautiful Ibis Species in the World,58 509 katselukertaa,12.18,/@4EverGreenYT
BBmrEc7m6-o,Nile Ibis Birds Create Swimming Pools | BBC Earth,51 461 katselukertaa,0.55,/@bbcearth
XMT5mXlD7_M,Reviewing the Ibis Ripmo V2s- how does it compare?,27 250 katselukertaa,13.42,/@JeffKendallWeed
XKhqY1IiacE,Ibis killer Tom Quach appears in Waverley Local Court | 7NEWS,158 820 katselukertaa,1.40,/@7news
Tu6acJWiC3w,Ibis,106 294 katselukertaa,3.47,/channel/UCzxsHB_TDeiSKnWCfsRRd_Q
mO-OpFjHRbE,"""A SONG ABOUT BIRDS""",5 266 833 katselukertaa,2.23,/@VanVuurenBros
8RMEScVXQAc,"Fujifilm Users, Remember THIS About IBIS!",30 304 katselukertaa,5.09,/@pal2tech
A6H192V65J4,I Stay In A Ibis Hotel!,137 652 katselukertaa,10.22,/@WalkWithMeTim
