Video Id,Title,View Count,Length,Channel
2_K8Zns3s9A,Shakira - Illegal (Official HD Video) ft. Santana,22 888 753 katselukertaa,4.20,/channel/UCYLNGLIzMhRTi6ZOLjAPSmw
Jt6k-aUZwqg,Jdot Breezy - Illegaly Tinted (Official Music Video) (Shot by Faiz),1 044 187 katselukertaa,3.00,/channel/UC6OTHQZgYyYQAaJ2bDqO2Mg
rFO1iqDpMZU,I Collected Every Illegal Item In Minecraft Hardcore,21 771 050 katselukertaa,23.22,/@Kolanii
huHl1d0otyA,Collecting 12 ILLEGAL Items in Minecraft,2 321 869 katselukertaa,18.30,/@SSundee
3GLBEBCwqp4,illegal hamilton is hilarious (and problematic),1 567 322 katselukertaa,53.44,/@CompoundProductions
LBOxIimxDnE,illegally blonde: for your consideration,772 190 katselukertaa,4.58,/@spooksier5085
pL3qySeQzr0,VARGAS BLUES BAND - Illegally (Madrid- Chicago Live),149 792 katselukertaa,4.24,/channel/UC2B1e-B1_eZ359OKgOLZeEA
KMZ4kkSVrBw,Illegally Downloading Music,6 471 963 katselukertaa,11.49,/@NakeyJakey
dfjARKW3LVw,I illegally Snuck Into Disneyland,609 778 katselukertaa,8.08,/@PeteZz
LZgeIReY04c,Never Illegally Download,21 920 901 katselukertaa,0.33,/@bouncinmouncin
98zqn0wSm68,Obviously Filming in Movies Theaters,2 629 355 katselukertaa,9.44,/@KanelJoseph
DTIDCA7mjZs,How to Illegally Cross the Mexico-US Border,1 917 090 katselukertaa,14.51,/@Wendoverproductions
Epe4Gns1Jjc,This Illegal Immigrant Is The Worst,1 057 843 katselukertaa,1.01,/@ConservativeTwins
kyM_9LRMPH0,Why People Risk Their Lives Illegally Riding Behind Trucks for a Living,1 836 733 katselukertaa,10.23,/@FluctusOfficial
z-ZHpr9-_m4,Playing Illegal Versions of GMOD,346 364 katselukertaa,20.12,/@ratlobber
ErQ48cTan1c,Headie One - Illegal (Official Video),1 904 174 katselukertaa,3.40,/channel/UC6rlSDvtzpYWgKrYnpjoH5Q
o8sj7uxLg88,I made an illegal home security sytem,5 532 503 katselukertaa,16.16,/@Ididathing
E2i4oaRoaG0,"Legal in the US, But Illegal Elsewhere",2 456 318 katselukertaa,15.24,/@LegalEagle
I7vNrxGPLr4,How To Illegally Earn $20 Million With THIS,1 848 720 katselukertaa,25.54,/@BeAmazed
SVEoC-gkbOU,WATCH an Illegal Traffic Stop Start to Finish. Bogus Dog Alert.,776 881 katselukertaa,10.02,/@InstituteForJustice
