Video Id,Title,View Count,Length,Channel
q8pV18WDtWg,i'm an illustration reject âœŒï¸,49Â 492 katselukertaa,14.26,/@furrylittlepeach
QzKllUEWZFs,5 TIPS TO MAKE YOUR ILLUSTRATIONS BETTER,144Â 587 katselukertaa,9.27,/@LucasPeinador
np6p51VwvEU,Illustration process,7Â 529 katselukertaa,10.03,/@alexvede2119
Vit5W3M3pdY,THE ART OF ILLUSTRATION PART 1,123Â 930 katselukertaa,14.12,/@petebeard
8vxKQHQZZLo,work on a commission with me! âœ¨ artist vlog // illustration process,22Â 402 katselukertaa,16.27,/@KatieMai
ReQpwgHk1xc,7 Tips For Being Consistent With Your Art âœ¨ Lessons Learned From Drawing Every Weekday For A Year!,75Â 317 katselukertaa,11.32,/@MimimooIllustration
Gnhxny0STrk,How I Built My Art Business From Nothing - My Business Strategy and Journey To Being An Illustrator,763Â 912 katselukertaa,15.40,/@MimimooIllustration
RPgBQqqBwBw,how I started my illustration career,10Â 997 katselukertaa,23.09,/@sunnykabocha
Q2bmNgTOlvg,illustrator doing illustration things â˜¼ studio vlog,90Â 092 katselukertaa,24.16,/@FranMeneses
2axc6P3FDK8,Strawberry Season ğŸ“ #pidgindoll #strawberry #strawberryaesthetic #fashionillustration #illustration,1Â 685Â 546 katselukertaa,0.30,/@PidginDoll
c0hyyod5lC0,Finding Your Illustration Style Through Iteration,12Â 008 katselukertaa,5.27,/@GregKletsel
mBGmf3PnJxQ,UNSUNG HEROES OF ILLUSTRATION 89   HD 1080p,9Â 578 katselukertaa,13.56,/@petebeard
Ib8UBwu3yGA,Adobe Illustrator for Beginners | FREE COURSE,9Â 318Â 739 katselukertaa,3.17.15,/@envatotuts
XeyXDkIHy8U,10 MUST DOs to Find Your Illustration Style,11Â 073 katselukertaa,40.03,/@TomFroese
6N3LsN-PtIc,How To Draw A #FashionDoll #drawingtutorial #pidgindoll #drawing #fashionillustration #illustration,10Â 022Â 870 katselukertaa,0.31,/@PidginDoll
8eghHiSNdQ4,Quick Flower design Tricks #illustrator-Design #short tutorial,70Â 233 katselukertaa,1.00,/@TechBirdsw
Q0QOqJvhRm4,30 Illustrator Secrets Graphic Designers MUST KNOW!,297Â 073 katselukertaa,7.54,/@ForeverDansky
OvBkYMNh07I,What Should You Learn First as an Illustrator? (Part 1) | Thoughts on Illustration Episode 3,5Â 072 katselukertaa,36.32,/@TomFroese
Y64BZn6tnVM,Easily make seamless patterns with this tool!,84Â 059 katselukertaa,0.49,/@abiconnick
v7_VvZEPLHQ,Studying Illustration at Art Uni | My First Week!,24Â 126 katselukertaa,23.36,/@artwithem6635
