Video Id,Title,View Count,Length,Channel
HwqAOolZJLc,Alien dance VS Funny alien VS Dame tu cosita VS Funny alien dance VS Green alien dance VS Dance song,124Â 110Â 269 katselukertaa,4.04,/channel/UCO1n94JTCasKSABHk6Dc_fg
8a-4ufvONa0,"à¦¦à§à¦·à§à¦Ÿ à¦¬à¦‰à¦¯à¦¼à§‡à¦° à¦¦à§à¦·à§à¦Ÿà¦¾à¦®à¦¿ | Dusto Bower Dustami | à¦œà§€à¦¬à¦¨ à¦¬à¦¦à¦²à§‡ à¦¦à§‡à¦¯à¦¼à¦¾ à¦à¦•à¦Ÿà¦¿ à¦¶à¦°à§à¦Ÿà¦«à¦¿à¦²à§à¦® | ""à¦…à¦¨à§à¦§à¦¾à¦¬à¦¨""- à§§à§¬",6Â 962Â 227 katselukertaa,13.54,/@ZSMultimedia
3-hEHTPfUWY,I Bought a Rs.30000 AI Dancing Robot !,6Â 786Â 784 katselukertaa,7.49,/@TechBurner
vGUcSObZ0to,My New Robot Friend is MAD ğŸ˜‚,6Â 176Â 774 katselukertaa,11.45,/@urmilaaa
EaGU8VvaOs4,imo video call live | video call record from my phone,5Â 622Â 576 katselukertaa,0.45,/@supervideocalls2348
M64HUIJFTZM,"The unexpectedly hard windmill question (2011 IMO, Q2)",4Â 611Â 924 katselukertaa,16.03,/@3blue1brown
v_USbdkK0IQ,Tastes better imo #amazon #amazonfinds #amazonhome #amazonlife #founditonamazon,1Â 586Â 586 katselukertaa,0.25,/@GeniusGifts
_Vavc3Rd-uw,IMO LANG | INFLUENCE WORSHIP Official Lyric Video,1Â 490Â 377 katselukertaa,6.15,/channel/UCXUX0KGuACRZSHYTHvpr_aQ
h1FGSyDyIX0,imo video call see live 40,1Â 463Â 050 katselukertaa,1.08,/@indianlivecall
xuE8feRi4P8,imo video call see live video calling (92789),1Â 301Â 257 katselukertaa,1.24,/@videocreatorarifa8177
YeY-2epxS98,This Robot can do some SECRET TRICKS ! (Living Emo robot),1Â 187Â 834 katselukertaa,12.12,/@OnespotTech
4tjNzVktwPc,How to Install IMO on Laptop/PC,1Â 094Â 931 katselukertaa,3.12,/@Lifedefaulters
QPBg28VNxj8,imo kivabe khulbo || How to open imo account,1Â 082Â 222 katselukertaa,2.48,/@TechBanglaunlimited
Y7pbEoCQJzw,Imo video call live | video call record from my phone,1Â 054Â 982 katselukertaa,0.42,/@supervideocalls2348
yA1Mk7xLyyY,Urvasi | New Odia Romantic Song | Sailendra | Priyambada | Abinash Dash | Raja D | IMO,1Â 022Â 305 katselukertaa,4.34,/@influxmusicofficials
SV9pmph1ny8,"How to Record Video call on IMO, Skype, Whatsapp, Facebook on Mobile",1Â 006Â 344 katselukertaa,3.25,/@FahedZaman
kfh-HAMRxe0,imo video call live | video call record from my phone,984Â 935 katselukertaa,0.33,/@supervideocalls2348
FlP2PQmtlRc,imo App : How to use,852Â 503 katselukertaa,2.05,/@AppDemoVideosAppPreviewVideo
aDi6Zz1aILQ,imo video call see record | imo call recording video call 2021 | imo live video call record 45,754Â 021 katselukertaa,0.46,/@liverecordson6412
2kXBHpF_FAc,imo video call live | video call record from my phone,634Â 502 katselukertaa,0.51,/@supervideocalls2348
