Video Id,Title,View Count,Length,Channel
NTO7DSifbKU,How Much Money My Importing Business Makes,41┬а108 katselukertaa,11.03,/@JamesSinclairEntrepreneur
8YdXyCHk_9M,THE JDM IMPORTING PROCESS EXPLAINED: How to import a Japanese car yourself,76┬а641 katselukertaa,18.07,/@CollectorCarFeed
geoe-6NBy10,"Imports, Exports, and Exchange Rates: Crash Course Economics #15",2┬а169┬а753 katselukertaa,10.11,/@crashcourse
hF3J4ViCKM8,Importing,81┬а690 katselukertaa,0.58,/channel/UC-bXlG2xlMylwcaQigx-XmQ
PwF-ki-oIDw,Importing FDA-Regulated Products: The Import Process,27┬а193 katselukertaa,10.55,/@US_FDA
Y0-8eLBMrF8,Importing to the Philippines (MUST WATCH) | John Smulo,4┬а517 katselukertaa,39.46,/@JohnSmuloTV
zgubu1VV8F0,Gino Marley: Importing (Official Music Video),300┬а586 katselukertaa,2.32,/@SmokeBoothHoe
tb7PNEU1r5w,5 Mistakes New Importers Make When Importing Products from China,592┬а919 katselukertaa,13.39,/@WholesaleTed
QMqKd7HGBbQ,Importing and demultiplexing,10┬а769 katselukertaa,16.23,/@QIIME2
uv59gtrrEQI,Importing From China - A Simple Formula For Success And Where To Find Suppliers,11┬а582 katselukertaa,10.03,/@mywifequitherjob
GxCXiSkm6no,Importing Your Own Python Modules Properly,107┬а687 katselukertaa,9.56,/@NeuralNine
rsNQ8JTDZKI,Learn from an Importer about importing a JDM or GC8 Subaru WRX STi into Australia,10┬а635 katselukertaa,15.30,/@wrxcult8266
YS7PqtZnZH8,Import export millionaire explains how he made it BIG!,80┬а947 katselukertaa,11.47,/@AaronVankampen
uHEG67Fdf5c,World's Largest Importing Countries from 1948 to 2019,140┬а835 katselukertaa,3.11,/@AnimatedStats
pyFx_CXBowM,So You Want to Import a Car,205┬а827 katselukertaa,12.03,/@FitmentIndustries
0AgIT5mmH5Y,Dubai рд╕реЗ рдХрд╛рд░ import рдХрд░рд╛рдиреЗ рдореИрдВ рдХрд┐рддрдирд╛ рдЦрд░реНрдЪрд╛ рдЖрддрд╛ рд╣реИ?,2┬а789┬а251 katselukertaa,0.59,/@officialrj23
g6AMQYjn7TM,рдмрд┐рдирд╛ TAX рднрд░реЗ 2022 Endeavour India рдореЗрдВ | Importing 2022 Ford Endeavour to India with ATA Carnet,209┬а982 katselukertaa,7.38,/@carversal
2Zqe5PqKkQM,Lightroom Importing MASTERCLASS,26┬а478 katselukertaa,16.55,/@AnthonyMorganti
N2zvL_GUJ1U,THINGS YOU NEED TO KNOW BEFORE YOU START IMPORTING ЁЯТп ЁЯЗ╡ЁЯЗн,17┬а552 katselukertaa,13.26,/@TinsSicangco
93R57sLATM4,Dynamic Importing (Code-Splitting) | ES2020,10┬а395 katselukertaa,4.06,/@codu
