Video Id,Title,View Count,Length,Channel
34c2cAI8DmQ,My inability to gain weight as a kid | MAKEUP STORYTIME #shorts,4 727 359 katselukertaa,0.56,/@CindyChenDesigns
I-HGUbstWs4,Najar - Mourn My Inability,24 373 katselukertaa,5.25,/@najar2776
4fFyyPZiGYA,The only true disability is the inability to accept and respect differences | #Shorts,69 338 969 katselukertaa,0.56,/@evancarmichaelshorts
WZVDV2prR6g,Inability Meaning,3 715 katselukertaa,0.25,/@SDictionaryEd
u29ze38J6_I,INABILITY - Meaning and Pronunciation,247 katselukertaa,0.19,/@accenthero-americanenglish1740
TrNzHWDu61M,Human Inability - Charles Spurgeon Audio Sermons,17 593 katselukertaa,42.24,/@ChristisLord
igY-fykdu3I,"Inability - A Gospel Principle for Parents, by Paul Tripp",1 644 katselukertaa,1.56,/@PaulDavidTripp
Yta1ZOPRC3g,Inability | meaning of Inability,533 katselukertaa,0.47,/@DefinitionOfTheWords
41TrrC0Ix8o,The Inability to Receive is a Trauma Response - Self-Empowerment,92 katselukertaa,3.17,/@jinghashem
tYtNk0BotRE,Developmental Psychology: Categorization inability,171 861 katselukertaa,2.29,/@Cugel2006
nzeuAt_tusA,THE INABILITY TO SELF-ASSESS (TGIM),72 181 katselukertaa,8.52,/@etthehiphoppreacher
CPQs3cpyGbQ,inability to think !! || Khunman #shorts #subscribe #share #art #youtubeshorts #viral,5 355 katselukertaa,0.23,/@khunman
GVk2zyBbu0o,Depression is an inability to construct a future. [TYS],7 375 katselukertaa,1.30,/@KillerQueen97
PyLxthqL42g,Disability is the Inability to See People as More,1 844 katselukertaa,14.28,/@sapientindia
4B938Tg3B1Y,BarBQ — Inability To Speak (Original Mix),2 219 katselukertaa,5.06,/@highwayrecs
IabOuPflZfE,Rick Warren on Total Inability: The need for clarity,7 007 katselukertaa,26.43,/@Soteriology101
xMBUC5HCEvU,The hidden reasons behind your inability to love others,1 925 katselukertaa,0.25,/@warrior_creed
fMombzbOr7w,Inability To Shut Off: Stress Awareness Month,54 katselukertaa,1.34,/@bodyshotperformancelimited8480
qqFs6U7NIgw,Is your nervous system & stored trauma to blame for the inability to lose weight or heal? Irene Lyon,2 501 katselukertaa,47.44,/@SarahKleinerWellness
7uJwMmjAemc,How I Healed ANHIDROSIS (the inability to sweat)!,1 354 katselukertaa,0.56,/@MarcWilliams
