Video Id,Title,View Count,Length,Channel
BvsvaCU6i1M,The World's FASTEST (and most INACCURATE) VIOLINIST!,10 246 874 katselukertaa,13.48,/@twosetviolin
41v3L0zCkNY,An Incorrect Summary of Metal Gear Rising | Part 1,9 216 955 katselukertaa,19.14,/@Max0r
TgmTsa3rFU0,An Incorrect Summary of Metal Gear Rising | Part 2 | Sons of Obesity,9 104 925 katselukertaa,22.02,/@Max0r
ZvjeXN_BWkE,"Every Mythical Inaccuracy in Disney's Hercules (300,000 subscriber special)",8 301 991 katselukertaa,25.58,/@TheMythologyGuy1
BKx1oGw0IRM,An Incorrect Summary of ULTRAKILL | Act 1,5 503 363 katselukertaa,23.29,/@Max0r
_-pYzbXSqss,Trevor Henderson Giants Comparison(Inaccurate Version),5 480 582 katselukertaa,1.15,/@AustraliaPM
r-dRwrbElRo,Top 10 Historically Inaccurate Movies,4 379 769 katselukertaa,14.19,/@WatchMojo
ojBwASARAzo,History Buffs: Braveheart,3 715 343 katselukertaa,24.43,/@HistoryBuffs
jnB2Uj7gWSE,Hilariously Inaccurate Medieval Art of Animals,3 273 943 katselukertaa,6.46,/@CuriousArchive
gGxtJY2Q6vA,Top 10 Scientific Inaccuracies in Jurassic Park,3 090 135 katselukertaa,10.22,/@WatchMojo
PzmDrUu8tlY,Top 10 Misleading Movie Trailers,2 741 820 katselukertaa,11.26,/@WatchMojo
UkunILryklI,Top 13 Most Inaccurate Fossil Reconstructions,2 557 146 katselukertaa,14.51,/@TREYtheExplainer
pDVDyWWbsf0,The Presidents' Song | All the Inaccuracies,2 474 992 katselukertaa,7.32,/@DeuteriumtheSentientMattress
cYVwOv8Pevg,Yakko's World [3.0] | All the Inaccuracies,2 141 147 katselukertaa,15.00,/@DeuteriumtheSentientMattress
HsJ9ydvKxSc,Donald Trump Explains Why Alec Baldwin’s ‘SNL’ Portrayal Is ‘Inaccurate',1 977 654 katselukertaa,2.21,/@extratv
5RTUKWauR9M,5 Ancient Body Myths that Are Wildly Inaccurate,1 699 503 katselukertaa,12.17,/@SciShow
ZiWLm7ASxL4,"The Accuracies and Inaccuracies of 10,000 BC (Part 1)",1 510 800 katselukertaa,19.21,/@TREYtheExplainer
7po41hJUsus,Listing Every Historical Inaccuracy in Call Of Duty Vanguard,1 456 364 katselukertaa,26.03,/@TheFrosty_1
sxYrzzy3cq8,How statistics can be misleading - Mark Liddell,1 298 328 katselukertaa,4.19,/@TEDEd
1giQ7UzzP8k,How To Fix WhatsApp Error Your Phone Date Is Inaccurate Adjust Your Clock And Try Again,1 250 212 katselukertaa,2.31,/@helpinghuman6791
