Video Id,Title,View Count,Length,Channel
eadpX3FNs9w,Q U E S T (Synthwave/Chillwave/Retrowave MIX),806Â 564 katselukertaa,2.05.02,/@INEXED
cCTaiJZAZak,E X O D U S  ğ—©ğ—¼ğ—¹. ğŸ­ (Synthwave/Chillwave/Retrowave MIX),2Â 028Â 387 katselukertaa,2.14.53,/@INEXED
5p_kechQOao,FamilySearch Indexing | How it Works,64Â 736 katselukertaa,1.49,/@familysearch
CNjVtqDnSXU,Best Fixed Indexed Annuities (FIAs) For Retirement in 2023,1Â 945 katselukertaa,14.30,/@GuaranteedRetirementGuy
0pxQxX1OfIw,Crawling vs Indexing - How to Index a Site in Google,1Â 338 katselukertaa,3.57,/@VascoSEOtips
utOuoohiMoQ,Lesson 4: Intro to Indexed sets and Example 1,4Â 483 katselukertaa,12.34,/@jonasr
7TjAVBudXy4,How To Get Indexed By Google | SEO Case Study Part 3 Setting Up The Blog To Get Indexed by Google,1Â 681 katselukertaa,8.59,/@ChrisMWalker
F264FpBDX28,How to use Excel Index Match (the right way),3Â 367Â 826 katselukertaa,11.32,/@LeilaGharani
Xtly0OdII_w,Indexed Universal Life's Fees Examined and Explained,7Â 849 katselukertaa,15.05,/@BankingTruths
FBuc3gYyFK8,Indexed Annuities - EXPLAINED!,80Â 847 katselukertaa,2.47,/@LivingBenefits
xAQga907NVU,Database Index Fundamentals,38Â 741 katselukertaa,4.20,/@ComputerScienceLessons
pSLkKiUp4Do,"How to Fix Indexing Problems in Google | Discovered, currently not indexed",13Â 514 katselukertaa,14.57,/@Key2Blogging
6JhbY8Mku1A,INDEX MATCH Excel Tutorial,272Â 111 katselukertaa,15.29,/@KevinStratvert
mXwL8C0jEcg,INDEXED by Mirrah Miraculous,2Â 312 katselukertaa,2.56,/@SaturnMagicShop
1towT-6Y9QM,Why You May Consider Purchasing an Indexed Annuity Right Now with Aaron Andrew,7Â 118 katselukertaa,12.50,/@missedfortune
4xBWaXpZD7M,3 Easy Steps to Submit Your Site to Google and Get Indexed For SEO,149Â 833 katselukertaa,1.47,/@neilpatel
7s_qNl4Orxo,13 Understanding Indexed Views,3Â 667 katselukertaa,4.31,/@datawarehouse6512
sW4lI86erq0,Google Indexing Issues: What I Do To Keep Up,4Â 590 katselukertaa,7.40,/@PassiveIncomeGeek
uFnXPaMxyUo,Search results may be incomplete because items are still being indexed.,125Â 730 katselukertaa,2.09,/@3CherriesTechTips
zPa2oI3V1yA,Get creative with color in Photoshop's 'Indexed Color' mode,5Â 174 katselukertaa,9.29,/@Sevenstyles
