Video Id,Title,View Count,Length,Channel
Ncd4gKmZImw,Nightcore - Infected (Lyrics),54 044 975 katselukertaa,3.05,/@ChinoNightcore
zQGOcOUBi6s,The Immune System Explained I – Bacteria Infection,53 327 184 katselukertaa,6.49,/@kurzgesagt
eLSc9ZZ1UJI,1000 People vs 1 Infected!,41 653 413 katselukertaa,9.06,/@MrBeastGaming
aOPdRuZYVMU,Infections On the Human Brain,40 771 448 katselukertaa,0.23,/@TheAnatomyLab
0CgNbYhT7cE,Infected Cyst on Mid-back,35 189 664 katselukertaa,8.33,/@DrGeoffButler
XT8HrAyvhCo,"Believe ME! Dandruff can cause a serious Scalp ""INFECTION"" 😱 #shorts",33 219 563 katselukertaa,1.00,/@ProfessorOfHow
EUbIxVZEGbE,Drainage of Infected Epidermal Cyst,32 625 352 katselukertaa,7.33,/@DrGeoffButler
FVw8y6zM01E,"741Hz, Cleanse Infections & Dissolve Toxins, Aura Cleanse, Boost Immune System, Meditation",27 077 539 katselukertaa,3.19.32,/@MusicforBodyandSpirit
-hOIwiVcn6g,( 1/3)Villagers Infected With A Bizarre Virus Turned Into Monsters#shorts #movie,21 438 612 katselukertaa,0.59,/@elephantmovie4607
qlinKNqHCyg,Tobu - Infectious (Original Mix),18 106 261 katselukertaa,5.18,/channel/UCAA6pKrh72sARBb7JCfp8AA
H3N3HBepekE,MAKING MY OWN ZOMBIE ARMY!! | Roblox Infection Inc.,16 751 462 katselukertaa,39.03,/@GamingWithKev
W2M2JuE9azU,He was bitten by a dog twice😨Rabies Infected Case| Raj Bhosle #shorts #medical #viral,16 659 256 katselukertaa,0.16,/@therajbhosle
j9Mzyf_B8rQ,"741 HZ- CLEANSE INFECTIONS, VIRUS, BACTERIA, FUNGAL- DISSOLVE TOXINS & ELECTROMAGNETIC RADATIONS",16 625 242 katselukertaa,1.00.06,/@GoodVibesMusic
72rCS9v3Wro,Don’t Get an Infected Ear Piercing 😱 #shorts,16 566 138 katselukertaa,0.10,/@doctorricky
_yAaoe-XyEE,Derp Infection (Minecraft Animation),16 257 888 katselukertaa,7.06,/@SquaredMediaAnimations
ch2H-aFFHW4,BITTEN by the infected... But What Happens Next? The Last of Us,15 266 264 katselukertaa,0.53,/@MR_ILLUSTRATED
93IU_GVJtlg,ASMR Remove 6 layers of contact lenses cause of eye infections | Rheum deep cleaning,14 772 683 katselukertaa,4.09,/@healingsoulasmr
RlcLy5oheCA,"ROTTEN, BACTERIA INFECTED cows HOOF ... dealing with a COMPLICATED ULCER | The Hoof GP",13 739 447 katselukertaa,4.53,/@TheHoofGP
m9LTPksZhls,"LARGE BALLOONING COW HEEL, INFECTED COW'S FOOT | 12 Hooves of Christmas",12 936 025 katselukertaa,10.31,/@TEC_TV
FSxOtCv4QLw,Wearing ear buds in the summer could give you a nasty infection that swimmers dread,10 982 085 katselukertaa,1.17,/@InsiderBusiness
