Video Id,Title,View Count,Length,Channel
nkGiFpJC9LM,Inbred Family-The Whittakers,39 627 450 katselukertaa,12.31,/@SoftWhiteUnderbelly
XCCkTz-qzJA,"Love, Incest, and the Mafia by Maurice Kamhi",13 081 460 katselukertaa,15.11,/@mauricekamhi2860
l4aAIF-iW9U,Inbred Family-The Whittakers (follow up),11 400 856 katselukertaa,24.51,/@SoftWhiteUnderbelly
WnzMPF6vFJk,The Whittakers-Spring 2022,9 259 315 katselukertaa,32.37,/@SoftWhiteUnderbelly
jQp0KowG67A,German brother and sister practice incest,8 971 800 katselukertaa,2.50,/@LinuxKid27
TLaLIUhRU1k,'I Have Three Children With My Father',8 159 253 katselukertaa,3.56,/@drphil
JMRNbsobE5M,Why Incest Should be Legalized!,7 308 022 katselukertaa,25.54,/@JiDion
VNr5FyZp9rI,What Happens When You Inbreed?,7 231 886 katselukertaa,2.41,/@AsapSCIENCE
4K-_KbbRiEE,"Wealthy Mother Tries To ""Fix"" Son with Incest - YEAH WTF - Mystery&Makeup | Bailey Sarian",6 773 739 katselukertaa,26.14,/@BaileySarian
FcInMQGcMaQ,What The Incest Brother Does if U Kill His Sister and Runaway - Red Dead Redemption 2,5 746 712 katselukertaa,4.36,/@BabyZoneGaming
Yz0ft0YhNHU,INCEST MURDERS: The Most HORRIFIC Story You've EVER Heard • EWU Story Time & Crime Documentary,5 368 978 katselukertaa,16.14,/@ExploreWithUs
O7HA-Y6jz10,Incest Survivor interview-Star,5 332 207 katselukertaa,1.02.43,/@SoftWhiteUnderbelly
3iY5gWdS7So,Top 10 Best Incest Anime EVER HD,4 986 768 katselukertaa,16.09,/@ChronexiaMisty
U8EAljABohM,I Went to the Incest Capital of America…,4 631 800 katselukertaa,9.46,/@TylerOliveira
eFog6enc6HE,Star Wars: How Much Incest?,4 610 344 katselukertaa,2.50,/@deshrektives
8qV9dRl4EkY,"‘Did You Say To Yourself, ‘I’m Actually Having Sex With My Child’?’ Dr. Phil Asks Guest",4 213 884 katselukertaa,3.06,/@drphil
fhfcWTZeP1k,Folgers Incest Commercial - Extended Cut,4 193 526 katselukertaa,2.10,/@aboveaverage
01AeVaKmcE4,Joe Rogan: How Did Mark Meet The Whittakers? INSANE Story!!,3 871 798 katselukertaa,7.59,/@JREDailyClips
14jnS-GYaEk,American Dad - Incest Jokes,3 688 369 katselukertaa,3.30,/@AddictedtoAmericanDad
5Hhuj_xOTMk,America's Most INBRED Family,3 345 445 katselukertaa,8.02,/@Eskify
