Video Id,Title,View Count,Length,Channel
3ctoSEQsY54,How Does Insurance Work?,212 060 katselukertaa,8.01,/@ConcerningReality
qjXgpJpSlCc,Insurance Explained - How Do Insurance Companies Make Money and How Do They Work,1 059 990 katselukertaa,6.58,/@TheInfographicsShow
pEdLM8904S0,"Newborn, Adopted and Fostered Children on the Health Insurance Exam",278 katselukertaa,3.18,/@insuranceexamqueen
-wpHszfnJns,A terrible guide to the terrible terminology of U.S. Health Insurance,2 234 273 katselukertaa,30.19,/@briandavidgilbert
6aDL5_jmzEg,Things to Know Before Choosing the Best Health Insurance Policy #Shorts #healthinsurance #insurance,236 647 katselukertaa,1.00,/@ffreedomapptelugu
eujZ1ZW2gfA,‘Pay How You Drive’ Car Insurance,1 789 548 katselukertaa,0.45,/@financewithsharan
5ldLXxLhMHw,Health Insurance Will Get Rejected If You Don’t Know This ft. Anant Ladha,2 455 496 katselukertaa,1.00,/@financewithsharan
L-z1Ek7S6z0,Whole Life Insurance Explained | @GarrettGundersonTV,234 katselukertaa,35.05,/@LIFE180
_UFw8rfeYAw,Insurance companies don't want you to know this! #LLAShorts 382,1 638 993 katselukertaa,0.59,/@LabourLawAdvisor
luQhMITT_9o,This Is Why Your Company Health Insurance Is NOT Enough.,2 913 019 katselukertaa,1.01,/@financewithsharan
N64LarhB7R0,I Took Out Life Insurance Whilst Risking My Life,1 002 551 katselukertaa,9.51,/@MaxFosh
CROpnE2BNGQ,Hack To Get 30% To 40% Cheaper Health Insurance.,5 669 135 katselukertaa,1.01,/@financewithsharan
pvxFm--Gxiw,"Do This For The Sake Of Your Family, While Getting Insurance.",2 744 343 katselukertaa,1.00,/@financewithsharan
45uoXvv_7t8,How to choose a GOOD life insurance policy,14 009 katselukertaa,0.54,/@itsrosehan
jBf_PqlautE,Cash Course: Insurance Basics,8 389 katselukertaa,5.51,/@PragerU
saKWwupxY1Y,Insurance Scam Fails 2022 (Caught on Dashcam),17 912 932 katselukertaa,8.04,/@AVCH
tdkJ3Q6ynoc,2023 Best Rs 1Crore Health Insurance,190 098 katselukertaa,52.36,/@daytradertelugu
n5RRJh5mTL0,Property & Casualty Insurance Exam: Home & Auto Class,77 040 katselukertaa,1.56.14,/@insuranceexamqueen
VvlY4fTZMNk,Insurance HACK that NO ONE will tell you,791 103 katselukertaa,0.42,/@financewithsharan
