Video Id,Title,View Count,Length,Channel
LNNBHX0CnXI,Evolution of the iPod [2001-2022],1 962 342 katselukertaa,13.46,/@Flatlife
VE3X9lmDZTs,4000GB in an iPod Classic.,2 507 041 katselukertaa,18.04,/@DankPods
TqmxUo-dtHQ,Opening iPods the wrong way.,763 215 katselukertaa,8.26,/@DankPods
gWt6zZ2T7j0,The absolute worst bootleg iPod.,1 951 785 katselukertaa,13.27,/@DankPods
xjFPX7EoINs,The 2019 iPod Touch: Why Does It Exist?,8 383 997 katselukertaa,9.00,/@mkbhd
SHw5iZ0tI48,How the iPod Made Apple Relevant Again,275 263 katselukertaa,15.10,/@ColdFusion
gok8tLU7eZo,CAN I USE iPOD IN 2022?,1 535 991 katselukertaa,13.08,/@Plainrock124
t9oLpD4FAO4,Reviewing Every iPod Ever - 20 Years of Apple iPod (Documentary),1 725 867 katselukertaa,1.57.39,/@91Tech
vZmIhkheSAI,Retro Buyer's Guide: Apple iPod!,394 587 katselukertaa,52.45,/@ThisDoesNotCompute
nfP9qc2rmOY,The iPod turned 20.,696 731 katselukertaa,12.05,/@DankPods
j_c05LEXhhQ,The Rise And Fall Of The iPod,1 289 852 katselukertaa,10.54,/@InsiderBusiness
KcwpY5W7S1s,The iPod Nano stinks.,2 518 942 katselukertaa,9.17,/@DankPods
UsW4sqQOgWc,why i still use an iPod,120 613 katselukertaa,9.51,/@canoopsy
sI44Emzey8w,The ULTIMATE iPod Tier List!,105 486 katselukertaa,33.33,/@snazzy
YuRoWqBcj_0,Why Apple Discontinued The iPod,232 410 katselukertaa,2.53,/@AppleExplained
6wr0vQ_TwYI,Reviewing Every iPod touch! RIP iPod,88 534 katselukertaa,21.30,/@UltimateiDeviceVids
gxTNlNYkECQ,Unboxing new iPod touch 7th gen (2021),3 701 862 katselukertaa,7.10,/@MetalJesusRocks
Sx9yH7GsEck,Collecting Apple iPods in 2021. Am I NUTS?!?,178 246 katselukertaa,14.35,/@MetalJesusRocks
OwAHKrraIwM,FALLOUT 3 IPOD NANO! 🤯,844 956 katselukertaa,0.22,/@MrsFallout
D5E15NllKZM,Surprise Apple iPod Touch (7th generation) | They Had No Idea | The LeRoys,775 910 katselukertaa,13.10,/@TheLeRoys
