Video Id,Title,View Count,Length,Channel
T56WnaTS-UE,LARVA - YELLOWS LEMON STAND | Larva 2018 | Cartoons | Comics | Larva Cartoon | LARVA Official,61Â 177Â 188 katselukertaa,36.49,/@Larvatuba
vGzGiWn-uVA,"Hogi Pyaar Ki Jeet (1999) || Ajay Devgn, Mayuri Kango || Hindi Romance Comedy || NH Studioz",59Â 179Â 367 katselukertaa,2.29.58,/@nhstudioz
uHFJ9qhR0VM,"George Duke Trio ""It's On"" Live at Java Jazz Festival 2010",20Â 825Â 078 katselukertaa,8.33,/@JavaJazzFest
smP4vBPNuYQ,Jawan |Official Tamil Prevue |Shah Rukh Khan |Atlee |Nayanthara |Vijay Sethupathi |Deepika |Anirudh,16Â 346Â 390 katselukertaa,2.13,/@RedChilliesEntertainment
3vauM7axnRs,Java Project Tutorial - Make Login and Register Form Step by Step Using NetBeans And MySQL Database,14Â 896Â 581 katselukertaa,3.43.31,/@1BestCsharpblog
iTtZRaL7ZZ8,JAVA - Dunyo seni Tog'angmas  (Official Audio),14Â 311Â 308 katselukertaa,2.54,/@javamusicc
v2XIYgNlP-Q,Java VS Bedrock Things!,11Â 322Â 615 katselukertaa,9.13,/@skipthetutorial
W6NZfCO5SIk,JavaScript Tutorial for Beginners: Learn JavaScript in 1 Hour,10Â 965Â 968 katselukertaa,48.17,/@programmingwithmosh
dHHmEHuMAAo,Minecraft JAVA vs. BEDROCK ğŸ˜±â› Â¿CUAL ES MEJOR? | MIKECRACK,10Â 115Â 868 katselukertaa,9.28,/@Mikecrack
f2YvnLIV61M,Java Apple or Avacado? Who win? #shorts #funny,10Â 035Â 440 katselukertaa,0.14,/@elmoofficial
eIrMbAQSU34,Java Tutorial for Beginners,9Â 722Â 311 katselukertaa,2.30.48,/@programmingwithmosh
yRpLlJmRo2w,Introduction to Java Language | Lecture 1 | Complete Placement Course,9Â 220Â 110 katselukertaa,18.46,/@ApnaCollegeOfficial
xk4_1vDrzzo,Java Full Course for free â˜•,7Â 899Â 284 katselukertaa,12.00.00,/@BroCodez
xcfnmAe4wfQ,The Java Guitars: Red  River Rock,7Â 732Â 262 katselukertaa,3.48,/@armandofilon
CpWoS8KawmY,Which Version is Better? Java or Bedrock? (main differences),7Â 258Â 163 katselukertaa,0.56,/@camman18
m2dSDjZtxww,java vs bedrock v11,7Â 255Â 254 katselukertaa,1.31,/@Alexa_Real
oFtx79Cy2GA,Java vs Bedrock,7Â 166Â 777 katselukertaa,9.29,/@zfazt
in4hvkiBrAM,JAVA - U kelmaydi  (Mood video),7Â 015Â 263 katselukertaa,3.05,/@javamusicc
