Video Id,Title,View Count,Length,Channel
2mgUPt2KI08,The Life of Jesus | English | Official Full HD Movie,58 575 452 katselukertaa,3.03.10,/@ThelifeofJesus
lKM-8CZRplI,Jesus I Need You - Hillsong Worship,121 974 545 katselukertaa,5.09,/channel/UC4q12NoPNySbVqwpw4iO5Vg
ivUb1K0B0zE,Yeshua | Jesus Image | Michael Koulianos,62 818 936 katselukertaa,19.08,/channel/UCu-rO0kN-fbuGKTllbuEvZw
8xs_wiKWZuc,Holy Are You Lord Medley | Jesus Image,1 785 509 katselukertaa,54.09,/channel/UCu-rO0kN-fbuGKTllbuEvZw
PcmqSfr1ENY,Charity Gayle - I Speak Jesus (feat. Steven Musso) [Live],62 657 089 katselukertaa,7.47,/channel/UCIfcyaWxjySIXHQO_Yt26rQ
50IiF1rTTGQ,Jesus Of Nazareth (Full Movie)1977,5 300 114 katselukertaa,6.20.28,/@Repenttv
XOZ8Zw9a718,A Vida de Jesus | Portuguese | Official Full HD Movie,25 188 717 katselukertaa,2.55.43,/@ThelifeofJesus
AuF853nKqYg,Jesus Christ - Life Changing Quotes,4 760 756 katselukertaa,4.46,/@RedFrostMotivation
pAG7OWZ_G1c,Jesus Explained Who He Was Before The Creation Of The World.,1 051 115 katselukertaa,21.33,/@GraceDigitalnetwork
-Td05XH0TDg,The Jesus Film | English | Official Full Movie HD,11 619 082 katselukertaa,2.07.54,/@ThelifeofJesus
u1xrNaTO1bI,Depeche Mode - Personal Jesus (Official Video),178 196 405 katselukertaa,3.46,/channel/UCM-CWGUijAC-8idv6k6Fygw
7Uzfa9-GzR4,"The Holiness of God | Michael Koulianos | Sunday Night Service | September 10th, 2023",38 742 katselukertaa,3.32.40,/channel/UCu-rO0kN-fbuGKTllbuEvZw
J39RujudSuQ,La Vida de Jesús | Español | Película Oficial Full HD,36 126 379 katselukertaa,2.55.43,/@ThelifeofJesus
neqZAVRMHMo,Jesus (ft. Draylin Young & Jessica DiGiovanni) || Miracles || IBC Live 2023,40 054 katselukertaa,9.07,/@IndianaBibleCollege
0O4SBwk3ip0,Naomi Raine - One Name (Jesus) [Official Video],4 167 896 katselukertaa,9.20,/@TheNaomiRaine
Hrvo2VeOVcw,Music in honor of Jesus Christ - Gregorian chant performed by the Orthodox choir,272 612 katselukertaa,11.54.58,/@catholic-field
Mnx-Uovcv1g,THIS IS JESUS feat. Jordan Smith (Official Music Video),508 925 katselukertaa,3.54,/channel/UC41GHsigm-VUSIntH8YyPoA
wp2p9sIOyVM,Jesus Is Crucified | The JESUS Film | English | 51/61 (HD),80 545 142 katselukertaa,2.49,/@jesusfilm
an8ZcPXxYLA,La Vie de Jésus | French | Official Full HD Movie,4 209 484 katselukertaa,2.56.24,/@laviedejesus
C7hdUorDU-U,"""These things I command you"" Jesus' own words from the 4 Gospels",7 197 413 katselukertaa,1.40.32,/@NoGreaterLove
