Video Id,Title,View Count,Length,Channel
_HDMCCLlGl4,The Who - Join Together,7 903 137 katselukertaa,4.18,/channel/UCUtwj-3S97bj3lYDVxDKtlQ
E7dUAlEn-78,Meowbah joined the gacha community? The gacha community reaction 😱,1 147 531 katselukertaa,0.40,/@Mikarou2
ckYvZdkgcFc,I Joined A Cursed Server That Exposed Adopt Me's BIGGEST SECRET (SHOCKING!),940 044 katselukertaa,18.23,/@SunnyxMisty
YLQGucRN89Y,I Joined Minecraft's Most Insane SMPs...,5 169 935 katselukertaa,11.40,/@Sipover
2tqcnrfW9Tg,i joined dream’s minecraft server. now he hates me.,10 596 954 katselukertaa,13.54,/@TommyInnit
nqYPbcvzLS8,Zellsis On Why He JOINED SENTINELS Over other Organisations,114 010 katselukertaa,1.58,/@JettShorts
YYoYQXaixtc,I Joined The POLICE On A NEW Server! (GTA RP),73 849 katselukertaa,15.22,/@angryginge13
nCm0MMzwowc,"#pov When the new girl joined the friend group #2 didn’t like her, but now…",199 032 katselukertaa,0.10,/@mr.spicygremlin
M2eBf0qRvQs,"I Joined 100 Servers, Here's What Happened",3 262 350 katselukertaa,14.45,/@ParrotX2
zumYKB-ziFw,I Joined a Elderly Basketball League!,1 567 428 katselukertaa,9.31,/@JeremyHutchins
G5fFnITvzC4,I JOINED A RANDOM DISCORD IN RANKED SOLOQ AND IT WENT AS EXPECTED... 💀,123 934 katselukertaa,19.51,/@KeshaEuw
sfo4aCkfNis,I Joined The QSMP!!,44 420 katselukertaa,9.26.28,/@TubboLIVE
YvLwW3mu58s,If Asians Joined The Army,1 260 668 katselukertaa,0.49,/@Genie_
7omx1_Zi0JA,We Joined The Military...,14 877 355 katselukertaa,18.21,/@TomSimonsVlog
O9oLJWAoOhk,I Joined Her For Lunch 😅,5 579 767 katselukertaa,0.35,/@BigDawsTv
8JA-FdwWSGY,The way they all joined in.. 😂,22 388 471 katselukertaa,0.28,/@StevenSchapiro
Eq_ahkFNfIw,i joined Smosh,241 643 katselukertaa,20.21,/@SwellEntertainment
HiOt9797kQ8,Ethobot Joined My Minecraft Server…,225 988 katselukertaa,0.42,/@eystreem
g_LIiAT7Y6k,I Joined ROBLOX'S Game..,1 761 908 katselukertaa,15.03,/@ZephPlayz
E778P-Xva1w,Finland Officially Joins NATO,999 122 katselukertaa,0.52,/@TLDRnewsEU
