Video Id,Title,View Count,Length,Channel
m8xyoEvdQv4,#judge #judiciary #patnahighcourt #lawyer #shorts #ajaykashyap,6Â 076Â 658 katselukertaa,0.57,/@AJAYKASHYAP
uERn1ruaHbI,JUST IN: Jim Jordan Leads Fiery Hearing In Which ATF Director Testifies Before Judiciary Committee,3Â 850Â 573 katselukertaa,3.20.11,/@ForbesBreakingNews
XKKBLVXZVUk,Indian judiciary is a joke | reality series unknown vazha #shorts #shortsvideo,3Â 371Â 912 katselukertaa,1.00,/@UnknownVazha
wH50Ikgk2Eo,"Every Judiciary, CA, UPSC Aspirant! ğŸ«¡",3Â 265Â 958 katselukertaa,0.24,/@_FinologyLegal
HuFR5XBYLfU,How is power divided in the United States government? - Belinda Stutzman,3Â 086Â 503 katselukertaa,3.50,/@TEDEd
h_na7-_DX98,Grand Entry Of Judge!! f Grand Entry!! #Shorts @civilservicesmotivation3474,2Â 890Â 735 katselukertaa,0.50,/@civilservicesmotivation3474
amewX07M8fQ,"JUST IN: Jim Jordan Chairs Judiciary Hearing Targeting Manhattan D.A. Alvin Bragg, Crime In NYC",2Â 591Â 647 katselukertaa,3.54.55,/@ForbesBreakingNews
luxkkn5viMg,Josh Hawley Takes No Prisoners Grilling Key Judicial Nominee: 'Why Are You Fighting Me On This?!',2Â 324Â 367 katselukertaa,6.21,/@ForbesBreakingNews
xETfeseo1Sw,"Indian Government [in Hindi] | Legislature, Executive, Judiciary | political science",2Â 114Â 394 katselukertaa,7.52,/@SSCCAMPUS
LTjzOEIQFmQ,Are Judges SLOW? ğŸ¢,2Â 031Â 660 katselukertaa,0.59,/@_FinologyLegal
plN7pwsInpI,Senate Judiciary Committee holds hearing on Supreme Court ethics reform | full video,1Â 758Â 336 katselukertaa,3.16.25,/@CBSNews
skR6Z6TwdcM,Kesavananda Bharati v. State of Kerala | Most important case of Indian Constitution,1Â 730Â 421 katselukertaa,10.50,/@_FinologyLegal
IGyx5UEwgtA,Structure of the Court System: Crash Course Government and Politics #19,1Â 643Â 245 katselukertaa,6.59,/@crashcourse
ixLKVjYajMQ,House Judiciary Committee Impeachment Inquiry Evidence Hearing,1Â 528Â 788 katselukertaa,10.00.06,/@CSPAN
uaT7VNF-08o,Robert Mueller's full testimony to House Judiciary committee,1Â 450Â 861 katselukertaa,3.42.13,/@CNN
bQ9oL9YIzds,WATCH LIVE: House Judiciary hearing on 'weaponization of the federal government',1Â 318Â 185 katselukertaa,3.36.01,/@PBSNewsHour
IfLHTMKWQpE,[Full Video] 2023 Presidential Election Petition Court Judgment,1Â 296Â 965 katselukertaa,11.54.56,/@ChannelsTelevision
mWYFwl93uCM,Judicial Review: Crash Course Government and Politics #21,1Â 246Â 000 katselukertaa,8.01,/@crashcourse
KPSVjzqDCqc,Civil Judge Judiciary Aspirants Study Night Motivation Judiciary Aspirants Study Night #study,1Â 186Â 700 katselukertaa,0.14,/@lawhindibaba
PvXwskecGCs,"'That Was Embarrassing, I Can't Vote For You': Kennedy Shreds Judicial Nominee",1Â 182Â 676 katselukertaa,5.21,/@thehill
