Video Id,Title,View Count,Length,Channel
gwMa6gpoE9I,BTS (방탄소년단) 'ON' Kinetic Manifesto Film : Come Prima,573 148 050 katselukertaa,4.59,/@HYBELABELS
w_-J8UD9Jaw,Pj Masks Toys With Kinetic Sand and Finger Paint Learn Colors Song Kids,510 768 406 katselukertaa,2.52,/@oyuncaksekeri
EECff5hpGbk,Wendy Pretend Play Learn Colors with Kinetic Sand Rainbow Ice Cream Kid Toys,249 102 573 katselukertaa,5.50,/@toysandcolors
nnA5u6xMYEU,Vlad and Niki pretend play with Kinetic Sand,206 249 620 katselukertaa,4.09,/@VladandNiki
aUo-pfoN9Ng,Lego Drop and Squish Kinetic Sand ASMR #shorts,166 385 915 katselukertaa,0.33,/@sandtagious
d6ewPV9pFRE,"Very Satisfying and Relaxing Kinetic Sand ASMR, drop and squish. #shorts",163 961 491 katselukertaa,0.35,/@sandsatisfaction
XQxw4QDAoSE,Colorful Cubes Drop and Squish Kinetic Sand Satisfying #shorts,146 709 937 katselukertaa,0.35,/@sandtagious
sDZctJcfAMc,Sand Noodles Drop and Squish Kinetic ASMR #shorts,131 669 415 katselukertaa,0.31,/@sandtagious
MWhfFWwKt08,DIY How To Build House Has Well and From Kinetic Sand - Zon Zon (Satisfying),131 231 843 katselukertaa,12.20,/@zonzon
Ay9gUcpWIsU,Vlad and Niki learn to make toys from Kinetic Sand,130 270 719 katselukertaa,17.51,/@VladandNiki
0l_gXGxvj1E,KINETIC SAND SEARCH FAMILY FUN TIME 😳 #shorts,129 302 754 katselukertaa,1.00,/@thefurrhafamily
gyuP5cWyCUc,"Learn 5 Colors Kinetic Sand in Baby Milk Bottle | Barbie Princess,Fruit Party,Juice,Surprise Eggs",129 210 682 katselukertaa,11.57,/@toybus-kidstoystoystory2129
mCDDMShjZ50,Kinetic sand Cutting ASMR SHAPES Satisfying Video #satisfying #asmr #kineticsand #shorts,125 203 621 katselukertaa,0.21,/@sand_box
T81cDX-N1Dk,Lego Kinetic Sand Excavator Bulldozer Color Building Fail,120 515 159 katselukertaa,10.35,/@briQle
5JqY-6q-RNA,Fall Out Boy - THE PHOENIX (Kinetic Typography Lyrics),118 652 965 katselukertaa,4.09,/@KerryPaulazzo
3clqk2U3T9Y,Very Satisfying and Relaxing Compilation 148 Kinetic Sand ASMR,114 534 118 katselukertaa,18.42,/@sandtagious
TmX8XtHGlNc,Kinetic sand Cutting 💔 BROKEN HEART 💔 Satisfying ASMR Video #satisfying #asmr #kineticsand #shorts,113 858 165 katselukertaa,0.20,/@sand_box
gtMqBECtIRo,Parent's Favorite Toy or Worst Nightmare? | The Original Kinetic Sand | VAT19,112 833 526 katselukertaa,1.50,/@vat19
-1E8uolHGho,Nursery Rhymes ABC Song Funny Bowling Ball Kinetic Sand Colors For Kids 3D,111 482 489 katselukertaa,2.24,/@TVBinkie
G8VhGdv4nak,Kinetic sand Cutting ASMR SHAPES Satisfying Video #satisfying #asmr #kineticsand #shorts,109 722 252 katselukertaa,0.22,/@sand_box
