Video Id,Title,View Count,Length,Channel
QW833sTtwcw,The Three Little Kittens song - kids songs - Gaby and Alex,650 535 284 katselukertaa,2.57,/@gabyandalex2379
oPclAk1EidM,Vlad and Mom exchanged cat and dog pets,463 756 494 katselukertaa,3.17,/@VladandNiki
LuTwmm-ExrA,Vlad and Niki play with Kittens,359 939 285 katselukertaa,4.13,/@VladandNiki
4joJHaKecBg,Three Little Kittens Went To The Park - Nursery Rhymes by Cutians™ | ChuChu TV Kids Songs,335 249 905 katselukertaa,41.25,/@ChuChuTV
LyqklQSkVxI,Nastya Learns How To Foster a Kittens,302 345 609 katselukertaa,8.30,/@LikeNastyaofficial
NQzmGewcaAM,Diana and Roma take care of the kitten,283 497 360 katselukertaa,16.40,/@KidsDianaShow
z935v1j_iR0,Three Little Kittens + More Nursery Rhymes & Kids Songs - CoComelon,277 289 320 katselukertaa,41.44,/channel/UCbCmjCuTUZos6Inko4u57UQ
xnmpvO-gt6w,RESCUE the Smallest KITTEN in the World !! And building a NEW HOUSE for CAT,268 404 453 katselukertaa,10.01,/@LikeAmagic
LJlYX7PZ9UU,GIANT Maze Labyrinth for Cat Kittens. Can they EXIT?,201 783 678 katselukertaa,3.54,/@EverXFun
6U7gV7KDEOI,🥹 #cat  #cats,193 146 970 katselukertaa,0.13,/@Sonyakisa8
jH7e1fDcZnY,The Cat Raised by a Mouse,190 777 641 katselukertaa,13.05,/@AaronsAnimals
YplpBh_JfoA,Diana and Roma - The best cat stories for kids,187 214 708 katselukertaa,27.12,/@KidsDianaShow
7uq1ymLZe9w,Vlad and Nikita Lost our cat,177 633 439 katselukertaa,4.18,/@VladandNiki
oZFAcp-Qfbs,World's Most Obedient Cat - Aaron's Animals,172 370 121 katselukertaa,2.53,/@AaronsAnimals
EkaVg3zF7wA,Diana Learns How To Foster a Kitten,153 952 057 katselukertaa,4.49,/@KidsDianaShow
GEfEOfvGkOk,Give love to beautiful #kitten #cat #shorts,152 758 553 katselukertaa,0.04,/@abhinavmishravlog
k6X2wJ6L0SY,Three Little Kittens l Nursery Rhymes & Kids Songs,148 600 716 katselukertaa,2.29,/@Badanamu
m0VW5f8iezs,Three Little Kittens | CoComelon Nursery Rhymes & Kids Songs,145 646 130 katselukertaa,5.25,/channel/UCbCmjCuTUZos6Inko4u57UQ
polX7S2Vnyw,Little Kitten My Favorite Cat Play Fun Pet Care Game for Toddlers and Children,144 287 454 katselukertaa,11.48,/@aGamesView
tdrlACOmgHU,Diana and her Quarantine Morning Routine with Kitten,137 094 494 katselukertaa,8.14,/@KidsDianaShow
