Video Id,Title,View Count,Length,Channel
ypioqrfQdXk,How To Install Laminate Flooring | Easy Step By Step Beginners Guide,100 751 katselukertaa,27.28,/@homeimprovements
OJqk2iS_jyQ,DIY Laminate or Vinyl Flooring | A to Z,5 053 660 katselukertaa,46.27,/@HomeRenoVisionDIY
vj2RwFYQ1gc,Wickes How To Lay Laminate Flooring,1 768 472 katselukertaa,9.44,/@wickesvideo
6QmkHoA-cqc,How to Install Laminate Flooring (for beginners),1 043 868 katselukertaa,17.16,/@WelcometotheWoodsBlog
lP7B9B7WX1E,How to Install Laminate Flooring for beginners,15 365 239 katselukertaa,13.33,/@DIYCreators
Igy-OfBdpZQ,How to lay laminate flooring,1 144 614 katselukertaa,3.13,/@bandq
BNL9eTooTYY,How To Laminate Plywood | Beginner's Guide,346 091 katselukertaa,5.28,/@AnvinArganosa
9MAe6nTXsIw,How We Make Laminate,94 412 katselukertaa,10.34,/@wilsonart
OiLmSszm2qA,Laminate Floor Installation for Beginners | 9 Clever Tips,3 414 060 katselukertaa,29.07,/@HomeRepairTutor
cDBhFapVEyA,LAMINATE REPAIR | How to perfectly repair damage to new laminate,171 452 katselukertaa,4.05,/@TheRestorer
hUvTY6bFhSE,How to Install Laminate on Your Worktop || DIY Laminate Work Surfaces,590 625 katselukertaa,31.23,/@Bourbonmoth
jXUviZYz_Zo,HOW TO Measure and Install the LAST ROW of LAMINATE - Tricks,14 679 katselukertaa,2.13,/@NicksWoodFlooring
qRe3llAAgfU,Laminate vs Luxury Vinyl Plank Flooring | Everything you need to know!,1 113 565 katselukertaa,10.16,/@BelindaCarr
Rk_LGCvzsKs,Δάπεδα Laminate στο Biostalis-Shop,279 katselukertaa,2.31,/@biostalishydroponicsfodder2901
uObZY3YI6AM,How to Install Sheet Laminate on a Countertop,772 715 katselukertaa,10.51,/@EverydayHomeRepairs
1Xpjg_aUt9U,Kuinka asentaa kalanruotolaminaattilattia - sivuttain,3 746 116 katselukertaa,16.55,/@NicksWoodFlooring
lvqdlRzNQss,How to Install Laminate Flooring | The Home Depot,371 861 katselukertaa,6.26,/@HomeDepot
pHj9f6kfMqk,Repair to Damaged Laminate Flooring,60 918 katselukertaa,1.25,/@smithsurfacerepairs2754
ddZfhZRzREE,How It's Made Laminate,617 913 katselukertaa,4.51,/@Sciencebox2010
