Video Id,Title,View Count,Length,Channel
q_c1rG4zYl4,LIC Holy Spirit Summit 2023 - Day 1 | 6th September 2023,1Â 865 katselukertaa,2.53.31,/@LICFamily
PIaeV4B01wo,LIC Holy Spirit Summit 2023 - Day 2 | 7th September 2023,1Â 853 katselukertaa,3.04.26,/@LICFamily
q9OUJtmbrq0,"""à°‡à°‚à°¤ à°•à°¾à°²à°¾à°¨à°¿à°•à°¿ à°ªà±†à°Ÿà±à°Ÿà±à°¬à°¡à°¿ 3 à°°à±†à°Ÿà±à°²à± "" LIC Dhan Vriddhi Plan! LIC table no 869 ! Single Premium Plan",185Â 612 katselukertaa,9.24,/@EASYWAYMEEKOSAM
dcnIs6ydVqA,LIC Sunday Service | TRANSFORMED BY THE HOLY SPIRIT | 10th September 2023,1Â 232 katselukertaa,3.06.32,/@LICFamily
p3Vh30CH6_4,LIC Holy Spirit Summit 2023 - Day 3 | 8th September 2023,1Â 764 katselukertaa,4.17.46,/@LICFamily
EvDgb41DXeU,LIC Sunday Service | A GRATEFUL HEART | 3rd September 2023,1Â 007 katselukertaa,2.57.54,/@LICFamily
kAkJ0_umCn8,"Market Experts Gaurang Shah, Mileen Vasudeo Are Bullish On LIC",2Â 900 katselukertaa,3.23,/@BusinessToday
77alg6VsFIg,7 Best LIC Plans to Invest in 2023 | Financial Monk,280Â 650 katselukertaa,6.08,/@financial-monk
xYNXdhatsoc,"LIC's Adani Group investment yields 26,000 crore return",10Â 695 katselukertaa,0.47,/@ThFrustratedIndian
ncPtX40qUWQ,Lic Jeevan Umang | Lic Jeevan Umang 945 | Jeevan Umang Lic Plan | Lic Guaranteed Pension Plan,198Â 147 katselukertaa,13.34,/@insuranceclinic
vgX1VW0WKpw,LIC Jeevan Shanti Plan 2023 | Best Investment Plan For Monthly Income | LIC monthly income plan 2023,7Â 830 katselukertaa,11.04,/@insuranceclinic
puM0uqEAyl0,LIC Scholarship Free For Students,134Â 754 katselukertaa,0.47,/@deepanshu.bhaskar
YDYtX4vi6jo,A Lifetime of Love: LIC of India (Hindi),1Â 705Â 398 katselukertaa,1.00,/@LICIndiaForeverOfficial
9mQtV_ykU0w,LIC Guaranteed life long pension Jeevan Shanti Malayalam with example deferred Annuity,47Â 523 katselukertaa,12.39,/@metinmaryjose
38Ce5_AHnLo,LIC à¤•à¥€ à¤¸à¤¬à¤¸à¥‡ Successful à¤¸à¥à¤•à¥€à¤® | Best Lic Policy 2023 | Jeevan Labh 936 in Hindi | Jeevan Labh Policy,24Â 460 katselukertaa,8.17,/@savingfund
RisrMRI9bTA,à¤ªà¤¾à¤°à¥à¤Ÿ 1 Lic Top 10 Plan 2023 | Lic Best Plan 2023 | Best Lic Policy 2023. Best Policy For Investment,23Â 537 katselukertaa,19.14,/@savingfund
Nq6D2ZVI7MQ,2023 à¤®à¥‡à¤‚ LIC à¤•à¥‡ 5 à¤¬à¥‡à¤¸à¥à¤Ÿ à¤ªà¥à¤²à¤¾à¤¨ | Best Plan of LIC 2023 - Most popular plans of LIC,181Â 693 katselukertaa,9.30,/@InsuranceTechnical
1uzErHwkp28,LIC is a Scam ğŸ˜± #shorts #insurance,2Â 655 katselukertaa,0.51,/@justify.
qlZn8S_8IJU,Lic Jeevan Kiran Plan 870 || Lic Jeevan Amar Plan 955 || Best Term Insurance Plan in India 2023 ||,5Â 745 katselukertaa,8.27,/@savingfund
CbolC7bYKKU,LIC Product Protected by Govt. Sovereign Guarantee || @bhawanilic #lic,1Â 076 katselukertaa,0.51,/@bhawanilic
