Video Id,Title,View Count,Length,Channel
AX6DmstS20s,Overcoming lifelong allergies ğŸ¥œ (8),8Â 749Â 422 katselukertaa,0.57,/@TylerCsatari
hFBEZddpC5w,"Rockie Fresh (Feat. Rick Ross & Nipsey Hussle) - ""Life Long"" Official Video",7Â 211Â 617 katselukertaa,4.19,/channel/UCY32rZoZ28moSDN9c74KJtQ
o6KCniVK-1k,"Gutar Gu - Lifelong friend BannaÂ hai | Ashlesha Thakur, Vishesh Bansal | New Series | Amazon miniTV",6Â 033Â 409 katselukertaa,1.00,/@amazonminitv
jQXLXTVNYz4,Genius Autistic Doctor Cures A Lifelong Crippled Guy,5Â 266Â 363 katselukertaa,0.59,/@MoviesBlast
mp6tT9llVmI,Dwayne 'The Rock' Johnson Gifts Car to Lifelong Friend | NowThis,4Â 627Â 100 katselukertaa,5.26,/@nowthisnews
MlJ5SDU6JNk,Lifelong Learning at McMaster Continuing Education,3Â 447Â 481 katselukertaa,0.26,/@McMasterContEd
aQeVzfwynKk,Jordan Henderson suprises a lifelong LFC fan | Pure Liverpool FC,3Â 317Â 749 katselukertaa,2.55,/@LiverpoolFC
HSercnrqeN4,A hilarious celebration of lifelong female friendship | Jane Fonda and Lily Tomlin,2Â 054Â 313 katselukertaa,15.45,/@TED
UDVzaNB0Hso,Chime - Lifelong [NCS Release],1Â 834Â 245 katselukertaa,3.47,/@NoCopyrightSounds
Av3G9jTsHVE,"Man Sues Lifelong Friend For Injuries - $425,000 Case (Full Episode) | Injury Court",1Â 774Â 050 katselukertaa,16.12,/@PersonalInjuryCourt
fq0DFPFh0Ss,Rolex Arts Festival - Talk: Lifelong learning,1Â 763Â 510 katselukertaa,1.01.48,/@ROLEX
N_fYrykccPA,Lifelong Republicans Explain Why They're Voting Against Trump | NowThis,1Â 515Â 735 katselukertaa,5.06,/@nowthisnews
EGUhZlmlfj4,Full Tricks? | How choose Color | à¤ªà¥‚à¤°à¥€ à¤¬à¤¾à¤¤ à¤¸à¤®à¤ à¤²à¥€à¤œà¤¿à¤¯à¥‡ | wallet money,1Â 265Â 117 katselukertaa,7.04,/@WalletMoney
EevX2yJNrDY,Han and Chewie - A Lifelong Partnership | Star Wars Galaxy of Adventures,1Â 232Â 343 katselukertaa,1.13,/@StarWarsKids
b21ZSnA0IZY,"Lifelong Democrat turns on AOC, urges Hispanics to support opponent",1Â 084Â 230 katselukertaa,6.05,/@FoxNews
78fvCY53XeU,Cambodian man builds an aeroplane house to fulfil his lifelong dream of flying,1Â 010Â 568 katselukertaa,2.49,/@SouthChinaMorningPost
Kft8_wqSTB4,Biga*Ranx - Life Long (OFFICIAL VIDEO),905Â 029 katselukertaa,2.15,/channel/UCHJ-g0a43Jcp_xa1LPjQvaQ
KvBiZO9IlkM,Best Colour Prediction Website Color prediction Game tricks #viral #shorts #shortfeed,836Â 914 katselukertaa,0.46,/@smartnitin
yClGYH3m4BA,'He literally saved my life' | Alisson helps with emotional surprise for lifelong Liverpool fan,773Â 903 katselukertaa,6.22,/@LiverpoolFC
qq63tq3cg14,Lifelong iPhone User Switches to S22 Ultra,774Â 153 katselukertaa,17.19,/@PeteMatheson
