Video Id,Title,View Count,Length,Channel
844fWMp8O8Y,No Longer A Slave - Terry Linen,3 622 043 katselukertaa,4.51,/@tadsrecord8478
-ZrZZefkohE,How Linen Is Made,3 322 011 katselukertaa,9.38,/@LibecoLagae
3JKhhtoe9v4,Flax to linen: from sowing to sewing.,2 796 393 katselukertaa,20.21,/@RobStephens007
FVseealJ9LY,Terry Linen - Goodness of God (Official New Music),1 378 197 katselukertaa,3.43,/@tadsrecord8478
fnsOnNNogME,"Westside Home | Bring Spring Home | Bed linens, Cushions, Plates, Candles, Decor",886 313 katselukertaa,0.47,/@WestsideStores
j5wYEWhDbx8,ELIYA Hotel Linen丨Professional Manufacturer of Table Linens and Hotel Bed Linen,845 479 katselukertaa,2.50,/@eliyahotellinenco.ltd.1570
SSg1Rb4Oxos,My Nontoxic Laundry Routine! How to wash your bed linens 🧺 🧼#laundry #shorts #cleaning #nontoxic,675 279 katselukertaa,1.00,/@j.ryansolutions
9XsGgUvRe_o,Fresh Summer Linens,448 485 katselukertaa,0.29,/@andamen518
0XzNAiBPJC8,Dirty Heads ft Alex Vince & Ivuss - John Linen (Official Lyric Video),433 065 katselukertaa,3.16,/@BetterNoiseMusic
YjoPtzrNuPM,Dirty Linen Grand Media Conference,379 245 katselukertaa,2.45.50,/@abscbnentertainment
s-WeMdJJOxo,Anna's Linens - Annabella Easy Window Valance,262 178 katselukertaa,0.42,/@annaslinens
HAHB1fkpAIo,Decorating for Wedding Receptions-Table Linens,236 735 katselukertaa,2.45,/@weddingtips
56yU7xsywKc,Home Linens By EK | Soothing Designs That Radiate Positivity,197 060 katselukertaa,0.19,/@ekbyekta5323
1BZT2gzH45A,Bed Bath & Beyond vs. Linens 'n Things,192 588 katselukertaa,11.32,/@companyman114
LNDbINF6Vew,How was it made? Linen,168 931 katselukertaa,2.25,/@vamuseum
OvWEs82tgE8,KonMari - Tidy - Linens,159 487 katselukertaa,3.21,/@oneatatime8677
o-2VGo5HBrc,Linen Explained - Men's Summer Fabric Guide,149 968 katselukertaa,18.00,/@gentlemansgazette
lcvhrUjbnbk,Idea on how to organize your linens and blankets #organization #foldingclothes #homehacks,129 690 katselukertaa,0.38,/@lenniamc
3lmoOaFc85k,How to get rid of wrinkles in your bed linens,88 520 katselukertaa,1.34,/@Verolinens
0vJynJ8SdUI,If You Aren't Looking For These Linens You're Missing THOUSANDS In PROFIT,83 378 katselukertaa,40.51,/@TheNurseFlipper
