Video Id,Title,View Count,Length,Channel
eVTXPUF4Oz4,In The End [Official HD Music Video] - Linkin Park,1 618 167 774 katselukertaa,3.39,/channel/UCZU9T1ceaOgwfLRq7OKFU4Q
kXYiU_JCYtU,Numb (Official Music Video) [4K UPGRADE] – Linkin Park,2 076 321 558 katselukertaa,3.08,/channel/UCZU9T1ceaOgwfLRq7OKFU4Q
iuh6_d_pBaE,Linking,83 053 katselukertaa,4.38,/@AmericanEnglishatState
-JqAs_vdQb8,How To Connect Ideas In English [with Linking Words],551 737 katselukertaa,15.23,/@mmmEnglish_Emma
QGfOAVpEHIE,Linking sounds rules #1 & 2,195 865 katselukertaa,10.34,/@HelloSpokenEnglish
6ziKkSig0jM,Linking Consonant to Consonant -- American English Pronunciation,277 829 katselukertaa,7.32,/@rachelsenglish
bdS8mcTxiwk,English Grammar: Linking Verbs (Copula),241 827 katselukertaa,12.33,/@engvidAdam
nbnRm_3_QKU,How to Link Words - Speak English Fluently - Pronunciation Lesson,1 707 803 katselukertaa,18.20,/@Oxfordonlineenglish1
Nc2r_5XhkGk,How to RELAX your ACCENT | Part 1 | Connected Speech & Linking in English,1 091 067 katselukertaa,16.13,/@mmmEnglish_Emma
hYcbugrzKSA,Sound more FLUENT and NATURAL with LINKING: How to Connect Words in Spoken English,934 029 katselukertaa,24.20,/@ClearEnglishCorner
7Mxg4VkkRRI,Live In Texas (Full) [HD UPGRADE] - Linkin Park,29 212 104 katselukertaa,1.11.01,/channel/UCZU9T1ceaOgwfLRq7OKFU4Q
AgmENVGIw38,What is Linking R & Intrusive R? | Connected Speech | English Pronunciation,19 344 katselukertaa,14.17,/@BillieEnglish
wLprxwzWtc4,Pronunciation: The linking /r/,235 707 katselukertaa,3.38,/@bbclearningenglish
oHlQoNXjAGo,Linking,9 521 katselukertaa,1.40,/channel/UCEVDYJjZxP37HPKi3e_g1dw
EvhZPWJSub4,Intro to Linking:  American English Pronunciation,169 566 katselukertaa,3.20,/@rachelsenglish
BECe_ok1RI8,Grammar: How to use linking words in English - BBC English Masterclass,470 796 katselukertaa,4.23,/@bbclearningenglish
4cx8uqeb5pY,04-Linking（音の連結） / English Phonetics,27 784 katselukertaa,18.39,/@English_Tutorials_Kengo.H
a-RIoxqZ-Gc,Linking Words for IELTS Speaking,688 776 katselukertaa,20.54,/@EnglishSpeakingSuccess
N7WPLhRJ_Gk,The Complete Guide to Connected Speech and Linking in English | Vowel + Vowel Linking (PART 1),154 448 katselukertaa,14.45,/@Pronunciationwithemma
