Video Id,Title,View Count,Length,Channel
LhahfErmja0,World’s #1 Longevity Expert: How To Live Longer in 4 Simple Steps,88 700 katselukertaa,1.40.34,/@HighPerformancePodcast
9lXG8x0yR3o,LONGEVITY MEDICINE: Diet & Lifestyle Hacks To Heal Your BODY & MIND | Dr. Mark Hyman,370 434 katselukertaa,2.35.38,/@DrChatterjeeRangan
B_CqKVU19ec,The science of super longevity | Dr. Morgan Levine,536 784 katselukertaa,7.15,/@bigthink
obpp0d6m7LU,The LONGEVITY Doctor: Are You Actually HEALTHY? 70% Of The Population Is NOT | Dr. Peter Attia,330 590 katselukertaa,1.31.16,/@JayShettyPodcast.
eqPnptAtBJk,"The LIFE-EXTENSION Doctor: ""The ONE thing that's increasing your chance of early-death by 170.8%!""",1 420 803 katselukertaa,2.03.20,/@TheDiaryOfACEO
fPGaBFjH_JI,Dr. Peter Attia’s 7 Golden Longevity Rules for Living Longer,301 798 katselukertaa,17.04,/@ThomasDeLauerOfficial
_F66kEvgfsU,Dr Peter Attia Reveals The Most Important Daily Habits For Longevity,360 131 katselukertaa,13.56,/@ChrisWillx
85ItRIGdl98,Longevity Doctor: Fix These Diet & Lifestyle Habits To Prevent An Early Death | Peter Attia,212 182 katselukertaa,2.18.06,/@DrChatterjeeRangan
RODwPAdtrw8,The most exciting REAL anti-aging drugs,30 755 katselukertaa,12.31,/@DrAndrewSteele
orJa62raA4w,Why Diet WON’T Increase Your Lifespan! (LONGEVITY MYTHS) | Peter Attia,787 255 katselukertaa,2.35.22,/@TomBilyeu
iVgNzPg0iEU,LONGEVITY SECRETS: How To Slow & Reverse Aging In Days! | Mark Hyman,1 267 044 katselukertaa,3.20.12,/@drmarkhyman
nuSGNTd5kCk,STORMZY - LONGEVITY FLOW,1 378 556 katselukertaa,3.04,/channel/UC7D-09kUG6Ei11SVO_deW_w
pUP0rSIu2TI,I AVOID 5 FOODS & my body is 30 YEARS YOUNGER! Harvard Genetics Professor David Sinclair,228 243 katselukertaa,14.29,/@healthlonglife
b_d-drdcfJo,Dr. Peter Attia: This Is What You Need to Do to Live Longer | Amanpour and Company,310 277 katselukertaa,18.15,/@AmanpourandCompany
pVa6T1j8x_0,Young Forever: The Emerging Science of Longevity with Dr. Mark Hyman at Summit Palm Desert,128 286 katselukertaa,51.37,/@SummitSessions
n9IxomBusuw,Dr. David Sinclair: The Biology of Slowing & Reversing Aging | Huberman Lab Podcast #52,2 708 137 katselukertaa,2.10.43,/@hubermanlab
HImSP61PcEQ,Diet That Heal Your Brain To Increase Longevity Everyday| David Sinclair,28 985 katselukertaa,9.21,/@InnerSelfyoutube
pxEnH00YcGY,A Longevity Masterclass: Emerging Science & Timeless Wisdom of Healthy Aging | Rich Roll Podcast,323 932 katselukertaa,1.35.45,/@richroll
z8c6EyMNd0A,Journal Club with Dr. Peter Attia | Metformin for Longevity & The Power of Belief Effects,134 248 katselukertaa,2.21.19,/@hubermanlab
e5JGu8RJ_XE,Pillars For Longevity: Do These Everyday To STAY YOUNG & Live Longer | Dr. Mark Hyman,33 457 katselukertaa,20.44,/@drmarkhyman
