Video Id,Title,View Count,Length,Channel
RV1yJP8P6rE,The LONGEST World Records,4 722 838 katselukertaa,8.05,/@JackSucksAtStuff
56lkofpjOAs,100 Hour Timer Countdown – 100 Hrs Video - 100h Video Countdown - 100 Stunden Timer,20 496 580 katselukertaa,100.00.01,/@MacPaverick
a_XgQhMPeEQ,Billy Joel - The Longest Time (Official Video),70 383 531 katselukertaa,4.05,/channel/UCyVomykHKyWCWo8lSKHHmzA
k1hgJkIGjUg,✰ 10 HOURS ✰ Best FIRE in Fireplace ✰ longest FullHD 1080p,2 167 762 katselukertaa,10.19.40,/@1HarryH
lg8X_S4FBt8,The LONGEST Game of Fortnite! (World Record),3 548 519 katselukertaa,16.29,/@lachlan
QQ3OfyIM5uM,The LONGEST road... (Bloons TD 6),104 787 katselukertaa,14.28,/@Tewbre
yrzi4PqI9Mg,El Fusilado | The Longest Johns | Chumbawamba Cover,28 204 katselukertaa,2.47,/channel/UC8BvYNPXVXylwSoXGSrfaBA
shBKTA3QIok,Morgan Page (ft. Lissie) - The Longest Road (Deadmau5 Remix) [Official Music Video],11 324 661 katselukertaa,3.57,/@NettwerkMusic
ggH4EfCC-r0,I Solved The World's Longest Math Problem!,12 479 521 katselukertaa,11.46,/@MsMunchie123
crq-qc_r6Jk,"Ashes, from Cures What Ails Ya by The Longest Johns",2 627 689 katselukertaa,3.45,/channel/UC8BvYNPXVXylwSoXGSrfaBA
l3cjFvfKfUc,Growing EVERY LONGEST NECK (Movie),5 292 311 katselukertaa,1.49.48,/@ProjectJamesify
Hx0vc6iYqaY,Binks Brew (Binks no Sake) | The Longest Johns | One Piece Cover,403 824 katselukertaa,3.30,/channel/UC8BvYNPXVXylwSoXGSrfaBA
KI9yzC9WJU4,Man of Constant Sorrow | The Longest Johns (arr. Soggy Bottom Boys),25 671 katselukertaa,3.29,/channel/UC8BvYNPXVXylwSoXGSrfaBA
K-8SUV9wd30,Longest Game On This Channel,41 988 katselukertaa,3.13,/@ChessSimp
uaKQOZUECn8,The longest overtime in Rocket League history,1 068 105 katselukertaa,27.13,/@SunlessKhan
nTAyY8x_dqI,Here Is The LONGEST Running Live Stream On YouTube!,4 273 katselukertaa,0.39,/@Timeworks
3kvNLugu190,LONGEST WORD IN THE WORLD?,8 580 487 katselukertaa,0.47,/@DannoDraws
g5o_KOB3o34,Who has the Longest Jump in Garten of Banban? (70+ Monsters),1 694 546 katselukertaa,10.50,/@JustJoeKing
R6wiCOYmJZY,- The Longest Briar Chase - Best lol Highlights  EP.142,8 931 katselukertaa,10.52,/@LOLADDICTS95
