Video Id,Title,View Count,Length,Channel
hht5QhoRpg8,Calvin Playing With The Biggest Lookout Tower CKN,239 423 364 katselukertaa,4.08,/@CKNToys
qzD3PGW23Dk,Paw Patrol Rescue Mission: Romeo's Giant Megazord & the My Size Lookout Tower!,174 539 108 katselukertaa,17.40,/@GenevievesPlayhouse
rVdv8LgOSm4,First  Mega Roll Patrol Lookout Tower Railway Barn's Rescue CKN,64 113 842 katselukertaa,5.45,/@CKNToys
NtSFF8qMvIY,NEW Paw Patrol Toys Lookout Tower Unboxing With Chase Marshall Sky Rubble Rocky Zuma,48 398 082 katselukertaa,8.37,/@eliasintoys68
4MnzA-2GWao,Patrol Lookout Climber Kids Outdoor Playtime Fun With CKN,43 458 479 katselukertaa,4.23,/@CKNToys
okx8Hb9NHtI,PAW Patrol Ultimate Rescue || The Pirated Lookout || Pups save the Pupmobiles,40 430 837 katselukertaa,0.26,/@SuperChase
yraK-7ECIeU,Paw Patrol Lookout Tower Playset,39 559 331 katselukertaa,10.22,/@Kidibli
XShZWzTZdGk,"MARSHALL'S IN TROUBLE! Paw Patrol My Size Lookout Tower, Rescue Mission & Puzzle Toy Learning Video",37 624 472 katselukertaa,20.02,/@ToyTubeTV1
XHMEMJK9nic,Partners in crime: Dog in China helps girl keep a lookout so she can watch TV,29 738 399 katselukertaa,4.08,/@SouthChinaMorningPost
_sflKTpzSs8,Assistant Plays Hide n Seek at the Paw Patrol Lookout with Dinosaurs,26 681 194 katselukertaa,13.13,/@TheEngineeringFamily
VUdq1v2FVbo,Asistant Plays Scare and Seek at the Paw Patrol Lookout Tower,22 631 498 katselukertaa,21.03,/@TheEngineeringFamily
c-UBeTZzlwI,Assistant Gabby Gabby tricks Paw Patrol at the Lookout Tower,22 453 396 katselukertaa,28.09,/@TheEngineeringFamily
67IsOSmdSOI,All 3 Lookout Tower Playtime Fun With CKN,21 460 743 katselukertaa,10.15,/@CKNToys
ueh0Ww9IjZY,Assistant Saves the Silly Mysterious Paw Patrol Lookout Tower,21 185 202 katselukertaa,19.27,/@TheEngineeringFamily
JqV0XjOUwHI,Race to the Lookout Point - LEGO Disney Princess - Frozen Northern Lights - EPISODE 1,20 891 084 katselukertaa,5.55,/@LEGO
JlL0QYEENGo,Assistant and Batboy Ryand Defend the Paw Patrol Lookout Tower,18 582 714 katselukertaa,17.59,/@TheEngineeringFamily
5ZmEkIO3W1E,Mighty Lookout Tower Super Pups CKN,16 822 865 katselukertaa,5.01,/@CKNToys
wKneW48w2k4,LOOKOUT! Toxic Starfish!,14 603 361 katselukertaa,16.42,/@BraveWilderness
qpz1_fIVMSg,Rubble Lookout Tower Rescues! w/ PAW Patrol Chase & Skye | 30 Minute Compilation | Rubble & Crew,12 654 880 katselukertaa,30.05,/@RubbleOfficial
J74-rRlMgFc,"Rubble & PAW Patrol Pups Bake a Cake! w/ Rocky, Zuma & Marshall | Rubble Official",11 157 753 katselukertaa,3.49,/@RubbleOfficial
