Video Id,Title,View Count,Length,Channel
QA-wi0d7-Ro,"Self Lymph Drainage Massage by MassageByHeather.com in Louisville, KY",9 534 506 katselukertaa,7.16,/@massagebyheatherw
u07HlElUUp8,LIFE PROCESSES IN 1 SHOT || Class 10th Board Exams,4 178 542 katselukertaa,6.39.06,/@PW-Foundation
I7orwMgTQ5I,Lymphatic System: Crash Course Anatomy & Physiology #44,3 820 226 katselukertaa,9.20,/@crashcourse
apJoW36KC2c,My Patient Thought it was Cancer…,3 252 570 katselukertaa,6.56,/@DoctorMike
dFrZD4oXvwM,Neck Mass: Swollen Lymph Node,3 073 182 katselukertaa,2.42,/@childrenscolo
LONbNTnF1OQ,"Lymphatic Drainage, Face Lifting Massage",2 739 222 katselukertaa,15.49,/@TheMomentsKS
ijEewWD5vHE,Lymph Gland Examination,2 514 390 katselukertaa,3.15,/@aidanblunt
1YnVb9Ie-r0,Dry Brushing for Lymphatic Drainage - Shown the Best way by a Lymphedema Physical Therapist,2 313 278 katselukertaa,10.09,/@CancerRehabPT
cCPyWFK0IKs,"The Lymphatic System Overview, Animation",1 782 971 katselukertaa,4.35,/@Alilamedicalmedia
vAs9uFYvcrk,Lymph Drainage for the Ears from Louisville Massage Therapist at MassageByHeather.com,1 728 322 katselukertaa,6.38,/@massagebyheatherw
6EItCUclj98,Tasoita vatsa nukkuessasi 8 helpolla vatsan imusolmukkeen itsehieronnan tekniikalla,1 437 522 katselukertaa,16.58,/@imis
H0OtQlQYwrQ,Warning Signs of Lymphoma,1 378 025 katselukertaa,2.25,/@clevelandclinic
c9t4Bu_Rbug,Työntämällä tänne polven imusolmukkeiden tyhjennys poisti polven rasvaa ja kipua ja laihtui jalkoja,1 304 735 katselukertaa,15.33,/@imis
8OXa2aP6Wts,"Congestion, Allergy, and Sinus Pressure Relief using Sinus Lymphatic Drainage Massage at Home",1 299 158 katselukertaa,9.27,/@CancerRehabPT
WSi42C9Nzv8,Examination of the Lymph Nodes - Clinical Examination,1 289 960 katselukertaa,5.53,/@ambossmedical
cyOKODs47JA,5 Minute Lymphatic Drainage Routine for your Immune System Health,1 213 406 katselukertaa,7.47,/@CancerRehabPT
BLrccmngOVQ,LYMPHOMA After Ignoring 6 WARNING Signs,1 154 664 katselukertaa,7.13,/@DoctorMikeHansen
XWFJU4vzKxU,"Massage Lymphatic Drainage Therapy Instructional Lymph Drainage, Legs and Thighs",1 101 588 katselukertaa,8.46,/@psychetruth
QD9AdNXSQe4,Introduction to the Lymphatic System,1 078 057 katselukertaa,10.32,/@osmosis
bYQwM841ED4,Yoga For Lymphatic Flow,1 064 490 katselukertaa,27.27,/@yogawithadriene
