Video Id,Title,View Count,Length,Channel
qaJUEuP6QlI,Madden Stereotypes,66 743 101 katselukertaa,4.51,/@dudeperfect
W5HvXRqhee4,The Madden NFL Curse..,6 272 453 katselukertaa,15.26,/@REBOUNDfootball
j9QAqekW6u0,Scoring a Touchdown on Every Madden EVER (1988-Present),6 180 795 katselukertaa,54.09,/@RBT
9pwjPb7KOAw,How Good is Tyreek Hill at Madden? HE EXPOSED ME WORSE THAN EVER!!,5 868 984 katselukertaa,13.36,/@YoBoyPizza
6yZxH3YRnqY,DAD vs SON in MADDEN NFL 20 (Closest Game EVER!) K-City GAMING,5 577 966 katselukertaa,22.37,/@KCityGaming
1mzflBFYSSw,SUPER BOWL TYREEK HILL IS A MADDEN GLITCH! THE FASTEST PLAYER! Madden 20 Ultimate Team,4 974 152 katselukertaa,13.41,/@KayKayEs
BCxfjIB7qEI,YoungBoy Never Broke Again - Like Madden [Official Audio],4 860 364 katselukertaa,2.29,/channel/UClW4jraMKz6Qj69lJf-tODA
fznneVRkSJw,PLAYING EVERY SINGLE MADDEN NFL GAME IN ONE VIDEO..,4 255 062 katselukertaa,1.37.34,/channel/UCyonhOKT0NDMXzM72UFcu5A
Er89BYiDUrc,Strongest Team vs Fastest Challenge in Madden NFL 22! K-City,4 212 983 katselukertaa,17.43,/@KCityGaming
MEtbHZeeYuI,scoring a 99 yard touchdown with lamar in every madden!,3 852 332 katselukertaa,0.47,/@MMG69
SgKVKSENvg4,Madden NFL Franchise Part 18: Super Bowl Finale!,3 796 881 katselukertaa,23.37,/@KCityGaming
dhGAiYfwyhA,I Found A Way To Get Tyreek Hill At Quarterback And He's Unstoppable!,3 626 171 katselukertaa,10.35,/channel/UCyonhOKT0NDMXzM72UFcu5A
U9Z1yxKPqPk,GOLDEN TICKET MICHAEL VICK IS A CHEAT CODE! JUKING EVERYONE! Madden 20 Ultimate Team,3 530 723 katselukertaa,14.35,/@KayKayEs
1WA8QixbGbI,Madden 23 But Out of Bounds Doesn't Exist..,3 325 239 katselukertaa,13.36,/@YoBoyPizza
PtUWY4orBmc,MVP LAMAR JACKSON IS A MADDEN CHEAT CODE! HE'S TOO FAST! Madden 20 Ultimate Team,3 073 354 katselukertaa,12.42,/@KayKayEs
GvyDhEuDCdc,Madden - Golden Light (feat. 6AM) [Official Audio],2 777 757 katselukertaa,3.27,/channel/UCb_Jm0zY1wB9BKQCU4zZ6QQ
oTivSNwsR_E,Scoring a 99 Yard Touchdown with Tyreek Hill on EVERY Madden,2 692 614 katselukertaa,14.42,/@RBT
D-rTB961ldc,"If you play Madden, you should watch this",2 649 633 katselukertaa,0.28,/@MisterCiv
7W3Dad8kPw8,Madden 23 in 1 minute,2 638 969 katselukertaa,0.59,/@Mayz
67lYJtKNAX8,What’s The Farthest Punt In Madden?,2 320 134 katselukertaa,0.57,/@KinnyGames
