Video Id,Title,View Count,Length,Channel
HQo1EbOjv9s,Is She Going Too Far? | Sex Madness,409 107 239 katselukertaa,3.46,/@fallingtower
4JkIs37a2JE,Jamiroquai - Virtual Insanity (Official Video),248 659 158 katselukertaa,3.55,/channel/UCd8wWXk6fSa8b8WaZbpWgvg
oUTKxaHj2o8,Nerf Blaster Madness! Ethan and Cole Nerf Modulus mess!,217 152 760 katselukertaa,6.07,/@SneakAttackSquad
Ek0SgwWmF9w,Muse - Madness,168 685 430 katselukertaa,5.20,/channel/UCGGhM6XCSJFQ6DTRffnKRIw
VPSoNx1gyQ4,"88RISING - Midsummer Madness ft. Joji, Rich Brian, Higher Brothers, AUGUST 08 (Official Music Video)",111 910 634 katselukertaa,5.07,/@88rising
UDRHDArMXQY,The Super Fat Guy Beat the Bodybuilders at Muscle Beach | Muscle Madness,90 779 218 katselukertaa,9.17,/@MuscleMadness
Hb0k5NvatkQ,"Doctor Strange Multiverse Madness, photoshoot",82 923 585 katselukertaa,0.43,/@JakeCeja
KGbMzi7UQig,SL - Gentleman (Music Video) | @SL_VP_ @MixtapeMadness,78 734 134 katselukertaa,3.10,/@MixtapeMadnessOfficial
Wh1L0rOaa88,March Madness Stereotypes,75 102 979 katselukertaa,5.48,/@dudeperfect
SsmVgoXDq2w,The Bangles - Manic Monday (Official Video),70 540 189 katselukertaa,3.12,/channel/UCAYH1oaK2xUntHxXIq5-4Dw
WGt-8adyabk,Shinedown - Sound Of Madness (Official Video) [HD],69 481 640 katselukertaa,4.15,/channel/UCv7Bgr5Mq-dPYu-Ol4AocEA
aWzlQ2N6qqg,Marvel Studios' Doctor Strange in the Multiverse of Madness | Official Trailer,63 400 983 katselukertaa,2.17,/@marvel
FaLfWuoflpw,Mickey Mouse descends into MADNESS #shorts,59 212 552 katselukertaa,0.31,/@HassanKhadair
AuzMyTHNFDw,SL - Tropical (Music Video) | @MixtapeMadness,58 599 066 katselukertaa,3.24,/@MixtapeMadnessOfficial
O-srTvXH5bo,Conor McGregor is Ready for The Heavyweight Division (Prank) | Muscle Madness,51 033 915 katselukertaa,7.28,/@MuscleMadness
ta7ITAYTATM,Dimitri Vegas & Like Mike - Bringing The World The Madness 2014 (FULL HD 2 HOUR LIVESET),50 728 749 katselukertaa,2.04.23,/channel/UCxmNWF8fQ4miqfGs84dFVrg
dlMReeBTNOI,Mumbai Madness | A Mickey Mouse Cartoon | Disney Shorts,50 634 596 katselukertaa,3.46,/@MickeyMouse
UPswKJ8Zh7E,Fittest Soldier in the World - Diamond Ott | Muscle Madness,48 141 770 katselukertaa,6.32,/@MuscleMadness
Rt_UqUm38BI,Marvel Studios' Doctor Strange in the Multiverse of Madness | Official Teaser,42 295 306 katselukertaa,2.12,/@marvel
1qc5bAgZ0uY,STRONGEST Soldier in Army Gym - Diamond Ott | Muscle Madness,41 742 505 katselukertaa,14.41,/@MuscleMadness
