Video Id,Title,View Count,Length,Channel
JtVuKkjdkHY,BATTLE OF THE BIG NO.9'S RETURN: FOOTBALL LANDSCAPE CHANGED COURSE! SANCHO'S ROAD TO REDEMPTION!,9 799 katselukertaa,1.20.11,/@matissearmani
eHD41yBHKfc,"[HEATED] THE BIGGER CLUB: WEST HAM V TOTTENHAM ""CHELSEA 10TH & SPURS ABOVE ARSENAL!"" [PL PREDICTION]",13 799 katselukertaa,1.43.48,/@matissearmani
XTBNONSR9F8,The Chemical Brothers - MAH (Visual),5 665 430 katselukertaa,2.25,/channel/UCvyAsTkXVoCQtFG-rGhwCKw
DzZ3xvzY2E8,THE RETURN: PURE PROFIT PLAYERS FIGHT FOR THEIR LIVES! DECISIVE ON DISASI & SQUAD EXCLUSIONS!,12 998 katselukertaa,1.30.32,/@matissearmani
q5cPnq_5wd8,"MAH’S FINALISED 23/24 PREMIER LEAGUE TABLE PREDICTION! WINNER, EUROPEAN PLACES & RELEGATION ZONE!",13 398 katselukertaa,29.20,/@matissearmani
_ENAXAYqKes,MAH LIVE: SHUT DOWN AT STAMFORD IN WIMBELDON WIN! CHELSEA TO SIGN £45M COLE PALMER CONFIRMED!,16 538 katselukertaa,1.13.07,/@matissearmani
t4ho3lnl5Ys,CHELSEA COLLAPSED: BE PROACTIVE POCHETTINO! LAST GASP DECLAN DRAMA & SON STEPPED UP! 10 POINT GXNG!,19 279 katselukertaa,1.41.06,/@matissearmani
417M7K78H7M,How to Play Mah Jongg 2023 9-12 Tips to join a new Group Live Clinic #ilovemahj,293 katselukertaa,1.03.34,/@MAHJONGGCLASS
LR8i1QqaPzk,MAH LIVE: WEST HAM VS CHELSEA PREMIER LEAGUE SARCIFICIAL SUNDAY WATCHALONG!,73 762 katselukertaa,2.59.40,/@matissearmani
VIZcOX9oZBQ,THERAPEUTIC SESSION: LAMPARD'S FITNESS SETUPS & BOEHLY MUST TAKE RESPONSIBILITY & NEVER REPEAT THIS!,22 585 katselukertaa,1.43.14,/@matissearmani
kK5arMrC2G8,TEN HAAG VS SANCHO: HAT-TRICK HAALAND FOR 100% CITY! SZOBOSSLAI STRIKES AS LIVERPOOL SMASH SCHEDULE!,17 548 katselukertaa,1.53.18,/@matissearmani
R8d-q9622O4,MAH LIVE: CHELSEA VS NOTTINGHAM FOREST PREMIER LEAGUE SCINTILLATING SATURDAY WATCHALONG!,58 737 katselukertaa,3.07.54,/@matissearmani
kdy1sWXELT0,DEBATE: WHAT IS CHELSEA’S STRONGEST XI! POCHETTINO’S PROBLEMS TO SOLVE & POTENTIAL PARTNERSHIPS!,14 571 katselukertaa,19.11,/@matissearmani
GcEoj6f92kU,BLUE SHARKS & HAMMER SHARKS RISE: LAWLESS LET LOOSE ON THE LOSERS CLUB! WHO'S MORE EMBARRASSED?!,11 705 katselukertaa,1.11.26,/@matissearmani
-9l_0-wnJm8,MAH LIVE: ARSENAL VS CHELSEA PREMIER LEAGUE TRAUMATIZING TUESDAY WATCHALONG!,53 865 katselukertaa,2.47.54,/@matissearmani
HyCbagOTOn8,CITY C-TEAM CHAMPIONS: 5 TITLES IN THE LAST 6 YEARS! RANKING THE TEAMS AT FAULT! THE PEP EFFECT!,11 777 katselukertaa,1.54.37,/@matissearmani
1bR5aXlgGVA,ANTICS ONLINE & IRL: FEELING SORRY FOR FERNANDEZ! HOLD HALL IN HIGH REGARD & RUTHLESS SUMMER SALES!,17 658 katselukertaa,1.22.27,/@matissearmani
KyiDvwopOIQ,LEFT-BACK DEBATE: TRIMMING DOWN THE TEAM! CAICEDO ALTERNATIVES & JACKSON SHUTS DOWN STRIKER TALK!,31 587 katselukertaa,1.49.33,/@matissearmani
wX32IcBPvcI,STELLINI SACKED: DESPICABLE SPURS WITNESS TOP 6 POWER SHIFT! ARSENAL BOTTLING & RICE RISING!,14 435 katselukertaa,1.13.38,/@matissearmani
