Video Id,Title,View Count,Length,Channel
ZI4RQFZYrXw,Five Kids Who's at the Door? Kids Song,266 867 797 katselukertaa,3.09,/@VaniaManiaKids
J0VLOPUIsi4,Five Kids Moving Song + more Children's Songs and Videos,245 236 812 katselukertaa,1.59.18,/@VaniaManiaKids
kBsycvSU6r8,The Weeknd - M A N I A (Official Video),119 866 177 katselukertaa,12.00,/channel/UC0WP5P-ufpRfjbNrmOWwLBQ
cOchidcyv9Q,Raça Negra - Cheia de Manias (Deezer Sessions),105 084 235 katselukertaa,4.14,/channel/UCVVvg0xw2FrVZEHmGboLkBw
ksaJrnLtrU8,Five Kids Rich Princess vs Broke Princess | The Story of Princesses,104 635 307 katselukertaa,39.00,/@VaniaManiaKids
mRQH4KQRE40,The Gummy Bear Song 2019 - Gummy Bear Show MANIA Style,102 647 568 katselukertaa,3.38,/@GummyBearShowMania
E6tPkgnJFec,Five Kids show that knowledge at school is the most important thing,94 673 721 katselukertaa,9.56,/@VaniaManiaKids
CLiIXb5137g,Five Kids How to Swim in the Kids Pool and Plays with Fun Water Toys,72 665 742 katselukertaa,38.53,/@VaniaManiaKids
5tnm7Nm9xd0,Find 32 types of Disney Cars & Japanese Anime Tomica in the park!,68 516 091 katselukertaa,10.17,/@maniajapansong
zbSm6E92-BY,Permainan bola plastik berwarna-warni lego challenge | vania mania bahasa indonesia,66 037 869 katselukertaa,11.41,/@vaniamaniabahasaindonesia
R1IGVEUQdc4,Five Kids Learn the alphabet ABC + more Children's Songs and Videos,53 769 253 katselukertaa,37.41,/@VaniaManiaKids
EA2kSzRRWoQ,Little Flash plays Sonic Mania Part 2: Chemical Zone Level! / K-City,48 060 513 katselukertaa,14.37,/@KCity
PltlJxIY-rU,Mania & Stefy both want the same dress,47 370 944 katselukertaa,4.13,/@VaniaManiaKids
MCZmd_qeb1I,Enjambre - Mania Cardiaca (Video Oficial),42 428 199 katselukertaa,4.15,/@ArteAnormal
C4oU2A9yiz0,MOTORCYCLE DRIFT MANIA [SAWMILL PLAYGROUND],41 523 171 katselukertaa,3.07,/@RokBagorosStuntrider
YHmeeDlHXAw,Mania is going to the Princess ball - Youtube,39 873 674 katselukertaa,4.06,/@VaniaManiaKids
CziQSdNFLoE,FATHER SON BURGER MANIA!!! / Make Tiny Burgers!,37 946 157 katselukertaa,15.47,/@TurboToyTime
xC_k29Pf_hE,Vania & Mania BUILD BEDS with GIANT LEGO Toys | Rain Rain Go Away Song,34 784 436 katselukertaa,10.54,/@VaniaManiaKids
hPzytbmDTRg,Father & Son PLAY SHARK MANIA! / Don't Get Eaten!,32 575 394 katselukertaa,12.42,/@TurboToyTime
E78GfKwGOSo,BURGER MANIA BOARD GAME with Ryan ToysReview,32 246 625 katselukertaa,10.08,/@RyansWorld
