Video Id,Title,View Count,Length,Channel
BMA171qWYZk,YUNGBLUD - mars (Official Video),11 026 245 katselukertaa,3.08,/channel/UCd3Llj2WWJh8ItfYl32eJ4Q
YaYi5CAy-g0,"Bruno Mars | Top Songs 2023 Playlist | When I Was Your Man, Just The Way You Are, 24K Magic...",1 710 183 katselukertaa,1.11.22,/@topsify
4wROpU-gPc0,Graham Hancock Just Announced NASA's Terrifying Discovery On Mars,145 281 katselukertaa,26.54,/@futureunity5129
di-VTrW7Kr0,Thirty Seconds To Mars – Stuck (Official Video),14 225 141 katselukertaa,3.23,/channel/UCK7wTMguyPyPCjhLoOK2rJg
xpWP55bJGB4,NASA's Mars Rover Capture Latest Shocking Scene of Mars Life -Perseverance Live Images,318 803 katselukertaa,8.05,/@TheDocumentaryWorld
70Qi4Nk3aJc,A Natural History of Mars,663 592 katselukertaa,12.27,/@eons
jMPkCCxkEVI,TALK - Run Away to Mars (Official Video),12 523 595 katselukertaa,3.52,/channel/UC__auRZOSvg0mxYBPs3GWMQ
ZEyAs3NWH4A,New: Mars In 4K,66 660 600 katselukertaa,10.09,/@ElderFoxDocumentaries
Hav6TTNUIB4,ALEKSANDRA PRIJOVIC - MARS (OFFICIAL VIDEO),26 274 351 katselukertaa,4.58,/channel/UC4qPZaQnAJmhv50Wcorf8uQ
aDpxXcrdCF0,Latest NASA Data Show Something Weird is Happening Inside Mars,790 335 katselukertaa,8.18,/@TheSecretsoftheUniverse
q9Nuy7mFIsE,Alien Artifacts on Mars: What NASA doesn't want you to know,3 478 781 katselukertaa,32.13,/@TheWhyFiles
p2CVaGPdZjM,How Are We Going To Survive On Mars? | Spark,79 106 katselukertaa,47.21,/@SparkDocs
dNFGMmPIC2Y,Latest NASA Data Shows That Something Strange Is Happening inside Mars!,30 686 katselukertaa,12.04,/@TheSimplySpace
D8pnmwOXhoY,Mars 101 | National Geographic,3 945 159 katselukertaa,3.41,/@NatGeo
MZ9GjSDhU-I,NASA Creating Oxygen On Mars,1 185 738 katselukertaa,0.25,/@omaragamyy
8e6RzkFmc_I,NASA's Journey to Mars | full Documentary,11 417 katselukertaa,44.13,/@ScienceDocumentariesEnglish
V2AyDjcGRrk,How SpaceX and NASA Plan To Build A Mars Colony!,100 888 katselukertaa,13.40,/@TheTeslaSpace
NMrIFKD1b8M,Mars Rover's Panoramic Cam Capture Latest 360° Unexpected Weird 4K Video Footage of Mars Life,566 169 katselukertaa,8.15,/@TaviTechnicalSpace
XRCIzZHpFtY,★ How to Get to Mars. Very Cool! HD,124 940 409 katselukertaa,6.33,/@aheli
