Video Id,Title,View Count,Length,Channel
ieIjgQ2X8kc,Mask Doo Doo Doo! | D Billions Kids Songs,812 310 892 katselukertaa,1.12,/@dbillions
xvZqHgFz51I,Future - Mask Off (Official Music Video),589 295 641 katselukertaa,4.50,/channel/UCSDvKdIQOwTfcyOimSi9oYA
V-LTv-r8u-w,That's a Spicy Meatball Two (Crazy Hunger) The Mask,256 894 269 katselukertaa,1.38,/@SalvoLaMonicaDigitalAnimator
4ZgThsAwsf0,Not able to drink or eat with a face mask?? #Shorts,254 661 824 katselukertaa,0.12,/@romina
bVAVCLpcTNM,Makeup Face Mask ASMR,236 068 558 katselukertaa,0.38,/@itsDrRyan
SdQs0v45HEI,Pink Face Mask ASMR #shorts,232 080 162 katselukertaa,0.27,/@itsDrRyan
M0gRztqjXIg,Wear your mask - a story for kids by Like Nastya,224 076 167 katselukertaa,5.29,/@LikeNastyaofficial
njUnl1dX6ew,Transforming Headquarters Playtime Fun With CKN,216 131 234 katselukertaa,4.09,/@CKNToys
FIASgzJHJ3I,ASMR Dental Face Mask #shorts,194 624 093 katselukertaa,0.26,/@itsDrRyan
fjUGC8g4GOE,Future - Mask Off (Lyrics / Lyric Video),191 237 096 katselukertaa,3.25,/@TrillyRap
4EhoHUFglvI,Gold Face Mask ASMR,185 308 816 katselukertaa,0.56,/@itsDrRyan
Xti4Ke04wNs,PJ Masks | CATBOY SQUARED! | Kids Cartoon Video | Animation for Kids | COMPILATION,179 908 180 katselukertaa,2.34.46,/@PJMasksOfficial
G6u4qzEKsBs,"Five Little Babies with PJ Masks | Connor, Amaya and Greg | Nursery Rhymes for kids",163 614 043 katselukertaa,2.32,/@Music4KidsOld
AvlEL8xhE-A,Wear Your Mask Song with Vlad and Niki,162 537 141 katselukertaa,3.37,/@VladandNiki
SOHupYAOaL0,PJ Masks | Superheroes in Action! | Kids Cartoon Video | Animation for Kids | COMPILATION,125 454 098 katselukertaa,2.34.46,/@PJMasksOfficial
k3LOvpcZlBM,PJ Masks | Robots! | Disney Junior UK,116 459 302 katselukertaa,3.48,/@disneyjunior
DdPkWdAlKRY,Indian Face Mask ASMR #shorts,114 992 505 katselukertaa,0.31,/@itsDrRyan
6q0P076A_ag,PJ Masks Toys for Kids,109 208 720 katselukertaa,12.27,/@Kidibli
k0Twsb22Ld4,"Kids, let's learn colors while the ☻PJ Masks☻Race!",101 581 614 katselukertaa,10.44,/@GenevievesPlayhouse
-bP0ekmHCTU,PJ Masks Full Episodes | GEKKO'S NICE ICE PLAN | ❄️PJ Masks Christmas Special ❄️ | Cartoons for Kids,97 076 655 katselukertaa,1.17.34,/@PJMasksOfficial
