Video Id,Title,View Count,Length,Channel
zTKtbtovCdc,"AriBeatz, Ozuna, Sfera Ebbasta, GIMS - MIRAGE (Official Animation Video)",19 904 388 katselukertaa,3.32,/channel/UCszKXJCtIrlMbsMjIJ1uakA
Gc9DbG-jzbc,Assassin's Creed Mirage Gameplay and Impressions...,268 637 katselukertaa,12.37,/@jackfrags
_PUPYK4bO44,"Assassin’s Creed Mirage ist VIEL mutiger, als wir dachten!",178 687 katselukertaa,12.01,/@gamestar
rqKuyx0m5mI,The Assasin’s Creed Mirage Experience,126 080 katselukertaa,27.58,/@AfroSenju
W0j4cQ8vJi0,"AriBeatz, Ozuna, Sfera Ebbasta, GIMS - MIRAGE (Lyrics)",264 189 katselukertaa,3.27,/@thevibeguide
RqcFgGwoxco,Jaki NAPRAWDĘ jest Assassin's Creed Mirage? Już graliśmy!,65 533 katselukertaa,13.03,/@tvgrypl
G97lx7orMN8,Assassin's Creed Mirage: Gameplay Trailer,2 318 746 katselukertaa,2.04,/@Ubisoft
mxpYHW-M_Ac,Assassin's Creed Mirage: Gameplay Walkthrough | Ubisoft Forward,3 597 959 katselukertaa,7.52,/@Ubisoft
lHgaolJLQoY,Assassin's Creed Mirage: The First Hands-On Preview,302 156 katselukertaa,4.43,/@IGN
Th4TyuecilA,AriBeatz x Ozuna x Sfera Ebbasta x GIMS - MIRAGE (Official Audio),4 634 796 katselukertaa,3.27,/channel/UCszKXJCtIrlMbsMjIJ1uakA
x55lAlFtXmw,Assassin's Creed Mirage: Cinematic World Premiere | #UbiForward,8 053 142 katselukertaa,3.49,/@Ubisoft
ie3kKBLUmxA,Assassin's Creed Mirage 4K Gameplay Reveal Trailer | PlayStation Showcase 2023,206 643 katselukertaa,2.04,/@gamespot
pPsi4FMGR6M,"théos, antent - mirage",132 919 katselukertaa,1.59,/@dreamscape..
I-ztu_HV-6Y,I played 'Assassin's Creed: Mirage' early...,272 389 katselukertaa,20.41,/@LukeStephensTV
0O1LvkTL0MM,"AriBeatz, Ozuna, Sfera Ebbasta, GIMS - MIRAGE (Letra/Lyrics)",530 110 katselukertaa,3.27,/@RoyalVibesOfficial
OW1mU4vBBEU,Transformers: Rise of the Beasts | Meeting Mirage Clip ft. Anthony Ramos | Paramount Movies,1 394 767 katselukertaa,9.26,/@paramountmovies
GL3vcLye5jg,I Played Assassin's Creed Mirage Early.... (AC Mirage Gameplay),105 745 katselukertaa,11.49,/@JorRaptor
yPs-p91hjBI,Assassin's Creed Mirage: The Round City of Baghdad,861 937 katselukertaa,2.07,/@Ubisoft
Rh-3zAcJu4o,Assassin's Creed Mirage: Basim  - The Master Assassin,1 338 366 katselukertaa,5.58,/@Ubisoft
J1SJP-K86s8,The good and bad of ASSASSIN'S CREED : MIRAGE,35 481 katselukertaa,15.09,/@TheBacklogs
