Video Id,Title,View Count,Length,Channel
g41Ddg8blUg,Lil Gnar - Missiles ft. Trippie Redd (Official Music Video),1 843 356 katselukertaa,2.47,/channel/UCIQtSBzxEZctxJWt9daNqpg
dKHbB8c2RQA,Missiles,111 768 katselukertaa,5.29,/channel/UCVenxdjfY0pKLGWvMskNfqA
O3xL370a6cQ,Storm Shadow Crusie Missiles Destroyed Sea Landing Ship and Kilo Class Submarine #3d,20 666 katselukertaa,8.22,/@Aitelly
CDsFKOrLWhU,Sam Fender - Hypersonic Missiles (Official Video),6 510 053 katselukertaa,4.25,/channel/UCNOPATl0JcguaVn1ovKWU1w
E5WWx9Zuj8s,Two Russian MiG-29s shot down by Ukrainian military tracked missiles | ARMA,278 926 katselukertaa,12.06,/@SILENCER1729
Zdrt0BvX7F0,Why Russia Worries about Ukraine getting Taurus Missiles,62 764 katselukertaa,6.29,/@Interestingengineeringofficial
IHOrIXSS-MM,Ukraine Hits Crimea With US Targeting And British Missiles,3 494 katselukertaa,29.54,/@RonPaulLibertyReport
_kg1k87190g,Johnny Jane - Missiles (Visualizer),34 916 katselukertaa,2.44,/channel/UCuNQ7yowbiYOxEwM_MKYvUQ
N3Bn4sy0zK4,US Air Force tests nuclear capable missile,236 747 katselukertaa,0.30,/@CNN
Trlm14F-nfw,Russian fighter jet pilot fired two missiles at British RAF plane carrying 30 aircrew,13 260 katselukertaa,1.47,/@scottishdailyrecord
pRHnblS7EoE,Storm Shadow Missiles: Inside Ukraine’s Nearly $1 Million Weapon | WSJ Equipped,1 020 264 katselukertaa,8.02,/@wsj
_sg7rmSgPb8,AGM-114 Hellfire: America's $100K Badass Missile,1 318 170 katselukertaa,10.33,/@USMilitary_News
Xe488-jnmLw,How SAMP/T Defends Ukraine Against Russia's Missile and Drone Attacks,16 160 katselukertaa,5.05,/@Interestingengineeringofficial
h449oIjg2kY,Long Range Anti-Ship Missile (LRASM),13 406 143 katselukertaa,5.00,/@LockheedMartin
b1E-_ti9VYY,Tomahawk Missile Are Superior to Hypersonic Missiles?,73 054 katselukertaa,9.02,/@Military-TV
Zy2RGu2L2DI,America's Nuclear Missile Fields; Defending America's Satellites | 60 Minutes Full Episodes,6 296 912 katselukertaa,50.57,/@60minutes
d0Hc5I5Mfuo,How missile guidance systems work,1 028 589 katselukertaa,5.41,/@Interestingengineeringofficial
ANJwH7Hxz_w,The 11 Most Terryfying Missiles In 2023,427 086 katselukertaa,11.45,/@thebuzz4108
yksbEE4GbCw,Cruise Missile Storm Shadow How it works | How Missile flies,758 313 katselukertaa,8.05,/@Aitelly
NN5k0BjTPzQ,North Korean Missiles,2 625 097 katselukertaa,0.40,/@PrestonStewart
