Video Id,Title,View Count,Length,Channel
lZ_PiG5mC30,Multilateral Nuclear Disarmament,237 851 katselukertaa,2.55,/channel/UCpRUSBcRWUQZIj3_jWF19Dg
Ca7giYI6zWA,Why do we need a strong system of multilateral cooperation?,1 389 katselukertaa,4.31,/@cgtn
U6XiSDSbX6k,MULTILATERAL - DZARIL FREAKOUT (ORIGINAL MIX),81 588 katselukertaa,4.01,/channel/UCXqiAPOqqCBwnqZ6vDcgrDA
-L4120-o4nU,Multi-Lateral Drilling,16 585 katselukertaa,2.23,/@TycoonEnergyInc
KRmUPHT2Vyo,History of the multilateral trading system,18 383 katselukertaa,3.52,/@WTO
m76KpJJXiHU,What are the challenges to multilateral negotiations? | Bilateralism and Multilateralism | #upsc,2 063 katselukertaa,13.26,/@OnlyIASExtended
3v3A5CJ7gdM,Multilateralism Explained | Model Diplomacy,33 346 katselukertaa,2.45,/@CFR_Education
q923zMiJHn0,Multilateral Organizations & Challenges,1 280 katselukertaa,5.01,/@crystalorangehearts2
_TgYbBAenHc,Multilateral Aid - What is it and who does it help?,2 428 katselukertaa,2.30,/@Missnewgeog
Ik0EcvNqvK4,The Multilateral Trade Agreements,4 886 katselukertaa,1.53,/@WTOE-LEARNING
WGYaot6wAOo,Episode 5 : Explained in 2 Minutes : Multilateral Development Banks MDBs,275 katselukertaa,2.11,/@bankingfinancewithus
dEHddER7cSg,What Is Multilateral Financing?,74 katselukertaa,2.25,/@expertvillage
qWsYlsFKnL0,KSR Diplomacy Diary: 13. Multilateral Diplomacy,1 465 katselukertaa,17.27,/@ambkishanrana
kont6_r2UJs,Bilateral vs. multilateral diplomacy explained by a Senior British Ambassador. Talk to artists!,1 595 katselukertaa,2.14,/@unitedcareercoalition7872
NbHXPzkE5tM,"Multilateral Drilling Wells Terminology, Applications & Classifications System",847 katselukertaa,1.06,/@drillingmanual
kj91sfH4fpY,How to drill a multi lateral well,10 431 katselukertaa,2.12,/@productiontechnology9239
pRJ22re4l9U,"Unilateral, Bilateral aur Multilateral Trade Agreements Kya Hote Hain ?",3 124 katselukertaa,0.34,/@LawMate-YourLegalGuide
Hnj5VmtHbh0,DI: The role of multilateral organizations,405 katselukertaa,3.30,/@LLORENTEYCUENCA
SuVtemaLSR8,International Organizations and Multilateral Diplomacy (IWP 682),1 089 katselukertaa,2.26,/@theiwp
PwPlE_sSN6w,DJ MULTILATERAL SOUND GAKOZEN VIRAL TIK TOK TERBARU YANG KALIAN CARI!,15 091 katselukertaa,6.14,/@DJREYHAN1
