Video Id,Title,View Count,Length,Channel
0UjpmT5noto,Municipal Violations: Last Week Tonight with John Oliver (HBO),11┬а206┬а695 katselukertaa,17.55,/@LastWeekTonight
iwEf-1NkIpg,MUNICIPAL WASTE - Breathe Grease (OFFICIAL MUSIC VIDEO),4┬а068┬а866 katselukertaa,3.08,/@NuclearBlastRecords
kAC8eG8qwjE,please give respect to municipality workers ЁЯЩП#shorts #youtube,2┬а265┬а159 katselukertaa,0.59,/@poojadevarakonda
Y1Edy7MKSp4,Local Government | Panchayati Raj Vs Municipalities Explained In Detail | Hindi,1┬а260┬а611 katselukertaa,14.10,/@BasicGyaan
Dn0QTMDVH6U,Mga Pinaka Mahihirap na Municipalities sa Pilipinas (Poorest Towns),880┬а577 katselukertaa,8.33,/@WelbizPh
1pkJtnNxP_k,рдирдЧрд░рдкрд╛рд▓рд┐рдХрд╛ (Municipality) | рдирдЧрд░ рдкрдВрдЪрд╛рдпрдд | рдирдЧрд░ рдкрд░рд┐рд╖рдж | рдирдЧрд░ рдирд┐рдЧрдо | Indian polity | Study vines official,795┬а348 katselukertaa,24.16,/@Studyvinesofficial
A7YeXD01iwQ,рмдрмо рмжрм┐рмЯрм╛ рмЩрнНрмХрнБ рмирнЗрмЗ рммрм╛рм╣рм╛рм░рнЗ Municipality рмЕрм│рм┐рмЖ рмЧрм╛рмбрм╝рм┐рм░рнЗ рмлрнЛрмкрм╛рмбрм╝рм┐ рмжрнЗрммрм┐ #Aparajita #Megaserial #SidharthTV,693┬а360 katselukertaa,0.44,/@SidharrthTVShorts
oMchF3XeRD4,MUNICIPAL WASTE - Grave Dive (OFFICIAL MUSIC VIDEO),571┬а991 katselukertaa,2.33,/@NuclearBlastRecords
XXJy1TFtJzw,р░Зр░Вр░Хр░╛ р░Зр░Яр▒Нр░▓р░ир▒Зр░ир░╛.. | Municipality Workers | V6 Teenmaar,516┬а047 katselukertaa,0.58,/@teenmaar
llpBrA_sQt4,рдЦреЛрд▓рд╛рдорд╛рдерд┐ рд╕реНрдХреБрд▓! рдорд╣рд╛рдирдЧрд░рдкрд╛рд▓рд┐рдХрд╛рд▓рд╛рдИ рдкрдирд┐ рдЫрд┐рд░реНрди рджрд┐рдЗрдПрди | Kathmandu a municipality | mayor Balen shan,404┬а243 katselukertaa,20.33,/@fewatimes
Byix7ultiAc,р░Ър░Вр░жр▒Нр░░р░мр░╛р░мр▒Б vs р░Ьр░Чр░ир▒Н | personality vs municipality | TS  Leaders about Ap CM Ys jagan and Chandrababu,364┬а949 katselukertaa,0.57,/@CBNFORPEOPLE
o1igThnt9Yc,Municipal Corporation : Local Self Government | Indian Polity | SSC CGL | By TVA,342┬а682 katselukertaa,9.11,/@THEVEDICACADEMY
spxWTHnVI2I,Municipality works Hyderabad ЁЯдЧЁЯШЗ #meal #lekirider #hyderabad,310┬а405 katselukertaa,0.54,/@Leki_goswami
xO5jiHAj8ec,Tadipatriр░▓р▒Л р░жр▒Вр░╕р▒Бр░Хр▒Бр░кр▒Лр░др▒Бр░ир▒Нр░и р░Яр▒Ар░бр▒Ар░кр▒А | JC prabhakar Reddy | Tadipatri Municipality | TV5 News,286┬а084 katselukertaa,1.59,/@tv5news
B3RfE54ifVk,Write a letter to the Municipal Corporation regarding Cleanliness | Letter Writing,283┬а182 katselukertaa,4.14,/@preparestudies
YKI0PjSN4T4,Mga Pinaka Mayayamang Municipalities sa Pilipinas 2023,275┬а688 katselukertaa,9.58,/@WelbizPh
NxI-FpWqYs0,The world's most powerful street machine. The municipality was shocked.,269┬а648 katselukertaa,10.08,/@populerwrldvideo
7tRYWkz1RIU,Alasina Jeevulu Municipality Karmiku | Social Songs | Telangana Folk Songs | Janapada Songs Telugu,195┬а768 katselukertaa,6.55,/@TelanganaFolks
IKrl4POsyRU,MUNICIPALITY ELECTION RESULTS LIVE | PRUDENT | 26 APRIL 2021,182┬а102 katselukertaa,10.10.30,/@PrudentMediaGoaTV
JKZ6jv9mdl4,Jugal Official Documentary ll Jugal Rural Municipality l Sindhupalchok  l with English Subtitle,180┬а924 katselukertaa,27.49,/@lhapsangkarpo
