Video Id,Title,View Count,Length,Channel
nLQmQg_tQxw,NAD Keeps Making the SAME AMP! NAD C 399 Review,121 082 katselukertaa,24.35,/@robinsonbrand
P41NtX82M1w,NAD Electronics: 50 Years of Truth in Power (Full Documentary),175 239 katselukertaa,42.30,/@NADElectronics
LmRDCBx42Ew,What is NAD+?,189 548 katselukertaa,7.27,/@DrMattDrMike
fEqtGba4MmI,A MORE Effective Approach To Restore Our NAD Levels??,101 471 katselukertaa,14.22,/@ReverseAgingRevolution
gK_OppZDOVw,NAD+ metabolism in aging & 3 strategies to rejuvenate,30 878 katselukertaa,15.49,/@TheSheekeyScienceShow
VWH82ioLTVY,NAD C 3050 The New VINTAGE STEREO I've Been Waiting For!,43 615 katselukertaa,8.13,/@JustAudioHiFi
hggLOXhFRxc,NAD+ in Aging: Role of Nicotinamide Riboside and Nicotinamide Mononucleotide,577 498 katselukertaa,30.01,/@FoundMyFitness
ld_RguSYZD4,The NAD C3050 LE is a VINTAGE AMPLIFIER for the 21st century!,147 478 katselukertaa,28.34,/@DarkoAudio
GuqP0GZndL8,NAD HID THEIR BEST AMPLIFIER IN THIS AND DIDN'T TELL YOU (do this hack now) NAD C399 BluOS-D,10 022 katselukertaa,7.07,/@JustAudioHiFi
fmeRgF46jh4,"Potential Risks of NAD Supplements | Iñigo San-Millán, Ph.D. & Peter Attia, M.D.",36 339 katselukertaa,7.30,/@PeterAttiaMD
JB8a5qlIl7o,HIGH END Home Theater Receivers: BEST NAD Amplifier? NAD T778 Review,155 940 katselukertaa,14.09,/@robinsonbrand
Y_P62LBKgJU,N181R - Dreamer Girl [NAD Arcade Release],43 katselukertaa,4.23,/@NADArcadeMusic
N6I__ijIkJk,The Problem Of Taking A NAD Precursor Alone | Lead NAD Scientist Explains,17 660 katselukertaa,14.53,/@ReverseAgingRevolution
9Uxbd21uaJo,The NAD M10 V2 is EVERYTHING,184 896 katselukertaa,24.02,/@DarkoAudio
oSKbATypWjg,IS IT BETTER TO TAKE NMN OR NAD? | Dr David Sinclair Interview Clips,28 191 katselukertaa,1.54,/@ReverseAgingRevolution
BViW9v-Y0U8,The TRUTH about NAD+ (You Could Be Taking it the Wrong Way),23 681 katselukertaa,8.40,/@LongevityInsider
PbbFiyl-cxc,STOP WASTING TIME with NAD Supplements,15 629 katselukertaa,5.46,/@SiimLand
QZ1FTm_6kjg,"Best Integrated Amplifier For Streaming? NAD C700 Review, NAIM vs NAD!",212 362 katselukertaa,21.35,/@robinsonbrand
5Y6H_WkhR_M,The FULL Ingredient List To RESTORE Our Youthful NAD Levels | NAD Scientist  Dr. Nichola Conlon,13 895 katselukertaa,14.46,/@ReverseAgingRevolution
hB7Xssl9nGw,NAD's C 3050LE is 100% 'VINTAGE' Future-Fi!,102 770 katselukertaa,10.00,/@DarkoAudio
