Video Id,Title,View Count,Length,Channel
ZlDWysim9XY,Nosy neighbor suspicious of her young neighbor steals his mail. Attorney Ugo Lord reacts!,25Â 681Â 093 katselukertaa,0.40,/@UgoLord
G0vji1R60Ts,"SECRET NEIGHBOR!! (Brand NEW Hello Neighbor Game!!) w/ Jem, ThinkNoodles & ThnxCya",7Â 761Â 169 katselukertaa,26.27,/@DanTDM
WP0ihLg74Ek,The Neighbour StoryğŸ ğŸ˜± #neighbors #shorts,2Â 452Â 892 katselukertaa,0.55,/@Prathamsinghal
aeL878NKnWI,Crazy neighbor,1Â 633Â 571 katselukertaa,3.35,/@Teena1282
epGpumB4KWI,Purity conferences at neighboring churches #makeuptutorial #shorts #breakingcodesilence #mua,1Â 360Â 067 katselukertaa,1.01,/@emily_harper_
xLVL8xnkWu4,What if Unite Neighboring Countries? | Fun With Flags,1Â 296Â 528 katselukertaa,3.39,/@fIags
_QLJ60LbZXE,What if these Neighbouring Countries Unite Part 2 #shorts,817Â 761 katselukertaa,0.35,/@asbgeo
e4k6T6wePKA,Neighboring Countries That Should Unite (Part 2) | Fun With Flags,775Â 077 katselukertaa,4.18,/@fIags
ENGgoVrDMdQ,What if Unite Neighboring Countries? Part 1,715Â 997 katselukertaa,4.29,/@dv4y
6s__8m8T0r4,Neighboring Countries Unite Into One,709Â 487 katselukertaa,3.20,/@SpinningTheGlobe
tz7bZFEZx-s,"Neighboring Countries, Please Unite Right Now!",549Â 789 katselukertaa,4.02,/@SpinningTheGlobe
UswJgVMbBzY,What if Neighboring countries unite into one ? | Fun With Flags,501Â 920 katselukertaa,4.33,/@kuizz1
ZB-G-JA7klo,What if Unite Neighboring Countries? Part 2,299Â 857 katselukertaa,6.00,/@dv4y
yeDOSDOs2X0,Neighboring Sounds Official Trailer #1 (2012) Independent Movie HD,156Â 525 katselukertaa,2.03,/@RottenTomatoesINDIE
-WlTsZdC1ds,What if Unite Neighboring Countries? Part 4,109Â 748 katselukertaa,4.46,/@dv4y
rkx6320MvUo,What if Unite Neighboring Countries? Part 3,101Â 892 katselukertaa,4.47,/@dv4y
_tYTUjMp-FI,Neighbour meaning in Hindi | Neighbour ka kya matlab hota hai | daily use English words,88Â 862 katselukertaa,0.37,/@WorldwideSpokenEnglishByVS
01szzLq_rIU,What if Unite Neighboring Countries? Part 5,83Â 170 katselukertaa,4.07,/@dv4y
32Xt2tMxI4s,Asian Countries Create New Ones! Neighbors Unite,74Â 879 katselukertaa,3.45,/@SpinningTheGlobe
d03r8apM2ts,Neighboring U.S. States Merge Into One State,58Â 787 katselukertaa,3.21,/@SpinningTheGlobe
