Video Id,Title,View Count,Length,Channel
NgGLFozNM2o,The Mouse Utopia Experiments | Down the Rabbit Hole,9 009 555 katselukertaa,24.43,/@FredrikKnudsen
tBg4ximDrsk,"What's inside Eneloop and LIDL NiMh cells (fire, apparently)",1 146 704 katselukertaa,19.34,/@bigclivedotcom
1OV3T6GWhIg,The Secret of NIMH (7/9) Movie CLIP - The Secret is Revealed (1982) HD,831 409 katselukertaa,4.50,/@MOVIECLIPS
FwNfsLwQBhM,The Secret of NIMH -Trailer,678 169 katselukertaa,2.26,/@Skully1200
LqgP16JQ24I,Battery Type Comparison || Lead Acid VS NiMH VS Li-Ion VS LiPo,635 351 katselukertaa,6.11,/@greatscottlab
cISmv0IGoQQ,"The Secret of NIMH (1982) Official Trailer - Dom DeLuise, Derek Jacobi Movie HD",594 353 katselukertaa,2.21,/@RottenTomatoesCLASSICTRAILERS
5B1sX7p5xXI,Are AA NiMH Batteries obsolete? Here is everything you need to know about them!,347 821 katselukertaa,11.33,/@greatscottlab
CCAiKsLLprU,[Extrait] The Secret Of Nimh - Owl scene,346 297 katselukertaa,4.09,/@NYTGW
IgDk1cf0lmw,NiMH to Li-ion Chainsaw Restoration | Black&Decker CCS818-JP (Older Model),342 637 katselukertaa,21.04,/@gear_show
iOFveSUmh9U,"John B. Calhoun Film 7.1 [edited], (NIMH, 1970-1972)",315 982 katselukertaa,38.29,/@NLMNIH
5yFwhWeqyq4,Charging NiMH cells - smart vs dumb chargers,283 374 katselukertaa,21.37,/@bigclivedotcom
UiwDgjrDlEQ,The Secret Of NIMH (1982) Justin fight with Jenner,235 097 katselukertaa,2.42,/@GustyPL
3Kqti3tDz-M,John B. Calhoun and the Rats of N.I.M.H.,226 263 katselukertaa,13.47,/@TheHistoryGuyChannel
5AIAomVTKHw,Tutorial: Tenergy TB6B Balance Charger for NiMH/LiPO/LiFe Battery Packs | All-Battery.com,222 010 katselukertaa,6.36,/@AllBattery
mu4BkrUHQv4,The Secret of NIMH Justin vs. Jenner 16mm film,218 901 katselukertaa,3.14,/@RagtimeFreak86
H6DpKNws_68,The Secret Of NIMH (1982)  Mrs  Brisby speaks with Mr. Ages,213 161 katselukertaa,3.41,/@GustyPL
L1RxhgFEPSM,recondition rechargable batteries...... nickel metal hydride (NiMH) batteries for free!,202 894 katselukertaa,4.35,/@BatteryGeekReviews
rtayt289u3k,"THE SECRET OF NIMH Clip - ""Justin Duels Jenner"" (1982)",189 534 katselukertaa,4.28,/@JoBloAnimated
7k8o8yNb6aM,Secret of N.I.M.H. OST 1: Main Title (vinyl),181 656 katselukertaa,3.16,/@VinylisNotOrdinary
W4xHs01SUA4,The Secret of Nimh (1982) | Official Trailer | MGM Studios,175 754 katselukertaa,2.35,/@MGMStudios
