Video Id,Title,View Count,Length,Channel
i7mEB2wnDLQ,Suede - Animal Nitrate (Remastered Official HD Video),7 248 260 katselukertaa,3.28,/channel/UCdNf1p4SVbcFWKJULVNvl3A
xOjtlIxYYbs,How to Make Potassium Nitrate at Home,1 602 446 katselukertaa,3.27,/@NurdRage
27qh44Ljmsg,AMMONIUM NITRATE,1 370 536 katselukertaa,4.12,/@har123455
hUX_cpFWNso,Make Glass Mirrors with Silver Nitrate,1 285 319 katselukertaa,2.26,/@NurdRage
oj1Nr3MThzU,Brown ring  test for nitrate ion in laboratory by Seema Makhijani.,1 208 769 katselukertaa,5.58,/@seemamakhijani721
8Ygs2j0v0sU,Enjoy Your BACON! The Nitrate/Nitrite Cancer Scare Destroyed!,632 611 katselukertaa,13.55,/@KenDBerryMD
lLwwamfHkJs,Testing Ammonium Nitrate Based Explosives,586 708 katselukertaa,9.46,/@OrdnanceLab
6w2cwJmVNbU,How to Make Potassium Nitrate from Scratch:  Part One (Making Nitrified Earth),568 604 katselukertaa,12.12,/@Green.Country.Agroforestry
RcDoh0NcXLU,HOW TO: CHEAP and EASY aquarium NITRATE removal - Aquaponics TUTORIAL,524 729 katselukertaa,3.01,/@thekingofdiy
VHfuFY-K_IQ,"Making Black Powder (Gunpowder) at Home from Charcoal, Sulfur and Potassium Nitrate!",515 991 katselukertaa,8.18,/@TheSciencePirate
DITY2rXYU-I,reaction of LEAD NITRATE & POTASSIUM IODIDE solutions,512 849 katselukertaa,1.48,/@Basco36
eR0rCPxDURE,Nitrate X Nate Harrell - Hero,500 254 katselukertaa,4.34,/@xKitoMusic
d6hPgGV_qAg,Make Silver Nitrate From Silver and Nitric Acid,315 097 katselukertaa,2.35,/@NurdRage
cJffz_CRISI,Vegetables Rate by Nitrate,313 351 katselukertaa,2.06,/@NutritionFactsOrg
VlBk_98uk_Y,Hidden camera shows ammonium nitrate easy to buy,289 708 katselukertaa,2.35,/@WCNCVideo
rTdjjZRBIDU,The Silent Killer - Nitrates in Your Fish Tank | What to Do About Them!,284 066 katselukertaa,11.27,/@PrimeTimeAquatics
fXo39WiDNhg,Chemical Tests for Nitrate - MeitY OLabs,272 213 katselukertaa,6.01,/@amritacreate
LjjLBgkKeQY,Calcium Nitrate fertilizer | how to use calcium nitrate | calcium nitrate with boron fertilizer,235 347 katselukertaa,9.16,/@IndianOrganicJourney
TZEk6dfU6Kw,Calcium Nitrate Fertilizer | mixing combination | कैल्शियम नाइट्रेट खाद | advance agriculture,233 385 katselukertaa,5.12,/@TheAdvanceAgriculture
ooFw-teZ3L8,Removing Silver Nitrate Stains,218 285 katselukertaa,4.32,/@theCodyReeder
