Video Id,Title,View Count,Length,Channel
igyZORnkNAk,"""Lust Och F칛gring Stor"" - La Belleza de las Cosas",102187108 katselukertaa,3.23,/@mikewaters2
20f8kHH4oHA,Lollo & Bernies dansskola,45045000 katselukertaa,3.09,/@VingSverige
9-7i4-w_k7o,Bill och Bulls lekland (som Busfabriken),42964077 katselukertaa,8.16,/@FamilyPlaylab
aTJncWndUB8,Basshunter - Vi sitter i ventrilo och spelar DotA,24890733 katselukertaa,3.56,/@ExtensiveMusicUnderground
t4i3dxfU98Y,Huvud axlar kn칛 och t친 och andra s친nger f칬r barn | R칬rlses친ng fr친n Busigt L칛rande游뗼 30 minuter,10061509 katselukertaa,29.22,/@jleikvik
QausjheMU3M,Grizzy och L칛mlarna | H칬gsp칛nning Bear Attack | Boomerang Sverige,6693509 katselukertaa,3.28,/@CartoonitoSverige
LI5P5qTpX0E,Hooja - Banan Melon Kiwi & Citron (Musikvideo),4674023 katselukertaa,2.49,/channel/UCUVMBRhTQ5nN63Kd-5dtYXg
aJAKiJCNKtY,Gourmetst친l produktdemo och information,4266885 katselukertaa,9.48,/@Gourmetstal
Lvrh2EigKtg,H친ll dig vaken f칬r under hundringen,2489711 katselukertaa,12.29,/@SPLAYsverige
qPMJ3SZ7paM,Leos Lekland S친ng och Musik - Leo delar ut kramar i Bor친s - Hela l친ten flera g친nger,2427492 katselukertaa,11.50,/@KiwisPlaygrounds
cBcMRSd7zvc,Frukost med ren Havrepower - Nyttigt och klimatsmart,1681923 katselukertaa,0.20,/@havrepower5308
gaC-FxDkl-k,OCH MAN EY ROHAT,1361523 katselukertaa,8.20,/@HungrigerHugo
IECU7l22C9s,OCH QOLGAN KELINLAR  ZIQNA QAYNONA,1093901 katselukertaa,44.40,/@Bunihayotdeydilar
jXB4xCrqhqA,Chips vs Mat CHALLENGE Snacks vs Real Food - knasiga smaker!,1063117 katselukertaa,18.43,/@THESWEDISHFAMILY
qUKJUW7U-e8,Qaldirg'och Qaldrig'och TIK TOK trend(햑혦 햡쮐햦혣혧+햃혣 햟혣) - Suxrobdoston,843499 katselukertaa,0.53,/@suxrobdostonofficial
90DR7iHpBW0,Qaldirg'ochning qanotiga bog'lab qo'ydim Ruxsora Uying kuygur @COVERUZOFFICIAL#coveruz #uyingkuygur,708826 katselukertaa,3.05,/@COVERUZOFFICIAL
ZoOhdd2QLSk,DEN ROLIGASTE VIDEON DU N칀GONSIN KOMMER SE! 칐zz Nujen om det svenska spr친ket och uttryck!,589469 katselukertaa,8.52,/@charliecockinwohlk7005
Qs6CFjhGe1Q,Alma ska resa till Japan & Harry testar v칛rldens b칛sta vattenpistol VLOGG,526461 katselukertaa,17.06,/@THESWEDISHFAMILY
e1BhpKzwdAs,Bofluencers: Emma Gerdin och hobbyrummet,428905 katselukertaa,0.30,/@fastighetsagarnaservice7366
X8lXWNgTN4A,Du & Jag,424023 katselukertaa,2.13,/channel/UCzhu_nsbi6hm8DIsOsHkgvQ
