Video Id,Title,View Count,Length,Channel
NkdyxDbQRhc,Now I'm up to My Neck with Offers,5 006 174 katselukertaa,2.48,/channel/UCU5AbNuMPGB491GcqXuzwKw
NA61omfYgvI,Applying $100M Offers to E-Commerce: I'm Pissed,124 605 katselukertaa,11.30,/@AlexHormozi
pxVeOkOVr2w,The Offer Is King (ALEX HORMOZI),130 703 katselukertaa,13.44,/@AlexHormozi
4Xbq_-i7Mlk,7 Traits Of Irresistible Offers: How To Create Offers That People Want To Buy,72 738 katselukertaa,8.45,/@DanLok
Py1Eddosfpg,Best SMMA Offers To Use in 2023 (This Got Me 700+ Clients),56 979 katselukertaa,21.35,/@charliemofficial
oIfOg2Moszg,"DMart latest offers, cheapest kitchen-ware & household starting ₹19, cookware & storage organisers",10 263 katselukertaa,11.44,/@happyindianmommy
VEm-KlvAWmQ,How To Create Offers People Can’t Say No To,37 385 katselukertaa,39.21,/@MyronGolden
vHUjGKOxn_U,Offer Nissim First Time,15 476 024 katselukertaa,7.11,/channel/UCuGYcNwcMfu_x8DcWSWcUiA
lsYPOX2NIhY,Offers and Requests conversation (asking for favors - offering things) English Conversation Practice,39 324 katselukertaa,11.55,/@english.tangerineacademy
XK5nHM26D00,Film Offers,112 956 katselukertaa,1.37.33,/@mya4mya
T7e91gwd0-E,Accepting your trade offers!!,408 911 katselukertaa,23.40,/@Sparkles
RRCq__ILabw,Accepting my trade offers & sending back the skins...,359 829 katselukertaa,24.37,/@Sparkles
UjzxhZbGGOA,I Got SCAMMED on Offer Up,2 166 440 katselukertaa,15.48,/@TheSarahGrace
VbMEAlb4YxM,Jerry Norton’s 5 Offers A Day Challenge! [LIVE],30 153 katselukertaa,24.28,/@FlippingMastery
iowLzO9-aew,The Offer | Official Trailer | Paramount+,5 170 953 katselukertaa,2.05,/@paramountplus
WZLHhCLgmF0,5 domino’s item at just ₹272/- || Dominos offer || #dominos #pizza #ad,457 746 katselukertaa,0.38,/@foodieankit
xPER41XXNwI,Job seekers speak out about pulled employment offers,92 688 katselukertaa,2.08,/@NBCNews
bhv-7D2H9FM,Opening my trade offers & sending back the skins...,636 680 katselukertaa,30.25,/@Sparkles
GDQ4f7kADWc,"I opened my trade offers, but 10x what you sent me...",689 584 katselukertaa,8.51,/@Sparkles
bEoICQBCgUo,would you take the offer #4,2 134 136 katselukertaa,0.48,/@adibc
