Video Id,Title,View Count,Length,Channel
I4Ra4z2Arqg,D-Block Europe - Overseas ft. @CentralCee (Official Music Video),64 436 007 katselukertaa,3.47,/channel/UCzyLniLK2YQ5xCJigB2WetA
F-14c_fp_YU,We Pretend to Send Ourselves Overseas To Hawaii! (skit) Kids Fun TV Family Vacation,64 355 949 katselukertaa,13.09,/@TheFunSquad
yE-Skzv4R68,We Pretend To Send Ourselves Overseas To Hawaii Again! (skit) Kids Fun TV Family Vacation,49 786 036 katselukertaa,17.01,/@TheFunSquad
KQQRUimkK-o,WE GOT MAILED OVERSEAS! | SKIT | We Are The Davises,41 166 247 katselukertaa,20.15,/@wearethedavises
RaKxMVBwxRc,D Block Europe (Young Adz x Dirtbike LB) - Darling [Music Video] | GRM Daily,35 988 813 katselukertaa,3.48,/@Grmdaily
0_1nZmz8c1Q,3 Times I BROKE the LAW while OVERSEAS in 2022! #shorts,17 410 297 katselukertaa,0.37,/@JordenTually
ahdhk1rZZrU,Gigantic Overseas Autoliner | Mega Transports | Free Documentary,13 114 638 katselukertaa,48.14,/@FreeDocumentary
kFlfgHvgetY,D-Block Europe - Make You Smile ft. @ajtracey  (Official Music Video),12 845 368 katselukertaa,3.05,/channel/UCzyLniLK2YQ5xCJigB2WetA
NPLxAqKu9XA,Soldier reunites with puppy he met overseas | Militarykind,12 157 353 katselukertaa,3.13,/@USATODAY
K10emL3Fo_Q,Donating a cup of coffee to a soldier overseas,10 037 831 katselukertaa,0.13,/@superlegendary
d9psufY9-kY,3 times I BROKE THE LAW overseas! #shorts,9 535 174 katselukertaa,0.35,/@JordenTually
vLmhU8bxjIE,MrBeast Gets Humbled Overseas!,9 287 776 katselukertaa,0.28,/@Dexerto
gCjb2QkBkok,Sail Over Seven Seas,9 296 031 katselukertaa,4.35,/channel/UCSJVMPa_vAM11uoBOOGml4g
qcWRht6bJhM,0563706873# Award received from overseas Pakistan Abdul Ghafoor Abdul shakoor zamzam electronicshop,9 243 912 katselukertaa,0.48,/@zamzamelectronicstradingllc
UKx2N35owgs,WE GOT MAILED OVERSEAS AGAIN! | IT WORKED! | We Are The Davises,9 167 239 katselukertaa,14.37,/@wearethedavises
bVr8e8Ofnfs,Sail Over Seven Seas lyrics @ciloscrisofficial1893,8 374 048 katselukertaa,4.29,/@ciloscrisofficial1893
WEgz_cQyO_M,Overseas,8 085 164 katselukertaa,3.43,/channel/UCzyLniLK2YQ5xCJigB2WetA
Y-euE_0cksc,TWICE at overseas concerts be like… 🙈 #twice #twicetour #kpopconcert #readytobe #mina #kpop,4 044 843 katselukertaa,0.15,/@dancingintheshed
Q_iJMFVqSOM,Fatal cosmetic surgery: the deadly downside of cheap overseas procedures  | 7NEWS Spotlight,3 933 639 katselukertaa,27.41,/@7NEWSSpotlight
SKDFUqIRNhU,Pretend To Ship The MailMan OverSeas To Hawaii!,3 923 199 katselukertaa,14.32,/@Tannerites
