Video Id,Title,View Count,Length,Channel
hjHnWz3EyHs,Spectacular Salsa - Paddy & Nicko - Electric Ballroom | Britain's Got Talent 2014,91Â 184Â 227 katselukertaa,6.58,/@BGT
J_GpqDCs8ys,Barrels of Whiskey - The O'Reillys and the Paddyhats [Official Video],49Â 880Â 238 katselukertaa,5.26,/channel/UCvhd2ziiPu15iJ9Gr922xFQ
xvoSCeGKVQE,MIni Paddy Field Rice Weeder/farm cultivator/rotary power tiller agricul tural,41Â 316Â 019 katselukertaa,1.34,/@Toenter
LEC6N0MXsL0,Paddy Pimblett Receives EPIC Gift from Drake #shorts,18Â 008Â 889 katselukertaa,0.57,/@DailySportsDosage
y07bBjv42CU,Paddy's Hilarious Reaction to Trying a Peanut Butter and Jelly Sandwich for the First Time,16Â 134Â 989 katselukertaa,0.39,/@PaddyTheBaddyUFC
AH8NpBJIG-Q,Paddy Pimblett hates American breakfast,14Â 170Â 812 katselukertaa,0.55,/@theresidencypod
uzOE3c12w0U,(Paddy Sun) Sunflower - Original Music,14Â 070Â 942 katselukertaa,3.33,/@paddysun
mO4JedoD0pA,I Got Fat Shamed!!! #shorts,13Â 351Â 305 katselukertaa,0.58,/@paddythebaddyclips6617
FNunH3hdpQk,PADDY ON THE PUBLIC THINKING HE'S RICH #shorts,12Â 754Â 829 katselukertaa,0.42,/@paddythebaddyclips6617
VHpBsc4dXDE,"Why Paddy the Baddy is Losing UFC Fans | Paddy Pimblett, Jared Gordon, & Helwani #shorts #mma #UFC",11Â 600Â 478 katselukertaa,1.00,/@lionelrivera_MMA
VDLmgJPydsQ,"Meet Paddy ""The Baddy"" Pimblett",11Â 019Â 561 katselukertaa,5.58,/@ufc
gKOd89P8dss,Logan Paul Calls out Paddy Pimblett!,10Â 724Â 302 katselukertaa,0.23,/@Dexerto
giFgvNqE7sk,UFC vs USMC - Paddy the Baddy Takes On The Marines!,10Â 602Â 574 katselukertaa,11.56,/@PaddyTheBaddyUFC
_NlrsmEvv1Q,The Fields of Athenry - The Dubliners & Paddy Reilly | 40 Years Reunion: Live from The Gaiety (2003),10Â 571Â 484 katselukertaa,4.47,/channel/UCZXk0hDQWjtcKWcXYvqLuyA
3_L4_19HVWg,Paddy Pimblett First Round Finish Luigi Vendramini #shorts,10Â 359Â 751 katselukertaa,0.59,/@boon_official3551
qHIKRwYe3Cs,"How Rice is Made : Step by Step Growing Rice Paddy Farming, South India",10Â 248Â 761 katselukertaa,14.56,/@TheRubieVerse
yiG6H0c6d78,"Dean Ambrose invades Raw in a paddy wagon: Raw, May 25, 2015",9Â 811Â 457 katselukertaa,4.59,/@WWE
X82ClCsaAKs,UFC APEX Banger: Paddy Pimblett vs Luigi Vendramini | FREE FIGHT,9Â 412Â 475 katselukertaa,6.47,/@ufc
l_F-0VO-ylU,à°µà°°à°¿à°²à±‹ à°…à°§à°¿à°• à°ªà°¿à°²à±à°•à°²à°•à± à°ªà±ˆà°¸à°¾ à°–à°°à±à°šà± à°²à±‡à°¨à°¿ à°‰à°ªà°¾à°¯à°‚ || #shorts #ytshorts #agriculture #paddy,8Â 588Â 543 katselukertaa,0.29,/@IndianAgricultureService
9pTXccixycA,Paddy Pimblett keeps his COD teabag promise during his fight ğŸ¤£ğŸ˜­ #shorts,8Â 283Â 842 katselukertaa,0.53,/@DailySportsDosage
