Video Id,Title,View Count,Length,Channel
B6voGWLU7Yk,Pallet CABIN from START to FINISH in 10 minutes,2 160 067 katselukertaa,11.46,/@klerobi1
htri-BiCsDw,I Bought a GIANT Amazon Returns Pallet!,71 164 katselukertaa,23.17,/@ConnorTVofficial
v-GxoMS1U2k,Pallet,3 031 643 katselukertaa,4.59,/channel/UCzQ_tqPc4aqp9bnCBh6jVgg
oLWIBQt6Zsw,Crazy Things Found on the Curb,17 367 katselukertaa,30.36,/@ScrapPalletMan
xn6RZZscRPA,I Bought a Pallet Of Returned Clothing!! *558 ITEMS*,745 202 katselukertaa,14.56,/@MiaMaples
3EpqnctyHt4,"How to Build a Mini RAISED BED Using ONE PALLET, FREE Backyard Gardening!",1 499 722 katselukertaa,15.34,/@jamesprigioni
-8vESmS2FCU,The process of mass-producing wooden pallets from giant trees. Pallet factory in Korea,847 189 katselukertaa,19.07,/@kingprocess
K-dUIa9_iVw,"Turning 3 Free Pallets into a $1,360 Desk",1 463 913 katselukertaa,18.10,/@MorleyKert
jOXvrHeSLzs,How to take a pallet apart without breaking it,806 727 katselukertaa,5.38,/@JesperMakes
O5l8Fgq6Zow,Transforming Old Pallets into a Unique Outdoor Seating Set // Using Only Recycled Pallets,68 371 katselukertaa,13.20,/@woodworkingguide6356
iV4lxbpEaAY,Luova tapa kerätä lavat kukkaistutuslaatikkoon DIY puutarha-ideoita,5 125 893 katselukertaa,10.02,/@DIYGardenIdeas
XSuuateHSAA,A Second Life for Pallets: Turning Discarded Wood into a Gorgeous Coffee Table,2 384 615 katselukertaa,34.01,/@woodworkingguide6356
OxWcvBA8Zas,4 DIY ideas best creative and recycled pallet - Creative Uses For Old Pallets,4 067 137 katselukertaa,32.25,/@creativepalletideas6057
S8XmzcV5DfU,I TESTED 'Turning A FREE Pallet Into A $600 Table',1 588 901 katselukertaa,12.29,/@John_Malecki
caFyrCUN0kQ,"I Bought A Pallet of Walmart Tool Returns for $2,217...... Mistake?",951 526 katselukertaa,12.23,/@John_Malecki
F7JBA5LMH3g,Turning a Free Pallet into a $550 Table,4 462 141 katselukertaa,20.46,/@MorleyKert
sZGJk5slkeo,Building a house from pallets. From start to finish,12 286 579 katselukertaa,26.04,/@lesnoy
zOH0gmu4lmo,"One Pallet, Endless Possibilities: Innovative Ideas for Repurposing Pallets",134 833 katselukertaa,11.18,/@woodworkingguide6356
Ct8BXW3pg_c,BIG Pallet Wood Slabs -This one is a how to!,91 433 katselukertaa,14.34,/@dainermade
