Video Id,Title,View Count,Length,Channel
VAkEunek8y0,"Download, choose EMI Tenures, check the payable amount and go! | MoneyTap Credit Line",1 830 429 katselukertaa,0.30,/@Moneytap
H5HDFC7PJ24,Oracle Training - Accounts Payable in Oracle E-Business Suite R12 (1080p - HD),551 893 katselukertaa,12.00,/@yemionigbode
UZffr0HJwNc,"Office Space deleted scene: Corporate accounts payable, Nina speaking,  just a moment...",330 819 katselukertaa,0.31,/@jamesiscoolbeans
VU3FJDQWm8M,Simplify your entire accounts payable workflow | Automate everything from POs to Invoices,215 030 katselukertaa,0.37,/@Quadient-AP-automation
KS-NMSKh3mc,Accounts Payable Tutorial - Sage 50 Accounting,212 512 katselukertaa,8.25,/@peachtreebysage
jcPxULwVVlQ,Accounts Payable Interview Questions and Answers,186 584 katselukertaa,13.29,/@interviewinsights
oPfAkYroFbs,Accounts-Payable Journal Entries- Tips & Tricks,181 650 katselukertaa,11.52,/@FnASkills
NPxiNBU8Vsk,Accounts Payable: A Day in The Life,165 842 katselukertaa,9.53,/@TheFinancialController
YJydAlwsNb4,Accounting Tutorial Accounts Payable Training Lesson 10.1,164 582 katselukertaa,3.45,/@Teachucomp
xQ0u_QocSO4,Accounting for Beginners #10 / Accounts Payable / Basics,158 379 katselukertaa,2.41,/@CPAStrengthPassion
VdP_l5YRctM,Accounts Receivable and Accounts Payable - By Saheb Academy,126 040 katselukertaa,13.31,/@SahebAcademy
GImcxTLANX0,Accounts Payable | What Is Accounts Payable,120 830 katselukertaa,11.48,/@ONSSTUDYCIRCLE
9ROyxS8yl2Y,Accounts Payable Interview Questions And Answers | New Part 1,110 327 katselukertaa,9.05,/@ONSSTUDYCIRCLE
zmkvab7qglk,Accounts Payable Interview Questions And Answers | Part 1,110 019 katselukertaa,8.03,/@ONSSTUDYCIRCLE
3FUtwuzvsK4,"Suits 6x02 Promo ""Accounts Payable"" (HD)",109 045 katselukertaa,0.21,/@tvpromos
pMT0Im3vdiY,AP Invoice Processing | Accounts Payable Invoice Processing,106 364 katselukertaa,17.13,/@ONSSTUDYCIRCLE
sHQe3vFr4KY,Accounts Payable in ComputerEase,94 611 katselukertaa,1.28,/@ComputerEaseSoftware
g5UsfXrCwmM,Accounts Payable Process,94 625 katselukertaa,6.12,/@TheBandmom54
ICjBntazEHQ,What is Bills Payable and Bills Receivable ?,90 078 katselukertaa,2.01,/@sevengeducation3855
oG9QuYyUWTY,Accounts Payable Tutorial - Sage Peachtree: Basics for New Users,89 647 katselukertaa,9.52,/@peachtreebysage4987
