Video Id,Title,View Count,Length,Channel
9e4b2EgcSo4,Nastya and papa go to a picnic to eat lunch,156 496 100 katselukertaa,5.12,/@LikeNastyaofficial
5ZTaHF2ufuU,Best Toy Learning Video for Kids - Paw Patrol Snuggle Pup Picnic!,143 884 380 katselukertaa,11.00,/@GenevievesPlayhouse
uy3BYH7BOAU,O Sasurir Beti Dj Bajabo || ও শাশুড়ির বেটি ডিজে বাজাবো || New Special Picnic Song 2022...,114 871 739 katselukertaa,3.16,/@palligramtv11
uyCWEbaUNaY,बच्चों के लिए बेस्ट टॉय लर्निंग वीडियो - Paw Patrol Snuggle Pup Picnic!,93 625 035 katselukertaa,11.00,/@-genevievesplayhouse1465
7khG1Akz41M,Pari's Picnic in Jungle | Tent House In Jungle | परी की जंगल कैंपिंग,78 166 991 katselukertaa,4.25,/@parislifestyle7488
LboXe0Fful4,School Picnic,66 314 417 katselukertaa,1.00,/@PaayalTenaShortVideos
6OoM2Rbs0Us,Natia Comedy Part 145 || PICNIC,49 690 255 katselukertaa,33.51,/@utkalcartoonworld
nx9SwgZa9PQ,Fruits Picnic - Tina & Bana Stories | Telugu Stories for Children | Infobells,39 380 938 katselukertaa,13.20,/@infobellstelugurhymes
cFCnrSDw9LM,Video de aprendizaje para niños - ¡Picnic de la Paw Patrol!,39 090 002 katselukertaa,11.00,/@GenevievesPlayhouse
hrIazIcdTBk,winter season picnic|| COUNTRY CHICKEN CURRY cooking & eating by santali tribe childrens,38 223 024 katselukertaa,13.21,/@therealvillagecooking
J0I8WXc_dAc,NIGHT PICNIC with Family | Family comedy | Aayu and Pihu Show,37 099 427 katselukertaa,15.41,/@AayuandPihuShow
KIMgLmBXB8I,PICNIC ! Elsa and Anna toddlers - hide and seek - Barbie - food truck - tree house,36 797 786 katselukertaa,14.56,/@ComePlayWithMe
3pMSSqKlGF4,Пикник - Королевство кривых,28 459 422 katselukertaa,4.47,/channel/UCrih5xnwVpN5eNMieBmwd7A
abpb387qMko,Camper ! Elsa & Anna toddlers - Barbie - picnic - RV - nature,26 800 908 katselukertaa,13.12,/@ComePlayWithMe
xYLf36UZWaE,School Picnic || Rachit Rojha,25 665 220 katselukertaa,23.39,/@RachitRojha
1_9DeMdjgGg,15 AWESOME PICNIC IDEAS || 5-Minute Camping Hacks You Must Try!,23 778 234 katselukertaa,13.08,/@5MinuteRecipesOfficial
fXdq0qSgpxU,Meher Retreat One Day Picnic near Pune,19 281 369 katselukertaa,1.00,/@MeherRetreatVideos
70tPEwSBmzQ,Nostalgic Cooking of Village Boys - Two Big Black Carp Fish Fry - Picnic Food - Choruivati,18 761 359 katselukertaa,8.51,/@AroundMeBD
U7xUWaMDF4Q,Building a Survival Shelter in a Forest - Camp food from natural herbs,18 709 010 katselukertaa,26.40,/@MrWildNature
O3O98Pc3jvU,Peppa Pig Family & Friends Picnic Dough Set with Friends Carry Case,18 567 598 katselukertaa,11.23,/@natandessie
