Video Id,Title,View Count,Length,Channel
0VG194YzotY,Pioneering Village Camp Gadgets,28 790 katselukertaa,1.29,/@TroopLeader
P0Yz_9Kr7VE,Anchors for Pioneering Projects,12 885 katselukertaa,3.14,/@TroopLeader
qjrRxUNndlA,Cara Membuat Tiang Bendera Pioneering Kaki Tiga || tutorial lengkap mudah,315 170 katselukertaa,10.32,/@sarjanapramuka
BeczPRn9C4s,What Is Pioneering?,2 462 katselukertaa,1.11,/@pioneersusa
CktdJK1QZ0E,TUTORIAL Miniature Tower Pioneering Project | Scouting PH,24 748 katselukertaa,13.40,/@RustyJaravata
Thd1RwqH1ME,Pioneer Homes of Appalachia and it's people,99 732 katselukertaa,14.25,/@donnielaws7020
nzSP8gIGmNM,29th Scouts Pioneering,865 katselukertaa,2.50,/@29thimmaculatascoutgroup-s48
cWkWU9rqEPU,Lashings For Pioneering,2 362 katselukertaa,15.25,/@LeatherheadDistrict
f_jBDw34uec,Pioneering Spirit removing the Brent Delta topsides HD,374 096 katselukertaa,7.48,/@RichardKrabbendam
SBMNto5FTrc,Scout Pioneering Trestle frame,33 319 katselukertaa,0.28,/@scoutingcollie
hsDXApWmHpQ,Tripod Lashing Square Lashing Pioneering Projects,6 290 katselukertaa,25.33,/@sperrinoutdoors7642
k1m8JIUf8mQ,"Revolutionising your Network:  Harnessing Automation, Ensuring Assurance & Pioneering Innovation",48 katselukertaa,45.08,/@cisilionmarketing
vMMpHRHM0Ac,Here's What It Was Really Like To Pioneer On The Oregon Trail,2 634 849 katselukertaa,14.05,/@GrungeHQ
vwGLExuUXf0,Camp Gaget Pioneering,30 103 katselukertaa,2.27,/@discoveroutdoors9992
SjbKZZfnd64,Program Feature: Pioneering,3 639 katselukertaa,2.01,/@TroopLeader
YTgqWbKXLWQ,Garden pioneering II: the table,68 490 katselukertaa,7.14,/@MarkGW
9ysgixlh7pA,What Early Pioneers Ate To Survive The Old West,2 540 957 katselukertaa,12.56,/@WeirdHistory
6jEXmOQ22fQ,Allseas Pioneering Spirit removing Brent Delta topsides 1080p,112 211 katselukertaa,2.37,/@RichardKrabbendam
v3H87D_fLTM,PIONEERING SPIRIT - I,44 301 katselukertaa,20.16,/@mkc1
a8BUrWc_FNE,Figure Of Eight Lashing | Tripod | Pioneering Dwitiya Sopan,7 129 katselukertaa,4.47,/@SSesafar
