Video Id,Title,View Count,Length,Channel
CTS57NCB_pE,Piston (Rock) Rockschool Premiere Grade Drums,6 229 katselukertaa,2.52,/@AtomMusicSchool
T8YWhAl6YV8,Rockschool 'Let's Rock' Drums - 'Piston' [WITH BACKING TRACK],30 302 katselukertaa,2.28,/@musicjam-musiclessonsmore7399
_Wk7ZUYkrpI,Bendy Minecraft pistons are weird,4 039 109 katselukertaa,9.50,/@ThatMumboJumbo
NMQrWQ2YVnc,I made pistons 1000x cooler,172 834 katselukertaa,8.44,/@ElementX
UbMhAx4_DGk,This Minecraft Three Player Prison is IMPOSSIBLE...,2 462 003 katselukertaa,15.44,/@seawattgaming
Xz8Ip_g7BKg,NEW PISTON +50% Efficiency ICE -  Made the Impossible Happen!,194 735 katselukertaa,4.01,/@LookAuto-Toptechnologies
Yc17oucI6jM,This ENGINE RUNS without a PISTON,855 750 katselukertaa,11.34,/@integza
GDc8xsPhEPA,I Built a Working LEGO Minecraft Piston...,7 519 086 katselukertaa,8.58,/@RJMBricks
XjlVgBYeh0c,Making a 4 Stroke Engine. Episode 1 - Piston and Connecting Rod,3 188 449 katselukertaa,6.06,/@MakerB
RV1xWCpBEr8,What Does This Thing Do: Pistons,330 688 katselukertaa,2.52,/@toyotaoforlando
lCEKJxHiEIM,"Why F1 Pistons Cost £50,000!",3 684 054 katselukertaa,9.19,/@Driver61
p6-cB1AGPO8,"Build & Test Lego Engines: 1-cyl, opp-piston, S2, V2, F2, U2, W3, S4, H4, X4, radial-6",5 169 106 katselukertaa,16.33,/@BrickExperimentChannel
-2XxJKinvis,How to Manufacturer Process Of Truck Engine Piston - Production of Engine Piston |,2 871 017 katselukertaa,18.27,/@amazingtechnology0007
i8vVG8-znFs,Piston motion acceleration,2 107 912 katselukertaa,3.44,/@ElectricExperimentsRobert33
jLtyNtf9_ew,See Thru Liquid Piston Rotary Engine - In Slow Motion,5 431 409 katselukertaa,13.31,/@WarpedPerception
4uPr_bKE27U,Que Pongo Refaccionaria O Taller De Motos??,2 230 katselukertaa,13.51,/@PistonBikers
rK0l68zwZOg,Why Are Forged Pistons So Strong?,989 418 katselukertaa,21.21,/@Donut
1CfVV9s5s6s,What happens if a piston pushes itself?,2 091 556 katselukertaa,4.07,/@ElementX
Wadmzv1Vs0Q,Piston Rings & Blowby - Explained,912 804 katselukertaa,3.51,/@EngineeringExplained
RLWSljLIBaw,We make copper/brass/bronze pistons – what will happen?,244 073 katselukertaa,25.04,/@Garage54ENG
