Video Id,Title,View Count,Length,Channel
iVcPGxnp558,A Stick Pivot Tournament,74 475 487 katselukertaa,10.10,/@CheezCurds
OMiYZIDYcuE,"pivot tire fixing, tire fixing, changing tire",15 495 522 katselukertaa,0.31,/@femalefarmerrancher3234
iT5nj5EovAI,Pivot SWAT part 1 (1000 subs thanks),15 312 726 katselukertaa,8.18,/@PivotTeamButItsNotTeamAnymore
9NUjHBNWe9M,"Introduction to Pivot Tables, Charts, and Dashboards in Excel (Part 1)",13 689 846 katselukertaa,14.48,/@ExcelCampus
uugIUoiBS4Q,Pivot animation stickman tournament ศึกสติกแมน EP1,9 360 623 katselukertaa,3.51,/@nnchannel2332
_I7wybFlT5Q,Pivot Alien Invasion Fight War Animation series 1 (full version),7 300 276 katselukertaa,1.04.56,/@TheREALAlexsplat
IHSVlP9Ey0U,Pivot Alien vs Predator Season 2 Part 1,7 141 932 katselukertaa,7.26,/@PivotTeamButItsNotTeamAnymore
6bUqUeKdiXk,UEF: Dinosaur Battle Royale (Collaboration with MatromX) | Pivot Animation Series,7 045 797 katselukertaa,4.44,/@AlpK
m3vozVLCYwo,Shaq Opens Up About His Divorce & His Only Regrets: Penny Hardaway & Kobe Bryant | The Pivot Podcast,6 217 680 katselukertaa,1.25.12,/@thepivotpodcast
4PWVFBiFVVU,MS Excel - Pivot Table Example 1 Video Tutorials,5 552 977 katselukertaa,15.05,/@TutorialsPoint_
zGGnMPQLVnw,The Ultimate Pivot Tournament 3 (NVL),5 497 304 katselukertaa,13.47,/@NicAnimation
qu-AK0Hv0b4,Learn Pivot Tables in 6 Minutes (Microsoft Excel),5 384 635 katselukertaa,6.22,/@codymbaldwin
7j1lMs7fcIQ,Everything About Irrigation Pivots (Farmers are Geniuses) - Smarter Every Day 278,4 677 569 katselukertaa,19.58,/@smartereveryday
e8as3nmM2fA,Godzilla Earth vs Legendary vs Shin vs Ultima  |  FULL BATTLE,4 586 509 katselukertaa,24.45,/@PivotMaster
Tam7KO4qhUI,Friends Funny Scene - PIVOT!!!!!,4 406 482 katselukertaa,3.13,/@TK4Movies
2btS31AU3Iw,How to build Dynamic & Interactive Dashboard in EXCEL with Pivot Tables&Charts | Tutorial Episode #1,4 283 793 katselukertaa,30.37,/@OtherLevels
8OurAiVyhE4,Secrets of Intraday Strategy No One will tell you - VWAP PIVOTS STOCHASTIC RSI - Anish Singh Thakur,4 017 101 katselukertaa,33.16,/@BoomingBulls
LwDVRErvs1k,x2 mtb shock serviced enduro pivot firebird bike #mtb suspension service mtb maintenance fox,3 738 611 katselukertaa,1.00,/@maxmtb12
_alcE8PfzbI,"Kevin Hart on Sacrifice, Success & Never Allowing Mistakes to Overshadow Purpose | The Pivot Podcast",3 422 106 katselukertaa,1.07.42,/@thepivotpodcast
7k4UI8M8M8Q,Red Death & Bewilderbeast vs Godzilla  |  EPIC BATTLE,3 210 641 katselukertaa,8.35,/@PivotMaster
