Video Id,Title,View Count,Length,Channel
i93Z7zljQ7I,Universe Size Comparison 3D,149Â 620Â 072 katselukertaa,5.08,/@HarryEvett
_yiJe5atQDc,SQUARE Planets Sizes for BABY | Planet comparison Game | Solar System Comparison | 8 Planets sizes,9Â 072Â 572 katselukertaa,1.33,/@ATOYDAY
Isic2Z2e2xs,"Gustav Holst- The Planets, Full Suite",9Â 751Â 089 katselukertaa,49.15,/@salemronkartz6866
iC95VzD7ALs,Wow! JWST Finds Possible Alien Biosignatures On K2-18b Water Planet,146Â 657 katselukertaa,13.37,/@whatdamath
xAMk87R-0Es,PLANET (C) | Ø§Ø² Ú¯ÙˆØ² ØªØ§ Ø´Ù‚ÛŒÙ‚Ù‡,34Â 078 katselukertaa,42.59,/@Kambizakhbari
x6_Q9-cgH8o,"Planet X Approaches, Kilauea Volcano Awakens, Libyan City Washed Away Thousands Missing",13Â 891 katselukertaa,1.07.00,/@PLANETXNEWS
bZEEVwa5H78,NASA Has Just Found the Most Horrible Planet in the Known Universe,2Â 717Â 170 katselukertaa,23.52,/@VineMontanaTV
wkQuOrsgVGY,Eight Wonders Of Our Solar System | The Planets | BBC Earth Lab,2Â 965Â 097 katselukertaa,1.05.30,/@BBCEarthLab
3Rh57WwV8H0,The Planet,8Â 769Â 752 katselukertaa,2.59,/channel/UCLkAepWjdylmXSltofFvsYQ
p0Bq55rfjZw,The Biggest Planet In The Universe #space #planet #universe,26Â 079Â 738 katselukertaa,0.37,/@AstroKobi
mQrlgH97v94,The Planet Song - 8 Planets of the Solar System Song for Kids | KidsLearningTube,163Â 339Â 337 katselukertaa,3.09,/@klt
2rVJvUawEms,HUNGRY PLANETS COMPILATION | Planet SIZES for BABY | Funny Planet comparison for kids | Planet size,42Â 469Â 554 katselukertaa,13.02,/@ATOYDAY
XmtXC_n6X6Q,Our Planet | From Deserts to Grasslands | FULL EPISODE | Netflix,34Â 100Â 904 katselukertaa,50.55,/@Netflix
ERPC2iTEz-Q,Planet Zoo: Oceania Pack | Announcement Trailer,48Â 267 katselukertaa,0.50,/@Planetzoogame
cXOanvv4plU,"Holst: The Planets, 'Mars' - BBC Proms",1Â 945Â 266 katselukertaa,6.58,/@BBC
GWCzIAQVcjQ,How Long Humans Could Survive On Other Planets ğŸª #shorts #planets,1Â 941Â 011 katselukertaa,0.26,/@tcezy
R2DU85qLfJQ,Our Planet | Fresh Water | FULL EPISODE | Netflix,15Â 018Â 093 katselukertaa,48.44,/@Netflix
ws3kWuMi0Y8,"The Dwarf Planet Song (feat. Jessica Pace Lyells, Loki Alohikea, Jan van der Beek, and Sophia Oaks)",32Â 713Â 321 katselukertaa,3.41,/@Hopscotchsongs
cleR5ROyM2U,Relaxing video/ No talking! Jelly. Can you imagine? soft jelly planets/,1Â 114Â 305 katselukertaa,1.15,/@ivirtv8184
JkaxUblCGz0,Our Planet | Forests | FULL EPISODE | Netflix,29Â 099Â 128 katselukertaa,48.18,/@Netflix
