Video Id,Title,View Count,Length,Channel
K6WCcBP4lSs,"The Weeknd, Playboi Carti, Madonna - Popular (Official Audio)",15 068 654 katselukertaa,3.36,/channel/UC0WP5P-ufpRfjbNrmOWwLBQ
RHBdvgO1Wx8,Sparks - Popularity,131 873 katselukertaa,3.46,/@yalita76
_Y70X4_sAs8,The good and bad of Popularity,7 201 794 katselukertaa,18.08,/@MSA.official
3GICFRWqXxM,Popularity,95 207 katselukertaa,3.54,/channel/UCYEwVH_S8x0rUcrRlssSqdA
Wc6JJ_TaTqw,Sparks - Popularity,90 168 katselukertaa,3.56,/@retromusic71jhon
xnvkStb2jT0,"The Weeknd, Madonna, Playboi Carti - Popular (Visualizer)",22 742 956 katselukertaa,3.36,/channel/UC0WP5P-ufpRfjbNrmOWwLBQ
7-VEPjqchak,"The Weeknd, Playboi Carti & Madonna - Popular (Lyrics)",3 353 159 katselukertaa,3.36,/@solitude_songs
848A52358Nc,The 5 Levels Of Popularity In High School,389 145 katselukertaa,4.30,/@itscbdbro151
WICUpY6ucEc,NERD Extreme MAKEOVER 🤓 *How To Become POPULAR* Beauty Transformation With Gadgets,42 338 926 katselukertaa,10.01,/@cooltool_wow
RqxxhziIP44,HOW TO BECOME POPULAR AT SCHOOL! || Awkward School Situations by Amigos Forever,43 767 023 katselukertaa,25.34,/@AF-Series
kKDXmWFVN-g,What Makes Popular Kids Popular?,2 322 515 katselukertaa,6.58,/@TheInfographicsShow
_5mzCy8J_aQ,What Social Behaviors Make People Popular so Quickly? - Psychology of Popularity,2 390 katselukertaa,10.48,/@maihuucuong5647
VvwzKuqBQhA,Julian Moon - Popularity [Official Audio],25 526 katselukertaa,2.34,/channel/UC3Ou14O6MMRComqIS9xDZpw
ZDd5wUSRUdQ,The 5 Levels Of Popularity In High School,7 444 katselukertaa,5.42,/@bxrry7
u2O9J4x79Wg,Diary of A Wimpy Kid: Popularity Rank,1 435 222 katselukertaa,0.57,/@20thCenturyUK
qImXtymwzq0,SECRETS OF POPULARITY REVEALED🤩Proven Hacks to Stand Out in School! Creative Hacks by 123GO! SCHOOL,263 031 katselukertaa,30.31,/@123GOSCHOOL
uu0lOixmyHM,POPULARITY SECRETS To Be POPULAR at SCHOOL and MAKE FRIENDS EASILY 2023,210 069 katselukertaa,14.42,/@AngelGrey_
Wcf0QbWm3OM,Popular vs Unpopular girl SWAP THEIR PHONES I How Different Are They?,1 287 951 katselukertaa,13.42,/@giggle77
JqJckkaztgk,"How High School Popularity Affects Your Life: Pretty Privilege, Regina George and The Plastics",4 546 katselukertaa,12.48,/@yilyau
QTKv9JSy25Y,"Popular (From ""Wicked"" Original Broadway Cast Recording/2003)",6 073 740 katselukertaa,3.45,/channel/UCKF498ZN6GRvUD19tzTvYJQ
