Video Id,Title,View Count,Length,Channel
nmcdLOjGVzw,MIKA - Popular Song (Closed-Captioned) ft. Ariana Grande,212 133 695 katselukertaa,3.27,/channel/UCALjQbQhtEeUFi5tSIDFY4Q
jakpo7tj7Qw,"Falling In Reverse - ""Popular Monster""",130 596 849 katselukertaa,3.53,/@epitaph
MILz2FDmh1E,HIGH SCHOOL YOU vs CHILD YOU – How to Become Popular | Funny by La La Life Relatable Musical,120 708 568 katselukertaa,10.18,/@LaLaLife
xJrOUJpCxOE,Dating the Popular Guy | Lele Pons,80 215 690 katselukertaa,5.58,/@LelePons
FG77CZY8APQ,Rod Wave - Popular Loner (Official Music Video),64 649 167 katselukertaa,2.29,/channel/UCenjunBhBhvKjfDAESnoppw
nE5-5w2x1BM,Tora Song Most Popular🔥|#tappuparmar #trending #attitude #shorts #short,61 255 335 katselukertaa,0.13,/@tappuhoneyparmar4277
HDdjzGenDM4,Rich Unpopular Barbie vs Broke Popular Barbie - Wolfoo's Sister Become a Dolls | Wolfoo Family,50 260 281 katselukertaa,21.15,/@wolfoofamilyofficiall
RqxxhziIP44,HOW TO BECOME POPULAR AT SCHOOL! || Awkward School Situations by Amigos Forever,43 768 504 katselukertaa,25.34,/@AF-Series
WICUpY6ucEc,NERD Extreme MAKEOVER 🤓 *How To Become POPULAR* Beauty Transformation With Gadgets,42 345 514 katselukertaa,10.01,/@cooltool_wow
2Uj1A9AguFs,Most Popular Websites 1996 - 2019,38 693 605 katselukertaa,8.26,/@DataIsBeautifulOfficial
YagzdURBBZ8,From NERD to POPULAR - EXTREME Makeover with Gadgets from TikTok! Hacks by La La Life Games,34 292 799 katselukertaa,20.13,/@lalalifegames
OJhq5FpFyjM,HOW TO BECOME POPULAR || Nerd VS Popular Students Funny School Life and Hacks by 123 GO! SCHOOL,33 634 038 katselukertaa,10.32,/@123GOSCHOOL
rkccrfKeO20,#pov the popular girl who never pays attention is actually smart #shorts #acting #tiktok,30 616 874 katselukertaa,0.44,/@ValerieLepelch
Hybm--GAgmo,POPULAR VS NERD STUDENT FOR 24 HOURS! How To Become Popular At School! Comedy by 123 GO! CHALLENGE,27 345 644 katselukertaa,10.16,/@123gochallenge
GCXRQrBQU7M,"From NERD to POPULAR, total makeover using viral hacks and gadgets from TikTok!",26 653 670 katselukertaa,7.45,/@cooltool
cJ03M8FYhd4,Popular Girl SHAMES NERD On VALENTINE'S DAY | Dhar Mann,26 368 688 katselukertaa,24.33,/@DharMann
reLmjzdEfUU,"Love, Popularity or Money??  What would you choose??😳 ang.lova TikTok #shorts",23 582 725 katselukertaa,0.36,/@anglova.official
7DemM7UGmIg,Most Popular TV Series 1986 - 2019,23 093 366 katselukertaa,8.05,/@DataIsBeautifulOfficial
xnvkStb2jT0,"The Weeknd, Madonna, Playboi Carti - Popular (Visualizer)",22 769 380 katselukertaa,3.36,/channel/UC0WP5P-ufpRfjbNrmOWwLBQ
W4wWdmfOibY,Most Popular Web Browsers 1993 - 2020,20 988 687 katselukertaa,4.25,/@CaptainGizmo
