Video Id,Title,View Count,Length,Channel
hy4OeVCLGZ4,What is Linux? Unix? POSIX?,50 884 katselukertaa,13.12,/@NERDfirst
U0GbJtnfqSM,What is POSIX in Unix? Linux Terminal 201 - HakTip 161,49 321 katselukertaa,9.22,/@hak5
728Eu5RFoTs,POSIX Compliance Explained: Does It Even Matter In 2020,13 955 katselukertaa,12.41,/@BrodieRobertson
BOeku3hDzrM,"How NOT To Implement the POSIX Standard, Featuring Windows NT ...",60 449 katselukertaa,14.39,/@NCommander
n1KjTWuvSUQ,249 what is POSIX?,597 katselukertaa,0.57,/@howtolinux8963
5A3yUA807z4,What is The POSIX standard?,1 886 katselukertaa,1.23,/@RoelVandePaar
0pjtn6HGPVI,List All Files And Directories In A Directory (POSIX Library) | C Programming Example,10 300 katselukertaa,8.47,/@PortfolioCourses
H1eE1q9IoWc,Q: What’s the best way to learn POSIX shell?,2 459 katselukertaa,9.56,/@rwxrob
N_ttw2Dihn8,Fast & Minimal Blog Using POSIX Shell and Markdown,55 567 katselukertaa,7.43,/@WolfgangsChannel
lzbG2XpE0zU,What are POSIX threads,4 382 katselukertaa,1.07,/@rambhaktsharma
uA8X5zNOGw8,How to create and join threads in C (pthreads).,215 624 katselukertaa,6.00,/@JacobSorber
spKZsLxDVS4,Windows vs Linux - POSIX compliant,1 247 katselukertaa,6.11,/@KentsTechWorld
oKA2aK0-tb4,"""Overcoming the limitations of the POSIX shell command language"" - Curtis Millar (LCA 2021 Online)",1 032 katselukertaa,41.37,/@linuxconfau
xLUaHhmZWIE,Making use of POSIX Capabilities in Linux to Reduce the Need to root Permissions,4 065 katselukertaa,6.25,/@theurbanpenguin
VXKKNxTYYWc,POSIX Signals with C Programming,1 620 katselukertaa,4.25,/@linuxhint
RdAS3maYZrc,POSIX Shell Has This Awesome Thing Called An Until Loop,3 088 katselukertaa,9.52,/@BrodieRobertson
UZ4zpfNn2dI,STREAM: Exploring and Using the POSIX Subsystem for Windows,10 943 katselukertaa,5.58.05,/@NCommander
bG7d3_N8GAE,What is POSIX?,671 katselukertaa,0.38,/@bradsen
maQH9Qs0u2U,Why POSIX shell scripts? [20210310161500],1 695 katselukertaa,23.18,/@rwxrob
