Video Id,Title,View Count,Length,Channel
snArvJ15SbY,"Recycling Clay, From Smashed Pot to Usable Stoneware (#Shorts)",66Â 502Â 797 katselukertaa,0.39,/@floriangadsby
civuoU_NE38,TOOL - The Pot (Audio),40Â 954Â 485 katselukertaa,6.24,/channel/UC1wUo-29zS7m_Jp-U_xYcFQ
mL3sho1CpkI,Primitive Technology: Chimney and pots,34Â 783Â 253 katselukertaa,6.39,/@primitivetechnology9550
NdxuTQUztJY,Recycle Plastic Bottles Into Hanging Lantern Flower Pots for Old Walls - Vertical Garden Ideas,29Â 783Â 429 katselukertaa,9.44,/@no1garden355
JmJbwUXGtj8,Make Unique Decorative Plant Pots From Fabric And Cement - Cement Craft Ideas At Home,19Â 049Â 229 katselukertaa,15.26,/@diycementprojects284
N9FIfj2hrtI,How To Make Cement Pots Easily From Plastic Bottles At Home For You,17Â 825Â 337 katselukertaa,13.25,/@construction-productscemen4935
bC8gAbf4r28,How To Cast a Cement Stove With a Plastic Pots is Both Easy and Save Firewood.,14Â 718Â 495 katselukertaa,8.45,/@cementstove
OJzI4luZNeI,Egg Tray And Cement - How To Make Easy Flower Pots at home for you,14Â 618Â 848 katselukertaa,10.51,/@construction-productscemen4935
eZ7qaFJWyns,How to Make Pots from CERAMIC TILES and PLASTIC CHAIRS,13Â 039Â 863 katselukertaa,10.08,/@no1ideas
P1CwUsfq_iM,How To Make Cement Pots | Simple & Easy DIY Flower Pot Designs,12Â 566Â 968 katselukertaa,8.12,/@TheVinodsingh
bb7LofNTjOQ,The Story of Two Pots English Moral Story || Animated Moral Storie | Fairy tales | English Stories,11Â 594Â 613 katselukertaa,3.31,/@JollyKidsEnglish
nMjNSSKDMyU,Recycling Plastic Bottles into Hanging Garden Planter Pots,10Â 928Â 278 katselukertaa,12.15,/@DIYGardenIdeas
dLmYNljajFk,Have you used a Moka Pot?,10Â 440Â 253 katselukertaa,1.00,/@Jeanelleats
FYil9uvulX8,Ideas to recycle plastic bottles to make beautiful two-tiered flower pots,10Â 201Â 456 katselukertaa,11.11,/@skygarden4653
79Mz6bRjnpQ,The 6 Most Beautiful Cement Flower Pots -  You'll Want To Make For Your Garden,9Â 253Â 376 katselukertaa,51.47,/@IntelligentTechnologyAmazing
0uATfA_WoTA,4 Types of Toxic Cookware to Avoid and 4 Safe Alternatives,8Â 619Â 724 katselukertaa,9.18,/@BRIGHTSIDEOFFICIAL
chjwg6RdvFQ,Hot Pot? ğŸ² #shorts,8Â 557Â 614 katselukertaa,1.00,/@andy_cooks
cs8OYby6RrA,One Pot Pastas | Basics with Babish,8Â 328Â 731 katselukertaa,11.19,/@babishculinaryuniverse
-aGYTeM_V4c,DIY | How To Casting Cement Pots Beautiful At Home | Moving Easily,8Â 190Â 536 katselukertaa,12.13,/@productsconstruction8243
pnLuGNU1rDY,DIY Plant Pots - For Free | creative explained,8Â 003Â 149 katselukertaa,0.48,/@creative_explained
