Video Id,Title,View Count,Length,Channel
sF6AMj3H0jg,Pricing strategy an introduction Explained,54 139 katselukertaa,8.02,/@theleaderstalk
4AvPhoU9rGA,What is Unity Thinking!? | New pricing updates,9 675 katselukertaa,16.14,/@bitemegames
b5OtiUpNvqs,3 Pricing Strategies - How To Price Your Service 2022,110 244 katselukertaa,17.44,/@thefutur
xQWUm_eHjGk,PRICING STRATEGY: How To Find The Ideal Price For A Product,161 133 katselukertaa,8.19,/@learnwithshopify
jE53O1PzmNU,Pricing Design Work & Creativity - Stop Charging Hourly,194 444 katselukertaa,2.38,/@thefutur
qfA0RkYube8,How To Price Your Services To Make MORE Money & Give MORE Value (Masterclass 3/5),63 693 katselukertaa,10.04,/@thefutur
jwXlo9gy_k4,Kevin Hale - Startup Pricing 101,159 151 katselukertaa,19.33,/@ycombinator
vLyBXF9UGvg,"What Is a Pricing Analyst? - Responsibilities, Career Path & Skills",6 714 katselukertaa,7.16,/@iqjayfeng
qutavZTkFeY,7 Pricing Strategies - How To Price A Product,495 795 katselukertaa,20.27,/@DanLok
elfq9K57Hq0,Learn the Secrets of 3 Pricing Strategies -- in 5 Min,5 760 katselukertaa,4.49,/@theleaderstalk
oWZbWzAyHAE,Startup Business Models and Pricing | Startup School,248 574 katselukertaa,32.44,/@ycombinator
ENoVL68z9PU,Unity New Pricing Explained,87 128 katselukertaa,10.59,/@CodeMonkeyUnity
KYqvqScg_j8,How Products Are Priced - The Psychology Of Pricing,63 990 katselukertaa,6.37,/@LogicallyAnswered
fPL5YnDXaYE,Ron Baker - Value based Pricing,22 046 katselukertaa,54.58,/@AdvertisingCouncilAustralia
aR-xxF4-vMU,Pricing Strategies for Uncertain Times | HBR IdeaCast,6 897 katselukertaa,21.13,/@harvardbusinessreview
dB90Cse3aaM,INTENSE Reaction to New Unity Change!,31 207 katselukertaa,7.48,/@Unity3dCollege
2tzd7XivFqk,The Marketing Mix - Pricing,132 373 katselukertaa,2.16,/@365FinancialAnalyst
SI2y3Me0aGk,What is Pricing in marketing? | Pricing strategies,11 199 katselukertaa,6.46,/@Educationleaves
TB54_6bEP-A,What Makes People Buy? Price & Value Masterclass w/ Ron Baker,363 168 katselukertaa,57.52,/@thefutur
DSdBNp2nZuk,3 Pricing Strategies For Your Etsy + Print  On Demand Business in 2023 (Etsy POD For Beginners),34 548 katselukertaa,13.35,/@CassiyJohnson
