Video Id,Title,View Count,Length,Channel
eXkEAJ06v0Q,PAUSE X Diib - JOUJ MIZAN (Prod. by Teaslax x Draconic),1 704 901 katselukertaa,3.16,/@hkzprod
2fjjjGPLrlw,When Prod Enters GODMODE Highlights,5 623 katselukertaa,10.53,/@cyphervalorantyt
Jxx5f-SMalI,These Are The Most BROKEN Weapons - Armored Core 6 Gameplay (Part 6),15 680 katselukertaa,23.40,/@codprodigyx
b3XN72z6pNk,Valorant Pros/Streamers React To Insane PROD Plays,1 250 154 katselukertaa,10.20,/@ValoMoments
sTsUDHFUyV0,Dark Souls 3 PLAY AS THE ENEMIES MOD (Funny Moments 8),34 070 katselukertaa,17.30,/@codprodigyx
sV5VR1pVjN0,PROD Plays but they increasingly get INSANE,24 509 katselukertaa,11.08,/@KacciVAL
QaQ84PX7x-0,Dark Souls 3: PLAY AS THE ENEMIES MOD (Funny Moments 3),68 167 katselukertaa,23.58,/@codprodigyx
yVeqk36nbpE,"PROD, the Only Player that plays like IRON & RADIANT",228 720 katselukertaa,8.09,/@ATMeraki
OiFB2XObkGE,"A Literal Impossible Boss, I Had To Reroll... - Dark Souls 3 IRREGULATOR MOD Funny Moments 2",44 367 katselukertaa,14.16,/@codprodigyx
czS1O6VnRKA,The Most BROKEN Dark Souls 3 Mod  EVER,60 457 katselukertaa,23.10,/@codprodigyx
b8yTLpRE6_E,The Art Of AIMBOT: PROD,359 034 katselukertaa,2.19,/@MEZYvalorant
NCjcn4ntl60,a slug sneezed and broke the dark souls 3 engine  - DS3 IRREGULATOR MOD Funny Moments 3,33 525 katselukertaa,15.05,/@codprodigyx
JNyT5Aob5xQ,PROD Proves That His Aggressive Playstyle Still Works ft. Sen Zombs | In Lotus | On Jett | VALORANT,63 030 katselukertaa,8.03,/@valorantclips0001
E0DRIKk-pvY,Turning Dark Souls Into A Breath Of The Wild Like With A MOD (pls don't sue me nintendo),96 170 katselukertaa,17.40,/@codprodigyx
jW9rF4jsHxQ,HORROR GAMES HAVE REACHED A NEW PEAK TODAY,32 634 katselukertaa,27.55,/@codprodigyx
2A8ZLRgN7TU,Mehsah - ETERNEL ( INSTRUMENTAL BOOMBAP FREESTYLE 8 MIN ),12 922 katselukertaa,7.51,/@mehsahalaprod
AesAI67jQDw,Starfield Is Pretty Goofy...But In A Good Way - Starfield Gameplay,24 283 katselukertaa,21.22,/@codprodigyx
cvs_USSA7Mw,"[FREE] Werenoi X Ninho Type Beat ""SOLITAIRE"" | Instru Rap 2023 | prod. Nonoalaprod",133 822 katselukertaa,3.09,/@Nonoonthetrack-rl7do
9UjjLAEf-PM,Dark Souls 2 FOG WALL Ran-DOOR-mizer Mod- Turning DS2 Into A Horror Maze  (PART 1),71 825 katselukertaa,27.02,/@codprodigyx
