Video Id,Title,View Count,Length,Channel
eOYL8qQxxPw,PAW Patrol - The Official Mighty Pups Trailer,330 043 090 katselukertaa,0.41,/@PAWPatrolOfficial
5WCCsVC2Kwc,"खेल के मैदान में Paw Patrol, Skye और चेस का मजेदार दिन",167 375 213 katselukertaa,10.46,/@-genevievesplayhouse1465
wiqrUEIKRL8,Paw Patrol बच्चों के लिए हेलोवीन वीडियो!,131 073 713 katselukertaa,8.02,/@-genevievesplayhouse1465
uyCWEbaUNaY,बच्चों के लिए बेस्ट टॉय लर्निंग वीडियो - Paw Patrol Snuggle Pup Picnic!,93 624 269 katselukertaa,11.00,/@-genevievesplayhouse1465
rzHczgrCV94,PAW Patrol - The Official Mighty Pups Trailer,69 297 296 katselukertaa,0.50,/@PAWPatrolOfficial
cjGZltVZORA,Cyprien - Les pubs VS La vie,46 245 492 katselukertaa,2.37,/@cyprien
TNRacn1Lp2w,Paw Patrol | Robo Pup | Nick Jr. UK,41 973 445 katselukertaa,2.07,/@nickjr
3ZibZA5Qo_4,PAW Patrol: Mighty Pups | Trailer | Paramount Pictures Australia,31 653 918 katselukertaa,1.11,/@ParamountPicturesAU
wy2t4fC_Ois,Paw Patrol Mighty Pups Save Adventure Bay-Snow Rescue Mission Let's Play Pt2,27 775 061 katselukertaa,11.31,/@CassandrasUniverse
Gi-n_Ku4Xek,LES PUBS vs LA VIE 3,25 327 176 katselukertaa,5.31,/@cyprien
3yxSyUJhtqc,PAW Patrol - Pups Save Mr. Porter - Rescue Episode - PAW Patrol Official & Friends!,24 745 915 katselukertaa,2.11,/@PAWPatrolOfficial
x6rfWmoeQiI,Les pubs sur internet - Cyprien,22 067 259 katselukertaa,2.54,/@cyprien
79pFPZNyiWw,LES PUBS vs LA VIE 4,21 431 256 katselukertaa,6.01,/@cyprien
LCrrT8fzCJE,LES PUBS vs LA VIE 5,13 969 467 katselukertaa,6.13,/@cyprien
fvawu25NSMc,Best Of Pubs Happy Meal 2,13 419 734 katselukertaa,7.17,/@ninibrisefer
_zez9ezpxCA,PAW Patrol | Ella and Tuck Help the Mighty Pups! | Nick Jr. UK,11 045 876 katselukertaa,2.13,/@nickjr
DsljtgONLOM,LES ANALYSES DE PUBS : SPÉCIAL TÉLÉ-ACHAT,9 907 065 katselukertaa,1.31.40,/@JDay
5PTuhR6_mCg,Il se passe quoi avec les pubs Facebook et Insta ?,9 832 011 katselukertaa,11.14,/@Squeezie
n-UOfPEury0,NEW PAW Patrol DVD Movie Ready Race Rescue! | PAW Patrol Official & Friends,9 815 387 katselukertaa,0.48,/@PAWPatrolOfficial
ljjWeHmeVE8,RANDOM DUDE WALKS INTO PUB THEN SHOCKS EVERYONE!!,9 529 483 katselukertaa,6.44,/@TerryMilesPiano
