Video Id,Title,View Count,Length,Channel
1_q8txKyg4E,Caramel Custard Pudding [Best Recipe],9 139 141 katselukertaa,6.29,/@NinosHome
Fz95m_nrvmE,Easy Chocolate Pudding Recipe,335 716 katselukertaa,5.20,/@PreppyKitchen
RyFmkGbwNpA,3 Ingredients Caramel Pudding | Dessert Recipe,7 934 567 katselukertaa,3.47,/@HandsTouch
Ou5dsR6DG6Y,I MAKE BREAD EGG PUDDING WITH LEFTOVER BREAD | BREAD PUDDING RECIPE | PUDDING DESSERT RECIPE,1 775 017 katselukertaa,4.02,/@NOvenFoods
QRpkitpWME4,"NO BAKE, NO STEAM, EGGLESS CARAMEL PUDDING RECIPE | EASY CARAMEL PUDDING AT HOME | EGGLESS PUDDING",7 580 501 katselukertaa,0.40,/@BakeWithShivesh
k2SVNKiCNe8,"Jell-O-style pudding — vanilla, coffee, chocolate, strawberry",351 743 katselukertaa,7.21,/@aragusea
XvI3xm-b0ao,Paras japanilainen karamellivanukas,519 067 katselukertaa,7.52,/@MoLaLaCook
dd2V1tsgdVc,Homemade dessert that I never get tired of eating! Creamy smooth it melts in mouth!,12 164 082 katselukertaa,3.33,/@VARGASAVOURRECIPES
AYJdKZiUEZY,Without Oven 10 minutes 3 ingredient Egg Pudding | Caramel Egg Pudding by Lunch Box,4 026 612 katselukertaa,4.21,/@Nipa-LunchBox
khJfA9kkhzE,"If You Have 3 Eggs At Home, You Can Make This Soft & Creamy Pudding Dessert | Steam Egg Pudding",1 350 073 katselukertaa,3.10,/@NOvenFoods
a-syCzbJ3Cs,HOW TO MAKE DELICIOUS MALVA PUDDING,537 583 katselukertaa,7.00,/@FatimaSydowCooks
JbGP0Y4QQOY,എപ്പോഴും വീട്ടിൽ ഉണ്ടാവുന്ന 3 ചേരുവ കൊണ്ട് ഒരു അടിപൊളി pudding   Easy Caramel pudding in Malayalam,1 279 706 katselukertaa,5.26,/@momuskitchen
unR-MpB1l2k,Classic Rice Pudding - Old Fashion Creamy Rice Pudding Recipe - One-Pot Method,2 838 598 katselukertaa,7.39,/@foodwishes
uJOD7Ta5s5s,Milk Pudding Recipe | Soft & Creamy Milk Pudding | Milk Dessert Recipe | N'Oven,505 162 katselukertaa,3.06,/@NOvenCakeCookies
cOEd7eq43oc,Mango Pudding Tried with Caramel but Failed #YouTubeShorts #Shorts #Viral #MangoRecipes #Pudding,8 093 879 katselukertaa,0.58,/@SagarsKitchen
byJuxZ-H1-w,Gordon Ramsay Makes a Sticky Toffee Pudding in a Microwave?!? | Ramsay in 10,690 750 katselukertaa,11.52,/@gordonramsay
rT5jt47RPE4,Easy Bread Pudding | No Oven No Bake | How To Make Bread Pudding,878 544 katselukertaa,8.24,/@PlatinItWithWendy
Xj0jlmM2SyM,How to make Pudding I Dr. Oetker Original CHOCOLATE Pudding,198 034 katselukertaa,4.32,/@Sloveniancookinghousewife
b146UCGHdq8,Japanese Caramel Custard Pudding - Purin,448 480 katselukertaa,0.30,/@TiffyCooks
pBWifP2KvgQ,Easy Bread Pudding | Wild Cookbook,3 292 752 katselukertaa,0.45,/@WildCookbook
