Video Id,Title,View Count,Length,Channel
3-TRlMP1v9c,Rich Amiri - Punt (Official Music Video),67 692 katselukertaa,2.10,/channel/UCoAlpsKqwk1nhC3HgaNmwmw
F9H9LwGmc-0,The search for the saddest punt in the world | Chart Party,4 056 915 katselukertaa,54.24,/@SecretBaseSBN
E_ZBAiE3rVQ,Longest Football Punts Ever,4 420 190 katselukertaa,3.54,/@7ikey
6eWPm5ZGtdk,Xavier Gipson WALK-OFF PUNT RETURN TOUCHDOWN vs. Bills,320 366 katselukertaa,3.13,/@HighlightHeaven
fTRL1d7jO7c,THE PUNT GUN (The Biggest Shotgun EVER !!!),4 446 597 katselukertaa,13.19,/@KentuckyBallistics
I9O-yPsrfiI,Ancient Somalia: From the Stone Age to the Kingdom of Punt | Episode 1,9 801 katselukertaa,13.39,/@SomaliChronicles
7EAIaV0KK0s,Rich Amiri - Punt (Official Audio),58 318 katselukertaa,1.56,/channel/UCoAlpsKqwk1nhC3HgaNmwmw
p_pWjfWf2_Q,Xavier Gipson CRAZY GAME-WINNING Punt Return TD,33 927 katselukertaa,0.21,/@nyjets
fVOI5PlR4mg,HOW TO PUNT A FOOTBALL / PUNT LIKE A PRO PUNTER / PUNT HIGHER & FARTHER / PUNTER MICHAEL TURK,110 821 katselukertaa,14.07,/@Hangtime37
iwv_Y1_H_3I,95 YARD PUNT RETURN TOUCHDOWN!!!,62 590 katselukertaa,0.52,/@NFL
FWX3RN1nks0,"Cherwell Boathouse  ""How to punt""",57 409 katselukertaa,2.09,/@CherwellBoathouse
x_EFCuwHAJk,How Did An Entire Ancient Country Disappear From History?,614 426 katselukertaa,11.38,/@TheInfographicsShow
E7X0cnTR7zk,How to Punt - Cambridge Punting Style,59 046 katselukertaa,1.45,/@PuntingCambridge
3OXO3oymegU,NFL Best Kick & Punt Returns of the 2022-2023 Season,304 615 katselukertaa,22.58,/@DingProductions
AKFNExaSYyk,PUNT Gameplay Showcase,9 754 katselukertaa,1.50,/@lunchhouse
jbCzTwHKFjU,ancient Land of Punt,1 256 katselukertaa,6.23,/@HistoryOfAncients
v6mOmQHI898,Pat McAfee Breaks Down The Game Winning Punt Return For The Jets & What The Bills Did Wrong,102 921 katselukertaa,9.10,/@ThePatMcAfeeShow
OfnAnPxTMKA,Jets vs Bills Insane Walk Off Punt Return Ending,59 937 katselukertaa,0.59,/@thatsgoodsports
San054Jmbmk,Punting EVERY Sports Ball To Discover What Goes Farthest,776 984 katselukertaa,4.22,/@Hangtime37
iMmhkxGHERE,"NFL ""Perfect"" Punts | Part 2",1 584 324 katselukertaa,4.01,/@HighlightHeaven
