Video Id,Title,View Count,Length,Channel
6vy9xTS0QxM,Rhiannon Giddens - At The Purchaser's Option,503Â 290 katselukertaa,4.17,/channel/UCTQvn1-6IhiMo994ivalgmA
W8B2vhd-ThU,"Purchase Executive Job Responsibilities In Hindi, Procurement Ka Kaam",215Â 246 katselukertaa,7.19,/@FocusLocus
LWS0GVN2ibw,Biggest Purchaser of Russian Diesel for this Month is Europe Again. 126% Rise Despite Sanctions,122Â 281 katselukertaa,5.54,/@SikarTimes
RFC6KhTMeEA,A Day in the Life - Purchasing,66Â 234 katselukertaa,3.02,/@MyTotalSource
oRyis6rmbHw,NEW TAX FOR PURCHASER OF GOODS |TDS NEW SECTION 194Q ON PURCHASE OF GOODS,63Â 102 katselukertaa,8.48,/@GSTPLATFORM
4aUg-Fq4qSg,Attention!ğŸ™ TVS Raider Buyers / Important Video for TVS raider purchaser / TVS Raider issues/problem,31Â 392 katselukertaa,8.23,/@Vehicle24
M2dXriu30nA,"Purchasing Manager, Purchasing Agent, Wholesale and Retail Buyer Career Video",24Â 982 katselukertaa,1.38,/@CareerOneStop
YycSzEu0jQs,Fisker Ocean   Everything You Need to Know with Reservation and Purchaser Info,24Â 192 katselukertaa,15.28,/@Aslash304
wXxB1e2Wz54,#226 - How to CANCEL SALE DEED by either PURCHASER or SELLER?? Complaint in Police & Suit to cancel?,24Â 180 katselukertaa,6.58,/@Advocateprasadcherukuri
iiUn5bWvBKU,Are you busy? #counter #purchaser #ì´íŠ¹ #leeteuk #holypop #shorts,21Â 278 katselukertaa,0.21,/@LEETEUK0701
Wr1G4t-iCBc,My Bond Fitness  How to go about to create your purchaser profile,20Â 728 katselukertaa,2.38,/@meyerdewaal1483
6uDYHhzy0wg,Quadriga Recruits an International Purchaser,15Â 140 katselukertaa,1.32,/@QcrBe
HbCjZd2_6Kw,Monopoly Business Opportunity | à¤à¤• à¤¬à¤¾à¤° à¤œà¥à¤¡à¤¼à¥‡ à¤”à¤° Seller à¤”à¤° Purchaser à¤¦à¥‹à¤¨à¥‹à¤‚ à¤¸à¥‡ à¤•à¤®à¤¾à¤ | Aamashop.com,14Â 518 katselukertaa,7.54,/@Franchisebatao
gr9qyr5OK_s,Stan's Vlog #30 - A Day In The Life Of A Purchaser,13Â 592 katselukertaa,4.16,/@stanleyzhou8521
60bRH1mzEWw,THE PURCHASER!!,13Â 247 katselukertaa,1.00,/@WallibearClips
KW5Soq5mnc4,At The Purchaser's Option,11Â 971 katselukertaa,6.33,/@dougplummer7007
bEZVf8WO6C0,Netgear AX1800 RAX20 review from a verified purchaser on Amazon,11Â 561 katselukertaa,6.17,/@FXV
kE5IFOlMp2o,BANGLADESH IS  BECOMING LARGEST PURCHASER OF INDIAN PRODUCTS | EXPERTS CALLING IT A MIRACLE,11Â 030 katselukertaa,9.14,/@TheBlankPageOfficial
3SRccAU5d8w,We are looking for a Junior Purchaser,8Â 926 katselukertaa,1.00,/@QcrBe
lbqx7JopDFw,"Mukesh Kothari in RCM 17th Anniversary Patna, introducing Top10 Purchaser in Fully Educational Way",8Â 811 katselukertaa,7.47,/@3not3aarambh
