Video Id,Title,View Count,Length,Channel
xevCK3pgEnY,Folding hacks for quilts and sheets organization/useful life tips/one minute craft ideas/tiktok,34Â 228Â 414 katselukertaa,0.59,/@KLCoolGadgets
nlbcg-wGqzk,"Prepare for Winter with a Warm, Snuggly - Cotton fluffing and quilt making",19Â 886Â 364 katselukertaa,11.08,/@HetalsArt
0vCWpxBRs20,The Ultimate Quilt Binding Tutorial with Jenny Doan of Missouri Star (Instructional Video),4Â 708Â 254 katselukertaa,16.52,/@MissouriQuiltCo
aPxddfPf5UQ,The KEY to Great Sleep Outdoors,3Â 103Â 398 katselukertaa,6.41,/@MyLifeOutdoors
ehdNBYnFsAw,Make a Zipper Pouch with Jenny Doan of Missouri Star! (Video Tutorial),3Â 102Â 107 katselukertaa,21.49,/@MissouriQuiltCo
xWh90tXr7g4,How to Bind a Quilt - 6 Simple Steps,3Â 067Â 431 katselukertaa,6.57,/@HeirloomCreations
-TyihOEvJ8E,"Your First Quilt - Beginner Tutorial, Part 1",2Â 357Â 896 katselukertaa,19.01,/@MelanieHam
jxC-0T5lXw4,Double Slice Layer Cake Quilt Tutorial,1Â 999Â 813 katselukertaa,9.18,/@MissouriQuiltCo
qwD9x_eT968,"Prepare for Winter with a Warm, - bed sheet - quilt making",1Â 833Â 239 katselukertaa,10.03,/@HetalsArt
itUKAJ6RaOc,Make a Jacob's Ladder Quilt,1Â 696Â 114 katselukertaa,9.48,/@MissouriQuiltCo
-axz453OzSA,Process of Making Soft Cotton Quilt. Korean Fluffy Duvet Factory,1Â 679Â 446 katselukertaa,10.01,/@Allprocessofworld
l4Jb73hBtoE,â™»ï¸ You won't throw away the leftover fabric after watching this video | Sewing Tips and Tricks,1Â 634Â 873 katselukertaa,8.02,/@TaleHandmade
SE5CqpWaReA,"FINISH YOUR QUILTS! How to - BORDERS, BACKING, BINDING, QUILTING - For ANY Quilt Top!!",1Â 610Â 305 katselukertaa,35.06,/@jordanfabrics8380
M851x5SaSAI,Easiest Quilt Ever â€“ The Coin Quilt,1Â 385Â 024 katselukertaa,7.51,/@fonsandporter
xWmKekCf76A,Duvet vs Comforter - What's The Difference?,1Â 301Â 262 katselukertaa,3.49,/@Mattressclarity
cgV64kXet7s,Fold and Sew Quilts  |  National Quilters Circle,1Â 249Â 788 katselukertaa,9.19,/@NationalQuiltersCircle
ksQ8qkpFUNw,Easy One Hour Quilt Made with Fat Quarters! Perfect for Gift Quilts!,1Â 110Â 251 katselukertaa,11.23,/@TinyOrchardQuilts
LfIAmgM8yd0,Tossed Nine Patch Technique,1Â 056Â 945 katselukertaa,2.41,/@quiltinaday
EI6HocWq4Cs,"Uusi, kaunis idea. Ompelu kangasnauhoista. Patchwork aloittelijoille. DIY laukkukansio - peitto",918Â 472 katselukertaa,11.07,/@sewing.diy.patchwork
ZimjXXPmrJE,Here's your next favorite quilt ğŸ’™ 2023 DESIGNER MYSTERY Block of the Month Quilt | Fat Quarter Shop,915Â 181 katselukertaa,0.59,/@FatQuarterShopTX
