Video Id,Title,View Count,Length,Channel
_DplpxTpu5s,Ranking Every MVP In NBA History,24 856 katselukertaa,34.00,/@SOLZandSAGE
_LsbXQ2RpNA,Ranking EVERY NBA Team For The 2023-24 Season...,23 968 katselukertaa,14.54,/@SportingLogically
g04sU8UoGxU,AMP RANK THEMSELVES,2 633 590 katselukertaa,23.14,/@AMPEXCLUSIVE
0zw2EmpEmGE,Ranking the Armored Core 6 Bosses from Easiest to Hardest [Part 2: #28-1],36 174 katselukertaa,33.36,/@theDeModcracy
-L93Rkx6wmg,ESTJ tier-ranking the 16 personalities,10 018 katselukertaa,12.15,/@dearkristin
ddYXqEnqbPI,RANKING ALL 32 NHL TEAMS FOR THE 2023-24 SEASON,3 814 katselukertaa,31.11,/@TacTixHD
q1Wab9GxABo,Ranking the Fallout 3 DLCs in 2023,19 915 katselukertaa,1.02.49,/@owenkung5000
5vOTbWXqUIo,Ranking by Skin Tone | Blindfolded vs Actual,428 764 katselukertaa,13.41,/@jubilee
t-ETw120AKg,RANKING EVERY SIDEMEN CHARITY MATCH PLAYER,5 435 katselukertaa,8.08,/@BenBlack10
RAlI0pbMQiM,Strangers Rank Their Intelligence | IQ vs First Impressions,7 480 364 katselukertaa,12.38,/@jubilee
Xks7H5WXyT0,Who's the Best Dressed Teen?,1 619 386 katselukertaa,13.20,/@jubilee
PbC4l5DG7s4,Whose Girlfriend is the Most Attractive? | Ranking,3 094 994 katselukertaa,12.04,/@jubilee
AhNkSdrIYzg,Ranking Men by Testosterone | Assumptions vs Blood Tests,305 909 katselukertaa,16.53,/@jubilee
2l7D_fa5ScQ,Ranking Strangers from Smartest to Dumbest,6 273 670 katselukertaa,24.45,/@BetaSquad
0X2GtnYFt30,Which Girl Gets the Most Guys? Guys Rank Girls by Rizz,1 727 627 katselukertaa,17.59,/@jubilee
2MxzsBrk9Cc,Ranking The Top 15 MMA GOATS,20 132 katselukertaa,30.19,/@lucastracymma8764
3FV407gsiOU,Ranking Every DreamWorks Villain,1 473 159 katselukertaa,28.04,/@JesseJokes
L3LYmAKfcMk,Ranking EVERY Family Guy Episode Ever,4 874 064 katselukertaa,5.00.05,/@LSMark
A-YcBYUfgtc,Ranking Women By Attractiveness | 5 Guys vs 5 Girls,7 290 993 katselukertaa,8.07,/@jubilee
GwL8lA3MIMI,"Ranking Every Spongebob Episode, Movie, and Spinoff",1 600 321 katselukertaa,7.38.31,/@NathanielBandy
