Video Id,Title,View Count,Length,Channel
KM3j_TXeqfc,The Pussycat Dolls - React,72 627 269 katselukertaa,3.25,/channel/UCqtT9GjW1fhc7Ks_2Lg6yKQ
ooqdg9Wr-mo,World’s Most Expensive Food!,66 048 665 katselukertaa,8.06,/@BeastReacts
S3DL82xBu6U,ELDERS REACT TO EMINEM,42 194 910 katselukertaa,10.19,/@React
xOZduW811Hw,Elders React To Seeing Their Black And White Photos In Color For The First Time,34 538 899 katselukertaa,10.51,/@React
KHoOrFdgYR8,Elders Play Grand Theft Auto V (Elders React: Gaming),33 445 942 katselukertaa,9.47,/@React
85Rzda2P4-E,Billie Eilish Reacts To Teens React To Billie Eilish,33 337 005 katselukertaa,11.22,/@React
ikH62qCV5Bo,"PARENTS REACT TO XXXTENTACION (SAD!, changes, Jocelyn Flores)",31 091 111 katselukertaa,10.17,/@React
i2N68FG5FFM,Doctor reacts: What's stuck in his foot?!,30 996 374 katselukertaa,0.43,/@FootDocDana
aInNomibLQE,Kids React Cast MEETS Poppy For The First Time,30 118 819 katselukertaa,9.22,/@React
dY09peNVVLc,The Pussycat Dolls REUNITE and perform new song 'React'! | Final | X Factor: Celebrity,29 614 257 katselukertaa,5.02,/@thexfactor
zkZcIKuA614,Try to Watch This Without Laughing or Grinning (REACT),28 920 134 katselukertaa,3.59,/@React
Qx5ONcVtnCw,KIDS REACT TO QUEEN,28 296 542 katselukertaa,9.55,/@React
PF7EpEnglgk,KIDS REACT TO OLD COMPUTERS,27 660 345 katselukertaa,7.42,/@React
tGo16GG9qTA,FIVE NIGHTS AT FREDDY'S (Teens React: Gaming),27 465 017 katselukertaa,11.01,/@React
AUq1pu9FqXo,TEENS REACT TO THRIFT SHOP (Macklemore & Ryan Lewis),23 388 953 katselukertaa,7.31,/@React
4_SvJO5sQ_w,The Truth About Kids React,21 995 652 katselukertaa,1.00,/@1MinuteTalkShow
Hg5dOEvjEYU,PARENTS REACT TO XXXTENTACION,21 942 259 katselukertaa,10.39,/@React
EyCWLG0Ehm0,Ishowspeed Reacts To Fan Art..💀😂,21 727 701 katselukertaa,0.23,/@IShowSpeedClips12
Fa9WJMrQLvw,British Highschoolers react to Bri'ish Memes,21 568 951 katselukertaa,9.39,/@jolly
WDBb_FBnxBU,Do Parents Know Secret Emoji Meanings?,21 180 937 katselukertaa,14.44,/@React
