Video Id,Title,View Count,Length,Channel
XRQtu0Lk-80,I’m still recovering 😱 FULL VIDEO on my YouTube channel! #icequeen #icebath #prank #couple #shorts,23 698 737 katselukertaa,1.00,/@itskyajeub
4RHJD2xs0Bw,Family of 12-year-old Little Leaguer shares video as he’s recovering from bunk bed fall,15 073 743 katselukertaa,0.25,/@abc7NY
NL2ox7HexsI,Recovering From Dislocating My Arm #shorts #aurora #kungfu,12 475 603 katselukertaa,0.13,/@ElinaMeng
Gbtulv0mnlU,Shuttle's Boosters Recovered in HD,11 450 360 katselukertaa,11.41,/@NASA
8LEqwPOehpE,FIXING COWS FEET ... COWS HOOVES RECOVERING,9 551 839 katselukertaa,20.11,/@TheHoofGP
l0uMGoW1KPM,"Magnet Fishing On A Military Base - US Army Equipment Recovered (86 Rockets, Mortar and More)",8 992 078 katselukertaa,25.28,/@Outdoorsweekly
Gw5xrWJo8pw,Recovering at the hospital,8 560 364 katselukertaa,10.14,/@ColleenVlogs
7CQyM1ZXkYs,"""It's time to show who I am now"": Dog sitter recovering after losing face in horrific dog attack",8 549 679 katselukertaa,8.33,/@CBSMornings
lQ3o6CzP-2Q,The Largest And Most Stuck Excavator I’ve Ever Recovered,8 325 417 katselukertaa,31.20,/@HeavyDSparks
dT9y-KQbqi4,How I hacked a hardware crypto wallet and recovered $2 million,7 728 164 katselukertaa,32.18,/@JoeGrand
wbKklnImXog,RECOVERING FROM A MELTDOWN LOL,7 590 010 katselukertaa,16.41,/@emmachamberlain
3TRl4edM_74,Recovering Ed's LJ20 Stuck 40 Years In The Sierra Nevada Mountains,4 658 304 katselukertaa,22.46,/@MattsOffRoadRecovery
L4zkRkmyx0k,Recovering Agent K | Men In Black II | Voyage,4 479 395 katselukertaa,4.27,/@VoyageOfficialChannel
wOZicr9SNdo,15 Terrifying Things Recovered from the Titanic!,4 434 678 katselukertaa,20.32,/@TopDiscovery
cKg2dZPHhTc,Brian Robinson Was Really Introduced To 'Many Men' After Recovering From Being Shot Twice 🔥,4 189 193 katselukertaa,0.19,/@RapMarathon
jXF1UkryBLw,Recovering Vehicles From A Cliff That Nobody Else Will Touch (Dead Man's Curve!),4 101 287 katselukertaa,42.55,/@HeavyDSparks
b_KG5jRe7Rs,CONFRONTING THE BIKE THIEF? Recovering my Stolen Dirt Bike,3 855 769 katselukertaa,7.29,/@savdaddies
vnul38p3HVY,"John Mayer, 'Recovered Ego Addict' | msnbc",3 665 754 katselukertaa,13.42,/@msnbc
eAr56x8lsuI,Thief Trackers Stolen R6 Recovered 3 Times by Automatrics MTrack Motorcycle Security Tracker,3 631 984 katselukertaa,7.01,/@AutomatricsMtrack
AFBTJKgQeEA,Recovering from birth hit us like a train #shorts,3 401 886 katselukertaa,1.00,/@MattandAbby
