Video Id,Title,View Count,Length,Channel
1GSAio5Xt7w,OVERLANDING with JEC EPISODES | La Parisukat | REED FOR SPEED,190 690 katselukertaa,19.45,/@REEDMOTOVLOG
w-L4lhKBZv8,Grave of Jerry Reed. Snowman from Smokey and the Bandit,28 135 katselukertaa,10.54,/@BackRoads1
0AvQRE_OmZ4,Coaching The Future | Chad Reed Returns To Ironman MX Moto Combine,45 808 katselukertaa,28.38,/@TwoTwo_TV
4NDwYEbtHR0,Raider 150 Fi Mc Arthur Highway Ride After Bagyo | Reed Motovlog,246 570 katselukertaa,21.47,/@REEDMOTOVLOG
oG6fayQBm9w,Lou Reed - Walk on the Wild Side (Official Audio),61 926 619 katselukertaa,4.15,/channel/UC6En-5Cd1suZ9lhezbuhGoA
gLPX0mJEkgA,YAMAHA TMAX | Zabarte Caloocan | Kai Mall | REED Motovlog,170 633 katselukertaa,28.28,/@REEDMOTOVLOG
-ro47aN1Psw,Eazy The Block Captain vs. Reed Dollaz (Full Battle),695 641 katselukertaa,37.32,/@Chrome23
OXk-m-5iiIg,Negros Ride Part 2 | Suzuki GSX S1000 | BMW S1000RR | Nissan GTR | REED MOTOVLOG,175 260 katselukertaa,27.14,/@REEDMOTOVLOG
dl4nbtVBpM0,Tate Reed Begins His 85cc Supercross Training!,55 552 katselukertaa,14.40,/@TwoTwo_TV
F3w8n7czJT4,"1,103cc Roaring Engine Sound Ducati Panigale V4S | REED New Bike Experience",328 121 katselukertaa,23.45,/@REEDMOTOVLOG
quijkx-Sbxw,ANSWERING YOUR ASSUMPTIONS ABOUT US…,194 847 katselukertaa,12.54,/@JessandReed
5NUS-NvngRg,"Hands down the BEST Superbike I've ever ridden 1,000cc Suzuki GSX-S1000",219 842 katselukertaa,23.34,/@REEDMOTOVLOG
yOoXjYppyMM,Lou Reed - Full Concert - 09/25/84 - Capitol Theatre (OFFICIAL),3 189 600 katselukertaa,2.17.06,/@LouReedOnMV
UH5CcfXGD04,GULAT sa Suzuki Raider 150 Fi Hataw kung Hataw! REED MOTOVLOG,372 838 katselukertaa,35.45,/@REEDMOTOVLOG
VpOKKO40iB8,Challenging Motos In The Heat! The Reeds Race Dade City MX,38 070 katselukertaa,27.45,/@TwoTwo_TV
x4fnfNxy7Uk,HULE OVERSPEEDING | REED MOTOVLOG | KAWASAKI Z H2,402 625 katselukertaa,25.13,/@REEDMOTOVLOG
dm458bpwK7Y,Reed's Point (2022) | Full Horror Movie | Joe Estevez | Joseph Almani | Clint Carmichael,2 425 818 katselukertaa,1.16.57,/@flixforfree
kx4BlC6S1uU,Testing the Ducati Panigale V4S 2023 in Sepang Circuit Malaysia | DRE Sepang 2023,196 129 katselukertaa,17.26,/@REEDMOTOVLOG
