Video Id,Title,View Count,Length,Channel
3EUL_f8vGJ0,Agriculture Reform Bill 2020 | MSP | APMC | Aadti | Kisan Andolan | One India One Agri Market,22Â 853Â 403 katselukertaa,46.22,/@khangsresearchcentre1685
F7U3J9AJS8M,APJ Abdul Kalam's idea to reform Education system ğŸš€,15Â 386Â 515 katselukertaa,0.58,/@LearnwithJaspal
R7IJC6nMons,Nightcore - Devastation and Reform,7Â 022Â 430 katselukertaa,2.58,/@nightcorereality
xQLqIWbc9VM,Bail Reform: Last Week Tonight with John Oliver (HBO),3Â 722Â 179 katselukertaa,26.38,/@LastWeekTonight
G3fnhA5of1M,Pension reform protest turns violent in France,3Â 367Â 273 katselukertaa,0.27,/@trtworld
t62fUZJvjOs,19th Century Reforms: Crash Course US History #15,2Â 762Â 713 katselukertaa,14.47,/@crashcourse
-8lW3jWJ4p8,Reform School Girls-1986 (Full Movie-Wendy O Williams),2Â 173Â 819 katselukertaa,1.34.16,/@terjehellesvik9057
HZ_1vFsk38U,neymiÅŸ bu yapÄ±sal reformlar?,1Â 763Â 519 katselukertaa,27.30,/@140journos
plN7pwsInpI,Senate Judiciary Committee holds hearing on Supreme Court ethics reform | full video,1Â 758Â 321 katselukertaa,3.16.25,/@CBSNews
Cs8d1IrreOg,DIY Upcycling a knit|ë‹ˆíŠ¸ ë¦¬í¼|ìŠ¤ì›¨í„°|sweater|ì¡°ë¼|vest|Reform Old Your Clothes|ì•ˆì…ëŠ”ì˜· ë¦¬í¼|Refashion|ì˜·ìˆ˜ì„ |ì˜·ë§Œë“¤ê¸°,1Â 728Â 008 katselukertaa,10.07,/@meeya
UIRS_PMeVVY,Marian Reforms and their Military Effects DOCUMENTARY,1Â 633Â 696 katselukertaa,14.20,/@KingsandGenerals
j5tFZ7UFhzM,Reform Muli T10 X | landwirt.com,1Â 434Â 907 katselukertaa,6.13,/@landwirtcom
XV18wx-xGaE,New Rule: Port Reform | Real Time with Bill Maher (HBO),1Â 205Â 293 katselukertaa,5.29,/@RealTime
sftPh0SMnvQ,Military Reforms of Augustus,1Â 160Â 340 katselukertaa,17.02,/@KingsandGenerals
3-Ilc5xK2_E,"Health Reform Explained Video: ""Health Reform Hits Main Street""",999Â 798 katselukertaa,9.05,/@KFFhealthreform
N-mwdJNYehc,Lawmakers address cannabis reform on 4/20,926Â 075 katselukertaa,3.32,/@NBCNews
5LS0UBuNKjE,Reform torta,724Â 713 katselukertaa,8.23,/@DomacireceptiNet
_uKp4FHPjHU,Reform and Revolution 1815-1848: Crash Course European History #25,685Â 204 katselukertaa,14.06,/@crashcourse
f1P2jeTwreM,Disney's Recess - Randalls Reform,647Â 339 katselukertaa,10.05,/@iVideoXD
1SBnK9XIlZE,How China became a superpower: 40 years of economic reform | DW News,641Â 560 katselukertaa,6.09,/@dwnews
