Video Id,Title,View Count,Length,Channel
VlgMnwmKXi0,"Darling Darling yes Sweetie - BillionSurpriseToys Nursery Rhymes, Kids Songs",640 134 927 katselukertaa,8.01,/@BillionSurpriseToys
MyeudDKF6W4,Indoor Playground Songs for children - BillionSurpriseToys Nursery Rhymes,472 125 106 katselukertaa,3.14,/@BillionSurpriseToys
kSiYIexPVbU,"Ice cream Song - BillionSurpriseToys Nursery Rhymes, Kids Songs",453 621 925 katselukertaa,3.21,/@BillionSurpriseToys
2xwNZLOQpl0,Fruit Ice cream shaker and Baby doll refrigerator toys play,294 642 693 katselukertaa,10.33,/@toypudding
IRcisLgq7zM,"Johnny & Refrigerator Friend - BillionSurpriseToys Nursery Rhymes, Kids Songs",262 164 087 katselukertaa,2.30,/@BillionSurpriseToys
aC_EcrxV20s,Johny Johny Yes Papa and Many More Videos | Popular Nursery Rhymes Collection by BillionSurpriseToys,201 542 479 katselukertaa,28.32,/@BillionSurpriseToys
wbp9tJRsgEM,"Cute Friend Refrigerator playtime with food - BillionSurpriseToys Nursery Rhymes, Kids Songs",157 797 124 katselukertaa,2.31,/@BillionSurpriseToys
7KFXMeKXBwA,Johny Johny Yes Papa - REFRIGERATOR Remix | 3D Baby Nursery Rhyme & Kids Songs,134 924 367 katselukertaa,2.26,/@BillionSurpriseToys
wTP2RUD_cL0,Dire Straits - Money For Nothing (Official Music Video),118 193 213 katselukertaa,4.39,/channel/UC9HKX4sDEYdgDEQTV9iy9yw
p-uZnfo4RlY,"Iceream Shop Songs - BillionSurpriseToys Nursery Rhymes, Kids Songs",99 586 334 katselukertaa,5.00,/@BillionSurpriseToys
fvAyVRUAxkc,"Cute Friend Refrigerator - BillionSurpriseToys Nursery Rhymes, Kids Songs",96 964 347 katselukertaa,7.59,/@BillionSurpriseToys
AiuyFAntBk4,Wendy & Liam Pretend Play w/ Giant Coca Cola Vending Machine & Kid Refrigerator Toy,96 075 187 katselukertaa,10.26,/@toysandcolors
BmpTaWfhWYs,Baby doll Refrigerator and food toys baby Doli play,88 478 800 katselukertaa,8.37,/@toypudding
C50JFYwnvUM,Baby doll cart kitchen and refrigerator toys baby Doli play,87 653 254 katselukertaa,10.19,/@toypudding
FFa_69_BKHg,Fridge mein ICE-CREAM 😆 Relatable ? #shorts | Harpreet SDC,68 091 684 katselukertaa,0.34,/@HarpreetSDC
d6ZxT2Ai-BU,Fizzy with Paw Patrol Refrigerator Fridge Supermarket Shopping,65 299 964 katselukertaa,13.27,/@FizzyFunHouse
P7k2MkVYLDE,"CGI Animated Short: ""Runaway"" - by Susan Yung, Emily Springer, Esther Parobek + Ringling | TheCGBros",57 136 062 katselukertaa,3.40,/@TheCGBros
tsnaePnzejY,Baby doll refrigerator toys baby Doli play,49 457 653 katselukertaa,10.06,/@toypudding
Bk4RND5AbRc,I turn Fridge Compressor into 4 stroke Engine,49 227 931 katselukertaa,36.41,/@letslearnsomething9332
dv1CQQFKDjw,American Girl Fridge Playset Maryellen's Refrigerator & Food Set with Shopkins Surprise,44 831 774 katselukertaa,16.09,/@Cookieswirlc
