Video Id,Title,View Count,Length,Channel
OFtNChII78k,Dido - Life for Rent,75 796 105 katselukertaa,3.42,/channel/UC9Nyyq3qHochdTq1klPyVIQ
PmVTFtwadzM,SIXT rent THE car,47 454 492 katselukertaa,0.31,/@Sixt-car-rentals
MC6kzTi3MLs,How MUCH to Rent this in NYC?,42 878 202 katselukertaa,0.58,/@GoodWorkMB
YshgmStEZh0,Broadway Carpool Karaoke ft. Hamilton & More,40 447 387 katselukertaa,11.05,/@TheLateLateShow
HkyB1studRU,I WENT ON 100 DATES IN 24 HOURS!!,29 149 479 katselukertaa,18.51,/@brentrivera
07Lru4hNVds,Tik Toks That Live Rent Free In My Head,24 871 678 katselukertaa,11.25,/@SSSniperWolf
zksbi3YFtLY,"Knocking on Strangers Doors, Then Paying Their Rent",19 919 403 katselukertaa,11.52,/@ThatWasEpic11
hj7LRuusFqo,Seasons of Love - Rent (Music Video),19 328 030 katselukertaa,2.58,/@readonaliti
s_nc1IVoMxc,Ren - Hi Ren (Official Music Video),19 163 175 katselukertaa,9.20,/channel/UCqq3VcwPGseErHUa0-xLInQ
CQOsAGSZXgw,So you say you can't pay your rent - The Big Bang Theory,16 471 284 katselukertaa,2.51,/@ShellyPenny
8tvzKOkWD5Y,Tik Toks That Live RENT FREE In My Head,15 963 763 katselukertaa,12.30,/@SSSniperWolf
_P25OStBiA4,"Worker was short for rent, then THIS happened 🥺",15 517 451 katselukertaa,0.39,/@MDMotivator
q3a4sBP4TZc,Husband Sells His Wife to Pay Rent! The Ending will SHOCK YOU! #shorts #sameerbhavnani #lifelessons,13 133 029 katselukertaa,0.59,/@SameerBhavnani
UvyHuse6buY,Seasons of Love (HD),12 105 516 katselukertaa,3.15,/@dudescolded
xNmHYVNvEro,Tik Toks That Live In My Head RENT FREE,12 004 781 katselukertaa,11.00,/@SSSniperWolf
vzaXw2ztCqU,Conan Rents A Family In Japan | CONAN on TBS,11 805 313 katselukertaa,6.47,/@TeamCoco
Vubc4TcGSYE,One Woman's Airbnb Home Rental Nightmare,9 823 129 katselukertaa,2.00,/@ABCNews
m4QklgrKNCE,I Rent A Boyfriend Everyday,9 650 855 katselukertaa,12.29,/@MSA.official
YTCN4Wr_9eQ,give me rent pt. 2,9 588 348 katselukertaa,0.35,/@TobeyInTheMCU
