Video Id,Title,View Count,Length,Channel
pRf2JHw9LQg,High Pressure Water Main Repair || ViralHog,337Â 978Â 398 katselukertaa,0.59,/@viralhog
XBl3fmPtbTs,$2 tire puncture repair,187Â 196Â 275 katselukertaa,1.00,/@reXpair
CclsnnleKms,Vlad and Mama repairing children's playhouses,146Â 842Â 829 katselukertaa,3.14,/@VladandNiki
c9Ts6lLrgcQ,Diana and Roma repairing playhouses,132Â 346Â 787 katselukertaa,4.53,/@KidsDianaShow
ducLiWY7l4Q,Arthur unboxing and assembling Gift Toy for Melissa,106Â 372Â 301 katselukertaa,4.00,/@Melliart
PlnfWk2hmQc,Achilles Tendon Repair,93Â 035Â 545 katselukertaa,0.54,/@3D4Medical
gkmKUBuo6hU,Meniscus Bucket Handle Tear Repair,65Â 678Â 502 katselukertaa,0.42,/@3D4Medical
ZgLJdKn31BE,Full restoration ancient UAZ 469 | Restoring and repair antique uaz 469 cars,53Â 248Â 958 katselukertaa,47.59,/@dtrestoration8590
KxZOemmTXrw,A tubeless tire puncture repair,47Â 183Â 118 katselukertaa,0.16,/@reXpair
czjarBaEOr0,The most amazing rescue ever! She saved a butterfly and repaired its wing! ğŸ¦‹,41Â 465Â 123 katselukertaa,0.57,/@Wood_Mood
PJyD4IAzNRs,$5 Phone Repair Hack!,37Â 848Â 903 katselukertaa,0.50,/@Mrwhosetheboss
kcIHONJfwYY,Restoration Lamborghini Huracan Model SuperCar Restore,34Â 603Â 858 katselukertaa,14.27,/@Restoration
4i9eiEme8vo,Repairing Damaged Pipe with Plug | Man News (via teknik_deha on ig) #oddlysatisfying #repair #react,31Â 106Â 278 katselukertaa,0.17,/@andpacker
kg3NXoaCQ1Q,Restoration Old Remote Control Helicopter | Restoring Broken drone,30Â 416Â 239 katselukertaa,24.16,/@restorationvr3793
zBak03929zY,Amazing skill of Repairing a Hard Impact Sidewall Biggest Truck Tire,28Â 668Â 818 katselukertaa,25.57,/@MechanicsTV
iA_Dty-sZ7s,Restoration extreme rusty abandoned 1931Â´s car truck,28Â 084Â 917 katselukertaa,15.10,/@restoremachines
7CiOgB9Z7fs,à¤¶à¤°à¥à¤® à¤•à¤°à¥‹ Samsung Service Centre asking me â‚¹70k for repair a Phone | Technical Dost @SamsungIndia,26Â 815Â 839 katselukertaa,0.59,/@TechnicalDost
VlXPOMGFrWI,The super glue idea that not many people know about,26Â 084Â 779 katselukertaa,3.50,/@Inventor101
eP3xJIJ-TbU,Super Glue and Baking soda ! Pour Glue on Baking soda and Amaze With Results,25Â 052Â 390 katselukertaa,4.34,/@Inventor101
7WZ-MPlOccg,Restoration Rolls Royce Sweptail to 24k Synthetic Gold - Ultra Luxury,24Â 652Â 963 katselukertaa,15.47,/@Restoration
