Video Id,Title,View Count,Length,Channel
bCiXB0tT_KQ,PAN Card Reprint Kaise Karen - Physical PAN Card Apply Online NSDL | e filling New Portal 2.0,686 286 katselukertaa,5.48,/@AmarGyan20
CDuMN4StMYc,Opening to Shrek 2001 DVD [2003 reprint; Full Screen],287 606 katselukertaa,2.22,/@JordanRiosMoreVHSopenings715
3YwF94qOWLg,Opening To Brother Bear 2 2006 DVD (2013 Reprint),252 882 katselukertaa,6.21,/@thepreviewsguydvdopenings1204
KXAEMnsU7jk,Voter ID card reprint kaise kare | how to reprint voter id card online,244 005 katselukertaa,7.05,/@Netmaster9
dzk9ryNUMP8,Closing To Ice Age 2002 (2005 Reprint) DVD (MOST POPULAR),211 901 katselukertaa,7.23,/@superstarfanatic2023
NUBLpoGSvbI,HOW TO GET LOST PAN CARD ONLINE IN TAMIL | REPRINT PAN CARD | GET DUPLICATE PAN CARD | NSDL | UTI,211 634 katselukertaa,13.01,/@makkalsevaiyoutube
KpnXOMfO8kQ,Buying The NEW 2021 Pokemon Cards Hidden Fates Reprint! I Got *LUCKY* Opening The Elite Trainer Box,195 584 katselukertaa,13.19,/@RealBreakingNate
vnavbK-bUT4,Don't Reprint These Magic: The Gathering Cards!,179 842 katselukertaa,15.49,/@TolarianCommunityCollege
-1-ngRKHSDo,Opening To Blue's Clues:Bluestock 2004 DVD (2012 Reprint),164 748 katselukertaa,5.57,/@thepreviewsguyalter
eJ87kHldxOY,How to Reprint Pan Card #shorts #tipsandtricks #pancard #reprintpancard #order,163 198 katselukertaa,0.23,/@SkykingTechnical
tUgzXV8U7v4,WIZARDS REMOVES REPRINT POLICY FROM WEBSITE.,153 376 katselukertaa,6.24,/@AlphaInvestments69
saoPstML0Lk,Previews From Brother Bear 2 2006 DVD (2013 Reprint),149 481 katselukertaa,5.16,/@thepreviewsguydvdopenings1204
SyFdHFbvyLs,How to reprint tax receipt from RTO portal,144 638 katselukertaa,7.00,/@ImranTamboli
SLnVsnMA0iM,PAN Card Reprint Kaise Karen - Physical PAN Card Apply Online NSDL | e filling New Portal 2.0,137 622 katselukertaa,6.57,/@JksumanSupport
sgnPfcu_xgc,【ゼルダの伝】Zelda's practice of learning bows and arrows [Reprint],120 393 katselukertaa,0.27,/@beibei-zx1fw
Otc_pWLT2qY,Buying a NEW 2021 Unified Minds Pokemon Cards Reprint! *MEWTWO & MEW PULLED TWICE* in a Box Opening,119 044 katselukertaa,18.01,/@RealBreakingNate
expGeUgEWAk,Roaring Skies Reprint just RUINED Pokemon's Credibility - 100% DESTROYED -,117 313 katselukertaa,13.38,/@AlphaInvestments69
JsmdvMZjwjA,Reprint These Magic: The Gathering Cards Into Pioneer Now!,116 537 katselukertaa,18.22,/@TolarianCommunityCollege
ePwRvOAFBgg,DARK PALADIN REPRINT EXPERIENCE,115 142 katselukertaa,12.58,/@justacatwithamoustache69
5XFRbB8ubjY,Every Masters Set Cracked Open! Which Magic: The Gathering Reprint Pack Was Best?,113 112 katselukertaa,14.43,/@TolarianCommunityCollege
