Video Id,Title,View Count,Length,Channel
SW7g5WZwOWk,Why is This Reproduction Prohibited?,159 135 katselukertaa,7.50,/@TheCanvasArtHistory
0ygx2qljUQM,Reproduction,890 888 katselukertaa,4.08,/channel/UCrbKnWfFB3hJ2yf67ItHASw
HLYPm2idSTE,Plant Reproduction in Angiosperms,1 094 369 katselukertaa,8.01,/@AmoebaSisters
5WdPno6-xkU,How Do Microorganisms Reproduce?,393 628 katselukertaa,8.35,/@journeytomicro
0ISJ2qTAESQ,These female animals don't need a male to reproduce | Parthenogenesis,30 328 katselukertaa,1.14,/@OneMinuteExplore
fcGDUcGjcyk,Asexual and Sexual Reproduction,2 341 341 katselukertaa,5.10,/@AmoebaSisters
ExaQ8shhkw8,The Plants & The Bees: Plant Reproduction - CrashCourse Biology #38,1 019 594 katselukertaa,10.24,/@crashcourse
yUFYnVXbLoY,How to Build a Working UFO | Alien Reproduction Vehicles (ARVs),2 114 923 katselukertaa,28.28,/@TheWhyFiles
j57HVRDoLHk,รวมเพลง Reproduced - จิ๋ว สกุณชัย [Long Play],940 621 katselukertaa,41.01,/@JorjanYoryak
HmbdtZnf4B4,Not to Be Reproduced | René Magritte | Artwork Review,4 082 katselukertaa,2.01,/@sartlearthistory3814
f3hFHFyzGjY,fungus reproduction,129 876 katselukertaa,7.49,/@benmountz4690
h077JEQ8w6g,Plant reproduction - Flower anatomy and pollination - GCSE Biology (9-1),111 211 katselukertaa,4.13,/@MrExhambio
wSubbwAggJA,JAONAAY - คืนที่ดาวเต็มฟ้า reproduced [Official MV],7 097 313 katselukertaa,5.01,/channel/UCovhtmk3ypC7vANFdfH6ssw
R8_ScKzLAfE,Sexual Reproduction in Plants | Plants | Biology | FuseSchool,591 945 katselukertaa,4.07,/@fuseschool
i9zj9V8OWRk,What Is Asexual Reproduction | Genetics | Biology | FuseSchool,518 736 katselukertaa,3.44,/@fuseschool
blq9sCIyXgA,Walter Benjamin: The Work of Art in the Age of Mechanical Reproduction,157 820 katselukertaa,9.30,/@ThenNow
og0RUhdL9p0,Hiérophante - Reproduction (video link in description),184 320 katselukertaa,2.20,/@Hierophante
7aLz8oDHWbc,How do Organisms Reproduce - 7 | Types of Asexual Reproduction - Spore Formation | CBSE Class 10,196 510 katselukertaa,1.48,/@PrepOngo
NRWRU1LGAbs,Learn How Pine Trees Reproduce | Gymnosperm Life Cycle,61 731 katselukertaa,4.21,/@natureclearly
6Ew6mqwgGR0,Asexual Reproduction,318 734 katselukertaa,7.41,/@symbiossofttech
