Video Id,Title,View Count,Length,Channel
S5SPGcVfH3k,The Mysterious Attacker Residing In An Apartment | सीआईडी | CID | Real Heroes,4 472 171 katselukertaa,43.18,/@LIVCrime
SS1x9ZaouQs,How to Install Vinyl Siding from A to Z,1 695 819 katselukertaa,57.00,/@HomeRenoVisionDIY
aHPp5S6glv8,Siding a House By Yourself,1 493 640 katselukertaa,8.06,/@chaddiy3512
3Q8ziLWP_YY,How To Build A Shed - Part 6 - Install Shed Siding,1 411 917 katselukertaa,6.41,/@icreatablestv
l1MwrqImWXs,How To Install Vinyl Siding,1 214 584 katselukertaa,30.12,/@TheExcellentLaborer
cXqgQ-akDEc,How to Install Fiber-Cement Siding | This Old House,930 842 katselukertaa,7.08,/@thisoldhouse
bz9JoJGWvI4,How to Replace Damaged Vinyl Siding | Ask This Old House,915 188 katselukertaa,6.20,/@thisoldhouse
XVDs8jtXpmc,How To Replace Vinyl Siding with Real Brick,827 351 katselukertaa,2.57,/@FIDELITY411
kr2pyd8tLHI,Flawless Siding Secrets - Matt Geeks out on the James Hardie Details at His House,796 911 katselukertaa,20.34,/@buildshow
E4PHRrzAL5A,How to Install Window Casing for Vinyl Siding | This Old House,631 129 katselukertaa,4.30,/@thisoldhouse
S6gDdyjx5hQ,SIDING Prep - DO NOT INSTALL Siding Till You Watch This,596 053 katselukertaa,17.13,/@buildshow
6FmYRzCgL-8,How To Remove Vinyl Siding [EASY!],403 260 katselukertaa,4.39,/@HouseImprovements
L59JB8Wo5Kc,How to Build a Shed - How To Install Exterior LP Siding Panels Part 1 - Video 8 of 15,399 769 katselukertaa,17.06,/@Countrylifeprojects
caMVjDLkmKg,Dreams have become reality with happy families residing at Merlin Gangotri,379 383 katselukertaa,4.37,/@MerlinGroupProjects
Ed34hSPixX8,Introduction to T1-11 Plywood Siding,378 432 katselukertaa,3.54,/@SyberPrepper
iFMsXIdaEfM,Why You Should Ditch The Vinyl Siding,356 300 katselukertaa,5.12,/@VergePermaculture
H7eeU6oR6oo,Lap Siding Installation Ep.81,339 138 katselukertaa,19.44,/@essentialcraftsman
eA5UQ1IrXaI,HOW TO INSTALL VINYL SIDING,323 995 katselukertaa,4.36,/@AverageGuyDIY
71VM6v0sqS4,How to Build a Shed - How To Install Exterior LP Siding Panels Part 2 - Video 12 of 15,322 646 katselukertaa,12.47,/@Countrylifeprojects
ek-rSRHR8Dc,#RESIDE,322 558 katselukertaa,2.17,/channel/UCawJVL59T11D7wtHRpd9Tpw
