Video Id,Title,View Count,Length,Channel
HaA2hBxiz24,What is Retail? | How Retailers Make Money | Retail Dogma,29 676 katselukertaa,2.55,/@RetailDogma
9hHMZOJdv2A,20 Retailers Collapsing Right In Front Of Our Eyes,2 197 974 katselukertaa,16.44,/@PeterSchiffChannel
dzejHGniMTQ,"How Costco Became A Massive ""Members Only"" Retailer",4 096 242 katselukertaa,22.02,/@CNBC
Rd-171DhZuk,Retail theft on the rise nationwide,45 361 katselukertaa,7.17,/@CBSNews
JzLoo8cFJBI,"Retailers, Wholesalers and Distributors",261 024 katselukertaa,1.38,/@LagosStateEmploymentTrustFund
NHrQkvldJ-o,What is Retail?,20 071 katselukertaa,1.40,/@MarketingBusinessNetwork
FclSidWwL0E,Why Retailers Are Spending Billions On Anti-Theft Technology,627 179 katselukertaa,18.04,/@CNBC
8nvg06VRNmU,Retailer vs Wholesaler - Whats the BIG Difference?,9 084 katselukertaa,5.56,/@retailmavens
gJpau8czZUY,Retailers scramble to find solutions to reported rise in organized theft | Nightline,897 774 katselukertaa,9.06,/@ABCNews
rWTk784HglI,What is an Online Retailer?,1 338 katselukertaa,2.08,/@MarketingBusinessNetwork
COA978PNt9Q,Differences of Retailer and Reseller,6 923 katselukertaa,1.34,/@healthiswealth1593
2RELaefxb4k,Rude Retailer,12 094 591 katselukertaa,0.46,/@LyannaKea
s9tXsQTy7c4,What is Retail Media,8 876 katselukertaa,1.51,/@CriteoOfficial
_A62bap1Eok,Retail Vs Wholesale Explained | Difference between Retail & Wholesale,84 578 katselukertaa,3.30,/@RetailConcepts
R6gLmICiL6o,How To Start a Successful Retail Business,16 488 katselukertaa,9.48,/@retailmavens
QybxiT00bGg,Retailer Definition - What is Retailer?,15 660 katselukertaa,1.49,/@AccountingInstruction
VDjxg-8Ra5o,The 8 Biggest Retail Trends Every Retailer Needs To Ready For Today,16 488 katselukertaa,11.14,/@bernardmarr
UrkPC81_QfU,How Retail Stores Manipulate You,4 664 037 katselukertaa,23.52,/@safiya
1EX9WUhW2Rw,Retailer Vue™ Terminal by IGT - Product Video,4 000 katselukertaa,1.47,/@igt
hUooueoMI2I,Bill Ackman: Wealthiest People are Retailer,2 997 katselukertaa,0.35,/@investingbasicsyt
