Video Id,Title,View Count,Length,Channel
W7kdKf_aqX4,"Party With The Bhoothnath Song (Official) | Bhoothnath Returns | Amitabh Bachchan, Yo Yo Honey Singh",246 757 531 katselukertaa,4.37,/@tseries
q-RP99S_qK0,"Lyrical: Uska Hi Banana | 1920 Evil Returns | Arijit Singh | Aftab Shivdasani, Tia Bajpai",171 448 104 katselukertaa,5.48,/@tseries
Rk_sAHh9s08,Enigma - Return To Innocence (Official Video),152 597 007 katselukertaa,4.55,/channel/UC8XZBbAN0qyfOjghG89236A
AbfZ-VQP9-Q,Big sister returns home from deployment to surprise little sister at school ❤️❤️,144 926 067 katselukertaa,0.29,/@MajicallyNews
WbubC8krWF0,Superman Returns | Ninja Kidz TV,129 287 111 katselukertaa,3.37,/@NinjaKidz
_Bu9QLDTHX4,"Lyrical: Khud Ko Tere Paas | 1920 Evil Returns | Aftab Shivdasani, Tia Bajpai",101 902 403 katselukertaa,5.27,/@tseries
VuwboLzEM-0,"1920: The Evil Returns (2012) Full Hindi Horror Movie | Aftab Shivdasani, Sharad Kelkar, Tia Bajpai",95 970 239 katselukertaa,2.04.10,/@GoldminesBollywood
fzOPc-VtcTE,"Galliyan Returns Song: Ek Villain Returns | John,Disha,Arjun,Tara | Ankit T,Manoj M, Mohit S,Ektaa K",91 661 299 katselukertaa,2.45,/@tseries
GIrx2bRqm2o,"Mehbooba | Fukrey Returns |Prem&Hardeep | Mohammed Rafi, Neha Kakkar, Raftaar",83 261 110 katselukertaa,3.10,/@zeemusiccompany
9Q6gFxqt9SU,"Don Returns (Ranarangam) 2021 New Released Hindi Dubbed Movie| Sharwanand, Kajal Aggarwal, Kalyani",82 216 396 katselukertaa,1.59.48,/@GoldminesTelefilms
564-85qXPTA,Returning Ball छोड़कर कही नही जाएगी,79 585 168 katselukertaa,0.31,/@DEVKeFacts
nWbj7W_pD9U,"Dil: Shreya's Version (Lyrical) | Ek Villain Returns | John Disha Arjun Tara | Kaushik-Guddu, Mohit",76 150 342 katselukertaa,5.29,/@tseries
Zew5xMl7_y0,Baalveer Returns - Ep 233 - Full Episode - 12th November 2020,75 050 107 katselukertaa,21.26,/@SonySAB
Nlb_CjApjlU,Paul Walker return in fast x #trend #fastx #paulwalker  #subscribe,73 250 039 katselukertaa,0.22,/@KSFilmFocus
IcMUB8qY-qo,Ghani Bawri (Video Song) | Tanu Weds Manu Returns | Kangana Ranaut & R. madhavan,69 314 558 katselukertaa,2.10,/@erosentertainment
l4BSJZnEX_c,"Shaamat (Full Video) - Ek Villain Returns | John, Disha, Arjun, Tara | Ankit, Prince, Mohit, Ektaa K",68 205 474 katselukertaa,5.32,/@tseries
xAaNbu-1k4o,The Mummy Returns | Ashish Chanchlani,67 612 920 katselukertaa,18.54,/@ashishchanchlanivines
5PLnZj5vcAo,Baalveer Returns - Ep 170  - Full Episode - 17th August 2020,65 893 853 katselukertaa,21.49,/@SonySAB
1vUITVQ1yJM,Ranjit Bawa: CHANDIGARH RETURNS (3 LAKH) Full VIDEO | Jassi X | Latest Punjabi Song 2016,63 089 184 katselukertaa,5.51,/@tseriesapnapunjab
jfosQWnUOK8,"Dil: Ek Villain Returns |John,Disha,Arjun,Tara Raghav Kaushik-Guddu | Mohit S Kunaal V Ektaa Bhushan",62 578 786 katselukertaa,2.21,/@tseries
