Video Id,Title,View Count,Length,Channel
5nvVVcYD-0w,Book of Revelation Summary: A Complete Animated Overview (Part 1),6 655 886 katselukertaa,11.49,/@bibleproject
TxMMJjnLXHs,The Book Of Revelation,420 784 katselukertaa,3.02.18,/@lionofjudahmotivation
LJO7oX-QAl4,the WORLD is a STAGE (PART 4) (Documentary),27 984 katselukertaa,3.37.59,/@theghettogospelteam
f1VZSgwagtE,The Complete Holy Bible - NIVUK Audio Bible - 66 Revelation,298 144 katselukertaa,1.25.09,/@GODSABLE
wv2J0cMQQEw,The Book Of Revelation Is Unfolding Before Our Eyes 2023,78 651 katselukertaa,11.27,/@lionofjudahmotivation
T9Q5KxGnPKE,Blood Moons Point to Hanukkah:The Conception Day of Sept Revelation 12 2023 Sign. Pentecost Sign too,1 196 katselukertaa,59.38,/@christianfirepoppy
FGr9WcWuXf0,MOST people are NOT READY! (WARNING),34 357 katselukertaa,28.11,/@theghettogospelteam
Dn7YEXL-jL8,GOD'S JUDGEMENT OF KENYA'S REJECTED KING!,5 523 katselukertaa,14.16,/@revelationwisdomministries
ClUB7_8xjEw,Revelations (2015 Remaster),3 116 613 katselukertaa,6.50,/channel/UCaisXKBdNOYqGr2qOXCLchQ
fJpp8sF3FJI,"""Paradise"" Revelation 22:1-5 | Pastor Ray Montoya | 9-13-23 6:30pm CCL#11012691",69 katselukertaa,1.32.57,/@calvarychapelsouthwest6550
bF3JPv_-luI,Holy Bible Audio: REVELATION (Contemporary English) With Text,1 027 246 katselukertaa,1.23.25,/@HolyBibleChannel
4m2q5Fw8gwI,Audioslave - Revelations (Official Video),27 864 095 katselukertaa,4.13,/channel/UCbJHfnWtshjo6zJg9Y8XzBw
3Dh-QPe5JZ8,MYSTERY:  THE BOOK OF REVELATION,611 000 katselukertaa,2.26.01,/@GraceDigitalnetwork
DyzBOu_liPw,Revelation 19:1 (feat. Naomi Raine & Mav City Gospel Choir) | Maverick City Music | TRIBL,7 606 503 katselukertaa,6.39,/@TRIBL
In_RB6N4VIs,Last Warnings to Humanity - Revelation Chapter 14 | Full Documentary,54 723 katselukertaa,1.52.14,/@Whitespike77
_MwOTnyQ0XA,66 | Book of Revelation | Read by Alexander Scourby | AUDIO & TEXT | FREE on YouTube | GOD IS LOVE!,531 529 katselukertaa,1.10.28,/@ScourbyYouBible
a_T7zK5hkhQ,The Book Of Revelation In One Hour (With Greg Laurie),908 544 katselukertaa,48.23,/@greglaurie
43iFc26GR-o,Revelation: End Times,172 808 katselukertaa,55.51,/@treysmithnutshell
h2F_heQjN08,Occult Secrets of the Book of Revelation - ROBERT SEPEHR,81 148 katselukertaa,16.53,/@818encino
nh8CyqcTu3g,Revelation - Total Chaos (Official Audio),7 695 katselukertaa,3.05,/@GearboxDigital
