Video Id,Title,View Count,Length,Channel
2fm3H_ZC9ro,Ma Vie (feat. Yay),22 539 307 katselukertaa,3.54,/channel/UCBCD1nIuiH-d10_l6Q-8rRg
NFJ5rOnhlYY,Kidd Keo - Rockport Espacial - Kikiki,18 757 587 katselukertaa,3.20,/channel/UCBCD1nIuiH-d10_l6Q-8rRg
mqYTGW6mx7w,Kikiki (feat. Yay),4 560 967 katselukertaa,3.20,/channel/UCBCD1nIuiH-d10_l6Q-8rRg
uH6Kk_zHKYU,I'm Ballin (feat. Yay),3 517 141 katselukertaa,3.43,/channel/UCBCD1nIuiH-d10_l6Q-8rRg
3mLnrH8SMig,"Level Up (feat. Enry-K, Yay)",1 988 776 katselukertaa,3.38,/channel/UCBCD1nIuiH-d10_l6Q-8rRg
vcVd-arTVFw,Nani (feat. Enry-K),1 670 266 katselukertaa,2.33,/channel/UCBCD1nIuiH-d10_l6Q-8rRg
CUuauWsTchQ,Need for Speed : Back To Rockport City,1 003 177 katselukertaa,12.51,/@8ballWASD
JCK8tII9TFg,Need For Speed MOST WANTED | 2024 REMAKE |  Back to ROCKPORT,899 461 katselukertaa,1.58,/@ODONATACINEMA
7Wy5ql1-GmU,Starting a New Realistic City | Cities Skylines : Rockport 1,461 238 katselukertaa,20.22,/@Timeister
RSGt6iRMG-g,"Hear Old-Time Mainers Describe Life In Small Town Rockport, Maine",454 942 katselukertaa,38.36,/@DavidHoffmanFilmmaker
gUFUIKt4Xpk,KIDD KEO - ROCKPORT ESPACIAL - ENGANCHADO - ALBUM COMPLETO,333 291 katselukertaa,15.31,/@federamirez4555
D4rLZlSVfw4,"How to Install the Hampton Bay 52"" Rockport Ceiling Fan",258 871 katselukertaa,14.30,/@ceilingfans101
UPKG57NHJic,Rockport arrakis ; the gryphon,201 218 katselukertaa,8.14,/@MrTifou57
E05LIp_8IaM,"George Straits house key allegro, Rockport Texas",189 087 katselukertaa,1.13,/@haitran724
_BHsQjkU0-A,From Rockport to Palmont,177 295 katselukertaa,12.02,/@enoiseh
s62GodqIyBE,Building a Giant Industrial Port | Cities Skylines : Rockport 2,144 270 katselukertaa,18.23,/@Timeister
uAuDxSVGcbA,Need For Speed Unbound Back to Rockport,140 199 katselukertaa,24.24,/@nunhiramoto6628
MGPGZ6aoQxY,NFS Carbon: Rockport City race - Hwy 2001 [Imported from NFS:MW],129 684 katselukertaa,5.00,/@laymer9089
JV9fXa75NkE,"Tom Rush - No Regrets and Rockport Sunday - Kerrville Folk Festival, 2015",129 057 katselukertaa,8.53,/@drbobdrake
fEd7ff4zx3I,The Texas Bucket List - The Boiling Pot in Rockport,117 199 katselukertaa,5.58,/@TheTexasBucketList
