Video Id,Title,View Count,Length,Channel
VjL031bE9FA,Rudolph the Red Nosed Reindeer | Christmas Song For Kids | Merry Christmas,22 573 229 katselukertaa,2.31,/@TinydreamsStories
qOkt5d1dlT0,Rudolph The Red-Nosed Reindeer,224 051 katselukertaa,51.46,/@abeharder5358
SqQeHVpx08w,Rudolph the Red-Nosed Reindeer - The Movie (1998),24 656 katselukertaa,1.23.25,/@ajace1000
lN0g5lLPsU4,Rudolph The Red-Nosed Reindeer (1948) HOLIDAY CARTOON,1 609 364 katselukertaa,8.43,/@PizzaFLIX
fJQqOzkcHjg,Rudolph the Red Nosed Reindeer With Lyrics | Christmas Songs and Carols,14 604 645 katselukertaa,1.35,/@christmassongsandcarols
f1u7lHSMoIU,Rudolph The Red Nosed Reindeer FULL MOVIE 1080P HD 1964 TV Movie,211 931 katselukertaa,51.44,/@salstylesblogcom
DRF7ffrdhSM,Blurred Lines: The Stunning Case of Travis Rudolph | True Crime 2023,718 868 katselukertaa,1.03.07,/@thecrimeatlas
d9N_vC8Y2fg,Santa's Reindeer | Christmas Carols | Pinkfong Songs for Children,54 784 835 katselukertaa,1.52,/channel/UCcdwLMPsaU2ezNSJU1nFoBQ
YCcVhtolK7g,Reindeer Rudolph is in Danger | Super Panda Rescue Team 10 | Christmas Movie | Kids Cartoon |BabyBus,17 219 515 katselukertaa,28.36,/@babybus
TMnk3WEzK48,"Rudolph The Red-Nosed Reindeer And The Island of Misfit Toys (2001, Widescreen)",755 349 katselukertaa,1.15.28,/@shadowluigissecondchannel1495
1iuCwx4QDlU,Rudolph The Red Nosed Reindeer Christmas Song For Kids I Christmas Songs I Christmas Carols,14 044 878 katselukertaa,2.41,/@skgkidsrhymes
cEqu-KQPGnU,Christmas Songs for Kids with Blippi | Rudolph the Red Nosed Reindeer,10 056 968 katselukertaa,12.42,/@Blippi
BQgOhu6u6Aw,Rudolph | The Red Nosed Reindeer Story | Stories for Teenagers | @EnglishFairyTales,4 498 970 katselukertaa,8.12,/@EnglishFairyTales
lM6mDRhKAcA,Rudolph The Red Nosed Reindeer - The Kiboomers Preschool Songs & Nursery Rhymes for Christmas,32 614 818 katselukertaa,2.28,/channel/UCLy6-72NzYpFztbJ7jNEMkg
y4SpQMom8t8,Rudolph's Nose | Christmas Songs for Kids,8 033 627 katselukertaa,1.39,/@Mapleleaflearning
44bL90HP0Ys,Gene Autry - Rudolph the Red-Nosed Reindeer (Audio),1 719 083 katselukertaa,3.09,/@geneautryvevo665
a1BBvJHaGfM,I Made 18th Century Stays Completely by Hand,41 355 katselukertaa,32.39,/@NicoleRudolph
mpILFd064Zk,Rudolph the Red-Nosed Reindeer with Lyrics Actions Movements | Kids Christmas Song | Sing Along,244 705 katselukertaa,2.56,/@SingwithBella
4zT0RNntvzM,Annoying Orange - Storytime: Rudolph the Red Nosed Reindeer!,1 015 318 katselukertaa,4.07,/@AnnoyingOrange
2QevZ5z9Cq4,"MJ Lenderman - ""Rudolph""",43 664 katselukertaa,3.40,/@antirecords
