Video Id,Title,View Count,Length,Channel
2dJdHMpCLIg,"L-1.5: Process States in Operating System| Schedulers(Long term,Short term,Medium term)",1 184 399 katselukertaa,20.54,/@GateSmashers
2h3eWaPx8SA,Process Scheduling,456 834 katselukertaa,11.19,/@nesoacademy
wA-Iy6ThYz4,Event/Scheduler calendar in asp.net MVC application,151 707 katselukertaa,40.54,/@souravmondal45
9pdVk1buyv0,CPU Scheduling in Operating System | Process Scheduling algorithms | Hindi | Easy Explanation,147 945 katselukertaa,12.24,/@StartPracticing
pro8cU5Uzdg,Types of Schedulers in OS,135 866 katselukertaa,8.07,/@easylearningwithnisha2491
7SSeNn-H-UU,How To Fix Video Scheduler Internal Error BSOD On Windows 10,132 650 katselukertaa,3.26,/@lcp03o
IWbPJz28p3Q,How To FIX Nvidia Cannot Continue Task Scheduler Service Not Running Tutorial,131 141 katselukertaa,2.58,/@ComputerSluggishTutorials
DVUlkU2AxgQ,How To Use Task Scheduler On Windows10 | Auto Start Programs or Scripts,123 389 katselukertaa,3.41,/@ComputerSluggishTutorials
JhmoI9nTet4,CPU Scheduling | Processor | OS | Lec-47 | Bhanu Priya,108 184 katselukertaa,10.46,/@education4uofficial
WNWSQOynrl0,What is Project Scheduling? - Project Management Training,89 415 katselukertaa,3.28,/@ProjectManager
tgjlJh_hv0k,FIX Error 1068 - Task Scheduler Cannot Start,67 685 katselukertaa,2.41,/@MDTechVideos
fReI_-xNvOw,Schedule your next service online with Santa Margarita Ford | Online service scheduler,69 667 katselukertaa,0.18,/@SantaMargaritaFord
7kWsjZcf1eg,How to fix the video scheduler internal error on Windows 10,66 624 katselukertaa,2.05,/@asefTutorials
GpYx9f-TVYA,How to Fix ' Task Scheduler remote computer not found ' (Task Scheduler Problem),63 126 katselukertaa,2.03,/@GameMasterAddict235
uxV-3947fiM,Spring Boot Job scheduler,60 523 katselukertaa,14.22,/@Javatechie
Wjt-ayvw1s8,5 Best Meeting Scheduler Apps (Calendar Assistant Tools),53 063 katselukertaa,10.58,/@Simpletivity
2zuTWra998I,iRobot Roomba Scheduler troubleshooting beeps,51 485 katselukertaa,1.31,/@kd8bxp
pwC2IFovnBM,"Part-1:Javascript calendar,events,booking and scheduler  in Javascript tutorial",50 385 katselukertaa,40.29,/@byteshift2753
ON2uRHlt_GI,Run Programs Automatically Using Windows Task Scheduler,48 382 katselukertaa,9.47,/@Britec09
