Video Id,Title,View Count,Length,Channel
t8XuHmHcKuc,Cursed Mosin PU scope adjustment,27 559 699 katselukertaa,0.16,/@TenaciousTrilobite
4unPxIAeVc0,*NO-SCOPE* KILLS ONLY Challenge in Fortnite Battle Royale,21 302 921 katselukertaa,14.24,/@LazarBeam
Y9GqHGlRU4o,BOUNCING NO-SCOPE ARENA in Fortnite Battle Royale,16 459 684 katselukertaa,10.04,/@LazarBeam
FW3k80Vuq34,Texas Hunter Eliminates Hundreds of Feral Hogs with Military-Grade Sniper Scope,16 005 714 katselukertaa,16.56,/@Ultimatenightvision
hfKYgh2ohvI,PANDA USE 15X SCOPE,15 537 202 katselukertaa,16.45,/@Panda.
S4VurqsSf_A,Winchester 670 30-06 POV Scope shot,8 091 983 katselukertaa,0.08,/@canadianclassics
4VzuEfaqLW0,Sniper using $4500 REAL Thermal Scope Ruins EVERYONE's GAME (UNFAIR),7 417 457 katselukertaa,8.15,/@SiloEntertainment
wmvFkasjmMw,ANTIMATTER INDUSTRIES SCOPE SWITCH - TRAVIS HALEY #SHORTS,6 606 828 katselukertaa,0.29,/@HaleyStrategicPartners
L2-LXpFTsIQ,2021 Hog Hunting w/ATN scope in Texas,4 800 374 katselukertaa,5.23,/@tomhjr63
Om3B42f9qOg,GTA Online Diamond Casino Heist Scope Guide (All Access Points),4 132 853 katselukertaa,6.05,/@GamersHeroes
1P7luB9T3ws,"GTA Online Cayo Perico Heist Scope Out Guide - ALL Points of Interest, Secondary Targets, Entries",3 722 393 katselukertaa,9.31,/@TGG_
f5YWXrZdNpA,The US Military's New Smart Optic that Aims For You. The XM-157,3 500 255 katselukertaa,30.58,/@GarandThumb
O7Z0Og-t4zI,How to Sight in a Rifle Scope at 100 Yards!,3 371 729 katselukertaa,1.00,/@RonSpomerOutdoors
pV1yHW8BtEw,POV: your scope now has unlimited range,3 314 576 katselukertaa,1.05,/@Hoot
rId18_lgBv0,How To Sight In Your Riflescope,3 279 583 katselukertaa,5.51,/@VortexOpticsUSA
Z5XeylD-1rE,I Bought Fashion from the FUTURE,3 184 957 katselukertaa,12.53,/@hopescope
k1J6W7NiAKw,Mounting Rifle Scope - Leupold Mark 5 HD,3 056 913 katselukertaa,0.31,/@reeseontherange
sWvm9fuAq6Y,✅3X Scope Sensitivity Settings Pubg Mobile  gyroscope 3 x zero recoil sensitivity 3x best settings,2 775 727 katselukertaa,0.35,/@TANIMYT
lLirsAFpsfE,The Easy Way to Sight-In an Air Rifle Scope,2 491 485 katselukertaa,3.02,/@ArcherAirguns
3QbLCHTEADA,Trooper 360 No Scope One Taps Seatbelt Violator,2 416 775 katselukertaa,4.01,/@DonutOperator
