Video Id,Title,View Count,Length,Channel
L6P3nI6VnlY,Extraction | Official Trailer | Screenplay by JOE RUSSO Directed by SAM HARGRAVE | Netflix,18┬а920┬а171 katselukertaa,3.03,/@Netflix
Vm1xivfPG4k,рдШрд░реЛрдВ рдХреЗ рдЕрдВрджрд░ рдорд┐рд▓реА 4 рд╕рдмрд╕реЗ рдЕрдЬреАрдмреЛрдЧрд░реАрдм рдЪреАрдЬреЗрдВЁЯШ▒ | By Mr.Screenplay #shorts,15┬а454┬а121 katselukertaa,0.54,/@mr.screenplay
iykcQI5b_qo,рдЖрдЦрд┐рд░ рдпреЗ рд▓реЛрдЧ рдЗрддрдирд╛ рджрд┐рдорд╛рдЧ рд▓рд╛рддреЗ рдХрд╣рд╛рдБ рд╕реЗ рд╣реИ ЁЯдп | Mr.Screenplay #shorts,14┬а454┬а969 katselukertaa,0.54,/@mr.screenplay
RUgsVucb_hc,Power Of Time рджреЗрдЦрдиреЗ рдХреЗ рд▓рд┐рдП рддреИрдпрд╛рд░ рд╣реЛ рдЬрд╛рдУ!тМЪ | By Mr.Screenplay #shorts,11┬а628┬а393 katselukertaa,0.48,/@mr.screenplay
I0LjDnc9j5M,рджреБрдирд┐рдпрд╛ рдХреА рд╕рдмрд╕реЗ рдЫреЛрдЯреА рдФрд░ CUTE рдЪреАрдЬрд╝реЗрдВЁЯдй | By Mr.Screenplay #shorts,9┬а841┬а785 katselukertaa,0.57,/@mr.screenplay
pFUKeD3FJm8,The Dark Knight тАФ Creating the Ultimate Antagonist,5┬а630┬а922 katselukertaa,11.00,/@LessonsfromtheScreenplay
ba-CB6wVuvQ,Whiplash vs. Black Swan тАФ The Anatomy of the Obsessed Artist,5┬а543┬а911 katselukertaa,16.37,/@LessonsfromtheScreenplay
zWA7ulgq0UQ,Best ScreenplayЁЯТеrest of Indian CinemaЁЯФетЭдя╕П#kadaisivivasayi,5┬а254┬а985 katselukertaa,0.58,/@Short-circuit_44
tu6jN-t6evI,рдЬрд╛рдирд╡рд░реЛрдВ рдХреЗ рдЕрдВрджрд░ рд╕реЗ рдорд┐рд▓реЗ рдЕрдЬреАрдмреЛрдЧрд░реАрдм рдЪреАрдЬрд╝реЗрдВ ЁЯШ▒ | By Mr Screenplay #shorts,4┬а616┬а394 katselukertaa,0.45,/@mr.screenplay
9pNBcrOuf0o,рджреБрдирд┐рдпрд╛ рдХреА рд╕рдмрд╕реЗ рдЫреЛрдЯреА рдФрд░ CUTE рдЪреАрдЬрд╝реЗрдВЁЯдй (PT-2) | By Mr.Screenplay #shorts,4┬а562┬а475 katselukertaa,0.53,/@mr.screenplay
muFzMAsGmP4,"""2013 Independent Spirit Awards: Best Screenplay Nominees"" тАФ A Bad Lip Reading",3┬а824┬а370 katselukertaa,2.06,/@BadLipReading
uL0atQFZzL8,If You Can't Answer These 6 Questions You Don't Have A Story - Glenn Gers,3┬а401┬а427 katselukertaa,14.57,/@filmcourage
5tQ-hfJLOHc,Each FNF character sings Screenplay(vs AGOTI),3┬а313┬а378 katselukertaa,1.00,/@angiefiercevideos
CF3lFPW4E1o,Gone Girl тАФ Don't Underestimate the Screenwriter,3┬а173┬а036 katselukertaa,7.07,/@LessonsfromtheScreenplay
4H-igyDAbhA,I had sold the screenplay for $100  @sylvesterstallonefanpodcas367,2┬а681┬а239 katselukertaa,0.57,/@RiseNetworkTVOfficial
KADoPXknQCI,No Country for Old Men тАФ┬аDon't Underestimate the Audience,2┬а484┬а409 katselukertaa,12.19,/@LessonsfromtheScreenplay
hEgsIV98ZmU,How To Write Great Dialogue,2┬а249┬а577 katselukertaa,16.42,/@TheCloserLook
L8Ed6v7tMug,Screenplay But Different Characters Sing It (Everyone Sings Screenplay) - Friday Night Funkin',2┬а207┬а359 katselukertaa,1.44,/@Crrano
VYsYwxsuCvg,рокрпБроЯро┐роЪрпНроЪ Saree-роХро╛роХ рокрогрпНрог ScreenplayЁЯдг #seetha #suhasinimaniratnam #somethingspecial #shorts,2┬а133┬а900 katselukertaa,0.55,/@Cineulagam
bgGt0bnu5nU,Taika Waititi's SCREENWRITING TRICK for writing better screenplays! #shorts,2┬а127┬а511 katselukertaa,0.57,/@OutstandingScreenplays
