Video Id,Title,View Count,Length,Channel
AaVoGtJDN84,How to hide screw #shorts,171 449 825 katselukertaa,0.31,/@ToolTips
Z69GfizC5Yc,Amazing flooring screw gun,115 058 537 katselukertaa,0.14,/@thes-tech
X1PQs0Yxauo,I Turn a Stainless Steel Bolt into a Beautiful little Hunting Knife,99 185 022 katselukertaa,5.57,/@BobbyDukeArts
gqELqRCnW6g,♪ Screw the Nether (Moves Like Jagger Parody),60 326 536 katselukertaa,4.03,/@yogscast
0bOUOCo6NLQ,kostromin — Моя голова винтом (My head is spinning like a screw) (Official Video),60 031 819 katselukertaa,2.21,/@LEGACYMUSICLABEL
XOvOaTKko40,How to remove spited and broken screws - life hacks #shorts,59 724 650 katselukertaa,0.53,/@ToolTips
9f8wc1-EcpU,$-Crew - J’aurais pas dû,51 724 208 katselukertaa,3.47,/channel/UC9qIxR3lFMKkdC3SVtbxgqQ
SfkWI9L-854,Screw the box,43 645 139 katselukertaa,3.08,/@DaanVerhoeven
Yu_LW6o-NzE,kostromin - Mоя голова винтом (my head is a screw) English Lyrics,38 736 059 katselukertaa,2.47,/@itsTikTokTunes
QtP6arjZmzI,T-Pain - Chopped N Skrewed ft. Ludacris,33 994 400 katselukertaa,4.22,/channel/UCwff7OoSHp3el6GqnSwcSdA
ZtCa1JBu9gM,When you SCREW UP but it's ok...,30 526 928 katselukertaa,0.31,/@Aphmau
96q_PL13X3c,tightening the loose screw with copper wire #shorts,30 292 906 katselukertaa,0.16,/@nstbrightideas
sky5dA7B8Vw,Screw Retained Implant Supported Bridge #shorts,29 311 032 katselukertaa,0.27,/@teethtube
UGrrLykPJZQ,Screw Removal from Foot,28 579 252 katselukertaa,0.41,/@MatthewHarbMD
6fAYdL_ydRE,Weight testing an ice screw,27 014 422 katselukertaa,1.00,/@NoahKane
fyoADuq_v9w,$-Crew - On va le faire,22 834 131 katselukertaa,3.57,/channel/UC9qIxR3lFMKkdC3SVtbxgqQ
p6rTRQiGrgY,Magnetic Adjustable Screw Drill Bit 2021,21 276 615 katselukertaa,0.40,/@DIYFans
fMe2bJWEUA4,The secret of experienced craftsmen! How to make a wood cutter from a self-tapping screw!,20 245 359 katselukertaa,0.27,/@MrNik01
4TENEvVW4eU,Know about Chemistry Bolt,20 222 238 katselukertaa,0.32,/@Mystery_Solver
VNjyztyH168,LooseScrew,19 349 646 katselukertaa,2.55,/channel/UC-bXlG2xlMylwcaQigx-XmQ
