Video Id,Title,View Count,Length,Channel
tWJ4ZhXPLYs,SSG Splurge - Secondary (Official Music Video)  ​⁠@ShotByMazi,27 346 katselukertaa,1.56,/channel/UCMXNVoTOpBqCSYT-O69cixQ
kDegppeQ1vg,Switching To Secondary Is Faster Than Reloading,3 172 052 katselukertaa,0.25,/@JohnnyQ
kQdPrGJZEYQ,Secondary school examination be like:,32 336 katselukertaa,2.09,/channel/UCvG_RH3tAekGN5rPUVUmcIg
qgUnBUi9hNQ,What Is Soldier's Best Secondary?,399 454 katselukertaa,7.48,/@elmaxoTF2
tfq3ZVzdBD8,RL Grime - Secondary feat. Problem,155 957 katselukertaa,3.08,/@FoolsGoldRecs
rNIc0GhFWyM,BRITISH SECONDARY SCHOOL TIKTOK COMPILATION,152 784 katselukertaa,3.00,/@ZaronLane
thnoUraeoGs,Moving Up! The transition to secondary school (SUBTITLED),28 236 katselukertaa,4.11,/@AnnaFreudNCCF
7TNSwAM_n-Q,GRWM My First Day At Secondary School *Real Morning Routine Week Day | Ruby Rose UK,290 957 katselukertaa,7.42,/@rubyroseuk
3sDJvFl0Djw,What Are Secondary Emotions?,60 592 katselukertaa,8.23,/@Katimorton
nl7mt0BuJog,"Ndindika Secondary School, Laikipia Academic Improvement Coaching-Kennedy Wangari",15 katselukertaa,6.43,/@dr.k.m.wangarimotiversity9045
KyLDhBMmm9Q,Things you should know before going into Secondary School | This is for the new Year 7s | Ciana Ubah,3 070 katselukertaa,9.33,/@cianaubah5291
cqXHO7bTPnw,Primary vs Secondary Sources,1 068 962 katselukertaa,2.59,/@robredmon7367
YcKK-xT29L4,The Truth About My First Term at Secondary School *Q&A & StoryTime | Ruby Rose UK,81 767 katselukertaa,14.26,/@rubyroseuk
_cf_eOd0U2s,Secondary,127 715 katselukertaa,3.09,/channel/UCtR4nrS3zXFkkT9Mxz5DnJw
XIUVa8zPkGE,"When A Primary Teacher, Covers Secondary!",1 657 789 katselukertaa,0.26,/@mrthomasenglish
py4HaueW50Q,Secondary Dominants- Write Better Chord Progressions! [MUSIC THEORY / SONGWRITING],571 678 katselukertaa,11.38,/@SignalsMusicStudio
UAkJrRRUi0Y,a day in the life of a british secondary school..! || pure CHAOS || cheeky schoolblog:) || engenelvr,10 646 katselukertaa,13.13,/@jellsss
TgU1BcDStK0,Primary vs. Secondary Sources,255 673 katselukertaa,4.19,/@minnesotahistory
bmquqAP2w_8,Primary Colors Song  and Secondary Colors Song,7 461 894 katselukertaa,2.59,/@klt
U9mRMNAEmk8,"6 Signs It's Not Anxiety, It's Secondary Trauma",67 760 katselukertaa,5.28,/@Psych2go
