Video Id,Title,View Count,Length,Channel
6JM6o4uqLmw,Securities Explained in One Minute: From Definition/Meaning to Examples,91 734 katselukertaa,1.02,/@OneMinuteEconomics
PRXXHy2N-8E,What are Securities?,162 306 katselukertaa,3.30,/@KALKINE
MTz9b9ctbmM,Securities,12 943 katselukertaa,4.05,/channel/UCogPVGm2Rr1z-se9iBxHMKQ
VpOtVMbR8bU,Mortgage-Backed Securities (MBS) Explained in One Minute: Did We Learn Our Lesson?,134 503 katselukertaa,1.49,/@OneMinuteEconomics
DqpIGNwVVWQ,What are Securities? [ The ultimate Securities Definition ],118 674 katselukertaa,2.11,/@NapkinFinance
CFUHR89QLj8,Introduction to Securities Markets,8 394 katselukertaa,1.02.47,/@BizLaw
f6suaDGWmOo,Skepta - No Security,27 361 940 katselukertaa,3.43,/channel/UCcfVrE3mmeQZ_RN3u5cUECA
HYCrT2sigKM,Debt Securities And Equity Securities,53 420 katselukertaa,1.41,/@weihuang2864
oosYQHq2hwE,Mortgage-backed securities I | Finance & Capital Markets | Khan Academy,660 582 katselukertaa,7.57,/@khanacademy
YBYKFsZvgcc,UUSI Robotti on KAUHEA (FNAF: Security Breach) #2,203 048 katselukertaa,16.37,/@Paqpa
p7HKvqRI_Bo,How does the stock market work? - Oliver Elfenbaum,8 113 131 katselukertaa,4.30,/@TEDEd
itrFdjOj588,Overview of Securities Law: Module 1 of 5,11 915 katselukertaa,15.52,/@LawShelf
GAal2K6fzeM,SECURITY ANALYSIS (BY BENJAMIN GRAHAM) | PART 1,270 337 katselukertaa,16.12,/@TheSwedishInvestor
feDw649zekw,What are Mortgage-Backed Securities? (2008 Financial Crisis Explained),136 745 katselukertaa,20.29,/@ConcerningReality
uI2vhCitTBw,What's the Difference Between Bonds and Stocks?,264 003 katselukertaa,3.36,/@TDAmeritrade
mEnCKNIb0Bs,Securities Trading Market Infrastructure,201 866 katselukertaa,7.22,/@telekurs007
fHQuooCiDUE,Crypto Platforms & Securities Laws | Office Hours with Gary Gensler,7 359 katselukertaa,3.56,/@USSECGov
ZCFkWDdmXG8,Explained | The Stock Market | FULL EPISODE | Netflix,12 900 076 katselukertaa,17.34,/@Netflix
hXN5Bn1o41U,Securities Markets (Definitions and Concepts),9 908 katselukertaa,26.21,/@glenramos3538
