Video Id,Title,View Count,Length,Channel
ELakhaGKoB0,"Selection, The - Unaired 2012 Pilot",218 757 katselukertaa,44.38,/@Media_Garage
Ee0gMl_imgE,Lil Tecca - Selection ft. Skrillex & DJ Scheme (Official Lyric Visualizer),568 844 katselukertaa,1.41,/channel/UCOlxqtcKc-HBEQJgDsylyhA
VQ8hrrG9tcI,Selected Sessions Meduza Iceland DJ Set,3 602 202 katselukertaa,1.10.47,/@SelectedBase
7_bT6QRaX90,"AYDEN LOYDE ° SELECTION : Vol. 1 (KREAM, MEDUZA, Vintage Culture, ARTBAT, Kx5 & Anyma) [House Mix]",1 559 222 katselukertaa,1.00.00,/@aydenloyde
t0oGDeNj_AA,"DJ ArtemiY Presents: SELECTION PART 1 (KREAM, MEDUZA, HARRISON, SHOUSE, GOODBOYS) (RELAX HOUSE MIX)",277 590 katselukertaa,1.20.00,/@djartemiy
v_9qEOENM9M,Selected Sessions Dom Dolla Belgrade DJ Set,2 347 524 katselukertaa,1.27.02,/@SelectedBase
-pdWIruMUjo,NØ SIGNE - Selection (Official Audio),60 963 katselukertaa,2.42,/@hexagon
_k0MjVjU8jk,The Selection | Trailer | Netflix,2 455 295 katselukertaa,3.07,/@GingerGirl
bFehguB4WFI,Selected Sessions Aaron Hibell Iceland DJ Set,443 120 katselukertaa,1.12.16,/@SelectedBase
UaMVSo2bMVM,"Hamilton Police Services Board Selection Committee - September 14, 2023",40 katselukertaa,1.49.32,/@InsideCityofHamilton
aLpu764Fkpk,"Eric Selects: Vol. 1 (Anyma, MEDUZA, Vintage Culture, ARTBAT & KREAM )",2 395 602 katselukertaa,35.38,/@EricMusic1
SNoQQpcPllo,"AYDEN LOYDE ° SELECTION : Vol. 2 (MEDUZA, CamelPhat, Anyma, KREAM, SHM, Afterlife) [Techno Mix]",231 614 katselukertaa,1.00.00,/@aydenloyde
9o5cjNIQ2vA,U.S. Navy Special Operations Forces SELECTION TRAINING,2 592 051 katselukertaa,45.00,/@TimesArchives
3O-8BceNdm8,"War and Remembrance - ""Selection"" Scene at Auschwitz-Birkenau",2 266 487 katselukertaa,10.39,/@NyJazzGuit
9WENMrl_wNw,the selection is one of the WORST book series (and i absolutely love it),123 686 katselukertaa,56.20,/@ainsleesbookclub
vE9x7zj_QVg,an unhinged recap of the selection,366 297 katselukertaa,21.48,/@AmandaTodhunterOfficial
4o34FucEc-s,"AYDEN LOYDE °SELECTION Presented by BLASTUK : LAB: (KREAM, MEDUZA, Vintage Culture, ARTBAT, Kx5)",32 753 katselukertaa,1.00.00,/@BlastUKHQ
n36VzYd_wiQ,SELECTION - Numbru wang (COVER),13 788 katselukertaa,4.37,/@selection7941
TcxEZ2nwnLE,Selection Live - Janji (Cover),5 806 katselukertaa,4.26,/@selection7941
