Video Id,Title,View Count,Length,Channel
iPtmDXlRR84,Configure Sendmail in Redhat Enterprise Linux (RHEL) | Setup Mail Server in Linux | Nehra Classes,21 458 katselukertaa,8.07,/@NehraClasses
BgGRS-i7x5A,Session - 150 | Mail Transfer Agents | SMTP | Sendmail Configuration in Linux | Nehra Classes,6 370 katselukertaa,1.35.06,/@NehraClasses
SJCClJ7yMKY,How to Configure SMTP on sendmail ? Install Sendmail on Ubuntu 20.04 | PHP Mail configuration,5 068 katselukertaa,4.29,/@EasyTutz
ylGr-hri-pM,"Install & Configure Sendmail in Linux Ubuntu , Fedora , Redhat",18 614 katselukertaa,9.35,/@linuxfantasy4913
XYLzDp8LBXk,Linux - How to send emails from linux terminal,31 883 katselukertaa,2.46,/@ElricIT
kO4NzlAA9vQ,How to Send Email from Linux using SendMail Hindi | Linux SENDMAIL Tutorial,34 038 katselukertaa,10.02,/@MPrashant
Re1MAO6jOLE,Lessons Learned from Sendmail,2 067 katselukertaa,45.22,/@EuroBSDcon
biREpjEQMQU,Pract 16 : Install & Configure Sendmail Server on RHEL 6,3 825 katselukertaa,6.28,/@MSDGurukul
ve7pC3aeewY,How to install & configure Sendmail on CentOS 7,24 255 katselukertaa,22.38,/@Fakharali087
75VA7czxwcA,Oracle Cloud Infrastructure: Email Delivery via sendmail,4 407 katselukertaa,9.03,/@CardanoBook
2ysThivkN3I,Masquerading domain using Sendmail | Sendmail masquerade outgoing email address,6 578 katselukertaa,9.12,/@networknutsdotnet
YLXq3Jo6Crs,What is sendmail and How to install Sendmail?,1 169 katselukertaa,2.46,/@rickydeane
6y_czpK8_Hg,[Solved] Send email from localhost/WAMP Server using SENDMAIL,14 394 katselukertaa,15.48,/@progFrog
_L4T7klci10,simple sendmail on AIX,587 katselukertaa,4.22,/@xakepeg
II3C3VlGboE,Linux sendmail app using gmail as relay to send automated emails,8 292 katselukertaa,7.57,/@asbat88
5Cd5FR4AuYI,How to install dovecot and sendmail  | Linux mail server (CentOS/RHEL),1 896 katselukertaa,47.49,/@NetITGeeks
RaCOBIe6Pqg,Configure Sendmail in Rocky Linux  | Setup Mail Server in Linux | Gmail as a Sendmail Email Relay,1 295 katselukertaa,11.20,/@TeknoPathShala
EqSsCK3aQUc,sendmail server configuration in centos 6,6 316 katselukertaa,6.27,/@LinuxTopic
