Video Id,Title,View Count,Length,Channel
kj9_ArUPCaI,"""The Settlements"" (Full Story) Scary Stories from The Internet | Creepypasta",214 539 katselukertaa,5.00.01,/@Darksomnium
JKT7cSFf2ic,Evolution of settlements,226 581 katselukertaa,4.09,/@johnlanser1586
idOFshUkBro,A New Era for the Survival Genre! - Settlement Survival Full Release (Part 1),921 679 katselukertaa,28.30,/@PravusGaming
5WqlfDIDgjs,"Settlement of Manouchehr nomadic family, clearing the place and preparing dinner",7 248 katselukertaa,35.05,/@GILLAS71
ecAsn4osLm0,"I Forced People to Work for 19,577 Years on My Nightmare Kingdom - Settlement Survival",8 003 128 katselukertaa,22.41,/@LetsGameItOut
3hZtp3P_pB4,Haikyuu!! OST - Settlement,239 894 katselukertaa,3.09,/@ShirayukiKitomiOST
E0uLbeQlwjw,"Israeli settlements, explained | Settlements Part I",7 432 302 katselukertaa,8.06,/@Vox
ZxMvJV9lG3k,Settlements,817 742 katselukertaa,12.20,/@Runesmith
w3tJIzraamY,"Authorising, Clearing and Settlement",8 556 katselukertaa,1.49,/@elavoneurope
hLGkUhm29DM,Fallout 4: Sim Settlements 2 - How To Rebuild The Commonwealth,93 794 katselukertaa,48.51,/@ManyATrueNerd
bz9mCTLqdQs,"How to Get a $1,000,000+ Settlement",61 073 katselukertaa,35.59,/@braniganrobertsonlaw
GcJo7OiVcxg,Cell phone video key to settlement in Kansas City police excessive force lawsuit,278 496 katselukertaa,5.22,/@KSHB41
5KWeosW8u4w,Minivan - Max Level ( 30 ) ! The Settlement | Last Day On Earth Survival,12 244 katselukertaa,8.07,/@elkolasa
eOoLOE4bdVE,The Home Loan Settlement Process (Australia),6 151 katselukertaa,3.39,/@Lendiau
B6L9mS9ti6o,Why Israeli settlements don’t feel like a conflict zone | Settlements Part II,3 401 006 katselukertaa,10.56,/@Vox
zuytX6ZUoLM,'SETTLEMENT' - Oikawa Tooru - AMV (Haikyuu!),79 188 katselukertaa,1.44,/@hoshiedits
ZhJtBYwiW5M,LARGEST SETTLEMENT IN HISTORY! Crazy cop got what he deserved! EPIC ID REFUSAL and ARREST!,123 592 katselukertaa,18.27,/@thepolicecontrol
F4aHI7u3LAQ,Settlement,1 950 katselukertaa,2.54,/@legalyou8412
greVzXc7yRg,"""The First Settlement"" Creepypasta | Scary Stories from the Internet",482 957 katselukertaa,36.37,/@Darksomnium
vJ2anNRp3-E,Pre Settlement Inspection Checklist [Home Buying Steps to Settlement],11 659 katselukertaa,6.31,/@MortgageBrokerAustralia
