Video Id,Title,View Count,Length,Channel
uMuJxd2Gpxo,The Sid Shuffle - Ice Age: Continental Drift,67Â 471Â 609 katselukertaa,3.26,/@officialiceage
6WVxKBThlds,This Ancient Secret Unlocks THE BLESSING CYCLE!,36Â 804 katselukertaa,37.37,/@sidroth
I8de8P6WbkE,***SID*** (Full Version),53Â 395 katselukertaa,4.18,/channel/UCxU6nh0LHqH9H4-fxWMGsgw
Mh-F3WKfNHQ,Recovering Fentanyl and Crystal Meth Addict-Sid (follow up),401Â 471 katselukertaa,22.21,/@SoftWhiteUnderbelly
NNyIuRUOEIA,"QUIZDUELL mit STEGI gegen ELIGELLA, WILLY, ELDOS & MUSTI ğŸ˜‚ğŸ§",75Â 863 katselukertaa,22.55,/@999sid5
9imC_jJcESY,Starting a New GUNCRAFTING Operation in DayZ!,41Â 686 katselukertaa,1.07.07,/@SidDayZ
n6DuZjePTXs,FULL EPISODE The Big Sneeze! | Sid The Science Kid | The Jim Henson Company,16Â 686Â 414 katselukertaa,27.08,/@JimHensonCompany
Cmq7o21E950,Making an Overpowered Base Using a NEW GIitch! - DayZ,43Â 560 katselukertaa,43.43,/@SidDayZ
msdmQDNxsfw,Sid Sriram: Tiny Desk Concert,448Â 034 katselukertaa,23.36,/@nprmusic
9cBH8ePF9-0,Sid the Science Kid - Sleep? Who Needs It?!,82Â 305 katselukertaa,25.24,/@ryanperez1999
CBVdIAE3nzM,I Become the World's Best Player...,1Â 043Â 600 katselukertaa,29.45,/@S2G
wM3YYnSaWW0,"Raiding a TOXIC Clan with a 40,000 Hour Team! - DayZ",69Â 349 katselukertaa,1.29.59,/@SidDayZ
rDyb_alTkMQ,Sid Vicious - My Way (Original and Complete Version),11Â 928Â 956 katselukertaa,4.17,/@LuisitoRN
YvM13FtbfNI,Sid the Science Kid - I Want To Be A Scientist,314Â 097 katselukertaa,25.39,/@ryanperez1999
kIHgKYqP4aw,"sid ""STE_FAN""",4Â 874 katselukertaa,7.49,/@SID.TV.
wxcG_C2cPP8,Drug Addicted Couple-Max and Sid,3Â 447Â 793 katselukertaa,27.27,/@SoftWhiteUnderbelly
4C2AC0iH8Kc,ã‚·ãƒ‰Â ã€ENAMELã€MusicÂ Video,334Â 320 katselukertaa,3.45,/channel/UC7jHTm2dDkhckKyOWUavuXg
wQoXaEu-6hg,Starting a Secret CASIN0 Operation in DayZ!,29Â 802 katselukertaa,57.16,/@SidDayZ
