Video Id,Title,View Count,Length,Channel
sa_cIOFfqrQ,I'm Looking for My Friends! | Sid the Science Kid | The Jim Henson Company,501 999 800 katselukertaa,1.34,/@JimHensonCompany
hP93gA8F6sM,Okey Oka Lokam Lyrical | Sashi Songs | Aadi | Sid Sriram | Srinivas Naidu Nadikatla | Arun Chiluveru,173 152 962 katselukertaa,3.30,/@adityamusic
5IEbR79kBPY,"Pushpa: Srivalli - Lyrical (Telugu) | Allu Arjun, Rashmika Mandanna | Sid Sriram | DSP | Sukumar",162 697 571 katselukertaa,3.45,/@adityamusic
ATElufr0OiE,Mudhal Nee Mudivum Nee - Title Track Video | Darbuka Siva | Sid Sriram | Thamarai,116 026 090 katselukertaa,5.36,/@SonyMusicSouthVEVO
a0U9GZoc-Bc,Toy Story: Sid Game  #Shorts,112 798 726 katselukertaa,0.24,/@markcannatarofilms
gPXRJtxQbWE,CID - सी आई डी - Mysterious Island - Episode 1349 - 4th June 2016,85 643 942 katselukertaa,42.28,/@SETIndia
lIKwGqNF3MQ,Sunset Di Tanah Anarki - Superman Is Dead,69 520 851 katselukertaa,6.56,/@dipanusantara3328
t_W_Ou3h2GA,"Sid The Hacker New South Indian Movies Dubbed in Hindi 2019 Full | Jiiva, Nikki Galrani",67 543 373 katselukertaa,1.48.43,/@GoldminesPremiere
uMuJxd2Gpxo,The Sid Shuffle - Ice Age: Continental Drift,67 476 219 katselukertaa,3.26,/@officialiceage
XzCgHNfdcYE,My Shrinking Shoes | Sid The Science Kid | The Jim Henson Company,63 329 291 katselukertaa,4.08,/@JimHensonCompany
fSS_R91Nimw,"Iktara Full Video - Wake Up Sid|Ranbir Kapoor,Konkona Sen Sharma|Kavita Seth|Amit Trivedi",62 820 424 katselukertaa,2.32,/@sonymusicindiaVEVO
5kzM6m33DTo,BRAHMĀSTRA (Telugu) | Kumkumala Video | Ranbir | Alia | Pritam | Sid Sriram | Chandrabose,53 400 019 katselukertaa,2.48,/@SonyMusicSouth
vDHBe1BA-Nk,"MAVINS - DOROBUCCI ft Don Jazzy, Tiwa Savage, Dr SID, D'Prince, Reekado Banks, Korede Bello, Di'Ja",50 579 871 katselukertaa,4.42,/@MavinRecords
lrSZH8L-0gI,Superman Is Dead - Jadilah Legenda (Video Clip),50 328 075 katselukertaa,5.04,/channel/UCvCPc6b_r2YVx9XA2dUgrjg
r9L5mfGSGTg,Maara | Yaar Azhaippadhu Song Lyric Video | Ghibran | Thamarai | Sid Sriram | Dhilip Kumar,43 613 402 katselukertaa,4.11,/@thinkmusicofficial
4tpmiGFxRg4,Sid The Science Kid | Getting a Shot: You can do it!,41 473 193 katselukertaa,28.08,/@HHS
-hsdXiwA4c0,UYIRE - Video Song Ft. Sid Sriram | Gauthamante Radham | Neeraj Madhav |Ankit Menon |Anand Menon |4K,41 314 264 katselukertaa,3.24,/@Muzik247
LVZcgxMqQxw,Did You Hear What Happened to the Tooth? | Sid The Science Kid | The Jim Henson Company,38 852 670 katselukertaa,2.42,/@JimHensonCompany
JXT2YfC298k,"Kaadhal En Kaviye - Lyrical | Salmon 3D | Sid Sriram | Vijay Yesudas, Jonita Doda | Sreejith Edavana",37 445 702 katselukertaa,5.12,/@LahariMusicIndia
YlMAhUrXFiM,Inayae | Full Video Song | Thadam | Arun Vijay |Sid Sriram |Madhan Karky |Magizh Thirumeni |Arun Raj,37 015 847 katselukertaa,3.53,/@SaregamaTamil
