Video Id,Title,View Count,Length,Channel
3H2PJbZXocs,Ani DiFranco - Simultaneously (Official Video),57 635 katselukertaa,4.29,/@righteousbaberecs
utwQNLyGRdI,How to Pronounce Simultaneously? British Vs. American English Pronunciation,28 036 katselukertaa,1.08,/@YouTubeJulien
_QHL_JkVgj8,South Park - Chef - Simultaneous,717 465 katselukertaa,3.19,/@robotmenace95
0Gscw5l_roo,Puscifer  -  Simultaneous,341 175 katselukertaa,6.46,/@Nicene325ad
xyWqGe-veOQ,Simultaneously Official Music Video,8 268 katselukertaa,4.12,/@ArmeenMusa
Kn96Bqp0pAY,How to Pronounce Simultaneously,12 662 katselukertaa,6.06,/@SpeechModification
PRFOplUmIDA,John MacArthur: Simultaneously Righteous and a Sinner,983 777 katselukertaa,59.46,/@LigonierMinistries
m5Y8DLVfOdI,5 Billionaires Simultaneously Arrived In The Slums Just To Visit A 20-year-old Poor Boy|Manhwa Recap,44 442 katselukertaa,6.25.16,/@MonkeyManhwaRecap-fw7su
54oHzERnPr4,How To Pronounce SIMULTANEOUSLY - American Pronunciation,62 514 katselukertaa,0.51,/@sozox
d6vyYvx8URw,Method of Elimination Steps to Solve Simultaneous Equations,1 685 733 katselukertaa,2.58,/@CowanAcademy
ZLnGDbpYoEk,Simultaneously Meaning,38 253 katselukertaa,0.27,/@SDictionaryEd
t-70OEcOfOw,Simultaneously | meaning of Simultaneously,1 806 katselukertaa,0.44,/@DefinitionOfTheWords
nxThhTE1fVg,How to solve simultaneous equations in just 2 secs?,210 138 katselukertaa,0.51,/@LKLogic
p7kH0pDmgiI,MEN - Simultaneously,12 327 katselukertaa,6.30,/@b1ng0phobic
ht36XUKySBI,How do I study 6 languages simultaneously?  Challenges and practical tips (Subtitles),288 587 katselukertaa,13.12,/@zoe.languages
r59oLimduIM,Solving simultaneous equations by substitution,246 016 katselukertaa,5.19,/@WhiteboardMaths
wOJ869XqF3g,Oh I love it and I hate it at the same time | LUBERTO EDIT,194 927 katselukertaa,0.18,/@justluberto
ib6pJdAfuIQ,The Maths Prof: Solve Simultaneous Equations part 1 (by elimination),1 165 839 katselukertaa,15.32,/@TheMathsProf
ThaxajdgCsY,Simultaneously Meaning with Examples,502 katselukertaa,2.54,/@ownurwords
wfkOJYmrSvg,Acquire Maxima and Edurus Potions and use them simultaneously Hogwarts Legacy,78 891 katselukertaa,1.59,/@WoWQuest
