Video Id,Title,View Count,Length,Channel
1s8tIWyg7g8,I skimmed out to the Kelly Slater wave pool again!!,155 652 505 katselukertaa,1.00,/@AustinKeen
1MStTMbWBdY,I LOVE math class because of this... 😉,57 932 734 katselukertaa,0.56,/@slaterkodish
6XJkPtxqWM8,AC Slater - Bass Inside (Official Music Video),33 796 745 katselukertaa,3.08,/@owsla
V4-MZtpcsTU,Lil Uzi Vert - 20 Min (slowed + reverb),33 229 549 katselukertaa,4.31,/@slater182
4lFelQQBriQ,"Heath Slater & Rhyno vs. The Miz and a bear: Raw, June 12, 2017",31 155 417 katselukertaa,3.52,/@WWE
a6tOLAp0MrA,Exchange of Hearts - David Slater (KARAOKE VERSION),26 151 646 katselukertaa,3.36,/@PinoyVideokeTambayan
CUw0uq91P3c,Voice TROLLING with Proximity Chat in WarZone 2! 😂,23 998 132 katselukertaa,0.25,/@slaterkodish
LduTM1dA79s,I called my Teammate a BOT then this HAPPENED! 😱,21 534 773 katselukertaa,1.00,/@slaterkodish
hGgfdo3wK78,Voice Trolling to *PICKUP* Girls in WarZone! 😂,19 315 062 katselukertaa,1.00,/@slaterkodish
OK4qE89oW04,Exchange of Hearts,18 951 309 katselukertaa,3.35,/channel/UCd1COec4GXjSyJRpybjw_TA
_tXe2EZcvaA,A Billionaire Mafia Boy is Obsessed with Me,17 897 268 katselukertaa,18.36,/@MSA.official
m_hGAPnBI2A,Rikishi vs. Heath Slater: Raw,17 796 919 katselukertaa,2.16,/@WWE
mfA0GzAX33c,I made this DADs Night in WarZone! 😂,17 187 942 katselukertaa,0.41,/@slaterkodish
XJ2xuVLZvAk,I found my DAD in WarZone then this HAPPENED!,14 997 484 katselukertaa,1.00,/@slaterkodish
0D3Dbz6-P2o,They didn't want me as their Teammate then this HAPPENED! 😱,14 266 608 katselukertaa,0.56,/@slaterkodish
ruy7KGf7rCA,frank ocean - in my room (slowed + reverb),12 476 161 katselukertaa,2.34,/@slaters666
fmg_JxSeZl8,My teammate SURPRISED me with this Birthday Gift! 😱,12 215 496 katselukertaa,1.00,/@slaterkodish
UIeZwRU8r-o,I Voice TROLLED to Pickup a Girl in WarZone! 😂,11 449 945 katselukertaa,0.48,/@slaterkodish
Gdxzno5Xp2Y,"Nymphomaniac: Volume 1 TRAILER 1 (2014) - Christian Slater, Shia LaBeouf Movie HD",11 374 624 katselukertaa,1.49,/@RottenTomatoesCOMINGSOON
pSYLjLpyZWw,So I Played Warzone With My Mom...,11 275 179 katselukertaa,0.51,/@slaterkodish
