Video Id,Title,View Count,Length,Channel
0junqD4BLH4,"Systemic lupus erythematosus (SLE) - causes, symptoms, diagnosis & pathology",2 144 735 katselukertaa,11.11,/@osmosis
g9dSVkqzs7k,"Systemic Lupus Erythematosus (SLE) - signs and symptoms, pathophysiology, investigations, treatment",380 780 katselukertaa,18.05,/@armandohasudungan
ift0xga6bhA,"Lupus: Symptoms, Risk factors, Pathophysiology, Diagnosis and Treatments.",144 461 katselukertaa,3.31,/@Alilamedicalmedia
sAjYwZjZeos,"Systemic Lupus Erythematosus Nursing SLE NCLEX Review: Pathophysiology, Symptoms, Treatment",191 292 katselukertaa,23.24,/@RegisteredNurseRN
lH9EgwoQDs0,"Lupus Signs & Symptoms (& Why They Occur) | Skin, Joints, Organ Systems",1 834 289 katselukertaa,11.22,/@jjmedicine
Cd69qYY_xGM,Systemic Lupus Erythematosus (SLE) in Children – Pediatrics | Lecturio,79 070 katselukertaa,8.17,/@lecturiomedical
yLydqNh81CM,Anti-dsDNA Mnemonic; Systemic Lupus Erythematosus (SLE),46 213 katselukertaa,3.46,/@MedicosisPerfectionalis
R9sMnyBXrCA,SLE-luento (22.5.2017),2 281 katselukertaa,1.05.55,/@SuomenReumaliittoRy
ieF-TooRizw,Systemic Lupus Erythematosus - CRASH! Medical Review Series,107 699 katselukertaa,27.24,/@pwbMD
Yl2RvydEOU8,"Lupus nephritis - causes, symptoms, diagnosis, treatment, pathology",61 179 katselukertaa,5.27,/@osmosis
Yko5kw-aIds,Systemic Lupus Erythematosus (SLE) - Medical-Surgical (Immune) | @LevelUpRN,87 390 katselukertaa,4.13,/@LevelUpRN
VfZ_DdrgxfQ,"Systemic Lupus Erythematosus (SLE): Symptoms, Diagnose And Treatment | Rheumatology",175 906 katselukertaa,11.47,/@YashodaHospitalsHyderabad
qQHeR34QeZQ,Systemic Lupus Erythematosus | SLE | Rheumatology | Revision Series | Harrison,13 699 katselukertaa,40.11,/@Medi-Lectures
GWZOcjZDwhM,"Systemic Lupus Erythematosus | SLE | Pathophysiology, Diagnosis, Diagnostic Criteria & Management",17 750 katselukertaa,16.43,/@LastSecondMedicine
kvDF4T3tKRo,Systemic Lupus Erythematosus : Mnemonic series # 25,26 139 katselukertaa,1.13,/@Medinaz
t3eZsCeRTpA,Systemic Lupus Erythematosus (SLE),3 181 katselukertaa,10.00,/@canadaqbank
dp1MRP5ZwxY,"Systemic Lupus Eythematosus (SLE), Causes, Signs and Symptoms, Diagnosis and Treatment.",4 454 katselukertaa,6.29,/@MedicalCentric
0WjNa5gQDmA,Systemic Lupus Erythematosus (SLE) Made Simple,158 557 katselukertaa,5.47,/@iMedSchool
cUEVwcblorE,Systemic Lupus Erythematosus (SLE),123 904 katselukertaa,21.42,/@drandrasfazakas
TP6vK0QYjiA,Systemic Lupus Erythematosus (SLE) | Ms. Renuka | Dr. Keerthi Talari | Yashoda Hospitals,43 881 katselukertaa,4.17,/@YashodaHospitalsHyderabad
