Video Id,Title,View Count,Length,Channel
YVkUvmDQ3HY,Eminem - Without Me (Official Music Video),1 751 624 392 katselukertaa,4.58,/channel/UCfM3zsQsOnfWNUppiycmBuw
bKDdT_nyP54,Akon - Smack That (Official Music Video) ft. Eminem,1 106 824 748 katselukertaa,4.12,/channel/UC6IBMCQ6-d7p41KHxOsq4RA
eJO5HU_7_1w,Eminem - The Real Slim Shady (Official Video - Clean Version),862 355 090 katselukertaa,4.29,/channel/UCfM3zsQsOnfWNUppiycmBuw
oh_ereAGUHo,Diana and Roma make a Giant slime,712 862 427 katselukertaa,6.46,/@KidsDianaShow
xmIKHROpeOY,Making Slime with Funny Balloons - Satisfying Slime video,576 175 512 katselukertaa,9.14,/@TaylorRS
CE8bCp1aGDM,Super Slime Sam HACE UNA PIZZA,323 504 963 katselukertaa,8.31,/@Slick_Slime_Sam_Spanish
u7tN_zftXh8,Roma and Diana are playing with slimes | Fun games with dad,290 386 435 katselukertaa,23.51,/@KidsRomaShow
Jddj8cthldw,Wendy Pretend Play Mixing Slimes & Fun Slime Challenge,233 774 376 katselukertaa,17.04,/@toysandcolors
95Rzsn-zjr0,"Rae Sremmurd, Swae Lee, Slim Jxmmi - Powerglide ft. Juicy J",203 195 996 katselukertaa,5.26,/channel/UC9iDw30SeRSm18kT98F5iAA
r5MR7_INQwg,The Real Slim Shady,199 849 123 katselukertaa,4.45,/channel/UCfM3zsQsOnfWNUppiycmBuw
NZiM0_4-j1k,Satisfying Slime ASMR | Relaxing Slime Videos # 1128,164 489 364 katselukertaa,8.03,/@csmrelaxing
PDPZTY-VqS8,Vídeos de Slime: Satisfatório & Relaxante #416,148 471 348 katselukertaa,10.22,/@videosdeslime
Q1dUDzBdnmI,"Beyoncé - Check On It (Video) ft. Bun B, Slim Thug",137 770 110 katselukertaa,3.31,/channel/UCuHzBCaKmtaLcRAOoazhCPA
G07HvNQXyMU,Satisfying Video l How to make Rainbow Pool into Mixing All My Glossy Slime & Fruit Cutting ASMR #99,114 864 694 katselukertaa,9.03,/@rainbowasmr5579
8qDDtm6BOfw,Slim Arms in 30 DAYs! | 8 Min Beginner Friendly Standing Workout ( No Equipment ),113 629 435 katselukertaa,9.29,/@AprilHanFit
8CKuWPRq2Ps,"Swae Lee, Slim Jxmmi, Rae Sremmurd - Guatemala",104 873 438 katselukertaa,4.45,/channel/UC9iDw30SeRSm18kT98F5iAA
5KfDx6G_urs,Nastya and dad make a giant multi-colored slime,83 931 099 katselukertaa,5.56,/@LikeNastyaofficial
TSmMv12TucI,SATISFYING WITH CLAY PIPING BAG & FOAM SLIME and GLITTER|Mixing Random Things Into GLOSSY Slime#1953,81 472 179 katselukertaa,17.20,/@boomslime7474
wCDIYvFmgW8,Fatboy Slim ft. Bootsy Collins - Weapon Of Choice [Official 4k Video],70 869 371 katselukertaa,3.46,/channel/UCCbP5cOWp9s75x_r6xq7LcQ
liEwQ6LwUYQ,#22 the slim shady moments #shorts #comedy #comedian,70 064 891 katselukertaa,0.21,/@WhateverFarley
