Video Id,Title,View Count,Length,Channel
W8aQk4lzOv4,My BIGGEST JACKPOT Ever On Ultimate Fire Link Slot,31 712 katselukertaa,20.40,/@NGSlot
7oNJzU5Xa6c,🔴 LIVE $10⮕$50 a Spin 🎰 High Limit Slots,43 717 katselukertaa,58.11,/@bcslots
WRqJ1LMADsg,"$1,156,282 GRAND Or $50,000 Max Out MAJOR ?",31 130 katselukertaa,11.33,/@NGSlot
egZMPki9PEI,The BIGGEST MAJOR JACKPOT I've EVER SEEN!,28 892 katselukertaa,38.19,/@sdguy1234
s4fnYF_Mxz0,EUREKA - Surprise JACKPOT! 🧨 MAX BET Bonus or Bust,77 512 katselukertaa,34.11,/@bcslots
hS598ertrwk,"LAS VEGAS SLOT MACHINE SAID I WON $24,000 (BUT I DIDN'T)",111 264 katselukertaa,33.12,/@VegasLowRoller
XbGjcEi_1LM,We Won Using The Mooch Betting Method At Yaamava Casino!!,18 312 katselukertaa,21.47,/@SCSlots
HRPSm03kiJQ,My Cousin Plays Slots With Greta At Aria Las Vegas!!,52 040 katselukertaa,28.42,/@PompsieSlots
96nzYjFcG80,Unlocking 3 Jackpots using the Fast Spin Strategy on Million Dollar Dragon Link,102 464 katselukertaa,18.30,/@LadyLuckHQ
vXW0bY_o_zE,Wheel Decide... but its ONLY PUSH GAMING SLOTS!! CRAZY LUCK!! (Bonus Buys),36 106 katselukertaa,49.22,/@WatchGamesTV
sqDVfLih00M,This NEW Slot Bonus Was WILD!!!,11 963 katselukertaa,14.06,/@leslieslots
6z5LCZUbvjU,Online Slot Bonuses with The Bandit!,37 282 katselukertaa,1.08.25,/@YouBanditTube
dLaWcr7gsk8,Quick Hits✨Stars & Stripes & Amazing Cherry Fever!,12 254 katselukertaa,17.43,/@SlotHopper
MBJrSlpRN2w,3 Jackpots and Nearly $116K Grand at Hard Rock Tampa,49 841 katselukertaa,18.06,/@LadyLuckHQ
6tQZkvcJNiw,Miracle Happens When You Don't Expect It - Casino Mega JACKPOT,88 285 katselukertaa,43.42,/@NGSlot
s0wlb4eHQlk,The Slot Attendant Told Me I Would WIN on This New Game!,41 603 katselukertaa,16.36,/@Ruby-Slots
M5AEvVXbEgM,I Hit a Super Rare Bonus on the NEW Buffalo Diamond Extreme Slot!,39 374 katselukertaa,13.29,/@Ruby-Slots
bRItmB_wYNk,I Played Wicked Wheel Slots Until I Won A Bonus!!!,14 723 katselukertaa,10.29,/@leslieslots
d2Oz4dg3IkQ,OMG 4 JACKPOTS! BUFFALO GOLD IS ON FIRE!!! 🔥🔥🔥,61 076 katselukertaa,33.43,/@MrMikeSlots
