Video Id,Title,View Count,Length,Channel
va_a2c-njng,Smugmug for sharing and backing up all your photos | SmugMug,4 389 katselukertaa,7.59,/@amandalittlecott
8kvfYdLgsr4,Smugmug vs Squarespace for photographers – which one is best?,1 570 katselukertaa,32.24,/@IanMiddletonPhotographyTravel
-0Z1SpFXKDk,How to setup photo galleries - Smugmug tutorial Pt 1,20 469 katselukertaa,27.36,/@IanMiddletonPhotographyTravel
-ZyhoBxAItg,SMUGMUG - Getting Started,44 743 katselukertaa,27.34,/@ThePhotographerAcademy
aH_PN0DUUl8,How to sell photos on Smugmug - Smugmug Tutorial Pt 4,7 813 katselukertaa,44.52,/@IanMiddletonPhotographyTravel
qr-kTIdHhFE,How to design a Smugmug website to sell photos online tips and tutorial,22 976 katselukertaa,18.47,/@Photerloo
TCUqFqtlHBY,How to sell photos on SmugMug Portfolio account - SmugMug Tutorial,3 306 katselukertaa,12.13,/@becgoutorbe
jGJU8CrJ4A4,How to build a website with Smugmug - Smugmug Tutorial Pt 2,9 738 katselukertaa,42.20,/@IanMiddletonPhotographyTravel
xK3__RcnuYA,"Quickly and privately share galleries, folders, and pages with clients",5 147 katselukertaa,2.55,/@SmugMugFilms
Ove_w1-IivM,What's the best photography website option for photographers?,4 213 katselukertaa,12.21,/@TechPhotoGuy
v4H6eWEdGLM,Alan Schaller: Streets in Mind - SmugMug Films,383 726 katselukertaa,5.35,/@SmugMugFilms
zYWDlkMKPbk,"SmugMug sellers, add digital downloads to pricelist",3 984 katselukertaa,5.18,/@SmugMugFilms
yA-eLQPsQO4,Upload to SmugMug - SmugMug Gallery Settings - Photography website tutorial,4 327 katselukertaa,17.45,/@becgoutorbe
pJuja9UNVig,Upload your photo hierarchy from your mac or pc to SmugMug,2 375 katselukertaa,3.59,/@SmugMugFilms
JQIOcnb_Dnw,"SMUGMUG - Folders, Galleries & Settings",24 454 katselukertaa,25.08,/@ThePhotographerAcademy
cJ97-OKe_3w,Photography Website Builder 2022 - Customise a website template for photographers. SmugMug Tutorials,9 016 katselukertaa,12.43,/@becgoutorbe
VEEQ1tDVGN8,why i changed platforms,22 466 katselukertaa,11.12,/@TheBiteShot
GvwxjI5obkU,Using SmugMug for Organizing Digital Photos,3 507 katselukertaa,12.26,/@Pixologie
