Video Id,Title,View Count,Length,Channel
fpKsygbNLT4,Socialism for Absolute Beginners,893 680 katselukertaa,24.31,/@SecondThought
lrBRV3WK2x4,SOCIALISM: An In-Depth Explanation,1 560 402 katselukertaa,50.23,/@realryanchapman
36pfyJk3Z50,Generational Wealth from a Socialist Perspective: Deep Dive,20 774 katselukertaa,58.38,/@Fabsocialism
MjwL1mSrPLA,Debunking Every Anti-Communist Argument Ever,1 553 082 katselukertaa,39.46,/@SpookyScarySocialist
thJ2ocejPko,Why You Should Be A Socialist In 2023,389 426 katselukertaa,19.29,/@SecondThought
QkO63lMyAhE,America's Forgotten Socialist History,351 024 katselukertaa,17.34,/@SecondThought
X9ez6w5BUMM,Were The Nazis Socialist?,375 531 katselukertaa,19.09,/@SecondThought
FrtDZ-LOXFw,Communism vs. Socialism: What's The Difference?,3 678 076 katselukertaa,4.03,/@NowThisOriginals
yAOWoV9_2SQ,You're Probably Already A Socialist,576 454 katselukertaa,11.46,/@SecondThought
fiaMiFtrsBI,THE GENIUS SOCIALIST: A Guide To Einstein's Little-Known Philosophy,111 622 katselukertaa,8.01,/@Sisyphus55
XT3qSEzjsuM,"Economically Socialist, Romantically Capitalist (Reaction) [1st Time Watching]@ItsComplicatedChannel",69 katselukertaa,21.11,/@AnonymousBased
mLHG4IfYE1w,Hitler's Socialism: The Evidence is Overwhelming,351 270 katselukertaa,43.00,/@TheImperatorKnight
O9CFP_58mBc,Why Would Anyone Work Under Socialism?,993 402 katselukertaa,16.56,/@SecondThought
Wv_0_Lu_Iyo,College Freshman Explains Socialism To Cuban Who Escaped On A Raft,2 609 480 katselukertaa,3.37,/@TheBabylonBee
zhLa6I72K_g,"Capitalism, Socialism, and Communism Compared",2 057 837 katselukertaa,14.32,/@iammrbeat
B3u4EFTwprM,Capitalism and Socialism: Crash Course World History #33,10 534 721 katselukertaa,14.03,/@crashcourse
MlP0nvJSshU,The Socialist guide to surviving in Capitalism | Doing well isn't treason.,474 182 katselukertaa,20.21,/@YUGOPNIK
vyl2DeKT-Vs,"The Difference Between Socialism, Communism, and Marxism Explained by a Marxist",4 137 224 katselukertaa,11.26,/@azureScapegoat
hactcmhVS1w,A Future Beyond Capitalism? Socialism Explained.,1 369 089 katselukertaa,26.26,/@SecondThought
eCkyWBPaTC8,Hitler's Socialism | Destroying the Denialist Counter Arguments,1 125 024 katselukertaa,4.54.21,/@TheImperatorKnight
