Video Id,Title,View Count,Length,Channel
848YvQRHKFY,Chef vs Normals: GROCERY SHOP CHALLENGE Ep.3,362 741 katselukertaa,19.38,/@SortedFood
thfPA2qHplA,2 Chefs Cook from Another Chef's Fridge | Chef vs Chef Battle,537 428 katselukertaa,20.07,/@SortedFood
ydGnJOQ2k_4,JAMES IS OUT OF HIS COMFORT ZONE!! | Sub-10 Minute Burger Challenge,313 325 katselukertaa,16.01,/@SortedFood
mBrsxYuZJjw,Can a Chef Make Amazing Dishes from Scraps? | Food Scrap Challenge,539 147 katselukertaa,18.02,/@SortedFood
bXLfO0jUTOQ,Spaghetti Bolognese Experiment,385 926 katselukertaa,17.06,/@SortedFood
Ew24c8oH_Nw,Canned Ingredients ONLY Battle | But can a Chef Tell?,462 001 katselukertaa,19.41,/@SortedFood
0cejv11vchc,Can a Chef Cook THIS Random International Dish? | A-Z Challenge: F,478 409 katselukertaa,18.51,/@SortedFood
e2MO0CIzuaY,A Ridiculous Fried Chicken Battle,393 856 katselukertaa,16.27,/@SortedFood
BlWjjHi_WcE,Can we Create Jamie’s ‘Dream Menu’ from 13 Questions? (CHALLENGE),458 038 katselukertaa,20.27,/@SortedFood
kceHa2XteNs,British Cooks Try Filipino Food and Cooking Methods!!,581 904 katselukertaa,20.45,/@SortedFood
qn_AL5IBZNw,A VERY HONEST Kitchen Gadgets Review!,441 289 katselukertaa,17.02,/@SortedFood
SSuG99ZYrt8,3 Meals from 1 Grocery Bag! Mike (£24 Budget) Ep.1/3,490 518 katselukertaa,19.00,/@SortedFood
_Z7H0b7htV0,Chefs Test 4 BBQs at different Prices,468 563 katselukertaa,22.51,/@SortedFood
xCi9-OlYzm4,Can we Create Baz’s 'Dream Menu' from just 13 Questions? (CHALLENGE),597 147 katselukertaa,21.16,/@SortedFood
S0exwwngiSA,Re-creating Famous Chefs' Signature Dishes,420 740 katselukertaa,17.18,/@SortedFood
e77ak11CUi0,Frozen Ingredients ONLY Battle | But can a Chef Tell? (BATTLE),763 330 katselukertaa,19.01,/@SortedFood
REq4sl0uLmA,Housewarming Dinner at Ebbers’ New Apartment!,242 359 katselukertaa,34.35,/@SortedFood
qCyrYMitReM,Chef Reviews CROWDFUNDED Kitchen Gadgets,558 961 katselukertaa,21.43,/@SortedFood
_ibnAOGzNC4,Blind Tasting 4 BUDGET vs PREMIUM Ingredients | Are they worth it?,522 006 katselukertaa,19.48,/@SortedFood
