Video Id,Title,View Count,Length,Channel
GS_Rg3jn5T8,What Do Your Sponsors Actually Want,5 507 katselukertaa,4.54,/@TheSponsorshipCollective
NP8Aom5npAE,How To Get Sponsorship Deals In 50 Seconds 🤯 - GaryVee,1 634 833 katselukertaa,0.52,/@10xinvestors82
N2cVO3bATAc,SPORT : COMMENT RÉDIGER UN DOSSIER DE SPONSORING EFFICACE !,26 621 katselukertaa,13.23,/@jeanferret-chabe2894
HhtMn2IxFEk,How to Get Event Sponsorship!,94 038 katselukertaa,11.32,/@TheSponsorshipCollective
7LFJEWXf1qE,How Sponsorships Work On YouTube // What you need to know about paid sponsorships (beginner's guide),105 390 katselukertaa,12.11,/@CathrinManning
FGA4hUEjcrg,SPONSORING AN UNKNOWN SKATER,246 715 katselukertaa,17.07,/@LuisMora
Trz0e2cFiuw,Hoe werkt sponsoring? | kcNL,691 katselukertaa,13.48,/@kcNLtv
6NmoWvkOHHQ,How to Get Sponsored on YouTube,80 316 katselukertaa,5.03,/@n8wealth
XvCquzsChq4,How to Get Better at Sponsoring in Network Marketing,3 400 katselukertaa,10.00,/@NetworkMarketingPower
MFFamlwcTW8,Eventmanagement #5 Sponsoring,1 392 katselukertaa,17.41,/@eventmanagement6273
0AyyjhadhoY,SPONSORING  by Ir  DJOKO KOMARA,4 677 katselukertaa,47.16,/@fendyzr9624
sIi_QS1tdFM,Sponsored Content: Last Week Tonight with John Oliver (HBO),6 761 599 katselukertaa,21.22,/@LastWeekTonight
_PH6qWB1CLk,Sponsoring,12 924 katselukertaa,1.36,/@VIDEOWORLDpl
z5UIX515TRg,What exactly is sponsorship in business?,19 290 katselukertaa,3.12,/@instituteforgenderandtheec2289
lg47NgV9FMk,8 Reasons Why Personal Sponsoring is Important |Zero To Millionaire| Video #6| Deepak Bajaj|,53 862 katselukertaa,14.06,/@DEEPAKBAJAJ
nNIvC6g4HMk,Sponsorship and 12 Step Recovery | What does a Sponsor do,3 644 katselukertaa,10.01,/@DRKJFOSTER
g9jfolrCi3g,How To Get Sponsored | How To Bike Season 2 Episode 5,42 658 katselukertaa,13.44,/@pinkbike
zHb9OC280hw,How To Get Sponsored on YouTube,214 407 katselukertaa,0.31,/@drktalks
iIlG_RFwbWQ,whyantek - Sponsoring,182 katselukertaa,2.56,/@whyantek
ufHtdpIXYo0,How To Ask For Sponsorship Money For An Event,21 476 katselukertaa,11.14,/@superstaractivator
