Video Id,Title,View Count,Length,Channel
KxC2cwmDezc,IBF Falun vs Storvreta IBK Highlights SM Finalen 2023 (SVT),25 414 katselukertaa,11.54,/@ssl-allsvenskanhighlights7508
u8AVtfpuAJI,Freestyle To SSL #7 (Season 11),191 977 katselukertaa,19.54,/@Evample
gNf3qCjPBlA,Freestyling to SSL 2 | Ranked Freestyle Sessions #7,39 315 katselukertaa,19.00,/@Maktuf
6EI0kw10zb8,SSL’s Choose Their Teammate Blindly Then Play Each Other,396 027 katselukertaa,14.35,/@MrNapkin
YSr_aVmSfgM,Can I FINALLY get SSL?? | SSL 2v2 - Rocket League,1 218 718 katselukertaa,23.30,/@amustycow
CaI0VmoZzC4,I'm back... (SSL 1v1),653 702 katselukertaa,19.22,/@Evample
5pLQAzuFr2A,Freestyle To SSL #1 (Season 11),358 131 katselukertaa,20.25,/@Evample
qlcVx-k-02E,Quick and Easy SSL Certificates for Your Homelab!,277 119 katselukertaa,12.08,/@WolfgangsChannel
hExRDVZHhig,"SSL, TLS, HTTP, HTTPS Explained",2 326 753 katselukertaa,6.31,/@PowerCertAnimatedVideos
IUlqK0F8yWs,Solid State Logic SSL 12 Review - 5 things people aren’t talking about!,11 482 katselukertaa,20.47,/@HarvVideoAudioStuff
j9QmMEWmcfo,"SSL, TLS, HTTPS Explained",401 085 katselukertaa,5.54,/@ByteByteGo
Fca_zRj0WqQ,BRONZE to SSL SPEEDRUN...(World Record ATTEMPT),346 350 katselukertaa,13.38,/@AlphaKep
W_5NnjojCMk,SSL Tournament DOMINATION In Rocket League... (Grog),378 918 katselukertaa,20.50,/@Evample
WilhGPWV0mw,Solid State Logic Controllers: Analog Feel Meets Digital Efficiency,48 119 katselukertaa,16.53,/@sweetwater
TqdeJimmim8,SSL UF1 - Logic Pro Setup & Tutorial,22 223 katselukertaa,31.17,/@SSLvideos
gFlvBP3CqoU,All stars battle!! 2v3 with 5 special youtubers! | SSL ROBLOX | Super striker league roblox | ROBLOX,7 500 katselukertaa,12.36,/@I_sawu
LJDsdSh1CYM,TLS / SSL - The complete sequence - Practical TLS,40 137 katselukertaa,6.15,/@PracticalNetworking
2mRTTCrPV1w,This Rocket League Pro Is Unbeatable In SSL Ranked 2s (ft. SSG Arsenal),54 895 katselukertaa,18.43,/@chronicRL
OIdPJ1quKko,Storvreta IBK vs Växjö Vipers Highlights SSL Semifinal 7:7,9 714 katselukertaa,3.10,/@ssl-allsvenskanhighlights7508
