Video Id,Title,View Count,Length,Channel
n_EOcwFMPjI,The School Queen Is Obsessed With Me,865 201 katselukertaa,14.01,/@StoryTimeAnimated
ZdBJyaGy_bA,😱 STA Token New News 🤔 || STA Token Price 🤫 Gurtej Singh Sidhu STA || #sta #viral #crypto,915 katselukertaa,12.15,/@sanjaykevideo
lK90OTzxVko,Mom literally only cares about money,1 147 345 katselukertaa,13.15,/@StoryTimeAnimated
VTMarDdi15g,I'm Famous But No One Has Seen My Face,514 889 katselukertaa,12.47,/@StoryTimeAnimated
BFmwV8e8zHc,I Have Days To Save My Dad,303 982 katselukertaa,14.42,/@StoryTimeAnimated
XpPLSchtugg,"The Final Among Us ""Movie""",934 500 katselukertaa,3.09.18,/@STAStudios
GL2agAy_qHs,My friends are complete opposites,847 336 katselukertaa,12.56,/@StoryTimeAnimated
w0tH4nUWFAI,Among Us: The Finale,603 979 katselukertaa,13.05,/@STAStudios
GbXEyMv9kGQ,I'm Being Hunted By Billionaires,442 490 katselukertaa,15.56,/@StoryTimeAnimated
OSBJEwtTk-A,I’m The Strongest Girl In The World,808 132 katselukertaa,13.56,/@StoryTimeAnimated
LkTMBXoB-tM,Among Us But Impostor Can Change Color,18 631 727 katselukertaa,10.03,/@STAStudios
cPrNms3cvgg,Among Us Zombie Apocalypse Takeover,2 562 166 katselukertaa,31.36,/@stastudioslive7137
CLY83eGjXHk,Among Us Skinny Impostor: Cartoon Animation,1 317 538 katselukertaa,9.43,/@STAStudios
gpOUY7ygj-s,"The Among Us ""Movie"" 3",14 098 739 katselukertaa,41.46,/@STAStudios
CCKkXWO6Kdw,Among Us But Impostor Can Hide Inside Walls,1 825 039 katselukertaa,11.19,/@STAStudios
OlmQuJgj6Qg,Among Us But Players Can Text Each Other,3 643 268 katselukertaa,8.43,/@STAStudios
b9BinLnxdcA,Among Us Cute Impostor Videos That Will Make You Smile,2 103 539 katselukertaa,34.35,/@stastudioslive7137
UBqqqBwvy_E,Among Us But With No Rules,1 775 632 katselukertaa,10.58,/@STAStudios
