Video Id,Title,View Count,Length,Channel
7nOMQIUFuaQ,Proving Why the JÅ (Japanese Staff) is So Strong,198Â 160 katselukertaa,12.17,/@letsasksekisensei
EYCSgRKTnEg,How I Learned Bo Staff Spinning from Scratch,2Â 513Â 330 katselukertaa,8.24,/@hafu
XCLzlfFsP-k,14 Types of Teachers in the Staff Room,8Â 035Â 349 katselukertaa,16.45,/@jianhao
AItNFAF-9yM,Staff Favorite Moments: Writer Jeff Stilson | Letterman,24Â 724 katselukertaa,14.47,/@Letterman
ENqMy1BU2-Y,"Bo Staff, Top 10 Spins and Strikes - Wow, Incredible",7Â 445Â 660 katselukertaa,6.34,/@RealKungFu
1LjovAG2kwA,BTS with Staff Girl â¤ï¸ğŸ’œ Cute Moments,1Â 219Â 370 katselukertaa,10.02,/@MisuP
lRt7-RIG2sQ,"Pimp My Staff- Walking Stick Maintenance, Decoration and Optimisation- Alpine Ferrule, Burn Designs",224Â 009 katselukertaa,10.22,/@FandabiDozi
MZHxrNLW7fY,"The STAFF. Multipurpose, Self-defence, Survival Tool (Scottish History and Myth)",703Â 511 katselukertaa,13.42,/@FandabiDozi
cdz1XCRDBAI,Basic Flow 2.0 | STAFF SPINNING TUTORIAL FOR BEGINNERS | Michelle C. Smith,459Â 546 katselukertaa,18.10,/@michelle-c-smith
j1v_n1wunV4,How to Make a Hiking Staff  - a Complete Guide,140Â 675 katselukertaa,33.24,/@MarkYoungBushcraft
Cv3ROAi7TFk,"Comparing 6 STAFF Martial Arts from around the World. History, Self-defence, Fitness & Flow",1Â 264Â 307 katselukertaa,16.42,/@FandabiDozi
6RbEbrh2Cjk,Learn Staff Spinning: 3 Staff Tricks,3Â 759Â 867 katselukertaa,4.19,/@MikeShake
8kifXy1eyPE,INSANE BO STAFF work from 16 year old prodigy and world champion Noah Fort,1Â 245Â 753 katselukertaa,1.25,/@the_fort_fam
2NSNwZmVYB4,Staff! Job Game - MAX LEVEL HOUSE EVOLUTION!,777Â 062 katselukertaa,12.01,/@pikaguy
w43kvA18Trs,How To Use A Pocket Staff - BrandNewLogic,33Â 669 katselukertaa,5.10,/@BrandNewLogic
ZzeojuA8XZ8,Staff - Santa Lucia - Merengue,174Â 237 katselukertaa,4.42,/@MrAlberttoon
uwIt80Z6We0,Domestic Staff Latest Yoruba Movie 2023 Comic Drama | Wunmi Toriola |Apa |Sisi Qaudri |Feyikemi Dada,982Â 694 katselukertaa,1.20.19,/@APATATVplus
VU8mM1g_g38,How To Read Notes On The Staff | EASY | Music Theory Tutorial,353Â 992 katselukertaa,4.24,/@fiveminutemozart
kn91pduT8kk,DOMESTIC STAFF FULL MOVIE- EBUBE OBIO DESTINY ETIKO JAMES BROWN 2023 Latest Nigerian Nollywood Movie,527Â 362 katselukertaa,6.40.54,/@Destinyetikotv
1vkUqIJAIvw,Amit Saini Rohtakiya | STAFF | Dj Haryanvi Songs Haryanavi | Haryanvi | Crown Records,9Â 977Â 065 katselukertaa,3.48,/@crownrecordsharyanvi8118
