Video Id,Title,View Count,Length,Channel
2_u7Nv7Wh-M,What is a Stakeholder?,112 513 katselukertaa,10.00,/@alexanderlyon
3KRwRVMrWVU,tofubeats（トーフビーツ）- STAKEHOLDER,1 664 335 katselukertaa,4.12,/@warnermusicjapan
8uZiGB8DeJg,Identify Stakeholders - What is it?,106 220 katselukertaa,1.36,/@sandipmungikarpmp
FnstXGgcIts,The Tyranny of Order:Balancing Stakeholder Need & Being a Force for Good | John Stroup | TEDxClayton,5 175 katselukertaa,14.19,/@TEDx
tZGol4xtY3g,Stakeholders | What is a Stakeholder?,49 057 katselukertaa,11.21,/@TwoTeachers
VHGTsEwbOJY,What is Stakeholder Engagement?,146 728 katselukertaa,3.07,/@Future500
NaGhBpfZLzg,How to Manage Difficult Stakeholders [6 COMMON CHALLENGES],9 368 katselukertaa,11.36,/@AdrianaGirdler
PXCo92Iag3g,What is a Stakeholder Analysis? — Leading Successful Projects,91 741 katselukertaa,4.02,/@Productplan
Jgflr5SuOJI,"ProductTank Wellington: Stakeholder Management, The Most Important Skill Nobody Teaches",229 katselukertaa,1.12.00,/@MindtheProductTV
JGZJjqhA9wY,"Shareholders and Stakeholders Compared in One Minute: Definition/Meaning, Explanation and Examples",56 066 katselukertaa,1.02,/@OneMinuteEconomics
4y3Rijojwok,Project Stakeholder Management Overview | PMBOK Video Course,5 710 katselukertaa,7.10,/@davidmclachlanproject
APc9S_8v7YY,Stakeholder Engagement Tips: 5 Tips For Project Managers,68 426 katselukertaa,8.48,/@Onlinepmcourses
gc55hPIFW8w,Stakeholders and Stakeholder Mapping Explained,194 492 katselukertaa,7.52,/@tutor2u-official
bIRUaLcvPe8,What is Stakeholder Theory? - R. Edward Freeman,402 153 katselukertaa,2.58,/@corporateethics
qgSPPzVM_5Q,Freeman's Stakeholder Theory,2 891 katselukertaa,6.45,/@aaronyarmelphilosophy4732
j8K8tw1-rEI,"How ESG and Stakeholder Capitalism and DESTROYED Disney, Marvel and Star Wars",198 537 katselukertaa,26.54,/@MidnightsEdge
OkyVirNorAc,How to build a key stakeholder map | Stakeholder mapping | Lauren Kress,90 551 katselukertaa,5.23,/@LaurenKress
HjvVa-I8PL0,What is Stakeholder?,53 366 katselukertaa,15.30,/@educateyourself9308
nrk-8KfLY98,"Is stakeholder capitalism building a better world, or just empowering the rich? | FT Moral Money",13 810 katselukertaa,2.54,/@FinancialTimes
R6mzivjcwXA,Stakeholder - Grundbegriffe der Wirtschaft,266 746 katselukertaa,3.11,/@simpleclub_wirtschaft
