Video Id,Title,View Count,Length,Channel
9f92VJ85v8M,Stem VS Fem: Kissing Challenge pt2,36Â 105Â 786 katselukertaa,9.31,/@AmbersCloset
sL5tCmBcJVA,The Real Reason Wine Glasses Have Stems ğŸ¤”,13Â 216Â 572 katselukertaa,0.24,/@zackdfilms
UFKYxHOhxdU,Subway Stem Conspiracy,12Â 124Â 723 katselukertaa,0.41,/@MiladMirg
sCQ2dAxsDk4,How To Grow Rose Plant From Cuttings | Grow Roses From Stem Cutting | Roses Cutting Idea,8Â 903Â 295 katselukertaa,3.39,/@gardening4u11
VDUFiBP2nfQ,Banana Stem Curry | Wild Cookbook,6Â 734Â 358 katselukertaa,0.59,/@WildCookbook
G-Qo9HuFUWg,"Growing Carrots From Discarded Stems Super Fast, Efficient, High Yield",6Â 359Â 826 katselukertaa,13.36,/@BalconyGarden
58m_oqQSk3k,a new way of propagating mango trees without media using stem cuttings.#growingfruits,5Â 550Â 051 katselukertaa,0.57,/@agarden.
LsQw1sfZYlg,What Happens When You Put Copper Wire Through a Tomato Stem?,3Â 860Â 762 katselukertaa,6.31,/@Selfsufficientme
4_8YoACI3dk,Stop Throwing Away Broccoli Stems,3Â 387Â 951 katselukertaa,0.41,/@thatdudecancook
HL-cBxDLxHk,Banana stem filtered juice | Best medicine for kidneystone | à²¬à²¾à²³à³†à²¦à²‚à²¡à²¿à²¨ à²¶à³à²¦à³à²§ à²°à²¸ à²¶à³‡à²–à²°à²£à³†,3Â 228Â 021 katselukertaa,10.34,/@BhatnBhat
3mw7RJfPqwk,God is a Woman high note stem (high quality),2Â 514Â 984 katselukertaa,0.38,/channel/UCG_P_IOVw-d6D8oW66-9UtQ
cDlgSeIhTeU,Chris Stapleton - Them Stems (Official Audio),2Â 507Â 397 katselukertaa,3.01,/channel/UCsdXkstc8jFC3zpMYdEz_zA
HHgjfrNQlio,HOW TO REPLACE A VALVE STEM WITHOUT BREAKING THE TIRE BEAD,2Â 389Â 496 katselukertaa,5.36,/@THEMOWERMEDIC1
Z-lq-z5KM2c,Remix ANY song with Kanye West's Stem Player,2Â 229Â 049 katselukertaa,12.26,/@CNET
uiDX9D19Ub0,Michael Jackson - Beat It (Original HQ stem version),1Â 881Â 944 katselukertaa,5.47,/@seleron1072
ql6OL7_qFgU,The Parts of a Plant (song for kids about flower/stem/leaves/roots),1Â 848Â 215 katselukertaa,2.32,/@HarryKindergarten
bX7IpuMCeBc,Cardigan (Dolby Atmos Stems) But only the Best Part loop,1Â 728Â 106 katselukertaa,4.07,/@alyxhud
EspzLgnTdsA,How to Stem Stitch,1Â 701Â 609 katselukertaa,3.31,/@CutesyCrafts
evH0I7Coc54,What are stem cells? - Craig A. Kohn,1Â 624Â 661 katselukertaa,4.11,/@TEDEd
hVQLcyw9L0A,"I Took $20,000 Stem Cells For 30 Days (insane results)",1Â 608Â 155 katselukertaa,12.20,/@JesseJamesWest
