Video Id,Title,View Count,Length,Channel
xF_QkfZI1mM,"Stephan Bodzin live @ Piz Gloria in Mürren, Switzerland for Cercle",14 255 008 katselukertaa,1.43.33,/@Cercle
KEMWTyO8iXQ,Hey Joe - Acoustic Hendrix Cover - Joscho Stephan Trio,3 691 267 katselukertaa,4.45,/channel/UCOx5xSWVB-hdfHuzHk16dIw
aAkHRPNaqaI,Worakls - Stephan Bodzin - Ben Böhmer - Colyn - Sainte Vie | Melodic Techno Classics mix 2016 / 2019,872 803 katselukertaa,3.30.29,/channel/UCuJRhbiG0TiTlgtEUCNZqjw
JcPeIt2Cehg,Stephan Bodzin | Tomorrowland 2022 - WE2,861 482 katselukertaa,1.59.20,/@tomorrowland
RcejqTNCkGs,Stephan Jolk live in Cappadocia - Sight & Sound Sessions 16 @GoTurkiye,36 726 katselukertaa,1.07.31,/@rikodisco
69v-9S8ho5Q,Sepan - You lie,544 755 katselukertaa,0.39,/@melviyycofficial
yIWZHvCwuoA,If I Had You ⎮Tommy Emmanuel & Joscho Stephan,2 452 035 katselukertaa,5.24,/channel/UCOx5xSWVB-hdfHuzHk16dIw
qORmNtnP4-0,Damit hab ich nicht gerechnet,112 768 katselukertaa,20.46,/@t800
MCBtR5V9INg,Stephan Bodzin | Tomorrowland 2022 - WE1,274 866 katselukertaa,59.20,/@tomorrowland
-FTSP1BcA_U,Sin Boy x Dj Stephan - Sexaki (Music Video),6 745 239 katselukertaa,3.12,/channel/UC9Cywg98uO9Gdb3X5tn9sQg
W3wynDVMpVI,Exactly like you // Joscho Stephan Trio,42 940 katselukertaa,3.28,/channel/UCOx5xSWVB-hdfHuzHk16dIw
mPQBcb9wf8Q,"LOVE EXPERT ON: When A Man TRULY LOVES You, He Will DO THIS! | Stephan Speaks & Jay Shetty",3 266 699 katselukertaa,1.07.36,/@JayShettyPodcast.
n_KxB_nAb0o,Solomun - Maceo Plex - Stephan Bodzin - Mind Against - Hunter/Game style ◆ Euphoria (Mixed by EJ),6 266 278 katselukertaa,56.00,/@ElectroJunkiee
10csuk7z-z4,Why Did All Of Korea Turn On Yoo Ah-In - Except Song Hye Kyo?,123 932 katselukertaa,50.51,/@StephanieSoo
Hv_oF2ol_Ks,Stephan Bodzin Boiler Room Berlin Live Set,5 566 311 katselukertaa,1.19.47,/@boilerroom
ofzTcfQBnWw,"If A Man DEEPLY LOVES YOU, He Will DO THESE 3 Things! | Stephan Speaks & Lewis Howes",1 450 048 katselukertaa,2.03.00,/@lewishowes
dqEke-0o9y8,The BIG SIGNS He’s Wasting Your Time & How to Tell If He’s USING YOU! | Stephan Speaks,1 610 471 katselukertaa,1.30.17,/@LisaBilyeu
euCAM-43Dg8,How To Be A Man's PEACE (These 7 Things WORK Every Time!),166 929 katselukertaa,37.58,/@MeetStephanSpeaks
H34iYiXBHtc,The ONLY Dating Advice You'll Ever Need with Stephan Speaks @MeetStephanSpeaks,451 213 katselukertaa,1.38.23,/@HardlyInitiated
