Video Id,Title,View Count,Length,Channel
9DGFS9HfX50,Diana and Roma funny stories with sticky tape,332 448 327 katselukertaa,7.52,/@KidsDianaShow
ICeSs0gdTLU,She was bragging until.. |Sticky|,231 338 641 katselukertaa,0.39,/@Stickylollies
vp5sSqyZ5Go,I Filled My Brother’s House With Slime & Bought Him A New One,197 950 600 katselukertaa,9.25,/@MrBeast
qsngtVA3SnM,Dad Did Not Let Her Win |STICKY|,169 753 131 katselukertaa,0.38,/@Stickylollies
5w7ODt7I4bg,Vlad and Mom funny stories with sticky tape,162 513 485 katselukertaa,3.52,/@VladandNiki
mpnXxmZMN6Y,Sticky cooks up some peppermint bullseyes! |Sticky|,130 349 644 katselukertaa,0.27,/@Stickylollies
HwfSN3blmH8,She STILL doesn't know how to make candy |Sticky|,129 336 809 katselukertaa,0.38,/@Stickylollies
dPztVrfdAAs,This Candy-maker is Faster Than A Machine,98 811 155 katselukertaa,0.23,/@Stickylollies
qdZXb33buR8,My Dad and I Are Both TERRIBLE,92 121 821 katselukertaa,0.51,/@Stickylollies
3tz3jvy_mvk,How Sitcky are Sticky Notes?,89 479 565 katselukertaa,1.00,/@Matt.Larose
fZivctKzy-g,Sticky sweet pancake,75 289 356 katselukertaa,0.13,/@FruitUniversity
7hkEQUNLF64,Icky Sticky  Bubble Gum | Nursery Rhymes | Kids Songs | Toddler Songs | BabyBus,75 118 674 katselukertaa,2.15,/@babybus
Uc1Jttwu-qo,Sticky phone prank gone too far!!,73 794 724 katselukertaa,0.26,/@wewearcute
0kLYRKvRUcE,Antiks | Sticky Shoes | Funny Cartoons For Kids,68 465 670 katselukertaa,10.58,/@OddbodsAndFriends
hKX9rEEgb0I,STICKY FINGERS - HOW TO FLY (Official video),66 448 647 katselukertaa,3.17,/channel/UCRC74iukYTRgzOZhlQq1f7A
3EtUHWr1YLE,This is Why Candy is Dangerous |Sticky|,57 140 213 katselukertaa,0.54,/@Stickylollies
lihlNEQywi0,Sticky Sticky Bubble Gum | Bubble Gum Song for Kids by Howdytoons,55 321 238 katselukertaa,1.41,/@Howdytoons
zzHouyi6t4g,Sticky Fingers - Cyclone (The Village Sessions),54 761 513 katselukertaa,4.37,/@PelicanSessions
0OSTdmGHj8k,Highest Sticky Notes Wall run ft @NickPro,53 004 942 katselukertaa,0.42,/@Matt.Larose
LdwgOGtuNqo,Princesses! But not the D*sney kind,49 971 096 katselukertaa,0.53,/@Stickylollies
