Video Id,Title,View Count,Length,Channel
49e7LrxS3FQ,"Tesla, Inc. 2022 Annual Meeting of Stockholders",624 231 katselukertaa,1.13.04,/@tesla
UWQ6jpyzaGc,Accounting Basics 5- Stockholders Equity,196 333 katselukertaa,4.38,/@SusanCrosson
Dmf8hVNH8cc,Stockholders' Equity (Financial Accounting),118 948 katselukertaa,3.31,/@Edspira
ZLIcF-vBYOg,Kevin Tan Shares MREIT's Success at the 2022 Annual Stockholders Meeting Report,71 676 katselukertaa,6.03,/@KevinAndrewTan
wiAL4gtxYNY,Is Shareholder different from stakeholder? | Shareholder and Stakeholder are not same!,66 845 katselukertaa,3.04,/@padhakulog
szH_8EBOKKI,Stockholders' Equity Vs Owners' Equity    ايه الفرق بين,65 099 katselukertaa,18.46,/@FinBeeAcademy
bB5SlfUWSjk,How BTS RM Responds to HYBE Stockholders who Absurdly Blame Bighit?,63 610 katselukertaa,4.50,/@kpopcrush8078
UdV383OSxps,"Alliance Global Group, Inc. CEO Kevin Tan's 2022 Annual Stockholders Meeting Report",48 180 katselukertaa,18.06,/@KevinAndrewTan
cdOG1qGCzbY,Stockholders & Sponsors Pressure WWE To Cancel FIREFLY FUN HOUSE!? | Off The Script 271 Part 1,43 487 katselukertaa,2.02.06,/@JDfromNY
OhUoEi0_WeY,Alliance Global Inc. CEO Kevin L. Tan's 2021 Annual Stockholders Meeting Report,41 753 katselukertaa,21.54,/@MegaworldLifestyleTV
vDSgQGbuZaE,"Stockholders Equity (Equity Accounts, Per Share Values, Balance Sheet Presentation)",39 143 katselukertaa,13.01,/@allenmursau7408
p-b8Oheaaoc,MOHENIC GARAGES extraordinary general meeting of stockholders,39 026 katselukertaa,3.43,/@MOHENICTV
uVmqLYkq3X4,Contributed Capital 3 Stockholders Equity format,35 321 katselukertaa,5.01,/@SusanCrosson
LvrzzPi2XRI,The Statement of Stockholders' Equity,34 034 katselukertaa,4.55,/@Edspira
WmaXbsC1YRI,"MREIT, Inc. President and CEO Kevin Tan's 2023 Stockholders Meeting Report",27 351 katselukertaa,6.21,/@KevinAndrewTan
Rn3iOh38sB4,Stockholder or shareholder vs  Stakeholder: Key Differences.,25 752 katselukertaa,4.40,/@businessschoolofir317
c41kFo42BCw,Basic Stock Transactions and Stockholders Equity Section of The Balance Sheet,24 705 katselukertaa,21.58,/@EconomyT1me
O7idM84HbME,"Stockholders Equity (Book Value Per Share, Preferred Stock & Common Stock Dividends)",24 417 katselukertaa,15.46,/@allenmursau7408
FBYFax3_pGs,What is a Shareholder?,23 533 katselukertaa,2.50,/@MarketingBusinessNetwork
_N7ne1kdYWM,"(LIVE NOW) Tesla, Inc. 2022 Annual Meeting of Stockholders (CYBER ROUND UP)",20 087 katselukertaa,2.02.44,/@RickyGutierrezz
