Video Id,Title,View Count,Length,Channel
cqREznICF54,Why Royal Guards Wear Their Straps Above The Chin 😬,30 659 824 katselukertaa,0.24,/@zackdfilms
Rm4-lbz0JVo,SPINE SURGEON reacts to Chiropractic Y-Strap Manipulations,17 061 984 katselukertaa,10.53,/@antoniowebbmd
GaJmKEwRlk4,I Hate Uncomfy Straps... #shorts,13 774 266 katselukertaa,1.00,/@Brevite
mMga6fydI9o,Hoe to put on a wig with straps 😱 | #wig #hairstyle #shorts #shortvideo #viral #tiktok,13 789 092 katselukertaa,0.15,/@arkhitofashion
-gqTp6WP0_E,BMW S1000RR wheelie fail | FLIPPED the bike - saved by the straps | WHEELIE MACHINE,13 746 312 katselukertaa,0.26,/@WheelieMachineau
eL9JjAHlltc,Strapp - THE WHOLE STORY,12 794 469 katselukertaa,5.09,/channel/UCcJcLmalpzHfE5-qNtMujVQ
ifyJjQXOttE,How Strong are Twisted Ratchet Straps?,10 430 398 katselukertaa,13.51,/@FireballTool
is4n6hoCauI,Bra Straps Showing?,9 268 748 katselukertaa,0.20,/@hannahwarling
1WluE599ccI,Easy Crochet Crop Top - How to crochet a Ribbed Singlet with Tie Straps!,8 624 238 katselukertaa,8.39,/@forthefrills
vJ62TL03boI,"Crotchless Pantyhose ,  Suspender Tights , Office Outfit , Straps Strumpfhose , Ouvert Collant .",8 147 689 katselukertaa,3.23,/@sashanylon
kblyMKRnLQU,Lil Tjay - Clutchin My Strap (Official Video),6 233 654 katselukertaa,2.10,/channel/UCEB4a5o_6KfjxHwNMnmj54Q
E3-RMJfsM14,Hoe to put on a wig with straps 😱 | #wig #hairstyle #shorts #shortvideo #viral #tiktok,5 494 199 katselukertaa,0.18,/@arkhitofashion
EeD8_zUUjc4,Bra Straps Showing On Your Tops? #Shorts,5 023 762 katselukertaa,0.30,/@hannahwarling
cgHk5wRvC-w,"VERSATILE ASSASSINS | Human | Aerial Straps over Salida, Colorado  -- Selkie Hom",4 631 754 katselukertaa,4.23,/@versatileassassins
Lb4lAcmDbBk,Here is the proper way to use a ratchet strap with macs tiedowns #doitright  #offroad4×4 #sanddunes,4 278 918 katselukertaa,0.58,/@UTVActionMagazine
1ugJ1BJx0HE,The SCAM of Wireless ESD Straps - Feat. ElectroBOOM,3 848 841 katselukertaa,29.23,/@LinusTechTips
kbSQdY8EGZE,Cutting the straps off my infant car seat,3 667 992 katselukertaa,0.56,/@gaming_foodie
bY-jt-NSxyg,Simple Hack with Trailer Straps when Hauling #shorts,3 346 719 katselukertaa,0.28,/@RRBuildings
AgkPJ8OrXIo,When your straps give up on you... 😩#shorts,2 865 740 katselukertaa,0.39,/@Brevite
rw363OhVYhs,CASETiFY - Phone straps with card,2 795 748 katselukertaa,0.20,/@Casetify
