Video Id,Title,View Count,Length,Channel
_9RiEs5Lo3g,"After trying many times, I finally succeeded in the wedding photo",66 664 875 katselukertaa,0.25,/@VDSAmazingVideos111
bXGhtjezJPY,Jack Ma's Ultimate Advice for Students & Young People - HOW TO SUCCEED IN LIFE,16 529 454 katselukertaa,11.17,/@Motivation2Study
qrHnETK5cZI,Man vs. Goose (3):The son succeeded at the last moment#Shorts #Tiktok #GuiGe #funnyvideos#ENSUB,12 003 370 katselukertaa,0.57,/@GuiGe
EwqXIhNYaUE,I succeeded because of Rainbow's indifference | Funny Animation #animation #story #shorts,7 368 426 katselukertaa,0.34,/@AnimationCartoonFunny
bNpx7gpSqbY,The single biggest reason why start-ups succeed | Bill Gross,5 776 818 katselukertaa,6.41,/@TED
3kLIDxUtTys,My local skateshop made a deal with me and I succeeded,3 291 273 katselukertaa,0.39,/@SkateVibes
8MMT_iOZkOk,You succeeded || GOW #godofwar,1 473 941 katselukertaa,0.27,/@BT_Atreus
HfMSF8dMgZo,Top 10 Athletes Who Succeeded As Actors,1 410 213 katselukertaa,12.29,/@WatchMojo
dhc7qHZ7Eg4,ONE PIECE Succeeds Where Cowboy Bebop Failed,942 161 katselukertaa,7.36,/@TheCriticalDrinker
EmVTvehpcGQ,In the end he succeeded 😢🥰 LeoNata family #shorts TikTok,842 269 katselukertaa,0.52,/@LeoNataFamily
wMaqwtCSHJE,Everyone did it successfully... But Yoonjin succeeded in one attempt 🔥#bts#yoongi#jin,781 973 katselukertaa,0.28,/@bangtanprincess6699
fPWDt9FkWP0,YouTube Pick a Side Succeeded...,736 132 katselukertaa,12.43,/@SomeOrdinaryGamers
H8uLrFauZ3U,Saranghae girl finally succeeded 🥺🥺,729 067 katselukertaa,0.10,/@seungbin
EsuZs1Q-HF0,What’s the DUMBEST thing a player rolled for and Succeeded? #1,726 742 katselukertaa,17.16,/@MrRipper
4oVJYawjZ48,436 Fortnite Pros Tried This Play But Only 1 Succeeded...,647 359 katselukertaa,0.34,/@KinchAnalytics
ezaSt0IPrIk,What if the Schlieffen Plan Succeeded? (Part 2),629 841 katselukertaa,5.18,/@AlternateHistoryHub
_gaO3j816Ek,"Kolme kuukautta koeaikaa, kunnes se onnistui",587 594 katselukertaa,12.05,/@NetHelp2
NYCCe3jWHeo,Stop These 3 Things If You Want To Succeed | Tony Robbins,483 694 katselukertaa,1.00,/@TonyRobbinsLive
cdPOtiqfJO8,10 People Who Succeeded Despite The Odds,447 877 katselukertaa,11.58,/@TheThingsCelebrity
eVSeugRmSCE,Europe Map if All MAJOR Separatist/Unionist Communities Succeeded,428 306 katselukertaa,0.10,/@aegeanmapping4
