Video Id,Title,View Count,Length,Channel
gCQv0UMMyOA,शफ़ा और सोसो सफ़ाई करने का नाटक करते है।,127 051 838 katselukertaa,6.09,/@shfashowindia
RwGiipDpmek,líue - suffer with me (slowed down),37 062 143 katselukertaa,4.44,/@dreamscape..
baF6NjFZNqc,líue - Suffer With Me | um hi edits tiktok,25 646 992 katselukertaa,3.29,/@itsTikTokTunes
cQ8xU0Kgf3M,Charlie Puth - Suffer [Official Audio],23 455 746 katselukertaa,3.31,/channel/UCwppdrjsBPAZg5_cUwQjfMQ
aNrh9UcL-eU,"Shrimad Bhagavad Gita “Why Good People Suffers the Most?"" by Shri Krishna",20 999 441 katselukertaa,7.45,/@WeRead
G_o3qU4k8A8,"'I hope you suffer,' mother says to son's killer",20 192 335 katselukertaa,2.27,/@mlive
Jd76HxqCPf0,California deputy suffers fentanyl overdose after exposure to substance on patrol,17 139 437 katselukertaa,2.28,/@Foxla
vUE_opa6Jqc,Earth Suffers... #planetballs,16 773 552 katselukertaa,0.09,/@spaceballs
H-G9mziXL9w,Damar Hamlin Collapses and Suffers Cardiac Arrest After a Hard Hit,11 634 437 katselukertaa,2.43,/@BrianSuttererMD
_ea97RiY_6A,Atlanta Hawks Announcer Suffers On-Air Medical Emergency,11 411 064 katselukertaa,1.05,/@InsideEdition
mR8QYKnrSL8,Petit Biscuit - Suffer (Ft. Skott) (Lyrics),9 503 252 katselukertaa,3.30,/@SyrebralVibes
1rPGtYDwVXc,Tiny Suffers Misery From His Newborn - Funny Moment Stop Motion Animation Cartoons,9 228 511 katselukertaa,11.00,/@ClayMixerOfficial
ti06Y4uN5No,Lecuona suffers a HUGE HIGHSIDE at Mandalika 😮,8 162 320 katselukertaa,0.15,/@worldsbk
ZwuVpNYrKPY,Eel Suffers Toxic Shock From Brine Pool | Blue Planet II,6 471 706 katselukertaa,2.31,/@bbcearth
WFIUS6Kk5ws,Children don't have to suffer because of adults 🥺😭LeoNata family #shorts TikTok,6 238 097 katselukertaa,0.36,/@LeoNataFamily
6lUg4bc_jGs,Duck Dynasty Family Suffers a Major Loss,6 227 976 katselukertaa,3.04,/@TasteofCountryMusic
F9Y7u7ZsHdc,*WARNING GRAPHIC* Stanford's Oscar da Silva suffers scary head injury after Nasty Collision,4 901 807 katselukertaa,2.32,/@RafaelHernandezRaf3skgc
EHScAnl5yrs,SMG4: Mario Suffers Infinite Detention,4 885 367 katselukertaa,10.12,/@SMG4
yX7qN0IVfDM,Jungkook Suffer a Lot For Being Youngest 😂 #bts #shorts,4 588 683 katselukertaa,0.38,/@vmatebts
r5-xxk90E2c,HUGE DRAMA: Baldassarri suffers spectacular highside in Race 1 💢,4 035 649 katselukertaa,0.19,/@worldsbk
