Video Id,Title,View Count,Length,Channel
EBYtxWlhBC8,Are Vitamins And Supplements Beneficial? What A New Study Shows,102 533 katselukertaa,3.44,/@TODAY
tLS6t3FVOTI,Developing a Rational Approach to Supplementation for Health & Performance | Huberman Lab Podcast,835 637 katselukertaa,2.00.47,/@hubermanlab
4r7mrHPYhoU,Stop Wasting Your Money on These 7 USELESS Supplements! | Dr. Steven Gundry,1 133 011 katselukertaa,12.40,/@DrGundry
4ZtZTtNDoNE,Top 4 Daily Supplements EVERYONE Should be Taking  | Ask Dr. Gundry,888 518 katselukertaa,3.20,/@GundryMDYT
JDuZCWNeYJ4,2023 SUPPLEMENT GUIDE (Which Supplements | What Age),654 679 katselukertaa,23.01,/@athleanx
IR5jW9iNNiw,TOP 5 SUPPLEMENTS | SCIENCE EXPLAINED (17 STUDIES) | WHEN AND HOW MUCH TO TAKE,2 742 883 katselukertaa,11.35,/@JeffNippard
RhhIwEQLbMw,The 4 BEST Supplements To Build Muscle Faster (And How Much They Help) ft. Dr. Brad Schoenfeld,2 373 470 katselukertaa,11.37,/@JeremyEthier
BlBb2P2_3GY,The TRUTH about Supplements!,509 952 katselukertaa,15.42,/@FutureProofTV
HWXNthesuyY,Top Supplements For Hormone Balancing,162 katselukertaa,7.56,/@DrMaggieYu
_hOxXq0wi-0,Eight Supplements That *Actually* Work,191 315 katselukertaa,9.51,/@DrBradStanfield
q37ARYnRDGc,Dr. Andy Galpin: Optimal Nutrition & Supplementation for Fitness | Huberman Lab Guest Series,2 956 658 katselukertaa,3.05.34,/@hubermanlab
J0CLMqpsrgY,Doctor answers your questions about vitamins and supplements,48 593 katselukertaa,6.44,/@CBCNews
5i-hlxAvlx4,How To Gain MUSCLE MASS?! The Best Supplements [You've Never Heard Of] By Andrew Huberman,782 384 katselukertaa,12.57,/@HubermanHUB
6w0uvlWwEOk,The 3 Daily Supplements Everyone Should Be Taking For Longevity | Mark Hyman,1 203 461 katselukertaa,1.18.39,/@drmarkhyman
kv91H2gAwe8,Fitness Supplements RANKED - Best to Worst!,463 851 katselukertaa,30.02,/@PictureFit
1Cy3WxRVKWU,Best Supplements for Health | ft. Dr. Brad Stanfield,67 248 katselukertaa,16.50,/@NutritionMadeSimple
p7dicWVSalE,What Do Vitamins Actually Do? (Vitamin Lore),626 184 katselukertaa,44.11,/@That_Chemist
Bll8oVpo23o,Neuroscientist: The Only Supplements You Need - Dr. Huberman,704 672 katselukertaa,12.33,/@lets-be-healthy
VoY4C7jqr_4,The ONLY Supplements You Need to Build Muscle Faster,2 189 740 katselukertaa,13.21,/@GravityTransformation
hC7YnQ8tj20,"How to know which, if any, dietary supplements are right for you",2 270 katselukertaa,4.51,/@ABCNews
