Video Id,Title,View Count,Length,Channel
sqGk86fGO2I,Tale on syvissä vesissä.. | Subnautica - 1,28 581 katselukertaa,18.32,/@TaleKanava
RcZU-a5WrRg,Tale Of Us | Tomorrowland 2023,206 480 katselukertaa,1.00.20,/@tomorrowland
xFfm7YkOcgI,"Cinematic Fairy Tale Music (1 HOUR) & ASMR Ambience (1,5 HOURS) | Fairy Lands Series",329 939 katselukertaa,2.30.10,/@fantaisiaambience
Yh3vZgcoT2M,Isä - Viimeinen Opetus (Tale Diss Track) ft. Äiti,844 501 katselukertaa,2.57,/@PeteKanava
DHI_DhxcYqM,All Stories - Fairy tale Compilation | 178 minutes English Stories (Reading Books),3 129 711 katselukertaa,2.58.56,/@EnglishSingsing
SarCQ_-ZIl4,Tale näyttää miten Minecraftia pelataan!,50 852 katselukertaa,12.38,/@TaleKanava
lN1f1qNPa7g,Tale varkaissa.. (Pete ja Isä nukkuivat),365 963 katselukertaa,4.23,/@PeteKanava
7h-EQTI_eBg,Tale - Peten loppu (Pete Diss Track),458 124 katselukertaa,2.11,/@PeteKanava
eeSwLvK_sb4,Tale ja Yö METSÄSSÄ..!,286 160 katselukertaa,4.30,/@PeteKanava
rGfjnJVrdkE,Tale x Pete - Väärä Valinta (Isä Diss Track),492 108 katselukertaa,2.20,/@PeteKanava
_JQtAdl9nsw,"Minecraft, mutta EI ole KIVAA..",57 788 katselukertaa,8.44,/@TaleKanava
wR_TOfmMGaY,Tale - Herra T (Diss Track) ft. Pete & Isäukot,162 839 katselukertaa,2.49,/@PeteKanava
Nq-OgMj3DHs,Tale saa tietää et Pete tuhos sen tallennuksen - Luukku 4,457 723 katselukertaa,3.57,/@Zounaas
Cr9ep0ZpFTg,Sukellus kohti pohjaa jatkuu... | Subnautica - 2,16 941 katselukertaa,34.30,/@TaleKanava
cCuYZm9z3dc,Tale REAGOI: Pete tuhos Tallennuksen...!,178 799 katselukertaa,2.40,/@PeteKanava
RsaDSFI7ZCI,Tale ja MILJONÄÄRI pappa...,134 717 katselukertaa,3.08,/@PeteKanava
YoNSbdn4jvw,Tale TUHOS Peten Minecraft Tallennuksen!!,210 424 katselukertaa,6.13,/@Zounaas
sApkyPk72EQ,Tale Of Us | Tomorrowland 2022 (Afterlife) - WE3,1 476 886 katselukertaa,1.59.50,/@tomorrowland
_jA6jQZMb68,Tale ja Rehtorin Mysteeri..,198 206 katselukertaa,4.51,/@PeteKanava
