Video Id,Title,View Count,Length,Channel
UZhTq61wovc,The Ultimate Tanks and Armoured Vehicles of World War Two | Full Series,240 994 katselukertaa,1.57.33,/@HistoryHit
lPwhI1jwJI0,Let Me Clip You: T69!😈| World of Tanks,18 183 katselukertaa,22.02,/@skill4ltu
VFgZA6Fwts0,EXPORTING TANKS & DIGGING HOLES,41 963 katselukertaa,19.55,/@MrHewes
ih0Ay0Gf6Ek,New American Monster JOHNNY M6 - Cartoons about tanks,46 461 katselukertaa,3.32,/@ValhallaToons
hwySsyLR-t0,World of Tanks - Hot Diggety TOG,55 414 katselukertaa,12.19,/@The_MightyJingles
ZkTMH5CC62A,Next Generation Super Tank Terrifying US Enemies: The AbramsX,107 916 katselukertaa,5.38,/@Interestingengineeringofficial
qqSmrQWui3M,How to Cheat in World of Tanks,74 325 katselukertaa,25.43,/@kajzoo
iO4Y8cAKcUw,10 Most Powerful Tanks in the World,1 933 231 katselukertaa,8.06,/@top10filesyt
ZVSQp11XumI,Evolution of the Tanks - Mitsi Studio,1 605 026 katselukertaa,9.10,/@mitsistudio
qXa2ykZmI6Y,"""Emperor vs King - the Great Battle begins"" Cartoons about tanks",97 457 katselukertaa,2.22,/@ValhallaToons
czsnOGL6FtI,ALL EPISODES about U.S. Civil War - Cartoons about tanks,96 493 katselukertaa,41.16,/@homeanimations-cartoontank
w1WA6rC4CFk,All episodes of Season 9: Siege of the Soviet Fortress + Bonus Ending - Cartoons about tanks,679 553 katselukertaa,39.49,/@homeanimations-cartoontank
evFl0D_Iz3Y,Upgrading tanks to Mechas in Hills of Steel,780 177 katselukertaa,15.46,/@GrayStillPlays
6gxgE-_VxP4,Black Ratte vs. KV-44M Battle - Cartoons about tanks,105 763 katselukertaa,6.16,/@homeanimations-cartoontank
a0LfgYd6ZN8,Why the Army’s New $13 Million Combat Vehicle Is 'Not a Tank' | WSJ Equipped,1 344 774 katselukertaa,8.05,/@wsj
WajXL5SKXAk,BRITISH New MOST POWERFUL TANK Shocked The World!,332 085 katselukertaa,13.56,/@incredible_facts
5Dmz70yGUNE,Footage appears to show British Challenger 2 tank destroyed in combat in Ukraine,257 792 katselukertaa,1.13,/@guardiannews
SdUdPFNVud0,This tank was MAD OP in World of Tanks!,90 562 katselukertaa,21.11,/@QuickyBabyTV
Z0mPz2ruVss,What does loss of Ukraine's Challenger 2 tank mean?,242 933 katselukertaa,4.45,/@SkyNews
