Video Id,Title,View Count,Length,Channel
wJT-YKmlWJc,Rauw Alejandro & Camilo - Tattoo Remix (Video Oficial),834Â 542Â 622 katselukertaa,3.43,/channel/UC_Av98lDjf5KvFib5elhpYg
3d8MPbaTneE,Rauw Alejandro - Tattoo (Video Oficial),206Â 973Â 743 katselukertaa,3.28,/channel/UC_Av98lDjf5KvFib5elhpYg
C4Lz4N96Xj8,Military Husband Surprises Wife Getting Tattoo!,179Â 542Â 551 katselukertaa,1.00,/@Greatestclips2023
kxLoycj4pJY,TATTOOING Close Up (in Slow Motion) - Smarter Every Day 122,86Â 332Â 053 katselukertaa,6.39,/@smartereveryday
EspCzgXH0o0,Jordin Sparks - Tattoo (Speer Version),85Â 279Â 722 katselukertaa,3.52,/channel/UC6m1BbuIUd3srjZKTsZWO8Q
Rsdopaqg85k,Fireboy DML - Tattoo (Official Video),72Â 520Â 892 katselukertaa,3.13,/channel/UCvrQdOvBRW-ycBQ32o1BCQw
FlBrbfZ2UQg,Maa Ka Tattoo â™¥ï¸â™¥ï¸ #shorts #emotional #motivational,67Â 533Â 817 katselukertaa,1.00,/@actorsamsingh1435
GL1z-seOScA,Stencil Time With Artist: @karllamendestattoo,61Â 856Â 744 katselukertaa,0.16,/@TattooMediaInk
Gvt2Kufi4c0,How To Make Tattoo At Home | Tattoo | Tattoo Designs,56Â 227Â 913 katselukertaa,3.48,/@shopylikeofficial
B5EGWLWqThI,Tattoo Roulette w/ One Direction,54Â 786Â 464 katselukertaa,8.51,/@TheLateLateShow
1I-OcPxH3GU,Rate my coverup tattoo out of 10ğŸ‘€,53Â 866Â 478 katselukertaa,0.50,/@maheshchavan
15gDEwd4Qmo,Friends forever Tattoo â¤ï¸ | Siblings Tattoo #artist #tattoo #youtube #friends #siblings,53Â 368Â 948 katselukertaa,0.19,/@Rahulink7
23JjGd8SAkM,TATTOOING A BARCODE ON MY LEG AND SCANNING IT,53Â 024Â 913 katselukertaa,0.16,/@CheekyBoyos
NL4U7mh8Y48,Why Cristiano Ronaldo Doesn't Have Any Tattoos ? | Footballers Without Tattoos | CR7 | #Shorts,48Â 534Â 366 katselukertaa,0.44,/@UltimateSmartKNOWLEDGE
diy2DfFieUg,Kaisa laga tattoo #trending,47Â 626Â 654 katselukertaa,0.46,/@maheshchavan
xJzZ6bFNn6s,So cute tattoo! Created by fernandosouzatattoo,47Â 000Â 531 katselukertaa,0.30,/@futureworldyt
jgfVtYiRNpo,Henna Tattoo Ideas that will Blow Your Mind ğŸ˜± #fun #shorts #howto #diy,42Â 952Â 313 katselukertaa,1.00,/@5MinuteCraftsLIKE
T4E1s0g3ZMw,Jordin Sparks - Tattoo,42Â 817Â 455 katselukertaa,3.51,/channel/UC6m1BbuIUd3srjZKTsZWO8Q
O-aUMnnbIX0,Sido - Tausend Tattoos (prod. by Djorkaeff & Beatzarre),42Â 447Â 147 katselukertaa,4.09,/channel/UChl3h_bqcx_c15f7WOtSn-A
R2teXqUPjiU,Mam ka tattoo kaisa laga #trending,41Â 803Â 394 katselukertaa,0.51,/@maheshchavan
