Video Id,Title,View Count,Length,Channel
eZOdfnswc74,carving a teaspoon out of black hawthorn wood,14 470 858 katselukertaa,0.59,/@Justinthetrees
EtQHmMsTrSA,How Many teaspoons of Water to Fill Up a Sink?,11 792 428 katselukertaa,0.38,/@JeffreyBui
fOppJ3yG6rU,Yung Bans - 4Tspoon (ft. PlayBoi Carti),8 693 202 katselukertaa,2.54,/@WulfTear
VvWUdwHa6gw,Bucket Biryani from Satti Babu biryani moosapet most hyped biryani in recent times #SHORTS,3 547 289 katselukertaa,0.59,/@TspoonIndia
OpV97RXXlcY,1 Teaspoon Cleans Out Fat in Your Liver | Dr. Mandell,2 155 109 katselukertaa,5.40,/@motivationaldoc
pGS-jZCuSK4,Take ONE Teaspoon of This Spice to Fix Your Diabetes,1 377 321 katselukertaa,5.50,/@DrEricBergDC
nu-DXvvQxgw,Coffee Mix lemon With Honey ~ The Secret Nobody Will Never Tell You - Simple Recipe,1 176 516 katselukertaa,2.12,/@healthplus2187
UpGnbaObh4Q,Just 1 Teaspoon Daily To Cure all Your Skin Problems | Eczema - Simple Treatment,1 145 264 katselukertaa,3.11,/@dr.vivekjoshi06
GXfpUrtzxJQ,1/2 Teaspoon...SLEEP Like a Baby | Dr. Mandell,580 541 katselukertaa,3.36,/@motivationaldoc
r6_uzevbDDk,What Is the Difference Between Dinner Spoons & Teaspoons? : Helpful Kitchen Tips,564 446 katselukertaa,1.18,/@cookingguide
nc7vVnHseOs,How Many Milligrams in a Teaspoon,547 245 katselukertaa,2.56,/@dsmasynergy
eStDfspWSiA,"1/2 Teaspoon...Lose Belly Fat & Cleanse Arteries | Dr Alan Mandell, DC",391 454 katselukertaa,4.45,/@motivationaldoc
wQ6B8BmrWiw,How Many Teaspoon in a Tablespoon? || Difference Between Tsp and Tbsp || Tsps in a Tbsp by FooD HuT,385 203 katselukertaa,4.15,/@FooDHuT
GkhGmBRw-cY,Measurement:  Milliliters in 4 Teaspoons,361 558 katselukertaa,1.52,/@mathstervakkas
QdczzFO-U2Q,"Hannes Coetzee - Teaspoon Guitar - ""De Kip, de Haan en de Boer"".",338 311 katselukertaa,1.35,/@Bokete7
oVSVNyCs59E,Uyawugeza Umoya Wami ft Inkosi Yamagcokama _ Teaspoon Sondela la,316 562 katselukertaa,4.44,/@maskandiwethutv
GjhksNsIAn8,DIY pendant. Carving Necklace from teaspoon with Dremel rotary tool,315 717 katselukertaa,8.13,/@TuomasSoikkelijyvaskyla
jDtWvGCrkwk,Teaspoon & the Waves - Oh Yeh Soweto,269 339 katselukertaa,4.10,/@KaderFunkyman
ogZMzVWMQao,"Funny Weasley Scene #55 | ""A emotional range of a teaspoon""",252 828 katselukertaa,1.04,/@LifeIsATwister93
R55gL7zF8Rk,EastEnders - Stella burns Ben with a teaspoon,248 102 katselukertaa,0.44,/@xxxEastendersFanxx
