Video Id,Title,View Count,Length,Channel
gHCRKAmZCoc,Top 5 - Best Tent For Camping 2023,23 490 katselukertaa,9.11,/@containlock
U8WYVQoH_Ow,This Tent Could Be Very Important - OneTigris Cometa 4 Season Tent First Look and Preview,310 713 katselukertaa,13.27,/@TheOutdoorGearReview
-N9rb2QDqrw,Sleep in the tent on a rainy day,19 284 454 katselukertaa,8.00.14,/@dreamysoundA
_0j19ee__Fk,"Rain On Tent Sound - BLACK SCREEN - Sleep, Study, Meditation, relaxation - 10 HOUR",646 770 katselukertaa,10.00.01,/@boneysrelaxingsounds5832
dBJTfSxg8S0,New Hilleberg Tents for 2024,1 909 katselukertaa,4.53,/@HillebergTentmaker
BNxrTM7zjf8,A Stealth Camping Tent for Less Than $90! Snugpak Ionosphere Alternative? Winterial Bivy Tent,68 014 katselukertaa,12.29,/@TheOutdoorGearReview
6tfTSkj5fBg,10 COOLEST TENTS IN THE WORLD,11 575 784 katselukertaa,10.11,/@tech___zone
URdldBoYo_o,Top 10 Best Camping Tents for 2023 | Unbeatable Quality and Comfort!,65 555 katselukertaa,14.24,/@productpicker9963
pPaC8vXXyjQ,New foldable tent from Thule MUST SEE!!! - Outset hitch tent,364 102 katselukertaa,6.03,/@mini-Campers
b_ze6vhC054,Top 10 Amazing Glamping Tents | Luxury Camping,25 475 katselukertaa,9.55,/@Top10Zone
oyrv7m30e_c,"SOLO Camping in a GIANT TENT [ Relax and Sleep in cosy luxus, Rain Forest mountain views, ASMR ]",876 877 katselukertaa,30.13,/@go4x4media
1NlTC9D1aeY,👉 TOP 10 Best Large Family Camping Tents in 2022 - Best Large Family Tents for Outdoor Camping,207 676 katselukertaa,14.25,/@GadgetShopping427
_lca2ziYED4,Upouusi autoteltta Land Rover Defender 130:n kanssa,540 045 katselukertaa,22.11,/@FISH13
4wM1QUELqe4,"Yksin camping rankkasade - kaatosade ja rentouttava , viihtyisä teltta , syö , ASMR",5 549 461 katselukertaa,34.44,/@yoyocamp
jQbMu-4S2eg,5 Best Inflatable Camping Tents You Can Buy In 2023,112 671 katselukertaa,4.38,/@gadgetworld795
qE6a-W3-wLQ,Spring Hot Tent Camping In The Snow,1 276 054 katselukertaa,49.55,/@HikeCampClimb
WN_ybUGQIXU,THE MOST INSANE TENTS THAT ARE ON ANOTHER LEVEL,3 692 544 katselukertaa,10.12,/@tech___zone
Pf2hmFeUsbY,Step - By - Step | How To Set Up a Tent,794 870 katselukertaa,4.48,/@parksNC
EmP8G3hUi0w,The CHEAPEST TENT on AMAZON – Is it Worth the MONEY?,4 620 katselukertaa,7.09,/@GoshenPrepping
S0xkrQNxG7c,Top 10 Best Pop Up Tents for Camping 2023 | Amazon Buying Guide,29 933 katselukertaa,9.45,/@outdoorengineer9021
