Video Id,Title,View Count,Length,Channel
4pXkVz_htcg,Throwing Snow At A Cactus 🌵,215 048 041 katselukertaa,0.51,/@pinkshirtcouple
fwrY0D2ACNk,"Rae Sremmurd - Throw Sum Mo ft. Nicki Minaj, Young Thug",180 004 106 katselukertaa,4.28,/channel/UC9iDw30SeRSm18kT98F5iAA
Ow_qI_F2ZJI,Bring Me The Horizon - Throne,164 441 207 katselukertaa,3.10,/channel/UCAayZDDj3uom0QpSJiwLoUw
hshzPcwsDj8,Throwing hands to save Christmas I respect it 🫡 (via haylee_b14/TT) #shorts,145 181 147 katselukertaa,0.38,/@Overtime
5wuv4hCKr4M,Record BREAKING throw with STEPH CURRY at Crypto.com Arena!!,119 342 759 katselukertaa,1.00,/@JennaBandy21
D9ur7l_QIB8,Throwing Snow in the Ocean 🌊,98 812 743 katselukertaa,0.51,/@pinkshirtcouple
WDu_hMDInxQ,Making a tall vase - Throw with me (#Shorts),80 119 400 katselukertaa,0.59,/@thrdfloor3F
ggwjcYY3-2o,Neeraj Chopra | All Javelin throw #shorts #olympics #javelinthrow,70 171 235 katselukertaa,0.14,/@born2elitesports
gJa0kCQ030o,Will you throw your bouquet at the ceremony?! #wedding #weddingshorts Via: @margothon21,62 593 207 katselukertaa,0.15,/@stylemepretty
kGDzPs1_rWg,Super Best ball Throw Challenge #shorts,60 629 385 katselukertaa,0.16,/@ajeetpratapvlog
2l0BAOqBp08,"Rae Sremmurd - Throw Sum Mo (Audio) ft. Nicki Minaj, Young Thug",58 804 674 katselukertaa,4.21,/channel/UC9iDw30SeRSm18kT98F5iAA
i8QH89bMiZI,World Best Ball Throw challenge #shorts,54 433 568 katselukertaa,0.16,/@ajeetpratapvlog
qGlD6ib3g3Q,Terrifying video shows wind throwing people into the air #Shorts,54 138 989 katselukertaa,0.20,/@USATODAY
wr-yoPNj9yA,Double Grenades and throw at the next person? #shorts,53 151 041 katselukertaa,1.00,/@SwampSniper
XjK-TQHQTEs,Cookiee Kawaii - Vibe (Lyrics) | if i throw it back is it fast enough,48 604 338 katselukertaa,1.42,/@itsTikTokTunes
pudIZbCRq_c,Rich Boy - Throw Some D's (Official Music Video),47 066 306 katselukertaa,4.11,/@RichBoyVEVO
iNLAGdRiWIQ,I learned to Throw a Boomerang,46 547 439 katselukertaa,0.39,/@MikeShake
63paP26nkuU,Kid in turtle costume gets foul ball and THROWS IT BACK!! 🤣🤣,45 292 178 katselukertaa,0.07,/@MLB
TX2qGgr0ASI,The Highest Phone Throw in the WORLD!?,45 158 404 katselukertaa,0.50,/@MrwhosethebossShorts
mpPDFDSa9Vg,"Warren G ""Party We Will Throw Now"" Ft. Nate Dogg & The Game | Official Music Video",42 178 525 katselukertaa,3.50,/@DashRadio
