Video Id,Title,View Count,Length,Channel
4S46sC22WYE,The Dark Age Origins Of The First Viking Raiders | The Vikings | Timeline,66 791 katselukertaa,46.03,/@TimelineChannel
ihBg11F0Ijc,Docteur Satan: The Serial Killer Doctor Of Nazi-Occupied Paris | Wartime Crime | Timeline,186 067 katselukertaa,44.50,/@TimelineChannel
S2dnPXd2t2c,Mafia Vs Mussolini: How Gangsters Helped Overthrow Fascist Italy | Wartime Crime | Timeline,60 642 katselukertaa,44.33,/@TimelineChannel
Iu24BEsFmOw,The Gruesome WW1 Trench Warfare Of Ypres Salient | The Great Underground War | Timeline,56 447 katselukertaa,44.43,/@TimelineChannel
mX8z6xNWoUs,The Real Bloody Story Of The English Civil War | The English Civil Wars | Timeline,151 278 katselukertaa,3.10.22,/@TimelineChannel
7W5-ojuY9BY,Power Play: The German Princesses At The Heart Of The Russian Empire | The Last Tsarinas | Timeline,140 612 katselukertaa,51.45,/@TimelineChannel
7cSwkPWx2B4,Oppenheimer's Atomic Bomb: The Nuclear Weapons That Could Wipe Out All Life | M.A.D World | Timeline,909 673 katselukertaa,3.14.59,/@TimelineChannel
6Nt7xLAfEPs,"Automata: The Extraordinary ""Robots"" Designed Hundreds Of Years Ago | Mechanical Marvels | Timeline",751 100 katselukertaa,59.29,/@TimelineChannel
ml01bwqiJNc,Goering: The Man At The Head Of The Gestapo | Hitler's Most Wanted | Timeline,91 099 katselukertaa,43.25,/@TimelineChannel
Gw9r6Ex5lWE,Monsters In The Dark: The Hunt For The Blitz Blackout Serial Killer | Wartime Crime | Timeline,102 461 katselukertaa,44.38,/@TimelineChannel
OnpZAnAAsHc,The Lost Bombproof German Bunkers Of World War One | The Great Underground War | Timeline,25 497 katselukertaa,45.19,/@TimelineChannel
8401mvYD-UM,The Fall Of Ancient Rome: The Events That Ended The Romans | Rome: Empire Without Limit | Timeline,93 513 katselukertaa,59.18,/@TimelineChannel
8FDeLnxCOXA,Inside Britain's Top Secret Codebreaking Organisation That Cracked Enigma | Station X | Timeline,3 089 893 katselukertaa,1.53.16,/@TimelineChannel
Pu-Fcc5vFlE,1861-1865: The Complete Story Of The American Civil War | History Of Warfare | Timeline,355 727 katselukertaa,54.41,/@TimelineChannel
Azu6NN5bZWc,The Year The Sun Turned Black: The Volcanic Winter Of 536 AD | Catastrophe | Timeline,1 129 518 katselukertaa,1.39.25,/@TimelineChannel
A4ilSEamH5o,The Minister Of Propaganda: Joesef Gobbels' Campaign Of Hate | Hitler's Most Wanted | Timeline,31 822 katselukertaa,43.25,/@TimelineChannel
E2zrqzvtWio,The Crucial Mistake That Cost Hitler His Victory | Warlords: Hitler vs Stalin | Timeline,26 538 243 katselukertaa,48.46,/@TimelineChannel
3O4rz4CV-H4,The Complete History Of The Napoleonic Wars | History Of Warfare | Timeline,185 502 katselukertaa,48.30,/@TimelineChannel
2ZrtuZ39TRo,Gorbachev's USSR: The Events That Led To The Collapse Of The Soviet Union | M.A.D World  | Timeline,421 418 katselukertaa,51.45,/@TimelineChannel
