Video Id,Title,View Count,Length,Channel
x6yr8W3mc38,Tracking Too-Good-To-Be-True 'Free Vacation' Mail Offer,7 059 087 katselukertaa,7.06,/@ABCNews
Bd2bbHoVQSM,Timeshares: Last Week Tonight with John Oliver (HBO),5 739 902 katselukertaa,25.32,/@LastWeekTonight
YB1NCuvYPpM,Dennis Reynolds Timeshare,1 623 893 katselukertaa,2.16,/@thechegeman
rU67YqQg0dg,Stuck in a timeshare he can’t afford!,1 559 587 katselukertaa,0.58,/@CalebHammer
wd-YtvsrmYw,Dave Ramsey Hit w/$150 Million Lawsuit,968 444 katselukertaa,20.08,/@stevelehto
xJc32lx1r5E,"Handling the ""I want to think about it"" Stall",713 041 katselukertaa,8.43,/@SteveRichardsredzonestudents
W2nrb5bAKEE,Your Timeshare Resorts Are Vacation Ready – Club Wyndham,533 411 katselukertaa,0.31,/@ClubwyndhamResorts
LpvSMELlTjE,The Truth Behind Timeshares and Travel Clubs | Corporate Casket,407 398 katselukertaa,26.32,/@iilluminaughtii
Nf7Wh_kURis,Zu Tisch mit dem BIG BOSS der Timeshare-Abzocker | Achtung Abzocke | Kabel Eins,256 774 katselukertaa,17.42,/@AchtungAbzockeDE
fZs0y0D8SSs,Couple Recounts Their Timeshare Nightmare As A Warning To Vacationers,196 906 katselukertaa,5.10,/@kcalnews
HJgLrLpSf1k,It's Always Sunny in Philadelphia - Mac and Dennis buy a timeshare,195 902 katselukertaa,2.16,/@paulieiasip5534
qmQvgmC4Tjs,BONES - TimeShare Condominium,194 217 katselukertaa,1.27,/@aputaovinte
tcALXEN3USQ,Timeshare pitch serves as lesson for consumers,184 347 katselukertaa,22.45,/@Channel3000
v7_7Y8VJD5Y,Wyndham Timeshare Nightmare,161 705 katselukertaa,12.03,/@ambermartinez3721
7Tdb9wd5y_E,Inside Edition Investigates Complaints Against Timeshare Exit Team,147 756 katselukertaa,4.13,/@InsideEdition
wOryyWJNS-k,How Do I Get Out of a Timeshare? Call 855-984-6275! Vacation Ownership Consultants.,148 408 katselukertaa,1.10,/@vacationownershipconsultan1711
juaJY4Kn1SI,"Living A Luxury ""Millionaire"" Lifestyle - The Timeshare Scheme",136 214 katselukertaa,22.34,/@KiraTV1
At2A3pK8qUo,timeshare salesman reveals all,115 476 katselukertaa,12.40,/@MarshallBishop
vnltGCBLo4Q,Four reasons you should never by a timeshare with John Adams,102 120 katselukertaa,4.37,/@fox5atlanta
zmRdKFWV30Q,"Couple Goes To Wyndham Timeshare Meeting, Unknowingly Gets $15K Line Of Credit",99 343 katselukertaa,3.51,/@newschannel5
