Video Id,Title,View Count,Length,Channel
sRoRg9EiV8k,TiVo Waited Over a Decade to Screw Over Advertisers (Amazing Commercials),858 110 katselukertaa,14.57,/@FactFiend
Q59bsJEh7rA,TiVo Series3 Startup Animation,276 783 katselukertaa,0.44,/@davezatz
sxSu2lb-Lbo,TiVO,270 729 katselukertaa,0.31,/@myaccessca
60NJgTlajv0,Crazy 2v2v2 Alternate Shot At The Nicest Golf Course I've Played! | The Tivo Classic Round 2,270 523 katselukertaa,23.51,/@gmgolf
qQasBOmJyhQ,An American Conspiracy: Part 1 (TiVo & Devo),261 941 katselukertaa,2.55,/@EastSussexRegionalTV
27rfD5DAXfE,Using Powerline to connect a V6 or TiVo box to a Virgin Media Hub,219 505 katselukertaa,3.46,/@helpinghands
cRZonB5njnA,TiVo Long Open 2013,187 187 katselukertaa,0.28,/@davidswope1739
9ctRwJvkQFk,TiVo Commercial - Angry Birds Jumpscare,153 760 katselukertaa,0.39,/@rebrandiscoming
7tlaGgMWp0Y,How to Program your TiVo Stream 4K Remote to Control your Tv's power and Volume,152 701 katselukertaa,4.43,/@cordcutterlifestyleandtech
oujW_cKfjpw,TIVO Stream 4K ¿Mejor que Chromecast con Google TV? | Review en Español,147 228 katselukertaa,11.18,/@jesustc87
2rMNyUrXwlA,Tivo Bolt Set Top Box - Hands On Review,138 259 katselukertaa,4.08,/@digitaltrends
9SKfT9FFO18,TiVo HD Opening Animation,137 044 katselukertaa,1.21,/@davezatz
yzD7qe5FsDo,Upgrade Your TIVO HD Hard drive,126 234 katselukertaa,8.13,/@aramistech
RVfQLdP_9nA,How to hook up your TiVo Series2 DT with a cable box,123 784 katselukertaa,5.16,/@ElfQueen
WU45-qDSSyc,TiVo Stream 4K Review: A $50 Android TV Dongle!,121 378 katselukertaa,8.13,/@Moderndad
CRjnd8LzvWE,Pairing Your TV with the TiVo Remote,121 510 katselukertaa,1.39,/@Cogeco
5RFTkWdvaCY,TiVo - The Birth - Catch The Mini,108 585 katselukertaa,0.16,/@Beauford514
rlEEn4st3Vw,TiVO - The Best Streaming Device for Cord Cutters,107 984 katselukertaa,13.44,/@TheMadHermit
2a3ZzKVHQws,New TiVo HD startup video,108 099 katselukertaa,1.16,/@ElfQueen
NZm41yXU0Mg,Tivo boot-up animation,99 291 katselukertaa,0.42,/@BreadCrustCouncil
