Video Id,Title,View Count,Length,Channel
9_WBQISVHnw,Best Learning Video for Toddlers Learn Colors with Crayon Surprises!,1┬а791┬а233┬а998 katselukertaa,10.23,/@GenevievesPlayhouse
rPe4yziWiOg,Blippi Learns about Jungle Animals for Kids | Educational Videos for Toddlers,923┬а905┬а368 katselukertaa,15.20,/@Blippi
2UtEvqe34jI,"Toddlers рдХреЗ рд▓рд┐рдП рдЦрд┐рд▓реМрдирд╛ рд▓рд░реНрдирд┐рдВрдЧ рд╡реАрдбрд┐рдпреЛ - рдЖрдХрд╛рд░, рд░рдВрдЧ, рдЦрд╛рджреНрдп рдирд╛рдо рдЬрд╛рдиреЗрдВ, рдЬрдиреНрдорджрд┐рди рдХреЗрдХ рдХреЗ рд╕рд╛рде рдЧрд┐рдирддреА!",884┬а488┬а658 katselukertaa,10.01,/@-genevievesplayhouse1465
xWUYf_19bks,Blippi Learns to Clean Up At The Kinderland Indoor Playground! | Educational Videos for Toddlers,758┬а154┬а670 katselukertaa,12.27,/@BlippiWonders
BGa3AqeqRy0,"""Color Songs Collection Vol. 1"" - Learn Colors, Teach Colours, Baby Toddler Preschool Nursery Rhymes",677┬а870┬а186 katselukertaa,24.51,/channel/UCbt63GNsB5wet6NO3dmhssA
nSO51Kat_MI,ЁЯФ┤Paw Patrol's Skye and Chase's fun day at the Playground No Bullying at School Baby Pups Videos!,644┬а526┬а660 katselukertaa,20.56,/@GenevievesPlayhouse
iAMubyaYz84,рдмрдЪреНрдЪреЛрдВ рдФрд░ Toddlers рдХреЗ рд▓рд┐рдП рд╕рд░реНрд╡рд╢реНрд░реЗрд╖реНрда рд▓рд░реНрдирд┐рдВрдЧ рд░рдВрдЧ рд╡реАрдбрд┐рдпреЛ! рд▓рд┐рдпреЛ рд▓рд┐рдЯрд┐рд▓ рдмрд╕ рдЦрд┐рд▓реМрдиреЗ!,547┬а476┬а288 katselukertaa,10.12,/@-genevievesplayhouse1465
gTf7VFLXPys,Blippi Learns at the Indoor Playground | Educational Videos for Toddlers,529┬а581┬а063 katselukertaa,12.40,/@Blippi
y6Fo4i_pLyc,"Toy Learning Video for Toddlers - Learn Spanish Colors, Shapes, and Numbers with a Birthday Cake!",500┬а658┬а870 katselukertaa,10.01,/@GenevievesPlayhouse
hTqtGJwsJVE,"Baby Learning With Ms Rachel - First Words, Songs and Nursery Rhymes for Babies - Toddler Videos",493┬а948┬а894 katselukertaa,1.00.21,/@msrachel
UdrG_UUNacY,Videos for Toddlers with Blippi | Learn Colors and Numbers for Children,459┬а754┬а667 katselukertaa,1.09.04,/@Blippi
UBICz01PcNM,Little Chris pretend play with toys - best videos with small brother,332┬а625┬а078 katselukertaa,19.24,/@VladandNiki
Gh-XKNuvvC4,Learning With Blippi At Kinderland Indoor Playground For Kids | Educational Videos For Toddlers,332┬а007┬а713 katselukertaa,55.35,/@Blippi
XlHzvTEstz8,Blippi Learns at the Children's Museum | Videos for Toddlers,323┬а773┬а563 katselukertaa,20.56,/@Blippi
W6qbobartbc,Shopping ! Elsa and Anna toddlers buy from Claire's store - Barbie,299┬а213┬а577 katselukertaa,17.19,/@ComePlayWithMe
9E3W-S5NH4E,Emma Pretend Play with Colorful Gumball Machine and Sweets Candy Toys for Kids,299┬а098┬а334 katselukertaa,14.01,/@toysandcolors
sJSGEQgAYWg,"Learn Colors and Race Cars with Max, Bill and Pete the Truck - TOYS (Colors and Toys for Toddlers)",294┬а395┬а199 katselukertaa,9.44,/@coilbook
u7tN_zftXh8,Roma and Diana are playing with slimes | Fun games with dad,290┬а394┬а340 katselukertaa,23.51,/@KidsRomaShow
3r6jW-8QuBM,Best тЩеPEPPA PIGтЩе Toy Learning Videos for Kids and Toddlers!,283┬а854┬а086 katselukertaa,43.36,/@GenevievesPlayhouse
zmEv7vTOQGE,"Baby Learning with Ms Rachel - Baby Songs, Speech, Sign Language for Babies - Baby Videos",265┬а364┬а515 katselukertaa,1.00.02,/@msrachel
