Video Id,Title,View Count,Length,Channel
ZM7Vsv86058,Learn about DINOSAURS! | Fun & Educational Compilation | Jurassic World Dominion Dinosaur Facts,8 859 483 katselukertaa,30.05,/@LearningToolkit
djo8Wc6f4O0,"😀Go Grow Fun😀 EP35 ""Learning Hand Tools with playtable Tool Set""",5 982 623 katselukertaa,9.24,/@MrWheelerAndFriends
7L8vAGGitr8,How Game Designers Protect Players From Themselves,5 500 006 katselukertaa,11.52,/@GMTK
8geGHbWIMXA,Why Metro Exodus is so Immersive,3 787 331 katselukertaa,14.15,/@GMTK
dwI5b-wRLic,The Two Types of Random in Game Design,3 095 179 katselukertaa,19.18,/@GMTK
7ITtPPE-pXE,The World Design of Hollow Knight | Boss Keys,2 941 119 katselukertaa,40.00,/@GMTK
J65bYFgyIF8,Lots of Toy Tool Set Compilation ! Repair Tools and Firefighter Toys ! Chainsaw - Drills - Hammer,2 771 805 katselukertaa,10.13,/@SamsToysBox
yorTG9at90g,Why Does Celeste Feel So Good to Play?,2 497 259 katselukertaa,17.34,/@GMTK
hbzGO_Qonu0,How to Keep Players Engaged (Without Being Evil),2 336 726 katselukertaa,10.46,/@GMTK
Lm_AzK27mZY,How the Nemesis System Creates Stories,2 220 956 katselukertaa,22.29,/@GMTK
CZzcVs8tNfE,How Nintendo Solved Zelda's Open World Problem,2 191 178 katselukertaa,9.31,/@GMTK
zFv6KAdQ5SE,What Capcom Didn't Tell You About Resident Evil 4,1 991 060 katselukertaa,6.00,/@GMTK
F8T6Ul4aHTI,How Cuphead's Bosses (Try to) Kill You,1 918 210 katselukertaa,10.19,/@GMTK
zsjC6fa_YBg,What Makes a Good Puzzle?,1 851 867 katselukertaa,17.42,/@GMTK
vFjXKOXdgGo,How I learned Unity without following tutorials (Developing 1),1 836 084 katselukertaa,18.11,/@GMTK
8X4fx-YncqA,What Makes a Good Combat System?,1 802 878 katselukertaa,17.25,/@GMTK
QhWdBhc3Wjc,The World Design of Dark Souls | Boss Keys,1 744 019 katselukertaa,21.21,/@GMTK
SnpAAX9CkIc,The Rise of the Systemic Game,1 586 561 katselukertaa,12.50,/@GMTK
I5fwCniV1Kc,Learn COLORS & COUNTING WITH DINOSAURS | For Toddlers | From Learning Toolkit,1 564 327 katselukertaa,10.15,/@LearningToolkit
32wp81AwVyY,"What’s Inside a $1,000,000 Toolkit",1 534 229 katselukertaa,10.09,/@Donut
