Video Id,Title,View Count,Length,Channel
kJCxTgrbB6c,Irish Music | Beautiful Celtic Music | Traditional Irish Folk Music,5 989 644 katselukertaa,3.02.09,/@LanternLofiChill
ZTQgkjpQu-I,"Tasty & Golden ""Aloo bondas!"", My Brother was surprised to see what was inside them!| Traditional Me",496 253 katselukertaa,23.35,/@TraditionalMe
XPcnZLeextk,Scotland Traditional Music,938 785 katselukertaa,28.02,/@TraditionalMusicChannel
EJGlJ9PynAg,Chicken Biryani - Cooking Traditionally In Village House || Chicken recipes || The Traditional Life,9 709 816 katselukertaa,13.01,/@TheTraditionalLife
MLnE2lS5zr8,Oil Brinjal Curry - Traditionally Made || Ft. @The Tiny Foods || Ram & Valar || The Traditional Life,9 175 999 katselukertaa,13.55,/@TheTraditionalLife
O8ZzlN99jPw,Raddish Recipes || Made Traditionally || ft. @The Tiny Foods Ram & Valar || The Traditional Life,4 331 188 katselukertaa,17.01,/@TheTraditionalLife
cfgp_aZJenU,Appam - Made Traditionally || With Two Side Dishes Cooking In Village House || The Traditional Life,26 061 075 katselukertaa,12.47,/@TheTraditionalLife
XhbKGsIzklo,Apple Guavas! layered pudding in no time & guava curry were delicious & scrumptious | Traditional Me,3 104 783 katselukertaa,24.23,/@TraditionalMe
pTVeFum4Ywk,Purple Cabbages added more colour to already colourful dishes! Bro made pickles too | Traditional Me,940 282 katselukertaa,29.47,/@TraditionalMe
ox2fgcbtCX8,Red lady Papayas - PART 2 | Golden Papayas for creamy Papaya boat & Pineapple drink | Traditional Me,1 075 967 katselukertaa,22.12,/@TraditionalMe
mnJwsB852jI,Juicy Dragon fruit harvest to a magnificent Dessert & Mocktail from it's outer peel | Traditional Me,5 244 626 katselukertaa,28.24,/@TraditionalMe
FluqZX7MLrc,Kuzhi Paniyaram - Made Traditionally || Paniyaram Recipe Cooking In Village || The Traditional Life,14 968 363 katselukertaa,14.06,/@TheTraditionalLife
1qqpfRT8G_w,I converted leftover rice into Bombay Halwa (Musket) & had with condensed milk tea!| Traditional Me,1 265 247 katselukertaa,22.32,/@TraditionalMe
MHr8-ak13rQ,TAPIOCA || Maravalli Kizhangu Recipe Cooking || Special Kappa Curry Recipe || The Traditional Life,1 597 704 katselukertaa,11.47,/@TheTraditionalLife
0dWIUDc1Jww,"Huge ""Turkey like Chicken"" converted my ordinary lunch table into a Christmas table | Traditional Me",7 752 223 katselukertaa,18.53,/@TraditionalMe
S6qBx6GeXr0,"Papaya Halwa, Kootu & Pickle For Breakfast & Lunch - Traditionally Made || The Traditional Life",2 742 404 katselukertaa,18.05,/@TheTraditionalLife
xQvJpldIE6g,Java apples! as a jammy filler for my Custard cloud Pudding & made Pink Cordial too | Traditional Me,1 986 121 katselukertaa,27.31,/@TraditionalMe
