Video Id,Title,View Count,Length,Channel
dehop4T13Uk,How different people react when you pass them on a bike.,132 984 448 katselukertaa,1.00,/@DanielLaBelle
LnFpve9r3uw,She found him on a trail of toilet paper 🧻😅🤣 #shorts #khamitovy #martaandrustam,63 927 754 katselukertaa,0.45,/@MartaAndRustam
AJ7QzqJi9YE,Hotstar Specials The Trial: Pyaar Kaanoon Dhokha | Official Trailer | 14th July | Kajol,43 264 377 katselukertaa,2.02,/@hotstarOfficial
nuiM04Mqn8A,Passing People On The Trails As A Biker,30 352 349 katselukertaa,0.27,/@nrmlmtber
ZZBDYciDdcw,Passing People On The Trails As A Biker pt3,29 148 605 katselukertaa,0.25,/@nrmlmtber
GzQGPs9G_LA,Bear Stalks Family Along Hiking Trail 😳,26 396 988 katselukertaa,0.41,/@nowthisnews
VSqe0_MHcCA,Ben and Holly’s Little Kingdom | Miss Cookie's Nature Trail | Cartoon for Kids,22 110 966 katselukertaa,59.46,/@BenAndHollyOfficial
stoLqWXsIOY,"Joey Bada$$ - ""Paper Trail$"" (Official Music Video)",20 832 374 katselukertaa,3.46,/@PROERA
hMCNDOwv544,The Most Disturbing Photo in Appalachian Trail History,20 348 435 katselukertaa,0.59,/@KyleHatesHiking
InpzIBIT6y4,Passing People On Trails As An E-Biker,20 195 465 katselukertaa,0.28,/@nrmlmtber
cw1TeLDPcUQ,Shopping with my Dad heads and trails,19 521 549 katselukertaa,0.51,/@SecretVlog
ICF0eAXpz3w,52 min 2016 FIM X-Trial World Championship - Wiener Neustadt (AUT),19 376 913 katselukertaa,52.08,/@fim-moto
vQ60EuLzUSY,Two Trucks Compete on a Large Backyard Scale Trail Park | RC ADVENTURES,13 932 360 katselukertaa,24.15,/@TheRealRCSparks
7OkuyqUU180,"""Beyond Expert"" - The Trail Sign Says It All",12 217 466 katselukertaa,8.59,/@ddangerousddave
gJQtmxsx7j4,The WEIRDEST Bike Park?,12 121 090 katselukertaa,11.29,/@BCpov
MASLZr7AO1Q,Oregon Trail | Teen Titans Go! | Cartoon Network,11 609 397 katselukertaa,2.18,/@cartoonnetwork
GB1pDYB0aEQ,Trail Camera: Leaving a PEANUT BUTTER Mountain in the Woods,9 897 851 katselukertaa,8.56,/@AceTrailCamera
CNgOmcYCOPw,PORTAL: KING OF THE DOUBLE BLACK DIAMONDS | Mountain Biking Moab,8 310 438 katselukertaa,26.46,/@bkxc
cybxmKJ8L60,Grizzly meets us on the trail in Glacier National Park-June 2021,7 373 454 katselukertaa,0.59,/@brandynguyen3377
Geb_QFxp_hs,"1,000 Miles Across Alaska! 1975 Honda CT90 vs. 2021 Trail 125 | Common Tread XP",6 576 415 katselukertaa,48.23,/@RevZilla
