Video Id,Title,View Count,Length,Channel
BI-NYtv8Fiw,USING EVERY FORM OF TRANSPORTATION IN 24 HOURS,82 190 katselukertaa,11.46,/@pierson
biX7NNxw_w8,"Means Of Transport For Children - Land, water and air transport for kids",1 535 720 katselukertaa,5.46,/@SmileandLearnEnglish
c872Ny10Iqw,Learn Transport Vehicles | Learning Street With Bob | Cartoon Videos And Nursery Rhymes by Kids Tv,3 777 671 katselukertaa,1.12.10,/@kidstv
lcdWNmvvyew,Kids vocabulary - Transportation - Learn English for kids - English educational video,443 504 katselukertaa,7.19,/@EnglishSingsing
M_Ll5u5GTxk,Transport Song | Transport Vehicles for Kids | Bob The Train Nursery Rhymes & Kids Songs,11 381 011 katselukertaa,1.00.54,/@BobTheTrain
FaLCQo8NJFA,An Animated History of Transportation,916 350 katselukertaa,2.33,/@TheAtlantic
Ut-HbauKzDw,Transportation Song | Transportation for kids | The Singing Walrus,8 489 092 katselukertaa,2.57,/channel/UCe1VpF4wS_kdcjyTRSXBcnQ
K0yyw8Fk1Uk,Kids vocabulary - Transportation Sounds - Vehicle - Learn English for kids - educational video,3 327 050 katselukertaa,3.36,/@EnglishSingsing
0DiKJZ4krO8,Blippi at the Children's Museum to see Vehicles for Kids | Transportation Song,17 235 910 katselukertaa,7.18,/@BlippiToys
5-DeiXPJ3H8,"Transportation Song - Vehicle Song - Cars, Boats, Trains, Planes - Kids English Learning",11 772 707 katselukertaa,4.52,/@EnglishSingsing
5rg7vgniCZc,The Power of Transportation | Origins: The Journey of Humankind,90 532 katselukertaa,2.14,/@NatGeo
yjIUAvcyeqk,Transportation Planning Organization Board Meeting - 09.13.23,228 katselukertaa,3.53.45,/@HillsboroughCountyMeetings
BFGtse525UE,Modes of Transport for Children | Kids Learning | Kids Hut,3 827 737 katselukertaa,10.44,/@kidshut
sUSjMbrc16c,Minecraft Transportation Guide,1 665 331 katselukertaa,1.00,/@PryorGaming
V0YFM98RFYI,The History and Transformation of Transportation,28 381 katselukertaa,2.59,/@ClickView
lxWeR5iCZtM,10 Fascinating Transportation Industries  | Big Business | Insider Business,919 490 katselukertaa,1.29.06,/@InsiderBusiness
zWss7p8DjVU,"""Alphabet Transport"" - ABC Transportation Song for Kids | Learn Vehicles, Phonics and Alphabet ABCs",57 645 540 katselukertaa,3.57,/@bouncepatrol
c4iVCJ00BYA,Transportation 101,72 384 katselukertaa,2.48,/@studentenergy
2SnJFbeVaIc,Why Free Public Transportation Is a Bad Idea,27 997 katselukertaa,11.37,/@visualeconomiken
iOj8CrxxNgA,Transportation,20 118 865 katselukertaa,6.46,/@TheJules524
