Video Id,Title,View Count,Length,Channel
_lK4cX5xGiQ,Tenacious D - Tribute (Official Video),129 085 951 katselukertaa,4.53,/channel/UCH-Uobgd_TrFNnxuphSnbeQ
xy5S8s6rTH0,Tenacious D- Tribute HD,4 088 421 katselukertaa,4.09,/@UploaderOfGoodMusic
mVKunkprfi0,Smokey & The Bandit Tribute Truck Ep.84 Wrap Day,41 586 katselukertaa,33.13,/@TwinStix
0zEWRc5FBq0,"Eric Clapton - 22 May 2023, London, Tribute To Jeff Beck - COMPLETE",612 755 katselukertaa,2.59.55,/@SlowhandArchiveProject
h2Tzd7MiOj8,Avicii Tribute Concert: In Loving Memory of Tim Bergling,16 755 194 katselukertaa,2.15.05,/channel/UCPHjpfnnGklkRBBTd0k6aHg
CRczDj9cT_Y,Tribute To The Cats Band / Kees Plat -  DREAMS,10 202 337 katselukertaa,6.53,/@CatsfanuithetOosten
2cZ_EFAmj08,Heart - Stairway to Heaven Led Zeppelin - Kennedy Center Honors HD,122 248 340 katselukertaa,6.56,/@MarkPakula
qzQ3TdZeX0c,THE SHOW   a Tribute to ABBA,8 801 215 katselukertaa,1.44.39,/@byg8450
P_SGFf0MCMo,Tylee and JJs Silver Linings Podcast - YouTube LIVE-002 - Tribute To Tylee and JJ,7 229 katselukertaa,1.01.34,/@TyleeandJJsSilverLiningsPod
aPm6poWNtcw,One Love - The Bob Marley All Star Tribute Together In Concert From Jamaica,2 501 682 katselukertaa,1.25.37,/@joefr7317
wzDGmqiricI,Dr Mbuyiseni Ndlozi Powerful Tribute to Mangosuthu Buthelezi at Memorial service.,29 469 katselukertaa,4.26,/@DailyUpdatesZA
V2wGLgnFg6Y,"A tribute to Stevie Wonder by Beyoncé, Ed Sheeran and Gary Clark Jr.",5 086 244 katselukertaa,9.06,/@philipflex
j632rUvU3QM,"Stogie T Pours His Heart Out in Tribute Freestyle for AKA: ""Survivor's Remorse""",25 785 katselukertaa,4.01,/@ZkhiphaniTV
Z0eflYLkI4A,Waiting For A Star To Fall: A Tribute to 80's Entertainment,16 043 551 katselukertaa,4.33,/@thevintagetribute
yB7ACD-CoDY,Lynyrd Skynyrd Tribute Medley of “Simple Man” & “Sweet Home Alabama” | 2023 CMT Music Awards,1 897 441 katselukertaa,6.12,/@CMT
jbWkZHP1Kvw,"Tenacious D - Tribute (Sept. 2022 @ Milwaukee, WI) - Jack Black & Kyle Gass performing live",3 518 879 katselukertaa,5.16,/@MyConcertCollection
UvM2Cmi-YRU,Queen & George Michael - Somebody to Love (The Freddie Mercury Tribute Concert),40 026 559 katselukertaa,4.58,/@MercuryStages
89qby-v-lqA,Dr Ndlozi full tribute to Mangosuthu Buthelezi,25 119 katselukertaa,5.44,/@AfricanSocialists
DYqNT-jc-9E,Tenacious D - Tribute live Rock am Ring 2012,3 993 258 katselukertaa,4.38,/@buster072
kWjPezb7DFo,A Tribute to FIFA,55 033 katselukertaa,1.12.25,/@Vizeh
