Video Id,Title,View Count,Length,Channel
HW2b9-3kF9A,Top 10 iPhone Trick Shots,701 658 129 katselukertaa,0.33,/@ThatsAmazingShorts
jy5oooTcdhM,Most liked Trickshots #trick #trickshot #LFG #lefgu,468 815 691 katselukertaa,0.33,/@Hulett_Brothers
iAA7JsaGiPQ,Baby John Learns Trick or Treat | Little Angel Halloween Song | Nursery Rhymes & Kids Songs,405 362 542 katselukertaa,13.56,/channel/UCNzsYU0aWwjERj-9Y9HUEng
NWi5yA9LhB4,Trick-or-Treating in a Rush,388 890 184 katselukertaa,0.39,/@DanielLaBelle
TDNNkOv8M8Q,INSANE strawberry trick! 😨 #shorts,337 872 704 katselukertaa,0.38,/@danrhodes
VRJmcxCrAOA,Real Life Trick Shots 2 | Dude Perfect,326 867 087 katselukertaa,4.18,/@dudeperfect
UeG1ftTmLAg,Ping Pong Trick Shots 3 | Dude Perfect,320 870 590 katselukertaa,7.17,/@dudeperfect
FqOML9SFuNQ,Brick wall magic trick,299 002 146 katselukertaa,0.19,/@MgagsClips
KPnJvpfTL-s,Halloween Songs for Kids with Blippi | Trick or Treat Nursery Rhyme,276 846 313 katselukertaa,4.31,/@Blippi
alVdORss5_c,Top 100 Greatest Magic Tricks REVEALED & ZACH KING Magic All Vine Funny Videos,261 946 004 katselukertaa,10.06,/@funnyvines9109
8IQbF0IK-f4,Airplane Trick Shots | Dude Perfect,253 679 105 katselukertaa,4.49,/@dudeperfect
A2FsgKoGD04,Real Life Trick Shots | Dude Perfect,247 759 510 katselukertaa,5.04,/@dudeperfect
QatEzPvTafc,Behind the Scenes of a Forces Perspective Trick #Shorts,229 577 206 katselukertaa,0.15,/@ZachKingComplilations
3RBCvUP8Xnw,Trick or Treat,222 572 478 katselukertaa,1.15,/@AaronsAnimals
UtsfUAHkyWQ,Ping Pong Trick Shots 2 | Dude Perfect,218 590 356 katselukertaa,5.56,/@dudeperfect
Q_Cz0vviX84,Ping Pong Ball Trick Shots #shorts #trickshots #trickshot,209 896 685 katselukertaa,0.29,/@andytrickshots
KQUC4j_0Y_Q,Ping Pong Ball Trick Shots #shorts #trickshots #potsandpans,204 998 806 katselukertaa,0.23,/@andytrickshots
D3MS3TUdtN4,Halloween Songs for Kids | Trick or Treat Baby Songs | Infobells Hindi Rhymes,202 841 175 katselukertaa,1.53,/@infobellshindirhymes
kEXtSYPP_9c,This Is The Way We Trick Or Treat | featuring The Super Simple Puppets,197 445 842 katselukertaa,1.57,/@SuperSimpleSongs
TvNTcB6c-V8,Temppuheittoja pelikorteilla | Dude Perfect,181 449 296 katselukertaa,6.47,/@dudeperfect
