Video Id,Title,View Count,Length,Channel
a_538wM3bhw,The Ultimate General Knowledge Trivia Quiz (Part 90),24 045 katselukertaa,14.22,/@detormentis
rLCt6y_Cxuo,General Knowledge Quiz Trivia | 50 Questions | Do You Know | Pub Quiz #quiz #trivia,2 469 katselukertaa,16.03,/@QuizMeOwl
uiZpISlp61A,General Knowledge Trivia Quiz (Part 17),74 586 katselukertaa,15.51,/@TheQuizChannel
kHeW0BIghZw,Guess the Song Music Quiz | One Song Per Year 1960-2023,29 488 katselukertaa,19.47,/@TheQuizChannel
ArmnGl686xQ,General Knowledge Quiz! Trivia (Part 1),100 katselukertaa,8.06,/@itsNNAU
m-KmuIj4mxY,Adivina La Bandera Oculta 🇲🇽👀🇦🇷 | Play Quiz de Países - Quiz Banderas - Cultura General,6 630 katselukertaa,9.28,/@PlayQuiz
18yhLIXE1Lg,General Knowledge & Trivia Quiz - Challenge yourself and try to beat 20! With English audio.,566 katselukertaa,8.26,/@QuizMasterDale
pA0Mwd2nsoc,General Knowledge Trivia Quiz (Part 16),128 358 katselukertaa,15.55,/@TheQuizChannel
gItPIkiDaNM,"Guess the ""SONG PLAYED BACKWARDS"" QUIZ! 🔊| CHALLENGE/TRIVIA",17 981 katselukertaa,13.25,/@FunnyFriQuiz
OCM5pG8NOyU,Guess the Song 2023 Music Quiz,771 638 katselukertaa,14.15,/@TheQuizShow
AqYtaWUq2bU,"50 Quiz Questions on The Human Body, History, Brands and more!",27 428 katselukertaa,14.25,/@detormentis
lJKQ4dMgvhY,90s Nostalgia Trivia! How many things can you remember from the 90s?,178 734 katselukertaa,10.17,/@GuessThatTrivia
hsaQyGUms84,[TRIVIA] Guess the Song - 100 Random Songs,77 288 katselukertaa,27.22,/@letstrivia
iaBmsxatG68,"Music Trivia - 70's, 80's, 90's - Guess The Song",857 109 katselukertaa,29.45,/@19zebra87
Yo62BRG73M4,Test Your General Knowledge Quiz - 50 Super Genius Trivia Questions,46 284 katselukertaa,14.57,/@detormentis
NIuK-toD0WE,30 Trivia Quiz | 30 Mixed Trivia Quiz Questions | Quiz Time |Quiz Channel |#Quiz |Donut Trivia,274 katselukertaa,11.36,/@DonutTrivia
S5LYEt3fBy0,QUIZ: How Good Is Your General Knowledge? 🧠📚🤓 How Smart Are You?,150 655 katselukertaa,13.54,/@QuizBlitz_
7BKHpIxRCmY,Only A True Genius Can Pass This Trivia Quiz (50 Questions),205 265 katselukertaa,15.09,/@detormentis
