Video Id,Title,View Count,Length,Channel
IiebN1Q5LjU,60 Days In: Officer’s Trustees Throw Juice & Bleach on an Inmate (Season 6) | A&E,3 287 009 katselukertaa,5.37,/@AETV
gQ0Y_jjlCTQ,CQV Cestui Que Vie Trust -- Appointing the Judge Trustee in New Hampshire,215 753 katselukertaa,8.12,/@KingCast65
U7m2sYU14xo,Bhuj Swaminarayan temple trustees refute Chandraprakash Swami's allegations - Zee 24 Kalak,178 273 katselukertaa,1.19.40,/@Zee24KalakGujarati
01t_3NwWt30,Sisters' 'cruel' eviction after trustee claims home | A Current Affair,120 566 katselukertaa,7.11,/@ACurrentAffair9
QTwk-2fKT7o,"Joe Paterno, President Fired by Board of Trustees, Penn State Students Riot in Video",118 954 katselukertaa,3.12,/@ABCNews
799z2iZhyfU,Soul Connection 22 - Dettached and Loving - Trustee conscious - Sr Shivani (English),112 330 katselukertaa,26.37,/@bkshivani
NgQNHoWDloU,What is a Trust? | Benefits of Using a Trust to Own Shares in a Company | LegalVision,100 012 katselukertaa,4.02,/@legalvisionlaw
YzY8kifTeG4,SMSF trustees – individual or corporate,98 931 katselukertaa,2.28,/@AusTaxOffice
nQXR3dRDzps,Cowards! HDSB trustees run away when asked about Kayla Lemieux at board meeting,90 240 katselukertaa,11.21,/@RebelNewsOnline
kqAgOOaJyLc,Heritage Minutes: Rural Teacher,82 385 katselukertaa,1.02,/@HistoricaCanada
euI2hAlZQtM,Guardianship: Life under the hidden control of the Public Trustee system revealed | Four Corners,55 734 katselukertaa,43.55,/@ABCNewsIndepth
du0ZLOrjYZo,TRUSTY CUTTING BOARD APPROVED BY BOARD OF TRUSTEES TRUST ME!!,54 266 katselukertaa,0.28,/@mattymatheson
Grzcs9FPi5M,FACT CHECK: Jewels Recovered from TTD Trustee's House in Recent Income Tax Raid?,52 534 katselukertaa,2.09,/@Factlyindia
0jWqnGw7aHs,A trust deed simply explained,50 842 katselukertaa,6.42,/@PrepAgent
7sgrGoXhAk4,Five Duties Of A Trust’s Trustee,50 495 katselukertaa,12.27,/@americasestateplanninglawy1946
VIx2nfXqWGc,"Meaning Of Trust, Trustee, Beneficiary & Void Trust Section 3 - 4 of Indian Trust Act 1882 in hindi",49 328 katselukertaa,11.19,/@GyanmShiksha
pE1mwszR5io,Board of Directors/Trustees and Officers - Law on Corporations | Revised Corporation Code,41 473 katselukertaa,1.06.53,/@Akawnting
Blhmr7a0qg8,This Is Purdue - Full Video Interview with Krannert Alum and Purdue University Trustee Shawn Taylor,41 039 katselukertaa,52.59,/@PurdueUniversity
WbCw57K7AGE,A Trust Beneficiary's Right To Information,40 462 katselukertaa,6.00,/@americasestateplanninglawy1946
zDucZpuX6xE,"Chapter III Part I || Section 11-20 || Indian Trusts Act, 1882 #archnasukhija #indiantrustsact1882",33 569 katselukertaa,9.31,/@ArchnaSukhija
