Video Id,Title,View Count,Length,Channel
xLPwKAk5JdU,Beware of Upstream Contamination!,2 678 023 katselukertaa,0.59,/@ActionLabShorts
4HRLswVPOG8,Boat And Stream | Boat And Stream Problems Tricks/Concept/Formula/Short Trick/Shortcut | In Hindi,2 316 235 katselukertaa,24.34,/@DearSir
5U9KmAlrEXU,Upstream Color: Theatrical Trailer,1 273 188 katselukertaa,2.10,/@UpstreamColor
VC5HUJAnn-8,God’s Up To Something Upstream! | Pastor Steven Furtick | Elevation Church,863 952 katselukertaa,1.15.08,/@elevationchurch
w4mf7cnM71k,Upstream ft Kelly - Nuk di  [( teksti) (lyrics)],778 466 katselukertaa,4.42,/@GSteve55
wImWSCIoFuc,Upstream Color Explained in Hindi | Upstream Color 2013 Movie Ending Explained हिंदी मे,708 752 katselukertaa,16.46,/@HollywoodExplainInHindi
aXu463XT8lk,How To Replace Upstream O2 Oxygen Sensor 00-02 Chevy Suburban,506 186 katselukertaa,3.57,/@1AAuto
lwLQYt9nk5E,Oh no! Don’t Go Upstream!😭😂,399 676 katselukertaa,0.10,/@patek_tv
jU2aln1Nl84,LOVE UPSTREAM Trailer (2021) Romantic Movie,355 883 katselukertaa,2.37,/@MovieCoverage
zPQM0Maylo0,UPSTREAM // So liebt wie du (Acoustic Video),290 688 katselukertaa,3.26,/channel/UChlKRBBWI-Y2ByLheGct5yQ
EDrPsekEwPs,Upstream Color (2013) Trailer,274 201 katselukertaa,2.10,/@MovieTrailerApple
4c1pedk0eSs,Upstream Blessings | Joel Osteen,229 095 katselukertaa,28.31,/@joelosteen
EVb4-lX69q4,Curb Your Enthusiasm - YOU UPSTREAM ME??  - Season 8 Ep. 8,194 961 katselukertaa,0.39,/@TheGuysTravel
rhbMjoBb4d4,Chaos Chaos - Do You Feel It? (Upstream Color),190 116 katselukertaa,4.13,/@mlhomanmlzny
Edoj7cF5QKs,Dan Heath: UPSTREAM Heroes,177 951 katselukertaa,4.38,/@danheath-upstream4707
ZfuwsiCn65s,Professional-Quality Livestreaming Simplified with the UpStream Pro Video Production Switch (GUV303),170 368 katselukertaa,1.06,/@iogearofficial
ygnrKg3IMQs,Upstream gates with Daniele Molmenti,159 551 katselukertaa,6.06,/@SportsceneTV
DpIhYkQ_H68,B X J FOREVER Episode 6 Trailer | Streaming worldwide every Friday on UPSTREAM.ph,155 798 katselukertaa,2.06,/@RegalEntertainmentInc
AxMzQXVM_Xs,Lancer Fix 18 | Upstream Oxygen O2 P0171 P0134 P0135 (DENSO Best),144 752 katselukertaa,5.21,/@DarkDragonWing
z10VuifOgEs,This is Raf | A Girl and A Guy | Upstream Original,143 658 katselukertaa,0.31,/@UPSTREAMPH1
