Video Id,Title,View Count,Length,Channel
gocwRvLhDf8,Will YouTube Ever Run Out Of Video IDs?,9 294 541 katselukertaa,5.10,/@TomScottGo
qQm3c-11bGU,How to Copy Our Instagram Profile URL ID Link,1 580 732 katselukertaa,1.54,/@techeasy8874
pNRgUq5sDhc,Tracking campaigns with URL Builder (4:37),1 267 129 katselukertaa,4.38,/@GoogleAnalytics
-grVvfJgbSo,How to Copy Your YouTube Channel Link / URL,1 182 002 katselukertaa,2.47,/@chillroot
H7bDwI5nUl8,"Internet Gyan : WWW, http vs https, IP Address ,URL , Client & Server",823 494 katselukertaa,9.54,/@TechnologyGyan
WIWpaYMdyfE,"How To Fix ""No App Found To Open URL"" in Android",796 129 katselukertaa,1.14,/@grokshop
C2Yd0W1CR5U,¿Qué es una URL?,500 933 katselukertaa,1.38,/@RomualdFonsTV
Pe_-TkdbXN0,URL Inspection Tool - Google Search Console Training,442 147 katselukertaa,4.36,/@GoogleSearchCentral
4ryaF96Lh4s,How to Find and Copy URL of Video on YouTube Mobile App on Android?,441 267 katselukertaa,2.35,/@TechMeSpot
GUP-Hll8RdQ,How to find your LinkedIn url,437 308 katselukertaa,1.35,/@AllIsWellYeah
OvF_pnJ6zrY,How Do URLs Work?,434 763 katselukertaa,5.36,/@techquickie
k36NUTqg_H4,URL's Own ShotGun Suge Freestyles on Flex | #Freestyle039,398 955 katselukertaa,4.48,/@hot97
-qts-QJSfiM,What are URL? How URL Work? - Explained - Hindi,390 697 katselukertaa,2.40,/@HindiTechTutorials
JlamLfyFjTA,Sitemaps in Search Console - Google Search Console Training,389 321 katselukertaa,7.11,/@GoogleSearchCentral
NMRoM0ndAtU,How to Copy linkedin Profile Link (2022) | Copy linkedin Link | Find LinkedIn Profile URL,375 342 katselukertaa,1.34,/@technowindow
5Jr-_Za5yQM,Internet Tips: Understanding URLs,347 727 katselukertaa,2.28,/@GCFLearnFree
wclmDuob8x4,How to Change Your YouTube Channel Name & Custom URL (UPDATE),338 057 katselukertaa,6.41,/@ThinkMediaTV
7yn-0-1GIrk,How to Find the URL,324 676 katselukertaa,1.26,/@designchemed
PXpuUSDAQpI,Instagram URL Link Kaise Nikale || Instagram Ka Link Kaise Nikale || Technical Dilshad,302 012 katselukertaa,3.19,/@TechnicalDilshad
ahbEcEakrj4,Cómo COPIAR EL LINK O URL DE INSTAGRAM 2023,288 118 katselukertaa,2.51,/@Pctutorialesoficial
