Video Id,Title,View Count,Length,Channel
pIZREjck9jg,"USB Ports, Cables, Types, & Connectors",1 850 530 katselukertaa,9.16,/@PowerCertAnimatedVideos
fpHt8v9SOnI,USB Port Plugger,42 028 143 katselukertaa,0.07,/@JONNYENGLSH
enR58PYHaWw,iPhone 15/15 Pro Impressions: Not Just USB-C!,9 539 947 katselukertaa,13.23,/@mkbhd
gNLXY6YQI60,a CRAZY FAN GIRL sent me this Minecraft USB…,1 623 826 katselukertaa,11.49,/@eystreem
ckERrPFa31c,I Fooled My Friend with a Minecraft USB,740 900 katselukertaa,14.23,/@Bionic
7KuLMe6KSVQ,Apple Fixed the Problem they Created. - iPhone 15 with USB-C Announcement,929 713 katselukertaa,12.11,/@LinusTechTips
gWg6aeNvQMY,🤩 I Made USB Type-C iPhone 🤯,27 406 251 katselukertaa,0.54,/@DDelectroTechECE
PctX3kcTj5U,Explaining USB: From 1.0 to USB4 V2.0,333 043 katselukertaa,14.46,/@ExplainingComputers
wdgULBpRoXk,How does a USB keyboard work?,2 813 658 katselukertaa,34.15,/@BenEater
V-vFtiDYiIw,Converting devices to USB Type-C,6 284 899 katselukertaa,16.25,/@DIYPerks
Af8Y-weJnVA,Medicat USB - all in one usb bootable tool for IT Troubleshooting,788 316 katselukertaa,11.41,/@NovaspiritTech
k1q9NJJygC4,USB,71 113 katselukertaa,2.00,/channel/UCSOYWHWohw-T9LR_RD4Ze2w
9cY1p2PqLig,I Found More Minecraft USBs,986 994 katselukertaa,16.05,/@Lynix
HbQ6q3skZgw,Add USB To Your Electronics Projects! - The USB Protocol Explained,300 882 katselukertaa,15.19,/@SineLab
NmShIXlNq0o,PRO8L3M - USB,7 334 113 katselukertaa,3.04,/@2020label
lrk858gboto,Apple Was Finally Forced To Change To USB-C,250 192 katselukertaa,2.32,/@LIMC
6lTu9z4AwNU,Android Users react to iPhone 15 finally getting USB-C,236 477 katselukertaa,1.17,/@NikTek
PQTnR0DWk6E,I Found Nico's SECRET Minecraft USB!,854 456 katselukertaa,23.16,/@cashminecraft
2KmNlOW0nmM,I Found Nico's SECRET Minecraft USB...,630 476 katselukertaa,13.14,/@KoryMC
hiwaxlttWow,How Many USBs Can You Plug In At Once?,2 320 000 katselukertaa,26.03,/@LinusTechTips
