Video Id,Title,View Count,Length,Channel
b-XMZuFp8Jw,Do you know your Vagina? ğŸ‘€ #short | Where is the vagina?,185Â 789Â 952 katselukertaa,0.30,/@DrSimiAdedeji
M5hFB1UwprI,Why I Tried a Vagina Facial for the First Time | Macro Beauty | Refinery29,189Â 358 katselukertaa,9.31,/@refinery29
UP1CnbCzDwM,"Labiaplasty & Vaginal Tightening | Procedure Part 3 | David Ghozland, M.D.",2Â 334Â 880 katselukertaa,0.48,/@davidghozlandmd
RX4u3n5412s,Changes in the woman's body and vagina 6 weeks after her baby was born.,31Â 742Â 684 katselukertaa,14.34,/@DrGustavoQuirosLicona
KIxg2zxg1CQ,"5 ""Strange"" Things Your Vagina Does That Are NORMAL",4Â 759Â 154 katselukertaa,6.06,/@MamaDoctorJones
qhWMqH87r0w,"How much does the appearance of the anus, vagina or perineal area change?",5Â 100Â 786 katselukertaa,3.49,/@DrGustavoQuirosLicona
c8n7L13De3M,ComprobaciÃ³n de la profundidad vaginal 18cm,141Â 753 katselukertaa,0.26,/@InstitutoLago
awfEugUDe7U,Vaginal Rejuvenation with ThermiVA,38Â 214Â 254 katselukertaa,1.05,/@drleifrogers
lPUnhZAjiDg,What I wish I know before experiencing a 2nd-degree tear,60Â 289 katselukertaa,0.36,/@perimomperinealmassager-pe1754
WWnVcWIiBLo,Getting Labiaplasty Surgery for a Designer Vagina,4Â 162Â 679 katselukertaa,16.53,/@VICE
NI1cscloOs4,Australian woman adjusts to life with two vaginas,190Â 456 katselukertaa,13.10,/@fox26houston
C3ODsniEn2Y,Women Look At Their Vaginas for the First Time | First Takes | Cut,970Â 890 katselukertaa,5.35,/@cut
1qt4DGJy_vs,The Gaping Vagina: Why it Happens and How to Fix It,12Â 420Â 969 katselukertaa,1.35,/@PelosiMedicalCenter
UYD7-Tuehtg,4 Ways to give a HANDJOB with your VAGINA | Pompoir 101,1Â 990Â 965 katselukertaa,6.45,/@AidaLucie
ldy4LOgvUCw,'Sperm Extractor' Machine Replicates Human Vagina for Donors  | NowThis,2Â 604Â 797 katselukertaa,1.41,/@nowthisnews
tQEZia-8pPI,You ğ——ğ—¶ğ—±ğ—»'ğ˜ ğ—ğ—»ğ—¼ğ˜„ ğ—§ğ—µğ—¶ğ˜€ About Vaginas,9Â 611 katselukertaa,0.47,/@drsamrobbins
