Video Id,Title,View Count,Length,Channel
H_7XOMO7nJE,Maxed Out GTA 5 With Realistic Vegetation And Photorealistic Graphics Mod On RTX 3080 4K Ray Tracing,11 514 331 katselukertaa,18.09,/@Gam3_4_Lif3
O8DkKClA7vY,InnovAsian Occasion - Battling Backyard Vegetation,3 869 250 katselukertaa,0.16,/@innovasiancuisine9869
ighN69o5Kk8,Black Screen Light Soft Rain Falling on vegetation For Sleeping | ASMR 10 Hours,1 495 274 katselukertaa,10.00.10,/@SoundsfortheMind
vQ56UBJZeRk,Indian Geography : भारत के वन एवं प्राकृतिक वनस्पतिया | Natural Vegetation | Lecture #08 | Part-1,1 338 149 katselukertaa,23.48,/@CrazyGkTrick
Z8jOcYEtyc0,"Types of Forests in India - Evergreen, Deciduous, Thorny, Montane, Littoral Swamp",1 149 818 katselukertaa,27.38,/@amitsengupta01
BaIWcukW9eo,"Huge vegetation covers the roof of the carpentry workshop, I clean like never before",884 764 katselukertaa,35.14,/@cleanupovergrownfree6868
8kbOEhb0hho,Class 7 Geography Full Chapter 6 | Natural Vegetation and Wildlife | CBSE,832 304 katselukertaa,1.38.01,/@MagnetBrainsEducation
4zHRdHvAyM0,Natural Vegetation and Wildlife - Chapter 5 Geography NCERT class 9,778 840 katselukertaa,14.03,/@amitsengupta01
ynSVkHOCi7U,Overwhelmed by the large vegetation covering the cleaned up abandoned house - Strangely satisfying,498 111 katselukertaa,45.38,/@cleanupovergrownfree6868
EstPeBt9CyU,Vegetation Transformation: Crash Course Kids #5.2,481 747 katselukertaa,3.00,/@crashcoursekids
B4j5tzAIflU,Creating Grass and Vegetation For Video Games,473 381 katselukertaa,23.30,/@Futurepoly
k-aP2u3h4Q4,Clean up the green vegetation covering the roof of the old warehouse | Strangely satisfying,418 387 katselukertaa,38.02,/@peterbeaver6523
b_ilq8Lms80,Large Vegetation Fire Threatens Homes & Forces Evacuations | Santee,390 860 katselukertaa,5.52,/@ONSCENETV
6gUnXpBMfyI,Green: Vegetation on Our Planet (Tour of Earth),337 071 katselukertaa,5.16,/@NOAAVisualizations
oR4DSbuJNv4,Natural vegetation and wildlife class 9 | chapter 5 geography class 9 | class 9 geography chapter 5,297 270 katselukertaa,12.25,/@Single_BB
wkFtBFW5Auk,Natural Vegetation and Wildlife | Ecosystem | Class 8 Geography,282 204 katselukertaa,11.02,/@MagnetBrainsEducation
4IIlVpLQ-zc,"Land, Soil, Water, Natural Vegetation & Wildlife in One Shot | Geography - Class 8th | Umang",240 900 katselukertaa,1.17.18,/@PW-Foundation
Sp9AVGH-z6I,t e l e p a t h テレパシー能力者 - 植生 (Vegetation),232 216 katselukertaa,2.41,/@SoundStation420
CBa8hk1QH2k,Natural Vegetation | CBSE Class 9 | Geography | Social Science | Full Explanation | Shubham Pathak,223 983 katselukertaa,50.48,/@cbseclass9894
UY4PcO0gYuQ,Types of Forest in India | Indian Geography | SSC CGL | by TVA,214 368 katselukertaa,11.05,/@THEVEDICACADEMY
