Video Id,Title,View Count,Length,Channel
hMS02SgR6Is,Blippi Visits a Children's Museum (Glazer) | Blippi Full Episodes | Blippi Toys,486 096 855 katselukertaa,20.53,/@BlippiToys
rZgkDxbEXZs,Blippi Visits an Indoor Play Place! | Blippi Full Episodes | Blippi Toys,390 684 051 katselukertaa,13.51,/@BlippiToys
CjbC9wAErts,Blippi Visits a Firetruck Station! | Blippi Full Episodes | Blippi Toys,329 230 376 katselukertaa,25.03,/@BlippiToys
o5-MkuEnDoA,Blippi Visits an Ice Cream Truck | Math and Simple Addition for Children,254 214 502 katselukertaa,13.59,/@Blippi
2fOWFfpLYW0,Blippi Visits The Aquarium | Educational Fish and Animals for Kids and Toddlers,234 135 357 katselukertaa,22.11,/@Blippi
V8GAMTrSeaU,Blippi Visits a Playground | @Blippi | Moonbug Literacy,228 531 659 katselukertaa,12.27,/@MoonbugSubtitles
EL7LNGzL0cc,Blippi Visits a Childrens Museum | 1 HOUR OF BLIPPI | Science Videos for Toddlers | Blippi Toys,218 670 822 katselukertaa,1.09.30,/@BlippiToys
kClDVw3fl3I,BLIPPI Visits Indoor Play Place (LOL Kids Club) - Learn | ABC 123 Moonbug Kids | Fun | Learning,202 261 777 katselukertaa,12.17,/@MoonbugKids_PreschoolLearning
Dvov7D1Wyzg,Blippi Visits Slides at an Indoor Playground! | Learn with Blippi | Educational Videos for Toddlers,170 048 705 katselukertaa,12.27,/@BlippiWonders
lJx753KxYZE,Peppa Pig Visits Madame Gazelle's House! | Peppa Pig Official Family Kids Cartoon,162 677 681 katselukertaa,45.53,/@PeppaPigOfficial
_Mhem1xH2aA,Blippi Visits an Indoor Playground (Funtastic Playtorium - Part 1) | Full Episodes | Blippi Toys,133 710 199 katselukertaa,14.15,/@BlippiToys
BNdMzImBTdw,Blippi Visits Dig This Las Vegas and Learns Verbs | Playground for Children | Moonbug Kids,131 325 456 katselukertaa,15.38,/@MoonbugKids_Playtime
jZC5aUbwJhw,Blippi Visits an Indoor Playground | Kids Fun & Educational Cartoons | Moonbug Play and Learn,115 037 748 katselukertaa,14.50,/@MoonbugKids_PlayAndLearn
69tTGdILYdU,Blippi Visits an Indoor Playground! | Animals for Kids | Animal Cartoons | Learn about Animals,113 955 525 katselukertaa,1.04.39,/@MoonbugKids_Animals
asSpAr1wbbw,Blippi Visits an Indoor Playground (Kinderland) | Learn Colors with Blippi | Blippi Toys,108 077 697 katselukertaa,51.49,/@BlippiToys
INAqa1PUfTk,Spice & Vybz Kartel - Conjugal Visit (Official Video),104 212 738 katselukertaa,4.22,/channel/UCT6AGQcdyWhQ5CdS0tZxNPg
4MelhU9Q2xA,Blippi Visits a Firetruck Station Full Episode | Trains for Children | Train Song | Moonbug for Kids,103 037 865 katselukertaa,25.16,/@MoonbugKids_Playtime
F4uxnWOETpU,Blippi Visits Party Jungle! | Learn About Animals for Kids | Educational Videos for Kids,101 056 734 katselukertaa,15.07,/@MoonbugKids_AfterSchoolClub
hyudpb9d4mU,Blippi Visits Discovery Children's Museum!  | Animals for Kids | Animal Cartoons,96 704 719 katselukertaa,1.13.30,/@MoonbugKids_Animals
XDgkm7Lr-Pk,BEACH HOUSE ! Elsa & Anna toddlers visit Barbie's Ocean Home - Water fun,93 591 826 katselukertaa,11.14,/@ComePlayWithMe
