Video Id,Title,View Count,Length,Channel
wuLTppemEgA,WHAT is a VOR? Explained by CAPTAIN JOE,689 408 katselukertaa,10.37,/@flywithcaptainjoe
uqGvbVDp5Jk,VOR Explained Simply | How VOR Works | IFR Training,69 262 katselukertaa,10.14,/@flightinsight9111
Da5qQD_RpEQ,KALEO - Vor í Vaglaskógi (Official Video) [with English subtitles],14 921 819 katselukertaa,4.47,/channel/UCXqJrBG563pZnaqLoxHjUDg
Eno0p1n2H84,VOR Navigation Made Easy,1 083 582 katselukertaa,13.51,/@MzeroAFlightTraining
U-AcHM9x2mA,Ridiculously easy VOR Navigation!,26 031 katselukertaa,8.39,/@ScottKoonCFI
6S95qXQNTzM,You WILL Understand VORs after Watching This! (PPL Lesson 37),597 484 katselukertaa,19.18,/@FreePilotTraining
ZewYS4VlwNQ,VOR navigation EXPLAINED (easy)! by CAPTAIN JOE,336 508 katselukertaa,12.02,/@flywithcaptainjoe
RTxW1VB_Qog,How to Use VOR Navigation | Tracking and Intercepting Radials | Instrument Navigation,190 906 katselukertaa,36.40,/@flightinsight9111
_vOl0cy8G3Y,VOR Navigation Made Simple,413 260 katselukertaa,6.37,/@GianLucaNoia
4lCTk7RCh00,VOR Navigation is Simple... Right? // Private Pilot Ground School,5 575 katselukertaa,9.10,/@KingSchools
jrQ21zKjlVg,"Simple Way to Determine Aircraft Position Using a VOR, CDI, and OBS",140 832 katselukertaa,8.28,/@Loves2Fly
ABx6Zdl1aIQ,KALEO - Vor í Vaglaskógi (official video),6 811 500 katselukertaa,4.39,/channel/UCXqJrBG563pZnaqLoxHjUDg
NPjwKIoePiY,How to Make VORs Easy to Use | VORs Tips | IFR Training,45 482 katselukertaa,13.19,/@flightinsight9111
R0Vzaf14SKQ,Understanding VOR,38 668 katselukertaa,7.23,/@RohdeundSchwarz
DrfeNp5Y36w,How to Fly a VOR Approach & VOR Hold | Hold in Lieu of Procedure Turn,38 700 katselukertaa,6.34,/@flightinsight9111
oLKUzWJTzjo,Basics of VOR Navigation,129 967 katselukertaa,4.15,/@aviationspirits
WFPdVcWG6pg,VOR Navigation Made Easy - MzeroA Flight Training,72 230 katselukertaa,13.35,/@MzeroAFlightTraining
tZ2gG1v9Xg8,The Technical Wizardry of VORs - How they work,44 294 katselukertaa,37.46,/@leepd60
NY5clXA510A,How to Fly a VOR Hold Procedure | FlightInsight | IFR,95 749 katselukertaa,15.09,/@flightinsight9111
iCCk2ch-xL4,Navigation Using a VOR,1 245 757 katselukertaa,12.30,/@HumbleAviation
