Video Id,Title,View Count,Length,Channel
iCvmsMzlF7o,The power of vulnerability | Brené Brown,20 131 791 katselukertaa,20.50,/@TED
PJsJ96yyVk8,The Importance of Vulnerability,555 583 katselukertaa,4.35,/@theschooloflifetv
TbsRU-crgsc,"This Is Why You FEEL LOST, LAZY & UNMOTIVATED In Life... | Brené Brown",1 937 215 katselukertaa,59.28,/@lewishowes
9Z_VHWopC2Q,Pablo Nouvelle  - Vulnerability (Official Music Video),86 722 katselukertaa,4.17,/@armadamusictv
e257BL851Uw,"Brené Brown: Vulnerability, not over-sharing",450 613 katselukertaa,3.13,/@60minutes
JYjwx--5Sew,Vulnerability Comes Before Strength,58 905 katselukertaa,6.57,/@FreedominThought
p7sNIyP14X8,Mili - Vulnerability,1 167 405 katselukertaa,2.09,/channel/UCVh47EKH9VLresRqiYi9txw
JjNtWRBdXws,The power of vulnerability - Brené Brown,163 910 katselukertaa,20.20,/@TEDEd
m_B3afFDPHc,5 Signs You're 'Overdoing' Vulnerability (And How To Stop),34 047 katselukertaa,29.10,/@heidipriebe1
h5CEOjPY_uw,Yoga for Vulnerability  |  35-Minute Home Yoga,2 152 143 katselukertaa,35.06,/@yogawithadriene
NCa3D0E_oh4,"Brené Brown ""Let's Start with Vulnerability"" | Inspirational & Motivational Video",18 852 katselukertaa,13.49,/@letsachievesuccess
PhEPSuibmWY,We Need to Talk about Vulnerability,13 828 katselukertaa,1.54,/@SimonSinek
EIcYUSP42Qw,Why Successful Love Requires Vulnerability,320 594 katselukertaa,6.23,/@theschooloflifetv
X4Qm9cGRub0,The power of vulnerability | Brené Brown | TEDxHouston,4 768 639 katselukertaa,20.45,/@TEDx
kvakdHlrFTM,Let's talk about Vulnerability,54 901 katselukertaa,3.42,/@SimonSinek
SM1ckkGwqZI,Vulnerability & Power | Brené Brown & Russell Brand,1 513 566 katselukertaa,1.22.45,/@RussellBrand
dYwLmisuNAU,How to Turn Vulnerability into a Superpower,80 111 katselukertaa,3.01,/@Psych2go
JX4kFRgTuaw,Vulnerability is your superpower  | Sanisha Wynter | TEDxUniversityofBristol,42 515 katselukertaa,17.20,/@TEDx
5n6gbpCqA5g,Friendship & Vulnerability,572 015 katselukertaa,2.27,/@theschooloflifetv
psN1DORYYV0,Listening to shame | Brené Brown,6 768 791 katselukertaa,20.39,/@TED
