Video Id,Title,View Count,Length,Channel
2744a5rtUrc,Starship HLS Progress & Ship 25 Destack Imminent!,9 007 katselukertaa,12.05,/@waiplus
IXCpbhe5DIA,Ship 26 is getting ready too? What's next for Starship?,6 238 katselukertaa,7.41,/@waiplus
yWnFkrtBwYE,မချစ်ရဘူးတဲ့လား - ဝေလ,9 752 398 katselukertaa,4.24,/channel/UCgCM2nL7NyBlHuMPXpQXN9A
iEJ4hJds_40,SpaceX is READY! How Starship will launch for the second time!,362 086 katselukertaa,23.27,/@Whataboutit
ENOKuaernNo,The unexpected way SpaceX is building the lunar Starship!,360 734 katselukertaa,21.47,/@Whataboutit
k5IMWGaL9Mw,The Beast Rises! What's Left for SpaceX's Starship before Launch Day?,286 620 katselukertaa,21.12,/@Whataboutit
nJXydGaiOgY,Let's Take A Ride Inside SpaceX's Mind-Blowing Crew Dragon!,203 657 katselukertaa,26.58,/@Whataboutit
JHgogU3dZp0,Light Train Tin Shui Wai to Yuenlong Hongkong,96 katselukertaa,10.16,/@Fashawayvlogs_30
C0Z2rux2vFw,Why did SpaceX Decide to Risk It and Hot-Stage a Starship?,394 172 katselukertaa,25.17,/@Whataboutit
sK9ZjtDqbfU,SpaceX ignites Monster Booster! Are we ready for the second Starship Flight?,288 819 katselukertaa,22.21,/@Whataboutit
IxDMCIOKxxE,Success? SpaceX Booster 9 Static Fire!,19 859 katselukertaa,9.44,/@waiplus
k_mdqiu1794,Epic Testing Change! Is SpaceX's Starship Raptor Engine Unreliable?,310 282 katselukertaa,21.50,/@Whataboutit
T8xV_JfBsIA,New Starbase Flyover! SpaceX is gearing up for the Second Starship flight!,11 051 katselukertaa,12.19,/@waiplus
iBiPTaqNGHg,Let the Monster loose! Starship Booster 9 Static Fire! How will SpaceX's Starship shape our future?,291 400 katselukertaa,21.50,/@Whataboutit
JZB3LLg1JI4,SpaceX Starship is ready for the big test! Will it be a full blast?,268 727 katselukertaa,22.35,/@Whataboutit
saHke8cy8qs,SpaceX Starship OLM Deluge Blast! Prep work for the next Full Stack!,289 357 katselukertaa,22.05,/@Whataboutit
Ol2ToBOZY_4,SpaceX Starship Launch Date Leaked! SOONER than you might think!,309 057 katselukertaa,22.32,/@Whataboutit
6jq3VIHyEn0,How SpaceX will do a BIG Starship upgrade for the next flight!,295 590 katselukertaa,20.22,/@Whataboutit
8eNCZksi28U,How is SpaceX going to fix the Starship program & How will they prepare for Flight #2?,234 465 katselukertaa,20.01,/@Whataboutit
