Video Id,Title,View Count,Length,Channel
fmLGWNRl1tM,Washable | FNF YOYLECAKE CENTRAL V2 OST,7 259 katselukertaa,2.01,/@srdoret
gkFJhmTytr0,"How Washable is Crayola off Everything? I Try ALL Markers, Crayons & Paint",555 155 katselukertaa,26.16,/@nerdecrafter
u3tJ-6iSuaA,How to get ALL WASHABLE KINGDOM MARKERS in FIND THE MARKERS || Roblox,298 188 katselukertaa,30.05,/@XpieTutorials
nmHnIfCO1gA,Trying Out @CrayolaLLC Washable Paint Pens and Watercolor Crayons,4 673 674 katselukertaa,1.00,/@ssavaart
Tye9mLtjTYE,ARPO The Robot For All Kids - Machine Washable | | 어린이를위한 만화,4 176 039 katselukertaa,10.17,/@ARPOTheRobot
zDg7i75oDFQ,BRUTALLY HONEST RUGGABLE REVIEW | Pros & Cons of Washable Rugs,691 968 katselukertaa,16.52,/@OakAbode
JePND-Xmibs,Foldable and Washable Square Basket Made to Measure,2 237 569 katselukertaa,8.47,/@CoserConUlyana
wxwWqZQO7jI,Best Machine Washing Rugs: Ruggable Washable Rugs vs Tumble Rugs,16 234 katselukertaa,8.45,/@DoriTurnerInteriors
pBq-gbfx76s,Tumblelux Washable Collection | Washable Rugs Australia,338 959 katselukertaa,0.23,/@missamaraloves
jgrR1P0vTvA,Washing a machine washable rug #rugcleaning #wtf,12 870 135 katselukertaa,0.58,/@rughubb
l-AWbd3d0DQ,Live Easy with Machine Washable Rugs,3 684 katselukertaa,1.03,/@suryasocial
IsTVVyRiFS0,Ruggable Review — The Best Washable Rug?,48 848 katselukertaa,4.12,/@ModernCastle
Z94itCEvXsA,Best Machine Washable Rug: Tumble Rug Review,10 712 katselukertaa,0.11,/@DoriTurnerInteriors
S2bZl_RN1p8,"IMPROVIA Washable Swift Dry Underpads, 34"" x 36"" Heavy Absorbency Reusable Incontinence Pads",1 585 katselukertaa,0.37,/@improvia_usa
y3Oct5ZaThs,Crayola Ultra-Clean Washable Markers Demo,97 101 katselukertaa,1.16,/@CrayolaLLC
tINghsaqjEY,Washable Dog Diapers | Paw Inspired® Reusable Dog Diapers,1 608 katselukertaa,0.54,/@PawInspired
9QQrn6mOwU4,"I Painted with ALL the Washable Markers, So YOU DON'T HAVE TO",14 625 katselukertaa,10.10,/@caryscuttlefish
oml4tTwON4A,Filti Washable Filter - How to Wash,114 712 katselukertaa,0.32,/@filti4327
u2-XeO6zXQw,How to sew a washable storage basket //  Fabric box,37 682 katselukertaa,8.32,/@timetosew
