Video Id,Title,View Count,Length,Channel
N2WUzy-NcBs,Vlad and Niki pretend play with toy washing machine,98 043 108 katselukertaa,4.23,/@VladandNiki
BzRaEaUqumE,WASHER ! Laundry - Elsa & Anna toddlers -  Foam - Mess - Soap,93 467 242 katselukertaa,12.06,/@ComePlayWithMe
3BzCZ2EudYg,Wendy Pretend Play with Customizable Kitchen & Washer Toy Playset,84 861 610 katselukertaa,6.31,/@toysandcolors
3vjkh-acmTE,Mitski - Washing Machine Heart,70 570 494 katselukertaa,2.09,/channel/UC-GjYlrAWIHgwNDnbFHZ77g
12rsVkwSsXU,Washing Machine Heart,68 904 162 katselukertaa,2.09,/channel/UC-GjYlrAWIHgwNDnbFHZ77g
A_OW8ROv5So,Rabbert goes in the washing machine,56 821 152 katselukertaa,0.45,/@Rabbert
FmRnR0FeO58,LG Washing Machine | Go Easy & Intelligent with AI Direct Drive | LG India,50 780 487 katselukertaa,0.40,/@LGIndia
BXnwpPsop6Y,Emma Pretend Play at Laundry Store w/ Washing Machine Toys,44 370 987 katselukertaa,6.15,/@toysandcolors
x7Jmx1N8jAM,Twin Tub Toy Washing Machine with Iron Laundry Playset Unboxing and Review,44 131 892 katselukertaa,3.38,/@toywashingmachine2150
FJAnjil4JPo,Rs.700 Worlds Smallest Washing Machine #shorts #gadgets,42 641 387 katselukertaa,0.43,/@TechFCShorts
g5XipFE8Hdc,EXPERIMENT: How Strong Is The Washing Machine?,41 310 114 katselukertaa,4.55,/@POWERTESTwww
pV7oxe4B9C8,I Found This SECRET Door On My Washing Machine - What Was Inside was Shocking..🥷,38 169 517 katselukertaa,0.29,/@kingkhieu
pKRbmI6t7Qs,Experiment Coca Cola Mentos  vs  Washing Machine,34 581 702 katselukertaa,6.11,/@POWERTESTwww
yZYdsjna7qo,Senya and Mommy playing with magical toy washing machine,34 427 946 katselukertaa,10.18,/@Senya_Super
THB3KwSIUPY,DIY Car and Bike Washer: How to Make a Plastic Bottle Pressure Washer at Home - ABCD,31 418 261 katselukertaa,6.39,/@shopylikeofficial
W-qL75dGV6k,How To Dig A Hole With Pressure Washer,26 388 350 katselukertaa,0.23,/@AllAboutPressureWashing
2AGOP7pLqu0,washing machine manual,26 146 100 katselukertaa,0.49,/@TheRussianBadger
DD9HKK33qPw,Wendy Pretend Play CLEANING with her Giant Washing Machine & Cleaning Toys,25 361 066 katselukertaa,6.30,/@toysandcolors
_9WpRg7vCHU,Wendy Pretend Play with GIANT Washing Machine Toy,24 792 825 katselukertaa,4.34,/@toysplay
yuNk9n--bXY,Wash Your Hands | The Bath Song For Kids + more nursery rhymes by HeyKids!,22 132 821 katselukertaa,27.16,/@HeyKids
