Video Id,Title,View Count,Length,Channel
BcmUOmvl1N8,Web Server vs  Application Server,864 383 katselukertaa,4.50,/@DurgaSoftwareSolutions
thJSev60yfg,Web Server and Application Server | Explained 🔥🔥,468 932 katselukertaa,10.33,/@KnowledgeCenter
q8ND-dLtHEc,Websphere Video Tutorials | Websphere Admin Training Online,144 016 katselukertaa,1.07.18,/@svrtechnologies
kqrHCPrTQnQ,"IBM Websphere MQ Sender,Receiver Channels and Remote Queues Configuration",62 082 katselukertaa,11.48,/@littlethingsforit8657
MJrZCnHpa8U,"WAS Architecture: Demystifying Cells, Profiles, Nodes, Servers, Clusters, and Federation",59 250 katselukertaa,14.44,/@seanwingert9111
GBc7m8Jfak4,websphere application server8.5 installation on windows,53 766 katselukertaa,18.12,/@webspherejungle8487
q64TThEk_Z4,How to deploy war file in websphere,50 455 katselukertaa,2.16,/@HimanshuSekharSwain
5G7b86a_r1U,IBM WebSphere Commerce Demo,50 185 katselukertaa,2.25,/@iboyibm
qg4lhtNiYtg,deploying applications in WebSphere Application Server v 8 5 on windows  (WebSphere Jungle),49 568 katselukertaa,3.38,/@webspherejungle8487
JGQif05QgPw,Getting started with the WebSphere Application Server Feature Pack for XML,46 236 katselukertaa,9.58,/@awspyker
BXsfKIWMTK8,WebSphere MQ Clustering,45 133 katselukertaa,5.42,/@MQonTV
_i5iVDdWe0c,IBM WebSphere Application Server V 8.5 installation on windows (websphere jungle),41 633 katselukertaa,6.59,/@webspherejungle8487
Rm3yU9jHAdw,websphere application server admin training || websphere application server deployement,40 320 katselukertaa,59.53,/@svrtechnologies
9jnxdWu_IDw,Websphere Application Server online training 1,39 827 katselukertaa,48.57,/@svrtechnologies
VGYoeBiBOwo,WebSphere Portal Tutorials | Difference between Portal Vs Website,37 983 katselukertaa,7.55,/@Projectsgeek
