Video Id,Title,View Count,Length,Channel
9ZqZ3is9tpk,Ennio Morricone - Sergio Leone Greatest Western Music of All Time (Remastered HQ Audio),24 533 725 katselukertaa,1.34.50,/channel/UCUAwOBo-ZZ8S8cIH0SGoXpg
Q42BgGVAO0Q,SANTEE | Glenn Ford | Michael Burns | Full Length Western Movie | English | HD | 720p,16 619 898 katselukertaa,1.30.45,/@WESTERN_CLUB
Gx-y7beNjPU,LÄNSIEN ELOKUVA: Kolminaisuus taas ratsastaa [täyspitkä] [Bud ​​Spencer & Terence Hill] - SUOMI,15 289 762 katselukertaa,1.38.56,/@GrjngoWesternMovies
bVPm7MkPNYw,Kuolleet miehet eivät tee varjoja LÄNSIEN ELOKUVA |suomi,13 632 580 katselukertaa,1.32.20,/@GrjngoWesternMovies
ebmWoXYGyPg,"La revanche d'un pistolero | Western, Jack Nicholson | Film complet en français",9 286 328 katselukertaa,1.21.49,/@CinemaCinemas
Q7tIqEgRwJY,Ennio Morricone - The Spaghetti Westerns Music - Greatest Western Themes of all Time,9 178 246 katselukertaa,1.28.58,/channel/UCUAwOBo-ZZ8S8cIH0SGoXpg
ZTyAmSPWX-g,"White Feather (Western Movie, Cowboys & Indians, Full Length, English) *free full westerns*",9 014 785 katselukertaa,1.38.14,/@GrjngoWesternMovies
3oDoFWptFsE,Gunfighters Moon | FREE WESTERN MOVIE | Action | Full Length Film | ENGLISH,7 719 164 katselukertaa,1.34.24,/@GrjngoWesternMovies
pH15fIh7xrg,McLintock | WESTERN MOVIE | John Wayne | Free Cowboy Film | Full Movie,7 030 819 katselukertaa,2.06.49,/@GrjngoWesternMovies
hDo5THT3LeM,Savage Guns | WESTERN | Full Movie | Cowboys | Free Movie on YouTube | Spaghetti Western,6 508 819 katselukertaa,1.28.19,/@GrjngoWesternMovies
iUiGxZy1qsI,"Make the Sign of the Cross, Stranger | WESTERN Movie Full Length | Action | Free Film | Full Films",6 396 694 katselukertaa,1.27.30,/@GrjngoWesternMovies
JWZV5x4WAXs,The Undefeated | WESTERN MOVIE | John Wayne | HD 1080p | Full Length Classic Western Film,5 708 467 katselukertaa,1.58.17,/@GrjngoWesternMovies
JK1LGPZZJV4,"Yuma (Western Movie starring Clint Walker, Feature Film, English, Free Movie, Full Length, YouTube)",5 624 044 katselukertaa,1.13.26,/@GrjngoWesternMovies
_Ar6IbZMy7A,Hole in the Forehead | FREE WESTERN MOVIE | Wild West | Full Length Movie,5 215 554 katselukertaa,1.22.48,/@GrjngoWesternMovies
KHasw4TmS0s,Cry Blood Apache | WESTERN | Rare Movie | Full Feature Film | Free Cowboy Movie,5 188 716 katselukertaa,1.14.58,/@GrjngoWesternMovies
TmReGI4tCC8,Aseet taistelijan käsissä WESTERN-elokuva | Ilmainen YouTube-elokuva | Englanti | HD | Koko elokuva,4 999 358 katselukertaa,1.16.51,/@GrjngoWesternMovies
ltfy-jLaV44,WESTERN-elokuva: Burt Lancaster VENGEANCE VALLEY -sarjassa [Full Western],4 795 454 katselukertaa,1.22.18,/@GrjngoWesternMovies
NkaJ66rcjvA,A Man Called Blade | SPAGHETTI WESTERN | Cowboy Movie | Wild West | English,4 567 745 katselukertaa,1.32.33,/@GrjngoWesternMovies
63I6sJ89y7k,"Something Big (Western Movie in Full Length, English, Classic Cowboy Film) *free full westerns*",4 435 877 katselukertaa,1.48.32,/@GrjngoWesternMovies
zeijkpC4Das,Joshua The Black Rider | WESTERN | Wild West | Action Cowboy Movie | Full Length | Civil War,4 308 915 katselukertaa,1.22.05,/@GrjngoWesternMovies
