Video Id,Title,View Count,Length,Channel
UDJum8ldMtc,A process I take every 3 days whilst managing a stoma bag..,256 243 114 katselukertaa,0.25,/@MrColitisCrohns
hFGG7T3Mq3w,Dino James – Wishlist feat Kaprila  | Official Music Video,72 981 083 katselukertaa,3.46,/@SonyMusicIndia
87E693PFcxA,I cried whilst making this 🥺💔 #shorts,6 592 733 katselukertaa,0.12,/@theoggreg.
TpFg1_n8x3o,Rema - calm down (calm down  dance challenge whilst shopping),4 509 533 katselukertaa,0.13,/@itisakay
bbrG0VIFcD8,How To Avoid A Trapped Arm Whilst Cuddling In Bed,3 276 275 katselukertaa,3.49,/@videojug
tp5bjzAwdAc,17-Year Old Girl Arrested For Swearing Whilst Talking With A 911 Operator To Help Dying Father,2 700 459 katselukertaa,5.00,/@maverickzvn
PUQFUYqE1UE,'World’s Oldest Woman' Dies Whilst Praying,2 202 314 katselukertaa,1.37,/@ilmfeed
2ufYmS-agF4,Woman Skateboards Downhill Whilst Doing A Handstand | BEST OF THE MONTH,2 002 977 katselukertaa,4.01,/@peopleareawesome
_DXmTbXyA3M,Fastest 100 metres whilst on fire 🔥 17 seconds by Jonathan Vero 🇫🇷,1 920 174 katselukertaa,0.28,/@guinnessworldrecords
KOpsbAUEe90,Nicolas Cage Punches A Woman Whilst Wearing A Bear Suit,1 527 466 katselukertaa,0.27,/@PipeRifle
r-HoSu-r4UM,LAUREN DAIGLE WALKS IN Whilst Contestant Is SINGING HER SONG In American Idol Audition |Idols Global,1 525 138 katselukertaa,7.33,/@idolsglobal
iVTYdLg-iMs,Purple impostor running with undertale music playing in the background whilst holding a large ham,1 449 505 katselukertaa,0.08,/@leontriestomeme9712
kF9WbaJ0GZ4,Solving 3 Rubik's Cubes in under 20 seconds whilst Juggling Mills Mess,1 287 005 katselukertaa,0.28,/@LeoWestonVFX
LSc0GRCRvpY,Tried Ordering McDonalds Whilst in an Uber 🇮🇳 #shorts,1 206 275 katselukertaa,0.43,/@SamzAdventures
CHQs3OLfi8Q,i forgot I was in discord whilst playing Osu!  #Shorts,1 151 883 katselukertaa,0.30,/@jig1433
xPxQ1mZcPSg,Whilst getting ready! #tinadatta #ytshorts #shorts #makeup #bts #shoot #trends #fyp #grwm,1 035 812 katselukertaa,0.15,/@tinaintinzeltown
F3U6qVCJjGM,cursed emojis whilst minecraft cave sounds play,941 985 katselukertaa,1.55,/@moykurs5432
X9IYcbw1DVQ,I cried whilst making this 💔😭 #shorts,901 550 katselukertaa,0.12,/@vschase
ozJ0S3Fq6TM,Just Going To Tie My Shoe Whilst You Think About That,892 164 katselukertaa,0.52,/@LeonardJohnnyPennyKaley
8YkLON-F8qs,Day in the Life of a QuaranTEEN! What I REALLY Do Whilst inside... ft. Boots! ad,836 500 katselukertaa,23.03,/@AnastasiaKings
