Video Id,Title,View Count,Length,Channel
o5hrbJfzj-E,"The White Buffalo At: Guitar Center ""The Whistler""",10 901 097 katselukertaa,3.45,/@guitarcenter
4GcYzKBbJrg,"TOP 10 Things to do in Whistler, British Columbia 2023!",9 657 katselukertaa,5.23,/@thetravelbosss
xaPoBhiMkgs,Roger Whittaker - Finnish Whistler,3 422 836 katselukertaa,2.18,/@sesalla
1hS0xOEqpAE,REPLAY: Crankworx Whistler Downhill 2023,533 832 katselukertaa,2.13.52,/@RedBullBike
Ie_LFXKIo38,REPLAY:  Crankworx Whistler Speed & Style 2023,75 567 katselukertaa,1.44.02,/@RedBullBike
93dQVf1MO4s,It's Harder than a Double Black! Whistler Bike Park Pro Lines,211 078 katselukertaa,23.51,/@remymetailler
v0gxB2M0nuQ,Whistler New World Cup Track is what DH tracks should be like,126 853 katselukertaa,18.45,/@remymetailler
VQcT5I2TloQ,RIDING A BRAND NEW MTB JUMP TRAIL IN WHISTLER!,235 436 katselukertaa,12.10,/@SamPilgrim
8-oMjcV9Fmg,Whistler Heli-Skiing - Booking Now For Winter 2023/24,462 katselukertaa,1.01,/@WhistlerBlackcomb
o1g9rmIYJSg,Full Pull Down Whistler From The Top Of the Gondola!,198 037 katselukertaa,20.41,/@SkillsWithPhil
ONooMhvwSN0,"WHISTLER, BC During Off Season | Things to See and Do During Off Season (or if you don't ski)",73 416 katselukertaa,10.24,/@TheAverageTourist
-70o9n-ma3c,Pro Lines with NO SUSPENSION,72 871 katselukertaa,21.22,/@VanCan
eIEgY0nGxxk,Things To Do In Whistler In Winter,75 803 katselukertaa,8.01,/@explopedia333
aoC18NeE7pY,WHISTLER TRAVEL TIPS: 8 Things to Know Before You Go,26 397 katselukertaa,13.08,/@YellowProductions
qwEZP01J9Zc,Whistler Mountain Bike Park In Depth Review and Guide,3 316 katselukertaa,14.48,/@trailreviews3628
rkUrD11N3dQ,JOYRIDE 2023 COURSE IS THE CRAZIEST ONE YET (Crankworx - Whistler),27 880 katselukertaa,14.02,/@MaxFredriksson
5_sqgx6OghI,ALL NEW HUGE JUMP LINE at Whistler Bike Park! + New Bike Upgrades!,178 156 katselukertaa,26.04,/@JordanBoostmaster
37TEsjkO518,THE DREAM - FIRST DOWNHILL RUNS IN WHISTLER!,12 507 katselukertaa,10.35,/@LuisGerstner
uVL6CoFcFR8,FULL LAP DOWN A-LINE - Whistler Mountain Bike Park 2023,11 213 katselukertaa,6.13,/@trailreviews3628
hXD90e96RDE,Exploring Whistler Village: Biggest Ski Town in North America,39 384 katselukertaa,12.33,/@YellowProductions
