Video Id,Title,View Count,Length,Channel
H1aZ-myEqyc,The Mansour Bahrami Trick Serve 🪄,156 931 109 katselukertaa,0.17,/@Wimbledon
rWAGlAGU9VE,Iga Swiatek's incredible on-court football skills,131 554 280 katselukertaa,0.11,/@Wimbledon
5NmIav-DttI,Wimbledon's Funniest Moments,46 959 199 katselukertaa,8.20,/@Wimbledon
keEmN6A7lOg,Sprinkler Causes Chaos During Mixed Doubles at Wimbledon 😂,46 167 525 katselukertaa,0.35,/@Wimbledon
nu3LsGBl1K0,Getting your revenge in Wimbledon doubles 😅,18 890 869 katselukertaa,0.30,/@Wimbledon
KrpdRh_2gW8,Steffi Graf answers marriage proposal at Wimbledon,14 221 271 katselukertaa,0.41,/@Wimbledon
_UUvhYcx_q0,Wimbledon's Worst Hawk-Eye Challenge Ever,11 839 950 katselukertaa,0.32,/@Wimbledon
e3VSVMuUx3A,Being a Wimbledon ball boy isn't always easy! 😉,10 560 955 katselukertaa,0.12,/@Wimbledon
CGRzfUccmNE,"The Best Game Ever? Andy Murray v Roger Federer (2015, Semi-Final)",10 553 371 katselukertaa,15.18,/@Wimbledon
dBIMzHevAQs,Mansour Bahrami - Best Wimbledon Trick Shots,10 418 138 katselukertaa,8.55,/@Wimbledon
8grJuYkhaSY,Funniest Moments of Wimbledon 2019,10 363 889 katselukertaa,3.37,/@Wimbledon
VHqn2fdJ2DE,Serena Williams returns 138mph serve in Wimbledon mixed doubles,8 696 000 katselukertaa,0.14,/@Wimbledon
pEPdLJhq6-k,"Roger Federer vs Pete Sampras: Wimbledon fourth round, 2001 (Extended Highlights)",8 526 698 katselukertaa,25.27,/@Wimbledon
wZnCcqm_g-E,Roger Federer vs Rafael Nadal | Wimbledon 2019 | Full Match,8 408 276 katselukertaa,3.05.38,/@Wimbledon
GkuDViOUcG8,Maria Sharapova vs Serena Williams: Wimbledon final 2004 (Extended Highlights),7 842 266 katselukertaa,25.33,/@Wimbledon
TUikJi0Qhhw,Novak Djokovic vs Roger Federer | Wimbledon 2019 | Full Match,7 839 210 katselukertaa,4.58.39,/@Wimbledon
mnLdAeSXZv0,Novak Djokovic vs Roger Federer Wimbledon 2019 final highlights,7 404 918 katselukertaa,11.10,/@Wimbledon
chfY_YhrIpc,Wimbledon TRICKSHOT 💯🔥,7 326 515 katselukertaa,0.23,/@tennislettuce
mSywWtS9YfQ,Wimbledon's greatest tie-break? Epic battle between Novak Djokovic and Roger Federer in 2015 Final,7 263 091 katselukertaa,16.20,/@Wimbledon
J8__TwOgTY0,Roger Federer vs Rafael Nadal Wimbledon 2019 semi-final highlights,7 137 950 katselukertaa,8.25,/@Wimbledon
