Video Id,Title,View Count,Length,Channel
tfvUWMbPsFI,Expert Woodworking Tips: From Design to Finishing,2 129 400 katselukertaa,15.06,/@5MINUTEREPAIR
2FgubDIctk4,Genius Woodworking Tips & Hacks That Work Extremely Well ▶9,3 962 532 katselukertaa,10.53,/@QuantumTech
XTLoZQpAvAs,Woodworking Ideas With Connections Without Screws // Wooden Table Design With Only Joints,10 502 katselukertaa,22.04,/@woodworkingsmart
OLFhDS_v8gI,10 Incredibly amazing Woodworking Skills,1 917 770 katselukertaa,5.05,/@marcip
3nZai1jb5tM,Prohibited Areas of Mr Van // Amazing Skills Woodworking Make Your Own Rack for Audio Equipment,46 160 katselukertaa,21.52,/@WoodworkingCraftsman
wriH2-g18LQ,Woodworking Tricks You'll Actually Use || Up Your Woodworking Skills,273 199 katselukertaa,23.58,/@Bourbonmoth
iTR4ikppnwY,Woodworking: Transforming a Found Roadside Wood Piece into a Beautiful Epoxy Resin Table,1 873 238 katselukertaa,21.20,/@Woodworking_Tools_Fix
9KVHYxEhuJY,Why did ancient carpenters keep these secrets? | woodworking,654 872 katselukertaa,6.19,/@WillWoodDiywoodworking
4i_beozHsnc,Genius Woodworking Tips & Hacks That Work Extremely Well | by @WoodworkingDIY,1 050 486 katselukertaa,9.10,/@QuantumTech
IJxKTlw5Xwo,5 Amazing Woodworking Tools Hacks | Router Tips and Tricks,473 567 katselukertaa,12.39,/@Junkyard250
u400NUOrvZE,Now I found the solution for my perfect fits | Woodworking,306 746 katselukertaa,6.47,/@WillWoodDiywoodworking
kWZtzR_Fo-E,5 Beginner Woodworking Tips I Wish I Knew Sooner,688 808 katselukertaa,17.40,/@John_Malecki
gvDKEq6yJhc,Build a Dining Table From Old Train Sleepers Wood: Skills Woodworking & Recycled Old Wood Shipwreck,988 082 katselukertaa,23.44,/@WoodworkingCraftsman
IUtl1m7LNl4,Amazing Woodworking Techniques & Wood Joint Tips | Genius Wooden Connections ▶3,1 888 800 katselukertaa,9.33,/@QuantumTech
_NjDxBsMk5M,DIY Woodworking: 7 Unique Projects You Haven't Seen Before,3 164 795 katselukertaa,31.34,/@TotallyHandy
ZhIOPL4UiwU,Maple and mahogany Bookshelf making,236 753 katselukertaa,36.49,/@gr_woodworking
c6TtSt0Hyw8,The Hardest Cabinets I've Ever Built || Vintage Airstream Remodel,178 409 katselukertaa,27.31,/@Bourbonmoth
Uw05Z8Ue4kk,"Woodworking Skill Extremely Smart Of Carpenter - Building Dining Chair Fastest, Strong And Beautiful",29 668 katselukertaa,35.22,/@WoodworkingCraftsman
rXOfYu5Ey-s,Sustainable Woodworking: Building Exquisite Furniture from Salvaged Materials,19 121 katselukertaa,28.56,/@woodworkingskill
