Video Id,Title,View Count,Length,Channel
3cg2cugi_j4,"How to 3 Star ""UNDERGROUND WORKAROUND"" with TH8, TH9, TH10, TH11, TH12 | Clash of Clans New Update",704 373 katselukertaa,2.22,/@Jaso
9uJLU539NA8,7 Videogame Workarounds That Will Blow Your Mind,423 036 katselukertaa,13.10,/@outsidexbox
vWluKCsQFW8,Mario Odyssey Has a Surprising Workaround Exclusive to Switch Lite! (No Rumble?!),218 942 katselukertaa,4.22,/@GameXplain
_tzA6dkLk88,Qualcomm Atheros Windows 8.1 Connection Dropping Workaround,214 768 katselukertaa,3.28,/@thepoint5696
54GQ2Ze5tJE,NVIDIA Web Drivers Workaround for macOS Mojave Hackintosh,157 570 katselukertaa,6.07,/@TravelerTechieBlog
p-agzhD-_0U,Remote Play Tutorial - How To Use XIM in PS5 Games Workaround Tutorial (XIM Apex & XIM4),122 941 katselukertaa,4.12,/@XIMCentral
qsp4LtMV-hg,"Samsung Gear 360 workaround for other Android devices (like Nexus, Sony Xperia, ...)",110 155 katselukertaa,3.04,/@phonetorch
fULygYQL87A,AR-180 Rifle with a Clever Legal Workaround: The Crusader Templar,108 936 katselukertaa,5.18,/@TFBTVShowTime
EpV5yZQ7uKY,Tricky Latin Mass workaround #shorts,100 230 katselukertaa,0.16,/@DrTaylorMarshall
kCamnyaLePo,Zoom 40 minute limit workaround | VideoSEOPro,91 687 katselukertaa,1.39,/@MyvideoseoproVideoSEOPro
iw3lDTaErVM,Xcode on iPad Pro using Luna Display (Workaround),88 768 katselukertaa,6.25,/@realityschool
dezc5q-d4ts,"How To Complete Knockback Influence Tutorial for MultiVersus! -Workaround for PlayStation, Xbox & PC",75 670 katselukertaa,1.49,/@Treyvoh
FpLLliWT5FM,Surface Pro 4 i7 - Throttling Workaround! - The Fan Strikes again!,73 994 katselukertaa,9.41,/@cbutters
mYsuq6Bn5Ls,RUST Roof Bunker PATCHED & Workaround,73 547 katselukertaa,2.38,/@EvilsRustLabs
rrnkAb0n12w,"Rockstar's God Mode Patch Fails! ,Griefers Found New Workaround Already! GTA Online Epic Fail!",67 493 katselukertaa,9.46,/@theprofessional155
4Y20LRZ5FZA,BRAND NEW XP GLITCH WORKAROUND IN CHAPTER 3 IN FORTNITE MAP CODE! (AFTER PATCH),64 714 katselukertaa,8.29,/@KingAlexHD
IbqB5wuSpv4,How to Install Windows 11 On Unsupported PC (Easiest Workaround),64 302 katselukertaa,11.32,/@EasyTechs
-vcMceeo2l0,GTA5 I *NEW* MERGING IS BACK! I Crooked Cop Workaround I MERGE ANY CLOTHING! I Patch 1.57,57 823 katselukertaa,8.04,/@GameTimeLive
umkis3cXSnY,Fix Update your AMD Driver Error | Version 21.20 Workaround | Battlefield 2042 Guide,56 366 katselukertaa,2.55,/@TroubleChute
Voy5WVlxHtk,"""Unavailable in your region"" Workaround | Lost Ark Fix | South Africa",54 258 katselukertaa,3.59,/@TroubleChute
