Video Id,Title,View Count,Length,Channel
dcsEg8PastM,"Drained lake yields cars, mystery",2 328 454 katselukertaa,2.06,/@KMBC
JwtkHxv_3pU,Maximizing Cannabis Yields with Dr Bruce Bugbee,895 792 katselukertaa,47.09,/@ApogeeInstrumentsInc
Pvgk4jMS180,5 Effective Ways to Increase Plant Yields,687 700 katselukertaa,6.23,/@FromSeedtoStoned
P1iyAKw8LYw,How Devious Licks Turned Into Angelic Yields,658 887 katselukertaa,2.16,/@LIMC
vk5MCpcjTO4,"Growing strawberries in plastic baskets for high yields, extremely lots of fruit",638 419 katselukertaa,10.16,/@magicfarm779
XUQLaohcUyE,Bigger Yields in Less Space – Complete Cannabis Training Guide,630 583 katselukertaa,10.58,/@FromSeedtoStoned
mS7t91U9Qqg,Treasury bond prices and yields | Stocks and bonds | Finance & Capital Markets | Khan Academy,511 034 katselukertaa,3.47,/@khanacademy
7x8vIvwYzFg,Why Bond Yields Are a Key Economic Barometer | WSJ,509 872 katselukertaa,5.17,/@wsj
n9kHU438C14,Biggest Yields We've Harvested!,439 283 katselukertaa,25.04,/@WelkerFarms
mE-ATPehBiM,Relationship Between Interest Rates & Bond Prices | (Part 1),431 806 katselukertaa,1.00,/@PratikChn
itDBuoZyL-k,This tik tok trend is taking over in schools “Angelic Yields”,427 694 katselukertaa,0.50,/@KingAsante
rHlWedm9q0Q,HIGHEST Paying Dividend Stock Yields 30%+ and I'm Buying,365 974 katselukertaa,10.07,/@DividendBull
pAAANsl9a1A,Special Technique Growing Guava with Apples Has High Yields | How to Plant Guava,374 160 katselukertaa,25.42,/@naturalnewlife
xuKbtsPq6fM,Drip Irrigation Saves Water and Increases Crop Yields,362 470 katselukertaa,0.10,/@dripdepot
Ga284IJlpNU,"How to Maximize Yields training Cannabis: Topping, Supercropping, LST, and Micro-topping",347 307 katselukertaa,23.18,/@GreenGrowSpaces
KmYmhqEgoyA,Buying A Giant Excavator To Double Gold Yields! - Building A Cleanout Site - Gold Rush The Game,336 346 katselukertaa,30.07,/@drae
_s8vnOt_0I8,What are BOND YIELDS? Why US Government's Treasury Bills are falling down? Current Affairs 2019 #IAS,295 399 katselukertaa,15.40,/@studyiqofficial
LPpNXKW-w34,How to Prune Tomato Plants to Increase Yields and Prevent Disease and Rot,265 337 katselukertaa,4.26,/@Gardenclips
kk0EiB2OBzw,HOW TO INCREASE YIELDS. PHOTOPERIODS & AUTOFLOWERS,254 288 katselukertaa,10.02,/@MrCanucksGrowGuide
14YOMyubDmo,8 Mistakes That Hurt Yields,239 321 katselukertaa,10.36,/@BeginnerBUDZ
